13	2020-03-17 22:31:10	192.168.1.10	14.215.177.39	Https	54	Ether / IP / TCP 192.168.1.10:10713 > 14.215.177.39:https FA
14	2020-03-17 22:31:11	fe80::f141:b4f2:11de:b126	fe80::1	DNS	102	Ether / IPv6 / UDP / DNS Qry "b'analytics.yinxiang.com.'" 
15	2020-03-17 22:31:11	fe80::1	fe80::f141:b4f2:11de:b126	DNS	175	Ether / IPv6 / UDP / DNS Ans 
16	2020-03-17 22:31:11	192.168.1.10	154.8.190.35	Https	66	Ether / IP / TCP 192.168.1.10:10714 > 154.8.190.35:https S
17	2020-03-17 22:31:11	154.8.190.35	192.168.1.10	Https	66	Ether / IP / TCP 154.8.190.35:https > 192.168.1.10:10714 SA
18	2020-03-17 22:31:11	192.168.1.10	154.8.190.35	Https	54	Ether / IP / TCP 192.168.1.10:10714 > 154.8.190.35:https A
19	2020-03-17 22:31:11	192.168.1.10	154.8.190.35	Https	237	Ether / IP / TCP 192.168.1.10:10714 > 154.8.190.35:https PA / Raw
20	2020-03-17 22:31:11	154.8.190.35	192.168.1.10	Https	60	Ether / IP / TCP 154.8.190.35:https > 192.168.1.10:10714 A / Padding
21	2020-03-17 22:31:11	154.8.190.35	192.168.1.10	Https	1486	Ether / IP / TCP 154.8.190.35:https > 192.168.1.10:10714 A / Raw
22	2020-03-17 22:31:11	154.8.190.35	192.168.1.10	Https	1486	Ether / IP / TCP 154.8.190.35:https > 192.168.1.10:10714 A / Raw
23	2020-03-17 22:31:11	154.8.190.35	192.168.1.10	Https	744	Ether / IP / TCP 154.8.190.35:https > 192.168.1.10:10714 PA / Raw
24	2020-03-17 22:31:11	192.168.1.10	154.8.190.35	Https	54	Ether / IP / TCP 192.168.1.10:10714 > 154.8.190.35:https A
25	2020-03-17 22:31:11	192.168.1.10	154.8.190.35	Https	180	Ether / IP / TCP 192.168.1.10:10714 > 154.8.190.35:https PA / Raw
26	2020-03-17 22:31:11	154.8.190.35	192.168.1.10	Https	328	Ether / IP / TCP 154.8.190.35:https > 192.168.1.10:10714 PA / Raw
27	2020-03-17 22:31:11	192.168.1.10	154.8.190.35	Https	303	Ether / IP / TCP 192.168.1.10:10714 > 154.8.190.35:https PA / Raw
28	2020-03-17 22:31:11	154.8.190.35	192.168.1.10	Https	352	Ether / IP / TCP 154.8.190.35:https > 192.168.1.10:10714 PA / Raw
29	2020-03-17 22:31:11	154.8.190.35	192.168.1.10	Https	88	Ether / IP / TCP 154.8.190.35:https > 192.168.1.10:10714 PA / Raw
30	2020-03-17 22:31:11	192.168.1.10	154.8.190.35	Https	54	Ether / IP / TCP 192.168.1.10:10714 > 154.8.190.35:https A
31	2020-03-17 22:31:11	192.168.1.10	154.8.190.35	Https	54	Ether / IP / TCP 192.168.1.10:10714 > 154.8.190.35:https FA
32	2020-03-17 22:31:11	154.8.190.35	192.168.1.10	Https	60	Ether / IP / TCP 154.8.190.35:https > 192.168.1.10:10714 FA / Padding
33	2020-03-17 22:31:11	192.168.1.10	154.8.190.35	Https	54	Ether / IP / TCP 192.168.1.10:10714 > 154.8.190.35:https A
34	2020-03-17 22:31:13	192.168.1.10	10.10.20.110	UDP	83	Ether / IP / UDP 192.168.1.10:59684 > 10.10.20.110:snmp / SNMP
35	2020-03-17 22:31:14	140.82.113.25	192.168.1.10	Https	78	Ether / IP / TCP 140.82.113.25:https > 192.168.1.10:9423 PA / Raw
36	2020-03-17 22:31:14	192.168.1.10	140.82.113.25	Https	82	Ether / IP / TCP 192.168.1.10:9423 > 140.82.113.25:https PA / Raw
37	2020-03-17 22:31:14	192.168.1.10	10.10.20.110	UDP	83	Ether / IP / UDP 192.168.1.10:59684 > 10.10.20.110:snmp / SNMP
38	2020-03-17 22:31:14	192.168.1.10	140.82.113.25	Https	82	Ether / IP / TCP 192.168.1.10:9423 > 140.82.113.25:https PA / Raw
39	2020-03-17 22:31:15	192.168.1.10	14.215.177.39	Https	54	Ether / IP / TCP 192.168.1.10:10711 > 14.215.177.39:https RA
40	2020-03-17 22:31:15	140.82.113.25	192.168.1.10	Https	66	Ether / IP / TCP 140.82.113.25:https > 192.168.1.10:9423 A
41	2020-03-17 22:31:15	192.168.1.10	14.215.177.39	Https	54	Ether / IP / TCP 192.168.1.10:10713 > 14.215.177.39:https FA
42	2020-03-17 22:31:15	192.168.1.10	239.255.255.250	UDP	216	Ether / IP / UDP 192.168.1.10:50933 > 239.255.255.250:ssdp / Raw
43	2020-03-17 22:31:16	192.168.1.10	14.215.177.39	Https	66	Ether / IP / TCP 192.168.1.10:10715 > 14.215.177.39:https S
44	2020-03-17 22:31:16	14.215.177.39	192.168.1.10	Https	66	Ether / IP / TCP 14.215.177.39:https > 192.168.1.10:10715 SA
45	2020-03-17 22:31:16	192.168.1.10	14.215.177.39	Https	54	Ether / IP / TCP 192.168.1.10:10715 > 14.215.177.39:https A
46	2020-03-17 22:31:16	192.168.1.10	14.215.177.39	Https	54	Ether / IP / TCP 192.168.1.10:10715 > 14.215.177.39:https FA
47	2020-03-17 22:31:16	fe80::f141:b4f2:11de:b126	fe80::1	ICMPv6	86	Ether / IPv6 / ICMPv6ND_NS / ICMPv6 Neighbor Discovery Option - Source Link-Layer Address 00:e0:4c:68:00:2d
48	2020-03-17 22:31:16	fe80::1	fe80::f141:b4f2:11de:b126	ICMPv6	78	Ether / IPv6 / ICMPv6 Neighbor Discovery - Neighbor Advertisement (tgt: fe80::1)
49	2020-03-17 22:31:16	192.168.1.10	14.215.177.39	Https	54	Ether / IP / TCP 192.168.1.10:10715 > 14.215.177.39:https FA
50	2020-03-17 22:31:16	fe80::1	fe80::f141:b4f2:11de:b126	ICMPv6	86	Ether / IPv6 / ICMPv6ND_NS / ICMPv6 Neighbor Discovery Option - Source Link-Layer Address 9c:d2:4b:38:91:c1
51	2020-03-17 22:31:16	fe80::f141:b4f2:11de:b126	fe80::1	ICMPv6	86	Ether / IPv6 / ICMPv6ND_NA / ICMPv6 Neighbor Discovery Option - Destination Link-Layer Address 00:e0:4c:68:00:2d
52	2020-03-17 22:31:16	192.168.1.10	239.255.255.250	UDP	216	Ether / IP / UDP 192.168.1.10:50933 > 239.255.255.250:ssdp / Raw
53	2020-03-17 22:31:17	192.168.1.10	14.215.177.39	Https	54	Ether / IP / TCP 192.168.1.10:10715 > 14.215.177.39:https FA
54	2020-03-17 22:31:17	192.168.1.10	239.255.255.250	UDP	216	Ether / IP / UDP 192.168.1.10:50933 > 239.255.255.250:ssdp / Raw
55	2020-03-17 22:31:18	192.168.1.10	14.215.177.39	Https	54	Ether / IP / TCP 192.168.1.10:10715 > 14.215.177.39:https FA
56	2020-03-17 22:31:18	192.168.1.10	239.255.255.250	UDP	216	Ether / IP / UDP 192.168.1.10:50933 > 239.255.255.250:ssdp / Raw
57	2020-03-17 22:31:19	139.99.69.89	192.168.1.10	Http	60	Ether / IP / TCP 139.99.69.89:http > 192.168.1.10:12360 A / Padding
58	2020-03-17 22:31:19	192.168.1.10	139.99.69.89	Http	54	Ether / IP / TCP 192.168.1.10:12360 > 139.99.69.89:http A
59	2020-03-17 22:31:19	192.168.1.10	10.10.20.110	UDP	83	Ether / IP / UDP 192.168.1.10:59684 > 10.10.20.110:snmp / SNMP
60	2020-03-17 22:31:20	192.168.1.10	140.82.113.25	Https	55	Ether / IP / TCP 192.168.1.10:9647 > 140.82.113.25:https A / Raw
61	2020-03-17 22:31:20	140.82.113.25	192.168.1.10	Https	66	Ether / IP / TCP 140.82.113.25:https > 192.168.1.10:9647 A
62	2020-03-17 22:31:20	192.168.1.10	10.10.20.110	UDP	83	Ether / IP / UDP 192.168.1.10:59684 > 10.10.20.110:snmp / SNMP
63	2020-03-17 22:31:20	192.168.1.10	14.215.177.39	Https	54	Ether / IP / TCP 192.168.1.10:10715 > 14.215.177.39:https FA
64	2020-03-17 22:31:21	192.168.1.10	10.10.20.110	UDP	120	Ether / IP / UDP 192.168.1.10:59684 > 10.10.20.110:snmp / SNMP
65	2020-03-17 22:31:25	192.168.1.10	14.215.177.39	Https	54	Ether / IP / TCP 192.168.1.10:10713 > 14.215.177.39:https RA
66	2020-03-17 22:31:25	192.168.1.10	14.215.177.39	Https	54	Ether / IP / TCP 192.168.1.10:10715 > 14.215.177.39:https FA
67	2020-03-17 22:31:25	192.168.1.10	10.10.20.110	UDP	83	Ether / IP / UDP 192.168.1.10:59684 > 10.10.20.110:snmp / SNMP
68	2020-03-17 22:31:26	192.168.1.10	14.215.177.39	Https	66	Ether / IP / TCP 192.168.1.10:10720 > 14.215.177.39:https S
69	2020-03-17 22:31:26	14.215.177.39	192.168.1.10	Https	66	Ether / IP / TCP 14.215.177.39:https > 192.168.1.10:10720 SA
70	2020-03-17 22:31:26	192.168.1.10	14.215.177.39	Https	54	Ether / IP / TCP 192.168.1.10:10720 > 14.215.177.39:https A
71	2020-03-17 22:31:26	192.168.1.10	14.215.177.39	Https	54	Ether / IP / TCP 192.168.1.10:10720 > 14.215.177.39:https FA
72	2020-03-17 22:31:26	192.168.1.10	54.223.180.103	Http	54	Ether / IP / TCP 192.168.1.10:10657 > 54.223.180.103:http FA
73	2020-03-17 22:31:26	192.168.1.10	54.223.180.103	Http	66	Ether / IP / TCP 192.168.1.10:10721 > 54.223.180.103:http S
74	2020-03-17 22:31:26	192.168.1.10	14.215.177.39	Https	54	Ether / IP / TCP 192.168.1.10:10720 > 14.215.177.39:https FA
75	2020-03-17 22:31:26	54.223.180.103	192.168.1.10	Http	60	Ether / IP / TCP 54.223.180.103:http > 192.168.1.10:10721 SA / Padding
76	2020-03-17 22:31:26	192.168.1.10	54.223.180.103	Http	54	Ether / IP / TCP 192.168.1.10:10721 > 54.223.180.103:http A
77	2020-03-17 22:31:26	192.168.1.10	54.223.180.103	Http	426	Ether / IP / TCP / HTTP / 'GET' '/message/updateTime?tags=commontags&updateTime=d751713988987e9331980363e24189ce1544026800519&serviceVersion=1.1.2.627' 'HTTP/1.1' / Raw
78	2020-03-17 22:31:26	54.223.180.103	192.168.1.10	Http	60	Ether / IP / TCP 54.223.180.103:http > 192.168.1.10:10721 A / Padding
79	2020-03-17 22:31:26	54.223.180.103	192.168.1.10	Http	151	Ether / IP / TCP / HTTP / 'HTTP/1.1' '200' 'OK'
80	2020-03-17 22:31:26	192.168.1.10	54.223.180.103	Http	54	Ether / IP / TCP 192.168.1.10:10721 > 54.223.180.103:http A
81	2020-03-17 22:31:26	192.168.1.10	10.10.20.110	UDP	83	Ether / IP / UDP 192.168.1.10:59684 > 10.10.20.110:snmp / SNMP
82	2020-03-17 22:31:26	192.168.1.10	54.223.180.103	Http	54	Ether / IP / TCP 192.168.1.10:10657 > 54.223.180.103:http FA
83	2020-03-17 22:31:27	192.168.1.10	14.215.177.39	Https	54	Ether / IP / TCP 192.168.1.10:10720 > 14.215.177.39:https FA
84	2020-03-17 22:31:27	192.168.1.10	54.223.180.103	Http	54	Ether / IP / TCP 192.168.1.10:10657 > 54.223.180.103:http FA
85	2020-03-17 22:31:28	192.168.1.10	14.215.177.39	Https	54	Ether / IP / TCP 192.168.1.10:10720 > 14.215.177.39:https FA
86	2020-03-17 22:31:28	192.168.1.10	54.223.180.103	Http	54	Ether / IP / TCP 192.168.1.10:10657 > 54.223.180.103:http FA
87	2020-03-17 22:31:28	140.82.113.25	192.168.1.10	Https	78	Ether / IP / TCP 140.82.113.25:https > 192.168.1.10:9647 PA / Raw
88	2020-03-17 22:31:28	192.168.1.10	140.82.113.25	Https	82	Ether / IP / TCP 192.168.1.10:9647 > 140.82.113.25:https PA / Raw
89	2020-03-17 22:31:29	140.82.113.25	192.168.1.10	Https	60	Ether / IP / TCP 140.82.113.25:https > 192.168.1.10:9647 A / Padding
90	2020-03-17 22:31:29	139.99.69.89	192.168.1.10	Http	60	Ether / IP / TCP 139.99.69.89:http > 192.168.1.10:12360 A / Padding
91	2020-03-17 22:31:29	192.168.1.10	139.99.69.89	Http	54	Ether / IP / TCP 192.168.1.10:12360 > 139.99.69.89:http A
92	2020-03-17 22:31:30	192.168.1.10	14.215.177.39	Https	54	Ether / IP / TCP 192.168.1.10:10720 > 14.215.177.39:https FA
