53	2020-03-22 12:56:29	192.168.1.8	172.217.27.142	Https	66	Ether / IP / TCP 192.168.1.8:9454 > 172.217.27.142:https S
54	2020-03-22 12:56:29	39.98.59.39	192.168.1.8	TCP	54	Ether / IP / TCP 39.98.59.39:5938 > 192.168.1.8:13902 A
55	2020-03-22 12:56:29	240e:d4:2efe:200:21ec:b634:66e2:3bbe	2404:6800:4008:801::200e	UDP	1392	Ether / IPv6 / UDP 240e:d4:2efe:200:21ec:b634:66e2:3bbe:49665 > 2404:6800:4008:801::200e:https / Raw
56	2020-03-22 12:56:29	192.168.1.8	172.217.27.142	Https	66	Ether / IP / TCP 192.168.1.8:9455 > 172.217.27.142:https S
57	2020-03-22 12:56:29	192.168.1.8	14.215.177.39	Https	54	Ether / IP / TCP 192.168.1.8:9451 > 14.215.177.39:https FA
58	2020-03-22 12:56:29	240e:d4:2efe:200:21ec:b634:66e2:3bbe	2404:6800:4008:801::200e	Https	86	Ether / IPv6 / TCP 240e:d4:2efe:200:21ec:b634:66e2:3bbe:9452 > 2404:6800:4008:801::200e:https S
59	2020-03-22 12:56:29	240e:d4:2efe:200:21ec:b634:66e2:3bbe	2404:6800:4008:801::200e	UDP	1392	Ether / IPv6 / UDP 240e:d4:2efe:200:21ec:b634:66e2:3bbe:49665 > 2404:6800:4008:801::200e:https / Raw
60	2020-03-22 12:56:29	192.168.1.8	239.255.255.250	UDP	216	Ether / IP / UDP 192.168.1.8:57006 > 239.255.255.250:ssdp / Raw
61	2020-03-22 12:56:30	240e:d4:2efe:200:21ec:b634:66e2:3bbe	2404:6800:4008:801::200e	Https	86	Ether / IPv6 / TCP 240e:d4:2efe:200:21ec:b634:66e2:3bbe:9453 > 2404:6800:4008:801::200e:https S
62	2020-03-22 12:56:30	192.168.1.8	172.217.27.142	Https	66	Ether / IP / TCP 192.168.1.8:9454 > 172.217.27.142:https S
63	2020-03-22 12:56:30	192.168.1.8	172.217.27.142	Https	66	Ether / IP / TCP 192.168.1.8:9455 > 172.217.27.142:https S
64	2020-03-22 12:56:30	61.151.180.190	192.168.1.8	UDP	129	Ether / IP / UDP 61.151.180.190:8000 > 192.168.1.8:4019 / Raw
65	2020-03-22 12:56:30	61.151.180.190	192.168.1.8	UDP	129	Ether / IP / UDP 61.151.180.190:8000 > 192.168.1.8:4019 / Raw
66	2020-03-22 12:56:30	61.151.180.190	192.168.1.8	UDP	129	Ether / IP / UDP 61.151.180.190:8000 > 192.168.1.8:4019 / Raw
67	2020-03-22 12:56:30	192.168.1.8	14.215.177.39	Https	54	Ether / IP / TCP 192.168.1.8:9451 > 14.215.177.39:https FA
68	2020-03-22 12:56:31	240e:d4:2efe:200:21ec:b634:66e2:3bbe	2404:6800:4008:801::200e	UDP	1392	Ether / IPv6 / UDP 240e:d4:2efe:200:21ec:b634:66e2:3bbe:49665 > 2404:6800:4008:801::200e:https / Raw
69	2020-03-22 12:56:31	39.98.59.39	192.168.1.8	TCP	103	Ether / IP / TCP 39.98.59.39:5938 > 192.168.1.8:13902 PA / Raw
70	2020-03-22 12:56:31	192.168.1.8	39.98.59.39	TCP	103	Ether / IP / TCP 192.168.1.8:13902 > 39.98.59.39:5938 PA / Raw
71	2020-03-22 12:56:31	39.98.59.39	192.168.1.8	TCP	54	Ether / IP / TCP 39.98.59.39:5938 > 192.168.1.8:13902 A
72	2020-03-22 12:56:31	240e:d4:2efe:200:21ec:b634:66e2:3bbe	2404:6800:4008:801::200e	Https	86	Ether / IPv6 / TCP 240e:d4:2efe:200:21ec:b634:66e2:3bbe:9452 > 2404:6800:4008:801::200e:https S
73	2020-03-22 12:56:31	192.168.1.8	10.10.20.110	UDP	83	Ether / IP / UDP 192.168.1.8:59684 > 10.10.20.110:snmp / SNMP
74	2020-03-22 12:56:32	240e:d4:2efe:200:21ec:b634:66e2:3bbe	2404:6800:4008:801::200e	Https	86	Ether / IPv6 / TCP 240e:d4:2efe:200:21ec:b634:66e2:3bbe:9453 > 2404:6800:4008:801::200e:https S
75	2020-03-22 12:56:32	192.168.1.8	172.217.27.142	Https	66	Ether / IP / TCP 192.168.1.8:9454 > 172.217.27.142:https S
76	2020-03-22 12:56:32	39.98.59.39	192.168.1.8	TCP	78	Ether / IP / TCP 39.98.59.39:5938 > 192.168.1.8:13902 PA / Raw
77	2020-03-22 12:56:32	192.168.1.8	39.98.59.39	TCP	54	Ether / IP / TCP 192.168.1.8:13902 > 39.98.59.39:5938 A
78	2020-03-22 12:56:32	192.168.1.8	172.217.27.142	Https	66	Ether / IP / TCP 192.168.1.8:9455 > 172.217.27.142:https S
79	2020-03-22 12:56:32	240e:d4:2efe:200:21ec:b634:66e2:3bbe	2404:6800:4012::200d	Https	86	Ether / IPv6 / TCP 240e:d4:2efe:200:21ec:b634:66e2:3bbe:9445 > 2404:6800:4012::200d:https S
80	2020-03-22 12:56:32	61.151.180.190	192.168.1.8	UDP	129	Ether / IP / UDP 61.151.180.190:8000 > 192.168.1.8:4019 / Raw
81	2020-03-22 12:56:32	240e:d4:2efe:200:21ec:b634:66e2:3bbe	2404:6800:4012::200d	Https	86	Ether / IPv6 / TCP 240e:d4:2efe:200:21ec:b634:66e2:3bbe:9446 > 2404:6800:4012::200d:https S
82	2020-03-22 12:56:32	192.168.1.8	172.217.160.77	Https	66	Ether / IP / TCP 192.168.1.8:9447 > 172.217.160.77:https S
83	2020-03-22 12:56:32	240e:d4:2efe:200:21ec:b634:66e2:3bbe	2404:6800:4008:801::200e	UDP	126	Ether / IPv6 / UDP 240e:d4:2efe:200:21ec:b634:66e2:3bbe:49665 > 2404:6800:4008:801::200e:https / Raw
84	2020-03-22 12:56:32	192.168.1.8	172.217.160.77	Https	66	Ether / IP / TCP 192.168.1.8:9448 > 172.217.160.77:https S
85	2020-03-22 12:56:32	192.168.1.8	10.10.20.110	UDP	83	Ether / IP / UDP 192.168.1.8:59684 > 10.10.20.110:snmp / SNMP
86	2020-03-22 12:56:33	39.98.59.39	192.168.1.8	TCP	103	Ether / IP / TCP 39.98.59.39:5938 > 192.168.1.8:13902 PA / Raw
87	2020-03-22 12:56:33	192.168.1.8	39.98.59.39	TCP	103	Ether / IP / TCP 192.168.1.8:13902 > 39.98.59.39:5938 PA / Raw
88	2020-03-22 12:56:33	39.98.59.39	192.168.1.8	TCP	54	Ether / IP / TCP 39.98.59.39:5938 > 192.168.1.8:13902 A
89	2020-03-22 12:56:33	192.168.1.8	14.215.177.39	Https	54	Ether / IP / TCP 192.168.1.8:9451 > 14.215.177.39:https FA
90	2020-03-22 12:56:33	b4:6b:fc:17:92:60	9c:d2:4b:38:91:c1	ARP	42	Ether / ARP who has 192.168.1.1 says 192.168.1.8
91	2020-03-22 12:56:33	9c:d2:4b:38:91:c1	b4:6b:fc:17:92:60	ARP	42	Ether / ARP is at 9c:d2:4b:38:91:c1 says 192.168.1.1
92	2020-03-22 12:56:33	103.107.198.18	192.168.1.8	Https	54	Ether / IP / TCP 103.107.198.18:https > 192.168.1.8:13463 A
93	2020-03-22 12:56:33	192.168.1.8	103.107.198.18	Https	54	Ether / IP / TCP 192.168.1.8:13463 > 103.107.198.18:https A
94	2020-03-22 12:56:33	192.168.1.8	140.143.213.113	Https	100	Ether / IP / TCP 192.168.1.8:3161 > 140.143.213.113:https PA / Raw
95	2020-03-22 12:56:33	140.143.213.113	192.168.1.8	Https	96	Ether / IP / TCP 140.143.213.113:https > 192.168.1.8:3161 PA / Raw
96	2020-03-22 12:56:34	192.168.1.8	140.143.213.113	Https	54	Ether / IP / TCP 192.168.1.8:3161 > 140.143.213.113:https A
97	2020-03-22 12:56:34	fe80::bd54:c78a:25f1:695	fe80::1	ICMPv6	86	Ether / IPv6 / ICMPv6ND_NS / ICMPv6 Neighbor Discovery Option - Source Link-Layer Address b4:6b:fc:17:92:60
98	2020-03-22 12:56:34	fe80::1	fe80::bd54:c78a:25f1:695	ICMPv6	78	Ether / IPv6 / ICMPv6 Neighbor Discovery - Neighbor Advertisement (tgt: fe80::1)
99	2020-03-22 12:56:34	61.151.180.190	192.168.1.8	UDP	129	Ether / IP / UDP 61.151.180.190:8000 > 192.168.1.8:4019 / Raw
100	2020-03-22 12:56:35	39.98.59.39	192.168.1.8	TCP	103	Ether / IP / TCP 39.98.59.39:5938 > 192.168.1.8:13902 PA / Raw
101	2020-03-22 12:56:35	39.98.59.39	192.168.1.8	TCP	103	Ether / IP / TCP 39.98.59.39:5938 > 192.168.1.8:13902 PA / Raw
102	2020-03-22 12:56:35	192.168.1.8	39.98.59.39	TCP	66	Ether / IP / TCP 192.168.1.8:13902 > 39.98.59.39:5938 A
103	2020-03-22 12:56:35	192.168.1.8	39.98.59.39	TCP	103	Ether / IP / TCP 192.168.1.8:13902 > 39.98.59.39:5938 PA / Raw
104	2020-03-22 12:56:35	39.98.59.39	192.168.1.8	TCP	54	Ether / IP / TCP 39.98.59.39:5938 > 192.168.1.8:13902 A
105	2020-03-22 12:56:35	240e:d4:2efe:200:21ec:b634:66e2:3bbe	2404:6800:4008:801::200e	Https	86	Ether / IPv6 / TCP 240e:d4:2efe:200:21ec:b634:66e2:3bbe:9452 > 2404:6800:4008:801::200e:https S
106	2020-03-22 12:56:36	240e:d4:2efe:200:21ec:b634:66e2:3bbe	2404:6800:4008:801::200e	Https	86	Ether / IPv6 / TCP 240e:d4:2efe:200:21ec:b634:66e2:3bbe:9453 > 2404:6800:4008:801::200e:https S
107	2020-03-22 12:56:36	192.168.1.8	172.217.27.142	Https	66	Ether / IP / TCP 192.168.1.8:9454 > 172.217.27.142:https S
108	2020-03-22 12:56:36	192.168.1.8	172.217.27.142	Https	66	Ether / IP / TCP 192.168.1.8:9455 > 172.217.27.142:https S
109	2020-03-22 12:56:36	192.168.1.8	103.107.198.18	Https	55	Ether / IP / TCP 192.168.1.8:13463 > 103.107.198.18:https A / Raw
110	2020-03-22 12:56:36	192.168.1.8	192.168.1.1	DNS	74	Ether / IP / UDP / DNS Qry "b'api.github.com.'" 
111	2020-03-22 12:56:36	192.168.1.1	192.168.1.8	DNS	542	Ether / IP / UDP / DNS Ans "140.82.112.6" 
112	2020-03-22 12:56:36	192.168.1.8	140.82.112.6	Https	66	Ether / IP / TCP 192.168.1.8:9456 > 140.82.112.6:https S
113	2020-03-22 12:56:37	39.98.59.39	192.168.1.8	TCP	103	Ether / IP / TCP 39.98.59.39:5938 > 192.168.1.8:13902 PA / Raw
114	2020-03-22 12:56:37	192.168.1.8	39.98.59.39	TCP	103	Ether / IP / TCP 192.168.1.8:13902 > 39.98.59.39:5938 PA / Raw
115	2020-03-22 12:56:37	140.82.112.6	192.168.1.8	Https	66	Ether / IP / TCP 140.82.112.6:https > 192.168.1.8:9456 SA
116	2020-03-22 12:56:37	39.98.59.39	192.168.1.8	TCP	54	Ether / IP / TCP 39.98.59.39:5938 > 192.168.1.8:13902 A
117	2020-03-22 12:56:37	192.168.1.8	140.82.112.6	Https	54	Ether / IP / TCP 192.168.1.8:9456 > 140.82.112.6:https A
118	2020-03-22 12:56:37	192.168.1.8	140.82.112.6	Https	532	Ether / IP / TCP 192.168.1.8:9456 > 140.82.112.6:https PA / Raw
119	2020-03-22 12:56:37	192.168.1.8	103.107.198.18	Https	55	Ether / IP / TCP 192.168.1.8:13463 > 103.107.198.18:https A / Raw
120	2020-03-22 12:56:37	192.168.1.8	183.57.48.55	Http	66	Ether / IP / TCP 192.168.1.8:9457 > 183.57.48.55:http S
121	2020-03-22 12:56:37	192.168.1.8	14.215.177.39	Https	54	Ether / IP / TCP 192.168.1.8:9449 > 14.215.177.39:https RA
122	2020-03-22 12:56:37	192.168.1.8	192.168.1.1	DNS	74	Ether / IP / UDP / DNS Qry "b'www.google.com.'" 
123	2020-03-22 12:56:37	192.168.1.8	192.168.1.1	DNS	74	Ether / IP / UDP / DNS Qry "b'www.google.com.'" 
124	2020-03-22 12:56:37	192.168.1.8	219.133.60.246	UDP	308	Ether / IP / UDP 192.168.1.8:62754 > 219.133.60.246:8000 / Raw
125	2020-03-22 12:56:37	fe80::bd54:c78a:25f1:695	fe80::1	DNS	94	Ether / IPv6 / UDP / DNS Qry "b'www.google.com.'" 
126	2020-03-22 12:56:37	140.82.112.6	192.168.1.8	Https	1490	Ether / IP / TCP 140.82.112.6:https > 192.168.1.8:9456 A / Raw
127	2020-03-22 12:56:37	140.82.112.6	192.168.1.8	Https	1490	Ether / IP / TCP 140.82.112.6:https > 192.168.1.8:9456 A / Raw
128	2020-03-22 12:56:37	140.82.112.6	192.168.1.8	Https	580	Ether / IP / TCP 140.82.112.6:https > 192.168.1.8:9456 PA / Raw
129	2020-03-22 12:56:37	192.168.1.1	192.168.1.8	DNS	338	Ether / IP / UDP / DNS Ans "174.37.154.236" 
130	2020-03-22 12:56:37	192.168.1.8	140.82.112.6	Https	54	Ether / IP / TCP 192.168.1.8:9456 > 140.82.112.6:https A
131	2020-03-22 12:56:37	192.168.1.1	192.168.1.8	DNS	350	Ether / IP / UDP / DNS Ans "2404:6800:4012::2004" 
132	2020-03-22 12:56:37	192.168.1.8	140.82.112.6	Https	128	Ether / IP / TCP 192.168.1.8:9456 > 140.82.112.6:https PA / Raw
133	2020-03-22 12:56:37	240e:d4:2efe:200:21ec:b634:66e2:3bbe	2404:6800:4012::2004	Https	86	Ether / IPv6 / TCP 240e:d4:2efe:200:21ec:b634:66e2:3bbe:9458 > 2404:6800:4012::2004:https S
134	2020-03-22 12:56:37	192.168.1.8	140.82.112.6	Https	435	Ether / IP / TCP 192.168.1.8:9456 > 140.82.112.6:https PA / Raw
135	2020-03-22 12:56:37	192.168.1.8	103.107.198.18	Https	55	Ether / IP / TCP 192.168.1.8:13463 > 103.107.198.18:https A / Raw
136	2020-03-22 12:56:37	240e:d4:2efe:200:21ec:b634:66e2:3bbe	2404:6800:4012::2004	Https	86	Ether / IPv6 / TCP 240e:d4:2efe:200:21ec:b634:66e2:3bbe:9459 > 2404:6800:4012::2004:https S
137	2020-03-22 12:56:37	240e:d4:2efe:200:21ec:b634:66e2:3bbe	2404:6800:4012::2004	Https	86	Ether / IPv6 / TCP 240e:d4:2efe:200:21ec:b634:66e2:3bbe:9460 > 2404:6800:4012::2004:https S
138	2020-03-22 12:56:38	192.168.1.8	10.10.20.110	UDP	83	Ether / IP / UDP 192.168.1.8:59684 > 10.10.20.110:snmp / SNMP
139	2020-03-22 12:56:38	140.82.112.6	192.168.1.8	Https	133	Ether / IP / TCP 140.82.112.6:https > 192.168.1.8:9456 PA / Raw
140	2020-03-22 12:56:38	140.82.112.6	192.168.1.8	Https	133	Ether / IP / TCP 140.82.112.6:https > 192.168.1.8:9456 PA / Raw
141	2020-03-22 12:56:38	192.168.1.8	140.82.112.6	Https	54	Ether / IP / TCP 192.168.1.8:9456 > 140.82.112.6:https A
142	2020-03-22 12:56:38	192.168.1.8	14.215.177.39	Https	54	Ether / IP / TCP 192.168.1.8:9451 > 14.215.177.39:https FA
143	2020-03-22 12:56:38	192.168.1.8	174.37.154.236	Https	66	Ether / IP / TCP 192.168.1.8:9461 > 174.37.154.236:https S
144	2020-03-22 12:56:38	174.37.154.236	192.168.1.8	Https	54	Ether / IP / TCP 174.37.154.236:https > 192.168.1.8:9461 RA
145	2020-03-22 12:56:38	39.98.59.39	192.168.1.8	TCP	78	Ether / IP / TCP 39.98.59.39:5938 > 192.168.1.8:13902 PA / Raw
146	2020-03-22 12:56:38	140.82.112.6	192.168.1.8	Https	1221	Ether / IP / TCP 140.82.112.6:https > 192.168.1.8:9456 PA / Raw
147	2020-03-22 12:56:38	192.168.1.8	140.82.112.6	Https	94	Ether / IP / TCP 192.168.1.8:9456 > 140.82.112.6:https PA / Raw
148	2020-03-22 12:56:38	192.168.1.8	140.82.112.6	Https	94	Ether / IP / TCP 192.168.1.8:9456 > 140.82.112.6:https PA / Raw
149	2020-03-22 12:56:38	192.168.1.8	140.82.112.6	Https	54	Ether / IP / TCP 192.168.1.8:9456 > 140.82.112.6:https FA
150	2020-03-22 12:56:38	192.168.1.8	39.98.59.39	TCP	54	Ether / IP / TCP 192.168.1.8:13902 > 39.98.59.39:5938 A
151	2020-03-22 12:56:38	192.168.1.8	183.57.48.55	Http	66	Ether / IP / TCP 192.168.1.8:9462 > 183.57.48.55:http S
152	2020-03-22 12:56:38	183.57.48.55	192.168.1.8	Http	66	Ether / IP / TCP 183.57.48.55:http > 192.168.1.8:9462 SA
153	2020-03-22 12:56:38	192.168.1.8	183.57.48.55	Http	54	Ether / IP / TCP 192.168.1.8:9462 > 183.57.48.55:http A
154	2020-03-22 12:56:38	103.107.198.18	192.168.1.8	Https	66	Ether / IP / TCP 103.107.198.18:https > 192.168.1.8:13463 A
155	2020-03-22 12:56:38	192.168.1.8	174.37.154.236	Https	66	Ether / IP / TCP 192.168.1.8:9463 > 174.37.154.236:https S
156	2020-03-22 12:56:38	174.37.154.236	192.168.1.8	Https	54	Ether / IP / TCP 174.37.154.236:https > 192.168.1.8:9463 RA
157	2020-03-22 12:56:38	192.168.1.8	174.37.154.236	Https	66	Ether / IP / TCP 192.168.1.8:9464 > 174.37.154.236:https S
158	2020-03-22 12:56:38	174.37.154.236	192.168.1.8	Https	54	Ether / IP / TCP 174.37.154.236:https > 192.168.1.8:9464 RA
159	2020-03-22 12:56:38	192.168.1.8	219.133.60.246	UDP	308	Ether / IP / UDP 192.168.1.8:62754 > 219.133.60.246:8000 / Raw
160	2020-03-22 12:56:38	192.168.1.8	183.57.48.55	Http	1217	Ether / IP / TCP / HTTP / 'POST' '/q.cgi' 'HTTP/1.1' / Raw
161	2020-03-22 12:56:38	140.82.112.6	192.168.1.8	Https	54	Ether / IP / TCP 140.82.112.6:https > 192.168.1.8:9456 A
162	2020-03-22 12:56:38	140.82.112.6	192.168.1.8	Https	54	Ether / IP / TCP 140.82.112.6:https > 192.168.1.8:9456 FA
163	2020-03-22 12:56:38	183.57.48.55	192.168.1.8	Http	54	Ether / IP / TCP 183.57.48.55:http > 192.168.1.8:9462 A
164	2020-03-22 12:56:38	192.168.1.8	140.82.112.6	Https	54	Ether / IP / TCP 192.168.1.8:9456 > 140.82.112.6:https A
165	2020-03-22 12:56:38	192.168.1.8	172.217.160.77	Https	66	Ether / IP / TCP 192.168.1.8:9465 > 172.217.160.77:https S
166	2020-03-22 12:56:38	183.57.48.55	192.168.1.8	Http	408	Ether / IP / TCP / HTTP / 'HTTP/1.1' '200' 'OK' / Raw
167	2020-03-22 12:56:38	192.168.1.8	183.57.48.55	Http	54	Ether / IP / TCP 192.168.1.8:9462 > 183.57.48.55:http FA
168	2020-03-22 12:56:38	183.57.48.55	192.168.1.8	Http	54	Ether / IP / TCP 183.57.48.55:http > 192.168.1.8:9462 FA
169	2020-03-22 12:56:38	192.168.1.8	183.57.48.55	Http	54	Ether / IP / TCP 192.168.1.8:9462 > 183.57.48.55:http A
170	2020-03-22 12:56:38	192.168.1.8	174.37.154.236	Https	66	Ether / IP / TCP 192.168.1.8:9461 > 174.37.154.236:https S
171	2020-03-22 12:56:38	192.168.1.8	183.57.48.55	Http	66	Ether / IP / TCP 192.168.1.8:9457 > 183.57.48.55:http S
172	2020-03-22 12:56:38	192.168.1.8	172.217.160.77	Https	66	Ether / IP / TCP 192.168.1.8:9466 > 172.217.160.77:https S
173	2020-03-22 12:56:38	183.57.48.55	192.168.1.8	Http	66	Ether / IP / TCP 183.57.48.55:http > 192.168.1.8:9457 SA
174	2020-03-22 12:56:38	192.168.1.8	183.57.48.55	Http	54	Ether / IP / TCP 192.168.1.8:9457 > 183.57.48.55:http A
175	2020-03-22 12:56:38	192.168.1.8	183.57.48.55	Http	1041	Ether / IP / TCP / HTTP / 'POST' '/q.cgi' 'HTTP/1.1' / Raw
176	2020-03-22 12:56:38	240e:d4:2efe:200:21ec:b634:66e2:3bbe	2404:6800:4012::200d	Https	86	Ether / IPv6 / TCP 240e:d4:2efe:200:21ec:b634:66e2:3bbe:9467 > 2404:6800:4012::200d:https S
177	2020-03-22 12:56:38	183.57.48.55	192.168.1.8	Http	54	Ether / IP / TCP 183.57.48.55:http > 192.168.1.8:9457 A
178	2020-03-22 12:56:38	183.57.48.55	192.168.1.8	Http	280	Ether / IP / TCP / HTTP / 'HTTP/1.1' '200' 'OK' / Raw
179	2020-03-22 12:56:38	192.168.1.8	183.57.48.55	Http	54	Ether / IP / TCP 192.168.1.8:9457 > 183.57.48.55:http FA
180	2020-03-22 12:56:38	183.57.48.55	192.168.1.8	Http	54	Ether / IP / TCP 183.57.48.55:http > 192.168.1.8:9457 FA
181	2020-03-22 12:56:38	192.168.1.8	183.57.48.55	Http	54	Ether / IP / TCP 192.168.1.8:9457 > 183.57.48.55:http A
182	2020-03-22 12:56:38	240e:d4:2efe:200:21ec:b634:66e2:3bbe	2404:6800:4012::2004	Https	86	Ether / IPv6 / TCP 240e:d4:2efe:200:21ec:b634:66e2:3bbe:9468 > 2404:6800:4012::2004:https S
183	2020-03-22 12:56:38	192.168.1.8	14.215.177.39	Https	66	Ether / IP / TCP 192.168.1.8:9469 > 14.215.177.39:https S
184	2020-03-22 12:56:38	192.168.1.8	174.37.154.236	Https	66	Ether / IP / TCP 192.168.1.8:9463 > 174.37.154.236:https S
185	2020-03-22 12:56:38	14.215.177.39	192.168.1.8	Https	66	Ether / IP / TCP 14.215.177.39:https > 192.168.1.8:9469 SA
186	2020-03-22 12:56:38	192.168.1.8	14.215.177.39	Https	54	Ether / IP / TCP 192.168.1.8:9469 > 14.215.177.39:https A
187	2020-03-22 12:56:38	192.168.1.8	14.215.177.39	Https	54	Ether / IP / TCP 192.168.1.8:9469 > 14.215.177.39:https FA
188	2020-03-22 12:56:38	240e:d4:2efe:200:21ec:b634:66e2:3bbe	2404:6800:4012::2004	Https	86	Ether / IPv6 / TCP 240e:d4:2efe:200:21ec:b634:66e2:3bbe:9458 > 2404:6800:4012::2004:https S
189	2020-03-22 12:56:38	192.168.1.8	174.37.154.236	Https	66	Ether / IP / TCP 192.168.1.8:9464 > 174.37.154.236:https S
190	2020-03-22 12:56:38	240e:d4:2efe:200:21ec:b634:66e2:3bbe	2404:6800:4012::2004	Https	86	Ether / IPv6 / TCP 240e:d4:2efe:200:21ec:b634:66e2:3bbe:9459 > 2404:6800:4012::2004:https S
191	2020-03-22 12:56:38	192.168.1.8	219.133.60.246	UDP	308	Ether / IP / UDP 192.168.1.8:62754 > 219.133.60.246:8000 / Raw
192	2020-03-22 12:56:38	240e:d4:2efe:200:21ec:b634:66e2:3bbe	2404:6800:4012::200d	Https	86	Ether / IPv6 / TCP 240e:d4:2efe:200:21ec:b634:66e2:3bbe:9470 > 2404:6800:4012::200d:https S
193	2020-03-22 12:56:38	240e:d4:2efe:200:21ec:b634:66e2:3bbe	2404:6800:4012::2004	Https	86	Ether / IPv6 / TCP 240e:d4:2efe:200:21ec:b634:66e2:3bbe:9460 > 2404:6800:4012::2004:https S
194	2020-03-22 12:56:39	192.168.1.8	10.10.20.110	UDP	83	Ether / IP / UDP 192.168.1.8:59684 > 10.10.20.110:snmp / SNMP
195	2020-03-22 12:56:39	192.168.1.8	174.37.154.236	Https	66	Ether / IP / TCP 192.168.1.8:9471 > 174.37.154.236:https S
196	2020-03-22 12:56:39	192.168.1.8	14.215.177.39	Https	54	Ether / IP / TCP 192.168.1.8:9469 > 14.215.177.39:https FA
197	2020-03-22 12:56:39	39.98.59.39	192.168.1.8	TCP	103	Ether / IP / TCP 39.98.59.39:5938 > 192.168.1.8:13902 PA / Raw
198	2020-03-22 12:56:39	192.168.1.8	39.98.59.39	TCP	103	Ether / IP / TCP 192.168.1.8:13902 > 39.98.59.39:5938 PA / Raw
199	2020-03-22 12:56:39	174.37.154.236	192.168.1.8	Https	54	Ether / IP / TCP 174.37.154.236:https > 192.168.1.8:9471 RA
200	2020-03-22 12:56:39	39.98.59.39	192.168.1.8	TCP	54	Ether / IP / TCP 39.98.59.39:5938 > 192.168.1.8:13902 A
201	2020-03-22 12:56:39	192.168.1.8	172.217.160.77	Https	66	Ether / IP / TCP 192.168.1.8:9465 > 172.217.160.77:https S
202	2020-03-22 12:56:39	192.168.1.8	192.168.1.1	DNS	76	Ether / IP / UDP / DNS Qry "b'www.nowcoder.com.'" 
203	2020-03-22 12:56:39	192.168.1.8	183.57.48.55	Http	66	Ether / IP / TCP 192.168.1.8:9472 > 183.57.48.55:http S
204	2020-03-22 12:56:39	192.168.1.8	192.168.1.1	DNS	76	Ether / IP / UDP / DNS Qry "b'www.nowcoder.com.'" 
205	2020-03-22 12:56:39	192.168.1.8	192.168.1.1	DNS	79	Ether / IP / UDP / DNS Qry "b'static.nowcoder.com.'" 
206	2020-03-22 12:56:39	192.168.1.8	192.168.1.1	DNS	77	Ether / IP / UDP / DNS Qry "b'fonts.gstatic.com.'" 
207	2020-03-22 12:56:39	192.168.1.8	192.168.1.1	DNS	79	Ether / IP / UDP / DNS Qry "b'static.nowcoder.com.'" 
208	2020-03-22 12:56:39	192.168.1.8	192.168.1.1	DNS	77	Ether / IP / UDP / DNS Qry "b'fonts.gstatic.com.'" 
209	2020-03-22 12:56:39	192.168.1.1	192.168.1.8	DNS	342	Ether / IP / UDP / DNS Ans "114.55.207.244" 
210	2020-03-22 12:56:39	fe80::bd54:c78a:25f1:695	fe80::1	DNS	96	Ether / IPv6 / UDP / DNS Qry "b'www.nowcoder.com.'" 
211	2020-03-22 12:56:39	fe80::bd54:c78a:25f1:695	fe80::1	DNS	99	Ether / IPv6 / UDP / DNS Qry "b'static.nowcoder.com.'" 
212	2020-03-22 12:56:39	fe80::bd54:c78a:25f1:695	fe80::1	DNS	97	Ether / IPv6 / UDP / DNS Qry "b'fonts.gstatic.com.'" 
213	2020-03-22 12:56:39	192.168.1.1	192.168.1.8	DNS	149	Ether / IP / UDP / DNS Ans 
214	2020-03-22 12:56:39	192.168.1.1	192.168.1.8	DNS	451	Ether / IP / UDP / DNS Ans "b'static.nowcoder.com.w.alikunlun.com.'" 
215	2020-03-22 12:56:39	192.168.1.1	192.168.1.8	DNS	425	Ether / IP / UDP / DNS Ans "b'gstaticadssl.l.google.com.'" 
216	2020-03-22 12:56:39	fe80::1	fe80::bd54:c78a:25f1:695	DNS	197	Ether / IPv6 / UDP / DNS Ans "b'static.nowcoder.com.w.alikunlun.com.'" 
217	2020-03-22 12:56:39	183.57.48.55	192.168.1.8	Http	66	Ether / IP / TCP 183.57.48.55:http > 192.168.1.8:9472 SA
218	2020-03-22 12:56:39	192.168.1.8	183.57.48.55	Http	54	Ether / IP / TCP 192.168.1.8:9472 > 183.57.48.55:http A
219	2020-03-22 12:56:39	192.168.1.8	114.55.207.244	Https	66	Ether / IP / TCP 192.168.1.8:9473 > 114.55.207.244:https S
220	2020-03-22 12:56:39	192.168.1.8	27.159.68.188	Https	66	Ether / IP / TCP 192.168.1.8:9474 > 27.159.68.188:https S
221	2020-03-22 12:56:39	192.168.1.1	192.168.1.8	DNS	163	Ether / IP / UDP / DNS Ans "b'gstaticadssl.l.google.com.'" 
222	2020-03-22 12:56:39	fe80::1	fe80::bd54:c78a:25f1:695	DNS	169	Ether / IPv6 / UDP / DNS Ans 
223	2020-03-22 12:56:39	27.159.68.188	192.168.1.8	Https	66	Ether / IP / TCP 27.159.68.188:https > 192.168.1.8:9474 SA
224	2020-03-22 12:56:39	192.168.1.8	27.159.68.188	Https	54	Ether / IP / TCP 192.168.1.8:9474 > 27.159.68.188:https A
225	2020-03-22 12:56:39	192.168.1.8	27.159.68.188	Https	571	Ether / IP / TCP 192.168.1.8:9474 > 27.159.68.188:https PA / Raw
226	2020-03-22 12:56:39	114.55.207.244	192.168.1.8	Https	66	Ether / IP / TCP 114.55.207.244:https > 192.168.1.8:9473 SA
227	2020-03-22 12:56:39	192.168.1.8	114.55.207.244	Https	54	Ether / IP / TCP 192.168.1.8:9473 > 114.55.207.244:https A
228	2020-03-22 12:56:39	192.168.1.8	114.55.207.244	Https	571	Ether / IP / TCP 192.168.1.8:9473 > 114.55.207.244:https PA / Raw
229	2020-03-22 12:56:39	27.159.68.188	192.168.1.8	Https	54	Ether / IP / TCP 27.159.68.188:https > 192.168.1.8:9474 A
230	2020-03-22 12:56:39	27.159.68.188	192.168.1.8	Https	1506	Ether / IP / TCP 27.159.68.188:https > 192.168.1.8:9474 A / Raw
231	2020-03-22 12:56:39	27.159.68.188	192.168.1.8	Https	1506	Ether / IP / TCP 27.159.68.188:https > 192.168.1.8:9474 A / Raw
232	2020-03-22 12:56:39	27.159.68.188	192.168.1.8	Https	233	Ether / IP / TCP 27.159.68.188:https > 192.168.1.8:9474 PA / Raw
233	2020-03-22 12:56:39	192.168.1.8	27.159.68.188	Https	54	Ether / IP / TCP 192.168.1.8:9474 > 27.159.68.188:https A
234	2020-03-22 12:56:39	192.168.1.8	174.37.154.236	Https	66	Ether / IP / TCP 192.168.1.8:9471 > 174.37.154.236:https S
235	2020-03-22 12:56:39	27.159.68.188	192.168.1.8	Https	233	Ether / IP / TCP 27.159.68.188:https > 192.168.1.8:9474 PA / Raw
236	2020-03-22 12:56:39	192.168.1.8	27.159.68.188	Https	66	Ether / IP / TCP 192.168.1.8:9474 > 27.159.68.188:https A
237	2020-03-22 12:56:39	114.55.207.244	192.168.1.8	Https	54	Ether / IP / TCP 114.55.207.244:https > 192.168.1.8:9473 A
238	2020-03-22 12:56:39	114.55.207.244	192.168.1.8	Https	1494	Ether / IP / TCP 114.55.207.244:https > 192.168.1.8:9473 A / Raw
239	2020-03-22 12:56:39	114.55.207.244	192.168.1.8	Https	1494	Ether / IP / TCP 114.55.207.244:https > 192.168.1.8:9473 A / Raw
240	2020-03-22 12:56:39	114.55.207.244	192.168.1.8	Https	257	Ether / IP / TCP 114.55.207.244:https > 192.168.1.8:9473 PA / Raw
241	2020-03-22 12:56:39	192.168.1.8	114.55.207.244	Https	54	Ether / IP / TCP 192.168.1.8:9473 > 114.55.207.244:https A
242	2020-03-22 12:56:39	192.168.1.8	172.217.160.77	Https	66	Ether / IP / TCP 192.168.1.8:9466 > 172.217.160.77:https S
243	2020-03-22 12:56:39	192.168.1.8	27.159.68.188	Https	147	Ether / IP / TCP 192.168.1.8:9474 > 27.159.68.188:https PA / Raw
244	2020-03-22 12:56:39	192.168.1.8	14.215.177.39	Https	54	Ether / IP / TCP 192.168.1.8:9469 > 14.215.177.39:https FA
245	2020-03-22 12:56:39	27.159.68.188	192.168.1.8	Https	296	Ether / IP / TCP 27.159.68.188:https > 192.168.1.8:9474 PA / Raw
246	2020-03-22 12:56:39	27.159.68.188	192.168.1.8	Https	123	Ether / IP / TCP 27.159.68.188:https > 192.168.1.8:9474 PA / Raw
247	2020-03-22 12:56:39	192.168.1.8	27.159.68.188	Https	54	Ether / IP / TCP 192.168.1.8:9474 > 27.159.68.188:https A
248	2020-03-22 12:56:39	192.168.1.8	114.55.207.244	Https	147	Ether / IP / TCP 192.168.1.8:9473 > 114.55.207.244:https PA / Raw
249	2020-03-22 12:56:39	192.168.1.8	114.55.207.244	Https	153	Ether / IP / TCP 192.168.1.8:9473 > 114.55.207.244:https PA / Raw
250	2020-03-22 12:56:39	192.168.1.8	114.55.207.244	Https	544	Ether / IP / TCP 192.168.1.8:9473 > 114.55.207.244:https PA / Raw
251	2020-03-22 12:56:39	240e:d4:2efe:200:21ec:b634:66e2:3bbe	2404:6800:4012::200d	Https	86	Ether / IPv6 / TCP 240e:d4:2efe:200:21ec:b634:66e2:3bbe:9467 > 2404:6800:4012::200d:https S
252	2020-03-22 12:56:39	114.55.207.244	192.168.1.8	Https	54	Ether / IP / TCP 114.55.207.244:https > 192.168.1.8:9473 A
253	2020-03-22 12:56:39	114.55.207.244	192.168.1.8	Https	312	Ether / IP / TCP 114.55.207.244:https > 192.168.1.8:9473 PA / Raw
254	2020-03-22 12:56:39	114.55.207.244	192.168.1.8	Https	132	Ether / IP / TCP 114.55.207.244:https > 192.168.1.8:9473 PA / Raw
255	2020-03-22 12:56:39	192.168.1.8	114.55.207.244	Https	54	Ether / IP / TCP 192.168.1.8:9473 > 114.55.207.244:https A
256	2020-03-22 12:56:39	192.168.1.8	114.55.207.244	Https	92	Ether / IP / TCP 192.168.1.8:9473 > 114.55.207.244:https PA / Raw
257	2020-03-22 12:56:39	192.168.1.8	183.57.48.55	Http	1025	Ether / IP / TCP / HTTP / 'POST' '/q.cgi' 'HTTP/1.1' / Raw
258	2020-03-22 12:56:39	114.55.207.244	192.168.1.8	Https	1483	Ether / IP / TCP 114.55.207.244:https > 192.168.1.8:9473 PA / Raw
259	2020-03-22 12:56:39	114.55.207.244	192.168.1.8	Https	1483	Ether / IP / TCP 114.55.207.244:https > 192.168.1.8:9473 PA / Raw
260	2020-03-22 12:56:39	114.55.207.244	192.168.1.8	Https	1494	Ether / IP / TCP 114.55.207.244:https > 192.168.1.8:9473 A / Raw
261	2020-03-22 12:56:39	114.55.207.244	192.168.1.8	Https	1494	Ether / IP / TCP 114.55.207.244:https > 192.168.1.8:9473 A / Raw
262	2020-03-22 12:56:39	192.168.1.8	114.55.207.244	Https	54	Ether / IP / TCP 192.168.1.8:9473 > 114.55.207.244:https A
263	2020-03-22 12:56:39	114.55.207.244	192.168.1.8	Https	1494	Ether / IP / TCP 114.55.207.244:https > 192.168.1.8:9473 A / Raw
264	2020-03-22 12:56:39	240e:d4:2efe:200:21ec:b634:66e2:3bbe	2404:6800:4012::2004	Https	86	Ether / IPv6 / TCP 240e:d4:2efe:200:21ec:b634:66e2:3bbe:9468 > 2404:6800:4012::2004:https S
265	2020-03-22 12:56:39	114.55.207.244	192.168.1.8	Https	1494	Ether / IP / TCP 114.55.207.244:https > 192.168.1.8:9473 A / Raw
266	2020-03-22 12:56:39	114.55.207.244	192.168.1.8	Https	1494	Ether / IP / TCP 114.55.207.244:https > 192.168.1.8:9473 A / Raw
267	2020-03-22 12:56:39	114.55.207.244	192.168.1.8	Https	1494	Ether / IP / TCP 114.55.207.244:https > 192.168.1.8:9473 A / Raw
268	2020-03-22 12:56:39	192.168.1.8	114.55.207.244	Https	54	Ether / IP / TCP 192.168.1.8:9473 > 114.55.207.244:https A
269	2020-03-22 12:56:39	114.55.207.244	192.168.1.8	Https	1494	Ether / IP / TCP 114.55.207.244:https > 192.168.1.8:9473 A / Raw
270	2020-03-22 12:56:39	114.55.207.244	192.168.1.8	Https	1494	Ether / IP / TCP 114.55.207.244:https > 192.168.1.8:9473 A / Raw
271	2020-03-22 12:56:39	114.55.207.244	192.168.1.8	Https	1494	Ether / IP / TCP 114.55.207.244:https > 192.168.1.8:9473 A / Raw
272	2020-03-22 12:56:39	114.55.207.244	192.168.1.8	Https	1494	Ether / IP / TCP 114.55.207.244:https > 192.168.1.8:9473 PA / Raw
273	2020-03-22 12:56:39	192.168.1.8	114.55.207.244	Https	54	Ether / IP / TCP 192.168.1.8:9473 > 114.55.207.244:https A
274	2020-03-22 12:56:39	183.57.48.55	192.168.1.8	Http	54	Ether / IP / TCP 183.57.48.55:http > 192.168.1.8:9472 A
275	2020-03-22 12:56:39	183.57.48.55	192.168.1.8	Http	280	Ether / IP / TCP / HTTP / 'HTTP/1.1' '200' 'OK' / Raw
276	2020-03-22 12:56:39	192.168.1.8	183.57.48.55	Http	54	Ether / IP / TCP 192.168.1.8:9472 > 183.57.48.55:http FA
277	2020-03-22 12:56:39	183.57.48.55	192.168.1.8	Http	54	Ether / IP / TCP 183.57.48.55:http > 192.168.1.8:9472 FA
278	2020-03-22 12:56:39	192.168.1.8	183.57.48.55	Http	54	Ether / IP / TCP 192.168.1.8:9472 > 183.57.48.55:http A
279	2020-03-22 12:56:39	192.168.1.8	27.159.68.188	Https	153	Ether / IP / TCP 192.168.1.8:9474 > 27.159.68.188:https PA / Raw
280	2020-03-22 12:56:39	192.168.1.8	27.159.68.188	Https	92	Ether / IP / TCP 192.168.1.8:9474 > 27.159.68.188:https PA / Raw
281	2020-03-22 12:56:39	192.168.1.8	27.159.68.188	Https	477	Ether / IP / TCP 192.168.1.8:9474 > 27.159.68.188:https PA / Raw
282	2020-03-22 12:56:39	192.168.1.8	27.159.68.188	Https	150	Ether / IP / TCP 192.168.1.8:9474 > 27.159.68.188:https PA / Raw
283	2020-03-22 12:56:39	192.168.1.8	27.159.68.188	Https	158	Ether / IP / TCP 192.168.1.8:9474 > 27.159.68.188:https PA / Raw
284	2020-03-22 12:56:39	192.168.1.8	27.159.68.188	Https	163	Ether / IP / TCP 192.168.1.8:9474 > 27.159.68.188:https PA / Raw
285	2020-03-22 12:56:39	192.168.1.8	27.159.68.188	Https	166	Ether / IP / TCP 192.168.1.8:9474 > 27.159.68.188:https PA / Raw
286	2020-03-22 12:56:39	192.168.1.8	27.159.68.188	Https	174	Ether / IP / TCP 192.168.1.8:9474 > 27.159.68.188:https PA / Raw
287	2020-03-22 12:56:39	192.168.1.8	192.168.1.1	DNS	84	Ether / IP / UDP / DNS Qry "b'uploadfiles.nowcoder.com.'" 
288	2020-03-22 12:56:39	192.168.1.8	192.168.1.1	DNS	84	Ether / IP / UDP / DNS Qry "b'uploadfiles.nowcoder.com.'" 
289	2020-03-22 12:56:39	27.159.68.188	192.168.1.8	Https	92	Ether / IP / TCP 27.159.68.188:https > 192.168.1.8:9474 PA / Raw
290	2020-03-22 12:56:39	27.159.68.188	192.168.1.8	Https	54	Ether / IP / TCP 27.159.68.188:https > 192.168.1.8:9474 A
291	2020-03-22 12:56:39	27.159.68.188	192.168.1.8	Https	54	Ether / IP / TCP 27.159.68.188:https > 192.168.1.8:9474 A
292	2020-03-22 12:56:39	27.159.68.188	192.168.1.8	Https	1506	Ether / IP / TCP 27.159.68.188:https > 192.168.1.8:9474 A / Raw
293	2020-03-22 12:56:39	27.159.68.188	192.168.1.8	Https	1506	Ether / IP / TCP 27.159.68.188:https > 192.168.1.8:9474 A / Raw
294	2020-03-22 12:56:39	27.159.68.188	192.168.1.8	Https	1506	Ether / IP / TCP 27.159.68.188:https > 192.168.1.8:9474 A / Raw
295	2020-03-22 12:56:39	27.159.68.188	192.168.1.8	Https	1506	Ether / IP / TCP 27.159.68.188:https > 192.168.1.8:9474 A / Raw
296	2020-03-22 12:56:39	192.168.1.8	27.159.68.188	Https	54	Ether / IP / TCP 192.168.1.8:9474 > 27.159.68.188:https A
297	2020-03-22 12:56:39	27.159.68.188	192.168.1.8	Https	1506	Ether / IP / TCP 27.159.68.188:https > 192.168.1.8:9474 A / Raw
298	2020-03-22 12:56:39	192.168.1.8	27.159.68.188	Https	54	Ether / IP / TCP 192.168.1.8:9474 > 27.159.68.188:https A
299	2020-03-22 12:56:39	27.159.68.188	192.168.1.8	Https	1506	Ether / IP / TCP 27.159.68.188:https > 192.168.1.8:9474 A / Raw
300	2020-03-22 12:56:39	27.159.68.188	192.168.1.8	Https	1506	Ether / IP / TCP 27.159.68.188:https > 192.168.1.8:9474 A / Raw
301	2020-03-22 12:56:39	27.159.68.188	192.168.1.8	Https	1506	Ether / IP / TCP 27.159.68.188:https > 192.168.1.8:9474 A / Raw
302	2020-03-22 12:56:39	27.159.68.188	192.168.1.8	Https	1506	Ether / IP / TCP 27.159.68.188:https > 192.168.1.8:9474 A / Raw
303	2020-03-22 12:56:39	192.168.1.8	27.159.68.188	Https	54	Ether / IP / TCP 192.168.1.8:9474 > 27.159.68.188:https A
304	2020-03-22 12:56:39	192.168.1.1	192.168.1.8	DNS	461	Ether / IP / UDP / DNS Ans "b'uploadfiles.nowcoder.com.w.alikunlun.com.'" 
305	2020-03-22 12:56:39	192.168.1.1	192.168.1.8	DNS	187	Ether / IP / UDP / DNS Ans "b'uploadfiles.nowcoder.com.w.alikunlun.com.'" 
306	2020-03-22 12:56:39	27.159.68.188	192.168.1.8	Https	1506	Ether / IP / TCP 27.159.68.188:https > 192.168.1.8:9474 A / Raw
307	2020-03-22 12:56:39	27.159.68.188	192.168.1.8	Https	1506	Ether / IP / TCP 27.159.68.188:https > 192.168.1.8:9474 A / Raw
308	2020-03-22 12:56:39	27.159.68.188	192.168.1.8	Https	1506	Ether / IP / TCP 27.159.68.188:https > 192.168.1.8:9474 A / Raw
309	2020-03-22 12:56:39	27.159.68.188	192.168.1.8	Https	1506	Ether / IP / TCP 27.159.68.188:https > 192.168.1.8:9474 A / Raw
310	2020-03-22 12:56:39	192.168.1.8	27.159.68.188	Https	54	Ether / IP / TCP 192.168.1.8:9474 > 27.159.68.188:https A
311	2020-03-22 12:56:39	fe80::bd54:c78a:25f1:695	fe80::1	DNS	104	Ether / IPv6 / UDP / DNS Qry "b'uploadfiles.nowcoder.com.'" 
312	2020-03-22 12:56:39	27.159.68.188	192.168.1.8	Https	1506	Ether / IP / TCP 27.159.68.188:https > 192.168.1.8:9474 A / Raw
313	2020-03-22 12:56:39	27.159.68.188	192.168.1.8	Https	1506	Ether / IP / TCP 27.159.68.188:https > 192.168.1.8:9474 A / Raw
314	2020-03-22 12:56:39	27.159.68.188	192.168.1.8	Https	1506	Ether / IP / TCP 27.159.68.188:https > 192.168.1.8:9474 A / Raw
315	2020-03-22 12:56:39	27.159.68.188	192.168.1.8	Https	1506	Ether / IP / TCP 27.159.68.188:https > 192.168.1.8:9474 A / Raw
316	2020-03-22 12:56:39	27.159.68.188	192.168.1.8	Https	1506	Ether / IP / TCP 27.159.68.188:https > 192.168.1.8:9474 A / Raw
317	2020-03-22 12:56:39	192.168.1.8	27.159.68.188	Https	54	Ether / IP / TCP 192.168.1.8:9474 > 27.159.68.188:https A
318	2020-03-22 12:56:39	27.159.68.188	192.168.1.8	Https	1506	Ether / IP / TCP 27.159.68.188:https > 192.168.1.8:9474 A / Raw
319	2020-03-22 12:56:39	27.159.68.188	192.168.1.8	Https	1506	Ether / IP / TCP 27.159.68.188:https > 192.168.1.8:9474 A / Raw
320	2020-03-22 12:56:39	27.159.68.188	192.168.1.8	Https	1506	Ether / IP / TCP 27.159.68.188:https > 192.168.1.8:9474 A / Raw
321	2020-03-22 12:56:39	192.168.1.8	27.159.68.188	Https	54	Ether / IP / TCP 192.168.1.8:9474 > 27.159.68.188:https A
322	2020-03-22 12:56:39	27.159.68.188	192.168.1.8	Https	1506	Ether / IP / TCP 27.159.68.188:https > 192.168.1.8:9474 A / Raw
323	2020-03-22 12:56:39	27.159.68.188	192.168.1.8	Https	1506	Ether / IP / TCP 27.159.68.188:https > 192.168.1.8:9474 A / Raw
324	2020-03-22 12:56:39	27.159.68.188	192.168.1.8	Https	1506	Ether / IP / TCP 27.159.68.188:https > 192.168.1.8:9474 A / Raw
325	2020-03-22 12:56:39	192.168.1.8	27.159.68.188	Https	54	Ether / IP / TCP 192.168.1.8:9474 > 27.159.68.188:https A
326	2020-03-22 12:56:39	27.159.68.188	192.168.1.8	Https	1506	Ether / IP / TCP 27.159.68.188:https > 192.168.1.8:9474 A / Raw
327	2020-03-22 12:56:39	27.159.68.188	192.168.1.8	Https	1506	Ether / IP / TCP 27.159.68.188:https > 192.168.1.8:9474 A / Raw
328	2020-03-22 12:56:39	192.168.1.8	27.159.68.188	Https	54	Ether / IP / TCP 192.168.1.8:9474 > 27.159.68.188:https A
329	2020-03-22 12:56:39	27.159.68.188	192.168.1.8	Https	1506	Ether / IP / TCP 27.159.68.188:https > 192.168.1.8:9474 A / Raw
330	2020-03-22 12:56:39	27.159.68.188	192.168.1.8	Https	1506	Ether / IP / TCP 27.159.68.188:https > 192.168.1.8:9474 A / Raw
331	2020-03-22 12:56:39	27.159.68.188	192.168.1.8	Https	1506	Ether / IP / TCP 27.159.68.188:https > 192.168.1.8:9474 A / Raw
332	2020-03-22 12:56:39	27.159.68.188	192.168.1.8	Https	1506	Ether / IP / TCP 27.159.68.188:https > 192.168.1.8:9474 A / Raw
333	2020-03-22 12:56:39	27.159.68.188	192.168.1.8	Https	1506	Ether / IP / TCP 27.159.68.188:https > 192.168.1.8:9474 A / Raw
334	2020-03-22 12:56:39	192.168.1.8	27.159.68.188	Https	54	Ether / IP / TCP 192.168.1.8:9474 > 27.159.68.188:https A
335	2020-03-22 12:56:39	27.159.68.188	192.168.1.8	Https	1506	Ether / IP / TCP 27.159.68.188:https > 192.168.1.8:9474 A / Raw
336	2020-03-22 12:56:39	27.159.68.188	192.168.1.8	Https	1506	Ether / IP / TCP 27.159.68.188:https > 192.168.1.8:9474 A / Raw
337	2020-03-22 12:56:39	27.159.68.188	192.168.1.8	Https	1506	Ether / IP / TCP 27.159.68.188:https > 192.168.1.8:9474 A / Raw
338	2020-03-22 12:56:39	27.159.68.188	192.168.1.8	Https	1506	Ether / IP / TCP 27.159.68.188:https > 192.168.1.8:9474 A / Raw
339	2020-03-22 12:56:39	27.159.68.188	192.168.1.8	Https	1506	Ether / IP / TCP 27.159.68.188:https > 192.168.1.8:9474 A / Raw
340	2020-03-22 12:56:39	192.168.1.8	27.159.68.188	Https	54	Ether / IP / TCP 192.168.1.8:9474 > 27.159.68.188:https A
341	2020-03-22 12:56:39	27.159.68.188	192.168.1.8	Https	1506	Ether / IP / TCP 27.159.68.188:https > 192.168.1.8:9474 A / Raw
342	2020-03-22 12:56:39	192.168.1.8	27.159.68.188	Https	54	Ether / IP / TCP 192.168.1.8:9474 > 27.159.68.188:https A
343	2020-03-22 12:56:39	27.159.68.188	192.168.1.8	Https	1506	Ether / IP / TCP 27.159.68.188:https > 192.168.1.8:9474 A / Raw
344	2020-03-22 12:56:39	27.159.68.188	192.168.1.8	Https	1506	Ether / IP / TCP 27.159.68.188:https > 192.168.1.8:9474 A / Raw
345	2020-03-22 12:56:39	27.159.68.188	192.168.1.8	Https	1506	Ether / IP / TCP 27.159.68.188:https > 192.168.1.8:9474 A / Raw
346	2020-03-22 12:56:39	27.159.68.188	192.168.1.8	Https	1506	Ether / IP / TCP 27.159.68.188:https > 192.168.1.8:9474 A / Raw
347	2020-03-22 12:56:39	192.168.1.8	27.159.68.188	Https	54	Ether / IP / TCP 192.168.1.8:9474 > 27.159.68.188:https A
348	2020-03-22 12:56:39	27.159.68.188	192.168.1.8	Https	1506	Ether / IP / TCP 27.159.68.188:https > 192.168.1.8:9474 A / Raw
349	2020-03-22 12:56:39	27.159.68.188	192.168.1.8	Https	1506	Ether / IP / TCP 27.159.68.188:https > 192.168.1.8:9474 A / Raw
350	2020-03-22 12:56:39	27.159.68.188	192.168.1.8	Https	1317	Ether / IP / TCP 27.159.68.188:https > 192.168.1.8:9474 PA / Raw
351	2020-03-22 12:56:39	192.168.1.8	27.159.68.188	Https	54	Ether / IP / TCP 192.168.1.8:9474 > 27.159.68.188:https A
352	2020-03-22 12:56:39	192.168.1.8	121.9.244.85	Https	66	Ether / IP / TCP 192.168.1.8:9475 > 121.9.244.85:https S
353	2020-03-22 12:56:39	240e:d4:2efe:200:21ec:b634:66e2:3bbe	2404:6800:4012::200d	Https	86	Ether / IPv6 / TCP 240e:d4:2efe:200:21ec:b634:66e2:3bbe:9470 > 2404:6800:4012::200d:https S
354	2020-03-22 12:56:39	fe80::1	fe80::bd54:c78a:25f1:695	DNS	207	Ether / IPv6 / UDP / DNS Ans "b'uploadfiles.nowcoder.com.w.alikunlun.com.'" 
355	2020-03-22 12:56:39	121.9.244.85	192.168.1.8	Https	66	Ether / IP / TCP 121.9.244.85:https > 192.168.1.8:9475 SA
356	2020-03-22 12:56:39	192.168.1.8	121.9.244.85	Https	54	Ether / IP / TCP 192.168.1.8:9475 > 121.9.244.85:https A
357	2020-03-22 12:56:39	192.168.1.8	27.159.68.188	Https	165	Ether / IP / TCP 192.168.1.8:9474 > 27.159.68.188:https PA / Raw
358	2020-03-22 12:56:39	192.168.1.8	27.159.68.188	Https	152	Ether / IP / TCP 192.168.1.8:9474 > 27.159.68.188:https PA / Raw
359	2020-03-22 12:56:39	192.168.1.8	27.159.68.188	Https	152	Ether / IP / TCP 192.168.1.8:9474 > 27.159.68.188:https PA / Raw
360	2020-03-22 12:56:39	192.168.1.8	27.159.68.188	Https	150	Ether / IP / TCP 192.168.1.8:9474 > 27.159.68.188:https PA / Raw
361	2020-03-22 12:56:39	192.168.1.8	27.159.68.188	Https	166	Ether / IP / TCP 192.168.1.8:9474 > 27.159.68.188:https PA / Raw
362	2020-03-22 12:56:39	192.168.1.8	27.159.68.188	Https	175	Ether / IP / TCP 192.168.1.8:9474 > 27.159.68.188:https PA / Raw
363	2020-03-22 12:56:39	192.168.1.8	121.9.244.85	Https	571	Ether / IP / TCP 192.168.1.8:9475 > 121.9.244.85:https PA / Raw
364	2020-03-22 12:56:40	27.159.68.188	192.168.1.8	Https	54	Ether / IP / TCP 27.159.68.188:https > 192.168.1.8:9474 A
365	2020-03-22 12:56:40	27.159.68.188	192.168.1.8	Https	1506	Ether / IP / TCP 27.159.68.188:https > 192.168.1.8:9474 A / Raw
366	2020-03-22 12:56:40	27.159.68.188	192.168.1.8	Https	1506	Ether / IP / TCP 27.159.68.188:https > 192.168.1.8:9474 A / Raw
367	2020-03-22 12:56:40	27.159.68.188	192.168.1.8	Https	1506	Ether / IP / TCP 27.159.68.188:https > 192.168.1.8:9474 A / Raw
368	2020-03-22 12:56:40	192.168.1.8	27.159.68.188	Https	54	Ether / IP / TCP 192.168.1.8:9474 > 27.159.68.188:https A
369	2020-03-22 12:56:40	27.159.68.188	192.168.1.8	Https	1506	Ether / IP / TCP 27.159.68.188:https > 192.168.1.8:9474 A / Raw
370	2020-03-22 12:56:40	27.159.68.188	192.168.1.8	Https	1506	Ether / IP / TCP 27.159.68.188:https > 192.168.1.8:9474 A / Raw
371	2020-03-22 12:56:40	27.159.68.188	192.168.1.8	Https	1506	Ether / IP / TCP 27.159.68.188:https > 192.168.1.8:9474 A / Raw
372	2020-03-22 12:56:40	192.168.1.8	27.159.68.188	Https	54	Ether / IP / TCP 192.168.1.8:9474 > 27.159.68.188:https A
373	2020-03-22 12:56:40	27.159.68.188	192.168.1.8	Https	1506	Ether / IP / TCP 27.159.68.188:https > 192.168.1.8:9474 A / Raw
374	2020-03-22 12:56:40	27.159.68.188	192.168.1.8	Https	1506	Ether / IP / TCP 27.159.68.188:https > 192.168.1.8:9474 A / Raw
375	2020-03-22 12:56:40	27.159.68.188	192.168.1.8	Https	1506	Ether / IP / TCP 27.159.68.188:https > 192.168.1.8:9474 A / Raw
376	2020-03-22 12:56:40	192.168.1.8	27.159.68.188	Https	54	Ether / IP / TCP 192.168.1.8:9474 > 27.159.68.188:https A
377	2020-03-22 12:56:40	27.159.68.188	192.168.1.8	Https	1506	Ether / IP / TCP 27.159.68.188:https > 192.168.1.8:9474 A / Raw
378	2020-03-22 12:56:40	27.159.68.188	192.168.1.8	Https	1506	Ether / IP / TCP 27.159.68.188:https > 192.168.1.8:9474 A / Raw
379	2020-03-22 12:56:40	27.159.68.188	192.168.1.8	Https	495	Ether / IP / TCP 27.159.68.188:https > 192.168.1.8:9474 PA / Raw
380	2020-03-22 12:56:40	27.159.68.188	192.168.1.8	Https	1506	Ether / IP / TCP 27.159.68.188:https > 192.168.1.8:9474 A / Raw
381	2020-03-22 12:56:40	27.159.68.188	192.168.1.8	Https	1506	Ether / IP / TCP 27.159.68.188:https > 192.168.1.8:9474 A / Raw
382	2020-03-22 12:56:40	192.168.1.8	27.159.68.188	Https	54	Ether / IP / TCP 192.168.1.8:9474 > 27.159.68.188:https A
383	2020-03-22 12:56:40	27.159.68.188	192.168.1.8	Https	1506	Ether / IP / TCP 27.159.68.188:https > 192.168.1.8:9474 A / Raw
384	2020-03-22 12:56:40	27.159.68.188	192.168.1.8	Https	1506	Ether / IP / TCP 27.159.68.188:https > 192.168.1.8:9474 A / Raw
385	2020-03-22 12:56:40	27.159.68.188	192.168.1.8	Https	1506	Ether / IP / TCP 27.159.68.188:https > 192.168.1.8:9474 A / Raw
386	2020-03-22 12:56:40	27.159.68.188	192.168.1.8	Https	1506	Ether / IP / TCP 27.159.68.188:https > 192.168.1.8:9474 A / Raw
387	2020-03-22 12:56:40	27.159.68.188	192.168.1.8	Https	1506	Ether / IP / TCP 27.159.68.188:https > 192.168.1.8:9474 A / Raw
388	2020-03-22 12:56:40	192.168.1.8	27.159.68.188	Https	54	Ether / IP / TCP 192.168.1.8:9474 > 27.159.68.188:https A
389	2020-03-22 12:56:40	27.159.68.188	192.168.1.8	Https	1506	Ether / IP / TCP 27.159.68.188:https > 192.168.1.8:9474 A / Raw
390	2020-03-22 12:56:40	27.159.68.188	192.168.1.8	Https	1506	Ether / IP / TCP 27.159.68.188:https > 192.168.1.8:9474 A / Raw
391	2020-03-22 12:56:40	27.159.68.188	192.168.1.8	Https	1506	Ether / IP / TCP 27.159.68.188:https > 192.168.1.8:9474 A / Raw
392	2020-03-22 12:56:40	192.168.1.8	27.159.68.188	Https	54	Ether / IP / TCP 192.168.1.8:9474 > 27.159.68.188:https A
393	2020-03-22 12:56:40	27.159.68.188	192.168.1.8	Https	1506	Ether / IP / TCP 27.159.68.188:https > 192.168.1.8:9474 A / Raw
394	2020-03-22 12:56:40	27.159.68.188	192.168.1.8	Https	1506	Ether / IP / TCP 27.159.68.188:https > 192.168.1.8:9474 A / Raw
395	2020-03-22 12:56:40	192.168.1.8	27.159.68.188	Https	54	Ether / IP / TCP 192.168.1.8:9474 > 27.159.68.188:https A
396	2020-03-22 12:56:40	27.159.68.188	192.168.1.8	Https	1506	Ether / IP / TCP 27.159.68.188:https > 192.168.1.8:9474 A / Raw
397	2020-03-22 12:56:40	27.159.68.188	192.168.1.8	Https	1506	Ether / IP / TCP 27.159.68.188:https > 192.168.1.8:9474 A / Raw
398	2020-03-22 12:56:40	27.159.68.188	192.168.1.8	Https	1506	Ether / IP / TCP 27.159.68.188:https > 192.168.1.8:9474 A / Raw
399	2020-03-22 12:56:40	27.159.68.188	192.168.1.8	Https	1506	Ether / IP / TCP 27.159.68.188:https > 192.168.1.8:9474 A / Raw
400	2020-03-22 12:56:40	27.159.68.188	192.168.1.8	Https	1506	Ether / IP / TCP 27.159.68.188:https > 192.168.1.8:9474 A / Raw
401	2020-03-22 12:56:40	192.168.1.8	27.159.68.188	Https	54	Ether / IP / TCP 192.168.1.8:9474 > 27.159.68.188:https A
402	2020-03-22 12:56:40	27.159.68.188	192.168.1.8	Https	1506	Ether / IP / TCP 27.159.68.188:https > 192.168.1.8:9474 A / Raw
403	2020-03-22 12:56:40	27.159.68.188	192.168.1.8	Https	1506	Ether / IP / TCP 27.159.68.188:https > 192.168.1.8:9474 A / Raw
404	2020-03-22 12:56:40	27.159.68.188	192.168.1.8	Https	1506	Ether / IP / TCP 27.159.68.188:https > 192.168.1.8:9474 A / Raw
405	2020-03-22 12:56:40	27.159.68.188	192.168.1.8	Https	1506	Ether / IP / TCP 27.159.68.188:https > 192.168.1.8:9474 A / Raw
406	2020-03-22 12:56:40	27.159.68.188	192.168.1.8	Https	1506	Ether / IP / TCP 27.159.68.188:https > 192.168.1.8:9474 A / Raw
407	2020-03-22 12:56:40	192.168.1.8	27.159.68.188	Https	54	Ether / IP / TCP 192.168.1.8:9474 > 27.159.68.188:https A
408	2020-03-22 12:56:40	27.159.68.188	192.168.1.8	Https	1506	Ether / IP / TCP 27.159.68.188:https > 192.168.1.8:9474 A / Raw
409	2020-03-22 12:56:40	27.159.68.188	192.168.1.8	Https	1506	Ether / IP / TCP 27.159.68.188:https > 192.168.1.8:9474 A / Raw
410	2020-03-22 12:56:40	27.159.68.188	192.168.1.8	Https	1506	Ether / IP / TCP 27.159.68.188:https > 192.168.1.8:9474 A / Raw
411	2020-03-22 12:56:40	27.159.68.188	192.168.1.8	Https	1506	Ether / IP / TCP 27.159.68.188:https > 192.168.1.8:9474 A / Raw
412	2020-03-22 12:56:40	192.168.1.8	27.159.68.188	Https	54	Ether / IP / TCP 192.168.1.8:9474 > 27.159.68.188:https A
413	2020-03-22 12:56:40	27.159.68.188	192.168.1.8	Https	1506	Ether / IP / TCP 27.159.68.188:https > 192.168.1.8:9474 A / Raw
414	2020-03-22 12:56:40	27.159.68.188	192.168.1.8	Https	1506	Ether / IP / TCP 27.159.68.188:https > 192.168.1.8:9474 A / Raw
415	2020-03-22 12:56:40	27.159.68.188	192.168.1.8	Https	1506	Ether / IP / TCP 27.159.68.188:https > 192.168.1.8:9474 A / Raw
416	2020-03-22 12:56:40	27.159.68.188	192.168.1.8	Https	1506	Ether / IP / TCP 27.159.68.188:https > 192.168.1.8:9474 A / Raw
417	2020-03-22 12:56:40	27.159.68.188	192.168.1.8	Https	1506	Ether / IP / TCP 27.159.68.188:https > 192.168.1.8:9474 A / Raw
418	2020-03-22 12:56:40	27.159.68.188	192.168.1.8	Https	1506	Ether / IP / TCP 27.159.68.188:https > 192.168.1.8:9474 A / Raw
419	2020-03-22 12:56:40	192.168.1.8	27.159.68.188	Https	54	Ether / IP / TCP 192.168.1.8:9474 > 27.159.68.188:https A
420	2020-03-22 12:56:40	27.159.68.188	192.168.1.8	Https	1506	Ether / IP / TCP 27.159.68.188:https > 192.168.1.8:9474 A / Raw
421	2020-03-22 12:56:40	27.159.68.188	192.168.1.8	Https	1506	Ether / IP / TCP 27.159.68.188:https > 192.168.1.8:9474 A / Raw
422	2020-03-22 12:56:40	121.9.244.85	192.168.1.8	Https	54	Ether / IP / TCP 121.9.244.85:https > 192.168.1.8:9475 A
423	2020-03-22 12:56:40	27.159.68.188	192.168.1.8	Https	1506	Ether / IP / TCP 27.159.68.188:https > 192.168.1.8:9474 A / Raw
424	2020-03-22 12:56:40	121.9.244.85	192.168.1.8	Https	1506	Ether / IP / TCP 121.9.244.85:https > 192.168.1.8:9475 A / Raw
425	2020-03-22 12:56:40	121.9.244.85	192.168.1.8	Https	1506	Ether / IP / TCP 121.9.244.85:https > 192.168.1.8:9475 A / Raw
426	2020-03-22 12:56:40	27.159.68.188	192.168.1.8	Https	1506	Ether / IP / TCP 27.159.68.188:https > 192.168.1.8:9474 A / Raw
427	2020-03-22 12:56:40	27.159.68.188	192.168.1.8	Https	1506	Ether / IP / TCP 27.159.68.188:https > 192.168.1.8:9474 A / Raw
428	2020-03-22 12:56:40	27.159.68.188	192.168.1.8	Https	1506	Ether / IP / TCP 27.159.68.188:https > 192.168.1.8:9474 A / Raw
429	2020-03-22 12:56:40	121.9.244.85	192.168.1.8	Https	233	Ether / IP / TCP 121.9.244.85:https > 192.168.1.8:9475 PA / Raw
430	2020-03-22 12:56:40	27.159.68.188	192.168.1.8	Https	1506	Ether / IP / TCP 27.159.68.188:https > 192.168.1.8:9474 A / Raw
431	2020-03-22 12:56:40	27.159.68.188	192.168.1.8	Https	1506	Ether / IP / TCP 27.159.68.188:https > 192.168.1.8:9474 A / Raw
432	2020-03-22 12:56:40	192.168.1.8	27.159.68.188	Https	54	Ether / IP / TCP 192.168.1.8:9474 > 27.159.68.188:https A
433	2020-03-22 12:56:40	192.168.1.8	121.9.244.85	Https	54	Ether / IP / TCP 192.168.1.8:9475 > 121.9.244.85:https A
434	2020-03-22 12:56:40	27.159.68.188	192.168.1.8	Https	1506	Ether / IP / TCP 27.159.68.188:https > 192.168.1.8:9474 A / Raw
435	2020-03-22 12:56:40	27.159.68.188	192.168.1.8	Https	1506	Ether / IP / TCP 27.159.68.188:https > 192.168.1.8:9474 A / Raw
436	2020-03-22 12:56:40	27.159.68.188	192.168.1.8	Https	1506	Ether / IP / TCP 27.159.68.188:https > 192.168.1.8:9474 A / Raw
437	2020-03-22 12:56:40	27.159.68.188	192.168.1.8	Https	1506	Ether / IP / TCP 27.159.68.188:https > 192.168.1.8:9474 A / Raw
438	2020-03-22 12:56:40	27.159.68.188	192.168.1.8	Https	1506	Ether / IP / TCP 27.159.68.188:https > 192.168.1.8:9474 A / Raw
439	2020-03-22 12:56:40	192.168.1.8	27.159.68.188	Https	54	Ether / IP / TCP 192.168.1.8:9474 > 27.159.68.188:https A
440	2020-03-22 12:56:40	27.159.68.188	192.168.1.8	Https	1506	Ether / IP / TCP 27.159.68.188:https > 192.168.1.8:9474 A / Raw
441	2020-03-22 12:56:40	27.159.68.188	192.168.1.8	Https	1506	Ether / IP / TCP 27.159.68.188:https > 192.168.1.8:9474 A / Raw
442	2020-03-22 12:56:40	27.159.68.188	192.168.1.8	Https	1506	Ether / IP / TCP 27.159.68.188:https > 192.168.1.8:9474 A / Raw
443	2020-03-22 12:56:40	27.159.68.188	192.168.1.8	Https	1506	Ether / IP / TCP 27.159.68.188:https > 192.168.1.8:9474 A / Raw
444	2020-03-22 12:56:40	27.159.68.188	192.168.1.8	Https	1506	Ether / IP / TCP 27.159.68.188:https > 192.168.1.8:9474 A / Raw
445	2020-03-22 12:56:40	192.168.1.8	27.159.68.188	Https	54	Ether / IP / TCP 192.168.1.8:9474 > 27.159.68.188:https A
446	2020-03-22 12:56:40	27.159.68.188	192.168.1.8	Https	1506	Ether / IP / TCP 27.159.68.188:https > 192.168.1.8:9474 A / Raw
447	2020-03-22 12:56:40	27.159.68.188	192.168.1.8	Https	1506	Ether / IP / TCP 27.159.68.188:https > 192.168.1.8:9474 A / Raw
448	2020-03-22 12:56:40	27.159.68.188	192.168.1.8	Https	1506	Ether / IP / TCP 27.159.68.188:https > 192.168.1.8:9474 A / Raw
449	2020-03-22 12:56:40	27.159.68.188	192.168.1.8	Https	1506	Ether / IP / TCP 27.159.68.188:https > 192.168.1.8:9474 A / Raw
450	2020-03-22 12:56:40	27.159.68.188	192.168.1.8	Https	1506	Ether / IP / TCP 27.159.68.188:https > 192.168.1.8:9474 A / Raw
451	2020-03-22 12:56:40	192.168.1.8	27.159.68.188	Https	54	Ether / IP / TCP 192.168.1.8:9474 > 27.159.68.188:https A
452	2020-03-22 12:56:40	27.159.68.188	192.168.1.8	Https	1506	Ether / IP / TCP 27.159.68.188:https > 192.168.1.8:9474 A / Raw
453	2020-03-22 12:56:40	27.159.68.188	192.168.1.8	Https	1506	Ether / IP / TCP 27.159.68.188:https > 192.168.1.8:9474 A / Raw
454	2020-03-22 12:56:40	27.159.68.188	192.168.1.8	Https	1506	Ether / IP / TCP 27.159.68.188:https > 192.168.1.8:9474 A / Raw
455	2020-03-22 12:56:40	27.159.68.188	192.168.1.8	Https	1506	Ether / IP / TCP 27.159.68.188:https > 192.168.1.8:9474 A / Raw
456	2020-03-22 12:56:40	27.159.68.188	192.168.1.8	Https	1506	Ether / IP / TCP 27.159.68.188:https > 192.168.1.8:9474 A / Raw
457	2020-03-22 12:56:40	27.159.68.188	192.168.1.8	Https	1506	Ether / IP / TCP 27.159.68.188:https > 192.168.1.8:9474 A / Raw
458	2020-03-22 12:56:40	27.159.68.188	192.168.1.8	Https	1506	Ether / IP / TCP 27.159.68.188:https > 192.168.1.8:9474 A / Raw
459	2020-03-22 12:56:40	27.159.68.188	192.168.1.8	Https	1274	Ether / IP / TCP 27.159.68.188:https > 192.168.1.8:9474 A / Raw
460	2020-03-22 12:56:40	192.168.1.8	27.159.68.188	Https	54	Ether / IP / TCP 192.168.1.8:9474 > 27.159.68.188:https A
461	2020-03-22 12:56:40	27.159.68.188	192.168.1.8	Https	1506	Ether / IP / TCP 27.159.68.188:https > 192.168.1.8:9474 A / Raw
462	2020-03-22 12:56:40	27.159.68.188	192.168.1.8	Https	1506	Ether / IP / TCP 27.159.68.188:https > 192.168.1.8:9474 A / Raw
463	2020-03-22 12:56:40	27.159.68.188	192.168.1.8	Https	1506	Ether / IP / TCP 27.159.68.188:https > 192.168.1.8:9474 A / Raw
464	2020-03-22 12:56:40	192.168.1.8	27.159.68.188	Https	54	Ether / IP / TCP 192.168.1.8:9474 > 27.159.68.188:https A
465	2020-03-22 12:56:40	27.159.68.188	192.168.1.8	Https	1506	Ether / IP / TCP 27.159.68.188:https > 192.168.1.8:9474 A / Raw
466	2020-03-22 12:56:40	27.159.68.188	192.168.1.8	Https	1506	Ether / IP / TCP 27.159.68.188:https > 192.168.1.8:9474 A / Raw
467	2020-03-22 12:56:40	192.168.1.8	27.159.68.188	Https	54	Ether / IP / TCP 192.168.1.8:9474 > 27.159.68.188:https A
468	2020-03-22 12:56:40	27.159.68.188	192.168.1.8	Https	1506	Ether / IP / TCP 27.159.68.188:https > 192.168.1.8:9474 A / Raw
469	2020-03-22 12:56:40	27.159.68.188	192.168.1.8	Https	1506	Ether / IP / TCP 27.159.68.188:https > 192.168.1.8:9474 A / Raw
470	2020-03-22 12:56:40	27.159.68.188	192.168.1.8	Https	1506	Ether / IP / TCP 27.159.68.188:https > 192.168.1.8:9474 A / Raw
471	2020-03-22 12:56:40	27.159.68.188	192.168.1.8	Https	1506	Ether / IP / TCP 27.159.68.188:https > 192.168.1.8:9474 A / Raw
472	2020-03-22 12:56:40	27.159.68.188	192.168.1.8	Https	1506	Ether / IP / TCP 27.159.68.188:https > 192.168.1.8:9474 A / Raw
473	2020-03-22 12:56:40	192.168.1.8	27.159.68.188	Https	54	Ether / IP / TCP 192.168.1.8:9474 > 27.159.68.188:https A
474	2020-03-22 12:56:40	27.159.68.188	192.168.1.8	Https	1506	Ether / IP / TCP 27.159.68.188:https > 192.168.1.8:9474 A / Raw
475	2020-03-22 12:56:40	27.159.68.188	192.168.1.8	Https	1506	Ether / IP / TCP 27.159.68.188:https > 192.168.1.8:9474 A / Raw
476	2020-03-22 12:56:40	27.159.68.188	192.168.1.8	Https	1506	Ether / IP / TCP 27.159.68.188:https > 192.168.1.8:9474 A / Raw
477	2020-03-22 12:56:40	27.159.68.188	192.168.1.8	Https	1506	Ether / IP / TCP 27.159.68.188:https > 192.168.1.8:9474 A / Raw
478	2020-03-22 12:56:40	27.159.68.188	192.168.1.8	Https	1506	Ether / IP / TCP 27.159.68.188:https > 192.168.1.8:9474 A / Raw
479	2020-03-22 12:56:40	27.159.68.188	192.168.1.8	Https	286	Ether / IP / TCP 27.159.68.188:https > 192.168.1.8:9474 PA / Raw
480	2020-03-22 12:56:40	192.168.1.8	27.159.68.188	Https	54	Ether / IP / TCP 192.168.1.8:9474 > 27.159.68.188:https A
481	2020-03-22 12:56:40	27.159.68.188	192.168.1.8	Https	1506	Ether / IP / TCP 27.159.68.188:https > 192.168.1.8:9474 A / Raw
482	2020-03-22 12:56:40	192.168.1.8	27.159.68.188	Https	54	Ether / IP / TCP 192.168.1.8:9474 > 27.159.68.188:https A
483	2020-03-22 12:56:40	27.159.68.188	192.168.1.8	Https	1506	Ether / IP / TCP 27.159.68.188:https > 192.168.1.8:9474 A / Raw
484	2020-03-22 12:56:40	27.159.68.188	192.168.1.8	Https	1506	Ether / IP / TCP 27.159.68.188:https > 192.168.1.8:9474 A / Raw
485	2020-03-22 12:56:40	27.159.68.188	192.168.1.8	Https	1506	Ether / IP / TCP 27.159.68.188:https > 192.168.1.8:9474 A / Raw
486	2020-03-22 12:56:40	192.168.1.8	27.159.68.188	Https	54	Ether / IP / TCP 192.168.1.8:9474 > 27.159.68.188:https A
487	2020-03-22 12:56:40	27.159.68.188	192.168.1.8	Https	1506	Ether / IP / TCP 27.159.68.188:https > 192.168.1.8:9474 A / Raw
488	2020-03-22 12:56:40	192.168.1.8	27.159.68.188	Https	54	Ether / IP / TCP 192.168.1.8:9474 > 27.159.68.188:https A
489	2020-03-22 12:56:40	27.159.68.188	192.168.1.8	Https	1506	Ether / IP / TCP 27.159.68.188:https > 192.168.1.8:9474 A / Raw
490	2020-03-22 12:56:40	27.159.68.188	192.168.1.8	Https	1506	Ether / IP / TCP 27.159.68.188:https > 192.168.1.8:9474 A / Raw
491	2020-03-22 12:56:40	192.168.1.8	27.159.68.188	Https	54	Ether / IP / TCP 192.168.1.8:9474 > 27.159.68.188:https A
492	2020-03-22 12:56:40	27.159.68.188	192.168.1.8	Https	1506	Ether / IP / TCP 27.159.68.188:https > 192.168.1.8:9474 A / Raw
493	2020-03-22 12:56:40	27.159.68.188	192.168.1.8	Https	1506	Ether / IP / TCP 27.159.68.188:https > 192.168.1.8:9474 A / Raw
494	2020-03-22 12:56:40	27.159.68.188	192.168.1.8	Https	1506	Ether / IP / TCP 27.159.68.188:https > 192.168.1.8:9474 A / Raw
495	2020-03-22 12:56:40	27.159.68.188	192.168.1.8	Https	1506	Ether / IP / TCP 27.159.68.188:https > 192.168.1.8:9474 A / Raw
496	2020-03-22 12:56:40	27.159.68.188	192.168.1.8	Https	1506	Ether / IP / TCP 27.159.68.188:https > 192.168.1.8:9474 A / Raw
497	2020-03-22 12:56:40	192.168.1.8	27.159.68.188	Https	54	Ether / IP / TCP 192.168.1.8:9474 > 27.159.68.188:https A
498	2020-03-22 12:56:40	27.159.68.188	192.168.1.8	Https	1506	Ether / IP / TCP 27.159.68.188:https > 192.168.1.8:9474 A / Raw
499	2020-03-22 12:56:40	27.159.68.188	192.168.1.8	Https	1506	Ether / IP / TCP 27.159.68.188:https > 192.168.1.8:9474 A / Raw
500	2020-03-22 12:56:40	27.159.68.188	192.168.1.8	Https	1506	Ether / IP / TCP 27.159.68.188:https > 192.168.1.8:9474 A / Raw
501	2020-03-22 12:56:40	27.159.68.188	192.168.1.8	Https	1506	Ether / IP / TCP 27.159.68.188:https > 192.168.1.8:9474 A / Raw
502	2020-03-22 12:56:40	27.159.68.188	192.168.1.8	Https	1506	Ether / IP / TCP 27.159.68.188:https > 192.168.1.8:9474 A / Raw
503	2020-03-22 12:56:40	192.168.1.8	27.159.68.188	Https	54	Ether / IP / TCP 192.168.1.8:9474 > 27.159.68.188:https A
504	2020-03-22 12:56:40	27.159.68.188	192.168.1.8	Https	1506	Ether / IP / TCP 27.159.68.188:https > 192.168.1.8:9474 A / Raw
505	2020-03-22 12:56:40	27.159.68.188	192.168.1.8	Https	1506	Ether / IP / TCP 27.159.68.188:https > 192.168.1.8:9474 A / Raw
506	2020-03-22 12:56:40	27.159.68.188	192.168.1.8	Https	1506	Ether / IP / TCP 27.159.68.188:https > 192.168.1.8:9474 A / Raw
507	2020-03-22 12:56:40	27.159.68.188	192.168.1.8	Https	1506	Ether / IP / TCP 27.159.68.188:https > 192.168.1.8:9474 A / Raw
508	2020-03-22 12:56:40	27.159.68.188	192.168.1.8	Https	1506	Ether / IP / TCP 27.159.68.188:https > 192.168.1.8:9474 A / Raw
509	2020-03-22 12:56:40	192.168.1.8	27.159.68.188	Https	54	Ether / IP / TCP 192.168.1.8:9474 > 27.159.68.188:https A
510	2020-03-22 12:56:40	27.159.68.188	192.168.1.8	Https	1506	Ether / IP / TCP 27.159.68.188:https > 192.168.1.8:9474 A / Raw
511	2020-03-22 12:56:40	27.159.68.188	192.168.1.8	Https	1506	Ether / IP / TCP 27.159.68.188:https > 192.168.1.8:9474 A / Raw
512	2020-03-22 12:56:40	27.159.68.188	192.168.1.8	Https	1506	Ether / IP / TCP 27.159.68.188:https > 192.168.1.8:9474 A / Raw
513	2020-03-22 12:56:40	192.168.1.8	27.159.68.188	Https	54	Ether / IP / TCP 192.168.1.8:9474 > 27.159.68.188:https A
514	2020-03-22 12:56:40	27.159.68.188	192.168.1.8	Https	1506	Ether / IP / TCP 27.159.68.188:https > 192.168.1.8:9474 A / Raw
515	2020-03-22 12:56:40	27.159.68.188	192.168.1.8	Https	1506	Ether / IP / TCP 27.159.68.188:https > 192.168.1.8:9474 A / Raw
516	2020-03-22 12:56:40	27.159.68.188	192.168.1.8	Https	1506	Ether / IP / TCP 27.159.68.188:https > 192.168.1.8:9474 A / Raw
517	2020-03-22 12:56:40	27.159.68.188	192.168.1.8	Https	1506	Ether / IP / TCP 27.159.68.188:https > 192.168.1.8:9474 A / Raw
518	2020-03-22 12:56:40	27.159.68.188	192.168.1.8	Https	1506	Ether / IP / TCP 27.159.68.188:https > 192.168.1.8:9474 A / Raw
519	2020-03-22 12:56:40	27.159.68.188	192.168.1.8	Https	1506	Ether / IP / TCP 27.159.68.188:https > 192.168.1.8:9474 A / Raw
520	2020-03-22 12:56:40	27.159.68.188	192.168.1.8	Https	1506	Ether / IP / TCP 27.159.68.188:https > 192.168.1.8:9474 A / Raw
521	2020-03-22 12:56:40	192.168.1.8	27.159.68.188	Https	54	Ether / IP / TCP 192.168.1.8:9474 > 27.159.68.188:https A
522	2020-03-22 12:56:40	27.159.68.188	192.168.1.8	Https	1506	Ether / IP / TCP 27.159.68.188:https > 192.168.1.8:9474 A / Raw
523	2020-03-22 12:56:40	27.159.68.188	192.168.1.8	Https	1506	Ether / IP / TCP 27.159.68.188:https > 192.168.1.8:9474 A / Raw
524	2020-03-22 12:56:40	27.159.68.188	192.168.1.8	Https	1506	Ether / IP / TCP 27.159.68.188:https > 192.168.1.8:9474 A / Raw
525	2020-03-22 12:56:40	192.168.1.8	27.159.68.188	Https	54	Ether / IP / TCP 192.168.1.8:9474 > 27.159.68.188:https A
526	2020-03-22 12:56:40	27.159.68.188	192.168.1.8	Https	1506	Ether / IP / TCP 27.159.68.188:https > 192.168.1.8:9474 A / Raw
527	2020-03-22 12:56:40	27.159.68.188	192.168.1.8	Https	1506	Ether / IP / TCP 27.159.68.188:https > 192.168.1.8:9474 A / Raw
528	2020-03-22 12:56:40	192.168.1.8	27.159.68.188	Https	54	Ether / IP / TCP 192.168.1.8:9474 > 27.159.68.188:https A
529	2020-03-22 12:56:40	27.159.68.188	192.168.1.8	Https	1506	Ether / IP / TCP 27.159.68.188:https > 192.168.1.8:9474 A / Raw
530	2020-03-22 12:56:40	27.159.68.188	192.168.1.8	Https	1506	Ether / IP / TCP 27.159.68.188:https > 192.168.1.8:9474 A / Raw
531	2020-03-22 12:56:40	27.159.68.188	192.168.1.8	Https	1506	Ether / IP / TCP 27.159.68.188:https > 192.168.1.8:9474 A / Raw
532	2020-03-22 12:56:40	27.159.68.188	192.168.1.8	Https	1506	Ether / IP / TCP 27.159.68.188:https > 192.168.1.8:9474 A / Raw
533	2020-03-22 12:56:40	27.159.68.188	192.168.1.8	Https	1506	Ether / IP / TCP 27.159.68.188:https > 192.168.1.8:9474 A / Raw
534	2020-03-22 12:56:40	192.168.1.8	27.159.68.188	Https	54	Ether / IP / TCP 192.168.1.8:9474 > 27.159.68.188:https A
535	2020-03-22 12:56:40	27.159.68.188	192.168.1.8	Https	1506	Ether / IP / TCP 27.159.68.188:https > 192.168.1.8:9474 A / Raw
536	2020-03-22 12:56:40	27.159.68.188	192.168.1.8	Https	1506	Ether / IP / TCP 27.159.68.188:https > 192.168.1.8:9474 A / Raw
537	2020-03-22 12:56:40	27.159.68.188	192.168.1.8	Https	1506	Ether / IP / TCP 27.159.68.188:https > 192.168.1.8:9474 A / Raw
538	2020-03-22 12:56:40	27.159.68.188	192.168.1.8	Https	1506	Ether / IP / TCP 27.159.68.188:https > 192.168.1.8:9474 A / Raw
539	2020-03-22 12:56:40	27.159.68.188	192.168.1.8	Https	1506	Ether / IP / TCP 27.159.68.188:https > 192.168.1.8:9474 A / Raw
540	2020-03-22 12:56:40	192.168.1.8	27.159.68.188	Https	54	Ether / IP / TCP 192.168.1.8:9474 > 27.159.68.188:https A
541	2020-03-22 12:56:40	27.159.68.188	192.168.1.8	Https	1506	Ether / IP / TCP 27.159.68.188:https > 192.168.1.8:9474 A / Raw
542	2020-03-22 12:56:40	27.159.68.188	192.168.1.8	Https	1506	Ether / IP / TCP 27.159.68.188:https > 192.168.1.8:9474 A / Raw
543	2020-03-22 12:56:40	27.159.68.188	192.168.1.8	Https	1506	Ether / IP / TCP 27.159.68.188:https > 192.168.1.8:9474 A / Raw
544	2020-03-22 12:56:40	27.159.68.188	192.168.1.8	Https	1506	Ether / IP / TCP 27.159.68.188:https > 192.168.1.8:9474 A / Raw
545	2020-03-22 12:56:40	27.159.68.188	192.168.1.8	Https	1506	Ether / IP / TCP 27.159.68.188:https > 192.168.1.8:9474 A / Raw
546	2020-03-22 12:56:40	192.168.1.8	27.159.68.188	Https	54	Ether / IP / TCP 192.168.1.8:9474 > 27.159.68.188:https A
547	2020-03-22 12:56:40	27.159.68.188	192.168.1.8	Https	1506	Ether / IP / TCP 27.159.68.188:https > 192.168.1.8:9474 A / Raw
548	2020-03-22 12:56:40	192.168.1.8	27.159.68.188	Https	54	Ether / IP / TCP 192.168.1.8:9474 > 27.159.68.188:https A
549	2020-03-22 12:56:40	27.159.68.188	192.168.1.8	Https	1506	Ether / IP / TCP 27.159.68.188:https > 192.168.1.8:9474 A / Raw
550	2020-03-22 12:56:40	27.159.68.188	192.168.1.8	Https	1506	Ether / IP / TCP 27.159.68.188:https > 192.168.1.8:9474 A / Raw
551	2020-03-22 12:56:40	27.159.68.188	192.168.1.8	Https	1506	Ether / IP / TCP 27.159.68.188:https > 192.168.1.8:9474 A / Raw
552	2020-03-22 12:56:40	27.159.68.188	192.168.1.8	Https	1506	Ether / IP / TCP 27.159.68.188:https > 192.168.1.8:9474 A / Raw
553	2020-03-22 12:56:40	192.168.1.8	27.159.68.188	Https	54	Ether / IP / TCP 192.168.1.8:9474 > 27.159.68.188:https A
554	2020-03-22 12:56:40	27.159.68.188	192.168.1.8	Https	1506	Ether / IP / TCP 27.159.68.188:https > 192.168.1.8:9474 A / Raw
555	2020-03-22 12:56:40	27.159.68.188	192.168.1.8	Https	1506	Ether / IP / TCP 27.159.68.188:https > 192.168.1.8:9474 A / Raw
556	2020-03-22 12:56:40	27.159.68.188	192.168.1.8	Https	1506	Ether / IP / TCP 27.159.68.188:https > 192.168.1.8:9474 A / Raw
557	2020-03-22 12:56:40	27.159.68.188	192.168.1.8	Https	1506	Ether / IP / TCP 27.159.68.188:https > 192.168.1.8:9474 A / Raw
558	2020-03-22 12:56:40	27.159.68.188	192.168.1.8	Https	1506	Ether / IP / TCP 27.159.68.188:https > 192.168.1.8:9474 A / Raw
559	2020-03-22 12:56:40	192.168.1.8	27.159.68.188	Https	54	Ether / IP / TCP 192.168.1.8:9474 > 27.159.68.188:https A
560	2020-03-22 12:56:40	27.159.68.188	192.168.1.8	Https	1506	Ether / IP / TCP 27.159.68.188:https > 192.168.1.8:9474 A / Raw
561	2020-03-22 12:56:40	27.159.68.188	192.168.1.8	Https	1506	Ether / IP / TCP 27.159.68.188:https > 192.168.1.8:9474 A / Raw
562	2020-03-22 12:56:40	27.159.68.188	192.168.1.8	Https	1506	Ether / IP / TCP 27.159.68.188:https > 192.168.1.8:9474 A / Raw
563	2020-03-22 12:56:40	27.159.68.188	192.168.1.8	Https	1506	Ether / IP / TCP 27.159.68.188:https > 192.168.1.8:9474 A / Raw
564	2020-03-22 12:56:40	27.159.68.188	192.168.1.8	Https	1506	Ether / IP / TCP 27.159.68.188:https > 192.168.1.8:9474 A / Raw
565	2020-03-22 12:56:40	192.168.1.8	27.159.68.188	Https	54	Ether / IP / TCP 192.168.1.8:9474 > 27.159.68.188:https A
566	2020-03-22 12:56:40	27.159.68.188	192.168.1.8	Https	1506	Ether / IP / TCP 27.159.68.188:https > 192.168.1.8:9474 A / Raw
567	2020-03-22 12:56:40	27.159.68.188	192.168.1.8	Https	1506	Ether / IP / TCP 27.159.68.188:https > 192.168.1.8:9474 A / Raw
568	2020-03-22 12:56:40	27.159.68.188	192.168.1.8	Https	1506	Ether / IP / TCP 27.159.68.188:https > 192.168.1.8:9474 A / Raw
569	2020-03-22 12:56:40	27.159.68.188	192.168.1.8	Https	1506	Ether / IP / TCP 27.159.68.188:https > 192.168.1.8:9474 A / Raw
