1	2020-03-17 22:49:14	192.168.1.10	59.111.239.61	Https	66	Ether / IP / TCP 192.168.1.10:11770 > 59.111.239.61:https S
2	2020-03-17 22:49:14	192.168.1.10	59.111.181.35	Http	66	Ether / IP / TCP 192.168.1.10:11771 > 59.111.181.35:http S
3	2020-03-17 22:49:14	59.111.239.61	192.168.1.10	Https	66	Ether / IP / TCP 59.111.239.61:https > 192.168.1.10:11770 SA
4	2020-03-17 22:49:14	192.168.1.10	59.111.239.61	Https	54	Ether / IP / TCP 192.168.1.10:11770 > 59.111.239.61:https A
5	2020-03-17 22:49:14	192.168.1.10	59.111.239.61	Https	231	Ether / IP / TCP 192.168.1.10:11770 > 59.111.239.61:https PA / Raw
6	2020-03-17 22:49:14	59.111.181.35	192.168.1.10	Http	66	Ether / IP / TCP 59.111.181.35:http > 192.168.1.10:11771 SA
7	2020-03-17 22:49:14	192.168.1.10	59.111.181.35	Http	54	Ether / IP / TCP 192.168.1.10:11771 > 59.111.181.35:http A
8	2020-03-17 22:49:14	192.168.1.10	59.111.181.35	Http	1103	Ether / IP / TCP / HTTP / 'POST' '/eapi/pl/count' 'HTTP/1.1'
9	2020-03-17 22:49:14	192.168.1.10	59.111.181.35	Http	1245	Ether / IP / TCP 192.168.1.10:11771 > 59.111.181.35:http PA / HTTP / Raw
10	2020-03-17 22:49:14	59.111.239.61	192.168.1.10	Https	60	Ether / IP / TCP 59.111.239.61:https > 192.168.1.10:11770 A / Padding
11	2020-03-17 22:49:14	59.111.181.35	192.168.1.10	Http	60	Ether / IP / TCP 59.111.181.35:http > 192.168.1.10:11771 A / Padding
12	2020-03-17 22:49:14	59.111.181.35	192.168.1.10	Http	60	Ether / IP / TCP 59.111.181.35:http > 192.168.1.10:11771 A / Padding
13	2020-03-17 22:49:14	59.111.181.35	192.168.1.10	Http	934	Ether / IP / TCP / HTTP / 'HTTP/1.1' '200' 'OK' / Raw
14	2020-03-17 22:49:14	59.111.181.35	192.168.1.10	Http	74	Ether / IP / TCP 59.111.181.35:http > 192.168.1.10:11771 PA / HTTP / Raw
15	2020-03-17 22:49:14	192.168.1.10	59.111.181.35	Http	54	Ether / IP / TCP 192.168.1.10:11771 > 59.111.181.35:http A
16	2020-03-17 22:49:15	59.111.239.61	192.168.1.10	Https	1506	Ether / IP / TCP 59.111.239.61:https > 192.168.1.10:11770 A / Raw
17	2020-03-17 22:49:15	59.111.239.61	192.168.1.10	Https	1506	Ether / IP / TCP 59.111.239.61:https > 192.168.1.10:11770 A / Raw
18	2020-03-17 22:49:15	59.111.239.61	192.168.1.10	Https	202	Ether / IP / TCP 59.111.239.61:https > 192.168.1.10:11770 PA / Raw
19	2020-03-17 22:49:15	192.168.1.10	59.111.239.61	Https	54	Ether / IP / TCP 192.168.1.10:11770 > 59.111.239.61:https A
20	2020-03-17 22:49:15	192.168.1.10	59.111.239.61	Https	147	Ether / IP / TCP 192.168.1.10:11770 > 59.111.239.61:https PA / Raw
21	2020-03-17 22:49:15	192.168.1.10	14.215.177.39	Https	54	Ether / IP / TCP 192.168.1.10:11763 > 14.215.177.39:https RA
22	2020-03-17 22:49:15	59.111.239.61	192.168.1.10	Https	60	Ether / IP / TCP 59.111.239.61:https > 192.168.1.10:11770 A / Padding
23	2020-03-17 22:49:15	59.111.239.61	192.168.1.10	Https	105	Ether / IP / TCP 59.111.239.61:https > 192.168.1.10:11770 PA / Raw
24	2020-03-17 22:49:15	192.168.1.10	59.111.239.61	Https	506	Ether / IP / TCP 192.168.1.10:11770 > 59.111.239.61:https PA / Raw
25	2020-03-17 22:49:15	59.111.239.61	192.168.1.10	Https	1506	Ether / IP / TCP 59.111.239.61:https > 192.168.1.10:11770 A / Raw
26	2020-03-17 22:49:15	59.111.239.61	192.168.1.10	Https	1263	Ether / IP / TCP 59.111.239.61:https > 192.168.1.10:11770 PA / Raw
27	2020-03-17 22:49:15	192.168.1.10	59.111.239.61	Https	54	Ether / IP / TCP 192.168.1.10:11770 > 59.111.239.61:https A
28	2020-03-17 22:49:15	192.168.1.10	59.111.239.61	Https	85	Ether / IP / TCP 192.168.1.10:11770 > 59.111.239.61:https PA / Raw
29	2020-03-17 22:49:15	192.168.1.10	59.111.239.61	Https	54	Ether / IP / TCP 192.168.1.10:11770 > 59.111.239.61:https FA
30	2020-03-17 22:49:15	59.111.239.61	192.168.1.10	Https	85	Ether / IP / TCP 59.111.239.61:https > 192.168.1.10:11770 PA / Raw
31	2020-03-17 22:49:15	59.111.239.61	192.168.1.10	Https	60	Ether / IP / TCP 59.111.239.61:https > 192.168.1.10:11770 RA / Padding
32	2020-03-17 22:49:15	192.168.1.10	59.111.239.61	Https	54	Ether / IP / TCP 192.168.1.10:11770 > 59.111.239.61:https RA
33	2020-03-17 22:49:15	192.168.1.10	14.215.177.39	Https	54	Ether / IP / TCP 192.168.1.10:11765 > 14.215.177.39:https FA
34	2020-03-17 22:49:15	192.168.1.10	239.255.255.250	UDP	216	Ether / IP / UDP 192.168.1.10:54447 > 239.255.255.250:ssdp / Raw
35	2020-03-17 22:49:16	192.168.1.10	14.215.177.39	Https	66	Ether / IP / TCP 192.168.1.10:11772 > 14.215.177.39:https S
36	2020-03-17 22:49:16	14.215.177.39	192.168.1.10	Https	66	Ether / IP / TCP 14.215.177.39:https > 192.168.1.10:11772 SA
37	2020-03-17 22:49:16	192.168.1.10	14.215.177.39	Https	54	Ether / IP / TCP 192.168.1.10:11772 > 14.215.177.39:https A
38	2020-03-17 22:49:16	192.168.1.10	14.215.177.39	Https	54	Ether / IP / TCP 192.168.1.10:11772 > 14.215.177.39:https FA
39	2020-03-17 22:49:16	192.168.1.10	119.147.134.70	Https	54	Ether / IP / TCP 192.168.1.10:11769 > 119.147.134.70:https FA
40	2020-03-17 22:49:16	192.168.1.10	119.147.134.70	Https	54	Ether / IP / TCP 192.168.1.10:11768 > 119.147.134.70:https FA
41	2020-03-17 22:49:16	119.147.134.70	192.168.1.10	Https	60	Ether / IP / TCP 119.147.134.70:https > 192.168.1.10:11768 FA / Padding
42	2020-03-17 22:49:16	192.168.1.10	119.147.134.70	Https	54	Ether / IP / TCP 192.168.1.10:11768 > 119.147.134.70:https A
43	2020-03-17 22:49:16	119.147.134.70	192.168.1.10	Https	60	Ether / IP / TCP 119.147.134.70:https > 192.168.1.10:11769 FA / Padding
44	2020-03-17 22:49:16	192.168.1.10	119.147.134.70	Https	54	Ether / IP / TCP 192.168.1.10:11769 > 119.147.134.70:https A
45	2020-03-17 22:49:16	192.168.1.10	14.215.177.39	Https	54	Ether / IP / TCP 192.168.1.10:11772 > 14.215.177.39:https FA
46	2020-03-17 22:49:16	192.168.1.10	239.255.255.250	UDP	216	Ether / IP / UDP 192.168.1.10:54447 > 239.255.255.250:ssdp / Raw
47	2020-03-17 22:49:17	192.168.1.10	14.215.177.39	Https	54	Ether / IP / TCP 192.168.1.10:11772 > 14.215.177.39:https FA
48	2020-03-17 22:49:17	192.168.1.10	239.255.255.250	UDP	216	Ether / IP / UDP 192.168.1.10:54447 > 239.255.255.250:ssdp / Raw
49	2020-03-17 22:49:18	192.168.1.10	14.215.177.39	Https	54	Ether / IP / TCP 192.168.1.10:11772 > 14.215.177.39:https FA
50	2020-03-17 22:49:18	161.117.236.80	192.168.1.10	TCP	447	Ether / IP / TCP 161.117.236.80:20395 > 192.168.1.10:11209 PA / Raw
51	2020-03-17 22:49:18	192.168.1.10	161.117.236.80	TCP	224	Ether / IP / TCP 192.168.1.10:11209 > 161.117.236.80:20395 PA / Raw
52	2020-03-17 22:49:18	161.117.236.80	192.168.1.10	TCP	60	Ether / IP / TCP 161.117.236.80:20395 > 192.168.1.10:11209 A / Padding
53	2020-03-17 22:49:18	192.168.1.10	130.198.91.107	Https	78	Ether / IP / TCP 192.168.1.10:10273 > 130.198.91.107:https PA / Raw
54	2020-03-17 22:49:18	fe80::f141:b4f2:11de:b126	fe80::1	ICMPv6	86	Ether / IPv6 / ICMPv6ND_NS / ICMPv6 Neighbor Discovery Option - Source Link-Layer Address 00:e0:4c:68:00:2d
55	2020-03-17 22:49:18	fe80::1	fe80::f141:b4f2:11de:b126	ICMPv6	78	Ether / IPv6 / ICMPv6 Neighbor Discovery - Neighbor Advertisement (tgt: fe80::1)
56	2020-03-17 22:49:18	192.168.1.10	239.255.255.250	UDP	216	Ether / IP / UDP 192.168.1.10:54447 > 239.255.255.250:ssdp / Raw
57	2020-03-17 22:49:18	192.168.1.10	223.252.199.69	TCP	189	Ether / IP / TCP 192.168.1.10:11596 > 223.252.199.69:6003 PA / Raw
58	2020-03-17 22:49:19	130.198.91.107	192.168.1.10	Https	78	Ether / IP / TCP 130.198.91.107:https > 192.168.1.10:10273 PA / Raw
59	2020-03-17 22:49:19	192.168.1.10	130.198.91.107	Https	54	Ether / IP / TCP 192.168.1.10:10273 > 130.198.91.107:https A
60	2020-03-17 22:49:19	192.168.1.10	223.252.199.69	TCP	189	Ether / IP / TCP 192.168.1.10:11596 > 223.252.199.69:6003 PA / Raw
61	2020-03-17 22:49:19	192.168.1.10	223.252.199.69	TCP	189	Ether / IP / TCP 192.168.1.10:11596 > 223.252.199.69:6003 PA / Raw
62	2020-03-17 22:49:19	59.111.181.35	192.168.1.10	Http	60	Ether / IP / TCP 59.111.181.35:http > 192.168.1.10:11771 FA / Padding
63	2020-03-17 22:49:19	192.168.1.10	59.111.181.35	Http	54	Ether / IP / TCP 192.168.1.10:11771 > 59.111.181.35:http A
64	2020-03-17 22:49:19	18:d2:76:f3:58:0b	ff:ff:ff:ff:ff:ff	ARP	60	Ether / ARP who has 192.168.1.1 says 192.168.1.3 / Padding
65	2020-03-17 22:49:20	192.168.1.10	223.252.199.69	TCP	189	Ether / IP / TCP 192.168.1.10:11596 > 223.252.199.69:6003 PA / Raw
66	2020-03-17 22:49:20	167.99.75.56	192.168.1.10	Http	60	Ether / IP / TCP 167.99.75.56:http > 192.168.1.10:11707 A / Padding
67	2020-03-17 22:49:20	192.168.1.10	167.99.75.56	Http	54	Ether / IP / TCP 192.168.1.10:11707 > 167.99.75.56:http A
68	2020-03-17 22:49:20	192.168.1.10	14.215.177.39	Https	54	Ether / IP / TCP 192.168.1.10:11772 > 14.215.177.39:https FA
69	2020-03-17 22:49:21	192.168.1.10	223.252.199.69	TCP	189	Ether / IP / TCP 192.168.1.10:11596 > 223.252.199.69:6003 PA / Raw
70	2020-03-17 22:49:21	fe80::f141:b4f2:11de:b126	fe80::1	DNS	102	Ether / IPv6 / UDP / DNS Qry "b'analytics.yinxiang.com.'" 
71	2020-03-17 22:49:21	fe80::1	fe80::f141:b4f2:11de:b126	DNS	175	Ether / IPv6 / UDP / DNS Ans 
72	2020-03-17 22:49:21	192.168.1.10	154.8.190.35	Https	66	Ether / IP / TCP 192.168.1.10:11773 > 154.8.190.35:https S
73	2020-03-17 22:49:21	154.8.190.35	192.168.1.10	Https	66	Ether / IP / TCP 154.8.190.35:https > 192.168.1.10:11773 SA
74	2020-03-17 22:49:21	192.168.1.10	154.8.190.35	Https	54	Ether / IP / TCP 192.168.1.10:11773 > 154.8.190.35:https A
75	2020-03-17 22:49:21	192.168.1.10	154.8.190.35	Https	237	Ether / IP / TCP 192.168.1.10:11773 > 154.8.190.35:https PA / Raw
76	2020-03-17 22:49:22	192.168.1.10	10.10.20.110	UDP	120	Ether / IP / UDP 192.168.1.10:59684 > 10.10.20.110:snmp / SNMP
77	2020-03-17 22:49:22	192.168.1.10	192.30.253.125	Https	55	Ether / IP / TCP 192.168.1.10:11754 > 192.30.253.125:https A / Raw
78	2020-03-17 22:49:22	154.8.190.35	192.168.1.10	Https	60	Ether / IP / TCP 154.8.190.35:https > 192.168.1.10:11773 A / Padding
79	2020-03-17 22:49:22	154.8.190.35	192.168.1.10	Https	1486	Ether / IP / TCP 154.8.190.35:https > 192.168.1.10:11773 A / Raw
80	2020-03-17 22:49:22	154.8.190.35	192.168.1.10	Https	1486	Ether / IP / TCP 154.8.190.35:https > 192.168.1.10:11773 A / Raw
81	2020-03-17 22:49:22	154.8.190.35	192.168.1.10	Https	744	Ether / IP / TCP 154.8.190.35:https > 192.168.1.10:11773 PA / Raw
82	2020-03-17 22:49:22	192.168.1.10	154.8.190.35	Https	54	Ether / IP / TCP 192.168.1.10:11773 > 154.8.190.35:https A
83	2020-03-17 22:49:22	192.168.1.10	154.8.190.35	Https	180	Ether / IP / TCP 192.168.1.10:11773 > 154.8.190.35:https PA / Raw
84	2020-03-17 22:49:22	154.8.190.35	192.168.1.10	Https	328	Ether / IP / TCP 154.8.190.35:https > 192.168.1.10:11773 PA / Raw
85	2020-03-17 22:49:22	192.168.1.10	154.8.190.35	Https	303	Ether / IP / TCP 192.168.1.10:11773 > 154.8.190.35:https PA / Raw
86	2020-03-17 22:49:22	154.8.190.35	192.168.1.10	Https	352	Ether / IP / TCP 154.8.190.35:https > 192.168.1.10:11773 PA / Raw
87	2020-03-17 22:49:22	154.8.190.35	192.168.1.10	Https	88	Ether / IP / TCP 154.8.190.35:https > 192.168.1.10:11773 PA / Raw
88	2020-03-17 22:49:22	192.168.1.10	154.8.190.35	Https	54	Ether / IP / TCP 192.168.1.10:11773 > 154.8.190.35:https A
89	2020-03-17 22:49:22	192.168.1.10	154.8.190.35	Https	54	Ether / IP / TCP 192.168.1.10:11773 > 154.8.190.35:https FA
90	2020-03-17 22:49:22	154.8.190.35	192.168.1.10	Https	60	Ether / IP / TCP 154.8.190.35:https > 192.168.1.10:11773 FA / Padding
91	2020-03-17 22:49:22	192.168.1.10	154.8.190.35	Https	54	Ether / IP / TCP 192.168.1.10:11773 > 154.8.190.35:https A
92	2020-03-17 22:49:22	192.30.253.125	192.168.1.10	Https	66	Ether / IP / TCP 192.30.253.125:https > 192.168.1.10:11754 A
93	2020-03-17 22:49:22	fe80::f141:b4f2:11de:b126	fe80::1	DNS	107	Ether / IPv6 / UDP / DNS Qry "b'googleads.g.doubleclick.net.'" 
94	2020-03-17 22:49:22	fe80::1	fe80::f141:b4f2:11de:b126	DNS	192	Ether / IPv6 / UDP / DNS Ans "b'pagead46.l.doubleclick.net.'" 
95	2020-03-17 22:49:22	192.168.1.10	203.208.39.217	UDP	1392	Ether / IP / UDP 192.168.1.10:62578 > 203.208.39.217:https / Raw
96	2020-03-17 22:49:22	192.168.1.10	203.208.39.217	UDP	1392	Ether / IP / UDP 192.168.1.10:62578 > 203.208.39.217:https / Raw
97	2020-03-17 22:49:22	192.168.1.10	203.208.39.217	UDP	891	Ether / IP / UDP 192.168.1.10:62578 > 203.208.39.217:https / Raw
98	2020-03-17 22:49:22	192.168.1.10	203.208.39.217	UDP	1392	Ether / IP / UDP 192.168.1.10:62578 > 203.208.39.217:https / Raw
99	2020-03-17 22:49:22	192.168.1.10	203.208.39.217	UDP	459	Ether / IP / UDP 192.168.1.10:62578 > 203.208.39.217:https / Raw
100	2020-03-17 22:49:22	203.208.39.217	192.168.1.10	UDP	1392	Ether / IP / UDP 203.208.39.217:https > 192.168.1.10:62578 / Raw
101	2020-03-17 22:49:22	203.208.39.217	192.168.1.10	UDP	1392	Ether / IP / UDP 203.208.39.217:https > 192.168.1.10:62578 / Raw
102	2020-03-17 22:49:22	192.168.1.10	203.208.39.217	UDP	1392	Ether / IP / UDP 192.168.1.10:62578 > 203.208.39.217:https / Raw
103	2020-03-17 22:49:22	192.168.1.10	203.208.39.217	UDP	1392	Ether / IP / UDP 192.168.1.10:62578 > 203.208.39.217:https / Raw
104	2020-03-17 22:49:22	192.168.1.10	203.208.39.217	UDP	1392	Ether / IP / UDP 192.168.1.10:62578 > 203.208.39.217:https / Raw
105	2020-03-17 22:49:22	192.168.1.10	203.208.39.217	UDP	1274	Ether / IP / UDP 192.168.1.10:62578 > 203.208.39.217:https / Raw
106	2020-03-17 22:49:22	203.208.39.217	192.168.1.10	UDP	81	Ether / IP / UDP 203.208.39.217:https > 192.168.1.10:62578 / Raw
107	2020-03-17 22:49:22	203.208.39.217	192.168.1.10	UDP	1392	Ether / IP / UDP 203.208.39.217:https > 192.168.1.10:62578 / Raw
108	2020-03-17 22:49:22	192.168.1.10	203.208.39.217	UDP	70	Ether / IP / UDP 192.168.1.10:62578 > 203.208.39.217:https / Raw
109	2020-03-17 22:49:22	192.168.1.10	203.208.39.217	UDP	1384	Ether / IP / UDP 192.168.1.10:62578 > 203.208.39.217:https / Raw
110	2020-03-17 22:49:22	203.208.39.217	192.168.1.10	UDP	65	Ether / IP / UDP 203.208.39.217:https > 192.168.1.10:62578 / Raw
111	2020-03-17 22:49:22	192.168.1.10	203.208.39.217	UDP	1392	Ether / IP / UDP 192.168.1.10:62578 > 203.208.39.217:https / Raw
112	2020-03-17 22:49:22	192.168.1.10	203.208.39.217	UDP	1258	Ether / IP / UDP 192.168.1.10:62578 > 203.208.39.217:https / Raw
113	2020-03-17 22:49:22	203.208.39.217	192.168.1.10	UDP	65	Ether / IP / UDP 203.208.39.217:https > 192.168.1.10:62578 / Raw
114	2020-03-17 22:49:22	203.208.39.217	192.168.1.10	UDP	947	Ether / IP / UDP 203.208.39.217:https > 192.168.1.10:62578 / Raw
115	2020-03-17 22:49:22	203.208.39.217	192.168.1.10	UDP	84	Ether / IP / UDP 203.208.39.217:https > 192.168.1.10:62578 / Raw
116	2020-03-17 22:49:22	203.208.39.217	192.168.1.10	UDP	60	Ether / IP / UDP 203.208.39.217:https > 192.168.1.10:62578 / Raw / Padding
117	2020-03-17 22:49:22	203.208.39.217	192.168.1.10	UDP	60	Ether / IP / UDP 203.208.39.217:https > 192.168.1.10:62578 / Raw / Padding
118	2020-03-17 22:49:22	192.168.1.10	203.208.39.217	UDP	70	Ether / IP / UDP 192.168.1.10:62578 > 203.208.39.217:https / Raw
119	2020-03-17 22:49:22	192.168.1.10	203.208.39.217	UDP	70	Ether / IP / UDP 192.168.1.10:62578 > 203.208.39.217:https / Raw
120	2020-03-17 22:49:23	192.168.1.10	167.99.75.56	Http	55	Ether / IP / TCP 192.168.1.10:11707 > 167.99.75.56:http A / HTTP / Raw
121	2020-03-17 22:49:23	192.168.1.10	223.252.199.69	TCP	189	Ether / IP / TCP 192.168.1.10:11596 > 223.252.199.69:6003 PA / Raw
122	2020-03-17 22:49:23	167.99.75.56	192.168.1.10	Http	66	Ether / IP / TCP 167.99.75.56:http > 192.168.1.10:11707 A
123	2020-03-17 22:49:23	9c:d2:4b:38:91:c1	00:e0:4c:68:00:2d	ARP	60	Ether / ARP who has 192.168.1.10 says 192.168.1.1 / Padding
124	2020-03-17 22:49:23	00:e0:4c:68:00:2d	9c:d2:4b:38:91:c1	ARP	42	Ether / ARP is at 00:e0:4c:68:00:2d says 192.168.1.10
125	2020-03-17 22:49:24	192.168.1.10	130.198.91.107	Https	78	Ether / IP / TCP 192.168.1.10:10273 > 130.198.91.107:https PA / Raw
126	2020-03-17 22:49:24	fe80::f141:b4f2:11de:b126	fe80::1	DNS	92	Ether / IPv6 / UDP / DNS Qry "b'hm.baidu.com.'" 
127	2020-03-17 22:49:24	fe80::f141:b4f2:11de:b126	fe80::1	DNS	92	Ether / IPv6 / UDP / DNS Qry "b'hm.baidu.com.'" 
128	2020-03-17 22:49:24	fe80::1	fe80::f141:b4f2:11de:b126	DNS	304	Ether / IPv6 / UDP / DNS Ans "b'hm.e.shifen.com.'" 
129	2020-03-17 22:49:24	fe80::1	fe80::f141:b4f2:11de:b126	DNS	175	Ether / IPv6 / UDP / DNS Ans "b'hm.e.shifen.com.'" 
130	2020-03-17 22:49:24	192.168.1.10	106.120.159.126	Https	66	Ether / IP / TCP 192.168.1.10:11774 > 106.120.159.126:https S
131	2020-03-17 22:49:24	192.168.1.10	106.120.159.126	Https	66	Ether / IP / TCP 192.168.1.10:11775 > 106.120.159.126:https S
132	2020-03-17 22:49:24	192.168.1.10	106.120.159.126	Https	66	Ether / IP / TCP 192.168.1.10:11776 > 106.120.159.126:https S
133	2020-03-17 22:49:24	192.168.1.10	106.120.159.126	Https	66	Ether / IP / TCP 192.168.1.10:11777 > 106.120.159.126:https S
134	2020-03-17 22:49:24	192.168.1.10	106.120.159.126	Https	66	Ether / IP / TCP 192.168.1.10:11778 > 106.120.159.126:https S
135	2020-03-17 22:49:24	192.168.1.10	192.30.253.125	Https	84	Ether / IP / TCP 192.168.1.10:11754 > 192.30.253.125:https PA / Raw
136	2020-03-17 22:49:24	192.168.1.10	192.30.253.125	Https	54	Ether / IP / TCP 192.168.1.10:11754 > 192.30.253.125:https FA
137	2020-03-17 22:49:24	106.120.159.126	192.168.1.10	Https	66	Ether / IP / TCP 106.120.159.126:https > 192.168.1.10:11774 SA
138	2020-03-17 22:49:24	192.168.1.10	106.120.159.126	Https	54	Ether / IP / TCP 192.168.1.10:11774 > 106.120.159.126:https A
139	2020-03-17 22:49:24	192.168.1.10	106.120.159.126	Https	571	Ether / IP / TCP 192.168.1.10:11774 > 106.120.159.126:https PA / Raw
140	2020-03-17 22:49:24	106.120.159.126	192.168.1.10	Https	66	Ether / IP / TCP 106.120.159.126:https > 192.168.1.10:11775 SA
141	2020-03-17 22:49:24	192.168.1.10	106.120.159.126	Https	54	Ether / IP / TCP 192.168.1.10:11775 > 106.120.159.126:https A
142	2020-03-17 22:49:24	192.168.1.10	106.120.159.126	Https	571	Ether / IP / TCP 192.168.1.10:11775 > 106.120.159.126:https PA / Raw
143	2020-03-17 22:49:24	106.120.159.126	192.168.1.10	Https	66	Ether / IP / TCP 106.120.159.126:https > 192.168.1.10:11776 SA
144	2020-03-17 22:49:24	192.168.1.10	106.120.159.126	Https	54	Ether / IP / TCP 192.168.1.10:11776 > 106.120.159.126:https A
145	2020-03-17 22:49:24	192.168.1.10	106.120.159.126	Https	571	Ether / IP / TCP 192.168.1.10:11776 > 106.120.159.126:https PA / Raw
146	2020-03-17 22:49:24	106.120.159.126	192.168.1.10	Https	66	Ether / IP / TCP 106.120.159.126:https > 192.168.1.10:11778 SA
147	2020-03-17 22:49:24	192.168.1.10	106.120.159.126	Https	54	Ether / IP / TCP 192.168.1.10:11778 > 106.120.159.126:https A
148	2020-03-17 22:49:24	192.168.1.10	106.120.159.126	Https	571	Ether / IP / TCP 192.168.1.10:11778 > 106.120.159.126:https PA / Raw
149	2020-03-17 22:49:24	106.120.159.126	192.168.1.10	Https	66	Ether / IP / TCP 106.120.159.126:https > 192.168.1.10:11777 SA
150	2020-03-17 22:49:24	192.168.1.10	106.120.159.126	Https	54	Ether / IP / TCP 192.168.1.10:11777 > 106.120.159.126:https A
151	2020-03-17 22:49:24	192.168.1.10	106.120.159.126	Https	571	Ether / IP / TCP 192.168.1.10:11777 > 106.120.159.126:https PA / Raw
152	2020-03-17 22:49:24	192.168.1.10	161.117.236.80	TCP	588	Ether / IP / TCP 192.168.1.10:11209 > 161.117.236.80:20395 PA / Raw
153	2020-03-17 22:49:24	192.168.1.10	161.117.236.80	TCP	54	Ether / IP / TCP 192.168.1.10:11209 > 161.117.236.80:20395 FA
154	2020-03-17 22:49:24	106.120.159.126	192.168.1.10	Https	60	Ether / IP / TCP 106.120.159.126:https > 192.168.1.10:11774 A / Padding
155	2020-03-17 22:49:24	106.120.159.126	192.168.1.10	Https	60	Ether / IP / TCP 106.120.159.126:https > 192.168.1.10:11776 A / Padding
156	2020-03-17 22:49:24	106.120.159.126	192.168.1.10	Https	122	Ether / IP / TCP 106.120.159.126:https > 192.168.1.10:11774 PA / Raw
157	2020-03-17 22:49:24	106.120.159.126	192.168.1.10	Https	1506	Ether / IP / TCP 106.120.159.126:https > 192.168.1.10:11774 A / Raw
158	2020-03-17 22:49:24	106.120.159.126	192.168.1.10	Https	1506	Ether / IP / TCP 106.120.159.126:https > 192.168.1.10:11774 A / Raw
159	2020-03-17 22:49:24	106.120.159.126	192.168.1.10	Https	60	Ether / IP / TCP 106.120.159.126:https > 192.168.1.10:11775 A / Padding
160	2020-03-17 22:49:24	106.120.159.126	192.168.1.10	Https	769	Ether / IP / TCP 106.120.159.126:https > 192.168.1.10:11774 PA / Raw
161	2020-03-17 22:49:24	106.120.159.126	192.168.1.10	Https	122	Ether / IP / TCP 106.120.159.126:https > 192.168.1.10:11776 PA / Raw
162	2020-03-17 22:49:24	192.168.1.10	106.120.159.126	Https	54	Ether / IP / TCP 192.168.1.10:11774 > 106.120.159.126:https A
163	2020-03-17 22:49:24	106.120.159.126	192.168.1.10	Https	1506	Ether / IP / TCP 106.120.159.126:https > 192.168.1.10:11776 A / Raw
164	2020-03-17 22:49:24	106.120.159.126	192.168.1.10	Https	1506	Ether / IP / TCP 106.120.159.126:https > 192.168.1.10:11776 A / Raw
165	2020-03-17 22:49:24	106.120.159.126	192.168.1.10	Https	769	Ether / IP / TCP 106.120.159.126:https > 192.168.1.10:11776 PA / Raw
166	2020-03-17 22:49:24	192.168.1.10	106.120.159.126	Https	54	Ether / IP / TCP 192.168.1.10:11776 > 106.120.159.126:https A
167	2020-03-17 22:49:24	106.120.159.126	192.168.1.10	Https	122	Ether / IP / TCP 106.120.159.126:https > 192.168.1.10:11775 PA / Raw
168	2020-03-17 22:49:24	106.120.159.126	192.168.1.10	Https	392	Ether / IP / TCP 106.120.159.126:https > 192.168.1.10:11774 PA / Raw
169	2020-03-17 22:49:24	106.120.159.126	192.168.1.10	Https	63	Ether / IP / TCP 106.120.159.126:https > 192.168.1.10:11774 PA / Raw
170	2020-03-17 22:49:24	106.120.159.126	192.168.1.10	Https	1506	Ether / IP / TCP 106.120.159.126:https > 192.168.1.10:11775 A / Raw
171	2020-03-17 22:49:24	106.120.159.126	192.168.1.10	Https	1506	Ether / IP / TCP 106.120.159.126:https > 192.168.1.10:11775 A / Raw
172	2020-03-17 22:49:24	106.120.159.126	192.168.1.10	Https	769	Ether / IP / TCP 106.120.159.126:https > 192.168.1.10:11775 PA / Raw
173	2020-03-17 22:49:24	106.120.159.126	192.168.1.10	Https	392	Ether / IP / TCP 106.120.159.126:https > 192.168.1.10:11776 PA / Raw
174	2020-03-17 22:49:24	106.120.159.126	192.168.1.10	Https	63	Ether / IP / TCP 106.120.159.126:https > 192.168.1.10:11776 PA / Raw
175	2020-03-17 22:49:24	106.120.159.126	192.168.1.10	Https	60	Ether / IP / TCP 106.120.159.126:https > 192.168.1.10:11778 A / Padding
176	2020-03-17 22:49:24	192.168.1.10	106.120.159.126	Https	54	Ether / IP / TCP 192.168.1.10:11774 > 106.120.159.126:https A
177	2020-03-17 22:49:24	192.168.1.10	106.120.159.126	Https	54	Ether / IP / TCP 192.168.1.10:11775 > 106.120.159.126:https A
178	2020-03-17 22:49:24	192.168.1.10	106.120.159.126	Https	54	Ether / IP / TCP 192.168.1.10:11776 > 106.120.159.126:https A
179	2020-03-17 22:49:24	106.120.159.126	192.168.1.10	Https	122	Ether / IP / TCP 106.120.159.126:https > 192.168.1.10:11778 PA / Raw
180	2020-03-17 22:49:24	106.120.159.126	192.168.1.10	Https	1506	Ether / IP / TCP 106.120.159.126:https > 192.168.1.10:11778 A / Raw
181	2020-03-17 22:49:24	106.120.159.126	192.168.1.10	Https	1506	Ether / IP / TCP 106.120.159.126:https > 192.168.1.10:11778 A / Raw
182	2020-03-17 22:49:24	106.120.159.126	192.168.1.10	Https	769	Ether / IP / TCP 106.120.159.126:https > 192.168.1.10:11778 PA / Raw
183	2020-03-17 22:49:24	192.168.1.10	106.120.159.126	Https	54	Ether / IP / TCP 192.168.1.10:11778 > 106.120.159.126:https A
184	2020-03-17 22:49:24	192.168.1.10	106.120.159.126	Https	180	Ether / IP / TCP 192.168.1.10:11774 > 106.120.159.126:https PA / Raw
185	2020-03-17 22:49:24	106.120.159.126	192.168.1.10	Https	60	Ether / IP / TCP 106.120.159.126:https > 192.168.1.10:11777 A / Padding
186	2020-03-17 22:49:24	106.120.159.126	192.168.1.10	Https	392	Ether / IP / TCP 106.120.159.126:https > 192.168.1.10:11778 PA / Raw
187	2020-03-17 22:49:24	106.120.159.126	192.168.1.10	Https	63	Ether / IP / TCP 106.120.159.126:https > 192.168.1.10:11778 PA / Raw
188	2020-03-17 22:49:24	106.120.159.126	192.168.1.10	Https	392	Ether / IP / TCP 106.120.159.126:https > 192.168.1.10:11775 PA / Raw
189	2020-03-17 22:49:24	106.120.159.126	192.168.1.10	Https	63	Ether / IP / TCP 106.120.159.126:https > 192.168.1.10:11775 PA / Raw
190	2020-03-17 22:49:24	192.168.1.10	106.120.159.126	Https	180	Ether / IP / TCP 192.168.1.10:11776 > 106.120.159.126:https PA / Raw
191	2020-03-17 22:49:24	192.168.1.10	106.120.159.126	Https	54	Ether / IP / TCP 192.168.1.10:11778 > 106.120.159.126:https A
192	2020-03-17 22:49:24	192.168.1.10	106.120.159.126	Https	54	Ether / IP / TCP 192.168.1.10:11775 > 106.120.159.126:https A
193	2020-03-17 22:49:24	192.168.1.10	106.120.159.126	Https	180	Ether / IP / TCP 192.168.1.10:11778 > 106.120.159.126:https PA / Raw
194	2020-03-17 22:49:24	106.120.159.126	192.168.1.10	Https	122	Ether / IP / TCP 106.120.159.126:https > 192.168.1.10:11777 PA / Raw
195	2020-03-17 22:49:24	106.120.159.126	192.168.1.10	Https	1506	Ether / IP / TCP 106.120.159.126:https > 192.168.1.10:11777 A / Raw
196	2020-03-17 22:49:24	106.120.159.126	192.168.1.10	Https	1506	Ether / IP / TCP 106.120.159.126:https > 192.168.1.10:11777 A / Raw
197	2020-03-17 22:49:24	106.120.159.126	192.168.1.10	Https	769	Ether / IP / TCP 106.120.159.126:https > 192.168.1.10:11777 PA / Raw
198	2020-03-17 22:49:24	192.168.1.10	106.120.159.126	Https	54	Ether / IP / TCP 192.168.1.10:11777 > 106.120.159.126:https A
199	2020-03-17 22:49:24	192.168.1.10	106.120.159.126	Https	180	Ether / IP / TCP 192.168.1.10:11775 > 106.120.159.126:https PA / Raw
200	2020-03-17 22:49:24	106.120.159.126	192.168.1.10	Https	392	Ether / IP / TCP 106.120.159.126:https > 192.168.1.10:11777 PA / Raw
201	2020-03-17 22:49:24	106.120.159.126	192.168.1.10	Https	63	Ether / IP / TCP 106.120.159.126:https > 192.168.1.10:11777 PA / Raw
202	2020-03-17 22:49:24	192.168.1.10	106.120.159.126	Https	54	Ether / IP / TCP 192.168.1.10:11777 > 106.120.159.126:https A
203	2020-03-17 22:49:24	192.168.1.10	106.120.159.126	Https	180	Ether / IP / TCP 192.168.1.10:11777 > 106.120.159.126:https PA / Raw
204	2020-03-17 22:49:24	192.168.1.10	106.120.159.126	Https	1388	Ether / IP / TCP 192.168.1.10:11774 > 106.120.159.126:https PA / Raw
205	2020-03-17 22:49:24	192.168.1.10	106.120.159.126	Https	1210	Ether / IP / TCP 192.168.1.10:11776 > 106.120.159.126:https PA / Raw
206	2020-03-17 22:49:24	192.168.1.10	106.120.159.126	Https	1338	Ether / IP / TCP 192.168.1.10:11778 > 106.120.159.126:https PA / Raw
207	2020-03-17 22:49:24	192.168.1.10	106.120.159.126	Https	1235	Ether / IP / TCP 192.168.1.10:11775 > 106.120.159.126:https PA / Raw
208	2020-03-17 22:49:24	192.168.1.10	106.120.159.126	Https	1218	Ether / IP / TCP 192.168.1.10:11777 > 106.120.159.126:https PA / Raw
209	2020-03-17 22:49:24	106.120.159.126	192.168.1.10	Https	63	Ether / IP / TCP 106.120.159.126:https > 192.168.1.10:11776 PA / Raw
210	2020-03-17 22:49:24	192.168.1.10	106.120.159.126	Https	66	Ether / IP / TCP 192.168.1.10:11776 > 106.120.159.126:https A
211	2020-03-17 22:49:24	106.120.159.126	192.168.1.10	Https	63	Ether / IP / TCP 106.120.159.126:https > 192.168.1.10:11774 PA / Raw
212	2020-03-17 22:49:24	106.120.159.126	192.168.1.10	Https	63	Ether / IP / TCP 106.120.159.126:https > 192.168.1.10:11778 PA / Raw
213	2020-03-17 22:49:24	192.168.1.10	106.120.159.126	Https	66	Ether / IP / TCP 192.168.1.10:11774 > 106.120.159.126:https A
214	2020-03-17 22:49:24	192.168.1.10	106.120.159.126	Https	66	Ether / IP / TCP 192.168.1.10:11778 > 106.120.159.126:https A
215	2020-03-17 22:49:24	106.120.159.126	192.168.1.10	Https	63	Ether / IP / TCP 106.120.159.126:https > 192.168.1.10:11775 PA / Raw
216	2020-03-17 22:49:24	192.168.1.10	106.120.159.126	Https	66	Ether / IP / TCP 192.168.1.10:11775 > 106.120.159.126:https A
217	2020-03-17 22:49:24	130.198.91.107	192.168.1.10	Https	60	Ether / IP / TCP 130.198.91.107:https > 192.168.1.10:10273 A / Padding
218	2020-03-17 22:49:24	106.120.159.126	192.168.1.10	Https	60	Ether / IP / TCP 106.120.159.126:https > 192.168.1.10:11774 A / Padding
219	2020-03-17 22:49:24	106.120.159.126	192.168.1.10	Https	173	Ether / IP / TCP 106.120.159.126:https > 192.168.1.10:11774 PA / Raw
220	2020-03-17 22:49:24	106.120.159.126	192.168.1.10	Https	60	Ether / IP / TCP 106.120.159.126:https > 192.168.1.10:11774 PA / Raw
221	2020-03-17 22:49:24	106.120.159.126	192.168.1.10	Https	99	Ether / IP / TCP 106.120.159.126:https > 192.168.1.10:11774 PA / Raw
222	2020-03-17 22:49:24	192.168.1.10	106.120.159.126	Https	54	Ether / IP / TCP 192.168.1.10:11774 > 106.120.159.126:https A
223	2020-03-17 22:49:24	106.120.159.126	192.168.1.10	Https	60	Ether / IP / TCP 106.120.159.126:https > 192.168.1.10:11776 A / Padding
224	2020-03-17 22:49:24	106.120.159.126	192.168.1.10	Https	60	Ether / IP / TCP 106.120.159.126:https > 192.168.1.10:11778 A / Padding
225	2020-03-17 22:49:24	106.120.159.126	192.168.1.10	Https	173	Ether / IP / TCP 106.120.159.126:https > 192.168.1.10:11776 PA / Raw
226	2020-03-17 22:49:24	106.120.159.126	192.168.1.10	Https	60	Ether / IP / TCP 106.120.159.126:https > 192.168.1.10:11776 PA / Raw
227	2020-03-17 22:49:24	106.120.159.126	192.168.1.10	Https	99	Ether / IP / TCP 106.120.159.126:https > 192.168.1.10:11776 PA / Raw
228	2020-03-17 22:49:24	192.168.1.10	106.120.159.126	Https	54	Ether / IP / TCP 192.168.1.10:11776 > 106.120.159.126:https A
229	2020-03-17 22:49:24	106.120.159.126	192.168.1.10	Https	173	Ether / IP / TCP 106.120.159.126:https > 192.168.1.10:11778 PA / Raw
230	2020-03-17 22:49:24	106.120.159.126	192.168.1.10	Https	105	Ether / IP / TCP 106.120.159.126:https > 192.168.1.10:11778 PA / Raw
231	2020-03-17 22:49:24	192.168.1.10	106.120.159.126	Https	54	Ether / IP / TCP 192.168.1.10:11778 > 106.120.159.126:https A
232	2020-03-17 22:49:24	106.120.159.126	192.168.1.10	Https	60	Ether / IP / TCP 106.120.159.126:https > 192.168.1.10:11774 A / Padding
233	2020-03-17 22:49:24	106.120.159.126	192.168.1.10	Https	60	Ether / IP / TCP 106.120.159.126:https > 192.168.1.10:11776 A / Padding
234	2020-03-17 22:49:24	106.120.159.126	192.168.1.10	Https	60	Ether / IP / TCP 106.120.159.126:https > 192.168.1.10:11775 A / Padding
235	2020-03-17 22:49:24	106.120.159.126	192.168.1.10	Https	173	Ether / IP / TCP 106.120.159.126:https > 192.168.1.10:11775 PA / Raw
236	2020-03-17 22:49:24	106.120.159.126	192.168.1.10	Https	60	Ether / IP / TCP 106.120.159.126:https > 192.168.1.10:11775 PA / Raw
237	2020-03-17 22:49:24	106.120.159.126	192.168.1.10	Https	99	Ether / IP / TCP 106.120.159.126:https > 192.168.1.10:11775 PA / Raw
238	2020-03-17 22:49:24	192.168.1.10	106.120.159.126	Https	54	Ether / IP / TCP 192.168.1.10:11775 > 106.120.159.126:https A
239	2020-03-17 22:49:24	106.120.159.126	192.168.1.10	Https	60	Ether / IP / TCP 106.120.159.126:https > 192.168.1.10:11778 A / Padding
240	2020-03-17 22:49:24	106.120.159.126	192.168.1.10	Https	60	Ether / IP / TCP 106.120.159.126:https > 192.168.1.10:11777 A / Padding
241	2020-03-17 22:49:24	106.120.159.126	192.168.1.10	Https	173	Ether / IP / TCP 106.120.159.126:https > 192.168.1.10:11777 PA / Raw
242	2020-03-17 22:49:24	106.120.159.126	192.168.1.10	Https	60	Ether / IP / TCP 106.120.159.126:https > 192.168.1.10:11777 PA / Raw
243	2020-03-17 22:49:24	106.120.159.126	192.168.1.10	Https	99	Ether / IP / TCP 106.120.159.126:https > 192.168.1.10:11777 PA / Raw
244	2020-03-17 22:49:24	192.168.1.10	106.120.159.126	Https	54	Ether / IP / TCP 192.168.1.10:11777 > 106.120.159.126:https A
245	2020-03-17 22:49:24	106.120.159.126	192.168.1.10	Https	60	Ether / IP / TCP 106.120.159.126:https > 192.168.1.10:11777 A / Padding
246	2020-03-17 22:49:24	106.120.159.126	192.168.1.10	Https	60	Ether / IP / TCP 106.120.159.126:https > 192.168.1.10:11775 A / Padding
247	2020-03-17 22:49:24	106.120.159.126	192.168.1.10	Https	382	Ether / IP / TCP 106.120.159.126:https > 192.168.1.10:11776 PA / Raw
248	2020-03-17 22:49:24	192.168.1.10	106.120.159.126	Https	54	Ether / IP / TCP 192.168.1.10:11776 > 106.120.159.126:https A
249	2020-03-17 22:49:24	106.120.159.126	192.168.1.10	Https	382	Ether / IP / TCP 106.120.159.126:https > 192.168.1.10:11778 PA / Raw
250	2020-03-17 22:49:24	161.117.236.80	192.168.1.10	TCP	60	Ether / IP / TCP 161.117.236.80:20395 > 192.168.1.10:11209 A / Padding
251	2020-03-17 22:49:24	106.120.159.126	192.168.1.10	Https	382	Ether / IP / TCP 106.120.159.126:https > 192.168.1.10:11774 PA / Raw
252	2020-03-17 22:49:24	192.168.1.10	106.120.159.126	Https	54	Ether / IP / TCP 192.168.1.10:11774 > 106.120.159.126:https A
253	2020-03-17 22:49:24	106.120.159.126	192.168.1.10	Https	382	Ether / IP / TCP 106.120.159.126:https > 192.168.1.10:11777 PA / Raw
254	2020-03-17 22:49:24	192.168.1.10	106.120.159.126	Https	54	Ether / IP / TCP 192.168.1.10:11777 > 106.120.159.126:https A
255	2020-03-17 22:49:24	106.120.159.126	192.168.1.10	Https	382	Ether / IP / TCP 106.120.159.126:https > 192.168.1.10:11775 PA / Raw
256	2020-03-17 22:49:24	fe80::f141:b4f2:11de:b126	fe80::1	DNS	95	Ether / IPv6 / UDP / DNS Qry "b'csi.gstatic.com.'" 
257	2020-03-17 22:49:24	192.168.1.10	106.120.159.126	Https	54	Ether / IP / TCP 192.168.1.10:11775 > 106.120.159.126:https A
258	2020-03-17 22:49:24	fe80::1	fe80::f141:b4f2:11de:b126	DNS	178	Ether / IPv6 / UDP / DNS Ans "b'csi-china.l.google.com.'" 
259	2020-03-17 22:49:24	192.168.1.10	203.208.40.95	UDP	1392	Ether / IP / UDP 192.168.1.10:49665 > 203.208.40.95:https / Raw
260	2020-03-17 22:49:24	192.168.1.10	106.120.159.126	Https	54	Ether / IP / TCP 192.168.1.10:11778 > 106.120.159.126:https A
261	2020-03-17 22:49:24	161.117.236.80	192.168.1.10	TCP	60	Ether / IP / TCP 161.117.236.80:20395 > 192.168.1.10:11209 A / Padding
262	2020-03-17 22:49:24	161.117.236.80	192.168.1.10	TCP	60	Ether / IP / TCP 161.117.236.80:20395 > 192.168.1.10:11209 FA / Padding
263	2020-03-17 22:49:24	192.168.1.10	161.117.236.80	TCP	54	Ether / IP / TCP 192.168.1.10:11209 > 161.117.236.80:20395 A
264	2020-03-17 22:49:24	203.208.40.95	192.168.1.10	UDP	1392	Ether / IP / UDP 203.208.40.95:https > 192.168.1.10:49665 / Raw
265	2020-03-17 22:49:24	203.208.40.95	192.168.1.10	UDP	1392	Ether / IP / UDP 203.208.40.95:https > 192.168.1.10:49665 / Raw
266	2020-03-17 22:49:24	192.168.1.10	203.208.40.95	UDP	1392	Ether / IP / UDP 192.168.1.10:49665 > 203.208.40.95:https / Raw
267	2020-03-17 22:49:24	203.208.40.95	192.168.1.10	UDP	1392	Ether / IP / UDP 203.208.40.95:https > 192.168.1.10:49665 / Raw
268	2020-03-17 22:49:24	192.168.1.10	203.208.40.95	UDP	70	Ether / IP / UDP 192.168.1.10:49665 > 203.208.40.95:https / Raw
269	2020-03-17 22:49:24	192.168.1.10	203.208.40.95	UDP	1392	Ether / IP / UDP 192.168.1.10:49665 > 203.208.40.95:https / Raw
270	2020-03-17 22:49:24	192.168.1.10	203.208.40.95	UDP	462	Ether / IP / UDP 192.168.1.10:49665 > 203.208.40.95:https / Raw
271	2020-03-17 22:49:24	192.168.1.10	203.208.40.95	UDP	66	Ether / IP / UDP 192.168.1.10:49665 > 203.208.40.95:https / Raw
272	2020-03-17 22:49:24	192.30.253.125	192.168.1.10	Https	80	Ether / IP / TCP 192.30.253.125:https > 192.168.1.10:11754 PA / Raw
273	2020-03-17 22:49:24	192.30.253.125	192.168.1.10	Https	78	Ether / IP / TCP 192.30.253.125:https > 192.168.1.10:11754 PA / Raw
274	2020-03-17 22:49:24	192.30.253.125	192.168.1.10	Https	60	Ether / IP / TCP 192.30.253.125:https > 192.168.1.10:11754 FA / Padding
275	2020-03-17 22:49:24	192.168.1.10	192.30.253.125	Https	54	Ether / IP / TCP 192.168.1.10:11754 > 192.30.253.125:https RA
276	2020-03-17 22:49:24	203.208.40.95	192.168.1.10	UDP	62	Ether / IP / UDP 203.208.40.95:https > 192.168.1.10:49665 / Raw
277	2020-03-17 22:49:24	203.208.40.95	192.168.1.10	UDP	367	Ether / IP / UDP 203.208.40.95:https > 192.168.1.10:49665 / Raw
278	2020-03-17 22:49:24	203.208.40.95	192.168.1.10	UDP	60	Ether / IP / UDP 203.208.40.95:https > 192.168.1.10:49665 / Raw / Padding
279	2020-03-17 22:49:24	192.168.1.10	203.208.40.95	UDP	70	Ether / IP / UDP 192.168.1.10:49665 > 203.208.40.95:https / Raw
280	2020-03-17 22:49:24	192.168.1.10	203.208.40.95	UDP	1392	Ether / IP / UDP 192.168.1.10:49665 > 203.208.40.95:https / Raw
281	2020-03-17 22:49:24	192.168.1.10	203.208.40.95	UDP	384	Ether / IP / UDP 192.168.1.10:49665 > 203.208.40.95:https / Raw
282	2020-03-17 22:49:24	192.168.1.10	203.208.40.95	UDP	66	Ether / IP / UDP 192.168.1.10:49665 > 203.208.40.95:https / Raw
283	2020-03-17 22:49:24	192.168.1.10	59.111.181.35	Http	54	Ether / IP / TCP 192.168.1.10:11771 > 59.111.181.35:http FA
284	2020-03-17 22:49:24	192.168.1.10	203.208.39.217	UDP	1392	Ether / IP / UDP 192.168.1.10:62578 > 203.208.39.217:https / Raw
285	2020-03-17 22:49:24	192.168.1.10	203.208.39.217	UDP	828	Ether / IP / UDP 192.168.1.10:62578 > 203.208.39.217:https / Raw
286	2020-03-17 22:49:24	192.168.1.10	203.208.40.95	UDP	316	Ether / IP / UDP 192.168.1.10:49665 > 203.208.40.95:https / Raw
287	2020-03-17 22:49:24	192.168.1.10	203.208.39.217	UDP	1331	Ether / IP / UDP 192.168.1.10:62578 > 203.208.39.217:https / Raw
288	2020-03-17 22:49:24	192.168.1.10	203.208.40.95	UDP	230	Ether / IP / UDP 192.168.1.10:49665 > 203.208.40.95:https / Raw
289	2020-03-17 22:49:24	192.168.1.10	203.208.39.217	UDP	1392	Ether / IP / UDP 192.168.1.10:62578 > 203.208.39.217:https / Raw
290	2020-03-17 22:49:24	192.168.1.10	203.208.39.217	UDP	799	Ether / IP / UDP 192.168.1.10:62578 > 203.208.39.217:https / Raw
291	2020-03-17 22:49:24	59.111.181.35	192.168.1.10	Http	60	Ether / IP / TCP 59.111.181.35:http > 192.168.1.10:11771 A / Padding
292	2020-03-17 22:49:24	192.168.1.10	203.208.40.95	UDP	230	Ether / IP / UDP 192.168.1.10:49665 > 203.208.40.95:https / Raw
293	2020-03-17 22:49:24	192.168.1.10	203.208.39.217	UDP	1392	Ether / IP / UDP 192.168.1.10:62578 > 203.208.39.217:https / Raw
294	2020-03-17 22:49:24	192.168.1.10	203.208.39.217	UDP	842	Ether / IP / UDP 192.168.1.10:62578 > 203.208.39.217:https / Raw
295	2020-03-17 22:49:24	203.208.40.95	192.168.1.10	UDP	62	Ether / IP / UDP 203.208.40.95:https > 192.168.1.10:49665 / Raw
296	2020-03-17 22:49:24	203.208.40.95	192.168.1.10	UDP	113	Ether / IP / UDP 203.208.40.95:https > 192.168.1.10:49665 / Raw
297	2020-03-17 22:49:24	192.168.1.10	203.208.39.217	UDP	81	Ether / IP / UDP 192.168.1.10:62578 > 203.208.39.217:https / Raw
298	2020-03-17 22:49:24	192.168.1.10	203.208.40.95	UDP	87	Ether / IP / UDP 192.168.1.10:49665 > 203.208.40.95:https / Raw
299	2020-03-17 22:49:24	192.168.1.10	203.208.39.217	UDP	81	Ether / IP / UDP 192.168.1.10:62578 > 203.208.39.217:https / Raw
300	2020-03-17 22:49:24	192.168.1.10	203.208.39.217	UDP	81	Ether / IP / UDP 192.168.1.10:62578 > 203.208.39.217:https / Raw
301	2020-03-17 22:49:24	192.168.1.10	203.208.40.95	UDP	81	Ether / IP / UDP 192.168.1.10:49665 > 203.208.40.95:https / Raw
302	2020-03-17 22:49:24	192.168.1.10	203.208.40.95	UDP	81	Ether / IP / UDP 192.168.1.10:49665 > 203.208.40.95:https / Raw
303	2020-03-17 22:49:24	192.168.1.10	203.208.39.217	UDP	81	Ether / IP / UDP 192.168.1.10:62578 > 203.208.39.217:https / Raw
304	2020-03-17 22:49:24	203.208.40.95	192.168.1.10	UDP	62	Ether / IP / UDP 203.208.40.95:https > 192.168.1.10:49665 / Raw
305	2020-03-17 22:49:24	203.208.40.95	192.168.1.10	UDP	80	Ether / IP / UDP 203.208.40.95:https > 192.168.1.10:49665 / Raw
306	2020-03-17 22:49:24	203.208.40.95	192.168.1.10	UDP	60	Ether / IP / UDP 203.208.40.95:https > 192.168.1.10:49665 / Raw / Padding
307	2020-03-17 22:49:24	192.168.1.10	203.208.40.95	UDP	70	Ether / IP / UDP 192.168.1.10:49665 > 203.208.40.95:https / Raw
308	2020-03-17 22:49:24	203.208.40.95	192.168.1.10	UDP	86	Ether / IP / UDP 203.208.40.95:https > 192.168.1.10:49665 / Raw
309	2020-03-17 22:49:24	203.208.40.95	192.168.1.10	UDP	60	Ether / IP / UDP 203.208.40.95:https > 192.168.1.10:49665 / Raw / Padding
310	2020-03-17 22:49:24	192.168.1.10	203.208.40.95	UDP	70	Ether / IP / UDP 192.168.1.10:49665 > 203.208.40.95:https / Raw
311	2020-03-17 22:49:24	203.208.40.95	192.168.1.10	UDP	84	Ether / IP / UDP 203.208.40.95:https > 192.168.1.10:49665 / Raw
312	2020-03-17 22:49:24	203.208.39.217	192.168.1.10	UDP	62	Ether / IP / UDP 203.208.39.217:https > 192.168.1.10:62578 / Raw
313	2020-03-17 22:49:24	203.208.39.217	192.168.1.10	UDP	258	Ether / IP / UDP 203.208.39.217:https > 192.168.1.10:62578 / Raw
314	2020-03-17 22:49:24	203.208.39.217	192.168.1.10	UDP	60	Ether / IP / UDP 203.208.39.217:https > 192.168.1.10:62578 / Raw
315	2020-03-17 22:49:24	192.168.1.10	203.208.39.217	UDP	70	Ether / IP / UDP 192.168.1.10:62578 > 203.208.39.217:https / Raw
316	2020-03-17 22:49:24	203.208.39.217	192.168.1.10	UDP	62	Ether / IP / UDP 203.208.39.217:https > 192.168.1.10:62578 / Raw
