1	2020-03-17 22:25:10	192.168.1.10	161.117.236.80	TCP	66	Ether / IP / TCP 192.168.1.10:10297 > 161.117.236.80:20395 S
2	2020-03-17 22:25:10	161.117.236.80	192.168.1.10	TCP	66	Ether / IP / TCP 161.117.236.80:20395 > 192.168.1.10:10297 SA
3	2020-03-17 22:25:10	192.168.1.10	161.117.236.80	TCP	54	Ether / IP / TCP 192.168.1.10:10297 > 161.117.236.80:20395 A
4	2020-03-17 22:25:10	192.168.1.10	161.117.236.80	TCP	264	Ether / IP / TCP 192.168.1.10:10297 > 161.117.236.80:20395 PA / Raw
5	2020-03-17 22:25:10	192.168.1.10	161.117.236.80	TCP	686	Ether / IP / TCP 192.168.1.10:10297 > 161.117.236.80:20395 PA / Raw
6	2020-03-17 22:25:10	161.117.236.80	192.168.1.10	TCP	60	Ether / IP / TCP 161.117.236.80:20395 > 192.168.1.10:10297 A / Padding
7	2020-03-17 22:25:10	161.117.236.80	192.168.1.10	TCP	60	Ether / IP / TCP 161.117.236.80:20395 > 192.168.1.10:10297 A / Padding
8	2020-03-17 22:25:10	161.117.236.80	192.168.1.10	TCP	300	Ether / IP / TCP 161.117.236.80:20395 > 192.168.1.10:10297 PA / Raw
9	2020-03-17 22:25:10	161.117.236.80	192.168.1.10	TCP	950	Ether / IP / TCP 161.117.236.80:20395 > 192.168.1.10:10297 PA / Raw
10	2020-03-17 22:25:10	192.168.1.10	161.117.236.80	TCP	54	Ether / IP / TCP 192.168.1.10:10297 > 161.117.236.80:20395 A
11	2020-03-17 22:25:10	192.168.1.10	161.117.236.80	TCP	597	Ether / IP / TCP 192.168.1.10:10297 > 161.117.236.80:20395 PA / Raw
12	2020-03-17 22:25:10	192.168.1.10	161.117.236.80	TCP	855	Ether / IP / TCP 192.168.1.10:10297 > 161.117.236.80:20395 PA / Raw
13	2020-03-17 22:25:10	161.117.236.80	192.168.1.10	TCP	60	Ether / IP / TCP 161.117.236.80:20395 > 192.168.1.10:10297 A / Padding
14	2020-03-17 22:25:10	161.117.236.80	192.168.1.10	TCP	1416	Ether / IP / TCP 161.117.236.80:20395 > 192.168.1.10:10297 PA / Raw
15	2020-03-17 22:25:10	192.168.1.10	161.117.236.80	TCP	825	Ether / IP / TCP 192.168.1.10:10297 > 161.117.236.80:20395 PA / Raw
16	2020-03-17 22:25:10	161.117.236.80	192.168.1.10	TCP	60	Ether / IP / TCP 161.117.236.80:20395 > 192.168.1.10:10297 A / Padding
17	2020-03-17 22:25:10	192.168.1.10	14.215.177.39	Https	54	Ether / IP / TCP 192.168.1.10:10294 > 14.215.177.39:https FA
18	2020-03-17 22:25:10	192.168.1.10	161.117.236.80	TCP	66	Ether / IP / TCP 192.168.1.10:10302 > 161.117.236.80:20395 S
19	2020-03-17 22:25:10	192.168.1.10	161.117.236.80	TCP	66	Ether / IP / TCP 192.168.1.10:10303 > 161.117.236.80:20395 S
20	2020-03-17 22:25:10	140.82.113.25	192.168.1.10	Https	78	Ether / IP / TCP 140.82.113.25:https > 192.168.1.10:9647 PA / Raw
21	2020-03-17 22:25:10	192.168.1.10	140.82.113.25	Https	82	Ether / IP / TCP 192.168.1.10:9647 > 140.82.113.25:https PA / Raw
22	2020-03-17 22:25:10	161.117.236.80	192.168.1.10	TCP	66	Ether / IP / TCP 161.117.236.80:20395 > 192.168.1.10:10302 SA
23	2020-03-17 22:25:10	192.168.1.10	161.117.236.80	TCP	54	Ether / IP / TCP 192.168.1.10:10302 > 161.117.236.80:20395 A
24	2020-03-17 22:25:10	161.117.236.80	192.168.1.10	TCP	66	Ether / IP / TCP 161.117.236.80:20395 > 192.168.1.10:10303 SA
25	2020-03-17 22:25:10	192.168.1.10	161.117.236.80	TCP	54	Ether / IP / TCP 192.168.1.10:10303 > 161.117.236.80:20395 A
26	2020-03-17 22:25:10	192.168.1.10	161.117.236.80	TCP	696	Ether / IP / TCP 192.168.1.10:10302 > 161.117.236.80:20395 PA / Raw
27	2020-03-17 22:25:10	192.168.1.10	161.117.236.80	TCP	585	Ether / IP / TCP 192.168.1.10:10302 > 161.117.236.80:20395 PA / Raw
28	2020-03-17 22:25:10	192.168.1.10	161.117.236.80	TCP	1077	Ether / IP / TCP 192.168.1.10:10303 > 161.117.236.80:20395 PA / Raw
29	2020-03-17 22:25:10	192.168.1.10	161.117.236.80	TCP	952	Ether / IP / TCP 192.168.1.10:10303 > 161.117.236.80:20395 PA / Raw
30	2020-03-17 22:25:10	161.117.236.80	192.168.1.10	TCP	60	Ether / IP / TCP 161.117.236.80:20395 > 192.168.1.10:10302 A / Padding
31	2020-03-17 22:25:10	161.117.236.80	192.168.1.10	TCP	60	Ether / IP / TCP 161.117.236.80:20395 > 192.168.1.10:10302 A / Padding
32	2020-03-17 22:25:10	161.117.236.80	192.168.1.10	TCP	60	Ether / IP / TCP 161.117.236.80:20395 > 192.168.1.10:10303 A / Padding
33	2020-03-17 22:25:10	161.117.236.80	192.168.1.10	TCP	60	Ether / IP / TCP 161.117.236.80:20395 > 192.168.1.10:10303 A / Padding
34	2020-03-17 22:25:11	140.82.113.25	192.168.1.10	Https	60	Ether / IP / TCP 140.82.113.25:https > 192.168.1.10:9647 A / Padding
35	2020-03-17 22:25:11	161.117.236.80	192.168.1.10	TCP	108	Ether / IP / TCP 161.117.236.80:20395 > 192.168.1.10:10303 PA / Raw
36	2020-03-17 22:25:11	192.168.1.10	161.117.236.80	TCP	54	Ether / IP / TCP 192.168.1.10:10303 > 161.117.236.80:20395 A
37	2020-03-17 22:25:11	161.117.236.80	192.168.1.10	TCP	439	Ether / IP / TCP 161.117.236.80:20395 > 192.168.1.10:10302 PA / Raw
38	2020-03-17 22:25:11	192.168.1.10	161.117.236.80	TCP	54	Ether / IP / TCP 192.168.1.10:10302 > 161.117.236.80:20395 A
39	2020-03-17 22:25:11	161.117.236.80	192.168.1.10	TCP	1506	Ether / IP / TCP 161.117.236.80:20395 > 192.168.1.10:10303 A / Raw
40	2020-03-17 22:25:11	161.117.236.80	192.168.1.10	TCP	1504	Ether / IP / TCP 161.117.236.80:20395 > 192.168.1.10:10303 PA / Raw
41	2020-03-17 22:25:11	192.168.1.10	161.117.236.80	TCP	54	Ether / IP / TCP 192.168.1.10:10303 > 161.117.236.80:20395 A
42	2020-03-17 22:25:11	161.117.236.80	192.168.1.10	TCP	1298	Ether / IP / TCP 161.117.236.80:20395 > 192.168.1.10:10303 PA / Raw
43	2020-03-17 22:25:11	192.168.1.10	161.117.236.80	TCP	216	Ether / IP / TCP 192.168.1.10:10303 > 161.117.236.80:20395 PA / Raw
44	2020-03-17 22:25:11	192.168.1.10	161.117.236.80	TCP	1463	Ether / IP / TCP 192.168.1.10:10303 > 161.117.236.80:20395 PA / Raw
45	2020-03-17 22:25:11	161.117.236.80	192.168.1.10	TCP	1506	Ether / IP / TCP 161.117.236.80:20395 > 192.168.1.10:10302 A / Raw
46	2020-03-17 22:25:11	161.117.236.80	192.168.1.10	TCP	1503	Ether / IP / TCP 161.117.236.80:20395 > 192.168.1.10:10302 PA / Raw
47	2020-03-17 22:25:11	192.168.1.10	161.117.236.80	TCP	54	Ether / IP / TCP 192.168.1.10:10302 > 161.117.236.80:20395 A
48	2020-03-17 22:25:11	161.117.236.80	192.168.1.10	TCP	1336	Ether / IP / TCP 161.117.236.80:20395 > 192.168.1.10:10302 PA / Raw
49	2020-03-17 22:25:11	192.168.1.10	161.117.236.80	TCP	807	Ether / IP / TCP 192.168.1.10:10302 > 161.117.236.80:20395 PA / Raw
50	2020-03-17 22:25:11	192.168.1.10	161.117.236.80	TCP	1429	Ether / IP / TCP 192.168.1.10:10302 > 161.117.236.80:20395 PA / Raw
51	2020-03-17 22:25:11	161.117.236.80	192.168.1.10	TCP	60	Ether / IP / TCP 161.117.236.80:20395 > 192.168.1.10:10303 A / Padding
52	2020-03-17 22:25:11	161.117.236.80	192.168.1.10	TCP	60	Ether / IP / TCP 161.117.236.80:20395 > 192.168.1.10:10303 A / Padding
53	2020-03-17 22:25:11	161.117.236.80	192.168.1.10	TCP	60	Ether / IP / TCP 161.117.236.80:20395 > 192.168.1.10:10302 A / Padding
54	2020-03-17 22:25:11	161.117.236.80	192.168.1.10	TCP	60	Ether / IP / TCP 161.117.236.80:20395 > 192.168.1.10:10302 A / Padding
55	2020-03-17 22:25:11	161.117.236.80	192.168.1.10	TCP	722	Ether / IP / TCP 161.117.236.80:20395 > 192.168.1.10:10303 PA / Raw
56	2020-03-17 22:25:11	139.99.69.89	192.168.1.10	Http	60	Ether / IP / TCP 139.99.69.89:http > 192.168.1.10:12360 A / Padding
57	2020-03-17 22:25:11	192.168.1.10	139.99.69.89	Http	54	Ether / IP / TCP 192.168.1.10:12360 > 139.99.69.89:http A
58	2020-03-17 22:25:11	161.117.236.80	192.168.1.10	TCP	579	Ether / IP / TCP 161.117.236.80:20395 > 192.168.1.10:10302 PA / Raw
59	2020-03-17 22:25:11	192.168.1.10	161.117.236.80	TCP	54	Ether / IP / TCP 192.168.1.10:10303 > 161.117.236.80:20395 A
60	2020-03-17 22:25:11	161.117.236.80	192.168.1.10	TCP	1252	Ether / IP / TCP 161.117.236.80:20395 > 192.168.1.10:10303 PA / Raw
61	2020-03-17 22:25:11	192.168.1.10	161.117.236.80	TCP	54	Ether / IP / TCP 192.168.1.10:10302 > 161.117.236.80:20395 A
62	2020-03-17 22:25:11	192.168.1.10	161.117.236.80	TCP	54	Ether / IP / TCP 192.168.1.10:10303 > 161.117.236.80:20395 A
63	2020-03-17 22:25:11	161.117.236.80	192.168.1.10	TCP	709	Ether / IP / TCP 161.117.236.80:20395 > 192.168.1.10:10302 PA / Raw
64	2020-03-17 22:25:11	192.168.1.10	161.117.236.80	TCP	54	Ether / IP / TCP 192.168.1.10:10302 > 161.117.236.80:20395 A
65	2020-03-17 22:25:13	161.117.236.80	192.168.1.10	TCP	707	Ether / IP / TCP 161.117.236.80:20395 > 192.168.1.10:10297 PA / Raw
66	2020-03-17 22:25:13	192.168.1.10	161.117.236.80	TCP	54	Ether / IP / TCP 192.168.1.10:10297 > 161.117.236.80:20395 A
67	2020-03-17 22:25:15	192.168.1.10	14.215.177.39	Https	54	Ether / IP / TCP 192.168.1.10:10292 > 14.215.177.39:https RA
