1	2020-03-18 01:20:04	192.168.1.10	47.244.15.210	TCP	66	Ether / IP / TCP 192.168.1.10:6153 > 47.244.15.210:20395 S
2	2020-03-18 01:20:04	192.168.1.10	47.244.15.210	TCP	66	Ether / IP / TCP 192.168.1.10:6149 > 47.244.15.210:20395 S
3	2020-03-18 01:20:05	192.168.1.10	14.215.177.39	Https	54	Ether / IP / TCP 192.168.1.10:6138 > 14.215.177.39:https RA
4	2020-03-18 01:20:05	192.168.1.10	14.215.177.39	Https	54	Ether / IP / TCP 192.168.1.10:6144 > 14.215.177.39:https FA
5	2020-03-18 01:20:05	192.168.1.10	92.223.85.103	Http	55	Ether / IP / TCP 192.168.1.10:14585 > 92.223.85.103:http A / HTTP / Raw
6	2020-03-18 01:20:06	192.168.1.10	14.215.177.39	Https	66	Ether / IP / TCP 192.168.1.10:6154 > 14.215.177.39:https S
7	2020-03-18 01:20:06	92.223.85.103	192.168.1.10	Http	66	Ether / IP / TCP 92.223.85.103:http > 192.168.1.10:14585 A
8	2020-03-18 01:20:06	14.215.177.39	192.168.1.10	Https	66	Ether / IP / TCP 14.215.177.39:https > 192.168.1.10:6154 SA
9	2020-03-18 01:20:06	192.168.1.10	14.215.177.39	Https	54	Ether / IP / TCP 192.168.1.10:6154 > 14.215.177.39:https A
10	2020-03-18 01:20:06	192.168.1.10	14.215.177.39	Https	54	Ether / IP / TCP 192.168.1.10:6154 > 14.215.177.39:https FA
11	2020-03-18 01:20:06	192.168.1.10	14.215.177.39	Https	54	Ether / IP / TCP 192.168.1.10:6154 > 14.215.177.39:https FA
12	2020-03-18 01:20:06	192.168.1.10	47.244.15.210	TCP	66	Ether / IP / TCP 192.168.1.10:6153 > 47.244.15.210:20395 S
13	2020-03-18 01:20:07	192.168.1.10	14.215.177.39	Https	54	Ether / IP / TCP 192.168.1.10:6154 > 14.215.177.39:https FA
14	2020-03-18 01:20:07	192.168.1.10	47.244.15.210	TCP	66	Ether / IP / TCP 192.168.1.10:6148 > 47.244.15.210:20395 S
15	2020-03-18 01:20:07	192.168.1.10	54.223.180.103	Http	54	Ether / IP / TCP 192.168.1.10:6067 > 54.223.180.103:http FA
16	2020-03-18 01:20:08	192.168.1.10	14.215.177.39	Https	54	Ether / IP / TCP 192.168.1.10:6154 > 14.215.177.39:https FA
17	2020-03-18 01:20:08	192.168.1.10	47.244.15.210	TCP	66	Ether / IP / TCP 192.168.1.10:6149 > 47.244.15.210:20395 S
18	2020-03-18 01:20:08	9c:d2:4b:38:91:c1	00:e0:4c:68:00:2d	ARP	60	Ether / ARP who has 192.168.1.10 says 192.168.1.1 / Padding
19	2020-03-18 01:20:08	00:e0:4c:68:00:2d	9c:d2:4b:38:91:c1	ARP	42	Ether / ARP is at 00:e0:4c:68:00:2d says 192.168.1.10
20	2020-03-18 01:20:10	192.168.1.10	130.198.91.107	Https	78	Ether / IP / TCP 192.168.1.10:10273 > 130.198.91.107:https PA / Raw
21	2020-03-18 01:20:10	192.168.1.10	14.215.177.39	Https	54	Ether / IP / TCP 192.168.1.10:6154 > 14.215.177.39:https FA
22	2020-03-18 01:20:10	192.168.1.10	47.244.15.210	TCP	66	Ether / IP / TCP 192.168.1.10:6153 > 47.244.15.210:20395 S
23	2020-03-18 01:20:10	192.168.1.10	47.244.15.210	TCP	66	Ether / IP / TCP 192.168.1.10:6155 > 47.244.15.210:20395 S
24	2020-03-18 01:20:10	130.198.91.107	192.168.1.10	Https	78	Ether / IP / TCP 130.198.91.107:https > 192.168.1.10:10273 PA / Raw
25	2020-03-18 01:20:10	192.168.1.10	130.198.91.107	Https	54	Ether / IP / TCP 192.168.1.10:10273 > 130.198.91.107:https A
26	2020-03-18 01:20:11	130.198.91.107	192.168.1.10	Https	78	Ether / IP / TCP 130.198.91.107:https > 192.168.1.10:10273 PA / Raw
27	2020-03-18 01:20:11	192.168.1.10	130.198.91.107	Https	66	Ether / IP / TCP 192.168.1.10:10273 > 130.198.91.107:https A
28	2020-03-18 01:20:11	223.252.199.69	192.168.1.10	TCP	60	Ether / IP / TCP 223.252.199.69:6003 > 192.168.1.10:13025 PA / Raw / Padding
29	2020-03-18 01:20:11	192.168.1.10	223.252.199.69	TCP	63	Ether / IP / TCP 192.168.1.10:13025 > 223.252.199.69:6003 PA / Raw
30	2020-03-18 01:20:11	223.252.199.69	192.168.1.10	TCP	60	Ether / IP / TCP 223.252.199.69:6003 > 192.168.1.10:13025 A / Padding
31	2020-03-18 01:20:11	192.168.1.10	47.244.15.210	TCP	66	Ether / IP / TCP 192.168.1.10:6155 > 47.244.15.210:20395 S
32	2020-03-18 01:20:12	fe80::f141:b4f2:11de:b126	fe80::1	DNS	102	Ether / IPv6 / UDP / DNS Qry "b'analytics.yinxiang.com.'" 
33	2020-03-18 01:20:12	fe80::1	fe80::f141:b4f2:11de:b126	DNS	175	Ether / IPv6 / UDP / DNS Ans 
34	2020-03-18 01:20:12	192.168.1.10	154.8.190.35	Https	66	Ether / IP / TCP 192.168.1.10:6156 > 154.8.190.35:https S
35	2020-03-18 01:20:12	154.8.190.35	192.168.1.10	Https	66	Ether / IP / TCP 154.8.190.35:https > 192.168.1.10:6156 SA
36	2020-03-18 01:20:12	192.168.1.10	154.8.190.35	Https	54	Ether / IP / TCP 192.168.1.10:6156 > 154.8.190.35:https A
37	2020-03-18 01:20:12	192.168.1.10	154.8.190.35	Https	237	Ether / IP / TCP 192.168.1.10:6156 > 154.8.190.35:https PA / Raw
38	2020-03-18 01:20:12	154.8.190.35	192.168.1.10	Https	60	Ether / IP / TCP 154.8.190.35:https > 192.168.1.10:6156 A / Padding
39	2020-03-18 01:20:12	154.8.190.35	192.168.1.10	Https	1486	Ether / IP / TCP 154.8.190.35:https > 192.168.1.10:6156 A / Raw
40	2020-03-18 01:20:12	154.8.190.35	192.168.1.10	Https	1486	Ether / IP / TCP 154.8.190.35:https > 192.168.1.10:6156 A / Raw
41	2020-03-18 01:20:12	154.8.190.35	192.168.1.10	Https	744	Ether / IP / TCP 154.8.190.35:https > 192.168.1.10:6156 PA / Raw
42	2020-03-18 01:20:12	192.168.1.10	154.8.190.35	Https	54	Ether / IP / TCP 192.168.1.10:6156 > 154.8.190.35:https A
43	2020-03-18 01:20:12	192.168.1.10	154.8.190.35	Https	180	Ether / IP / TCP 192.168.1.10:6156 > 154.8.190.35:https PA / Raw
44	2020-03-18 01:20:12	154.8.190.35	192.168.1.10	Https	328	Ether / IP / TCP 154.8.190.35:https > 192.168.1.10:6156 PA / Raw
45	2020-03-18 01:20:12	192.168.1.10	154.8.190.35	Https	303	Ether / IP / TCP 192.168.1.10:6156 > 154.8.190.35:https PA / Raw
46	2020-03-18 01:20:12	154.8.190.35	192.168.1.10	Https	352	Ether / IP / TCP 154.8.190.35:https > 192.168.1.10:6156 PA / Raw
47	2020-03-18 01:20:12	154.8.190.35	192.168.1.10	Https	88	Ether / IP / TCP 154.8.190.35:https > 192.168.1.10:6156 PA / Raw
48	2020-03-18 01:20:12	192.168.1.10	154.8.190.35	Https	54	Ether / IP / TCP 192.168.1.10:6156 > 154.8.190.35:https A
49	2020-03-18 01:20:12	192.168.1.10	154.8.190.35	Https	54	Ether / IP / TCP 192.168.1.10:6156 > 154.8.190.35:https FA
50	2020-03-18 01:20:12	154.8.190.35	192.168.1.10	Https	60	Ether / IP / TCP 154.8.190.35:https > 192.168.1.10:6156 FA / Padding
51	2020-03-18 01:20:12	192.168.1.10	154.8.190.35	Https	54	Ether / IP / TCP 192.168.1.10:6156 > 154.8.190.35:https A
52	2020-03-18 01:20:13	192.168.1.10	47.244.15.210	TCP	66	Ether / IP / TCP 192.168.1.10:6157 > 47.244.15.210:20395 S
53	2020-03-18 01:20:13	192.168.1.10	47.244.15.210	TCP	66	Ether / IP / TCP 192.168.1.10:6155 > 47.244.15.210:20395 S
54	2020-03-18 01:20:14	192.168.1.10	47.244.15.210	TCP	66	Ether / IP / TCP 192.168.1.10:6157 > 47.244.15.210:20395 S
55	2020-03-18 01:20:15	192.168.1.10	14.215.177.39	Https	54	Ether / IP / TCP 192.168.1.10:6144 > 14.215.177.39:https RA
56	2020-03-18 01:20:15	192.168.1.10	14.215.177.39	Https	54	Ether / IP / TCP 192.168.1.10:6154 > 14.215.177.39:https FA
57	2020-03-18 01:20:15	192.168.1.10	130.198.91.107	Https	78	Ether / IP / TCP 192.168.1.10:10273 > 130.198.91.107:https PA / Raw
58	2020-03-18 01:20:16	192.168.1.10	14.215.177.39	Https	66	Ether / IP / TCP 192.168.1.10:6158 > 14.215.177.39:https S
59	2020-03-18 01:20:16	130.198.91.107	192.168.1.10	Https	60	Ether / IP / TCP 130.198.91.107:https > 192.168.1.10:10273 A / Padding
60	2020-03-18 01:20:16	14.215.177.39	192.168.1.10	Https	66	Ether / IP / TCP 14.215.177.39:https > 192.168.1.10:6158 SA
61	2020-03-18 01:20:16	192.168.1.10	14.215.177.39	Https	54	Ether / IP / TCP 192.168.1.10:6158 > 14.215.177.39:https A
62	2020-03-18 01:20:16	192.168.1.10	14.215.177.39	Https	54	Ether / IP / TCP 192.168.1.10:6158 > 14.215.177.39:https FA
63	2020-03-18 01:20:16	192.168.1.10	14.215.177.39	Https	54	Ether / IP / TCP 192.168.1.10:6158 > 14.215.177.39:https FA
64	2020-03-18 01:20:16	192.168.1.10	47.244.15.210	TCP	66	Ether / IP / TCP 192.168.1.10:6157 > 47.244.15.210:20395 S
65	2020-03-18 01:20:17	192.168.1.10	14.215.177.39	Https	54	Ether / IP / TCP 192.168.1.10:6158 > 14.215.177.39:https FA
66	2020-03-18 01:20:17	fe80::f141:b4f2:11de:b126	fe80::1	ICMPv6	86	Ether / IPv6 / ICMPv6ND_NS / ICMPv6 Neighbor Discovery Option - Source Link-Layer Address 00:e0:4c:68:00:2d
67	2020-03-18 01:20:17	fe80::1	fe80::f141:b4f2:11de:b126	ICMPv6	78	Ether / IPv6 / ICMPv6 Neighbor Discovery - Neighbor Advertisement (tgt: fe80::1)
68	2020-03-18 01:20:17	192.168.1.10	54.223.180.103	Http	54	Ether / IP / TCP 192.168.1.10:6067 > 54.223.180.103:http RA
69	2020-03-18 01:20:17	192.168.1.10	47.244.15.210	TCP	66	Ether / IP / TCP 192.168.1.10:6155 > 47.244.15.210:20395 S
70	2020-03-18 01:20:18	192.168.1.10	14.215.177.39	Https	54	Ether / IP / TCP 192.168.1.10:6158 > 14.215.177.39:https FA
71	2020-03-18 01:20:19	fe80::f141:b4f2:11de:b126	fe80::1	DNS	96	Ether / IPv6 / UDP / DNS Qry "b'www.nowcoder.com.'" 
72	2020-03-18 01:20:19	fe80::f141:b4f2:11de:b126	fe80::1	DNS	97	Ether / IPv6 / UDP / DNS Qry "b'fonts.gstatic.com.'" 
73	2020-03-18 01:20:19	fe80::f141:b4f2:11de:b126	fe80::1	DNS	99	Ether / IPv6 / UDP / DNS Qry "b'static.nowcoder.com.'" 
74	2020-03-18 01:20:19	fe80::f141:b4f2:11de:b126	fe80::1	DNS	96	Ether / IPv6 / UDP / DNS Qry "b'www.nowcoder.com.'" 
75	2020-03-18 01:20:19	fe80::f141:b4f2:11de:b126	fe80::1	DNS	99	Ether / IPv6 / UDP / DNS Qry "b'static.nowcoder.com.'" 
76	2020-03-18 01:20:19	fe80::f141:b4f2:11de:b126	fe80::1	DNS	97	Ether / IPv6 / UDP / DNS Qry "b'fonts.gstatic.com.'" 
77	2020-03-18 01:20:19	fe80::1	fe80::f141:b4f2:11de:b126	DNS	362	Ether / IPv6 / UDP / DNS Ans "114.55.207.244" 
78	2020-03-18 01:20:19	fe80::1	fe80::f141:b4f2:11de:b126	DNS	445	Ether / IPv6 / UDP / DNS Ans "b'gstaticadssl.l.google.com.'" 
79	2020-03-18 01:20:19	fe80::1	fe80::f141:b4f2:11de:b126	DNS	359	Ether / IPv6 / UDP / DNS Ans "b'static.nowcoder.com.w.alikunlun.com.'" 
80	2020-03-18 01:20:19	fe80::1	fe80::f141:b4f2:11de:b126	DNS	197	Ether / IPv6 / UDP / DNS Ans "b'static.nowcoder.com.w.alikunlun.com.'" 
81	2020-03-18 01:20:19	fe80::1	fe80::f141:b4f2:11de:b126	DNS	183	Ether / IPv6 / UDP / DNS Ans "b'gstaticadssl.l.google.com.'" 
82	2020-03-18 01:20:19	fe80::1	fe80::f141:b4f2:11de:b126	DNS	169	Ether / IPv6 / UDP / DNS Ans 
83	2020-03-18 01:20:19	192.168.1.10	203.208.39.223	UDP	1392	Ether / IP / UDP 192.168.1.10:61275 > 203.208.39.223:https / Raw
84	2020-03-18 01:20:19	192.168.1.10	125.77.142.169	Https	66	Ether / IP / TCP 192.168.1.10:6159 > 125.77.142.169:https S
85	2020-03-18 01:20:19	192.168.1.10	114.55.207.244	Https	66	Ether / IP / TCP 192.168.1.10:6160 > 114.55.207.244:https S
86	2020-03-18 01:20:19	125.77.142.169	192.168.1.10	Https	66	Ether / IP / TCP 125.77.142.169:https > 192.168.1.10:6159 SA
87	2020-03-18 01:20:19	192.168.1.10	125.77.142.169	Https	54	Ether / IP / TCP 192.168.1.10:6159 > 125.77.142.169:https A
88	2020-03-18 01:20:19	192.168.1.10	125.77.142.169	Https	571	Ether / IP / TCP 192.168.1.10:6159 > 125.77.142.169:https PA / Raw
89	2020-03-18 01:20:19	125.77.142.169	192.168.1.10	Https	60	Ether / IP / TCP 125.77.142.169:https > 192.168.1.10:6159 A / Padding
90	2020-03-18 01:20:19	125.77.142.169	192.168.1.10	Https	1506	Ether / IP / TCP 125.77.142.169:https > 192.168.1.10:6159 A / Raw
91	2020-03-18 01:20:19	125.77.142.169	192.168.1.10	Https	1506	Ether / IP / TCP 125.77.142.169:https > 192.168.1.10:6159 A / Raw
92	2020-03-18 01:20:19	125.77.142.169	192.168.1.10	Https	233	Ether / IP / TCP 125.77.142.169:https > 192.168.1.10:6159 PA / Raw
93	2020-03-18 01:20:19	192.168.1.10	125.77.142.169	Https	54	Ether / IP / TCP 192.168.1.10:6159 > 125.77.142.169:https A
94	2020-03-18 01:20:19	192.168.1.10	125.77.142.169	Https	147	Ether / IP / TCP 192.168.1.10:6159 > 125.77.142.169:https PA / Raw
95	2020-03-18 01:20:19	114.55.207.244	192.168.1.10	Https	66	Ether / IP / TCP 114.55.207.244:https > 192.168.1.10:6160 SA
96	2020-03-18 01:20:19	192.168.1.10	114.55.207.244	Https	54	Ether / IP / TCP 192.168.1.10:6160 > 114.55.207.244:https A
97	2020-03-18 01:20:19	192.168.1.10	114.55.207.244	Https	571	Ether / IP / TCP 192.168.1.10:6160 > 114.55.207.244:https PA / Raw
98	2020-03-18 01:20:19	125.77.142.169	192.168.1.10	Https	296	Ether / IP / TCP 125.77.142.169:https > 192.168.1.10:6159 PA / Raw
99	2020-03-18 01:20:19	125.77.142.169	192.168.1.10	Https	123	Ether / IP / TCP 125.77.142.169:https > 192.168.1.10:6159 PA / Raw
100	2020-03-18 01:20:19	192.168.1.10	125.77.142.169	Https	54	Ether / IP / TCP 192.168.1.10:6159 > 125.77.142.169:https A
101	2020-03-18 01:20:19	114.55.207.244	192.168.1.10	Https	60	Ether / IP / TCP 114.55.207.244:https > 192.168.1.10:6160 A / Padding
102	2020-03-18 01:20:19	114.55.207.244	192.168.1.10	Https	1506	Ether / IP / TCP 114.55.207.244:https > 192.168.1.10:6160 A / Raw
103	2020-03-18 01:20:19	114.55.207.244	192.168.1.10	Https	1506	Ether / IP / TCP 114.55.207.244:https > 192.168.1.10:6160 A / Raw
104	2020-03-18 01:20:19	114.55.207.244	192.168.1.10	Https	233	Ether / IP / TCP 114.55.207.244:https > 192.168.1.10:6160 PA / Raw
105	2020-03-18 01:20:19	192.168.1.10	114.55.207.244	Https	54	Ether / IP / TCP 192.168.1.10:6160 > 114.55.207.244:https A
106	2020-03-18 01:20:19	192.168.1.10	114.55.207.244	Https	147	Ether / IP / TCP 192.168.1.10:6160 > 114.55.207.244:https PA / Raw
107	2020-03-18 01:20:19	114.55.207.244	192.168.1.10	Https	312	Ether / IP / TCP 114.55.207.244:https > 192.168.1.10:6160 PA / Raw
108	2020-03-18 01:20:19	114.55.207.244	192.168.1.10	Https	123	Ether / IP / TCP 114.55.207.244:https > 192.168.1.10:6160 PA / Raw
109	2020-03-18 01:20:19	192.168.1.10	114.55.207.244	Https	54	Ether / IP / TCP 192.168.1.10:6160 > 114.55.207.244:https A
110	2020-03-18 01:20:19	192.168.1.10	120.131.14.181	UDP	151	Ether / IP / UDP 192.168.1.10:49770 > 120.131.14.181:9402 / Raw
111	2020-03-18 01:20:19	192.168.1.10	203.208.39.223	UDP	1392	Ether / IP / UDP 192.168.1.10:61275 > 203.208.39.223:https / Raw
112	2020-03-18 01:20:19	192.168.1.10	203.208.39.223	UDP	1392	Ether / IP / UDP 192.168.1.10:61275 > 203.208.39.223:https / Raw
113	2020-03-18 01:20:20	192.168.1.10	183.57.48.55	UDP	1012	Ether / IP / UDP 192.168.1.10:54843 > 183.57.48.55:8000 / Raw
114	2020-03-18 01:20:20	183.57.48.55	192.168.1.10	UDP	356	Ether / IP / UDP 183.57.48.55:8000 > 192.168.1.10:54843 / Raw
115	2020-03-18 01:20:20	192.168.1.10	14.215.177.39	Https	54	Ether / IP / TCP 192.168.1.10:6158 > 14.215.177.39:https FA
116	2020-03-18 01:20:20	192.168.1.10	203.208.39.223	UDP	1392	Ether / IP / UDP 192.168.1.10:61275 > 203.208.39.223:https / Raw
117	2020-03-18 01:20:20	192.168.1.10	47.244.15.210	TCP	66	Ether / IP / TCP 192.168.1.10:6157 > 47.244.15.210:20395 S
118	2020-03-18 01:20:20	192.168.1.10	47.244.15.210	TCP	66	Ether / IP / TCP 192.168.1.10:6163 > 47.244.15.210:20395 S
119	2020-03-18 01:20:21	192.168.1.10	47.244.15.210	TCP	66	Ether / IP / TCP 192.168.1.10:6163 > 47.244.15.210:20395 S
120	2020-03-18 01:20:21	192.168.1.10	203.208.39.223	UDP	1392	Ether / IP / UDP 192.168.1.10:61275 > 203.208.39.223:https / Raw
121	2020-03-18 01:20:21	fe80::f141:b4f2:11de:b126	fe80::1	DNS	95	Ether / IPv6 / UDP / DNS Qry "b'click.suning.cn.'" 
122	2020-03-18 01:20:21	fe80::1	fe80::f141:b4f2:11de:b126	DNS	281	Ether / IPv6 / UDP / DNS Ans "b'wsapub.suning.com.'" 
123	2020-03-18 01:20:21	192.168.1.10	27.148.207.21	Https	66	Ether / IP / TCP 192.168.1.10:6164 > 27.148.207.21:https S
124	2020-03-18 01:20:21	27.148.207.21	192.168.1.10	Https	66	Ether / IP / TCP 27.148.207.21:https > 192.168.1.10:6164 SA
125	2020-03-18 01:20:21	192.168.1.10	27.148.207.21	Https	54	Ether / IP / TCP 192.168.1.10:6164 > 27.148.207.21:https A
126	2020-03-18 01:20:21	192.168.1.10	27.148.207.21	Https	571	Ether / IP / TCP 192.168.1.10:6164 > 27.148.207.21:https PA / Raw
127	2020-03-18 01:20:21	27.148.207.21	192.168.1.10	Https	60	Ether / IP / TCP 27.148.207.21:https > 192.168.1.10:6164 A / Padding
128	2020-03-18 01:20:21	27.148.207.21	192.168.1.10	Https	1506	Ether / IP / TCP 27.148.207.21:https > 192.168.1.10:6164 A / Raw
129	2020-03-18 01:20:21	27.148.207.21	192.168.1.10	Https	1506	Ether / IP / TCP 27.148.207.21:https > 192.168.1.10:6164 A / Raw
130	2020-03-18 01:20:21	27.148.207.21	192.168.1.10	Https	1246	Ether / IP / TCP 27.148.207.21:https > 192.168.1.10:6164 PA / Raw
131	2020-03-18 01:20:21	192.168.1.10	27.148.207.21	Https	54	Ether / IP / TCP 192.168.1.10:6164 > 27.148.207.21:https A
132	2020-03-18 01:20:21	27.148.207.21	192.168.1.10	Https	1424	Ether / IP / TCP 27.148.207.21:https > 192.168.1.10:6164 PA / Raw
133	2020-03-18 01:20:21	192.168.1.10	27.148.207.21	Https	54	Ether / IP / TCP 192.168.1.10:6164 > 27.148.207.21:https A
134	2020-03-18 01:20:21	192.168.1.10	27.148.207.21	Https	134	Ether / IP / TCP 192.168.1.10:6164 > 27.148.207.21:https PA / Raw
135	2020-03-18 01:20:21	192.168.1.10	27.148.207.21	Https	1506	Ether / IP / TCP 192.168.1.10:6164 > 27.148.207.21:https A / Raw
136	2020-03-18 01:20:21	192.168.1.10	27.148.207.21	Https	1009	Ether / IP / TCP 192.168.1.10:6164 > 27.148.207.21:https PA / Raw
137	2020-03-18 01:20:21	27.148.207.21	192.168.1.10	Https	357	Ether / IP / TCP 27.148.207.21:https > 192.168.1.10:6164 PA / Raw
138	2020-03-18 01:20:21	27.148.207.21	192.168.1.10	Https	357	Ether / IP / TCP 27.148.207.21:https > 192.168.1.10:6164 PA / Raw
139	2020-03-18 01:20:21	192.168.1.10	27.148.207.21	Https	54	Ether / IP / TCP 192.168.1.10:6164 > 27.148.207.21:https A
140	2020-03-18 01:20:21	27.148.207.21	192.168.1.10	Https	60	Ether / IP / TCP 27.148.207.21:https > 192.168.1.10:6164 A / Padding
141	2020-03-18 01:20:21	fe80::f141:b4f2:11de:b126	fe80::1	DNS	96	Ether / IPv6 / UDP / DNS Qry "b'qiang.suning.com.'" 
142	2020-03-18 01:20:21	fe80::f141:b4f2:11de:b126	fe80::1	DNS	96	Ether / IPv6 / UDP / DNS Qry "b'qiang.suning.com.'" 
143	2020-03-18 01:20:21	fe80::1	fe80::f141:b4f2:11de:b126	DNS	560	Ether / IPv6 / UDP / DNS Ans "b'wsapubv46.suning.com.'" 
144	2020-03-18 01:20:21	fe80::1	fe80::f141:b4f2:11de:b126	DNS	568	Ether / IPv6 / UDP / DNS Ans "b'wsapubv46.suning.com.'" 
145	2020-03-18 01:20:21	240e:d4:2e8e:df00:4882:f650:cbf9:db1d	240e:966:1801:10:0:2:1:17	Https	86	Ether / IPv6 / TCP 240e:d4:2e8e:df00:4882:f650:cbf9:db1d:6165 > 240e:966:1801:10:0:2:1:17:https S
