1	2020-03-17 22:25:36	192.168.1.10	14.215.177.39	Https	66	Ether / IP / TCP 192.168.1.10:10320 > 14.215.177.39:https S
2	2020-03-17 22:25:36	14.215.177.39	192.168.1.10	Https	66	Ether / IP / TCP 14.215.177.39:https > 192.168.1.10:10320 SA
3	2020-03-17 22:25:36	192.168.1.10	14.215.177.39	Https	54	Ether / IP / TCP 192.168.1.10:10320 > 14.215.177.39:https A
4	2020-03-17 22:25:36	192.168.1.10	14.215.177.39	Https	54	Ether / IP / TCP 192.168.1.10:10320 > 14.215.177.39:https FA
5	2020-03-17 22:25:36	139.99.69.89	192.168.1.10	Http	66	Ether / IP / TCP 139.99.69.89:http > 192.168.1.10:12360 A
6	2020-03-17 22:25:36	192.168.1.10	14.215.177.39	Https	54	Ether / IP / TCP 192.168.1.10:10320 > 14.215.177.39:https FA
7	2020-03-17 22:25:36	192.168.1.10	120.131.14.181	UDP	151	Ether / IP / UDP 192.168.1.10:49770 > 120.131.14.181:9402 / Raw
8	2020-03-17 22:25:36	120.131.14.181	192.168.1.10	UDP	155	Ether / IP / UDP 120.131.14.181:9402 > 192.168.1.10:49770 / Raw
9	2020-03-17 22:25:37	192.168.1.10	14.215.177.39	Https	54	Ether / IP / TCP 192.168.1.10:10320 > 14.215.177.39:https FA
10	2020-03-17 22:25:38	192.168.1.10	14.215.177.39	Https	54	Ether / IP / TCP 192.168.1.10:10320 > 14.215.177.39:https FA
11	2020-03-17 22:25:39	fe80::1	240e:d4:2e8e:df00:4882:f650:cbf9:db1d	ICMPv6	86	Ether / IPv6 / ICMPv6ND_NS / ICMPv6 Neighbor Discovery Option - Source Link-Layer Address 9c:d2:4b:38:91:c1
12	2020-03-17 22:25:39	240e:d4:2e8e:df00:4882:f650:cbf9:db1d	fe80::1	ICMPv6	86	Ether / IPv6 / ICMPv6ND_NA / ICMPv6 Neighbor Discovery Option - Destination Link-Layer Address 00:e0:4c:68:00:2d
13	2020-03-17 22:25:40	192.168.1.10	161.117.236.80	TCP	66	Ether / IP / TCP 192.168.1.10:10323 > 161.117.236.80:20395 S
14	2020-03-17 22:25:40	161.117.236.80	192.168.1.10	TCP	66	Ether / IP / TCP 161.117.236.80:20395 > 192.168.1.10:10323 SA
15	2020-03-17 22:25:40	192.168.1.10	161.117.236.80	TCP	54	Ether / IP / TCP 192.168.1.10:10323 > 161.117.236.80:20395 A
16	2020-03-17 22:25:40	192.168.1.10	161.117.236.80	TCP	976	Ether / IP / TCP 192.168.1.10:10323 > 161.117.236.80:20395 PA / Raw
17	2020-03-17 22:25:40	192.168.1.10	161.117.236.80	TCP	1032	Ether / IP / TCP 192.168.1.10:10323 > 161.117.236.80:20395 PA / Raw
18	2020-03-17 22:25:40	161.117.236.80	192.168.1.10	TCP	60	Ether / IP / TCP 161.117.236.80:20395 > 192.168.1.10:10323 A / Padding
19	2020-03-17 22:25:40	161.117.236.80	192.168.1.10	TCP	60	Ether / IP / TCP 161.117.236.80:20395 > 192.168.1.10:10323 A / Padding
20	2020-03-17 22:25:40	161.117.236.80	192.168.1.10	TCP	1506	Ether / IP / TCP 161.117.236.80:20395 > 192.168.1.10:10323 A / Raw
21	2020-03-17 22:25:40	161.117.236.80	192.168.1.10	TCP	60	Ether / IP / TCP 161.117.236.80:20395 > 192.168.1.10:10323 PA / Raw
22	2020-03-17 22:25:40	192.168.1.10	161.117.236.80	TCP	54	Ether / IP / TCP 192.168.1.10:10323 > 161.117.236.80:20395 A
23	2020-03-17 22:25:40	161.117.236.80	192.168.1.10	TCP	1506	Ether / IP / TCP 161.117.236.80:20395 > 192.168.1.10:10323 A / Raw
24	2020-03-17 22:25:40	161.117.236.80	192.168.1.10	TCP	1497	Ether / IP / TCP 161.117.236.80:20395 > 192.168.1.10:10323 PA / Raw
25	2020-03-17 22:25:40	192.168.1.10	161.117.236.80	TCP	54	Ether / IP / TCP 192.168.1.10:10323 > 161.117.236.80:20395 A
26	2020-03-17 22:25:40	161.117.236.80	192.168.1.10	TCP	1052	Ether / IP / TCP 161.117.236.80:20395 > 192.168.1.10:10323 PA / Raw
27	2020-03-17 22:25:40	192.168.1.10	161.117.236.80	TCP	897	Ether / IP / TCP 192.168.1.10:10323 > 161.117.236.80:20395 PA / Raw
28	2020-03-17 22:25:40	192.168.1.10	161.117.236.80	TCP	948	Ether / IP / TCP 192.168.1.10:10323 > 161.117.236.80:20395 PA / Raw
29	2020-03-17 22:25:40	161.117.236.80	192.168.1.10	TCP	60	Ether / IP / TCP 161.117.236.80:20395 > 192.168.1.10:10323 A / Padding
30	2020-03-17 22:25:40	161.117.236.80	192.168.1.10	TCP	1032	Ether / IP / TCP 161.117.236.80:20395 > 192.168.1.10:10323 PA / Raw
31	2020-03-17 22:25:40	161.117.236.80	192.168.1.10	TCP	300	Ether / IP / TCP 161.117.236.80:20395 > 192.168.1.10:10323 PA / Raw
32	2020-03-17 22:25:40	192.168.1.10	161.117.236.80	TCP	54	Ether / IP / TCP 192.168.1.10:10323 > 161.117.236.80:20395 A
33	2020-03-17 22:25:40	192.168.1.10	161.117.236.80	TCP	576	Ether / IP / TCP 192.168.1.10:10323 > 161.117.236.80:20395 PA / Raw
34	2020-03-17 22:25:40	161.117.236.80	192.168.1.10	TCP	60	Ether / IP / TCP 161.117.236.80:20395 > 192.168.1.10:10323 A / Padding
35	2020-03-17 22:25:40	192.168.1.10	14.215.177.39	Https	54	Ether / IP / TCP 192.168.1.10:10320 > 14.215.177.39:https FA
36	2020-03-17 22:25:40	161.117.236.80	192.168.1.10	TCP	919	Ether / IP / TCP 161.117.236.80:20395 > 192.168.1.10:10323 PA / Raw
37	2020-03-17 22:25:40	192.168.1.10	161.117.236.80	TCP	54	Ether / IP / TCP 192.168.1.10:10323 > 161.117.236.80:20395 A
38	2020-03-17 22:25:41	192.168.1.10	140.82.113.25	Https	55	Ether / IP / TCP 192.168.1.10:9423 > 140.82.113.25:https A / Raw
39	2020-03-17 22:25:42	140.82.113.25	192.168.1.10	Https	66	Ether / IP / TCP 140.82.113.25:https > 192.168.1.10:9423 A
40	2020-03-17 22:25:42	240e:ff:f101:10::11a	240e:d4:2e8e:df00:4882:f650:cbf9:db1d	Http	115	Ether / IPv6 / TCP 240e:ff:f101:10::11a:http > 240e:d4:2e8e:df00:4882:f650:cbf9:db1d:2012 PA / HTTP / Raw
41	2020-03-17 22:25:42	240e:d4:2e8e:df00:4882:f650:cbf9:db1d	240e:ff:f101:10::11a	Http	429	Ether / IPv6 / TCP 240e:d4:2e8e:df00:4882:f650:cbf9:db1d:2012 > 240e:ff:f101:10::11a:http PA / HTTP / Raw
42	2020-03-17 22:25:42	192.168.1.10	10.10.20.110	UDP	120	Ether / IP / UDP 192.168.1.10:59684 > 10.10.20.110:snmp / SNMP
43	2020-03-17 22:25:42	240e:ff:f101:10::11a	240e:d4:2e8e:df00:4882:f650:cbf9:db1d	Http	598	Ether / IPv6 / TCP 240e:ff:f101:10::11a:http > 240e:d4:2e8e:df00:4882:f650:cbf9:db1d:2012 PA / HTTP / Raw
44	2020-03-17 22:25:42	240e:d4:2e8e:df00:4882:f650:cbf9:db1d	240e:ff:f101:10::11a	Http	74	Ether / IPv6 / TCP 240e:d4:2e8e:df00:4882:f650:cbf9:db1d:2012 > 240e:ff:f101:10::11a:http A
45	2020-03-17 22:25:43	180.163.21.35	192.168.1.10	Http	60	Ether / IP / TCP 180.163.21.35:http > 192.168.1.10:9537 A / Padding
46	2020-03-17 22:25:43	192.168.1.10	180.163.21.35	Http	54	Ether / IP / TCP 192.168.1.10:9537 > 180.163.21.35:http A
47	2020-03-17 22:25:44	192.168.1.10	52.139.250.253	Https	157	Ether / IP / TCP 192.168.1.10:1307 > 52.139.250.253:https PA / Raw
48	2020-03-17 22:25:45	192.168.1.10	14.215.177.39	Https	54	Ether / IP / TCP 192.168.1.10:10317 > 14.215.177.39:https RA
49	2020-03-17 22:25:45	192.168.1.10	14.215.177.39	Https	54	Ether / IP / TCP 192.168.1.10:10320 > 14.215.177.39:https FA
50	2020-03-17 22:25:45	192.168.1.10	161.117.236.80	TCP	54	Ether / IP / TCP 192.168.1.10:10323 > 161.117.236.80:20395 FA
51	2020-03-17 22:25:45	161.117.236.80	192.168.1.10	TCP	60	Ether / IP / TCP 161.117.236.80:20395 > 192.168.1.10:10323 FA / Padding
52	2020-03-17 22:25:45	192.168.1.10	161.117.236.80	TCP	54	Ether / IP / TCP 192.168.1.10:10323 > 161.117.236.80:20395 A
53	2020-03-17 22:25:45	192.168.1.10	52.139.250.253	Https	157	Ether / IP / TCP 192.168.1.10:1307 > 52.139.250.253:https PA / Raw
54	2020-03-17 22:25:46	52.139.250.253	192.168.1.10	Https	66	Ether / IP / TCP 52.139.250.253:https > 192.168.1.10:1307 A
55	2020-03-17 22:25:46	192.168.1.10	14.215.177.39	Https	66	Ether / IP / TCP 192.168.1.10:10324 > 14.215.177.39:https S
56	2020-03-17 22:25:46	14.215.177.39	192.168.1.10	Https	66	Ether / IP / TCP 14.215.177.39:https > 192.168.1.10:10324 SA
57	2020-03-17 22:25:46	192.168.1.10	14.215.177.39	Https	54	Ether / IP / TCP 192.168.1.10:10324 > 14.215.177.39:https A
58	2020-03-17 22:25:46	192.168.1.10	14.215.177.39	Https	54	Ether / IP / TCP 192.168.1.10:10324 > 14.215.177.39:https FA
59	2020-03-17 22:25:46	192.168.1.10	14.215.177.39	Https	54	Ether / IP / TCP 192.168.1.10:10324 > 14.215.177.39:https FA
60	2020-03-17 22:25:47	192.168.1.10	14.215.177.39	Https	54	Ether / IP / TCP 192.168.1.10:10324 > 14.215.177.39:https FA
61	2020-03-17 22:25:48	192.168.1.10	14.215.177.39	Https	54	Ether / IP / TCP 192.168.1.10:10324 > 14.215.177.39:https FA
62	2020-03-17 22:25:48	9c:d2:4b:38:91:c1	00:e0:4c:68:00:2d	ARP	60	Ether / ARP who has 192.168.1.10 says 192.168.1.1 / Padding
63	2020-03-17 22:25:48	00:e0:4c:68:00:2d	9c:d2:4b:38:91:c1	ARP	42	Ether / ARP is at 00:e0:4c:68:00:2d says 192.168.1.10
64	2020-03-17 22:25:49	240e:d4:2e8e:df00:4882:f650:cbf9:db1d	240e:ff:f101:10::118	Http	86	Ether / IPv6 / TCP 240e:d4:2e8e:df00:4882:f650:cbf9:db1d:10325 > 240e:ff:f101:10::118:http S
65	2020-03-17 22:25:49	240e:ff:f101:10::118	240e:d4:2e8e:df00:4882:f650:cbf9:db1d	Http	86	Ether / IPv6 / TCP 240e:ff:f101:10::118:http > 240e:d4:2e8e:df00:4882:f650:cbf9:db1d:10325 SA
66	2020-03-17 22:25:49	240e:d4:2e8e:df00:4882:f650:cbf9:db1d	240e:ff:f101:10::118	Http	74	Ether / IPv6 / TCP 240e:d4:2e8e:df00:4882:f650:cbf9:db1d:10325 > 240e:ff:f101:10::118:http A
67	2020-03-17 22:25:49	240e:d4:2e8e:df00:4882:f650:cbf9:db1d	240e:ff:f101:10::118	Http	878	Ether / IPv6 / TCP / HTTP / 'POST' '/mmtls/0000798d' 'HTTP/1.1' / Raw
68	2020-03-17 22:25:49	240e:ff:f101:10::118	240e:d4:2e8e:df00:4882:f650:cbf9:db1d	Http	74	Ether / IPv6 / TCP 240e:ff:f101:10::118:http > 240e:d4:2e8e:df00:4882:f650:cbf9:db1d:10325 A
69	2020-03-17 22:25:49	240e:ff:f101:10::118	240e:d4:2e8e:df00:4882:f650:cbf9:db1d	Http	402	Ether / IPv6 / TCP / HTTP / 'HTTP/1.1' '200' 'OK' / Raw
70	2020-03-17 22:25:49	240e:d4:2e8e:df00:4882:f650:cbf9:db1d	240e:ff:f101:10::118	Http	74	Ether / IPv6 / TCP 240e:d4:2e8e:df00:4882:f650:cbf9:db1d:10325 > 240e:ff:f101:10::118:http FA
71	2020-03-17 22:25:49	240e:ff:f101:10::118	240e:d4:2e8e:df00:4882:f650:cbf9:db1d	Http	74	Ether / IPv6 / TCP 240e:ff:f101:10::118:http > 240e:d4:2e8e:df00:4882:f650:cbf9:db1d:10325 FA
72	2020-03-17 22:25:49	240e:d4:2e8e:df00:4882:f650:cbf9:db1d	240e:ff:f101:10::118	Http	74	Ether / IPv6 / TCP 240e:d4:2e8e:df00:4882:f650:cbf9:db1d:10325 > 240e:ff:f101:10::118:http A
73	2020-03-17 22:25:49	240e:d4:2e8e:df00:4882:f650:cbf9:db1d	240e:ff:f101:10::118	Http	86	Ether / IPv6 / TCP 240e:d4:2e8e:df00:4882:f650:cbf9:db1d:10326 > 240e:ff:f101:10::118:http S
74	2020-03-17 22:25:49	240e:ff:f101:10::118	240e:d4:2e8e:df00:4882:f650:cbf9:db1d	Http	74	Ether / IPv6 / TCP 240e:ff:f101:10::118:http > 240e:d4:2e8e:df00:4882:f650:cbf9:db1d:10325 A
75	2020-03-17 22:25:49	240e:ff:f101:10::118	240e:d4:2e8e:df00:4882:f650:cbf9:db1d	Http	86	Ether / IPv6 / TCP 240e:ff:f101:10::118:http > 240e:d4:2e8e:df00:4882:f650:cbf9:db1d:10326 SA
76	2020-03-17 22:25:49	240e:d4:2e8e:df00:4882:f650:cbf9:db1d	240e:ff:f101:10::118	Http	74	Ether / IPv6 / TCP 240e:d4:2e8e:df00:4882:f650:cbf9:db1d:10326 > 240e:ff:f101:10::118:http A
77	2020-03-17 22:25:49	240e:d4:2e8e:df00:4882:f650:cbf9:db1d	240e:ff:f101:10::118	Http	815	Ether / IPv6 / TCP / HTTP / 'POST' '/mmtls/0000798d' 'HTTP/1.1' / Raw
78	2020-03-17 22:25:49	240e:ff:f101:10::118	240e:d4:2e8e:df00:4882:f650:cbf9:db1d	Http	74	Ether / IPv6 / TCP 240e:ff:f101:10::118:http > 240e:d4:2e8e:df00:4882:f650:cbf9:db1d:10326 A
79	2020-03-17 22:25:50	240e:ff:f101:10::118	240e:d4:2e8e:df00:4882:f650:cbf9:db1d	Http	1494	Ether / IPv6 / TCP / HTTP / 'HTTP/1.1' '200' 'OK' / Raw
80	2020-03-17 22:25:50	240e:ff:f101:10::118	240e:d4:2e8e:df00:4882:f650:cbf9:db1d	Http	1494	Ether / IPv6 / TCP 240e:ff:f101:10::118:http > 240e:d4:2e8e:df00:4882:f650:cbf9:db1d:10326 A / HTTP / Raw
81	2020-03-17 22:25:50	240e:ff:f101:10::118	240e:d4:2e8e:df00:4882:f650:cbf9:db1d	Http	1494	Ether / IPv6 / TCP 240e:ff:f101:10::118:http > 240e:d4:2e8e:df00:4882:f650:cbf9:db1d:10326 A / HTTP / Raw
82	2020-03-17 22:25:50	240e:d4:2e8e:df00:4882:f650:cbf9:db1d	240e:ff:f101:10::118	Http	74	Ether / IPv6 / TCP 240e:d4:2e8e:df00:4882:f650:cbf9:db1d:10326 > 240e:ff:f101:10::118:http A
83	2020-03-17 22:25:50	240e:ff:f101:10::118	240e:d4:2e8e:df00:4882:f650:cbf9:db1d	Http	1494	Ether / IPv6 / TCP 240e:ff:f101:10::118:http > 240e:d4:2e8e:df00:4882:f650:cbf9:db1d:10326 A / HTTP / Raw
84	2020-03-17 22:25:50	240e:ff:f101:10::118	240e:d4:2e8e:df00:4882:f650:cbf9:db1d	Http	1494	Ether / IPv6 / TCP 240e:ff:f101:10::118:http > 240e:d4:2e8e:df00:4882:f650:cbf9:db1d:10326 A / HTTP / Raw
85	2020-03-17 22:25:50	240e:ff:f101:10::118	240e:d4:2e8e:df00:4882:f650:cbf9:db1d	Http	328	Ether / IPv6 / TCP 240e:ff:f101:10::118:http > 240e:d4:2e8e:df00:4882:f650:cbf9:db1d:10326 PA / HTTP / Raw
86	2020-03-17 22:25:50	240e:ff:f101:10::118	240e:d4:2e8e:df00:4882:f650:cbf9:db1d	Http	74	Ether / IPv6 / TCP 240e:ff:f101:10::118:http > 240e:d4:2e8e:df00:4882:f650:cbf9:db1d:10326 FA
87	2020-03-17 22:25:50	240e:d4:2e8e:df00:4882:f650:cbf9:db1d	240e:ff:f101:10::118	Http	74	Ether / IPv6 / TCP 240e:d4:2e8e:df00:4882:f650:cbf9:db1d:10326 > 240e:ff:f101:10::118:http A
88	2020-03-17 22:25:50	240e:d4:2e8e:df00:4882:f650:cbf9:db1d	240e:ff:f101:10::118	Http	74	Ether / IPv6 / TCP 240e:d4:2e8e:df00:4882:f650:cbf9:db1d:10326 > 240e:ff:f101:10::118:http FA
89	2020-03-17 22:25:50	240e:ff:f101:10::118	240e:d4:2e8e:df00:4882:f650:cbf9:db1d	Http	74	Ether / IPv6 / TCP 240e:ff:f101:10::118:http > 240e:d4:2e8e:df00:4882:f650:cbf9:db1d:10326 R
90	2020-03-17 22:25:50	140.82.113.25	192.168.1.10	Https	78	Ether / IP / TCP 140.82.113.25:https > 192.168.1.10:9423 PA / Raw
91	2020-03-17 22:25:50	192.168.1.10	140.82.113.25	Https	82	Ether / IP / TCP 192.168.1.10:9423 > 140.82.113.25:https PA / Raw
92	2020-03-17 22:25:50	192.168.1.10	14.215.177.39	Https	54	Ether / IP / TCP 192.168.1.10:10324 > 14.215.177.39:https FA
93	2020-03-17 22:25:50	140.82.113.25	192.168.1.10	Https	60	Ether / IP / TCP 140.82.113.25:https > 192.168.1.10:9423 A / Padding
94	2020-03-17 22:25:55	192.168.1.10	14.215.177.39	Https	54	Ether / IP / TCP 192.168.1.10:10320 > 14.215.177.39:https RA
