1	2020-03-18 01:04:45	192.168.1.10	14.215.177.39	Https	54	Ether / IP / TCP 192.168.1.10:4641 > 14.215.177.39:https FA
2	2020-03-18 01:04:45	192.168.1.10	47.244.15.210	TCP	66	Ether / IP / TCP 192.168.1.10:4648 > 47.244.15.210:20395 S
3	2020-03-18 01:04:46	192.168.1.10	14.215.177.39	Https	66	Ether / IP / TCP 192.168.1.10:4651 > 14.215.177.39:https S
4	2020-03-18 01:04:46	14.215.177.39	192.168.1.10	Https	66	Ether / IP / TCP 14.215.177.39:https > 192.168.1.10:4651 SA
5	2020-03-18 01:04:46	192.168.1.10	14.215.177.39	Https	54	Ether / IP / TCP 192.168.1.10:4651 > 14.215.177.39:https A
6	2020-03-18 01:04:46	192.168.1.10	14.215.177.39	Https	54	Ether / IP / TCP 192.168.1.10:4651 > 14.215.177.39:https FA
7	2020-03-18 01:04:46	192.168.1.10	14.215.177.39	Https	54	Ether / IP / TCP 192.168.1.10:4651 > 14.215.177.39:https FA
8	2020-03-18 01:04:46	192.168.1.10	47.244.15.210	TCP	66	Ether / IP / TCP 192.168.1.10:4648 > 47.244.15.210:20395 S
9	2020-03-18 01:04:47	192.168.1.10	14.215.177.39	Https	54	Ether / IP / TCP 192.168.1.10:4651 > 14.215.177.39:https FA
10	2020-03-18 01:04:48	192.168.1.10	14.215.177.39	Https	54	Ether / IP / TCP 192.168.1.10:4651 > 14.215.177.39:https FA
11	2020-03-18 01:04:48	192.168.1.10	47.244.15.210	TCP	66	Ether / IP / TCP 192.168.1.10:4648 > 47.244.15.210:20395 S
12	2020-03-18 01:04:49	192.168.1.10	219.133.60.246	Http	66	Ether / IP / TCP 192.168.1.10:4653 > 219.133.60.246:http S
13	2020-03-18 01:04:49	219.133.60.246	192.168.1.10	Http	66	Ether / IP / TCP 219.133.60.246:http > 192.168.1.10:4653 SA
14	2020-03-18 01:04:49	192.168.1.10	219.133.60.246	Http	54	Ether / IP / TCP 192.168.1.10:4653 > 219.133.60.246:http A
15	2020-03-18 01:04:49	192.168.1.10	219.133.60.246	Http	473	Ether / IP / TCP / HTTP / 'POST' '/q.cgi' 'HTTP/1.1' / Raw
16	2020-03-18 01:04:49	219.133.60.246	192.168.1.10	Http	60	Ether / IP / TCP 219.133.60.246:http > 192.168.1.10:4653 A / Padding
17	2020-03-18 01:04:49	219.133.60.246	192.168.1.10	Http	320	Ether / IP / TCP / HTTP / 'HTTP/1.1' '200' 'OK' / Raw
18	2020-03-18 01:04:49	192.168.1.10	219.133.60.246	Http	54	Ether / IP / TCP 192.168.1.10:4653 > 219.133.60.246:http FA
19	2020-03-18 01:04:49	219.133.60.246	192.168.1.10	Http	60	Ether / IP / TCP 219.133.60.246:http > 192.168.1.10:4653 FA / Padding
20	2020-03-18 01:04:49	192.168.1.10	219.133.60.246	Http	54	Ether / IP / TCP 192.168.1.10:4653 > 219.133.60.246:http A
21	2020-03-18 01:04:50	192.168.1.10	14.215.177.39	Https	54	Ether / IP / TCP 192.168.1.10:4651 > 14.215.177.39:https FA
22	2020-03-18 01:04:52	192.168.1.10	220.181.76.82	Http	54	Ether / IP / TCP 192.168.1.10:4568 > 220.181.76.82:http RA
23	2020-03-18 01:04:52	192.168.1.10	220.181.76.82	Http	54	Ether / IP / TCP 192.168.1.10:4566 > 220.181.76.82:http RA
24	2020-03-18 01:04:52	192.168.1.10	220.181.76.82	Http	54	Ether / IP / TCP 192.168.1.10:4574 > 220.181.76.82:http RA
25	2020-03-18 01:04:52	192.168.1.10	220.181.76.82	Http	54	Ether / IP / TCP 192.168.1.10:4573 > 220.181.76.82:http RA
26	2020-03-18 01:04:52	192.168.1.10	220.181.76.82	Http	54	Ether / IP / TCP 192.168.1.10:4571 > 220.181.76.82:http RA
27	2020-03-18 01:04:52	192.168.1.10	220.181.76.82	Http	54	Ether / IP / TCP 192.168.1.10:4570 > 220.181.76.82:http RA
28	2020-03-18 01:04:52	192.168.1.10	220.181.76.82	Http	54	Ether / IP / TCP 192.168.1.10:4569 > 220.181.76.82:http RA
29	2020-03-18 01:04:52	192.168.1.10	220.181.76.82	Http	54	Ether / IP / TCP 192.168.1.10:4567 > 220.181.76.82:http RA
30	2020-03-18 01:04:52	192.168.1.10	220.181.76.82	Http	54	Ether / IP / TCP 192.168.1.10:4572 > 220.181.76.82:http RA
31	2020-03-18 01:04:52	192.168.1.10	220.181.76.82	Http	54	Ether / IP / TCP 192.168.1.10:4565 > 220.181.76.82:http RA
32	2020-03-18 01:04:52	192.168.1.10	47.244.15.210	TCP	66	Ether / IP / TCP 192.168.1.10:4648 > 47.244.15.210:20395 S
33	2020-03-18 01:04:52	192.168.1.10	10.10.20.110	UDP	120	Ether / IP / UDP 192.168.1.10:59684 > 10.10.20.110:snmp / SNMP
34	2020-03-18 01:04:54	92.223.85.103	192.168.1.10	Http	60	Ether / IP / TCP 92.223.85.103:http > 192.168.1.10:14585 A / Padding
35	2020-03-18 01:04:54	192.168.1.10	92.223.85.103	Http	54	Ether / IP / TCP 192.168.1.10:14585 > 92.223.85.103:http A
36	2020-03-18 01:04:55	192.168.1.10	14.215.177.39	Https	54	Ether / IP / TCP 192.168.1.10:4641 > 14.215.177.39:https RA
37	2020-03-18 01:04:55	54.223.180.103	192.168.1.10	Http	60	Ether / IP / TCP 54.223.180.103:http > 192.168.1.10:4612 FA / Padding
38	2020-03-18 01:04:55	192.168.1.10	54.223.180.103	Http	54	Ether / IP / TCP 192.168.1.10:4612 > 54.223.180.103:http A
39	2020-03-18 01:04:55	192.168.1.10	14.215.177.39	Https	54	Ether / IP / TCP 192.168.1.10:4651 > 14.215.177.39:https FA
40	2020-03-18 01:04:55	192.168.1.10	47.244.15.210	TCP	66	Ether / IP / TCP 192.168.1.10:4654 > 47.244.15.210:20395 S
41	2020-03-18 01:04:55	192.168.1.10	223.252.199.69	TCP	55	Ether / IP / TCP 192.168.1.10:13025 > 223.252.199.69:6003 A / Raw
42	2020-03-18 01:04:55	223.252.199.69	192.168.1.10	TCP	66	Ether / IP / TCP 223.252.199.69:6003 > 192.168.1.10:13025 A
43	2020-03-18 01:04:56	fe80::f141:b4f2:11de:b126	fe80::1	DNS	99	Ether / IPv6 / UDP / DNS Qry "b'api.vc.bilibili.com.'" 
44	2020-03-18 01:04:56	fe80::1	fe80::f141:b4f2:11de:b126	DNS	204	Ether / IPv6 / UDP / DNS Ans "b'interface.biliapi.com.'" 
45	2020-03-18 01:04:56	192.168.1.10	120.92.168.51	Https	66	Ether / IP / TCP 192.168.1.10:4655 > 120.92.168.51:https S
46	2020-03-18 01:04:56	120.92.168.51	192.168.1.10	Https	62	Ether / IP / TCP 120.92.168.51:https > 192.168.1.10:4655 SA
47	2020-03-18 01:04:56	192.168.1.10	120.92.168.51	Https	54	Ether / IP / TCP 192.168.1.10:4655 > 120.92.168.51:https A
48	2020-03-18 01:04:56	192.168.1.10	120.92.168.51	Https	571	Ether / IP / TCP 192.168.1.10:4655 > 120.92.168.51:https PA / Raw
49	2020-03-18 01:04:56	120.92.168.51	192.168.1.10	Https	60	Ether / IP / TCP 120.92.168.51:https > 192.168.1.10:4655 A / Padding
50	2020-03-18 01:04:56	120.92.168.51	192.168.1.10	Https	206	Ether / IP / TCP 120.92.168.51:https > 192.168.1.10:4655 PA / Raw
51	2020-03-18 01:04:56	192.168.1.10	120.92.168.51	Https	105	Ether / IP / TCP 192.168.1.10:4655 > 120.92.168.51:https PA / Raw
52	2020-03-18 01:04:56	192.168.1.10	120.92.168.51	Https	1151	Ether / IP / TCP 192.168.1.10:4655 > 120.92.168.51:https PA / Raw
53	2020-03-18 01:04:56	192.168.1.10	14.215.177.39	Https	66	Ether / IP / TCP 192.168.1.10:4656 > 14.215.177.39:https S
54	2020-03-18 01:04:56	120.92.168.51	192.168.1.10	Https	60	Ether / IP / TCP 120.92.168.51:https > 192.168.1.10:4655 A / Padding
55	2020-03-18 01:04:56	120.92.168.51	192.168.1.10	Https	938	Ether / IP / TCP 120.92.168.51:https > 192.168.1.10:4655 PA / Raw
56	2020-03-18 01:04:56	14.215.177.39	192.168.1.10	Https	66	Ether / IP / TCP 14.215.177.39:https > 192.168.1.10:4656 SA
57	2020-03-18 01:04:56	192.168.1.10	14.215.177.39	Https	54	Ether / IP / TCP 192.168.1.10:4656 > 14.215.177.39:https A
58	2020-03-18 01:04:56	192.168.1.10	14.215.177.39	Https	54	Ether / IP / TCP 192.168.1.10:4656 > 14.215.177.39:https FA
59	2020-03-18 01:04:56	192.168.1.10	120.92.168.51	Https	54	Ether / IP / TCP 192.168.1.10:4655 > 120.92.168.51:https A
60	2020-03-18 01:04:56	192.168.1.10	14.215.177.39	Https	54	Ether / IP / TCP 192.168.1.10:4656 > 14.215.177.39:https FA
61	2020-03-18 01:04:56	192.168.1.10	47.244.15.210	TCP	66	Ether / IP / TCP 192.168.1.10:4654 > 47.244.15.210:20395 S
62	2020-03-18 01:04:57	192.168.1.10	14.215.177.39	Https	54	Ether / IP / TCP 192.168.1.10:4656 > 14.215.177.39:https FA
63	2020-03-18 01:04:57	192.168.1.10	120.92.168.51	Https	54	Ether / IP / TCP 192.168.1.10:4655 > 120.92.168.51:https FA
64	2020-03-18 01:04:57	120.92.168.51	192.168.1.10	Https	60	Ether / IP / TCP 120.92.168.51:https > 192.168.1.10:4655 FA / Padding
65	2020-03-18 01:04:57	192.168.1.10	120.92.168.51	Https	54	Ether / IP / TCP 192.168.1.10:4655 > 120.92.168.51:https A
66	2020-03-18 01:04:58	fe80::f141:b4f2:11de:b126	fe80::1	DNS	96	Ether / IPv6 / UDP / DNS Qry "b'www.nowcoder.com.'" 
67	2020-03-18 01:04:58	fe80::f141:b4f2:11de:b126	fe80::1	DNS	99	Ether / IPv6 / UDP / DNS Qry "b'static.nowcoder.com.'" 
68	2020-03-18 01:04:58	fe80::f141:b4f2:11de:b126	fe80::1	DNS	96	Ether / IPv6 / UDP / DNS Qry "b'www.nowcoder.com.'" 
69	2020-03-18 01:04:58	fe80::f141:b4f2:11de:b126	fe80::1	DNS	99	Ether / IPv6 / UDP / DNS Qry "b'static.nowcoder.com.'" 
70	2020-03-18 01:04:58	fe80::1	fe80::f141:b4f2:11de:b126	DNS	362	Ether / IPv6 / UDP / DNS Ans "114.55.207.244" 
71	2020-03-18 01:04:58	fe80::1	fe80::f141:b4f2:11de:b126	DNS	311	Ether / IPv6 / UDP / DNS Ans "b'static.nowcoder.com.w.alikunlun.com.'" 
72	2020-03-18 01:04:58	fe80::1	fe80::f141:b4f2:11de:b126	DNS	197	Ether / IPv6 / UDP / DNS Ans "b'static.nowcoder.com.w.alikunlun.com.'" 
73	2020-03-18 01:04:58	fe80::1	fe80::f141:b4f2:11de:b126	DNS	169	Ether / IPv6 / UDP / DNS Ans 
74	2020-03-18 01:04:58	192.168.1.10	114.55.207.244	Https	66	Ether / IP / TCP 192.168.1.10:4657 > 114.55.207.244:https S
75	2020-03-18 01:04:58	192.168.1.10	125.77.142.169	Https	66	Ether / IP / TCP 192.168.1.10:4658 > 125.77.142.169:https S
76	2020-03-18 01:04:58	125.77.142.169	192.168.1.10	Https	66	Ether / IP / TCP 125.77.142.169:https > 192.168.1.10:4658 SA
77	2020-03-18 01:04:58	192.168.1.10	125.77.142.169	Https	54	Ether / IP / TCP 192.168.1.10:4658 > 125.77.142.169:https A
78	2020-03-18 01:04:58	192.168.1.10	125.77.142.169	Https	571	Ether / IP / TCP 192.168.1.10:4658 > 125.77.142.169:https PA / Raw
79	2020-03-18 01:04:58	125.77.142.169	192.168.1.10	Https	60	Ether / IP / TCP 125.77.142.169:https > 192.168.1.10:4658 A / Padding
80	2020-03-18 01:04:58	125.77.142.169	192.168.1.10	Https	204	Ether / IP / TCP 125.77.142.169:https > 192.168.1.10:4658 PA / Raw
81	2020-03-18 01:04:58	114.55.207.244	192.168.1.10	Https	66	Ether / IP / TCP 114.55.207.244:https > 192.168.1.10:4657 SA
82	2020-03-18 01:04:58	192.168.1.10	114.55.207.244	Https	54	Ether / IP / TCP 192.168.1.10:4657 > 114.55.207.244:https A
83	2020-03-18 01:04:58	192.168.1.10	114.55.207.244	Https	571	Ether / IP / TCP 192.168.1.10:4657 > 114.55.207.244:https PA / Raw
84	2020-03-18 01:04:58	192.168.1.10	125.77.142.169	Https	105	Ether / IP / TCP 192.168.1.10:4658 > 125.77.142.169:https PA / Raw
85	2020-03-18 01:04:58	114.55.207.244	192.168.1.10	Https	60	Ether / IP / TCP 114.55.207.244:https > 192.168.1.10:4657 A / Padding
86	2020-03-18 01:04:58	125.77.142.169	192.168.1.10	Https	123	Ether / IP / TCP 125.77.142.169:https > 192.168.1.10:4658 PA / Raw
87	2020-03-18 01:04:58	114.55.207.244	192.168.1.10	Https	1506	Ether / IP / TCP 114.55.207.244:https > 192.168.1.10:4657 A / Raw
88	2020-03-18 01:04:58	114.55.207.244	192.168.1.10	Https	1506	Ether / IP / TCP 114.55.207.244:https > 192.168.1.10:4657 A / Raw
89	2020-03-18 01:04:58	114.55.207.244	192.168.1.10	Https	233	Ether / IP / TCP 114.55.207.244:https > 192.168.1.10:4657 PA / Raw
90	2020-03-18 01:04:58	192.168.1.10	114.55.207.244	Https	54	Ether / IP / TCP 192.168.1.10:4657 > 114.55.207.244:https A
91	2020-03-18 01:04:58	192.168.1.10	114.55.207.244	Https	147	Ether / IP / TCP 192.168.1.10:4657 > 114.55.207.244:https PA / Raw
92	2020-03-18 01:04:58	192.168.1.10	114.55.207.244	Https	153	Ether / IP / TCP 192.168.1.10:4657 > 114.55.207.244:https PA / Raw
93	2020-03-18 01:04:58	192.168.1.10	114.55.207.244	Https	676	Ether / IP / TCP 192.168.1.10:4657 > 114.55.207.244:https PA / Raw
94	2020-03-18 01:04:58	114.55.207.244	192.168.1.10	Https	312	Ether / IP / TCP 114.55.207.244:https > 192.168.1.10:4657 PA / Raw
95	2020-03-18 01:04:58	114.55.207.244	192.168.1.10	Https	123	Ether / IP / TCP 114.55.207.244:https > 192.168.1.10:4657 PA / Raw
96	2020-03-18 01:04:58	192.168.1.10	114.55.207.244	Https	54	Ether / IP / TCP 192.168.1.10:4657 > 114.55.207.244:https A
97	2020-03-18 01:04:58	192.168.1.10	114.55.207.244	Https	92	Ether / IP / TCP 192.168.1.10:4657 > 114.55.207.244:https PA / Raw
98	2020-03-18 01:04:58	114.55.207.244	192.168.1.10	Https	60	Ether / IP / TCP 114.55.207.244:https > 192.168.1.10:4657 A / Padding
99	2020-03-18 01:04:58	114.55.207.244	192.168.1.10	Https	92	Ether / IP / TCP 114.55.207.244:https > 192.168.1.10:4657 PA / Raw
100	2020-03-18 01:04:58	192.168.1.10	125.77.142.169	Https	54	Ether / IP / TCP 192.168.1.10:4658 > 125.77.142.169:https A
101	2020-03-18 01:04:58	192.168.1.10	114.55.207.244	Https	54	Ether / IP / TCP 192.168.1.10:4657 > 114.55.207.244:https A
102	2020-03-18 01:04:58	114.55.207.244	192.168.1.10	Https	60	Ether / IP / TCP 114.55.207.244:https > 192.168.1.10:4657 A / Padding
103	2020-03-18 01:04:58	114.55.207.244	192.168.1.10	Https	1506	Ether / IP / TCP 114.55.207.244:https > 192.168.1.10:4657 A / Raw
104	2020-03-18 01:04:58	114.55.207.244	192.168.1.10	Https	1506	Ether / IP / TCP 114.55.207.244:https > 192.168.1.10:4657 A / Raw
105	2020-03-18 01:04:58	114.55.207.244	192.168.1.10	Https	1506	Ether / IP / TCP 114.55.207.244:https > 192.168.1.10:4657 A / Raw
106	2020-03-18 01:04:58	192.168.1.10	114.55.207.244	Https	54	Ether / IP / TCP 192.168.1.10:4657 > 114.55.207.244:https A
107	2020-03-18 01:04:58	114.55.207.244	192.168.1.10	Https	1506	Ether / IP / TCP 114.55.207.244:https > 192.168.1.10:4657 A / Raw
108	2020-03-18 01:04:58	114.55.207.244	192.168.1.10	Https	1506	Ether / IP / TCP 114.55.207.244:https > 192.168.1.10:4657 A / Raw
109	2020-03-18 01:04:58	114.55.207.244	192.168.1.10	Https	1506	Ether / IP / TCP 114.55.207.244:https > 192.168.1.10:4657 A / Raw
110	2020-03-18 01:04:58	192.168.1.10	114.55.207.244	Https	54	Ether / IP / TCP 192.168.1.10:4657 > 114.55.207.244:https A
111	2020-03-18 01:04:58	114.55.207.244	192.168.1.10	Https	1506	Ether / IP / TCP 114.55.207.244:https > 192.168.1.10:4657 A / Raw
112	2020-03-18 01:04:58	114.55.207.244	192.168.1.10	Https	1506	Ether / IP / TCP 114.55.207.244:https > 192.168.1.10:4657 A / Raw
113	2020-03-18 01:04:58	114.55.207.244	192.168.1.10	Https	1506	Ether / IP / TCP 114.55.207.244:https > 192.168.1.10:4657 A / Raw
114	2020-03-18 01:04:58	192.168.1.10	114.55.207.244	Https	54	Ether / IP / TCP 192.168.1.10:4657 > 114.55.207.244:https A
115	2020-03-18 01:04:58	114.55.207.244	192.168.1.10	Https	1506	Ether / IP / TCP 114.55.207.244:https > 192.168.1.10:4657 A / Raw
116	2020-03-18 01:04:58	192.168.1.10	114.55.207.244	Https	54	Ether / IP / TCP 192.168.1.10:4657 > 114.55.207.244:https A
117	2020-03-18 01:04:58	114.55.207.244	192.168.1.10	Https	1506	Ether / IP / TCP 114.55.207.244:https > 192.168.1.10:4657 A / Raw
118	2020-03-18 01:04:58	114.55.207.244	192.168.1.10	Https	1506	Ether / IP / TCP 114.55.207.244:https > 192.168.1.10:4657 A / Raw
119	2020-03-18 01:04:58	114.55.207.244	192.168.1.10	Https	1506	Ether / IP / TCP 114.55.207.244:https > 192.168.1.10:4657 A / Raw
120	2020-03-18 01:04:58	114.55.207.244	192.168.1.10	Https	1506	Ether / IP / TCP 114.55.207.244:https > 192.168.1.10:4657 A / Raw
121	2020-03-18 01:04:58	114.55.207.244	192.168.1.10	Https	1506	Ether / IP / TCP 114.55.207.244:https > 192.168.1.10:4657 A / Raw
122	2020-03-18 01:04:58	114.55.207.244	192.168.1.10	Https	1506	Ether / IP / TCP 114.55.207.244:https > 192.168.1.10:4657 A / Raw
123	2020-03-18 01:04:58	114.55.207.244	192.168.1.10	Https	1506	Ether / IP / TCP 114.55.207.244:https > 192.168.1.10:4657 A / Raw
124	2020-03-18 01:04:58	114.55.207.244	192.168.1.10	Https	1506	Ether / IP / TCP 114.55.207.244:https > 192.168.1.10:4657 A / Raw
125	2020-03-18 01:04:58	114.55.207.244	192.168.1.10	Https	1506	Ether / IP / TCP 114.55.207.244:https > 192.168.1.10:4657 A / Raw
126	2020-03-18 01:04:58	114.55.207.244	192.168.1.10	Https	1506	Ether / IP / TCP 114.55.207.244:https > 192.168.1.10:4657 A / Raw
127	2020-03-18 01:04:58	114.55.207.244	192.168.1.10	Https	1506	Ether / IP / TCP 114.55.207.244:https > 192.168.1.10:4657 A / Raw
128	2020-03-18 01:04:58	114.55.207.244	192.168.1.10	Https	1506	Ether / IP / TCP 114.55.207.244:https > 192.168.1.10:4657 A / Raw
129	2020-03-18 01:04:58	114.55.207.244	192.168.1.10	Https	1506	Ether / IP / TCP 114.55.207.244:https > 192.168.1.10:4657 A / Raw
130	2020-03-18 01:04:58	114.55.207.244	192.168.1.10	Https	1506	Ether / IP / TCP 114.55.207.244:https > 192.168.1.10:4657 A / Raw
131	2020-03-18 01:04:58	114.55.207.244	192.168.1.10	Https	1506	Ether / IP / TCP 114.55.207.244:https > 192.168.1.10:4657 A / Raw
132	2020-03-18 01:04:58	192.168.1.10	114.55.207.244	Https	54	Ether / IP / TCP 192.168.1.10:4657 > 114.55.207.244:https A
133	2020-03-18 01:04:58	114.55.207.244	192.168.1.10	Https	1506	Ether / IP / TCP 114.55.207.244:https > 192.168.1.10:4657 A / Raw
134	2020-03-18 01:04:58	114.55.207.244	192.168.1.10	Https	1506	Ether / IP / TCP 114.55.207.244:https > 192.168.1.10:4657 A / Raw
135	2020-03-18 01:04:58	114.55.207.244	192.168.1.10	Https	1506	Ether / IP / TCP 114.55.207.244:https > 192.168.1.10:4657 A / Raw
136	2020-03-18 01:04:58	114.55.207.244	192.168.1.10	Https	1506	Ether / IP / TCP 114.55.207.244:https > 192.168.1.10:4657 PA / Raw
137	2020-03-18 01:04:58	114.55.207.244	192.168.1.10	Https	1506	Ether / IP / TCP 114.55.207.244:https > 192.168.1.10:4657 A / Raw
138	2020-03-18 01:04:58	192.168.1.10	114.55.207.244	Https	54	Ether / IP / TCP 192.168.1.10:4657 > 114.55.207.244:https A
139	2020-03-18 01:04:58	192.168.1.10	14.215.177.39	Https	54	Ether / IP / TCP 192.168.1.10:4656 > 14.215.177.39:https FA
140	2020-03-18 01:04:58	192.168.1.10	125.77.142.169	Https	153	Ether / IP / TCP 192.168.1.10:4658 > 125.77.142.169:https PA / Raw
141	2020-03-18 01:04:58	192.168.1.10	125.77.142.169	Https	92	Ether / IP / TCP 192.168.1.10:4658 > 125.77.142.169:https PA / Raw
142	2020-03-18 01:04:58	192.168.1.10	125.77.142.169	Https	561	Ether / IP / TCP 192.168.1.10:4658 > 125.77.142.169:https PA / Raw
143	2020-03-18 01:04:58	125.77.142.169	192.168.1.10	Https	60	Ether / IP / TCP 125.77.142.169:https > 192.168.1.10:4658 A / Padding
144	2020-03-18 01:04:58	125.77.142.169	192.168.1.10	Https	92	Ether / IP / TCP 125.77.142.169:https > 192.168.1.10:4658 PA / Raw
145	2020-03-18 01:04:58	125.77.142.169	192.168.1.10	Https	582	Ether / IP / TCP 125.77.142.169:https > 192.168.1.10:4658 PA / Raw
146	2020-03-18 01:04:58	192.168.1.10	125.77.142.169	Https	54	Ether / IP / TCP 192.168.1.10:4658 > 125.77.142.169:https A
147	2020-03-18 01:04:58	114.55.207.244	192.168.1.10	Https	1506	Ether / IP / TCP 114.55.207.244:https > 192.168.1.10:4657 A / Raw
148	2020-03-18 01:04:58	114.55.207.244	192.168.1.10	Https	609	Ether / IP / TCP 114.55.207.244:https > 192.168.1.10:4657 PA / Raw
149	2020-03-18 01:04:58	192.168.1.10	114.55.207.244	Https	54	Ether / IP / TCP 192.168.1.10:4657 > 114.55.207.244:https A
150	2020-03-18 01:04:58	192.168.1.10	125.77.142.169	Https	167	Ether / IP / TCP 192.168.1.10:4658 > 125.77.142.169:https PA / Raw
151	2020-03-18 01:04:58	192.168.1.10	125.77.142.169	Https	167	Ether / IP / TCP 192.168.1.10:4658 > 125.77.142.169:https PA / Raw
152	2020-03-18 01:04:58	fe80::f141:b4f2:11de:b126	fe80::1	DNS	104	Ether / IPv6 / UDP / DNS Qry "b'uploadfiles.nowcoder.com.'" 
153	2020-03-18 01:04:58	fe80::f141:b4f2:11de:b126	fe80::1	DNS	104	Ether / IPv6 / UDP / DNS Qry "b'uploadfiles.nowcoder.com.'" 
154	2020-03-18 01:04:58	192.168.1.10	125.77.142.169	Https	164	Ether / IP / TCP 192.168.1.10:4658 > 125.77.142.169:https PA / Raw
155	2020-03-18 01:04:58	192.168.1.10	125.77.142.169	Https	175	Ether / IP / TCP 192.168.1.10:4658 > 125.77.142.169:https PA / Raw
156	2020-03-18 01:04:58	192.168.1.10	125.77.142.169	Https	160	Ether / IP / TCP 192.168.1.10:4658 > 125.77.142.169:https PA / Raw
157	2020-03-18 01:04:58	125.77.142.169	192.168.1.10	Https	332	Ether / IP / TCP 125.77.142.169:https > 192.168.1.10:4658 PA / Raw
158	2020-03-18 01:04:58	125.77.142.169	192.168.1.10	Https	1506	Ether / IP / TCP 125.77.142.169:https > 192.168.1.10:4658 A / Raw
159	2020-03-18 01:04:58	125.77.142.169	192.168.1.10	Https	1033	Ether / IP / TCP 125.77.142.169:https > 192.168.1.10:4658 PA / Raw
160	2020-03-18 01:04:58	125.77.142.169	192.168.1.10	Https	92	Ether / IP / TCP 125.77.142.169:https > 192.168.1.10:4658 PA / Raw
161	2020-03-18 01:04:58	192.168.1.10	125.77.142.169	Https	54	Ether / IP / TCP 192.168.1.10:4658 > 125.77.142.169:https A
162	2020-03-18 01:04:58	fe80::1	fe80::f141:b4f2:11de:b126	DNS	481	Ether / IPv6 / UDP / DNS Ans "b'uploadfiles.nowcoder.com.w.alikunlun.com.'" 
163	2020-03-18 01:04:58	fe80::1	fe80::f141:b4f2:11de:b126	DNS	207	Ether / IPv6 / UDP / DNS Ans "b'uploadfiles.nowcoder.com.w.alikunlun.com.'" 
164	2020-03-18 01:04:58	125.77.142.169	192.168.1.10	Https	60	Ether / IP / TCP 125.77.142.169:https > 192.168.1.10:4658 A / Padding
165	2020-03-18 01:04:58	125.77.142.169	192.168.1.10	Https	331	Ether / IP / TCP 125.77.142.169:https > 192.168.1.10:4658 PA / Raw
166	2020-03-18 01:04:58	125.77.142.169	192.168.1.10	Https	401	Ether / IP / TCP 125.77.142.169:https > 192.168.1.10:4658 PA / Raw
167	2020-03-18 01:04:58	125.77.142.169	192.168.1.10	Https	395	Ether / IP / TCP 125.77.142.169:https > 192.168.1.10:4658 PA / Raw
168	2020-03-18 01:04:58	192.168.1.10	125.77.142.169	Https	54	Ether / IP / TCP 192.168.1.10:4658 > 125.77.142.169:https A
169	2020-03-18 01:04:58	192.168.1.10	121.9.244.83	Https	66	Ether / IP / TCP 192.168.1.10:4659 > 121.9.244.83:https S
170	2020-03-18 01:04:58	121.9.244.83	192.168.1.10	Https	66	Ether / IP / TCP 121.9.244.83:https > 192.168.1.10:4659 SA
171	2020-03-18 01:04:58	192.168.1.10	121.9.244.83	Https	54	Ether / IP / TCP 192.168.1.10:4659 > 121.9.244.83:https A
172	2020-03-18 01:04:58	192.168.1.10	121.9.244.83	Https	571	Ether / IP / TCP 192.168.1.10:4659 > 121.9.244.83:https PA / Raw
173	2020-03-18 01:04:58	121.9.244.83	192.168.1.10	Https	60	Ether / IP / TCP 121.9.244.83:https > 192.168.1.10:4659 A / Padding
174	2020-03-18 01:04:58	121.9.244.83	192.168.1.10	Https	204	Ether / IP / TCP 121.9.244.83:https > 192.168.1.10:4659 PA / Raw
175	2020-03-18 01:04:58	192.168.1.10	121.9.244.83	Https	105	Ether / IP / TCP 192.168.1.10:4659 > 121.9.244.83:https PA / Raw
176	2020-03-18 01:04:58	192.168.1.10	121.9.244.83	Https	153	Ether / IP / TCP 192.168.1.10:4659 > 121.9.244.83:https PA / Raw
177	2020-03-18 01:04:58	192.168.1.10	121.9.244.83	Https	570	Ether / IP / TCP 192.168.1.10:4659 > 121.9.244.83:https PA / Raw
178	2020-03-18 01:04:58	192.168.1.10	121.9.244.83	Https	154	Ether / IP / TCP 192.168.1.10:4659 > 121.9.244.83:https PA / Raw
179	2020-03-18 01:04:58	192.168.1.10	121.9.244.83	Https	165	Ether / IP / TCP 192.168.1.10:4659 > 121.9.244.83:https PA / Raw
180	2020-03-18 01:04:58	192.168.1.10	121.9.244.83	Https	172	Ether / IP / TCP 192.168.1.10:4659 > 121.9.244.83:https PA / Raw
181	2020-03-18 01:04:58	192.168.1.10	121.9.244.83	Https	165	Ether / IP / TCP 192.168.1.10:4659 > 121.9.244.83:https PA / Raw
182	2020-03-18 01:04:58	192.168.1.10	121.9.244.83	Https	153	Ether / IP / TCP 192.168.1.10:4659 > 121.9.244.83:https PA / Raw
183	2020-03-18 01:04:58	192.168.1.10	121.9.244.83	Https	172	Ether / IP / TCP 192.168.1.10:4659 > 121.9.244.83:https PA / Raw
184	2020-03-18 01:04:58	192.168.1.10	121.9.244.83	Https	164	Ether / IP / TCP 192.168.1.10:4659 > 121.9.244.83:https PA / Raw
185	2020-03-18 01:04:58	192.168.1.10	121.9.244.83	Https	171	Ether / IP / TCP 192.168.1.10:4659 > 121.9.244.83:https PA / Raw
186	2020-03-18 01:04:58	192.168.1.10	121.9.244.83	Https	153	Ether / IP / TCP 192.168.1.10:4659 > 121.9.244.83:https PA / Raw
187	2020-03-18 01:04:58	192.168.1.10	121.9.244.83	Https	185	Ether / IP / TCP 192.168.1.10:4659 > 121.9.244.83:https PA / Raw
188	2020-03-18 01:04:58	192.168.1.10	121.9.244.83	Https	171	Ether / IP / TCP 192.168.1.10:4659 > 121.9.244.83:https PA / Raw
189	2020-03-18 01:04:58	192.168.1.10	121.9.244.83	Https	179	Ether / IP / TCP 192.168.1.10:4659 > 121.9.244.83:https PA / Raw
190	2020-03-18 01:04:58	192.168.1.10	121.9.244.83	Https	171	Ether / IP / TCP 192.168.1.10:4659 > 121.9.244.83:https PA / Raw
191	2020-03-18 01:04:58	192.168.1.10	121.9.244.83	Https	163	Ether / IP / TCP 192.168.1.10:4659 > 121.9.244.83:https PA / Raw
192	2020-03-18 01:04:58	192.168.1.10	121.9.244.83	Https	186	Ether / IP / TCP 192.168.1.10:4659 > 121.9.244.83:https PA / Raw
193	2020-03-18 01:04:58	192.168.1.10	121.9.244.83	Https	171	Ether / IP / TCP 192.168.1.10:4659 > 121.9.244.83:https PA / Raw
194	2020-03-18 01:04:58	192.168.1.10	121.9.244.83	Https	179	Ether / IP / TCP 192.168.1.10:4659 > 121.9.244.83:https PA / Raw
195	2020-03-18 01:04:58	121.9.244.83	192.168.1.10	Https	123	Ether / IP / TCP 121.9.244.83:https > 192.168.1.10:4659 PA / Raw
196	2020-03-18 01:04:58	192.168.1.10	121.9.244.83	Https	163	Ether / IP / TCP 192.168.1.10:4659 > 121.9.244.83:https PA / Raw
197	2020-03-18 01:04:58	192.168.1.10	121.9.244.83	Https	173	Ether / IP / TCP 192.168.1.10:4659 > 121.9.244.83:https PA / Raw
198	2020-03-18 01:04:58	192.168.1.10	121.9.244.83	Https	171	Ether / IP / TCP 192.168.1.10:4659 > 121.9.244.83:https PA / Raw
199	2020-03-18 01:04:58	192.168.1.10	121.9.244.83	Https	208	Ether / IP / TCP 192.168.1.10:4659 > 121.9.244.83:https PA / Raw
200	2020-03-18 01:04:58	192.168.1.10	121.9.244.83	Https	154	Ether / IP / TCP 192.168.1.10:4659 > 121.9.244.83:https PA / Raw
201	2020-03-18 01:04:58	192.168.1.10	121.9.244.83	Https	171	Ether / IP / TCP 192.168.1.10:4659 > 121.9.244.83:https PA / Raw
202	2020-03-18 01:04:58	192.168.1.10	121.9.244.83	Https	173	Ether / IP / TCP 192.168.1.10:4659 > 121.9.244.83:https PA / Raw
203	2020-03-18 01:04:58	192.168.1.10	121.9.244.83	Https	179	Ether / IP / TCP 192.168.1.10:4659 > 121.9.244.83:https PA / Raw
204	2020-03-18 01:04:58	192.168.1.10	121.9.244.83	Https	171	Ether / IP / TCP 192.168.1.10:4659 > 121.9.244.83:https PA / Raw
205	2020-03-18 01:04:58	192.168.1.10	121.9.244.83	Https	146	Ether / IP / TCP 192.168.1.10:4659 > 121.9.244.83:https PA / Raw
206	2020-03-18 01:04:58	192.168.1.10	121.9.244.83	Https	172	Ether / IP / TCP 192.168.1.10:4659 > 121.9.244.83:https PA / Raw
207	2020-03-18 01:04:58	192.168.1.10	121.9.244.83	Https	151	Ether / IP / TCP 192.168.1.10:4659 > 121.9.244.83:https PA / Raw
208	2020-03-18 01:04:58	192.168.1.10	121.9.244.83	Https	165	Ether / IP / TCP 192.168.1.10:4659 > 121.9.244.83:https PA / Raw
209	2020-03-18 01:04:58	192.168.1.10	121.9.244.83	Https	171	Ether / IP / TCP 192.168.1.10:4659 > 121.9.244.83:https PA / Raw
210	2020-03-18 01:04:58	192.168.1.10	121.9.244.83	Https	153	Ether / IP / TCP 192.168.1.10:4659 > 121.9.244.83:https PA / Raw
211	2020-03-18 01:04:58	192.168.1.10	121.9.244.83	Https	166	Ether / IP / TCP 192.168.1.10:4659 > 121.9.244.83:https PA / Raw
212	2020-03-18 01:04:58	192.168.1.10	121.9.244.83	Https	171	Ether / IP / TCP 192.168.1.10:4659 > 121.9.244.83:https PA / Raw
213	2020-03-18 01:04:58	192.168.1.10	121.9.244.83	Https	156	Ether / IP / TCP 192.168.1.10:4659 > 121.9.244.83:https PA / Raw
214	2020-03-18 01:04:58	192.168.1.10	121.9.244.83	Https	160	Ether / IP / TCP 192.168.1.10:4659 > 121.9.244.83:https PA / Raw
215	2020-03-18 01:04:58	192.168.1.10	121.9.244.83	Https	171	Ether / IP / TCP 192.168.1.10:4659 > 121.9.244.83:https PA / Raw
216	2020-03-18 01:04:58	192.168.1.10	121.9.244.83	Https	154	Ether / IP / TCP 192.168.1.10:4659 > 121.9.244.83:https PA / Raw
217	2020-03-18 01:04:58	121.9.244.83	192.168.1.10	Https	92	Ether / IP / TCP 121.9.244.83:https > 192.168.1.10:4659 PA / Raw
218	2020-03-18 01:04:58	121.9.244.83	192.168.1.10	Https	60	Ether / IP / TCP 121.9.244.83:https > 192.168.1.10:4659 A / Padding
219	2020-03-18 01:04:58	192.168.1.10	121.9.244.83	Https	92	Ether / IP / TCP 192.168.1.10:4659 > 121.9.244.83:https PA / Raw
220	2020-03-18 01:04:58	192.168.1.10	121.9.244.83	Https	171	Ether / IP / TCP 192.168.1.10:4659 > 121.9.244.83:https PA / Raw
221	2020-03-18 01:04:58	192.168.1.10	121.9.244.83	Https	179	Ether / IP / TCP 192.168.1.10:4659 > 121.9.244.83:https PA / Raw
222	2020-03-18 01:04:58	192.168.1.10	121.9.244.83	Https	152	Ether / IP / TCP 192.168.1.10:4659 > 121.9.244.83:https PA / Raw
223	2020-03-18 01:04:58	121.9.244.83	192.168.1.10	Https	60	Ether / IP / TCP 121.9.244.83:https > 192.168.1.10:4659 A / Padding
224	2020-03-18 01:04:58	121.9.244.83	192.168.1.10	Https	60	Ether / IP / TCP 121.9.244.83:https > 192.168.1.10:4659 A / Padding
225	2020-03-18 01:04:58	192.168.1.10	121.9.244.83	Https	175	Ether / IP / TCP 192.168.1.10:4659 > 121.9.244.83:https PA / Raw
226	2020-03-18 01:04:58	192.168.1.10	121.9.244.83	Https	154	Ether / IP / TCP 192.168.1.10:4659 > 121.9.244.83:https PA / Raw
227	2020-03-18 01:04:58	121.9.244.83	192.168.1.10	Https	60	Ether / IP / TCP 121.9.244.83:https > 192.168.1.10:4659 A / Padding
228	2020-03-18 01:04:58	121.9.244.83	192.168.1.10	Https	60	Ether / IP / TCP 121.9.244.83:https > 192.168.1.10:4659 A / Padding
229	2020-03-18 01:04:58	121.9.244.83	192.168.1.10	Https	60	Ether / IP / TCP 121.9.244.83:https > 192.168.1.10:4659 A / Padding
230	2020-03-18 01:04:58	121.9.244.83	192.168.1.10	Https	60	Ether / IP / TCP 121.9.244.83:https > 192.168.1.10:4659 A / Padding
231	2020-03-18 01:04:58	121.9.244.83	192.168.1.10	Https	60	Ether / IP / TCP 121.9.244.83:https > 192.168.1.10:4659 A / Padding
232	2020-03-18 01:04:58	121.9.244.83	192.168.1.10	Https	1506	Ether / IP / TCP 121.9.244.83:https > 192.168.1.10:4659 A / Raw
233	2020-03-18 01:04:58	121.9.244.83	192.168.1.10	Https	1506	Ether / IP / TCP 121.9.244.83:https > 192.168.1.10:4659 A / Raw
234	2020-03-18 01:04:58	121.9.244.83	192.168.1.10	Https	1409	Ether / IP / TCP 121.9.244.83:https > 192.168.1.10:4659 PA / Raw
235	2020-03-18 01:04:58	121.9.244.83	192.168.1.10	Https	92	Ether / IP / TCP 121.9.244.83:https > 192.168.1.10:4659 PA / Raw
236	2020-03-18 01:04:58	121.9.244.83	192.168.1.10	Https	1506	Ether / IP / TCP 121.9.244.83:https > 192.168.1.10:4659 A / Raw
237	2020-03-18 01:04:58	121.9.244.83	192.168.1.10	Https	1506	Ether / IP / TCP 121.9.244.83:https > 192.168.1.10:4659 A / Raw
238	2020-03-18 01:04:58	121.9.244.83	192.168.1.10	Https	801	Ether / IP / TCP 121.9.244.83:https > 192.168.1.10:4659 PA / Raw
239	2020-03-18 01:04:58	121.9.244.83	192.168.1.10	Https	92	Ether / IP / TCP 121.9.244.83:https > 192.168.1.10:4659 PA / Raw
240	2020-03-18 01:04:58	192.168.1.10	121.9.244.83	Https	54	Ether / IP / TCP 192.168.1.10:4659 > 121.9.244.83:https A
241	2020-03-18 01:04:58	192.168.1.10	121.9.244.83	Https	151	Ether / IP / TCP 192.168.1.10:4659 > 121.9.244.83:https PA / Raw
242	2020-03-18 01:04:58	192.168.1.10	121.9.244.83	Https	154	Ether / IP / TCP 192.168.1.10:4659 > 121.9.244.83:https PA / Raw
243	2020-03-18 01:04:58	121.9.244.83	192.168.1.10	Https	1506	Ether / IP / TCP 121.9.244.83:https > 192.168.1.10:4659 A / Raw
244	2020-03-18 01:04:58	192.168.1.10	121.9.244.83	Https	179	Ether / IP / TCP 192.168.1.10:4659 > 121.9.244.83:https PA / Raw
245	2020-03-18 01:04:58	192.168.1.10	121.9.244.83	Https	54	Ether / IP / TCP 192.168.1.10:4659 > 121.9.244.83:https A
246	2020-03-18 01:04:58	192.168.1.10	121.9.244.83	Https	172	Ether / IP / TCP 192.168.1.10:4659 > 121.9.244.83:https PA / Raw
247	2020-03-18 01:04:58	192.168.1.10	121.9.244.83	Https	172	Ether / IP / TCP 192.168.1.10:4659 > 121.9.244.83:https PA / Raw
248	2020-03-18 01:04:58	192.168.1.10	121.9.244.83	Https	155	Ether / IP / TCP 192.168.1.10:4659 > 121.9.244.83:https PA / Raw
249	2020-03-18 01:04:58	192.168.1.10	121.9.244.83	Https	189	Ether / IP / TCP 192.168.1.10:4659 > 121.9.244.83:https PA / Raw
250	2020-03-18 01:04:58	192.168.1.10	121.9.244.83	Https	163	Ether / IP / TCP 192.168.1.10:4659 > 121.9.244.83:https PA / Raw
251	2020-03-18 01:04:58	192.168.1.10	121.9.244.83	Https	161	Ether / IP / TCP 192.168.1.10:4659 > 121.9.244.83:https PA / Raw
252	2020-03-18 01:04:58	192.168.1.10	121.9.244.83	Https	175	Ether / IP / TCP 192.168.1.10:4659 > 121.9.244.83:https PA / Raw
253	2020-03-18 01:04:58	192.168.1.10	121.9.244.83	Https	155	Ether / IP / TCP 192.168.1.10:4659 > 121.9.244.83:https PA / Raw
254	2020-03-18 01:04:58	192.168.1.10	121.9.244.83	Https	160	Ether / IP / TCP 192.168.1.10:4659 > 121.9.244.83:https PA / Raw
255	2020-03-18 01:04:58	192.168.1.10	121.9.244.83	Https	171	Ether / IP / TCP 192.168.1.10:4659 > 121.9.244.83:https PA / Raw
256	2020-03-18 01:04:58	192.168.1.10	121.9.244.83	Https	180	Ether / IP / TCP 192.168.1.10:4659 > 121.9.244.83:https PA / Raw
257	2020-03-18 01:04:58	192.168.1.10	121.9.244.83	Https	171	Ether / IP / TCP 192.168.1.10:4659 > 121.9.244.83:https PA / Raw
258	2020-03-18 01:04:58	121.9.244.83	192.168.1.10	Https	1506	Ether / IP / TCP 121.9.244.83:https > 192.168.1.10:4659 A / Raw
259	2020-03-18 01:04:58	121.9.244.83	192.168.1.10	Https	1506	Ether / IP / TCP 121.9.244.83:https > 192.168.1.10:4659 A / Raw
260	2020-03-18 01:04:58	121.9.244.83	192.168.1.10	Https	60	Ether / IP / TCP 121.9.244.83:https > 192.168.1.10:4659 A / Padding
261	2020-03-18 01:04:58	192.168.1.10	121.9.244.83	Https	54	Ether / IP / TCP 192.168.1.10:4659 > 121.9.244.83:https A
262	2020-03-18 01:04:58	192.168.1.10	121.9.244.83	Https	153	Ether / IP / TCP 192.168.1.10:4659 > 121.9.244.83:https PA / Raw
263	2020-03-18 01:04:58	192.168.1.10	121.9.244.83	Https	209	Ether / IP / TCP 192.168.1.10:4659 > 121.9.244.83:https PA / Raw
264	2020-03-18 01:04:58	192.168.1.10	121.9.244.83	Https	155	Ether / IP / TCP 192.168.1.10:4659 > 121.9.244.83:https PA / Raw
265	2020-03-18 01:04:58	192.168.1.10	121.9.244.83	Https	172	Ether / IP / TCP 192.168.1.10:4659 > 121.9.244.83:https PA / Raw
266	2020-03-18 01:04:58	192.168.1.10	121.9.244.83	Https	171	Ether / IP / TCP 192.168.1.10:4659 > 121.9.244.83:https PA / Raw
267	2020-03-18 01:04:58	192.168.1.10	121.9.244.83	Https	182	Ether / IP / TCP 192.168.1.10:4659 > 121.9.244.83:https PA / Raw
268	2020-03-18 01:04:58	192.168.1.10	121.9.244.83	Https	165	Ether / IP / TCP 192.168.1.10:4659 > 121.9.244.83:https PA / Raw
269	2020-03-18 01:04:58	192.168.1.10	121.9.244.83	Https	165	Ether / IP / TCP 192.168.1.10:4659 > 121.9.244.83:https PA / Raw
270	2020-03-18 01:04:58	192.168.1.10	121.9.244.83	Https	172	Ether / IP / TCP 192.168.1.10:4659 > 121.9.244.83:https PA / Raw
