1	2020-03-17 22:38:32	192.168.1.10	10.10.20.110	UDP	120	Ether / IP / UDP 192.168.1.10:59684 > 10.10.20.110:snmp / SNMP
2	2020-03-17 22:38:32	192.168.1.10	140.82.113.25	Https	55	Ether / IP / TCP 192.168.1.10:9647 > 140.82.113.25:https A / Raw
3	2020-03-17 22:38:33	140.82.113.25	192.168.1.10	Https	66	Ether / IP / TCP 140.82.113.25:https > 192.168.1.10:9647 A
4	2020-03-17 22:38:35	192.168.1.10	14.215.177.39	Https	54	Ether / IP / TCP 192.168.1.10:10985 > 14.215.177.39:https RA
5	2020-03-17 22:38:35	192.168.1.10	40.119.211.203	Https	153	Ether / IP / TCP 192.168.1.10:1310 > 40.119.211.203:https PA / Raw
6	2020-03-17 22:38:35	40.119.211.203	192.168.1.10	Https	223	Ether / IP / TCP 40.119.211.203:https > 192.168.1.10:1310 PA / Raw
7	2020-03-17 22:38:35	192.168.1.10	40.119.211.203	Https	54	Ether / IP / TCP 192.168.1.10:1310 > 40.119.211.203:https A
8	2020-03-17 22:38:35	192.168.1.10	14.215.177.39	Https	54	Ether / IP / TCP 192.168.1.10:10988 > 14.215.177.39:https FA
9	2020-03-17 22:38:36	139.99.69.89	192.168.1.10	Http	60	Ether / IP / TCP 139.99.69.89:http > 192.168.1.10:10898 A / Padding
10	2020-03-17 22:38:36	192.168.1.10	139.99.69.89	Http	54	Ether / IP / TCP 192.168.1.10:10898 > 139.99.69.89:http A
11	2020-03-17 22:38:36	192.168.1.10	14.215.177.39	Https	66	Ether / IP / TCP 192.168.1.10:10989 > 14.215.177.39:https S
12	2020-03-17 22:38:36	14.215.177.39	192.168.1.10	Https	66	Ether / IP / TCP 14.215.177.39:https > 192.168.1.10:10989 SA
13	2020-03-17 22:38:36	192.168.1.10	14.215.177.39	Https	54	Ether / IP / TCP 192.168.1.10:10989 > 14.215.177.39:https A
14	2020-03-17 22:38:36	192.168.1.10	14.215.177.39	Https	54	Ether / IP / TCP 192.168.1.10:10989 > 14.215.177.39:https FA
15	2020-03-17 22:38:36	192.168.1.10	14.215.177.39	Https	54	Ether / IP / TCP 192.168.1.10:10989 > 14.215.177.39:https FA
16	2020-03-17 22:38:37	192.168.1.10	14.215.177.39	Https	54	Ether / IP / TCP 192.168.1.10:10989 > 14.215.177.39:https FA
17	2020-03-17 22:38:38	9c:d2:4b:38:91:c1	00:e0:4c:68:00:2d	ARP	60	Ether / ARP who has 192.168.1.10 says 192.168.1.1 / Padding
18	2020-03-17 22:38:38	00:e0:4c:68:00:2d	9c:d2:4b:38:91:c1	ARP	42	Ether / ARP is at 00:e0:4c:68:00:2d says 192.168.1.10
19	2020-03-17 22:38:38	192.168.1.10	14.215.177.39	Https	54	Ether / IP / TCP 192.168.1.10:10989 > 14.215.177.39:https FA
20	2020-03-17 22:38:40	192.168.1.10	14.215.177.39	Https	54	Ether / IP / TCP 192.168.1.10:10989 > 14.215.177.39:https FA
21	2020-03-17 22:38:40	140.82.113.25	192.168.1.10	Https	78	Ether / IP / TCP 140.82.113.25:https > 192.168.1.10:9647 PA / Raw
22	2020-03-17 22:38:40	192.168.1.10	140.82.113.25	Https	82	Ether / IP / TCP 192.168.1.10:9647 > 140.82.113.25:https PA / Raw
23	2020-03-17 22:38:41	192.168.1.10	140.82.113.25	Https	82	Ether / IP / TCP 192.168.1.10:9647 > 140.82.113.25:https PA / Raw
24	2020-03-17 22:38:41	140.82.113.25	192.168.1.10	Https	66	Ether / IP / TCP 140.82.113.25:https > 192.168.1.10:9647 A
25	2020-03-17 22:38:42	192.168.1.10	10.10.20.110	UDP	120	Ether / IP / UDP 192.168.1.10:59684 > 10.10.20.110:snmp / SNMP
26	2020-03-17 22:38:43	fe80::1	ff02::1	ICMPv6	134	Ether / IPv6 / ICMPv6ND_RA / ICMPv6NDOptPrefixInfo / ICMPv6NDOptRDNSS / ICMPv6 Neighbor Discovery Option - Source Link-Layer Address 9c:d2:4b:38:91:c1
27	2020-03-17 22:38:45	192.168.1.10	161.117.236.80	TCP	66	Ether / IP / TCP 192.168.1.10:10992 > 161.117.236.80:20395 S
28	2020-03-17 22:38:45	192.168.1.10	14.215.177.39	Https	54	Ether / IP / TCP 192.168.1.10:10988 > 14.215.177.39:https RA
29	2020-03-17 22:38:45	161.117.236.80	192.168.1.10	TCP	66	Ether / IP / TCP 161.117.236.80:20395 > 192.168.1.10:10992 SA
30	2020-03-17 22:38:45	192.168.1.10	161.117.236.80	TCP	54	Ether / IP / TCP 192.168.1.10:10992 > 161.117.236.80:20395 A
31	2020-03-17 22:38:45	192.168.1.10	161.117.236.80	TCP	318	Ether / IP / TCP 192.168.1.10:10992 > 161.117.236.80:20395 PA / Raw
32	2020-03-17 22:38:45	192.168.1.10	161.117.236.80	TCP	717	Ether / IP / TCP 192.168.1.10:10992 > 161.117.236.80:20395 PA / Raw
33	2020-03-17 22:38:45	161.117.236.80	192.168.1.10	TCP	60	Ether / IP / TCP 161.117.236.80:20395 > 192.168.1.10:10992 A / Padding
34	2020-03-17 22:38:45	161.117.236.80	192.168.1.10	TCP	60	Ether / IP / TCP 161.117.236.80:20395 > 192.168.1.10:10992 A / Padding
35	2020-03-17 22:38:45	161.117.236.80	192.168.1.10	TCP	106	Ether / IP / TCP 161.117.236.80:20395 > 192.168.1.10:10992 PA / Raw
36	2020-03-17 22:38:45	192.168.1.10	161.117.236.80	TCP	54	Ether / IP / TCP 192.168.1.10:10992 > 161.117.236.80:20395 A
37	2020-03-17 22:38:45	192.168.1.10	161.117.236.80	TCP	66	Ether / IP / TCP 192.168.1.10:10995 > 161.117.236.80:20395 S
38	2020-03-17 22:38:45	161.117.236.80	192.168.1.10	TCP	66	Ether / IP / TCP 161.117.236.80:20395 > 192.168.1.10:10995 SA
39	2020-03-17 22:38:45	192.168.1.10	161.117.236.80	TCP	54	Ether / IP / TCP 192.168.1.10:10995 > 161.117.236.80:20395 A
40	2020-03-17 22:38:45	192.168.1.10	161.117.236.80	TCP	794	Ether / IP / TCP 192.168.1.10:10995 > 161.117.236.80:20395 PA / Raw
41	2020-03-17 22:38:45	192.168.1.10	161.117.236.80	TCP	985	Ether / IP / TCP 192.168.1.10:10995 > 161.117.236.80:20395 PA / Raw
42	2020-03-17 22:38:45	192.168.1.10	219.133.60.246	UDP	1012	Ether / IP / UDP 192.168.1.10:54843 > 219.133.60.246:8000 / Raw
43	2020-03-17 22:38:45	161.117.236.80	192.168.1.10	TCP	1506	Ether / IP / TCP 161.117.236.80:20395 > 192.168.1.10:10992 PA / Raw
44	2020-03-17 22:38:45	219.133.60.246	192.168.1.10	UDP	356	Ether / IP / UDP 219.133.60.246:8000 > 192.168.1.10:54843 / Raw
45	2020-03-17 22:38:45	192.168.1.10	14.215.177.39	Https	54	Ether / IP / TCP 192.168.1.10:10989 > 14.215.177.39:https FA
46	2020-03-17 22:38:45	fe80::f141:b4f2:11de:b126	fe80::1	DNS	106	Ether / IPv6 / UDP / DNS Qry "b'pcs-sdk-server.alibaba.com.'" 
47	2020-03-17 22:38:45	fe80::f141:b4f2:11de:b126	fe80::1	DNS	106	Ether / IPv6 / UDP / DNS Qry "b'pcs-sdk-server.alibaba.com.'" 
48	2020-03-17 22:38:45	fe80::1	fe80::f141:b4f2:11de:b126	DNS	333	Ether / IPv6 / UDP / DNS Ans "b'na61-na62.wagbridge.alibaba.alibaba.com.'" 
49	2020-03-17 22:38:45	161.117.236.80	192.168.1.10	TCP	1482	Ether / IP / TCP 161.117.236.80:20395 > 192.168.1.10:10992 PA / Raw
50	2020-03-17 22:38:45	fe80::1	fe80::f141:b4f2:11de:b126	DNS	264	Ether / IPv6 / UDP / DNS Ans "b'na61-na62.wagbridge.alibaba.alibaba.com.'" 
51	2020-03-17 22:38:45	192.168.1.10	161.117.236.80	TCP	54	Ether / IP / TCP 192.168.1.10:10992 > 161.117.236.80:20395 A
52	2020-03-17 22:38:45	192.168.1.10	161.117.236.80	TCP	54	Ether / IP / TCP 192.168.1.10:10995 > 161.117.236.80:20395 FA
53	2020-03-17 22:38:45	192.168.1.10	161.117.236.80	TCP	488	Ether / IP / TCP 192.168.1.10:10992 > 161.117.236.80:20395 PA / Raw
54	2020-03-17 22:38:45	192.168.1.10	161.117.236.80	TCP	1437	Ether / IP / TCP 192.168.1.10:10992 > 161.117.236.80:20395 PA / Raw
55	2020-03-17 22:38:45	fe80::f141:b4f2:11de:b126	fe80::1	DNS	102	Ether / IPv6 / UDP / DNS Qry "b'analytics.yinxiang.com.'" 
56	2020-03-17 22:38:45	fe80::f141:b4f2:11de:b126	fe80::1	DNS	102	Ether / IPv6 / UDP / DNS Qry "b'analytics.yinxiang.com.'" 
57	2020-03-17 22:38:45	192.168.1.10	203.119.144.20	Http	66	Ether / IP / TCP 192.168.1.10:10996 > 203.119.144.20:http S
58	2020-03-17 22:38:45	fe80::1	fe80::f141:b4f2:11de:b126	DNS	496	Ether / IPv6 / UDP / DNS Ans "154.8.190.35" 
59	2020-03-17 22:38:45	fe80::1	fe80::f141:b4f2:11de:b126	DNS	175	Ether / IPv6 / UDP / DNS Ans 
60	2020-03-17 22:38:45	192.168.1.10	154.8.190.35	Https	66	Ether / IP / TCP 192.168.1.10:10997 > 154.8.190.35:https S
61	2020-03-17 22:38:45	161.117.236.80	192.168.1.10	TCP	60	Ether / IP / TCP 161.117.236.80:20395 > 192.168.1.10:10995 A / Padding
62	2020-03-17 22:38:45	161.117.236.80	192.168.1.10	TCP	60	Ether / IP / TCP 161.117.236.80:20395 > 192.168.1.10:10995 A / Padding
63	2020-03-17 22:38:45	192.168.1.10	161.117.236.80	TCP	591	Ether / IP / TCP 192.168.1.10:10992 > 161.117.236.80:20395 PA / Raw
64	2020-03-17 22:38:45	203.119.144.20	192.168.1.10	Http	66	Ether / IP / TCP 203.119.144.20:http > 192.168.1.10:10996 SA
65	2020-03-17 22:38:45	154.8.190.35	192.168.1.10	Https	66	Ether / IP / TCP 154.8.190.35:https > 192.168.1.10:10997 SA
66	2020-03-17 22:38:45	192.168.1.10	203.119.144.20	Http	54	Ether / IP / TCP 192.168.1.10:10996 > 203.119.144.20:http A
67	2020-03-17 22:38:45	192.168.1.10	154.8.190.35	Https	54	Ether / IP / TCP 192.168.1.10:10997 > 154.8.190.35:https A
68	2020-03-17 22:38:45	192.168.1.10	203.119.144.20	Http	181	Ether / IP / TCP / HTTP / 'POST' '/a' 'HTTP/1.1'
69	2020-03-17 22:38:45	192.168.1.10	203.119.144.20	Http	1494	Ether / IP / TCP 192.168.1.10:10996 > 203.119.144.20:http A / HTTP / Raw
70	2020-03-17 22:38:45	192.168.1.10	203.119.144.20	Http	552	Ether / IP / TCP 192.168.1.10:10996 > 203.119.144.20:http PA / HTTP / Raw
71	2020-03-17 22:38:45	192.168.1.10	154.8.190.35	Https	237	Ether / IP / TCP 192.168.1.10:10997 > 154.8.190.35:https PA / Raw
72	2020-03-17 22:38:45	161.117.236.80	192.168.1.10	TCP	1257	Ether / IP / TCP 161.117.236.80:20395 > 192.168.1.10:10995 PA / Raw
73	2020-03-17 22:38:45	192.168.1.10	161.117.236.80	TCP	54	Ether / IP / TCP 192.168.1.10:10995 > 161.117.236.80:20395 RA
74	2020-03-17 22:38:45	161.117.236.80	192.168.1.10	TCP	60	Ether / IP / TCP 161.117.236.80:20395 > 192.168.1.10:10992 A / Padding
75	2020-03-17 22:38:45	161.117.236.80	192.168.1.10	TCP	60	Ether / IP / TCP 161.117.236.80:20395 > 192.168.1.10:10992 A / Padding
76	2020-03-17 22:38:45	161.117.236.80	192.168.1.10	TCP	60	Ether / IP / TCP 161.117.236.80:20395 > 192.168.1.10:10995 FA / Padding
77	2020-03-17 22:38:45	154.8.190.35	192.168.1.10	Https	60	Ether / IP / TCP 154.8.190.35:https > 192.168.1.10:10997 A / Padding
78	2020-03-17 22:38:45	154.8.190.35	192.168.1.10	Https	1486	Ether / IP / TCP 154.8.190.35:https > 192.168.1.10:10997 A / Raw
79	2020-03-17 22:38:45	154.8.190.35	192.168.1.10	Https	1486	Ether / IP / TCP 154.8.190.35:https > 192.168.1.10:10997 A / Raw
80	2020-03-17 22:38:45	154.8.190.35	192.168.1.10	Https	744	Ether / IP / TCP 154.8.190.35:https > 192.168.1.10:10997 PA / Raw
81	2020-03-17 22:38:45	192.168.1.10	154.8.190.35	Https	54	Ether / IP / TCP 192.168.1.10:10997 > 154.8.190.35:https A
82	2020-03-17 22:38:45	203.119.144.20	192.168.1.10	Http	60	Ether / IP / TCP 203.119.144.20:http > 192.168.1.10:10996 A / Padding
83	2020-03-17 22:38:45	203.119.144.20	192.168.1.10	Http	60	Ether / IP / TCP 203.119.144.20:http > 192.168.1.10:10996 A / Padding
84	2020-03-17 22:38:45	203.119.144.20	192.168.1.10	Http	324	Ether / IP / TCP / HTTP / 'HTTP/1.1' '200' 'OK'
85	2020-03-17 22:38:45	203.119.144.20	192.168.1.10	Http	83	Ether / IP / TCP 203.119.144.20:http > 192.168.1.10:10996 PA / HTTP / Raw
86	2020-03-17 22:38:45	192.168.1.10	203.119.144.20	Http	54	Ether / IP / TCP 192.168.1.10:10996 > 203.119.144.20:http A
87	2020-03-17 22:38:45	161.117.236.80	192.168.1.10	TCP	737	Ether / IP / TCP 161.117.236.80:20395 > 192.168.1.10:10992 PA / Raw
88	2020-03-17 22:38:45	192.168.1.10	161.117.236.80	TCP	760	Ether / IP / TCP 192.168.1.10:10992 > 161.117.236.80:20395 PA / Raw
89	2020-03-17 22:38:45	192.168.1.10	154.8.190.35	Https	180	Ether / IP / TCP 192.168.1.10:10997 > 154.8.190.35:https PA / Raw
90	2020-03-17 22:38:45	161.117.236.80	192.168.1.10	TCP	1399	Ether / IP / TCP 161.117.236.80:20395 > 192.168.1.10:10992 PA / Raw
91	2020-03-17 22:38:45	192.168.1.10	161.117.236.80	TCP	54	Ether / IP / TCP 192.168.1.10:10992 > 161.117.236.80:20395 A
92	2020-03-17 22:38:45	192.168.1.10	161.117.236.80	TCP	307	Ether / IP / TCP 192.168.1.10:10992 > 161.117.236.80:20395 PA / Raw
93	2020-03-17 22:38:45	154.8.190.35	192.168.1.10	Https	328	Ether / IP / TCP 154.8.190.35:https > 192.168.1.10:10997 PA / Raw
94	2020-03-17 22:38:45	192.168.1.10	154.8.190.35	Https	303	Ether / IP / TCP 192.168.1.10:10997 > 154.8.190.35:https PA / Raw
95	2020-03-17 22:38:45	161.117.236.80	192.168.1.10	TCP	1506	Ether / IP / TCP 161.117.236.80:20395 > 192.168.1.10:10992 A / Raw
96	2020-03-17 22:38:45	161.117.236.80	192.168.1.10	TCP	1506	Ether / IP / TCP 161.117.236.80:20395 > 192.168.1.10:10992 A / Raw
97	2020-03-17 22:38:45	192.168.1.10	161.117.236.80	TCP	54	Ether / IP / TCP 192.168.1.10:10992 > 161.117.236.80:20395 A
98	2020-03-17 22:38:45	161.117.236.80	192.168.1.10	TCP	1506	Ether / IP / TCP 161.117.236.80:20395 > 192.168.1.10:10992 A / Raw
99	2020-03-17 22:38:45	161.117.236.80	192.168.1.10	TCP	1506	Ether / IP / TCP 161.117.236.80:20395 > 192.168.1.10:10992 A / Raw
100	2020-03-17 22:38:45	192.168.1.10	161.117.236.80	TCP	54	Ether / IP / TCP 192.168.1.10:10992 > 161.117.236.80:20395 A
101	2020-03-17 22:38:45	161.117.236.80	192.168.1.10	TCP	1506	Ether / IP / TCP 161.117.236.80:20395 > 192.168.1.10:10992 A / Raw
102	2020-03-17 22:38:45	161.117.236.80	192.168.1.10	TCP	1506	Ether / IP / TCP 161.117.236.80:20395 > 192.168.1.10:10992 A / Raw
103	2020-03-17 22:38:45	192.168.1.10	161.117.236.80	TCP	54	Ether / IP / TCP 192.168.1.10:10992 > 161.117.236.80:20395 A
104	2020-03-17 22:38:45	161.117.236.80	192.168.1.10	TCP	1506	Ether / IP / TCP 161.117.236.80:20395 > 192.168.1.10:10992 A / Raw
105	2020-03-17 22:38:45	161.117.236.80	192.168.1.10	TCP	1506	Ether / IP / TCP 161.117.236.80:20395 > 192.168.1.10:10992 A / Raw
106	2020-03-17 22:38:45	192.168.1.10	161.117.236.80	TCP	54	Ether / IP / TCP 192.168.1.10:10992 > 161.117.236.80:20395 A
107	2020-03-17 22:38:45	161.117.236.80	192.168.1.10	TCP	1506	Ether / IP / TCP 161.117.236.80:20395 > 192.168.1.10:10992 A / Raw
108	2020-03-17 22:38:45	161.117.236.80	192.168.1.10	TCP	1506	Ether / IP / TCP 161.117.236.80:20395 > 192.168.1.10:10992 A / Raw
109	2020-03-17 22:38:45	192.168.1.10	161.117.236.80	TCP	54	Ether / IP / TCP 192.168.1.10:10992 > 161.117.236.80:20395 A
110	2020-03-17 22:38:45	161.117.236.80	192.168.1.10	TCP	1506	Ether / IP / TCP 161.117.236.80:20395 > 192.168.1.10:10992 A / Raw
111	2020-03-17 22:38:45	192.168.1.10	161.117.236.80	TCP	54	Ether / IP / TCP 192.168.1.10:10992 > 161.117.236.80:20395 A
112	2020-03-17 22:38:45	161.117.236.80	192.168.1.10	TCP	1506	Ether / IP / TCP 161.117.236.80:20395 > 192.168.1.10:10992 A / Raw
113	2020-03-17 22:38:45	161.117.236.80	192.168.1.10	TCP	1506	Ether / IP / TCP 161.117.236.80:20395 > 192.168.1.10:10992 A / Raw
114	2020-03-17 22:38:45	192.168.1.10	161.117.236.80	TCP	54	Ether / IP / TCP 192.168.1.10:10992 > 161.117.236.80:20395 A
115	2020-03-17 22:38:45	154.8.190.35	192.168.1.10	Https	352	Ether / IP / TCP 154.8.190.35:https > 192.168.1.10:10997 PA / Raw
116	2020-03-17 22:38:45	154.8.190.35	192.168.1.10	Https	88	Ether / IP / TCP 154.8.190.35:https > 192.168.1.10:10997 PA / Raw
117	2020-03-17 22:38:45	192.168.1.10	154.8.190.35	Https	54	Ether / IP / TCP 192.168.1.10:10997 > 154.8.190.35:https A
118	2020-03-17 22:38:45	192.168.1.10	154.8.190.35	Https	54	Ether / IP / TCP 192.168.1.10:10997 > 154.8.190.35:https FA
119	2020-03-17 22:38:45	161.117.236.80	192.168.1.10	TCP	1506	Ether / IP / TCP 161.117.236.80:20395 > 192.168.1.10:10992 A / Raw
120	2020-03-17 22:38:45	161.117.236.80	192.168.1.10	TCP	1506	Ether / IP / TCP 161.117.236.80:20395 > 192.168.1.10:10992 A / Raw
121	2020-03-17 22:38:45	192.168.1.10	161.117.236.80	TCP	54	Ether / IP / TCP 192.168.1.10:10992 > 161.117.236.80:20395 A
122	2020-03-17 22:38:45	154.8.190.35	192.168.1.10	Https	60	Ether / IP / TCP 154.8.190.35:https > 192.168.1.10:10997 FA / Padding
123	2020-03-17 22:38:45	192.168.1.10	154.8.190.35	Https	54	Ether / IP / TCP 192.168.1.10:10997 > 154.8.190.35:https A
124	2020-03-17 22:38:45	161.117.236.80	192.168.1.10	TCP	1506	Ether / IP / TCP 161.117.236.80:20395 > 192.168.1.10:10992 A / Raw
125	2020-03-17 22:38:45	161.117.236.80	192.168.1.10	TCP	1506	Ether / IP / TCP 161.117.236.80:20395 > 192.168.1.10:10992 A / Raw
126	2020-03-17 22:38:45	192.168.1.10	161.117.236.80	TCP	54	Ether / IP / TCP 192.168.1.10:10992 > 161.117.236.80:20395 A
127	2020-03-17 22:38:45	161.117.236.80	192.168.1.10	TCP	1506	Ether / IP / TCP 161.117.236.80:20395 > 192.168.1.10:10992 A / Raw
128	2020-03-17 22:38:45	161.117.236.80	192.168.1.10	TCP	1506	Ether / IP / TCP 161.117.236.80:20395 > 192.168.1.10:10992 A / Raw
129	2020-03-17 22:38:45	192.168.1.10	161.117.236.80	TCP	54	Ether / IP / TCP 192.168.1.10:10992 > 161.117.236.80:20395 A
130	2020-03-17 22:38:45	161.117.236.80	192.168.1.10	TCP	1506	Ether / IP / TCP 161.117.236.80:20395 > 192.168.1.10:10992 A / Raw
131	2020-03-17 22:38:45	161.117.236.80	192.168.1.10	TCP	1506	Ether / IP / TCP 161.117.236.80:20395 > 192.168.1.10:10992 A / Raw
132	2020-03-17 22:38:45	192.168.1.10	161.117.236.80	TCP	54	Ether / IP / TCP 192.168.1.10:10992 > 161.117.236.80:20395 A
133	2020-03-17 22:38:45	161.117.236.80	192.168.1.10	TCP	1506	Ether / IP / TCP 161.117.236.80:20395 > 192.168.1.10:10992 A / Raw
134	2020-03-17 22:38:45	161.117.236.80	192.168.1.10	TCP	1506	Ether / IP / TCP 161.117.236.80:20395 > 192.168.1.10:10992 A / Raw
135	2020-03-17 22:38:45	192.168.1.10	161.117.236.80	TCP	54	Ether / IP / TCP 192.168.1.10:10992 > 161.117.236.80:20395 A
136	2020-03-17 22:38:45	161.117.236.80	192.168.1.10	TCP	1506	Ether / IP / TCP 161.117.236.80:20395 > 192.168.1.10:10992 A / Raw
137	2020-03-17 22:38:45	161.117.236.80	192.168.1.10	TCP	1506	Ether / IP / TCP 161.117.236.80:20395 > 192.168.1.10:10992 A / Raw
138	2020-03-17 22:38:45	192.168.1.10	161.117.236.80	TCP	54	Ether / IP / TCP 192.168.1.10:10992 > 161.117.236.80:20395 A
139	2020-03-17 22:38:45	161.117.236.80	192.168.1.10	TCP	1506	Ether / IP / TCP 161.117.236.80:20395 > 192.168.1.10:10992 A / Raw
140	2020-03-17 22:38:45	161.117.236.80	192.168.1.10	TCP	1506	Ether / IP / TCP 161.117.236.80:20395 > 192.168.1.10:10992 A / Raw
141	2020-03-17 22:38:45	192.168.1.10	161.117.236.80	TCP	54	Ether / IP / TCP 192.168.1.10:10992 > 161.117.236.80:20395 A
142	2020-03-17 22:38:45	161.117.236.80	192.168.1.10	TCP	1506	Ether / IP / TCP 161.117.236.80:20395 > 192.168.1.10:10992 A / Raw
143	2020-03-17 22:38:45	161.117.236.80	192.168.1.10	TCP	1506	Ether / IP / TCP 161.117.236.80:20395 > 192.168.1.10:10992 A / Raw
144	2020-03-17 22:38:45	192.168.1.10	161.117.236.80	TCP	54	Ether / IP / TCP 192.168.1.10:10992 > 161.117.236.80:20395 A
145	2020-03-17 22:38:45	161.117.236.80	192.168.1.10	TCP	1506	Ether / IP / TCP 161.117.236.80:20395 > 192.168.1.10:10992 A / Raw
146	2020-03-17 22:38:45	161.117.236.80	192.168.1.10	TCP	1078	Ether / IP / TCP 161.117.236.80:20395 > 192.168.1.10:10992 PA / Raw
147	2020-03-17 22:38:45	192.168.1.10	161.117.236.80	TCP	54	Ether / IP / TCP 192.168.1.10:10992 > 161.117.236.80:20395 A
148	2020-03-17 22:38:46	192.168.1.10	161.117.236.80	TCP	66	Ether / IP / TCP 192.168.1.10:11001 > 161.117.236.80:20395 S
149	2020-03-17 22:38:46	192.168.1.10	161.117.236.80	TCP	66	Ether / IP / TCP 192.168.1.10:11003 > 161.117.236.80:20395 S
150	2020-03-17 22:38:46	192.168.1.10	161.117.236.80	TCP	66	Ether / IP / TCP 192.168.1.10:11006 > 161.117.236.80:20395 S
151	2020-03-17 22:38:46	161.117.236.80	192.168.1.10	TCP	66	Ether / IP / TCP 161.117.236.80:20395 > 192.168.1.10:11001 SA
152	2020-03-17 22:38:46	192.168.1.10	161.117.236.80	TCP	54	Ether / IP / TCP 192.168.1.10:11001 > 161.117.236.80:20395 A
153	2020-03-17 22:38:46	161.117.236.80	192.168.1.10	TCP	66	Ether / IP / TCP 161.117.236.80:20395 > 192.168.1.10:11003 SA
154	2020-03-17 22:38:46	192.168.1.10	161.117.236.80	TCP	54	Ether / IP / TCP 192.168.1.10:11003 > 161.117.236.80:20395 A
155	2020-03-17 22:38:46	192.168.1.10	161.117.236.80	TCP	299	Ether / IP / TCP 192.168.1.10:11003 > 161.117.236.80:20395 PA / Raw
156	2020-03-17 22:38:46	192.168.1.10	161.117.236.80	TCP	808	Ether / IP / TCP 192.168.1.10:11001 > 161.117.236.80:20395 PA / Raw
157	2020-03-17 22:38:46	192.168.1.10	161.117.236.80	TCP	590	Ether / IP / TCP 192.168.1.10:11001 > 161.117.236.80:20395 PA / Raw
158	2020-03-17 22:38:46	192.168.1.10	161.117.236.80	TCP	1001	Ether / IP / TCP 192.168.1.10:11003 > 161.117.236.80:20395 PA / Raw
159	2020-03-17 22:38:46	161.117.236.80	192.168.1.10	TCP	66	Ether / IP / TCP 161.117.236.80:20395 > 192.168.1.10:11006 SA
160	2020-03-17 22:38:46	192.168.1.10	161.117.236.80	TCP	54	Ether / IP / TCP 192.168.1.10:11006 > 161.117.236.80:20395 A
161	2020-03-17 22:38:46	192.168.1.10	161.117.236.80	TCP	721	Ether / IP / TCP 192.168.1.10:11006 > 161.117.236.80:20395 PA / Raw
162	2020-03-17 22:38:46	192.168.1.10	161.117.236.80	TCP	685	Ether / IP / TCP 192.168.1.10:11006 > 161.117.236.80:20395 PA / Raw
163	2020-03-17 22:38:46	192.168.1.10	14.215.177.39	Https	66	Ether / IP / TCP 192.168.1.10:11007 > 14.215.177.39:https S
164	2020-03-17 22:38:46	14.215.177.39	192.168.1.10	Https	66	Ether / IP / TCP 14.215.177.39:https > 192.168.1.10:11007 SA
165	2020-03-17 22:38:46	192.168.1.10	14.215.177.39	Https	54	Ether / IP / TCP 192.168.1.10:11007 > 14.215.177.39:https A
166	2020-03-17 22:38:46	192.168.1.10	14.215.177.39	Https	54	Ether / IP / TCP 192.168.1.10:11007 > 14.215.177.39:https FA
167	2020-03-17 22:38:46	161.117.236.80	192.168.1.10	TCP	60	Ether / IP / TCP 161.117.236.80:20395 > 192.168.1.10:11003 A / Padding
168	2020-03-17 22:38:46	161.117.236.80	192.168.1.10	TCP	1440	Ether / IP / TCP 161.117.236.80:20395 > 192.168.1.10:11003 PA / Raw
169	2020-03-17 22:38:46	161.117.236.80	192.168.1.10	TCP	60	Ether / IP / TCP 161.117.236.80:20395 > 192.168.1.10:11001 A / Padding
170	2020-03-17 22:38:46	161.117.236.80	192.168.1.10	TCP	60	Ether / IP / TCP 161.117.236.80:20395 > 192.168.1.10:11001 A / Padding
171	2020-03-17 22:38:46	161.117.236.80	192.168.1.10	TCP	951	Ether / IP / TCP 161.117.236.80:20395 > 192.168.1.10:11001 PA / Raw
172	2020-03-17 22:38:46	161.117.236.80	192.168.1.10	TCP	60	Ether / IP / TCP 161.117.236.80:20395 > 192.168.1.10:11006 A / Padding
173	2020-03-17 22:38:46	161.117.236.80	192.168.1.10	TCP	60	Ether / IP / TCP 161.117.236.80:20395 > 192.168.1.10:11006 A / Padding
174	2020-03-17 22:38:46	161.117.236.80	192.168.1.10	TCP	614	Ether / IP / TCP 161.117.236.80:20395 > 192.168.1.10:11006 PA / Raw
175	2020-03-17 22:38:46	161.117.236.80	192.168.1.10	TCP	1506	Ether / IP / TCP 161.117.236.80:20395 > 192.168.1.10:11003 A / Raw
176	2020-03-17 22:38:46	161.117.236.80	192.168.1.10	TCP	1499	Ether / IP / TCP 161.117.236.80:20395 > 192.168.1.10:11003 PA / Raw
177	2020-03-17 22:38:46	192.168.1.10	161.117.236.80	TCP	54	Ether / IP / TCP 192.168.1.10:11003 > 161.117.236.80:20395 A
178	2020-03-17 22:38:46	161.117.236.80	192.168.1.10	TCP	1506	Ether / IP / TCP 161.117.236.80:20395 > 192.168.1.10:11001 A / Raw
179	2020-03-17 22:38:46	161.117.236.80	192.168.1.10	TCP	1498	Ether / IP / TCP 161.117.236.80:20395 > 192.168.1.10:11001 PA / Raw
180	2020-03-17 22:38:46	192.168.1.10	161.117.236.80	TCP	54	Ether / IP / TCP 192.168.1.10:11001 > 161.117.236.80:20395 A
181	2020-03-17 22:38:46	161.117.236.80	192.168.1.10	TCP	1031	Ether / IP / TCP 161.117.236.80:20395 > 192.168.1.10:11003 PA / Raw
182	2020-03-17 22:38:46	192.168.1.10	161.117.236.80	TCP	54	Ether / IP / TCP 192.168.1.10:11003 > 161.117.236.80:20395 A
183	2020-03-17 22:38:46	161.117.236.80	192.168.1.10	TCP	1062	Ether / IP / TCP 161.117.236.80:20395 > 192.168.1.10:11001 PA / Raw
184	2020-03-17 22:38:46	192.168.1.10	161.117.236.80	TCP	54	Ether / IP / TCP 192.168.1.10:11001 > 161.117.236.80:20395 A
185	2020-03-17 22:38:46	161.117.236.80	192.168.1.10	TCP	1506	Ether / IP / TCP 161.117.236.80:20395 > 192.168.1.10:11006 A / Raw
186	2020-03-17 22:38:46	161.117.236.80	192.168.1.10	TCP	1505	Ether / IP / TCP 161.117.236.80:20395 > 192.168.1.10:11006 PA / Raw
187	2020-03-17 22:38:46	192.168.1.10	161.117.236.80	TCP	54	Ether / IP / TCP 192.168.1.10:11006 > 161.117.236.80:20395 A
188	2020-03-17 22:38:46	192.168.1.10	161.117.236.80	TCP	847	Ether / IP / TCP 192.168.1.10:11003 > 161.117.236.80:20395 PA / Raw
189	2020-03-17 22:38:46	161.117.236.80	192.168.1.10	TCP	1444	Ether / IP / TCP 161.117.236.80:20395 > 192.168.1.10:11006 PA / Raw
190	2020-03-17 22:38:46	192.168.1.10	161.117.236.80	TCP	1144	Ether / IP / TCP 192.168.1.10:11001 > 161.117.236.80:20395 PA / Raw
191	2020-03-17 22:38:46	192.168.1.10	161.117.236.80	TCP	54	Ether / IP / TCP 192.168.1.10:11006 > 161.117.236.80:20395 A
192	2020-03-17 22:38:46	192.168.1.10	161.117.236.80	TCP	1207	Ether / IP / TCP 192.168.1.10:11001 > 161.117.236.80:20395 PA / Raw
193	2020-03-17 22:38:46	192.168.1.10	161.117.236.80	TCP	305	Ether / IP / TCP 192.168.1.10:11006 > 161.117.236.80:20395 PA / Raw
194	2020-03-17 22:38:46	192.168.1.10	161.117.236.80	TCP	767	Ether / IP / TCP 192.168.1.10:11006 > 161.117.236.80:20395 PA / Raw
195	2020-03-17 22:38:46	161.117.236.80	192.168.1.10	TCP	60	Ether / IP / TCP 161.117.236.80:20395 > 192.168.1.10:11001 A / Padding
196	2020-03-17 22:38:46	161.117.236.80	192.168.1.10	TCP	1070	Ether / IP / TCP 161.117.236.80:20395 > 192.168.1.10:11003 PA / Raw
197	2020-03-17 22:38:46	161.117.236.80	192.168.1.10	TCP	1506	Ether / IP / TCP 161.117.236.80:20395 > 192.168.1.10:11001 A / Raw
198	2020-03-17 22:38:46	161.117.236.80	192.168.1.10	TCP	1506	Ether / IP / TCP 161.117.236.80:20395 > 192.168.1.10:11001 A / Raw
199	2020-03-17 22:38:46	192.168.1.10	161.117.236.80	TCP	54	Ether / IP / TCP 192.168.1.10:11001 > 161.117.236.80:20395 A
200	2020-03-17 22:38:46	161.117.236.80	192.168.1.10	TCP	60	Ether / IP / TCP 161.117.236.80:20395 > 192.168.1.10:11006 A / Padding
201	2020-03-17 22:38:46	161.117.236.80	192.168.1.10	TCP	1506	Ether / IP / TCP 161.117.236.80:20395 > 192.168.1.10:11001 A / Raw
202	2020-03-17 22:38:46	161.117.236.80	192.168.1.10	TCP	1506	Ether / IP / TCP 161.117.236.80:20395 > 192.168.1.10:11001 A / Raw
203	2020-03-17 22:38:46	192.168.1.10	161.117.236.80	TCP	54	Ether / IP / TCP 192.168.1.10:11001 > 161.117.236.80:20395 A
204	2020-03-17 22:38:46	161.117.236.80	192.168.1.10	TCP	883	Ether / IP / TCP 161.117.236.80:20395 > 192.168.1.10:11006 PA / Raw
205	2020-03-17 22:38:46	161.117.236.80	192.168.1.10	TCP	1506	Ether / IP / TCP 161.117.236.80:20395 > 192.168.1.10:11006 PA / Raw
206	2020-03-17 22:38:46	192.168.1.10	161.117.236.80	TCP	54	Ether / IP / TCP 192.168.1.10:11006 > 161.117.236.80:20395 A
207	2020-03-17 22:38:46	161.117.236.80	192.168.1.10	TCP	1461	Ether / IP / TCP 161.117.236.80:20395 > 192.168.1.10:11006 PA / Raw
208	2020-03-17 22:38:46	161.117.236.80	192.168.1.10	TCP	1506	Ether / IP / TCP 161.117.236.80:20395 > 192.168.1.10:11001 A / Raw
209	2020-03-17 22:38:46	161.117.236.80	192.168.1.10	TCP	1506	Ether / IP / TCP 161.117.236.80:20395 > 192.168.1.10:11001 A / Raw
210	2020-03-17 22:38:46	192.168.1.10	161.117.236.80	TCP	54	Ether / IP / TCP 192.168.1.10:11001 > 161.117.236.80:20395 A
211	2020-03-17 22:38:46	192.168.1.10	161.117.236.80	TCP	1040	Ether / IP / TCP 192.168.1.10:11006 > 161.117.236.80:20395 PA / Raw
212	2020-03-17 22:38:46	192.168.1.10	161.117.236.80	TCP	458	Ether / IP / TCP 192.168.1.10:11001 > 161.117.236.80:20395 PA / Raw
213	2020-03-17 22:38:46	161.117.236.80	192.168.1.10	TCP	1506	Ether / IP / TCP 161.117.236.80:20395 > 192.168.1.10:11001 A / Raw
214	2020-03-17 22:38:46	161.117.236.80	192.168.1.10	TCP	1506	Ether / IP / TCP 161.117.236.80:20395 > 192.168.1.10:11001 A / Raw
215	2020-03-17 22:38:46	192.168.1.10	161.117.236.80	TCP	54	Ether / IP / TCP 192.168.1.10:11001 > 161.117.236.80:20395 A
216	2020-03-17 22:38:46	192.168.1.10	161.117.236.80	TCP	141	Ether / IP / TCP 192.168.1.10:11006 > 161.117.236.80:20395 PA / Raw
217	2020-03-17 22:38:46	161.117.236.80	192.168.1.10	TCP	1506	Ether / IP / TCP 161.117.236.80:20395 > 192.168.1.10:11001 A / Raw
218	2020-03-17 22:38:46	161.117.236.80	192.168.1.10	TCP	1506	Ether / IP / TCP 161.117.236.80:20395 > 192.168.1.10:11001 A / Raw
219	2020-03-17 22:38:46	192.168.1.10	161.117.236.80	TCP	54	Ether / IP / TCP 192.168.1.10:11001 > 161.117.236.80:20395 A
220	2020-03-17 22:38:46	161.117.236.80	192.168.1.10	TCP	1506	Ether / IP / TCP 161.117.236.80:20395 > 192.168.1.10:11001 A / Raw
221	2020-03-17 22:38:46	161.117.236.80	192.168.1.10	TCP	1506	Ether / IP / TCP 161.117.236.80:20395 > 192.168.1.10:11001 A / Raw
222	2020-03-17 22:38:46	192.168.1.10	161.117.236.80	TCP	54	Ether / IP / TCP 192.168.1.10:11001 > 161.117.236.80:20395 A
223	2020-03-17 22:38:46	161.117.236.80	192.168.1.10	TCP	1506	Ether / IP / TCP 161.117.236.80:20395 > 192.168.1.10:11001 A / Raw
224	2020-03-17 22:38:46	161.117.236.80	192.168.1.10	TCP	1506	Ether / IP / TCP 161.117.236.80:20395 > 192.168.1.10:11001 A / Raw
225	2020-03-17 22:38:46	192.168.1.10	161.117.236.80	TCP	54	Ether / IP / TCP 192.168.1.10:11001 > 161.117.236.80:20395 A
226	2020-03-17 22:38:46	192.168.1.10	161.117.236.80	TCP	54	Ether / IP / TCP 192.168.1.10:11003 > 161.117.236.80:20395 A
227	2020-03-17 22:38:46	139.99.69.89	192.168.1.10	Http	60	Ether / IP / TCP 139.99.69.89:http > 192.168.1.10:10898 A / Padding
228	2020-03-17 22:38:46	192.168.1.10	139.99.69.89	Http	54	Ether / IP / TCP 192.168.1.10:10898 > 139.99.69.89:http A
229	2020-03-17 22:38:46	161.117.236.80	192.168.1.10	TCP	1506	Ether / IP / TCP 161.117.236.80:20395 > 192.168.1.10:11001 A / Raw
230	2020-03-17 22:38:46	161.117.236.80	192.168.1.10	TCP	1506	Ether / IP / TCP 161.117.236.80:20395 > 192.168.1.10:11001 A / Raw
231	2020-03-17 22:38:46	192.168.1.10	161.117.236.80	TCP	54	Ether / IP / TCP 192.168.1.10:11001 > 161.117.236.80:20395 A
232	2020-03-17 22:38:46	161.117.236.80	192.168.1.10	TCP	1506	Ether / IP / TCP 161.117.236.80:20395 > 192.168.1.10:11001 A / Raw
233	2020-03-17 22:38:46	161.117.236.80	192.168.1.10	TCP	1506	Ether / IP / TCP 161.117.236.80:20395 > 192.168.1.10:11001 A / Raw
234	2020-03-17 22:38:46	192.168.1.10	161.117.236.80	TCP	54	Ether / IP / TCP 192.168.1.10:11001 > 161.117.236.80:20395 A
235	2020-03-17 22:38:46	161.117.236.80	192.168.1.10	TCP	1506	Ether / IP / TCP 161.117.236.80:20395 > 192.168.1.10:11001 A / Raw
236	2020-03-17 22:38:46	161.117.236.80	192.168.1.10	TCP	1506	Ether / IP / TCP 161.117.236.80:20395 > 192.168.1.10:11001 A / Raw
237	2020-03-17 22:38:46	192.168.1.10	161.117.236.80	TCP	54	Ether / IP / TCP 192.168.1.10:11001 > 161.117.236.80:20395 A
238	2020-03-17 22:38:46	161.117.236.80	192.168.1.10	TCP	1506	Ether / IP / TCP 161.117.236.80:20395 > 192.168.1.10:11001 A / Raw
239	2020-03-17 22:38:46	161.117.236.80	192.168.1.10	TCP	1506	Ether / IP / TCP 161.117.236.80:20395 > 192.168.1.10:11001 A / Raw
240	2020-03-17 22:38:46	192.168.1.10	161.117.236.80	TCP	54	Ether / IP / TCP 192.168.1.10:11001 > 161.117.236.80:20395 A
241	2020-03-17 22:38:46	161.117.236.80	192.168.1.10	TCP	60	Ether / IP / TCP 161.117.236.80:20395 > 192.168.1.10:11006 A / Padding
242	2020-03-17 22:38:46	161.117.236.80	192.168.1.10	TCP	1506	Ether / IP / TCP 161.117.236.80:20395 > 192.168.1.10:11001 A / Raw
243	2020-03-17 22:38:46	161.117.236.80	192.168.1.10	TCP	1506	Ether / IP / TCP 161.117.236.80:20395 > 192.168.1.10:11001 A / Raw
244	2020-03-17 22:38:46	192.168.1.10	161.117.236.80	TCP	54	Ether / IP / TCP 192.168.1.10:11001 > 161.117.236.80:20395 A
245	2020-03-17 22:38:46	161.117.236.80	192.168.1.10	TCP	1506	Ether / IP / TCP 161.117.236.80:20395 > 192.168.1.10:11001 A / Raw
246	2020-03-17 22:38:46	161.117.236.80	192.168.1.10	TCP	1506	Ether / IP / TCP 161.117.236.80:20395 > 192.168.1.10:11001 A / Raw
247	2020-03-17 22:38:46	192.168.1.10	161.117.236.80	TCP	54	Ether / IP / TCP 192.168.1.10:11001 > 161.117.236.80:20395 A
248	2020-03-17 22:38:46	192.168.1.10	14.215.177.39	Https	54	Ether / IP / TCP 192.168.1.10:11007 > 14.215.177.39:https FA
249	2020-03-17 22:38:46	161.117.236.80	192.168.1.10	TCP	1506	Ether / IP / TCP 161.117.236.80:20395 > 192.168.1.10:11001 A / Raw
250	2020-03-17 22:38:46	161.117.236.80	192.168.1.10	TCP	1506	Ether / IP / TCP 161.117.236.80:20395 > 192.168.1.10:11001 A / Raw
251	2020-03-17 22:38:46	192.168.1.10	161.117.236.80	TCP	54	Ether / IP / TCP 192.168.1.10:11001 > 161.117.236.80:20395 A
252	2020-03-17 22:38:46	161.117.236.80	192.168.1.10	TCP	1506	Ether / IP / TCP 161.117.236.80:20395 > 192.168.1.10:11001 A / Raw
253	2020-03-17 22:38:46	161.117.236.80	192.168.1.10	TCP	1506	Ether / IP / TCP 161.117.236.80:20395 > 192.168.1.10:11001 A / Raw
254	2020-03-17 22:38:46	192.168.1.10	161.117.236.80	TCP	54	Ether / IP / TCP 192.168.1.10:11001 > 161.117.236.80:20395 A
255	2020-03-17 22:38:46	161.117.236.80	192.168.1.10	TCP	1506	Ether / IP / TCP 161.117.236.80:20395 > 192.168.1.10:11001 A / Raw
256	2020-03-17 22:38:46	161.117.236.80	192.168.1.10	TCP	1506	Ether / IP / TCP 161.117.236.80:20395 > 192.168.1.10:11001 A / Raw
257	2020-03-17 22:38:46	192.168.1.10	161.117.236.80	TCP	54	Ether / IP / TCP 192.168.1.10:11001 > 161.117.236.80:20395 A
258	2020-03-17 22:38:46	161.117.236.80	192.168.1.10	TCP	1506	Ether / IP / TCP 161.117.236.80:20395 > 192.168.1.10:11001 A / Raw
259	2020-03-17 22:38:46	161.117.236.80	192.168.1.10	TCP	1506	Ether / IP / TCP 161.117.236.80:20395 > 192.168.1.10:11001 A / Raw
260	2020-03-17 22:38:46	192.168.1.10	161.117.236.80	TCP	54	Ether / IP / TCP 192.168.1.10:11001 > 161.117.236.80:20395 A
261	2020-03-17 22:38:46	161.117.236.80	192.168.1.10	TCP	1506	Ether / IP / TCP 161.117.236.80:20395 > 192.168.1.10:11001 A / Raw
262	2020-03-17 22:38:46	161.117.236.80	192.168.1.10	TCP	1506	Ether / IP / TCP 161.117.236.80:20395 > 192.168.1.10:11001 A / Raw
263	2020-03-17 22:38:46	192.168.1.10	161.117.236.80	TCP	54	Ether / IP / TCP 192.168.1.10:11001 > 161.117.236.80:20395 A
264	2020-03-17 22:38:46	161.117.236.80	192.168.1.10	TCP	1506	Ether / IP / TCP 161.117.236.80:20395 > 192.168.1.10:11001 A / Raw
265	2020-03-17 22:38:46	161.117.236.80	192.168.1.10	TCP	1506	Ether / IP / TCP 161.117.236.80:20395 > 192.168.1.10:11001 A / Raw
266	2020-03-17 22:38:46	192.168.1.10	161.117.236.80	TCP	54	Ether / IP / TCP 192.168.1.10:11001 > 161.117.236.80:20395 A
267	2020-03-17 22:38:46	161.117.236.80	192.168.1.10	TCP	1506	Ether / IP / TCP 161.117.236.80:20395 > 192.168.1.10:11001 A / Raw
268	2020-03-17 22:38:46	161.117.236.80	192.168.1.10	TCP	1506	Ether / IP / TCP 161.117.236.80:20395 > 192.168.1.10:11001 A / Raw
269	2020-03-17 22:38:46	192.168.1.10	161.117.236.80	TCP	54	Ether / IP / TCP 192.168.1.10:11001 > 161.117.236.80:20395 A
270	2020-03-17 22:38:46	161.117.236.80	192.168.1.10	TCP	1506	Ether / IP / TCP 161.117.236.80:20395 > 192.168.1.10:11001 A / Raw
271	2020-03-17 22:38:46	161.117.236.80	192.168.1.10	TCP	1506	Ether / IP / TCP 161.117.236.80:20395 > 192.168.1.10:11001 A / Raw
272	2020-03-17 22:38:46	192.168.1.10	161.117.236.80	TCP	54	Ether / IP / TCP 192.168.1.10:11001 > 161.117.236.80:20395 A
273	2020-03-17 22:38:46	161.117.236.80	192.168.1.10	TCP	1506	Ether / IP / TCP 161.117.236.80:20395 > 192.168.1.10:11001 A / Raw
274	2020-03-17 22:38:46	161.117.236.80	192.168.1.10	TCP	1506	Ether / IP / TCP 161.117.236.80:20395 > 192.168.1.10:11001 A / Raw
275	2020-03-17 22:38:46	192.168.1.10	161.117.236.80	TCP	54	Ether / IP / TCP 192.168.1.10:11001 > 161.117.236.80:20395 A
276	2020-03-17 22:38:46	161.117.236.80	192.168.1.10	TCP	1506	Ether / IP / TCP 161.117.236.80:20395 > 192.168.1.10:11001 A / Raw
277	2020-03-17 22:38:46	161.117.236.80	192.168.1.10	TCP	1506	Ether / IP / TCP 161.117.236.80:20395 > 192.168.1.10:11001 A / Raw
278	2020-03-17 22:38:46	192.168.1.10	161.117.236.80	TCP	54	Ether / IP / TCP 192.168.1.10:11001 > 161.117.236.80:20395 A
279	2020-03-17 22:38:46	161.117.236.80	192.168.1.10	TCP	1506	Ether / IP / TCP 161.117.236.80:20395 > 192.168.1.10:11001 A / Raw
280	2020-03-17 22:38:46	161.117.236.80	192.168.1.10	TCP	1506	Ether / IP / TCP 161.117.236.80:20395 > 192.168.1.10:11001 A / Raw
281	2020-03-17 22:38:46	192.168.1.10	161.117.236.80	TCP	54	Ether / IP / TCP 192.168.1.10:11001 > 161.117.236.80:20395 A
282	2020-03-17 22:38:46	161.117.236.80	192.168.1.10	TCP	1138	Ether / IP / TCP 161.117.236.80:20395 > 192.168.1.10:11001 PA / Raw
283	2020-03-17 22:38:46	192.168.1.10	161.117.236.80	TCP	152	Ether / IP / TCP 192.168.1.10:11001 > 161.117.236.80:20395 PA / Raw
284	2020-03-17 22:38:46	161.117.236.80	192.168.1.10	TCP	60	Ether / IP / TCP 161.117.236.80:20395 > 192.168.1.10:11001 A / Padding
285	2020-03-17 22:38:47	192.168.1.10	14.215.177.39	Https	54	Ether / IP / TCP 192.168.1.10:11007 > 14.215.177.39:https FA
286	2020-03-17 22:38:47	192.168.1.10	219.133.60.246	Http	66	Ether / IP / TCP 192.168.1.10:11008 > 219.133.60.246:http S
287	2020-03-17 22:38:47	219.133.60.246	192.168.1.10	Http	66	Ether / IP / TCP 219.133.60.246:http > 192.168.1.10:11008 SA
288	2020-03-17 22:38:47	192.168.1.10	219.133.60.246	Http	54	Ether / IP / TCP 192.168.1.10:11008 > 219.133.60.246:http A
289	2020-03-17 22:38:47	192.168.1.10	219.133.60.246	Http	513	Ether / IP / TCP / HTTP / 'POST' '/q.cgi' 'HTTP/1.1' / Raw
290	2020-03-17 22:38:47	219.133.60.246	192.168.1.10	Http	60	Ether / IP / TCP 219.133.60.246:http > 192.168.1.10:11008 A / Padding
291	2020-03-17 22:38:47	219.133.60.246	192.168.1.10	Http	352	Ether / IP / TCP / HTTP / 'HTTP/1.1' '200' 'OK' / Raw
292	2020-03-17 22:38:47	192.168.1.10	219.133.60.246	Http	54	Ether / IP / TCP 192.168.1.10:11008 > 219.133.60.246:http FA
293	2020-03-17 22:38:47	192.168.1.10	219.133.60.246	Http	66	Ether / IP / TCP 192.168.1.10:11009 > 219.133.60.246:http S
294	2020-03-17 22:38:47	219.133.60.246	192.168.1.10	Http	60	Ether / IP / TCP 219.133.60.246:http > 192.168.1.10:11008 FA / Padding
295	2020-03-17 22:38:47	192.168.1.10	219.133.60.246	Http	54	Ether / IP / TCP 192.168.1.10:11008 > 219.133.60.246:http A
296	2020-03-17 22:38:47	219.133.60.246	192.168.1.10	Http	66	Ether / IP / TCP 219.133.60.246:http > 192.168.1.10:11009 SA
297	2020-03-17 22:38:47	192.168.1.10	219.133.60.246	Http	54	Ether / IP / TCP 192.168.1.10:11009 > 219.133.60.246:http A
298	2020-03-17 22:38:48	192.168.1.10	161.117.236.80	TCP	66	Ether / IP / TCP 192.168.1.10:11012 > 161.117.236.80:20395 S
299	2020-03-17 22:38:48	161.117.236.80	192.168.1.10	TCP	66	Ether / IP / TCP 161.117.236.80:20395 > 192.168.1.10:11012 SA
300	2020-03-17 22:38:48	192.168.1.10	161.117.236.80	TCP	54	Ether / IP / TCP 192.168.1.10:11012 > 161.117.236.80:20395 A
301	2020-03-17 22:38:48	192.168.1.10	14.215.177.39	Https	54	Ether / IP / TCP 192.168.1.10:11007 > 14.215.177.39:https FA
302	2020-03-17 22:38:48	192.168.1.10	161.117.236.80	TCP	593	Ether / IP / TCP 192.168.1.10:11012 > 161.117.236.80:20395 PA / Raw
303	2020-03-17 22:38:48	192.168.1.10	161.117.236.80	TCP	1058	Ether / IP / TCP 192.168.1.10:11012 > 161.117.236.80:20395 PA / Raw
304	2020-03-17 22:38:48	161.117.236.80	192.168.1.10	TCP	60	Ether / IP / TCP 161.117.236.80:20395 > 192.168.1.10:11012 A / Padding
305	2020-03-17 22:38:48	161.117.236.80	192.168.1.10	TCP	60	Ether / IP / TCP 161.117.236.80:20395 > 192.168.1.10:11012 A / Padding
306	2020-03-17 22:38:48	161.117.236.80	192.168.1.10	TCP	586	Ether / IP / TCP 161.117.236.80:20395 > 192.168.1.10:11012 PA / Raw
307	2020-03-17 22:38:48	192.168.1.10	161.117.236.80	TCP	54	Ether / IP / TCP 192.168.1.10:11012 > 161.117.236.80:20395 A
308	2020-03-17 22:38:48	161.117.236.80	192.168.1.10	TCP	1506	Ether / IP / TCP 161.117.236.80:20395 > 192.168.1.10:11012 A / Raw
309	2020-03-17 22:38:48	161.117.236.80	192.168.1.10	TCP	1497	Ether / IP / TCP 161.117.236.80:20395 > 192.168.1.10:11012 PA / Raw
310	2020-03-17 22:38:48	192.168.1.10	161.117.236.80	TCP	54	Ether / IP / TCP 192.168.1.10:11012 > 161.117.236.80:20395 A
311	2020-03-17 22:38:48	161.117.236.80	192.168.1.10	TCP	1387	Ether / IP / TCP 161.117.236.80:20395 > 192.168.1.10:11012 PA / Raw
312	2020-03-17 22:38:48	192.168.1.10	161.117.236.80	TCP	1003	Ether / IP / TCP 192.168.1.10:11012 > 161.117.236.80:20395 PA / Raw
313	2020-03-17 22:38:48	192.168.1.10	161.117.236.80	TCP	968	Ether / IP / TCP 192.168.1.10:11012 > 161.117.236.80:20395 PA / Raw
314	2020-03-17 22:38:48	161.117.236.80	192.168.1.10	TCP	60	Ether / IP / TCP 161.117.236.80:20395 > 192.168.1.10:11012 A / Padding
315	2020-03-17 22:38:48	161.117.236.80	192.168.1.10	TCP	60	Ether / IP / TCP 161.117.236.80:20395 > 192.168.1.10:11012 A / Padding
316	2020-03-17 22:38:48	161.117.236.80	192.168.1.10	TCP	1341	Ether / IP / TCP 161.117.236.80:20395 > 192.168.1.10:11012 PA / Raw
317	2020-03-17 22:38:48	192.168.1.10	161.117.236.80	TCP	66	Ether / IP / TCP 192.168.1.10:11015 > 161.117.236.80:20395 S
318	2020-03-17 22:38:48	192.168.1.10	161.117.236.80	TCP	1076	Ether / IP / TCP 192.168.1.10:11012 > 161.117.236.80:20395 PA / Raw
319	2020-03-17 22:38:48	192.168.1.10	161.117.236.80	TCP	552	Ether / IP / TCP 192.168.1.10:11012 > 161.117.236.80:20395 PA / Raw
320	2020-03-17 22:38:48	192.168.1.10	219.133.60.246	Http	521	Ether / IP / TCP / HTTP / 'POST' '/q.cgi' 'HTTP/1.1' / Raw
