packet_id	packet_time	src	dst	proto	length	info
1	2020-03-23 13:01:53	192.168.1.8	183.57.48.55	Http	66	Ether / IP / TCP 192.168.1.8:12396 > 183.57.48.55:http S
2	2020-03-23 13:01:53	183.57.48.55	192.168.1.8	Http	66	Ether / IP / TCP 183.57.48.55:http > 192.168.1.8:12396 SA
3	2020-03-23 13:01:53	192.168.1.8	183.57.48.55	Http	54	Ether / IP / TCP 192.168.1.8:12396 > 183.57.48.55:http A
4	2020-03-23 13:01:54	fe80::1	fe80::bd54:c78a:25f1:695	ICMPv6	86	Ether / IPv6 / ICMPv6ND_NS / ICMPv6 Neighbor Discovery Option - Source Link-Layer Address 9c:d2:4b:38:91:c1
5	2020-03-23 13:01:54	fe80::bd54:c78a:25f1:695	fe80::1	ICMPv6	86	Ether / IPv6 / ICMPv6ND_NA / ICMPv6 Neighbor Discovery Option - Destination Link-Layer Address b4:6b:fc:17:92:60
6	2020-03-23 13:01:54	fe80::bd54:c78a:25f1:695	fe80::1	DNS	102	Ether / IPv6 / UDP / DNS Qry "b'analytics.yinxiang.com.'" 
7	2020-03-23 13:01:54	fe80::1	fe80::bd54:c78a:25f1:695	DNS	175	Ether / IPv6 / UDP / DNS Ans 
8	2020-03-23 13:01:54	192.168.1.8	154.8.190.35	Https	66	Ether / IP / TCP 192.168.1.8:12397 > 154.8.190.35:https S
9	2020-03-23 13:01:54	154.8.190.35	192.168.1.8	Https	66	Ether / IP / TCP 154.8.190.35:https > 192.168.1.8:12397 SA
10	2020-03-23 13:01:54	192.168.1.8	154.8.190.35	Https	54	Ether / IP / TCP 192.168.1.8:12397 > 154.8.190.35:https A
11	2020-03-23 13:01:54	192.168.1.8	154.8.190.35	Https	237	Ether / IP / TCP 192.168.1.8:12397 > 154.8.190.35:https PA / Raw
12	2020-03-23 13:01:54	154.8.190.35	192.168.1.8	Https	54	Ether / IP / TCP 154.8.190.35:https > 192.168.1.8:12397 A
13	2020-03-23 13:01:54	154.8.190.35	192.168.1.8	Https	1486	Ether / IP / TCP 154.8.190.35:https > 192.168.1.8:12397 A / Raw
14	2020-03-23 13:01:54	154.8.190.35	192.168.1.8	Https	1486	Ether / IP / TCP 154.8.190.35:https > 192.168.1.8:12397 A / Raw
15	2020-03-23 13:01:54	154.8.190.35	192.168.1.8	Https	744	Ether / IP / TCP 154.8.190.35:https > 192.168.1.8:12397 PA / Raw
16	2020-03-23 13:01:54	192.168.1.8	154.8.190.35	Https	54	Ether / IP / TCP 192.168.1.8:12397 > 154.8.190.35:https A
17	2020-03-23 13:01:54	192.168.1.8	154.8.190.35	Https	180	Ether / IP / TCP 192.168.1.8:12397 > 154.8.190.35:https PA / Raw
18	2020-03-23 13:01:54	154.8.190.35	192.168.1.8	Https	328	Ether / IP / TCP 154.8.190.35:https > 192.168.1.8:12397 PA / Raw
19	2020-03-23 13:01:54	192.168.1.8	154.8.190.35	Https	1475	Ether / IP / TCP 192.168.1.8:12397 > 154.8.190.35:https PA / Raw
20	2020-03-23 13:01:54	154.8.190.35	192.168.1.8	Https	352	Ether / IP / TCP 154.8.190.35:https > 192.168.1.8:12397 PA / Raw
21	2020-03-23 13:01:54	154.8.190.35	192.168.1.8	Https	88	Ether / IP / TCP 154.8.190.35:https > 192.168.1.8:12397 PA / Raw
22	2020-03-23 13:01:54	192.168.1.8	154.8.190.35	Https	54	Ether / IP / TCP 192.168.1.8:12397 > 154.8.190.35:https A
23	2020-03-23 13:01:54	192.168.1.8	154.8.190.35	Https	54	Ether / IP / TCP 192.168.1.8:12397 > 154.8.190.35:https FA
24	2020-03-23 13:01:54	154.8.190.35	192.168.1.8	Https	54	Ether / IP / TCP 154.8.190.35:https > 192.168.1.8:12397 FA
25	2020-03-23 13:01:54	192.168.1.8	154.8.190.35	Https	54	Ether / IP / TCP 192.168.1.8:12397 > 154.8.190.35:https A
26	2020-03-23 13:01:54	192.168.1.8	183.57.48.55	Http	457	Ether / IP / TCP / HTTP / 'POST' '/q.cgi' 'HTTP/1.1' / Raw
27	2020-03-23 13:01:54	183.57.48.55	192.168.1.8	Http	54	Ether / IP / TCP 183.57.48.55:http > 192.168.1.8:12396 A
28	2020-03-23 13:01:54	183.57.48.55	192.168.1.8	Http	360	Ether / IP / TCP / HTTP / 'HTTP/1.1' '200' 'OK' / Raw
29	2020-03-23 13:01:54	192.168.1.8	183.57.48.55	Http	54	Ether / IP / TCP 192.168.1.8:12396 > 183.57.48.55:http FA
30	2020-03-23 13:01:54	183.57.48.55	192.168.1.8	Http	54	Ether / IP / TCP 183.57.48.55:http > 192.168.1.8:12396 FA
31	2020-03-23 13:01:54	192.168.1.8	183.57.48.55	Http	54	Ether / IP / TCP 192.168.1.8:12396 > 183.57.48.55:http A
32	2020-03-23 13:01:55	192.168.1.8	10.10.20.110	UDP	83	Ether / IP / UDP 192.168.1.8:59684 > 10.10.20.110:snmp / SNMP
33	2020-03-23 13:01:55	192.168.1.8	14.215.177.39	Https	54	Ether / IP / TCP 192.168.1.8:12390 > 14.215.177.39:https FA
34	2020-03-23 13:01:56	192.168.1.8	10.10.20.110	UDP	83	Ether / IP / UDP 192.168.1.8:59684 > 10.10.20.110:snmp / SNMP
35	2020-03-23 13:01:56	fe80::bd54:c78a:25f1:695	fe80::1	DNS	102	Ether / IPv6 / UDP / DNS Qry "b'analytics.yinxiang.com.'" 
36	2020-03-23 13:01:56	fe80::1	fe80::bd54:c78a:25f1:695	DNS	175	Ether / IPv6 / UDP / DNS Ans 
37	2020-03-23 13:01:56	192.168.1.8	154.8.190.35	Https	66	Ether / IP / TCP 192.168.1.8:12398 > 154.8.190.35:https S
38	2020-03-23 13:01:56	154.8.190.35	192.168.1.8	Https	66	Ether / IP / TCP 154.8.190.35:https > 192.168.1.8:12398 SA
39	2020-03-23 13:01:56	192.168.1.8	154.8.190.35	Https	54	Ether / IP / TCP 192.168.1.8:12398 > 154.8.190.35:https A
40	2020-03-23 13:01:56	192.168.1.8	154.8.190.35	Https	237	Ether / IP / TCP 192.168.1.8:12398 > 154.8.190.35:https PA / Raw
41	2020-03-23 13:01:56	154.8.190.35	192.168.1.8	Https	54	Ether / IP / TCP 154.8.190.35:https > 192.168.1.8:12398 A
42	2020-03-23 13:01:56	154.8.190.35	192.168.1.8	Https	1486	Ether / IP / TCP 154.8.190.35:https > 192.168.1.8:12398 A / Raw
43	2020-03-23 13:01:56	154.8.190.35	192.168.1.8	Https	1486	Ether / IP / TCP 154.8.190.35:https > 192.168.1.8:12398 A / Raw
44	2020-03-23 13:01:56	192.168.1.8	154.8.190.35	Https	54	Ether / IP / TCP 192.168.1.8:12398 > 154.8.190.35:https A
45	2020-03-23 13:01:56	154.8.190.35	192.168.1.8	Https	744	Ether / IP / TCP 154.8.190.35:https > 192.168.1.8:12398 PA / Raw
46	2020-03-23 13:01:56	192.168.1.8	154.8.190.35	Https	180	Ether / IP / TCP 192.168.1.8:12398 > 154.8.190.35:https PA / Raw
47	2020-03-23 13:01:56	192.168.1.8	183.57.48.55	Http	66	Ether / IP / TCP 192.168.1.8:12399 > 183.57.48.55:http S
48	2020-03-23 13:01:56	192.168.1.8	183.57.48.55	Http	66	Ether / IP / TCP 192.168.1.8:12400 > 183.57.48.55:http S
49	2020-03-23 13:01:56	192.168.1.8	183.57.48.55	Http	66	Ether / IP / TCP 192.168.1.8:12401 > 183.57.48.55:http S
50	2020-03-23 13:01:56	192.168.1.8	183.57.48.55	UDP	204	Ether / IP / UDP 192.168.1.8:54993 > 183.57.48.55:8000 / Raw
51	2020-03-23 13:01:56	192.168.1.8	183.57.48.55	Http	66	Ether / IP / TCP 192.168.1.8:12402 > 183.57.48.55:http S
52	2020-03-23 13:01:56	192.168.1.8	183.57.48.55	Http	66	Ether / IP / TCP 192.168.1.8:12403 > 183.57.48.55:http S
53	2020-03-23 13:01:56	192.168.1.8	154.8.190.35	Https	180	Ether / IP / TCP 192.168.1.8:12398 > 154.8.190.35:https PA / Raw
54	2020-03-23 13:01:57	192.168.1.8	183.57.48.55	Http	66	Ether / IP / TCP 192.168.1.8:12404 > 183.57.48.55:http S
55	2020-03-23 13:01:57	183.57.48.55	192.168.1.8	Http	66	Ether / IP / TCP 183.57.48.55:http > 192.168.1.8:12399 SA
56	2020-03-23 13:01:57	183.57.48.55	192.168.1.8	Http	66	Ether / IP / TCP 183.57.48.55:http > 192.168.1.8:12400 SA
57	2020-03-23 13:01:57	183.57.48.55	192.168.1.8	Http	66	Ether / IP / TCP 183.57.48.55:http > 192.168.1.8:12401 SA
58	2020-03-23 13:01:57	183.57.48.55	192.168.1.8	Http	66	Ether / IP / TCP 183.57.48.55:http > 192.168.1.8:12402 SA
59	2020-03-23 13:01:57	183.57.48.55	192.168.1.8	Http	66	Ether / IP / TCP 183.57.48.55:http > 192.168.1.8:12403 SA
60	2020-03-23 13:01:57	154.8.190.35	192.168.1.8	Https	328	Ether / IP / TCP 154.8.190.35:https > 192.168.1.8:12398 PA / Raw
61	2020-03-23 13:01:57	154.8.190.35	192.168.1.8	Https	66	Ether / IP / TCP 154.8.190.35:https > 192.168.1.8:12398 A
62	2020-03-23 13:01:57	183.57.48.55	192.168.1.8	Http	66	Ether / IP / TCP 183.57.48.55:http > 192.168.1.8:12404 SA
63	2020-03-23 13:01:57	192.168.1.8	183.57.48.55	Http	54	Ether / IP / TCP 192.168.1.8:12399 > 183.57.48.55:http A
64	2020-03-23 13:01:57	192.168.1.8	183.57.48.55	Http	54	Ether / IP / TCP 192.168.1.8:12400 > 183.57.48.55:http A
65	2020-03-23 13:01:57	192.168.1.8	183.57.48.55	Http	54	Ether / IP / TCP 192.168.1.8:12401 > 183.57.48.55:http A
66	2020-03-23 13:01:57	192.168.1.8	183.57.48.55	Http	54	Ether / IP / TCP 192.168.1.8:12402 > 183.57.48.55:http A
67	2020-03-23 13:01:57	192.168.1.8	183.57.48.55	Http	54	Ether / IP / TCP 192.168.1.8:12403 > 183.57.48.55:http A
68	2020-03-23 13:01:57	192.168.1.8	183.57.48.55	Http	54	Ether / IP / TCP 192.168.1.8:12404 > 183.57.48.55:http A
69	2020-03-23 13:01:57	192.168.1.8	154.8.190.35	Https	1494	Ether / IP / TCP 192.168.1.8:12398 > 154.8.190.35:https A / Raw
70	2020-03-23 13:01:57	192.168.1.8	154.8.190.35	Https	198	Ether / IP / TCP 192.168.1.8:12398 > 154.8.190.35:https PA / Raw
71	2020-03-23 13:01:57	154.8.190.35	192.168.1.8	Https	54	Ether / IP / TCP 154.8.190.35:https > 192.168.1.8:12398 A
72	2020-03-23 13:01:57	154.8.190.35	192.168.1.8	Https	54	Ether / IP / TCP 154.8.190.35:https > 192.168.1.8:12398 A
73	2020-03-23 13:01:57	192.168.1.8	183.57.48.55	Http	66	Ether / IP / TCP 192.168.1.8:12405 > 183.57.48.55:http S
74	2020-03-23 13:01:57	183.57.48.55	192.168.1.8	Http	66	Ether / IP / TCP 183.57.48.55:http > 192.168.1.8:12405 SA
75	2020-03-23 13:01:57	192.168.1.8	183.57.48.55	Http	54	Ether / IP / TCP 192.168.1.8:12405 > 183.57.48.55:http A
76	2020-03-23 13:01:57	192.168.1.8	183.57.48.55	Http	409	Ether / IP / TCP / HTTP / 'POST' '/q.cgi' 'HTTP/1.1' / Raw
77	2020-03-23 13:01:57	183.57.48.55	192.168.1.8	Http	54	Ether / IP / TCP 183.57.48.55:http > 192.168.1.8:12405 A
78	2020-03-23 13:01:57	183.57.48.55	192.168.1.8	Http	360	Ether / IP / TCP / HTTP / 'HTTP/1.1' '200' 'OK' / Raw
79	2020-03-23 13:01:57	192.168.1.8	183.57.48.55	Http	54	Ether / IP / TCP 192.168.1.8:12405 > 183.57.48.55:http FA
80	2020-03-23 13:01:57	183.57.48.55	192.168.1.8	Http	54	Ether / IP / TCP 183.57.48.55:http > 192.168.1.8:12405 FA
81	2020-03-23 13:01:57	192.168.1.8	183.57.48.55	Http	54	Ether / IP / TCP 192.168.1.8:12405 > 183.57.48.55:http A
82	2020-03-23 13:01:57	192.168.1.8	183.57.48.55	Http	409	Ether / IP / TCP / HTTP / 'POST' '/q.cgi' 'HTTP/1.1' / Raw
83	2020-03-23 13:01:57	192.168.1.8	183.57.48.55	Http	457	Ether / IP / TCP / HTTP / 'POST' '/q.cgi' 'HTTP/1.1' / Raw
84	2020-03-23 13:01:57	192.168.1.8	183.57.48.55	Http	409	Ether / IP / TCP / HTTP / 'POST' '/q.cgi' 'HTTP/1.1' / Raw
85	2020-03-23 13:01:57	192.168.1.8	183.57.48.55	Http	409	Ether / IP / TCP / HTTP / 'POST' '/q.cgi' 'HTTP/1.1' / Raw
86	2020-03-23 13:01:57	192.168.1.8	183.57.48.55	Http	433	Ether / IP / TCP / HTTP / 'POST' '/q.cgi' 'HTTP/1.1' / Raw
87	2020-03-23 13:01:57	192.168.1.8	183.57.48.55	Http	409	Ether / IP / TCP / HTTP / 'POST' '/q.cgi' 'HTTP/1.1' / Raw
88	2020-03-23 13:01:57	183.57.48.55	192.168.1.8	Http	54	Ether / IP / TCP 183.57.48.55:http > 192.168.1.8:12404 A
89	2020-03-23 13:01:57	183.57.48.55	192.168.1.8	Http	54	Ether / IP / TCP 183.57.48.55:http > 192.168.1.8:12399 A
90	2020-03-23 13:01:57	183.57.48.55	192.168.1.8	Http	54	Ether / IP / TCP 183.57.48.55:http > 192.168.1.8:12402 A
91	2020-03-23 13:01:57	183.57.48.55	192.168.1.8	Http	384	Ether / IP / TCP / HTTP / 'HTTP/1.1' '200' 'OK' / Raw
92	2020-03-23 13:01:57	183.57.48.55	192.168.1.8	Http	54	Ether / IP / TCP 183.57.48.55:http > 192.168.1.8:12400 A
93	2020-03-23 13:01:57	183.57.48.55	192.168.1.8	Http	54	Ether / IP / TCP 183.57.48.55:http > 192.168.1.8:12401 A
94	2020-03-23 13:01:57	183.57.48.55	192.168.1.8	Http	264	Ether / IP / TCP / HTTP / 'HTTP/1.1' '200' 'OK' / Raw
95	2020-03-23 13:01:57	183.57.48.55	192.168.1.8	Http	264	Ether / IP / TCP / HTTP / 'HTTP/1.1' '200' 'OK' / Raw
96	2020-03-23 13:01:57	183.57.48.55	192.168.1.8	Http	54	Ether / IP / TCP 183.57.48.55:http > 192.168.1.8:12403 A
97	2020-03-23 13:01:57	192.168.1.8	183.57.48.55	Http	54	Ether / IP / TCP 192.168.1.8:12399 > 183.57.48.55:http FA
98	2020-03-23 13:01:57	192.168.1.8	183.57.48.55	Http	66	Ether / IP / TCP 192.168.1.8:12406 > 183.57.48.55:http S
99	2020-03-23 13:01:57	192.168.1.8	183.57.48.55	Http	66	Ether / IP / TCP 192.168.1.8:12407 > 183.57.48.55:http S
100	2020-03-23 13:01:57	183.57.48.55	192.168.1.8	Http	264	Ether / IP / TCP / HTTP / 'HTTP/1.1' '200' 'OK' / Raw
101	2020-03-23 13:01:57	192.168.1.8	183.57.48.55	Http	54	Ether / IP / TCP 192.168.1.8:12401 > 183.57.48.55:http FA
102	2020-03-23 13:01:57	192.168.1.8	183.57.48.55	Http	54	Ether / IP / TCP 192.168.1.8:12402 > 183.57.48.55:http FA
103	2020-03-23 13:01:57	192.168.1.8	183.57.48.55	UDP	244	Ether / IP / UDP 192.168.1.8:54993 > 183.57.48.55:8000 / Raw
104	2020-03-23 13:01:57	183.57.48.55	192.168.1.8	Http	264	Ether / IP / TCP / HTTP / 'HTTP/1.1' '200' 'OK' / Raw
105	2020-03-23 13:01:57	192.168.1.8	183.57.48.55	Http	54	Ether / IP / TCP 192.168.1.8:12403 > 183.57.48.55:http FA
106	2020-03-23 13:01:57	192.168.1.8	183.57.48.55	Http	54	Ether / IP / TCP 192.168.1.8:12400 > 183.57.48.55:http FA
107	2020-03-23 13:01:57	183.57.48.55	192.168.1.8	Http	264	Ether / IP / TCP / HTTP / 'HTTP/1.1' '200' 'OK' / Raw
108	2020-03-23 13:01:57	192.168.1.8	183.57.48.55	Http	66	Ether / IP / TCP 192.168.1.8:12408 > 183.57.48.55:http S
109	2020-03-23 13:01:57	192.168.1.8	183.57.48.55	Http	54	Ether / IP / TCP 192.168.1.8:12404 > 183.57.48.55:http FA
110	2020-03-23 13:01:57	192.168.1.8	172.217.160.110	Https	66	Ether / IP / TCP 192.168.1.8:12310 > 172.217.160.110:https S
111	2020-03-23 13:01:57	192.168.1.8	183.57.48.55	Http	66	Ether / IP / TCP 192.168.1.8:12409 > 183.57.48.55:http S
112	2020-03-23 13:01:58	192.168.1.8	183.57.48.55	Http	54	Ether / IP / TCP 192.168.1.8:12404 > 183.57.48.55:http FA
113	2020-03-23 13:01:58	192.168.1.8	172.217.160.110	Https	66	Ether / IP / TCP 192.168.1.8:12311 > 172.217.160.110:https S
114	2020-03-23 13:01:58	183.57.48.55	192.168.1.8	Http	54	Ether / IP / TCP 183.57.48.55:http > 192.168.1.8:12402 FA
115	2020-03-23 13:01:58	183.57.48.55	192.168.1.8	Http	54	Ether / IP / TCP 183.57.48.55:http > 192.168.1.8:12401 FA
116	2020-03-23 13:01:58	183.57.48.55	192.168.1.8	Http	66	Ether / IP / TCP 183.57.48.55:http > 192.168.1.8:12407 SA
117	2020-03-23 13:01:58	183.57.48.55	192.168.1.8	Http	54	Ether / IP / TCP 183.57.48.55:http > 192.168.1.8:12404 FA
118	2020-03-23 13:01:58	183.57.48.55	192.168.1.8	Http	54	Ether / IP / TCP 183.57.48.55:http > 192.168.1.8:12400 FA
119	2020-03-23 13:01:58	183.57.48.55	192.168.1.8	Http	54	Ether / IP / TCP 183.57.48.55:http > 192.168.1.8:12403 FA
120	2020-03-23 13:01:58	183.57.48.55	192.168.1.8	Http	66	Ether / IP / TCP 183.57.48.55:http > 192.168.1.8:12408 SA
121	2020-03-23 13:01:58	183.57.48.55	192.168.1.8	Http	66	Ether / IP / TCP 183.57.48.55:http > 192.168.1.8:12409 SA
122	2020-03-23 13:01:58	183.57.48.55	192.168.1.8	Http	54	Ether / IP / TCP 183.57.48.55:http > 192.168.1.8:12404 FA
123	2020-03-23 13:01:58	183.57.48.55	192.168.1.8	Http	66	Ether / IP / TCP 183.57.48.55:http > 192.168.1.8:12404 A
124	2020-03-23 13:01:58	192.168.1.8	183.57.48.55	Http	54	Ether / IP / TCP 192.168.1.8:12402 > 183.57.48.55:http A
125	2020-03-23 13:01:58	192.168.1.8	183.57.48.55	Http	54	Ether / IP / TCP 192.168.1.8:12401 > 183.57.48.55:http A
126	2020-03-23 13:01:58	192.168.1.8	183.57.48.55	Http	54	Ether / IP / TCP 192.168.1.8:12404 > 183.57.48.55:http A
127	2020-03-23 13:01:58	192.168.1.8	183.57.48.55	Http	54	Ether / IP / TCP 192.168.1.8:12400 > 183.57.48.55:http A
128	2020-03-23 13:01:58	192.168.1.8	183.57.48.55	Http	449	Ether / IP / TCP / HTTP / 'POST' '/q.cgi' 'HTTP/1.1' / Raw
129	2020-03-23 13:01:58	192.168.1.8	183.57.48.55	Http	54	Ether / IP / TCP 192.168.1.8:12403 > 183.57.48.55:http A
130	2020-03-23 13:01:58	192.168.1.8	183.57.48.55	Http	54	Ether / IP / TCP 192.168.1.8:12404 > 183.57.48.55:http A
131	2020-03-23 13:01:58	192.168.1.8	183.57.48.55	Http	54	Ether / IP / TCP 192.168.1.8:12408 > 183.57.48.55:http A
132	2020-03-23 13:01:58	192.168.1.8	183.57.48.55	Http	54	Ether / IP / TCP 192.168.1.8:12409 > 183.57.48.55:http A
133	2020-03-23 13:01:58	192.168.1.8	183.57.48.55	Http	449	Ether / IP / TCP / HTTP / 'POST' '/q.cgi' 'HTTP/1.1' / Raw
134	2020-03-23 13:01:58	192.168.1.8	183.57.48.55	Http	449	Ether / IP / TCP / HTTP / 'POST' '/q.cgi' 'HTTP/1.1' / Raw
135	2020-03-23 13:01:58	183.57.48.55	192.168.1.8	Http	54	Ether / IP / TCP 183.57.48.55:http > 192.168.1.8:12404 R
136	2020-03-23 13:01:58	183.57.48.55	192.168.1.8	Http	54	Ether / IP / TCP 183.57.48.55:http > 192.168.1.8:12409 A
137	2020-03-23 13:01:58	183.57.48.55	192.168.1.8	Http	54	Ether / IP / TCP 183.57.48.55:http > 192.168.1.8:12407 A
138	2020-03-23 13:01:58	183.57.48.55	192.168.1.8	Http	54	Ether / IP / TCP 183.57.48.55:http > 192.168.1.8:12408 A
139	2020-03-23 13:01:58	183.57.48.55	192.168.1.8	Http	376	Ether / IP / TCP / HTTP / 'HTTP/1.1' '200' 'OK' / Raw
140	2020-03-23 13:01:58	192.168.1.8	183.57.48.55	Http	54	Ether / IP / TCP 192.168.1.8:12407 > 183.57.48.55:http FA
141	2020-03-23 13:01:58	183.57.48.55	192.168.1.8	Http	560	Ether / IP / TCP / HTTP / 'HTTP/1.1' '200' 'OK' / Raw
142	2020-03-23 13:01:58	183.57.48.55	192.168.1.8	Http	376	Ether / IP / TCP / HTTP / 'HTTP/1.1' '200' 'OK' / Raw
143	2020-03-23 13:01:58	192.168.1.8	183.57.48.55	Http	54	Ether / IP / TCP 192.168.1.8:12409 > 183.57.48.55:http FA
144	2020-03-23 13:01:58	192.168.1.8	183.57.48.55	Http	54	Ether / IP / TCP 192.168.1.8:12408 > 183.57.48.55:http FA
145	2020-03-23 13:01:58	240e:d4:2efe:200:c1e4:29e:10f8:4eb	2404:6800:4008:803::200e	Https	86	Ether / IPv6 / TCP 240e:d4:2efe:200:c1e4:29e:10f8:4eb:12312 > 2404:6800:4008:803::200e:https S
146	2020-03-23 13:01:58	183.57.48.55	192.168.1.8	Http	54	Ether / IP / TCP 183.57.48.55:http > 192.168.1.8:12409 FA
147	2020-03-23 13:01:58	192.168.1.8	183.57.48.55	Http	54	Ether / IP / TCP 192.168.1.8:12409 > 183.57.48.55:http A
148	2020-03-23 13:01:58	183.57.48.55	192.168.1.8	Http	54	Ether / IP / TCP 183.57.48.55:http > 192.168.1.8:12407 FA
149	2020-03-23 13:01:58	192.168.1.8	183.57.48.55	Http	54	Ether / IP / TCP 192.168.1.8:12407 > 183.57.48.55:http A
150	2020-03-23 13:01:58	192.168.1.8	10.10.20.110	UDP	120	Ether / IP / UDP 192.168.1.8:59684 > 10.10.20.110:snmp / SNMP
151	2020-03-23 13:01:58	183.57.48.55	192.168.1.8	Http	54	Ether / IP / TCP 183.57.48.55:http > 192.168.1.8:12408 FA
152	2020-03-23 13:01:58	192.168.1.8	183.57.48.55	Http	54	Ether / IP / TCP 192.168.1.8:12408 > 183.57.48.55:http A
153	2020-03-23 13:01:58	240e:d4:2efe:200:c1e4:29e:10f8:4eb	2404:6800:4008:803::200e	Https	86	Ether / IPv6 / TCP 240e:d4:2efe:200:c1e4:29e:10f8:4eb:12313 > 2404:6800:4008:803::200e:https S
154	2020-03-23 13:01:58	183.57.48.55	192.168.1.8	Http	54	Ether / IP / TCP 183.57.48.55:http > 192.168.1.8:12399 FA
155	2020-03-23 13:01:58	192.168.1.8	183.57.48.55	Http	54	Ether / IP / TCP 192.168.1.8:12399 > 183.57.48.55:http A
156	2020-03-23 13:01:58	fe80::bd54:c78a:25f1:695	fe80::1	DNS	104	Ether / IPv6 / UDP / DNS Qry "b'p2pupgrade.gamedl.qq.com.'" 
157	2020-03-23 13:01:58	fe80::1	fe80::bd54:c78a:25f1:695	DNS	244	Ether / IPv6 / UDP / DNS Ans "183.61.39.217" 
158	2020-03-23 13:01:58	192.168.1.8	183.61.39.217	TCP	66	Ether / IP / TCP 192.168.1.8:12412 > 183.61.39.217:8000 S
159	2020-03-23 13:01:58	183.61.39.217	192.168.1.8	TCP	66	Ether / IP / TCP 183.61.39.217:8000 > 192.168.1.8:12412 SA
160	2020-03-23 13:01:58	192.168.1.8	183.61.39.217	TCP	54	Ether / IP / TCP 192.168.1.8:12412 > 183.61.39.217:8000 A
161	2020-03-23 13:01:58	192.168.1.8	183.61.39.217	TCP	112	Ether / IP / TCP 192.168.1.8:12412 > 183.61.39.217:8000 PA / Raw
162	2020-03-23 13:01:58	fe80::bd54:c78a:25f1:695	fe80::1	DNS	93	Ether / IPv6 / UDP / DNS Qry "b'dlied6.qq.com.'" 
163	2020-03-23 13:01:58	fe80::1	fe80::bd54:c78a:25f1:695	DNS	471	Ether / IPv6 / UDP / DNS Ans "b'3gdl.tc.qq.com.'" 
164	2020-03-23 13:01:58	183.61.39.217	192.168.1.8	TCP	54	Ether / IP / TCP 183.61.39.217:8000 > 192.168.1.8:12412 A
165	2020-03-23 13:01:58	192.168.1.8	183.57.48.55	Http	66	Ether / IP / TCP 192.168.1.8:12406 > 183.57.48.55:http S
166	2020-03-23 13:01:58	183.57.48.55	192.168.1.8	Http	66	Ether / IP / TCP 183.57.48.55:http > 192.168.1.8:12406 SA
167	2020-03-23 13:01:58	192.168.1.8	183.57.48.55	Http	54	Ether / IP / TCP 192.168.1.8:12406 > 183.57.48.55:http A
168	2020-03-23 13:01:58	192.168.1.8	183.57.48.55	Http	449	Ether / IP / TCP / HTTP / 'POST' '/q.cgi' 'HTTP/1.1' / Raw
169	2020-03-23 13:01:58	183.57.48.55	192.168.1.8	Http	54	Ether / IP / TCP 183.57.48.55:http > 192.168.1.8:12406 A
170	2020-03-23 13:01:58	183.57.48.55	192.168.1.8	Http	376	Ether / IP / TCP / HTTP / 'HTTP/1.1' '200' 'OK' / Raw
171	2020-03-23 13:01:58	183.61.39.217	192.168.1.8	TCP	160	Ether / IP / TCP 183.61.39.217:8000 > 192.168.1.8:12412 PA / Raw
172	2020-03-23 13:01:58	192.168.1.8	183.61.39.217	TCP	54	Ether / IP / TCP 192.168.1.8:12412 > 183.61.39.217:8000 FA
173	2020-03-23 13:01:58	192.168.1.8	183.57.48.55	Http	54	Ether / IP / TCP 192.168.1.8:12406 > 183.57.48.55:http A
174	2020-03-23 13:01:58	183.61.39.217	192.168.1.8	TCP	54	Ether / IP / TCP 183.61.39.217:8000 > 192.168.1.8:12412 A
175	2020-03-23 13:01:59	183.61.39.217	192.168.1.8	TCP	54	Ether / IP / TCP 183.61.39.217:8000 > 192.168.1.8:12412 FA
176	2020-03-23 13:01:59	192.168.1.8	183.61.39.217	TCP	54	Ether / IP / TCP 192.168.1.8:12412 > 183.61.39.217:8000 A
177	2020-03-23 13:01:59	fe80::bd54:c78a:25f1:695	fe80::1	DNS	98	Ether / IPv6 / UDP / DNS Qry "b'stat.gamedl.qq.com.'" 
178	2020-03-23 13:01:59	fe80::bd54:c78a:25f1:695	fe80::1	DNS	100	Ether / IPv6 / UDP / DNS Qry "b'config.gamedl.qq.com.'" 
179	2020-03-23 13:01:59	192.168.1.8	183.3.225.79	TCP	66	Ether / IP / TCP 192.168.1.8:12413 > 183.3.225.79:36688 S
180	2020-03-23 13:01:59	fe80::1	fe80::bd54:c78a:25f1:695	DNS	302	Ether / IPv6 / UDP / DNS Ans "14.17.53.113" 
181	2020-03-23 13:01:59	fe80::1	fe80::bd54:c78a:25f1:695	DNS	240	Ether / IPv6 / UDP / DNS Ans "183.61.39.226" 
182	2020-03-23 13:01:59	192.168.1.8	183.61.39.226	TCP	66	Ether / IP / TCP 192.168.1.8:12414 > 183.61.39.226:14309 S
183	2020-03-23 13:01:59	fe80::bd54:c78a:25f1:695	fe80::1	DNS	97	Ether / IPv6 / UDP / DNS Qry "b'ps2.gamedl.qq.com.'" 
184	2020-03-23 13:01:59	fe80::bd54:c78a:25f1:695	fe80::1	DNS	103	Ether / IPv6 / UDP / DNS Qry "b'p2pupdate.gamedl.qq.com.'" 
185	2020-03-23 13:01:59	fe80::1	fe80::bd54:c78a:25f1:695	DNS	237	Ether / IPv6 / UDP / DNS Ans "183.61.39.229" 
186	2020-03-23 13:01:59	192.168.1.8	183.61.39.229	UDP	167	Ether / IP / UDP 192.168.1.8:msnp > 183.61.39.229:8000 / Raw
187	2020-03-23 13:01:59	fe80::1	fe80::bd54:c78a:25f1:695	DNS	243	Ether / IPv6 / UDP / DNS Ans "183.61.39.218" 
188	2020-03-23 13:01:59	192.168.1.8	183.61.39.218	UDP	84	Ether / IP / UDP 192.168.1.8:60697 > 183.61.39.218:8000 / Raw
189	2020-03-23 13:01:59	183.3.225.79	192.168.1.8	TCP	66	Ether / IP / TCP 183.3.225.79:36688 > 192.168.1.8:12413 SA
190	2020-03-23 13:01:59	192.168.1.8	183.3.225.79	TCP	54	Ether / IP / TCP 192.168.1.8:12413 > 183.3.225.79:36688 A
191	2020-03-23 13:01:59	192.168.1.8	183.3.225.79	TCP	346	Ether / IP / TCP 192.168.1.8:12413 > 183.3.225.79:36688 PA / Raw
192	2020-03-23 13:01:59	183.61.39.226	192.168.1.8	TCP	66	Ether / IP / TCP 183.61.39.226:14309 > 192.168.1.8:12414 SA
193	2020-03-23 13:01:59	192.168.1.8	183.61.39.226	TCP	54	Ether / IP / TCP 192.168.1.8:12414 > 183.61.39.226:14309 A
194	2020-03-23 13:01:59	192.168.1.8	183.61.39.226	TCP	104	Ether / IP / TCP 192.168.1.8:12414 > 183.61.39.226:14309 PA / Raw
195	2020-03-23 13:01:59	183.61.39.229	192.168.1.8	UDP	96	Ether / IP / UDP 183.61.39.229:8000 > 192.168.1.8:msnp / Raw
196	2020-03-23 13:01:59	192.168.1.8	101.91.62.179	UDP	167	Ether / IP / UDP 192.168.1.8:msnp > 101.91.62.179:8000 / Raw
197	2020-03-23 13:01:59	192.168.1.8	183.57.48.55	Http	54	Ether / IP / TCP 192.168.1.8:12406 > 183.57.48.55:http FA
198	2020-03-23 13:01:59	183.61.39.226	192.168.1.8	TCP	54	Ether / IP / TCP 183.61.39.226:14309 > 192.168.1.8:12414 A
199	2020-03-23 13:01:59	183.61.39.226	192.168.1.8	TCP	927	Ether / IP / TCP 183.61.39.226:14309 > 192.168.1.8:12414 PA / Raw
200	2020-03-23 13:01:59	192.168.1.8	183.61.39.226	TCP	54	Ether / IP / TCP 192.168.1.8:12414 > 183.61.39.226:14309 FA
201	2020-03-23 13:01:59	183.3.225.79	192.168.1.8	TCP	54	Ether / IP / TCP 183.3.225.79:36688 > 192.168.1.8:12413 A
202	2020-03-23 13:01:59	183.61.39.218	192.168.1.8	UDP	324	Ether / IP / UDP 183.61.39.218:8000 > 192.168.1.8:60697 / Raw
203	2020-03-23 13:01:59	101.91.62.179	192.168.1.8	UDP	168	Ether / IP / UDP 101.91.62.179:8000 > 192.168.1.8:msnp / Raw
204	2020-03-23 13:01:59	192.168.1.8	101.91.62.179	UDP	127	Ether / IP / UDP 192.168.1.8:msnp > 101.91.62.179:8000 / Raw
205	2020-03-23 13:01:59	183.57.48.55	192.168.1.8	Http	54	Ether / IP / TCP 183.57.48.55:http > 192.168.1.8:12406 FA
206	2020-03-23 13:01:59	192.168.1.8	183.57.48.55	Http	54	Ether / IP / TCP 192.168.1.8:12406 > 183.57.48.55:http A
207	2020-03-23 13:01:59	183.61.39.226	192.168.1.8	TCP	54	Ether / IP / TCP 183.61.39.226:14309 > 192.168.1.8:12414 RA
208	2020-03-23 13:01:59	101.91.62.179	192.168.1.8	UDP	72	Ether / IP / UDP 101.91.62.179:8000 > 192.168.1.8:msnp / Raw
209	2020-03-23 13:01:59	183.3.225.79	192.168.1.8	TCP	74	Ether / IP / TCP 183.3.225.79:36688 > 192.168.1.8:12413 PA / Raw
210	2020-03-23 13:01:59	fe80::bd54:c78a:25f1:695	fe80::1	DNS	98	Ether / IPv6 / UDP / DNS Qry "b'stun.qqlive.qq.com.'" 
211	2020-03-23 13:01:59	fe80::1	fe80::bd54:c78a:25f1:695	DNS	292	Ether / IPv6 / UDP / DNS Ans "b'stun-a1.qq.com.'" 
212	2020-03-23 13:01:59	192.168.1.8	183.3.225.79	TCP	54	Ether / IP / TCP 192.168.1.8:12413 > 183.3.225.79:36688 A
213	2020-03-23 13:02:00	192.168.1.8	14.215.177.39	Https	54	Ether / IP / TCP 192.168.1.8:12309 > 14.215.177.39:https RA
214	2020-03-23 13:02:00	192.168.1.8	14.215.177.39	Https	54	Ether / IP / TCP 192.168.1.8:12390 > 14.215.177.39:https FA
215	2020-03-23 13:02:00	110.43.81.71	192.168.1.8	Http	54	Ether / IP / TCP 110.43.81.71:http > 192.168.1.8:12339 FA
216	2020-03-23 13:02:00	192.168.1.8	110.43.81.71	Http	54	Ether / IP / TCP 192.168.1.8:12339 > 110.43.81.71:http A
217	2020-03-23 13:02:00	192.168.1.8	110.43.81.71	Http	54	Ether / IP / TCP 192.168.1.8:12339 > 110.43.81.71:http FA
218	2020-03-23 13:02:00	110.43.81.71	192.168.1.8	Http	54	Ether / IP / TCP 110.43.81.71:http > 192.168.1.8:12339 R
219	2020-03-23 13:02:00	192.168.1.8	183.57.48.55	Http	66	Ether / IP / TCP 192.168.1.8:12415 > 183.57.48.55:http S
220	2020-03-23 13:02:00	183.57.48.55	192.168.1.8	Http	66	Ether / IP / TCP 183.57.48.55:http > 192.168.1.8:12415 SA
221	2020-03-23 13:02:00	192.168.1.8	183.57.48.55	Http	54	Ether / IP / TCP 192.168.1.8:12415 > 183.57.48.55:http A
222	2020-03-23 13:02:01	192.168.1.8	10.10.20.110	UDP	83	Ether / IP / UDP 192.168.1.8:59684 > 10.10.20.110:snmp / SNMP
223	2020-03-23 13:02:01	192.168.1.8	183.3.225.79	TCP	54	Ether / IP / TCP 192.168.1.8:12413 > 183.3.225.79:36688 FA
224	2020-03-23 13:02:01	183.3.225.79	192.168.1.8	TCP	54	Ether / IP / TCP 183.3.225.79:36688 > 192.168.1.8:12413 FA
225	2020-03-23 13:02:01	192.168.1.8	183.3.225.79	TCP	54	Ether / IP / TCP 192.168.1.8:12413 > 183.3.225.79:36688 A
226	2020-03-23 13:02:01	192.168.1.8	14.215.177.39	Https	66	Ether / IP / TCP 192.168.1.8:12416 > 14.215.177.39:https S
227	2020-03-23 13:02:01	14.215.177.39	192.168.1.8	Https	66	Ether / IP / TCP 14.215.177.39:https > 192.168.1.8:12416 SA
228	2020-03-23 13:02:01	192.168.1.8	14.215.177.39	Https	54	Ether / IP / TCP 192.168.1.8:12416 > 14.215.177.39:https A
229	2020-03-23 13:02:01	192.168.1.8	14.215.177.39	Https	54	Ether / IP / TCP 192.168.1.8:12416 > 14.215.177.39:https FA
230	2020-03-23 13:02:01	192.168.1.8	14.215.177.39	Https	54	Ether / IP / TCP 192.168.1.8:12416 > 14.215.177.39:https FA
231	2020-03-23 13:02:01	192.168.1.8	183.57.48.55	Http	385	Ether / IP / TCP / HTTP / 'POST' '/q.cgi' 'HTTP/1.1' / Raw
232	2020-03-23 13:02:01	183.57.48.55	192.168.1.8	Http	54	Ether / IP / TCP 183.57.48.55:http > 192.168.1.8:12415 A
233	2020-03-23 13:02:01	183.57.48.55	192.168.1.8	Http	288	Ether / IP / TCP / HTTP / 'HTTP/1.1' '200' 'OK' / Raw
234	2020-03-23 13:02:01	192.168.1.8	183.57.48.55	Http	54	Ether / IP / TCP 192.168.1.8:12415 > 183.57.48.55:http FA
235	2020-03-23 13:02:01	183.57.48.55	192.168.1.8	Http	54	Ether / IP / TCP 183.57.48.55:http > 192.168.1.8:12415 FA
236	2020-03-23 13:02:01	192.168.1.8	183.57.48.55	Http	54	Ether / IP / TCP 192.168.1.8:12415 > 183.57.48.55:http A
237	2020-03-23 13:02:02	192.168.1.8	10.10.20.110	UDP	83	Ether / IP / UDP 192.168.1.8:59684 > 10.10.20.110:snmp / SNMP
238	2020-03-23 13:02:02	192.168.1.8	14.215.177.39	Https	54	Ether / IP / TCP 192.168.1.8:12416 > 14.215.177.39:https FA
239	2020-03-23 13:02:03	192.168.1.8	183.3.225.79	TCP	66	Ether / IP / TCP 192.168.1.8:12417 > 183.3.225.79:36688 S
240	2020-03-23 13:02:03	183.3.225.79	192.168.1.8	TCP	66	Ether / IP / TCP 183.3.225.79:36688 > 192.168.1.8:12417 SA
241	2020-03-23 13:02:03	192.168.1.8	183.3.225.79	TCP	54	Ether / IP / TCP 192.168.1.8:12417 > 183.3.225.79:36688 A
242	2020-03-23 13:02:03	192.168.1.8	183.3.225.79	TCP	282	Ether / IP / TCP 192.168.1.8:12417 > 183.3.225.79:36688 PA / Raw
243	2020-03-23 13:02:03	183.3.225.79	192.168.1.8	TCP	54	Ether / IP / TCP 183.3.225.79:36688 > 192.168.1.8:12417 A
244	2020-03-23 13:02:03	192.168.1.8	14.215.177.39	Https	54	Ether / IP / TCP 192.168.1.8:12416 > 14.215.177.39:https FA
245	2020-03-23 13:02:03	192.168.1.8	183.57.48.55	Http	66	Ether / IP / TCP 192.168.1.8:12418 > 183.57.48.55:http S
246	2020-03-23 13:02:03	183.57.48.55	192.168.1.8	Http	66	Ether / IP / TCP 183.57.48.55:http > 192.168.1.8:12418 SA
247	2020-03-23 13:02:03	192.168.1.8	183.57.48.55	Http	54	Ether / IP / TCP 192.168.1.8:12418 > 183.57.48.55:http A
248	2020-03-23 13:02:03	192.168.1.8	140.143.213.113	Https	66	Ether / IP / TCP 192.168.1.8:12425 > 140.143.213.113:https S
249	2020-03-23 13:02:03	178.128.83.14	192.168.1.8	Http	54	Ether / IP / TCP 178.128.83.14:http > 192.168.1.8:11325 A
250	2020-03-23 13:02:03	192.168.1.8	178.128.83.14	Http	54	Ether / IP / TCP 192.168.1.8:11325 > 178.128.83.14:http A
251	2020-03-23 13:02:03	192.168.1.8	183.57.48.55	Http	1209	Ether / IP / TCP / HTTP / 'POST' '/q.cgi' 'HTTP/1.1' / Raw
252	2020-03-23 13:02:03	140.143.213.113	192.168.1.8	Https	66	Ether / IP / TCP 140.143.213.113:https > 192.168.1.8:12425 SA
253	2020-03-23 13:02:03	192.168.1.8	140.143.213.113	Https	54	Ether / IP / TCP 192.168.1.8:12425 > 140.143.213.113:https A
254	2020-03-23 13:02:03	183.57.48.55	192.168.1.8	Http	54	Ether / IP / TCP 183.57.48.55:http > 192.168.1.8:12418 A
255	2020-03-23 13:02:03	183.57.48.55	192.168.1.8	Http	408	Ether / IP / TCP / HTTP / 'HTTP/1.1' '200' 'OK' / Raw
256	2020-03-23 13:02:03	192.168.1.8	183.57.48.55	Http	54	Ether / IP / TCP 192.168.1.8:12418 > 183.57.48.55:http FA
257	2020-03-23 13:02:03	183.57.48.55	192.168.1.8	Http	54	Ether / IP / TCP 183.57.48.55:http > 192.168.1.8:12418 FA
258	2020-03-23 13:02:03	192.168.1.8	183.57.48.55	Http	54	Ether / IP / TCP 192.168.1.8:12418 > 183.57.48.55:http A
259	2020-03-23 13:02:04	192.168.1.8	140.143.213.113	Https	390	Ether / IP / TCP 192.168.1.8:12425 > 140.143.213.113:https PA / Raw
260	2020-03-23 13:02:04	183.3.225.79	192.168.1.8	TCP	74	Ether / IP / TCP 183.3.225.79:36688 > 192.168.1.8:12417 PA / Raw
261	2020-03-23 13:02:04	192.168.1.8	183.3.225.79	TCP	282	Ether / IP / TCP 192.168.1.8:12417 > 183.3.225.79:36688 PA / Raw
262	2020-03-23 13:02:04	183.3.225.79	192.168.1.8	TCP	54	Ether / IP / TCP 183.3.225.79:36688 > 192.168.1.8:12417 A
263	2020-03-23 13:02:04	140.143.213.113	192.168.1.8	Https	54	Ether / IP / TCP 140.143.213.113:https > 192.168.1.8:12425 A
264	2020-03-23 13:02:04	140.143.213.113	192.168.1.8	Https	1486	Ether / IP / TCP 140.143.213.113:https > 192.168.1.8:12425 A / Raw
265	2020-03-23 13:02:04	140.143.213.113	192.168.1.8	Https	1486	Ether / IP / TCP 140.143.213.113:https > 192.168.1.8:12425 A / Raw
266	2020-03-23 13:02:04	140.143.213.113	192.168.1.8	Https	749	Ether / IP / TCP 140.143.213.113:https > 192.168.1.8:12425 PA / Raw
267	2020-03-23 13:02:04	192.168.1.8	140.143.213.113	Https	54	Ether / IP / TCP 192.168.1.8:12425 > 140.143.213.113:https A
268	2020-03-23 13:02:04	192.168.1.8	140.143.213.113	Https	180	Ether / IP / TCP 192.168.1.8:12425 > 140.143.213.113:https PA / Raw
269	2020-03-23 13:02:04	140.143.213.113	192.168.1.8	Https	328	Ether / IP / TCP 140.143.213.113:https > 192.168.1.8:12425 PA / Raw
270	2020-03-23 13:02:04	192.168.1.8	140.143.213.113	Https	479	Ether / IP / TCP 192.168.1.8:12425 > 140.143.213.113:https PA / Raw
271	2020-03-23 13:02:04	140.143.213.113	192.168.1.8	Https	54	Ether / IP / TCP 140.143.213.113:https > 192.168.1.8:12425 A
272	2020-03-23 13:02:05	192.168.1.8	120.131.14.109	UDP	151	Ether / IP / UDP 192.168.1.8:54116 > 120.131.14.109:9405 / Raw
273	2020-03-23 13:02:05	192.168.1.8	14.215.177.39	Https	54	Ether / IP / TCP 192.168.1.8:12416 > 14.215.177.39:https FA
274	2020-03-23 13:02:06	192.168.1.8	183.57.48.55	Http	66	Ether / IP / TCP 192.168.1.8:12438 > 183.57.48.55:http S
275	2020-03-23 13:02:06	183.57.48.55	192.168.1.8	Http	66	Ether / IP / TCP 183.57.48.55:http > 192.168.1.8:12438 SA
276	2020-03-23 13:02:06	192.168.1.8	183.57.48.55	Http	54	Ether / IP / TCP 192.168.1.8:12438 > 183.57.48.55:http A
277	2020-03-23 13:02:06	192.168.1.8	183.57.48.55	Http	481	Ether / IP / TCP / HTTP / 'POST' '/q.cgi' 'HTTP/1.1' / Raw
278	2020-03-23 13:02:06	183.57.48.55	192.168.1.8	Http	54	Ether / IP / TCP 183.57.48.55:http > 192.168.1.8:12438 A
279	2020-03-23 13:02:06	183.57.48.55	192.168.1.8	Http	223	Ether / IP / TCP / HTTP / 'HTTP/1.1' '200' 'OK' / Raw
280	2020-03-23 13:02:06	192.168.1.8	183.57.48.55	Http	54	Ether / IP / TCP 192.168.1.8:12438 > 183.57.48.55:http FA
281	2020-03-23 13:02:06	183.57.48.55	192.168.1.8	Http	54	Ether / IP / TCP 183.57.48.55:http > 192.168.1.8:12438 FA
282	2020-03-23 13:02:06	192.168.1.8	183.57.48.55	Http	54	Ether / IP / TCP 192.168.1.8:12438 > 183.57.48.55:http A
283	2020-03-23 13:02:06	fe80::bd54:c78a:25f1:695	fe80::1	DNS	95	Ether / IPv6 / UDP / DNS Qry "b'connc.gj.qq.com.'" 
284	2020-03-23 13:02:06	fe80::1	fe80::bd54:c78a:25f1:695	DNS	283	Ether / IPv6 / UDP / DNS Ans "183.36.108.18" 
285	2020-03-23 13:02:06	192.168.1.8	183.36.108.18	TCP	66	Ether / IP / TCP 192.168.1.8:12439 > 183.36.108.18:36688 S
286	2020-03-23 13:02:06	183.36.108.18	192.168.1.8	TCP	66	Ether / IP / TCP 183.36.108.18:36688 > 192.168.1.8:12439 SA
287	2020-03-23 13:02:06	192.168.1.8	183.36.108.18	TCP	54	Ether / IP / TCP 192.168.1.8:12439 > 183.36.108.18:36688 A
288	2020-03-23 13:02:06	192.168.1.8	183.36.108.18	TCP	294	Ether / IP / TCP 192.168.1.8:12439 > 183.36.108.18:36688 PA / Raw
289	2020-03-23 13:02:06	183.36.108.18	192.168.1.8	TCP	54	Ether / IP / TCP 183.36.108.18:36688 > 192.168.1.8:12439 A
290	2020-03-23 13:02:06	183.36.108.18	192.168.1.8	TCP	74	Ether / IP / TCP 183.36.108.18:36688 > 192.168.1.8:12439 PA / Raw
291	2020-03-23 13:02:06	192.168.1.8	183.36.108.18	TCP	328	Ether / IP / TCP 192.168.1.8:12439 > 183.36.108.18:36688 PA / Raw
292	2020-03-23 13:02:06	183.36.108.18	192.168.1.8	TCP	74	Ether / IP / TCP 183.36.108.18:36688 > 192.168.1.8:12439 PA / Raw
293	2020-03-23 13:02:06	192.168.1.8	183.36.108.18	TCP	54	Ether / IP / TCP 192.168.1.8:12439 > 183.36.108.18:36688 A
294	2020-03-23 13:02:07	183.3.225.79	192.168.1.8	TCP	74	Ether / IP / TCP 183.3.225.79:36688 > 192.168.1.8:12417 PA / Raw
295	2020-03-23 13:02:07	192.168.1.8	183.3.225.79	TCP	262	Ether / IP / TCP 192.168.1.8:12417 > 183.3.225.79:36688 PA / Raw
296	2020-03-23 13:02:07	192.168.1.8	10.10.20.110	UDP	83	Ether / IP / UDP 192.168.1.8:59684 > 10.10.20.110:snmp / SNMP
297	2020-03-23 13:02:07	183.3.225.79	192.168.1.8	TCP	54	Ether / IP / TCP 183.3.225.79:36688 > 192.168.1.8:12417 A
298	2020-03-23 13:02:07	fe80::bd54:c78a:25f1:695	fe80::1	DNS	95	Ether / IPv6 / UDP / DNS Qry "b'play.google.com.'" 
299	2020-03-23 13:02:07	fe80::bd54:c78a:25f1:695	fe80::1	DNS	95	Ether / IPv6 / UDP / DNS Qry "b'play.google.com.'" 
300	2020-03-23 13:02:07	fe80::1	fe80::bd54:c78a:25f1:695	DNS	359	Ether / IPv6 / UDP / DNS Ans "172.217.24.14" 
301	2020-03-23 13:02:07	fe80::1	fe80::bd54:c78a:25f1:695	DNS	371	Ether / IPv6 / UDP / DNS Ans "2404:6800:4012::200e" 
302	2020-03-23 13:02:07	240e:d4:2efe:200:c1e4:29e:10f8:4eb	2404:6800:4012::200e	Https	86	Ether / IPv6 / TCP 240e:d4:2efe:200:c1e4:29e:10f8:4eb:12440 > 2404:6800:4012::200e:https S
303	2020-03-23 13:02:07	240e:d4:2efe:200:c1e4:29e:10f8:4eb	2404:6800:4012::200e	Https	86	Ether / IPv6 / TCP 240e:d4:2efe:200:c1e4:29e:10f8:4eb:12441 > 2404:6800:4012::200e:https S
304	2020-03-23 13:02:07	192.168.1.8	172.217.24.14	Https	66	Ether / IP / TCP 192.168.1.8:12442 > 172.217.24.14:https S
305	2020-03-23 13:02:07	192.168.1.8	183.36.108.18	TCP	54	Ether / IP / TCP 192.168.1.8:12439 > 183.36.108.18:36688 FA
306	2020-03-23 13:02:07	183.36.108.18	192.168.1.8	TCP	54	Ether / IP / TCP 183.36.108.18:36688 > 192.168.1.8:12439 FA
307	2020-03-23 13:02:07	192.168.1.8	183.36.108.18	TCP	54	Ether / IP / TCP 192.168.1.8:12439 > 183.36.108.18:36688 A
308	2020-03-23 13:02:07	192.168.1.8	172.217.24.14	Https	66	Ether / IP / TCP 192.168.1.8:12443 > 172.217.24.14:https S
309	2020-03-23 13:02:08	192.168.1.8	10.10.20.110	UDP	83	Ether / IP / UDP 192.168.1.8:59684 > 10.10.20.110:snmp / SNMP
310	2020-03-23 13:02:08	240e:d4:2efe:200:c1e4:29e:10f8:4eb	2404:6800:4012::200e	Https	86	Ether / IPv6 / TCP 240e:d4:2efe:200:c1e4:29e:10f8:4eb:12440 > 2404:6800:4012::200e:https S
311	2020-03-23 13:02:08	240e:d4:2efe:200:c1e4:29e:10f8:4eb	2404:6800:4012::200e	Https	86	Ether / IPv6 / TCP 240e:d4:2efe:200:c1e4:29e:10f8:4eb:12441 > 2404:6800:4012::200e:https S
312	2020-03-23 13:02:08	192.168.1.8	172.217.24.14	Https	66	Ether / IP / TCP 192.168.1.8:12442 > 172.217.24.14:https S
313	2020-03-23 13:02:08	192.168.1.8	172.217.24.14	Https	66	Ether / IP / TCP 192.168.1.8:12443 > 172.217.24.14:https S
314	2020-03-23 13:02:09	192.168.1.8	10.10.20.110	UDP	120	Ether / IP / UDP 192.168.1.8:59684 > 10.10.20.110:snmp / SNMP
315	2020-03-23 13:02:09	183.3.225.79	192.168.1.8	TCP	74	Ether / IP / TCP 183.3.225.79:36688 > 192.168.1.8:12417 PA / Raw
316	2020-03-23 13:02:09	192.168.1.8	183.3.225.79	TCP	282	Ether / IP / TCP 192.168.1.8:12417 > 183.3.225.79:36688 PA / Raw
317	2020-03-23 13:02:09	183.3.225.79	192.168.1.8	TCP	54	Ether / IP / TCP 183.3.225.79:36688 > 192.168.1.8:12417 A
318	2020-03-23 13:02:09	192.168.1.8	183.57.48.55	Http	66	Ether / IP / TCP 192.168.1.8:12456 > 183.57.48.55:http S
319	2020-03-23 13:02:09	183.57.48.55	192.168.1.8	Http	66	Ether / IP / TCP 183.57.48.55:http > 192.168.1.8:12456 SA
320	2020-03-23 13:02:09	192.168.1.8	183.57.48.55	Http	54	Ether / IP / TCP 192.168.1.8:12456 > 183.57.48.55:http A
321	2020-03-23 13:02:09	192.168.1.8	183.57.48.55	Http	433	Ether / IP / TCP / HTTP / 'POST' '/q.cgi' 'HTTP/1.1' / Raw
322	2020-03-23 13:02:09	183.57.48.55	192.168.1.8	Http	54	Ether / IP / TCP 183.57.48.55:http > 192.168.1.8:12456 A
323	2020-03-23 13:02:09	183.57.48.55	192.168.1.8	Http	1414	Ether / IP / TCP / HTTP / 'HTTP/1.1' '200' 'OK' / Raw
324	2020-03-23 13:02:09	183.57.48.55	192.168.1.8	Http	1414	Ether / IP / TCP 183.57.48.55:http > 192.168.1.8:12456 A / HTTP / Raw
325	2020-03-23 13:02:09	183.57.48.55	192.168.1.8	Http	1414	Ether / IP / TCP 183.57.48.55:http > 192.168.1.8:12456 A / HTTP / Raw
326	2020-03-23 13:02:09	183.57.48.55	192.168.1.8	Http	1414	Ether / IP / TCP 183.57.48.55:http > 192.168.1.8:12456 A / HTTP / Raw
327	2020-03-23 13:02:09	183.57.48.55	192.168.1.8	Http	1414	Ether / IP / TCP 183.57.48.55:http > 192.168.1.8:12456 A / HTTP / Raw
328	2020-03-23 13:02:09	183.57.48.55	192.168.1.8	Http	1414	Ether / IP / TCP 183.57.48.55:http > 192.168.1.8:12456 A / HTTP / Raw
329	2020-03-23 13:02:09	183.57.48.55	192.168.1.8	Http	1414	Ether / IP / TCP 183.57.48.55:http > 192.168.1.8:12456 A / HTTP / Raw
330	2020-03-23 13:02:09	183.57.48.55	192.168.1.8	Http	1414	Ether / IP / TCP 183.57.48.55:http > 192.168.1.8:12456 A / HTTP / Raw
331	2020-03-23 13:02:09	183.57.48.55	192.168.1.8	Http	370	Ether / IP / TCP 183.57.48.55:http > 192.168.1.8:12456 PA / HTTP / Raw
332	2020-03-23 13:02:09	192.168.1.8	183.57.48.55	Http	54	Ether / IP / TCP 192.168.1.8:12456 > 183.57.48.55:http A
333	2020-03-23 13:02:09	192.168.1.8	183.57.48.55	Http	54	Ether / IP / TCP 192.168.1.8:12456 > 183.57.48.55:http FA
334	2020-03-23 13:02:09	183.57.48.55	192.168.1.8	Http	54	Ether / IP / TCP 183.57.48.55:http > 192.168.1.8:12456 FA
335	2020-03-23 13:02:09	192.168.1.8	183.57.48.55	Http	54	Ether / IP / TCP 192.168.1.8:12456 > 183.57.48.55:http A
336	2020-03-23 13:02:09	192.168.1.8	183.57.48.55	Http	66	Ether / IP / TCP 192.168.1.8:12457 > 183.57.48.55:http S
337	2020-03-23 13:02:09	183.57.48.55	192.168.1.8	Http	66	Ether / IP / TCP 183.57.48.55:http > 192.168.1.8:12457 SA
338	2020-03-23 13:02:09	192.168.1.8	183.57.48.55	Http	54	Ether / IP / TCP 192.168.1.8:12457 > 183.57.48.55:http A
339	2020-03-23 13:02:09	192.168.1.8	183.57.48.55	Http	481	Ether / IP / TCP / HTTP / 'POST' '/q.cgi' 'HTTP/1.1' / Raw
340	2020-03-23 13:02:09	183.57.48.55	192.168.1.8	Http	54	Ether / IP / TCP 183.57.48.55:http > 192.168.1.8:12457 A
341	2020-03-23 13:02:09	183.57.48.55	192.168.1.8	Http	223	Ether / IP / TCP / HTTP / 'HTTP/1.1' '200' 'OK' / Raw
342	2020-03-23 13:02:09	192.168.1.8	183.57.48.55	Http	54	Ether / IP / TCP 192.168.1.8:12457 > 183.57.48.55:http FA
343	2020-03-23 13:02:09	183.57.48.55	192.168.1.8	Http	54	Ether / IP / TCP 183.57.48.55:http > 192.168.1.8:12457 FA
344	2020-03-23 13:02:09	192.168.1.8	183.57.48.55	Http	54	Ether / IP / TCP 192.168.1.8:12457 > 183.57.48.55:http A
345	2020-03-23 13:02:09	192.168.1.8	183.36.108.18	TCP	66	Ether / IP / TCP 192.168.1.8:12458 > 183.36.108.18:36688 S
346	2020-03-23 13:02:09	183.36.108.18	192.168.1.8	TCP	66	Ether / IP / TCP 183.36.108.18:36688 > 192.168.1.8:12458 SA
347	2020-03-23 13:02:09	192.168.1.8	183.36.108.18	TCP	54	Ether / IP / TCP 192.168.1.8:12458 > 183.36.108.18:36688 A
348	2020-03-23 13:02:09	192.168.1.8	183.36.108.18	TCP	294	Ether / IP / TCP 192.168.1.8:12458 > 183.36.108.18:36688 PA / Raw
349	2020-03-23 13:02:09	183.36.108.18	192.168.1.8	TCP	54	Ether / IP / TCP 183.36.108.18:36688 > 192.168.1.8:12458 A
350	2020-03-23 13:02:09	183.36.108.18	192.168.1.8	TCP	74	Ether / IP / TCP 183.36.108.18:36688 > 192.168.1.8:12458 PA / Raw
351	2020-03-23 13:02:09	192.168.1.8	183.36.108.18	TCP	328	Ether / IP / TCP 192.168.1.8:12458 > 183.36.108.18:36688 PA / Raw
352	2020-03-23 13:02:09	183.36.108.18	192.168.1.8	TCP	74	Ether / IP / TCP 183.36.108.18:36688 > 192.168.1.8:12458 PA / Raw
353	2020-03-23 13:02:09	192.168.1.8	183.36.108.18	TCP	54	Ether / IP / TCP 192.168.1.8:12458 > 183.36.108.18:36688 A
354	2020-03-23 13:02:10	192.168.1.8	140.143.213.113	Https	85	Ether / IP / TCP 192.168.1.8:12425 > 140.143.213.113:https PA / Raw
355	2020-03-23 13:02:10	192.168.1.8	140.143.213.113	Https	54	Ether / IP / TCP 192.168.1.8:12425 > 140.143.213.113:https FA
356	2020-03-23 13:02:10	140.143.213.113	192.168.1.8	Https	54	Ether / IP / TCP 140.143.213.113:https > 192.168.1.8:12425 A
357	2020-03-23 13:02:10	140.143.213.113	192.168.1.8	Https	85	Ether / IP / TCP 140.143.213.113:https > 192.168.1.8:12425 PA / Raw
358	2020-03-23 13:02:10	140.143.213.113	192.168.1.8	Https	54	Ether / IP / TCP 140.143.213.113:https > 192.168.1.8:12425 RA
359	2020-03-23 13:02:10	192.168.1.8	140.143.213.113	Https	54	Ether / IP / TCP 192.168.1.8:12425 > 140.143.213.113:https RA
360	2020-03-23 13:02:10	192.168.1.8	14.215.177.39	Https	54	Ether / IP / TCP 192.168.1.8:12390 > 14.215.177.39:https RA
361	2020-03-23 13:02:10	240e:d4:2efe:200:c1e4:29e:10f8:4eb	2404:6800:4012::200e	Https	86	Ether / IPv6 / TCP 240e:d4:2efe:200:c1e4:29e:10f8:4eb:12440 > 2404:6800:4012::200e:https S
362	2020-03-23 13:02:10	240e:d4:2efe:200:c1e4:29e:10f8:4eb	2404:6800:4012::200e	Https	86	Ether / IPv6 / TCP 240e:d4:2efe:200:c1e4:29e:10f8:4eb:12441 > 2404:6800:4012::200e:https S
363	2020-03-23 13:02:10	192.168.1.8	172.217.24.14	Https	66	Ether / IP / TCP 192.168.1.8:12442 > 172.217.24.14:https S
364	2020-03-23 13:02:10	192.168.1.8	14.215.177.39	Https	54	Ether / IP / TCP 192.168.1.8:12416 > 14.215.177.39:https FA
365	2020-03-23 13:02:10	192.168.1.8	172.217.24.14	Https	66	Ether / IP / TCP 192.168.1.8:12443 > 172.217.24.14:https S
366	2020-03-23 13:02:11	192.168.1.8	183.36.108.18	TCP	54	Ether / IP / TCP 192.168.1.8:12458 > 183.36.108.18:36688 FA
367	2020-03-23 13:02:11	183.36.108.18	192.168.1.8	TCP	54	Ether / IP / TCP 183.36.108.18:36688 > 192.168.1.8:12458 FA
368	2020-03-23 13:02:11	192.168.1.8	183.36.108.18	TCP	54	Ether / IP / TCP 192.168.1.8:12458 > 183.36.108.18:36688 A
369	2020-03-23 13:02:11	192.168.1.8	14.215.177.39	Https	66	Ether / IP / TCP 192.168.1.8:12463 > 14.215.177.39:https S
370	2020-03-23 13:02:11	14.215.177.39	192.168.1.8	Https	66	Ether / IP / TCP 14.215.177.39:https > 192.168.1.8:12463 SA
371	2020-03-23 13:02:11	192.168.1.8	14.215.177.39	Https	54	Ether / IP / TCP 192.168.1.8:12463 > 14.215.177.39:https A
372	2020-03-23 13:02:11	192.168.1.8	14.215.177.39	Https	54	Ether / IP / TCP 192.168.1.8:12463 > 14.215.177.39:https FA
373	2020-03-23 13:02:11	183.3.225.79	192.168.1.8	TCP	74	Ether / IP / TCP 183.3.225.79:36688 > 192.168.1.8:12417 PA / Raw
374	2020-03-23 13:02:11	192.168.1.8	183.3.225.79	TCP	282	Ether / IP / TCP 192.168.1.8:12417 > 183.3.225.79:36688 PA / Raw
375	2020-03-23 13:02:11	192.168.1.8	14.215.177.39	Https	54	Ether / IP / TCP 192.168.1.8:12463 > 14.215.177.39:https FA
376	2020-03-23 13:02:11	183.3.225.79	192.168.1.8	TCP	54	Ether / IP / TCP 183.3.225.79:36688 > 192.168.1.8:12417 A
377	2020-03-23 13:02:11	fe80::bd54:c78a:25f1:695	fe80::1	DNS	94	Ether / IPv6 / UDP / DNS Qry "b'api.github.com.'" 
378	2020-03-23 13:02:11	fe80::1	fe80::bd54:c78a:25f1:695	DNS	450	Ether / IPv6 / UDP / DNS Ans "140.82.112.5" 
379	2020-03-23 13:02:11	192.168.1.8	140.82.112.5	Https	66	Ether / IP / TCP 192.168.1.8:12464 > 140.82.112.5:https S
380	2020-03-23 13:02:12	9c:d2:4b:38:91:c1	b4:6b:fc:17:92:60	ARP	42	Ether / ARP who has 192.168.1.8 says 192.168.1.1
381	2020-03-23 13:02:12	b4:6b:fc:17:92:60	9c:d2:4b:38:91:c1	ARP	42	Ether / ARP is at b4:6b:fc:17:92:60 says 192.168.1.8
382	2020-03-23 13:02:12	140.82.112.5	192.168.1.8	Https	66	Ether / IP / TCP 140.82.112.5:https > 192.168.1.8:12464 SA
383	2020-03-23 13:02:12	192.168.1.8	140.82.112.5	Https	54	Ether / IP / TCP 192.168.1.8:12464 > 140.82.112.5:https A
384	2020-03-23 13:02:12	192.168.1.8	140.82.112.5	Https	485	Ether / IP / TCP 192.168.1.8:12464 > 140.82.112.5:https PA / Raw
385	2020-03-23 13:02:12	192.168.1.8	14.215.177.39	Https	54	Ether / IP / TCP 192.168.1.8:12463 > 14.215.177.39:https FA
386	2020-03-23 13:02:12	140.82.112.5	192.168.1.8	Https	1490	Ether / IP / TCP 140.82.112.5:https > 192.168.1.8:12464 A / Raw
387	2020-03-23 13:02:12	140.82.112.5	192.168.1.8	Https	1490	Ether / IP / TCP 140.82.112.5:https > 192.168.1.8:12464 A / Raw
388	2020-03-23 13:02:12	140.82.112.5	192.168.1.8	Https	612	Ether / IP / TCP 140.82.112.5:https > 192.168.1.8:12464 PA / Raw
389	2020-03-23 13:02:12	192.168.1.8	140.82.112.5	Https	54	Ether / IP / TCP 192.168.1.8:12464 > 140.82.112.5:https A
390	2020-03-23 13:02:12	192.168.1.8	140.82.112.5	Https	60	Ether / IP / TCP 192.168.1.8:12464 > 140.82.112.5:https PA / Raw
391	2020-03-23 13:02:12	192.168.1.8	140.82.112.5	Https	128	Ether / IP / TCP 192.168.1.8:12464 > 140.82.112.5:https PA / Raw
392	2020-03-23 13:02:12	192.168.1.8	140.82.112.5	Https	392	Ether / IP / TCP 192.168.1.8:12464 > 140.82.112.5:https PA / Raw
393	2020-03-23 13:02:12	140.82.112.5	192.168.1.8	Https	54	Ether / IP / TCP 140.82.112.5:https > 192.168.1.8:12464 A
394	2020-03-23 13:02:12	140.82.112.5	192.168.1.8	Https	133	Ether / IP / TCP 140.82.112.5:https > 192.168.1.8:12464 PA / Raw
395	2020-03-23 13:02:12	140.82.112.5	192.168.1.8	Https	133	Ether / IP / TCP 140.82.112.5:https > 192.168.1.8:12464 PA / Raw
396	2020-03-23 13:02:12	140.82.112.5	192.168.1.8	Https	54	Ether / IP / TCP 140.82.112.5:https > 192.168.1.8:12464 A
397	2020-03-23 13:02:12	192.168.1.8	140.82.112.5	Https	54	Ether / IP / TCP 192.168.1.8:12464 > 140.82.112.5:https A
398	2020-03-23 13:02:12	140.82.112.5	192.168.1.8	Https	1446	Ether / IP / TCP 140.82.112.5:https > 192.168.1.8:12464 PA / Raw
399	2020-03-23 13:02:12	140.82.112.5	192.168.1.8	Https	458	Ether / IP / TCP 140.82.112.5:https > 192.168.1.8:12464 PA / Raw
400	2020-03-23 13:02:12	192.168.1.8	140.82.112.5	Https	54	Ether / IP / TCP 192.168.1.8:12464 > 140.82.112.5:https A
401	2020-03-23 13:02:13	fe80::bd54:c78a:25f1:695	fe80::1	ICMPv6	86	Ether / IPv6 / ICMPv6ND_NS / ICMPv6 Neighbor Discovery Option - Source Link-Layer Address b4:6b:fc:17:92:60
402	2020-03-23 13:02:13	fe80::1	fe80::bd54:c78a:25f1:695	ICMPv6	78	Ether / IPv6 / ICMPv6 Neighbor Discovery - Neighbor Advertisement (tgt: fe80::1)
403	2020-03-23 13:02:13	192.168.1.8	140.82.112.5	Https	66	Ether / IP / TCP 192.168.1.8:12469 > 140.82.112.5:https S
404	2020-03-23 13:02:13	192.168.1.8	14.215.177.39	Https	54	Ether / IP / TCP 192.168.1.8:12463 > 14.215.177.39:https FA
405	2020-03-23 13:02:13	140.82.112.5	192.168.1.8	Https	66	Ether / IP / TCP 140.82.112.5:https > 192.168.1.8:12469 SA
406	2020-03-23 13:02:13	192.168.1.8	140.82.112.5	Https	54	Ether / IP / TCP 192.168.1.8:12469 > 140.82.112.5:https A
407	2020-03-23 13:02:13	192.168.1.8	140.82.112.5	Https	532	Ether / IP / TCP 192.168.1.8:12469 > 140.82.112.5:https PA / Raw
408	2020-03-23 13:02:13	192.168.1.8	159.226.251.13	Https	90	Ether / IP / TCP 192.168.1.8:9122 > 159.226.251.13:https PA / Raw
409	2020-03-23 13:02:13	159.226.251.13	192.168.1.8	Https	86	Ether / IP / TCP 159.226.251.13:https > 192.168.1.8:9122 PA / Raw
410	2020-03-23 13:02:13	192.168.1.8	159.226.251.13	Https	54	Ether / IP / TCP 192.168.1.8:9122 > 159.226.251.13:https A
411	2020-03-23 13:02:14	140.82.112.5	192.168.1.8	Https	1490	Ether / IP / TCP 140.82.112.5:https > 192.168.1.8:12469 A / Raw
412	2020-03-23 13:02:14	140.82.112.5	192.168.1.8	Https	1490	Ether / IP / TCP 140.82.112.5:https > 192.168.1.8:12469 A / Raw
413	2020-03-23 13:02:14	140.82.112.5	192.168.1.8	Https	580	Ether / IP / TCP 140.82.112.5:https > 192.168.1.8:12469 PA / Raw
414	2020-03-23 13:02:14	178.128.83.14	192.168.1.8	Http	54	Ether / IP / TCP 178.128.83.14:http > 192.168.1.8:11325 A
415	2020-03-23 13:02:14	192.168.1.8	178.128.83.14	Http	54	Ether / IP / TCP 192.168.1.8:11325 > 178.128.83.14:http A
416	2020-03-23 13:02:14	192.168.1.8	140.82.112.5	Https	54	Ether / IP / TCP 192.168.1.8:12469 > 140.82.112.5:https A
417	2020-03-23 13:02:14	192.168.1.8	140.82.112.5	Https	128	Ether / IP / TCP 192.168.1.8:12469 > 140.82.112.5:https PA / Raw
418	2020-03-23 13:02:14	192.168.1.8	140.82.112.5	Https	411	Ether / IP / TCP 192.168.1.8:12469 > 140.82.112.5:https PA / Raw
419	2020-03-23 13:02:14	240e:d4:2efe:200:c1e4:29e:10f8:4eb	2404:6800:4012::200e	Https	86	Ether / IPv6 / TCP 240e:d4:2efe:200:c1e4:29e:10f8:4eb:12440 > 2404:6800:4012::200e:https S
420	2020-03-23 13:02:14	240e:d4:2efe:200:c1e4:29e:10f8:4eb	2404:6800:4012::200e	Https	86	Ether / IPv6 / TCP 240e:d4:2efe:200:c1e4:29e:10f8:4eb:12441 > 2404:6800:4012::200e:https S
421	2020-03-23 13:02:14	140.82.112.5	192.168.1.8	Https	133	Ether / IP / TCP 140.82.112.5:https > 192.168.1.8:12469 PA / Raw
422	2020-03-23 13:02:14	140.82.112.5	192.168.1.8	Https	133	Ether / IP / TCP 140.82.112.5:https > 192.168.1.8:12469 PA / Raw
423	2020-03-23 13:02:14	192.168.1.8	140.82.112.5	Https	54	Ether / IP / TCP 192.168.1.8:12469 > 140.82.112.5:https A
424	2020-03-23 13:02:14	192.168.1.8	172.217.24.14	Https	66	Ether / IP / TCP 192.168.1.8:12442 > 172.217.24.14:https S
425	2020-03-23 13:02:14	140.82.112.5	192.168.1.8	Https	54	Ether / IP / TCP 140.82.112.5:https > 192.168.1.8:12469 A
426	2020-03-23 13:02:14	140.82.112.5	192.168.1.8	Https	1446	Ether / IP / TCP 140.82.112.5:https > 192.168.1.8:12469 PA / Raw
427	2020-03-23 13:02:14	140.82.112.5	192.168.1.8	Https	81	Ether / IP / TCP 140.82.112.5:https > 192.168.1.8:12469 PA / Raw
428	2020-03-23 13:02:14	192.168.1.8	140.82.112.5	Https	66	Ether / IP / TCP 192.168.1.8:12469 > 140.82.112.5:https A
429	2020-03-23 13:02:14	192.168.1.8	172.217.24.14	Https	66	Ether / IP / TCP 192.168.1.8:12443 > 172.217.24.14:https S
430	2020-03-23 13:02:15	140.82.112.5	192.168.1.8	Https	1270	Ether / IP / TCP 140.82.112.5:https > 192.168.1.8:12469 PA / Raw
431	2020-03-23 13:02:15	183.3.225.79	192.168.1.8	TCP	54	Ether / IP / TCP 183.3.225.79:36688 > 192.168.1.8:12417 A
432	2020-03-23 13:02:15	192.168.1.8	140.82.112.5	Https	54	Ether / IP / TCP 192.168.1.8:12469 > 140.82.112.5:https A
433	2020-03-23 13:02:15	192.168.1.8	183.3.225.79	TCP	54	Ether / IP / TCP 192.168.1.8:12417 > 183.3.225.79:36688 A
434	2020-03-23 13:02:15	192.168.1.8	140.82.112.5	Https	94	Ether / IP / TCP 192.168.1.8:12469 > 140.82.112.5:https PA / Raw
435	2020-03-23 13:02:15	192.168.1.8	140.82.112.5	Https	94	Ether / IP / TCP 192.168.1.8:12469 > 140.82.112.5:https PA / Raw
436	2020-03-23 13:02:15	192.168.1.8	140.82.112.5	Https	54	Ether / IP / TCP 192.168.1.8:12469 > 140.82.112.5:https FA
437	2020-03-23 13:02:15	192.168.1.8	140.82.112.5	Https	54	Ether / IP / TCP 192.168.1.8:12469 > 140.82.112.5:https RA
438	2020-03-23 13:02:15	140.82.112.5	192.168.1.8	Https	54	Ether / IP / TCP 140.82.112.5:https > 192.168.1.8:12469 A
439	2020-03-23 13:02:15	140.82.112.5	192.168.1.8	Https	54	Ether / IP / TCP 140.82.112.5:https > 192.168.1.8:12469 A
440	2020-03-23 13:02:15	140.82.112.5	192.168.1.8	Https	78	Ether / IP / TCP 140.82.112.5:https > 192.168.1.8:12469 PA / Raw
441	2020-03-23 13:02:15	140.82.112.5	192.168.1.8	Https	54	Ether / IP / TCP 140.82.112.5:https > 192.168.1.8:12469 FA
442	2020-03-23 13:02:15	140.82.112.5	192.168.1.8	Https	54	Ether / IP / TCP 140.82.112.5:https > 192.168.1.8:12469 A
443	2020-03-23 13:02:15	192.168.1.8	140.82.112.5	Https	66	Ether / IP / TCP 192.168.1.8:12470 > 140.82.112.5:https S
444	2020-03-23 13:02:15	192.168.1.8	14.215.177.39	Https	54	Ether / IP / TCP 192.168.1.8:12463 > 14.215.177.39:https FA
445	2020-03-23 13:02:16	192.168.1.8	140.82.112.5	Https	66	Ether / IP / TCP 192.168.1.8:12470 > 140.82.112.5:https S
446	2020-03-23 13:02:16	140.82.112.5	192.168.1.8	Https	66	Ether / IP / TCP 140.82.112.5:https > 192.168.1.8:12470 SA
447	2020-03-23 13:02:16	192.168.1.8	140.82.112.5	Https	54	Ether / IP / TCP 192.168.1.8:12470 > 140.82.112.5:https A
448	2020-03-23 13:02:16	192.168.1.8	140.82.112.5	Https	532	Ether / IP / TCP 192.168.1.8:12470 > 140.82.112.5:https PA / Raw
449	2020-03-23 13:02:17	114.112.66.247	192.168.1.8	Https	85	Ether / IP / TCP 114.112.66.247:https > 192.168.1.8:12188 PA / Raw
450	2020-03-23 13:02:17	114.112.66.247	192.168.1.8	Https	54	Ether / IP / TCP 114.112.66.247:https > 192.168.1.8:12188 FA
451	2020-03-23 13:02:17	192.168.1.8	114.112.66.247	Https	54	Ether / IP / TCP 192.168.1.8:12188 > 114.112.66.247:https A
452	2020-03-23 13:02:17	192.168.1.8	114.112.66.247	Https	54	Ether / IP / TCP 192.168.1.8:12188 > 114.112.66.247:https FA
453	2020-03-23 13:02:17	114.112.66.247	192.168.1.8	Https	54	Ether / IP / TCP 114.112.66.247:https > 192.168.1.8:12188 A
454	2020-03-23 13:02:17	140.82.112.5	192.168.1.8	Https	1490	Ether / IP / TCP 140.82.112.5:https > 192.168.1.8:12470 A / Raw
455	2020-03-23 13:02:17	140.82.112.5	192.168.1.8	Https	1490	Ether / IP / TCP 140.82.112.5:https > 192.168.1.8:12470 A / Raw
456	2020-03-23 13:02:17	140.82.112.5	192.168.1.8	Https	580	Ether / IP / TCP 140.82.112.5:https > 192.168.1.8:12470 PA / Raw
457	2020-03-23 13:02:17	192.168.1.8	140.82.112.5	Https	54	Ether / IP / TCP 192.168.1.8:12470 > 140.82.112.5:https A
458	2020-03-23 13:02:17	192.168.1.8	140.82.112.5	Https	128	Ether / IP / TCP 192.168.1.8:12470 > 140.82.112.5:https PA / Raw
459	2020-03-23 13:02:17	192.168.1.8	140.82.112.5	Https	450	Ether / IP / TCP 192.168.1.8:12470 > 140.82.112.5:https PA / Raw
460	2020-03-23 13:02:17	192.168.1.8	140.82.112.5	Https	999	Ether / IP / TCP 192.168.1.8:12470 > 140.82.112.5:https PA / Raw
461	2020-03-23 13:02:17	192.168.1.8	178.128.83.14	Http	55	Ether / IP / TCP 192.168.1.8:11325 > 178.128.83.14:http A / HTTP / Raw
462	2020-03-23 13:02:17	140.82.112.5	192.168.1.8	Https	133	Ether / IP / TCP 140.82.112.5:https > 192.168.1.8:12470 PA / Raw
463	2020-03-23 13:02:17	140.82.112.5	192.168.1.8	Https	133	Ether / IP / TCP 140.82.112.5:https > 192.168.1.8:12470 PA / Raw
464	2020-03-23 13:02:17	192.168.1.8	140.82.112.5	Https	54	Ether / IP / TCP 192.168.1.8:12470 > 140.82.112.5:https A
465	2020-03-23 13:02:17	140.82.112.5	192.168.1.8	Https	54	Ether / IP / TCP 140.82.112.5:https > 192.168.1.8:12470 A
466	2020-03-23 13:02:17	140.82.112.5	192.168.1.8	Https	54	Ether / IP / TCP 140.82.112.5:https > 192.168.1.8:12470 A
467	2020-03-23 13:02:17	192.168.1.8	178.128.83.14	Http	55	Ether / IP / TCP 192.168.1.8:11325 > 178.128.83.14:http A / HTTP / Raw
468	2020-03-23 13:02:18	192.168.1.8	14.17.43.252	UDP	70	Ether / IP / UDP 192.168.1.8:20671 > 14.17.43.252:8000 / Raw
469	2020-03-23 13:02:18	192.168.1.8	14.17.43.252	UDP	70	Ether / IP / UDP 192.168.1.8:20672 > 14.17.43.252:8000 / Raw
470	2020-03-23 13:02:18	192.168.1.8	14.17.43.252	UDP	70	Ether / IP / UDP 192.168.1.8:20672 > 14.17.43.252:8000 / Raw
471	2020-03-23 13:02:18	14.17.43.252	192.168.1.8	UDP	98	Ether / IP / UDP 14.17.43.252:8000 > 192.168.1.8:20671 / Raw
472	2020-03-23 13:02:18	178.128.83.14	192.168.1.8	Http	66	Ether / IP / TCP 178.128.83.14:http > 192.168.1.8:11325 A
473	2020-03-23 13:02:18	192.168.1.8	14.17.43.154	UDP	70	Ether / IP / UDP 192.168.1.8:20671 > 14.17.43.154:8000 / Raw
474	2020-03-23 13:02:18	14.17.43.154	192.168.1.8	UDP	98	Ether / IP / UDP 14.17.43.154:8000 > 192.168.1.8:20671 / Raw
475	2020-03-23 13:02:18	192.168.1.8	140.82.112.5	Https	94	Ether / IP / TCP 192.168.1.8:12464 > 140.82.112.5:https PA / Raw
476	2020-03-23 13:02:18	192.168.1.8	140.82.112.5	Https	94	Ether / IP / TCP 192.168.1.8:12464 > 140.82.112.5:https PA / Raw
477	2020-03-23 13:02:18	192.168.1.8	140.82.112.5	Https	54	Ether / IP / TCP 192.168.1.8:12464 > 140.82.112.5:https FA
478	2020-03-23 13:02:18	192.168.1.8	14.17.43.252	UDP	70	Ether / IP / UDP 192.168.1.8:20672 > 14.17.43.252:8000 / Raw
479	2020-03-23 13:02:18	140.82.112.5	192.168.1.8	Https	1262	Ether / IP / TCP 140.82.112.5:https > 192.168.1.8:12470 PA / Raw
480	2020-03-23 13:02:18	192.168.1.8	14.17.43.252	UDP	70	Ether / IP / UDP 192.168.1.8:20672 > 14.17.43.252:8000 / Raw
481	2020-03-23 13:02:18	192.168.1.8	140.82.112.5	Https	54	Ether / IP / TCP 192.168.1.8:12470 > 140.82.112.5:https A
482	2020-03-23 13:02:18	192.168.1.8	121.207.80.164	UDP	70	Ether / IP / UDP 192.168.1.8:20671 > 121.207.80.164:3166 / Raw
483	2020-03-23 13:02:18	121.207.80.164	192.168.1.8	UDP	70	Ether / IP / UDP 121.207.80.164:3166 > 192.168.1.8:20671 / Raw
484	2020-03-23 13:02:18	140.82.112.5	192.168.1.8	Https	54	Ether / IP / TCP 140.82.112.5:https > 192.168.1.8:12464 A
485	2020-03-23 13:02:18	140.82.112.5	192.168.1.8	Https	54	Ether / IP / TCP 140.82.112.5:https > 192.168.1.8:12464 A
486	2020-03-23 13:02:18	140.82.112.5	192.168.1.8	Https	78	Ether / IP / TCP 140.82.112.5:https > 192.168.1.8:12464 PA / Raw
487	2020-03-23 13:02:18	140.82.112.5	192.168.1.8	Https	54	Ether / IP / TCP 140.82.112.5:https > 192.168.1.8:12464 FA
488	2020-03-23 13:02:18	192.168.1.8	140.82.112.5	Https	54	Ether / IP / TCP 192.168.1.8:12464 > 140.82.112.5:https RA
489	2020-03-23 13:02:18	192.168.1.8	14.17.43.252	UDP	70	Ether / IP / UDP 192.168.1.8:20672 > 14.17.43.252:8000 / Raw
490	2020-03-23 13:02:18	192.168.1.8	14.17.43.252	UDP	70	Ether / IP / UDP 192.168.1.8:20672 > 14.17.43.252:8000 / Raw
491	2020-03-23 13:02:19	192.168.1.8	10.10.20.110	UDP	120	Ether / IP / UDP 192.168.1.8:59684 > 10.10.20.110:snmp / SNMP
492	2020-03-23 13:02:19	192.168.1.8	14.17.43.252	UDP	70	Ether / IP / UDP 192.168.1.8:20672 > 14.17.43.252:8000 / Raw
493	2020-03-23 13:02:19	192.168.1.8	14.17.43.252	UDP	70	Ether / IP / UDP 192.168.1.8:20672 > 14.17.43.252:8000 / Raw
494	2020-03-23 13:02:19	192.168.1.8	14.17.43.252	UDP	70	Ether / IP / UDP 192.168.1.8:20672 > 14.17.43.252:8000 / Raw
495	2020-03-23 13:02:19	192.168.1.8	14.17.43.252	UDP	70	Ether / IP / UDP 192.168.1.8:20672 > 14.17.43.252:8000 / Raw
496	2020-03-23 13:02:19	192.168.1.8	14.17.43.252	UDP	70	Ether / IP / UDP 192.168.1.8:20672 > 14.17.43.252:8000 / Raw
497	2020-03-23 13:02:20	192.168.1.8	14.17.43.252	UDP	70	Ether / IP / UDP 192.168.1.8:20672 > 14.17.43.252:8000 / Raw
498	2020-03-23 13:02:20	192.168.1.8	14.215.177.39	Https	54	Ether / IP / TCP 192.168.1.8:12416 > 14.215.177.39:https RA
499	2020-03-23 13:02:20	192.168.1.8	14.17.43.252	UDP	70	Ether / IP / UDP 192.168.1.8:20672 > 14.17.43.252:8000 / Raw
500	2020-03-23 13:02:20	192.168.1.8	14.17.43.252	UDP	70	Ether / IP / UDP 192.168.1.8:20672 > 14.17.43.252:8000 / Raw
501	2020-03-23 13:02:20	192.168.1.8	14.215.177.39	Https	54	Ether / IP / TCP 192.168.1.8:12463 > 14.215.177.39:https FA
502	2020-03-23 13:02:20	192.168.1.8	14.17.43.252	UDP	70	Ether / IP / UDP 192.168.1.8:20672 > 14.17.43.252:8000 / Raw
503	2020-03-23 13:02:20	192.168.1.8	14.17.43.252	UDP	70	Ether / IP / UDP 192.168.1.8:20672 > 14.17.43.252:8000 / Raw
504	2020-03-23 13:02:20	192.168.1.8	101.91.62.179	UDP	95	Ether / IP / UDP 192.168.1.8:msnp > 101.91.62.179:8000 / Raw
505	2020-03-23 13:02:20	101.91.62.179	192.168.1.8	UDP	72	Ether / IP / UDP 101.91.62.179:8000 > 192.168.1.8:msnp / Raw
506	2020-03-23 13:02:21	192.168.1.8	14.215.177.39	Https	66	Ether / IP / TCP 192.168.1.8:12483 > 14.215.177.39:https S
507	2020-03-23 13:02:21	14.215.177.39	192.168.1.8	Https	66	Ether / IP / TCP 14.215.177.39:https > 192.168.1.8:12483 SA
508	2020-03-23 13:02:21	192.168.1.8	14.215.177.39	Https	54	Ether / IP / TCP 192.168.1.8:12483 > 14.215.177.39:https A
509	2020-03-23 13:02:21	192.168.1.8	14.215.177.39	Https	54	Ether / IP / TCP 192.168.1.8:12483 > 14.215.177.39:https FA
510	2020-03-23 13:02:21	192.168.1.8	14.215.177.39	Https	54	Ether / IP / TCP 192.168.1.8:12483 > 14.215.177.39:https FA
511	2020-03-23 13:02:22	192.168.1.8	14.215.177.39	Https	54	Ether / IP / TCP 192.168.1.8:12483 > 14.215.177.39:https FA
512	2020-03-23 13:02:22	240e:d4:2efe:200:c1e4:29e:10f8:4eb	2404:6800:4012::200e	Https	86	Ether / IPv6 / TCP 240e:d4:2efe:200:c1e4:29e:10f8:4eb:12440 > 2404:6800:4012::200e:https S
513	2020-03-23 13:02:22	240e:d4:2efe:200:c1e4:29e:10f8:4eb	2404:6800:4012::200e	Https	86	Ether / IPv6 / TCP 240e:d4:2efe:200:c1e4:29e:10f8:4eb:12441 > 2404:6800:4012::200e:https S
514	2020-03-23 13:02:22	fe80::bd54:c78a:25f1:695	ff02::c	UDP	714	Ether / IPv6 / UDP fe80::bd54:c78a:25f1:695:57097 > ff02::c:ws_discovery / Raw
515	2020-03-23 13:02:22	192.168.1.8	239.255.255.250	UDP	694	Ether / IP / UDP 192.168.1.8:57096 > 239.255.255.250:ws_discovery / Raw
516	2020-03-23 13:02:22	192.168.1.8	172.217.24.14	Https	66	Ether / IP / TCP 192.168.1.8:12442 > 172.217.24.14:https S
517	2020-03-23 13:02:22	192.168.1.8	239.255.255.250	UDP	694	Ether / IP / UDP 192.168.1.8:57096 > 239.255.255.250:ws_discovery / Raw
518	2020-03-23 13:02:22	fe80::1	fe80::bd54:c78a:25f1:695	ICMPv6	86	Ether / IPv6 / ICMPv6ND_NS / ICMPv6 Neighbor Discovery Option - Source Link-Layer Address 9c:d2:4b:38:91:c1
519	2020-03-23 13:02:22	fe80::bd54:c78a:25f1:695	fe80::1	ICMPv6	86	Ether / IPv6 / ICMPv6ND_NA / ICMPv6 Neighbor Discovery Option - Destination Link-Layer Address b4:6b:fc:17:92:60
520	2020-03-23 13:02:22	fe80::bd54:c78a:25f1:695	ff02::c	UDP	714	Ether / IPv6 / UDP fe80::bd54:c78a:25f1:695:57097 > ff02::c:ws_discovery / Raw
521	2020-03-23 13:02:22	192.168.1.8	172.217.24.14	Https	66	Ether / IP / TCP 192.168.1.8:12443 > 172.217.24.14:https S
522	2020-03-23 13:02:22	192.168.1.8	239.255.255.250	UDP	694	Ether / IP / UDP 192.168.1.8:57096 > 239.255.255.250:ws_discovery / Raw
523	2020-03-23 13:02:23	fe80::bd54:c78a:25f1:695	ff02::c	UDP	714	Ether / IPv6 / UDP fe80::bd54:c78a:25f1:695:57097 > ff02::c:ws_discovery / Raw
524	2020-03-23 13:02:23	fe80::bd54:c78a:25f1:695	fe80::1	DNS	90	Ether / IPv6 / UDP / DNS Qry "b'github.com.'" 
525	2020-03-23 13:02:23	fe80::bd54:c78a:25f1:695	fe80::1	DNS	90	Ether / IPv6 / UDP / DNS Qry "b'github.com.'" 
526	2020-03-23 13:02:23	fe80::1	fe80::bd54:c78a:25f1:695	DNS	574	Ether / IPv6 / UDP / DNS Ans "52.74.223.119" 
527	2020-03-23 13:02:23	fe80::1	fe80::bd54:c78a:25f1:695	DNS	155	Ether / IPv6 / UDP / DNS Ans 
528	2020-03-23 13:02:23	192.168.1.8	52.74.223.119	Https	66	Ether / IP / TCP 192.168.1.8:12488 > 52.74.223.119:https S
529	2020-03-23 13:02:23	192.168.1.8	183.3.225.78	TCP	66	Ether / IP / TCP 192.168.1.8:12489 > 183.3.225.78:36688 S
530	2020-03-23 13:02:23	183.3.225.78	192.168.1.8	TCP	66	Ether / IP / TCP 183.3.225.78:36688 > 192.168.1.8:12489 SA
531	2020-03-23 13:02:23	192.168.1.8	183.3.225.78	TCP	54	Ether / IP / TCP 192.168.1.8:12489 > 183.3.225.78:36688 A
532	2020-03-23 13:02:23	192.168.1.8	183.3.225.78	TCP	556	Ether / IP / TCP 192.168.1.8:12489 > 183.3.225.78:36688 PA / Raw
533	2020-03-23 13:02:23	192.168.1.8	14.215.177.39	Https	54	Ether / IP / TCP 192.168.1.8:12483 > 14.215.177.39:https FA
534	2020-03-23 13:02:23	183.3.225.78	192.168.1.8	TCP	54	Ether / IP / TCP 183.3.225.78:36688 > 192.168.1.8:12489 A
535	2020-03-23 13:02:23	183.3.225.78	192.168.1.8	TCP	74	Ether / IP / TCP 183.3.225.78:36688 > 192.168.1.8:12489 PA / Raw
536	2020-03-23 13:02:23	192.168.1.8	183.3.225.78	TCP	54	Ether / IP / TCP 192.168.1.8:12489 > 183.3.225.78:36688 A
537	2020-03-23 13:02:23	192.168.1.8	239.255.255.250	UDP	694	Ether / IP / UDP 192.168.1.8:57096 > 239.255.255.250:ws_discovery / Raw
538	2020-03-23 13:02:23	192.168.1.8	140.82.112.5	Https	94	Ether / IP / TCP 192.168.1.8:12470 > 140.82.112.5:https PA / Raw
539	2020-03-23 13:02:23	192.168.1.8	140.82.112.5	Https	94	Ether / IP / TCP 192.168.1.8:12470 > 140.82.112.5:https PA / Raw
540	2020-03-23 13:02:23	192.168.1.8	140.82.112.5	Https	54	Ether / IP / TCP 192.168.1.8:12470 > 140.82.112.5:https FA
541	2020-03-23 13:02:23	192.168.1.8	183.3.225.78	TCP	1414	Ether / IP / TCP 192.168.1.8:12489 > 183.3.225.78:36688 A / Raw
542	2020-03-23 13:02:23	192.168.1.8	183.3.225.78	TCP	546	Ether / IP / TCP 192.168.1.8:12489 > 183.3.225.78:36688 PA / Raw
543	2020-03-23 13:02:23	183.3.225.78	192.168.1.8	TCP	54	Ether / IP / TCP 183.3.225.78:36688 > 192.168.1.8:12489 A
544	2020-03-23 13:02:23	183.3.225.78	192.168.1.8	TCP	74	Ether / IP / TCP 183.3.225.78:36688 > 192.168.1.8:12489 PA / Raw
545	2020-03-23 13:02:23	192.168.1.8	183.3.225.78	TCP	54	Ether / IP / TCP 192.168.1.8:12489 > 183.3.225.78:36688 A
546	2020-03-23 13:02:24	fe80::bd54:c78a:25f1:695	ff02::c	UDP	714	Ether / IPv6 / UDP fe80::bd54:c78a:25f1:695:57097 > ff02::c:ws_discovery / Raw
547	2020-03-23 13:02:24	140.82.112.5	192.168.1.8	Https	54	Ether / IP / TCP 140.82.112.5:https > 192.168.1.8:12470 A
548	2020-03-23 13:02:24	140.82.112.5	192.168.1.8	Https	54	Ether / IP / TCP 140.82.112.5:https > 192.168.1.8:12470 A
549	2020-03-23 13:02:24	140.82.112.5	192.168.1.8	Https	78	Ether / IP / TCP 140.82.112.5:https > 192.168.1.8:12470 PA / Raw
550	2020-03-23 13:02:24	140.82.112.5	192.168.1.8	Https	54	Ether / IP / TCP 140.82.112.5:https > 192.168.1.8:12470 FA
551	2020-03-23 13:02:24	192.168.1.8	140.82.112.5	Https	54	Ether / IP / TCP 192.168.1.8:12470 > 140.82.112.5:https RA
552	2020-03-23 13:02:24	192.168.1.8	52.74.223.119	Https	66	Ether / IP / TCP 192.168.1.8:12488 > 52.74.223.119:https S
553	2020-03-23 13:02:24	52.74.223.119	192.168.1.8	Https	66	Ether / IP / TCP 52.74.223.119:https > 192.168.1.8:12488 SA
554	2020-03-23 13:02:24	192.168.1.8	52.74.223.119	Https	54	Ether / IP / TCP 192.168.1.8:12488 > 52.74.223.119:https A
555	2020-03-23 13:02:24	192.168.1.8	52.74.223.119	Https	571	Ether / IP / TCP 192.168.1.8:12488 > 52.74.223.119:https PA / Raw
556	2020-03-23 13:02:24	52.74.223.119	192.168.1.8	Https	1490	Ether / IP / TCP 52.74.223.119:https > 192.168.1.8:12488 A / Raw
557	2020-03-23 13:02:24	192.168.1.8	52.74.223.119	Https	66	Ether / IP / TCP 192.168.1.8:12488 > 52.74.223.119:https A
558	2020-03-23 13:02:24	192.168.1.8	239.255.255.250	UDP	694	Ether / IP / UDP 192.168.1.8:57096 > 239.255.255.250:ws_discovery / Raw
559	2020-03-23 13:02:24	192.168.1.8	183.3.225.78	TCP	54	Ether / IP / TCP 192.168.1.8:12489 > 183.3.225.78:36688 FA
560	2020-03-23 13:02:24	52.74.223.119	192.168.1.8	Https	1490	Ether / IP / TCP 52.74.223.119:https > 192.168.1.8:12488 A / Raw
561	2020-03-23 13:02:24	192.168.1.8	52.74.223.119	Https	54	Ether / IP / TCP 192.168.1.8:12488 > 52.74.223.119:https A
562	2020-03-23 13:02:24	183.3.225.78	192.168.1.8	TCP	54	Ether / IP / TCP 183.3.225.78:36688 > 192.168.1.8:12489 FA
563	2020-03-23 13:02:24	192.168.1.8	183.3.225.78	TCP	54	Ether / IP / TCP 192.168.1.8:12489 > 183.3.225.78:36688 A
564	2020-03-23 13:02:25	52.74.223.119	192.168.1.8	Https	818	Ether / IP / TCP 52.74.223.119:https > 192.168.1.8:12488 PA / Raw
565	2020-03-23 13:02:25	192.168.1.8	52.74.223.119	Https	118	Ether / IP / TCP 192.168.1.8:12488 > 52.74.223.119:https PA / Raw
566	2020-03-23 13:02:25	192.168.1.8	52.74.223.119	Https	265	Ether / IP / TCP 192.168.1.8:12488 > 52.74.223.119:https PA / Raw
567	2020-03-23 13:02:25	52.74.223.119	192.168.1.8	Https	133	Ether / IP / TCP 52.74.223.119:https > 192.168.1.8:12488 PA / Raw
568	2020-03-23 13:02:25	192.168.1.8	52.74.223.119	Https	54	Ether / IP / TCP 192.168.1.8:12488 > 52.74.223.119:https A
569	2020-03-23 13:02:25	52.74.223.119	192.168.1.8	Https	133	Ether / IP / TCP 52.74.223.119:https > 192.168.1.8:12488 PA / Raw
570	2020-03-23 13:02:25	192.168.1.8	52.74.223.119	Https	54	Ether / IP / TCP 192.168.1.8:12488 > 52.74.223.119:https A
571	2020-03-23 13:02:25	192.168.1.8	14.215.177.39	Https	54	Ether / IP / TCP 192.168.1.8:12483 > 14.215.177.39:https FA
572	2020-03-23 13:02:25	52.74.223.119	192.168.1.8	Https	326	Ether / IP / TCP 52.74.223.119:https > 192.168.1.8:12488 PA / Raw
573	2020-03-23 13:02:25	192.168.1.8	52.74.223.119	Https	54	Ether / IP / TCP 192.168.1.8:12488 > 52.74.223.119:https A
574	2020-03-23 13:02:25	fe80::bd54:c78a:25f1:695	ff02::c	UDP	714	Ether / IPv6 / UDP fe80::bd54:c78a:25f1:695:57097 > ff02::c:ws_discovery / Raw
575	2020-03-23 13:02:26	240e:d4:2efe:200:c1e4:29e:10f8:4eb	2401:c900:1001:163::4	Https	98	Ether / IPv6 / TCP 240e:d4:2efe:200:c1e4:29e:10f8:4eb:10348 > 2401:c900:1001:163::4:https PA / Raw
576	2020-03-23 13:02:26	192.168.1.8	239.255.255.250	UDP	694	Ether / IP / UDP 192.168.1.8:57096 > 239.255.255.250:ws_discovery / Raw
577	2020-03-23 13:02:27	2401:c900:1001:163::4	240e:d4:2efe:200:c1e4:29e:10f8:4eb	Https	98	Ether / IPv6 / TCP 2401:c900:1001:163::4:https > 240e:d4:2efe:200:c1e4:29e:10f8:4eb:10348 PA / Raw
578	2020-03-23 13:02:27	240e:d4:2efe:200:c1e4:29e:10f8:4eb	2401:c900:1001:163::4	Https	74	Ether / IPv6 / TCP 240e:d4:2efe:200:c1e4:29e:10f8:4eb:10348 > 2401:c900:1001:163::4:https A
579	2020-03-23 13:02:27	192.168.1.8	154.8.190.35	Https	54	Ether / IP / TCP 192.168.1.8:12398 > 154.8.190.35:https RA
580	2020-03-23 13:02:27	192.168.1.8	52.74.223.119	Https	356	Ether / IP / TCP 192.168.1.8:12488 > 52.74.223.119:https PA / Raw
581	2020-03-23 13:02:27	52.74.223.119	192.168.1.8	Https	54	Ether / IP / TCP 52.74.223.119:https > 192.168.1.8:12488 A
582	2020-03-23 13:02:27	fe80::bd54:c78a:25f1:695	ff02::c	UDP	714	Ether / IPv6 / UDP fe80::bd54:c78a:25f1:695:57097 > ff02::c:ws_discovery / Raw
583	2020-03-23 13:02:28	192.168.1.8	172.217.24.14	Https	66	Ether / IP / TCP 192.168.1.8:12500 > 172.217.24.14:https S
584	2020-03-23 13:02:28	192.168.1.8	172.217.24.14	Https	66	Ether / IP / TCP 192.168.1.8:12501 > 172.217.24.14:https S
585	2020-03-23 13:02:28	178.128.83.14	192.168.1.8	Http	54	Ether / IP / TCP 178.128.83.14:http > 192.168.1.8:11325 A
586	2020-03-23 13:02:28	192.168.1.8	178.128.83.14	Http	54	Ether / IP / TCP 192.168.1.8:11325 > 178.128.83.14:http A
587	2020-03-23 13:02:28	240e:d4:2efe:200:c1e4:29e:10f8:4eb	2404:6800:4012::200e	Https	86	Ether / IPv6 / TCP 240e:d4:2efe:200:c1e4:29e:10f8:4eb:12502 > 2404:6800:4012::200e:https S
588	2020-03-23 13:02:28	52.74.223.119	192.168.1.8	Https	467	Ether / IP / TCP 52.74.223.119:https > 192.168.1.8:12488 PA / Raw
589	2020-03-23 13:02:28	192.168.1.8	52.74.223.119	Https	54	Ether / IP / TCP 192.168.1.8:12488 > 52.74.223.119:https A
590	2020-03-23 13:02:28	52.74.223.119	192.168.1.8	Https	80	Ether / IP / TCP 52.74.223.119:https > 192.168.1.8:12488 PA / Raw
591	2020-03-23 13:02:28	192.168.1.8	52.74.223.119	Https	54	Ether / IP / TCP 192.168.1.8:12488 > 52.74.223.119:https A
592	2020-03-23 13:02:28	192.168.1.8	239.255.255.250	UDP	694	Ether / IP / UDP 192.168.1.8:57096 > 239.255.255.250:ws_discovery / Raw
593	2020-03-23 13:02:28	240e:d4:2efe:200:c1e4:29e:10f8:4eb	2404:6800:4012::200e	Https	86	Ether / IPv6 / TCP 240e:d4:2efe:200:c1e4:29e:10f8:4eb:12503 > 2404:6800:4012::200e:https S
594	2020-03-23 13:02:28	192.168.1.8	59.37.96.250	Http	1199	Ether / IP / TCP / HTTP / 'POST' '/q.cgi' 'HTTP/1.1' / Raw
595	2020-03-23 13:02:28	192.168.1.8	140.143.213.113	Https	66	Ether / IP / TCP 192.168.1.8:12504 > 140.143.213.113:https S
596	2020-03-23 13:02:28	140.143.213.113	192.168.1.8	Https	66	Ether / IP / TCP 140.143.213.113:https > 192.168.1.8:12504 SA
597	2020-03-23 13:02:28	192.168.1.8	140.143.213.113	Https	54	Ether / IP / TCP 192.168.1.8:12504 > 140.143.213.113:https A
598	2020-03-23 13:02:29	192.168.1.8	59.37.96.250	Http	1199	Ether / IP / TCP / HTTP / 'POST' '/q.cgi' 'HTTP/1.1' / Raw
599	2020-03-23 13:02:29	52.74.223.119	192.168.1.8	Https	249	Ether / IP / TCP 52.74.223.119:https > 192.168.1.8:12488 PA / Raw
600	2020-03-23 13:02:29	192.168.1.8	52.74.223.119	Https	54	Ether / IP / TCP 192.168.1.8:12488 > 52.74.223.119:https A
601	2020-03-23 13:02:29	192.168.1.8	52.74.223.119	Https	1102	Ether / IP / TCP 192.168.1.8:12488 > 52.74.223.119:https PA / Raw
602	2020-03-23 13:02:29	192.168.1.8	172.217.24.14	Https	66	Ether / IP / TCP 192.168.1.8:12500 > 172.217.24.14:https S
603	2020-03-23 13:02:29	52.74.223.119	192.168.1.8	Https	54	Ether / IP / TCP 52.74.223.119:https > 192.168.1.8:12488 A
604	2020-03-23 13:02:29	192.168.1.8	59.37.96.250	Http	1199	Ether / IP / TCP / HTTP / 'POST' '/q.cgi' 'HTTP/1.1' / Raw
605	2020-03-23 13:02:29	192.168.1.8	172.217.24.14	Https	66	Ether / IP / TCP 192.168.1.8:12501 > 172.217.24.14:https S
606	2020-03-23 13:02:29	192.168.1.8	140.143.213.113	Https	390	Ether / IP / TCP 192.168.1.8:12504 > 140.143.213.113:https PA / Raw
607	2020-03-23 13:02:29	240e:d4:2efe:200:c1e4:29e:10f8:4eb	2404:6800:4012::200e	Https	86	Ether / IPv6 / TCP 240e:d4:2efe:200:c1e4:29e:10f8:4eb:12502 > 2404:6800:4012::200e:https S
608	2020-03-23 13:02:29	140.143.213.113	192.168.1.8	Https	54	Ether / IP / TCP 140.143.213.113:https > 192.168.1.8:12504 A
609	2020-03-23 13:02:29	140.143.213.113	192.168.1.8	Https	1486	Ether / IP / TCP 140.143.213.113:https > 192.168.1.8:12504 A / Raw
610	2020-03-23 13:02:29	140.143.213.113	192.168.1.8	Https	1486	Ether / IP / TCP 140.143.213.113:https > 192.168.1.8:12504 A / Raw
611	2020-03-23 13:02:29	140.143.213.113	192.168.1.8	Https	749	Ether / IP / TCP 140.143.213.113:https > 192.168.1.8:12504 PA / Raw
612	2020-03-23 13:02:29	192.168.1.8	140.143.213.113	Https	54	Ether / IP / TCP 192.168.1.8:12504 > 140.143.213.113:https A
613	2020-03-23 13:02:29	192.168.1.8	140.143.213.113	Https	180	Ether / IP / TCP 192.168.1.8:12504 > 140.143.213.113:https PA / Raw
614	2020-03-23 13:02:29	140.143.213.113	192.168.1.8	Https	328	Ether / IP / TCP 140.143.213.113:https > 192.168.1.8:12504 PA / Raw
615	2020-03-23 13:02:29	192.168.1.8	140.143.213.113	Https	479	Ether / IP / TCP 192.168.1.8:12504 > 140.143.213.113:https PA / Raw
616	2020-03-23 13:02:29	fe80::bd54:c78a:25f1:695	fe80::1	DNS	102	Ether / IPv6 / UDP / DNS Qry "b'analytics.yinxiang.com.'" 
617	2020-03-23 13:02:29	fe80::1	fe80::bd54:c78a:25f1:695	DNS	175	Ether / IPv6 / UDP / DNS Ans 
618	2020-03-23 13:02:29	192.168.1.8	154.8.190.35	Https	66	Ether / IP / TCP 192.168.1.8:12511 > 154.8.190.35:https S
619	2020-03-23 13:02:29	154.8.190.35	192.168.1.8	Https	66	Ether / IP / TCP 154.8.190.35:https > 192.168.1.8:12511 SA
620	2020-03-23 13:02:29	192.168.1.8	154.8.190.35	Https	54	Ether / IP / TCP 192.168.1.8:12511 > 154.8.190.35:https A
621	2020-03-23 13:02:29	192.168.1.8	154.8.190.35	Https	237	Ether / IP / TCP 192.168.1.8:12511 > 154.8.190.35:https PA / Raw
622	2020-03-23 13:02:29	140.143.213.113	192.168.1.8	Https	54	Ether / IP / TCP 140.143.213.113:https > 192.168.1.8:12504 A
623	2020-03-23 13:02:29	240e:d4:2efe:200:c1e4:29e:10f8:4eb	2404:6800:4012::200e	Https	86	Ether / IPv6 / TCP 240e:d4:2efe:200:c1e4:29e:10f8:4eb:12503 > 2404:6800:4012::200e:https S
624	2020-03-23 13:02:29	154.8.190.35	192.168.1.8	Https	54	Ether / IP / TCP 154.8.190.35:https > 192.168.1.8:12511 A
625	2020-03-23 13:02:29	154.8.190.35	192.168.1.8	Https	1486	Ether / IP / TCP 154.8.190.35:https > 192.168.1.8:12511 A / Raw
626	2020-03-23 13:02:29	154.8.190.35	192.168.1.8	Https	1486	Ether / IP / TCP 154.8.190.35:https > 192.168.1.8:12511 A / Raw
627	2020-03-23 13:02:29	154.8.190.35	192.168.1.8	Https	744	Ether / IP / TCP 154.8.190.35:https > 192.168.1.8:12511 PA / Raw
628	2020-03-23 13:02:29	192.168.1.8	154.8.190.35	Https	54	Ether / IP / TCP 192.168.1.8:12511 > 154.8.190.35:https A
629	2020-03-23 13:02:29	192.168.1.8	154.8.190.35	Https	180	Ether / IP / TCP 192.168.1.8:12511 > 154.8.190.35:https PA / Raw
630	2020-03-23 13:02:29	154.8.190.35	192.168.1.8	Https	328	Ether / IP / TCP 154.8.190.35:https > 192.168.1.8:12511 PA / Raw
631	2020-03-23 13:02:29	192.168.1.8	154.8.190.35	Https	1494	Ether / IP / TCP 192.168.1.8:12511 > 154.8.190.35:https A / Raw
632	2020-03-23 13:02:29	192.168.1.8	154.8.190.35	Https	198	Ether / IP / TCP 192.168.1.8:12511 > 154.8.190.35:https PA / Raw
633	2020-03-23 13:02:29	154.8.190.35	192.168.1.8	Https	54	Ether / IP / TCP 154.8.190.35:https > 192.168.1.8:12511 A
634	2020-03-23 13:02:29	154.8.190.35	192.168.1.8	Https	352	Ether / IP / TCP 154.8.190.35:https > 192.168.1.8:12511 PA / Raw
635	2020-03-23 13:02:29	154.8.190.35	192.168.1.8	Https	88	Ether / IP / TCP 154.8.190.35:https > 192.168.1.8:12511 PA / Raw
636	2020-03-23 13:02:29	192.168.1.8	154.8.190.35	Https	54	Ether / IP / TCP 192.168.1.8:12511 > 154.8.190.35:https A
637	2020-03-23 13:02:29	192.168.1.8	154.8.190.35	Https	54	Ether / IP / TCP 192.168.1.8:12511 > 154.8.190.35:https FA
638	2020-03-23 13:02:29	154.8.190.35	192.168.1.8	Https	54	Ether / IP / TCP 154.8.190.35:https > 192.168.1.8:12511 FA
639	2020-03-23 13:02:29	192.168.1.8	154.8.190.35	Https	54	Ether / IP / TCP 192.168.1.8:12511 > 154.8.190.35:https A
640	2020-03-23 13:02:29	fe80::bd54:c78a:25f1:695	ff02::c	UDP	714	Ether / IPv6 / UDP fe80::bd54:c78a:25f1:695:57097 > ff02::c:ws_discovery / Raw
641	2020-03-23 13:02:30	192.168.1.8	59.37.96.250	Http	1199	Ether / IP / TCP / HTTP / 'POST' '/q.cgi' 'HTTP/1.1' / Raw
642	2020-03-23 13:02:30	192.168.1.8	14.215.177.39	Https	54	Ether / IP / TCP 192.168.1.8:12463 > 14.215.177.39:https RA
643	2020-03-23 13:02:30	52.74.223.119	192.168.1.8	Https	112	Ether / IP / TCP 52.74.223.119:https > 192.168.1.8:12488 PA / Raw
644	2020-03-23 13:02:30	192.168.1.8	52.74.223.119	Https	66	Ether / IP / TCP 192.168.1.8:12488 > 52.74.223.119:https A
645	2020-03-23 13:02:30	52.74.223.119	192.168.1.8	Https	419	Ether / IP / TCP 52.74.223.119:https > 192.168.1.8:12488 PA / Raw
646	2020-03-23 13:02:30	192.168.1.8	52.74.223.119	Https	66	Ether / IP / TCP 192.168.1.8:12488 > 52.74.223.119:https A
647	2020-03-23 13:02:30	192.168.1.8	14.215.177.39	Https	54	Ether / IP / TCP 192.168.1.8:12483 > 14.215.177.39:https FA
648	2020-03-23 13:02:30	52.74.223.119	192.168.1.8	Https	414	Ether / IP / TCP 52.74.223.119:https > 192.168.1.8:12488 PA / Raw
649	2020-03-23 13:02:30	192.168.1.8	52.74.223.119	Https	66	Ether / IP / TCP 192.168.1.8:12488 > 52.74.223.119:https A
650	2020-03-23 13:02:30	52.74.223.119	192.168.1.8	Https	80	Ether / IP / TCP 52.74.223.119:https > 192.168.1.8:12488 PA / Raw
651	2020-03-23 13:02:30	192.168.1.8	52.74.223.119	Https	54	Ether / IP / TCP 192.168.1.8:12488 > 52.74.223.119:https A
652	2020-03-23 13:02:31	192.168.1.8	59.37.96.250	Http	1199	Ether / IP / TCP / HTTP / 'POST' '/q.cgi' 'HTTP/1.1' / Raw
653	2020-03-23 13:02:31	192.168.1.8	172.217.24.14	Https	66	Ether / IP / TCP 192.168.1.8:12500 > 172.217.24.14:https S
654	2020-03-23 13:02:31	192.168.1.8	14.215.177.39	Https	66	Ether / IP / TCP 192.168.1.8:12512 > 14.215.177.39:https S
655	2020-03-23 13:02:31	14.215.177.39	192.168.1.8	Https	66	Ether / IP / TCP 14.215.177.39:https > 192.168.1.8:12512 SA
656	2020-03-23 13:02:31	192.168.1.8	14.215.177.39	Https	54	Ether / IP / TCP 192.168.1.8:12512 > 14.215.177.39:https A
657	2020-03-23 13:02:31	192.168.1.8	14.215.177.39	Https	54	Ether / IP / TCP 192.168.1.8:12512 > 14.215.177.39:https FA
658	2020-03-23 13:02:31	192.168.1.8	172.217.24.14	Https	66	Ether / IP / TCP 192.168.1.8:12501 > 172.217.24.14:https S
659	2020-03-23 13:02:31	240e:d4:2efe:200:c1e4:29e:10f8:4eb	2404:6800:4012::200e	Https	86	Ether / IPv6 / TCP 240e:d4:2efe:200:c1e4:29e:10f8:4eb:12502 > 2404:6800:4012::200e:https S
660	2020-03-23 13:02:31	192.168.1.8	14.215.177.39	Https	54	Ether / IP / TCP 192.168.1.8:12512 > 14.215.177.39:https FA
661	2020-03-23 13:02:31	240e:d4:2efe:200:c1e4:29e:10f8:4eb	2404:6800:4012::200e	Https	86	Ether / IPv6 / TCP 240e:d4:2efe:200:c1e4:29e:10f8:4eb:12503 > 2404:6800:4012::200e:https S
662	2020-03-23 13:02:31	fe80::bd54:c78a:25f1:695	fe80::1	DNS	102	Ether / IPv6 / UDP / DNS Qry "b'analytics.yinxiang.com.'" 
663	2020-03-23 13:02:31	fe80::1	fe80::bd54:c78a:25f1:695	DNS	175	Ether / IPv6 / UDP / DNS Ans 
664	2020-03-23 13:02:31	192.168.1.8	154.8.190.35	Https	66	Ether / IP / TCP 192.168.1.8:12517 > 154.8.190.35:https S
665	2020-03-23 13:02:31	192.168.1.8	183.3.225.79	TCP	54	Ether / IP / TCP 192.168.1.8:12417 > 183.3.225.79:36688 FA
666	2020-03-23 13:02:31	183.3.225.79	192.168.1.8	TCP	54	Ether / IP / TCP 183.3.225.79:36688 > 192.168.1.8:12417 FA
667	2020-03-23 13:02:31	192.168.1.8	183.3.225.79	TCP	54	Ether / IP / TCP 192.168.1.8:12417 > 183.3.225.79:36688 A
668	2020-03-23 13:02:31	154.8.190.35	192.168.1.8	Https	66	Ether / IP / TCP 154.8.190.35:https > 192.168.1.8:12517 SA
669	2020-03-23 13:02:31	192.168.1.8	154.8.190.35	Https	54	Ether / IP / TCP 192.168.1.8:12517 > 154.8.190.35:https A
670	2020-03-23 13:02:31	192.168.1.8	154.8.190.35	Https	237	Ether / IP / TCP 192.168.1.8:12517 > 154.8.190.35:https PA / Raw
671	2020-03-23 13:02:31	154.8.190.35	192.168.1.8	Https	54	Ether / IP / TCP 154.8.190.35:https > 192.168.1.8:12517 A
672	2020-03-23 13:02:31	154.8.190.35	192.168.1.8	Https	1486	Ether / IP / TCP 154.8.190.35:https > 192.168.1.8:12517 A / Raw
673	2020-03-23 13:02:31	154.8.190.35	192.168.1.8	Https	1486	Ether / IP / TCP 154.8.190.35:https > 192.168.1.8:12517 A / Raw
674	2020-03-23 13:02:31	154.8.190.35	192.168.1.8	Https	744	Ether / IP / TCP 154.8.190.35:https > 192.168.1.8:12517 PA / Raw
675	2020-03-23 13:02:31	192.168.1.8	154.8.190.35	Https	54	Ether / IP / TCP 192.168.1.8:12517 > 154.8.190.35:https A
676	2020-03-23 13:02:31	192.168.1.8	154.8.190.35	Https	180	Ether / IP / TCP 192.168.1.8:12517 > 154.8.190.35:https PA / Raw
677	2020-03-23 13:02:32	154.8.190.35	192.168.1.8	Https	328	Ether / IP / TCP 154.8.190.35:https > 192.168.1.8:12517 PA / Raw
678	2020-03-23 13:02:32	192.168.1.8	154.8.190.35	Https	1459	Ether / IP / TCP 192.168.1.8:12517 > 154.8.190.35:https PA / Raw
679	2020-03-23 13:02:32	52.74.223.119	192.168.1.8	Https	80	Ether / IP / TCP 52.74.223.119:https > 192.168.1.8:12488 PA / Raw
680	2020-03-23 13:02:32	52.74.223.119	192.168.1.8	Https	133	Ether / IP / TCP 52.74.223.119:https > 192.168.1.8:12488 PA / Raw
681	2020-03-23 13:02:32	192.168.1.8	52.74.223.119	Https	54	Ether / IP / TCP 192.168.1.8:12488 > 52.74.223.119:https A
682	2020-03-23 13:02:32	fe80::1	240e:d4:2efe:200:c1e4:29e:10f8:4eb	ICMPv6	86	Ether / IPv6 / ICMPv6ND_NS / ICMPv6 Neighbor Discovery Option - Source Link-Layer Address 9c:d2:4b:38:91:c1
683	2020-03-23 13:02:32	240e:d4:2efe:200:c1e4:29e:10f8:4eb	fe80::1	ICMPv6	86	Ether / IPv6 / ICMPv6ND_NA / ICMPv6 Neighbor Discovery Option - Destination Link-Layer Address b4:6b:fc:17:92:60
684	2020-03-23 13:02:32	154.8.190.35	192.168.1.8	Https	352	Ether / IP / TCP 154.8.190.35:https > 192.168.1.8:12517 PA / Raw
685	2020-03-23 13:02:32	154.8.190.35	192.168.1.8	Https	88	Ether / IP / TCP 154.8.190.35:https > 192.168.1.8:12517 PA / Raw
686	2020-03-23 13:02:32	192.168.1.8	154.8.190.35	Https	54	Ether / IP / TCP 192.168.1.8:12517 > 154.8.190.35:https A
687	2020-03-23 13:02:32	192.168.1.8	154.8.190.35	Https	54	Ether / IP / TCP 192.168.1.8:12517 > 154.8.190.35:https FA
688	2020-03-23 13:02:32	240e:d4:2efe:200:c1e4:29e:10f8:4eb	2401:c900:1001:163::4	Https	98	Ether / IPv6 / TCP 240e:d4:2efe:200:c1e4:29e:10f8:4eb:10348 > 2401:c900:1001:163::4:https PA / Raw
689	2020-03-23 13:02:32	154.8.190.35	192.168.1.8	Https	54	Ether / IP / TCP 154.8.190.35:https > 192.168.1.8:12517 FA
690	2020-03-23 13:02:32	192.168.1.8	154.8.190.35	Https	54	Ether / IP / TCP 192.168.1.8:12517 > 154.8.190.35:https A
691	2020-03-23 13:02:32	52.74.223.119	192.168.1.8	Https	79	Ether / IP / TCP 52.74.223.119:https > 192.168.1.8:12488 PA / Raw
692	2020-03-23 13:02:32	52.74.223.119	192.168.1.8	Https	101	Ether / IP / TCP 52.74.223.119:https > 192.168.1.8:12488 PA / Raw
693	2020-03-23 13:02:32	192.168.1.8	52.74.223.119	Https	54	Ether / IP / TCP 192.168.1.8:12488 > 52.74.223.119:https A
694	2020-03-23 13:02:32	192.168.1.8	52.74.223.119	Https	78	Ether / IP / TCP 192.168.1.8:12488 > 52.74.223.119:https PA / Raw
695	2020-03-23 13:02:32	192.168.1.8	52.74.223.119	Https	54	Ether / IP / TCP 192.168.1.8:12488 > 52.74.223.119:https FA
696	2020-03-23 13:02:32	192.168.1.8	14.215.177.39	Https	54	Ether / IP / TCP 192.168.1.8:12512 > 14.215.177.39:https FA
697	2020-03-23 13:02:32	52.74.223.119	192.168.1.8	Https	54	Ether / IP / TCP 52.74.223.119:https > 192.168.1.8:12488 A
698	2020-03-23 13:02:32	52.74.223.119	192.168.1.8	Https	54	Ether / IP / TCP 52.74.223.119:https > 192.168.1.8:12488 FA
699	2020-03-23 13:02:32	192.168.1.8	52.74.223.119	Https	54	Ether / IP / TCP 192.168.1.8:12488 > 52.74.223.119:https A
700	2020-03-23 13:02:32	fe80::bd54:c78a:25f1:695	fe80::1	DNS	90	Ether / IPv6 / UDP / DNS Qry "b'github.com.'" 
701	2020-03-23 13:02:32	fe80::1	fe80::bd54:c78a:25f1:695	DNS	155	Ether / IPv6 / UDP / DNS Ans 
702	2020-03-23 13:02:32	192.168.1.8	52.74.223.119	Https	66	Ether / IP / TCP 192.168.1.8:12518 > 52.74.223.119:https S
703	2020-03-23 13:02:32	52.74.223.119	192.168.1.8	Https	66	Ether / IP / TCP 52.74.223.119:https > 192.168.1.8:12518 SA
704	2020-03-23 13:02:32	192.168.1.8	52.74.223.119	Https	54	Ether / IP / TCP 192.168.1.8:12518 > 52.74.223.119:https A
705	2020-03-23 13:02:32	192.168.1.8	52.74.223.119	Https	571	Ether / IP / TCP 192.168.1.8:12518 > 52.74.223.119:https PA / Raw
706	2020-03-23 13:02:32	fe80::bd54:c78a:25f1:695	ff02::c	UDP	718	Ether / IPv6 / UDP fe80::bd54:c78a:25f1:695:57097 > ff02::c:ws_discovery / Raw
707	2020-03-23 13:02:32	192.168.1.8	239.255.255.250	UDP	698	Ether / IP / UDP 192.168.1.8:57096 > 239.255.255.250:ws_discovery / Raw
708	2020-03-23 13:02:32	192.168.1.8	52.74.223.119	Https	54	Ether / IP / TCP 192.168.1.8:12488 > 52.74.223.119:https FA
709	2020-03-23 13:02:32	52.74.223.119	192.168.1.8	Https	1490	Ether / IP / TCP 52.74.223.119:https > 192.168.1.8:12518 A / Raw
710	2020-03-23 13:02:32	52.74.223.119	192.168.1.8	Https	818	Ether / IP / TCP 52.74.223.119:https > 192.168.1.8:12518 PA / Raw
711	2020-03-23 13:02:32	192.168.1.8	52.74.223.119	Https	66	Ether / IP / TCP 192.168.1.8:12518 > 52.74.223.119:https A
712	2020-03-23 13:02:32	fe80::bd54:c78a:25f1:695	ff02::c	UDP	718	Ether / IPv6 / UDP fe80::bd54:c78a:25f1:695:57097 > ff02::c:ws_discovery / Raw
713	2020-03-23 13:02:32	52.74.223.119	192.168.1.8	Https	1490	Ether / IP / TCP 52.74.223.119:https > 192.168.1.8:12518 A / Raw
714	2020-03-23 13:02:32	192.168.1.8	52.74.223.119	Https	54	Ether / IP / TCP 192.168.1.8:12518 > 52.74.223.119:https A
715	2020-03-23 13:02:32	192.168.1.8	52.74.223.119	Https	118	Ether / IP / TCP 192.168.1.8:12518 > 52.74.223.119:https PA / Raw
716	2020-03-23 13:02:32	192.168.1.8	52.74.223.119	Https	264	Ether / IP / TCP 192.168.1.8:12518 > 52.74.223.119:https PA / Raw
717	2020-03-23 13:02:32	192.168.1.8	239.255.255.250	UDP	698	Ether / IP / UDP 192.168.1.8:57096 > 239.255.255.250:ws_discovery / Raw
718	2020-03-23 13:02:32	240e:d4:2efe:200:c1e4:29e:10f8:4eb	2401:c900:1001:163::4	Https	98	Ether / IPv6 / TCP 240e:d4:2efe:200:c1e4:29e:10f8:4eb:10348 > 2401:c900:1001:163::4:https PA / Raw
719	2020-03-23 13:02:32	52.74.223.119	192.168.1.8	Https	133	Ether / IP / TCP 52.74.223.119:https > 192.168.1.8:12518 PA / Raw
720	2020-03-23 13:02:32	192.168.1.8	52.74.223.119	Https	54	Ether / IP / TCP 192.168.1.8:12518 > 52.74.223.119:https A
721	2020-03-23 13:02:32	52.74.223.119	192.168.1.8	Https	54	Ether / IP / TCP 52.74.223.119:https > 192.168.1.8:12518 A
722	2020-03-23 13:02:32	fe80::bd54:c78a:25f1:695	ff02::c	UDP	718	Ether / IPv6 / UDP fe80::bd54:c78a:25f1:695:57097 > ff02::c:ws_discovery / Raw
723	2020-03-23 13:02:33	192.168.1.8	239.255.255.250	UDP	698	Ether / IP / UDP 192.168.1.8:57096 > 239.255.255.250:ws_discovery / Raw
724	2020-03-23 13:02:33	2401:c900:1001:163::4	240e:d4:2efe:200:c1e4:29e:10f8:4eb	Https	86	Ether / IPv6 / TCP 2401:c900:1001:163::4:https > 240e:d4:2efe:200:c1e4:29e:10f8:4eb:10348 A
725	2020-03-23 13:02:33	192.168.1.8	52.74.223.119	Https	54	Ether / IP / TCP 192.168.1.8:12488 > 52.74.223.119:https FA
726	2020-03-23 13:02:33	52.74.223.119	192.168.1.8	Https	133	Ether / IP / TCP 52.74.223.119:https > 192.168.1.8:12518 PA / Raw
727	2020-03-23 13:02:33	192.168.1.8	52.74.223.119	Https	54	Ether / IP / TCP 192.168.1.8:12518 > 52.74.223.119:https A
728	2020-03-23 13:02:33	fe80::bd54:c78a:25f1:695	ff02::c	UDP	718	Ether / IPv6 / UDP fe80::bd54:c78a:25f1:695:57097 > ff02::c:ws_discovery / Raw
729	2020-03-23 13:02:33	192.168.1.8	14.215.177.39	Https	54	Ether / IP / TCP 192.168.1.8:12512 > 14.215.177.39:https FA
730	2020-03-23 13:02:33	52.74.223.119	192.168.1.8	Https	78	Ether / IP / TCP 52.74.223.119:https > 192.168.1.8:12488 FPA / Raw
731	2020-03-23 13:02:33	192.168.1.8	52.74.223.119	Https	54	Ether / IP / TCP 192.168.1.8:12488 > 52.74.223.119:https RA
732	2020-03-23 13:02:33	52.74.223.119	192.168.1.8	Https	326	Ether / IP / TCP 52.74.223.119:https > 192.168.1.8:12518 PA / Raw
733	2020-03-23 13:02:33	192.168.1.8	52.74.223.119	Https	54	Ether / IP / TCP 192.168.1.8:12518 > 52.74.223.119:https A
734	2020-03-23 13:02:33	192.168.1.8	59.37.96.250	Http	1199	Ether / IP / TCP / HTTP / 'POST' '/q.cgi' 'HTTP/1.1' / Raw
735	2020-03-23 13:02:33	192.168.1.8	239.255.255.250	UDP	698	Ether / IP / UDP 192.168.1.8:57096 > 239.255.255.250:ws_discovery / Raw
736	2020-03-23 13:02:34	fe80::bd54:c78a:25f1:695	fe80::1	DNS	102	Ether / IPv6 / UDP / DNS Qry "b'analytics.yinxiang.com.'" 
737	2020-03-23 13:02:34	192.168.1.8	192.168.1.1	DNS	82	Ether / IP / UDP / DNS Qry "b'analytics.yinxiang.com.'" 
738	2020-03-23 13:02:34	192.168.1.1	192.168.1.8	DNS	155	Ether / IP / UDP / DNS Ans 
739	2020-03-23 13:02:34	192.168.1.8	154.8.190.35	Https	66	Ether / IP / TCP 192.168.1.8:12522 > 154.8.190.35:https S
740	2020-03-23 13:02:34	154.8.190.35	192.168.1.8	Https	66	Ether / IP / TCP 154.8.190.35:https > 192.168.1.8:12522 SA
741	2020-03-23 13:02:34	192.168.1.8	154.8.190.35	Https	54	Ether / IP / TCP 192.168.1.8:12522 > 154.8.190.35:https A
742	2020-03-23 13:02:34	192.168.1.8	154.8.190.35	Https	237	Ether / IP / TCP 192.168.1.8:12522 > 154.8.190.35:https PA / Raw
743	2020-03-23 13:02:34	fe80::bd54:c78a:25f1:695	fe80::1	ICMPv6	86	Ether / IPv6 / ICMPv6ND_NS / ICMPv6 Neighbor Discovery Option - Source Link-Layer Address b4:6b:fc:17:92:60
744	2020-03-23 13:02:34	192.168.1.8	52.74.223.119	Https	264	Ether / IP / TCP 192.168.1.8:12518 > 52.74.223.119:https PA / Raw
745	2020-03-23 13:02:34	192.168.1.8	154.8.190.35	Https	237	Ether / IP / TCP 192.168.1.8:12522 > 154.8.190.35:https PA / Raw
746	2020-03-23 13:02:34	fe80::bd54:c78a:25f1:695	ff02::c	UDP	718	Ether / IPv6 / UDP fe80::bd54:c78a:25f1:695:57097 > ff02::c:ws_discovery / Raw
747	2020-03-23 13:02:34	154.8.190.35	192.168.1.8	Https	1486	Ether / IP / TCP 154.8.190.35:https > 192.168.1.8:12522 A / Raw
748	2020-03-23 13:02:34	154.8.190.35	192.168.1.8	Https	1486	Ether / IP / TCP 154.8.190.35:https > 192.168.1.8:12522 A / Raw
749	2020-03-23 13:02:34	154.8.190.35	192.168.1.8	Https	744	Ether / IP / TCP 154.8.190.35:https > 192.168.1.8:12522 PA / Raw
750	2020-03-23 13:02:34	154.8.190.35	192.168.1.8	Https	744	Ether / IP / TCP 154.8.190.35:https > 192.168.1.8:12522 PA / Raw
751	2020-03-23 13:02:34	fe80::1	fe80::bd54:c78a:25f1:695	ICMPv6	78	Ether / IPv6 / ICMPv6 Neighbor Discovery - Neighbor Advertisement (tgt: fe80::1)
752	2020-03-23 13:02:34	fe80::1	fe80::bd54:c78a:25f1:695	DNS	175	Ether / IPv6 / UDP / DNS Ans 
753	2020-03-23 13:02:34	154.8.190.35	192.168.1.8	Https	66	Ether / IP / TCP 154.8.190.35:https > 192.168.1.8:12522 A
754	2020-03-23 13:02:34	52.74.223.119	192.168.1.8	Https	54	Ether / IP / TCP 52.74.223.119:https > 192.168.1.8:12518 A
755	2020-03-23 13:02:34	192.168.1.8	154.8.190.35	Https	66	Ether / IP / TCP 192.168.1.8:12522 > 154.8.190.35:https A
756	2020-03-23 13:02:34	192.168.1.8	154.8.190.35	Https	180	Ether / IP / TCP 192.168.1.8:12522 > 154.8.190.35:https PA / Raw
757	2020-03-23 13:02:34	154.8.190.35	192.168.1.8	Https	54	Ether / IP / TCP 154.8.190.35:https > 192.168.1.8:12522 A
758	2020-03-23 13:02:34	154.8.190.35	192.168.1.8	Https	328	Ether / IP / TCP 154.8.190.35:https > 192.168.1.8:12522 PA / Raw
759	2020-03-23 13:02:34	192.168.1.8	154.8.190.35	Https	1494	Ether / IP / TCP 192.168.1.8:12522 > 154.8.190.35:https A / Raw
760	2020-03-23 13:02:34	192.168.1.8	154.8.190.35	Https	132	Ether / IP / TCP 192.168.1.8:12522 > 154.8.190.35:https PA / Raw
761	2020-03-23 13:02:34	154.8.190.35	192.168.1.8	Https	54	Ether / IP / TCP 154.8.190.35:https > 192.168.1.8:12522 A
762	2020-03-23 13:02:34	154.8.190.35	192.168.1.8	Https	352	Ether / IP / TCP 154.8.190.35:https > 192.168.1.8:12522 PA / Raw
763	2020-03-23 13:02:34	154.8.190.35	192.168.1.8	Https	88	Ether / IP / TCP 154.8.190.35:https > 192.168.1.8:12522 PA / Raw
764	2020-03-23 13:02:34	192.168.1.8	154.8.190.35	Https	54	Ether / IP / TCP 192.168.1.8:12522 > 154.8.190.35:https A
765	2020-03-23 13:02:34	192.168.1.8	154.8.190.35	Https	54	Ether / IP / TCP 192.168.1.8:12522 > 154.8.190.35:https FA
766	2020-03-23 13:02:34	154.8.190.35	192.168.1.8	Https	54	Ether / IP / TCP 154.8.190.35:https > 192.168.1.8:12522 FA
767	2020-03-23 13:02:34	192.168.1.8	154.8.190.35	Https	54	Ether / IP / TCP 192.168.1.8:12522 > 154.8.190.35:https A
768	2020-03-23 13:02:35	192.168.1.8	140.143.213.113	Https	85	Ether / IP / TCP 192.168.1.8:12504 > 140.143.213.113:https PA / Raw
769	2020-03-23 13:02:35	192.168.1.8	140.143.213.113	Https	54	Ether / IP / TCP 192.168.1.8:12504 > 140.143.213.113:https FA
770	2020-03-23 13:02:35	140.143.213.113	192.168.1.8	Https	54	Ether / IP / TCP 140.143.213.113:https > 192.168.1.8:12504 A
771	2020-03-23 13:02:35	140.143.213.113	192.168.1.8	Https	85	Ether / IP / TCP 140.143.213.113:https > 192.168.1.8:12504 PA / Raw
772	2020-03-23 13:02:35	140.143.213.113	192.168.1.8	Https	54	Ether / IP / TCP 140.143.213.113:https > 192.168.1.8:12504 RA
773	2020-03-23 13:02:35	192.168.1.8	140.143.213.113	Https	54	Ether / IP / TCP 192.168.1.8:12504 > 140.143.213.113:https RA
774	2020-03-23 13:02:35	52.74.223.119	192.168.1.8	Https	326	Ether / IP / TCP 52.74.223.119:https > 192.168.1.8:12518 PA / Raw
775	2020-03-23 13:02:35	192.168.1.8	52.74.223.119	Https	54	Ether / IP / TCP 192.168.1.8:12518 > 52.74.223.119:https RA
776	2020-03-23 13:02:35	192.168.1.8	172.217.24.14	Https	66	Ether / IP / TCP 192.168.1.8:12500 > 172.217.24.14:https S
777	2020-03-23 13:02:35	192.168.1.8	172.217.24.14	Https	66	Ether / IP / TCP 192.168.1.8:12501 > 172.217.24.14:https S
778	2020-03-23 13:02:35	240e:d4:2efe:200:c1e4:29e:10f8:4eb	2404:6800:4012::200e	Https	86	Ether / IPv6 / TCP 240e:d4:2efe:200:c1e4:29e:10f8:4eb:12502 > 2404:6800:4012::200e:https S
779	2020-03-23 13:02:35	192.168.1.8	239.255.255.250	UDP	698	Ether / IP / UDP 192.168.1.8:57096 > 239.255.255.250:ws_discovery / Raw
780	2020-03-23 13:02:35	240e:d4:2efe:200:c1e4:29e:10f8:4eb	2404:6800:4012::200e	Https	86	Ether / IPv6 / TCP 240e:d4:2efe:200:c1e4:29e:10f8:4eb:12503 > 2404:6800:4012::200e:https S
781	2020-03-23 13:02:35	192.168.1.8	14.215.177.39	Https	54	Ether / IP / TCP 192.168.1.8:12512 > 14.215.177.39:https FA
782	2020-03-23 13:02:36	fe80::bd54:c78a:25f1:695	ff02::c	UDP	718	Ether / IPv6 / UDP fe80::bd54:c78a:25f1:695:57097 > ff02::c:ws_discovery / Raw
783	2020-03-23 13:02:36	fe80::bd54:c78a:25f1:695	fe80::1	DNS	90	Ether / IPv6 / UDP / DNS Qry "b'github.com.'" 
784	2020-03-23 13:02:36	fe80::1	fe80::bd54:c78a:25f1:695	DNS	155	Ether / IPv6 / UDP / DNS Ans 
785	2020-03-23 13:02:36	fe80::bd54:c78a:25f1:695	fe80::1	DNS	102	Ether / IPv6 / UDP / DNS Qry "b'analytics.yinxiang.com.'" 
786	2020-03-23 13:02:36	192.168.1.8	52.74.223.119	Https	66	Ether / IP / TCP 192.168.1.8:12530 > 52.74.223.119:https S
