1	2020-03-18 01:11:31	00:e0:4c:68:00:2d	9c:d2:4b:38:91:c1	ARP	42	Ether / ARP who has 192.168.1.1 says 192.168.1.10
2	2020-03-18 01:11:31	9c:d2:4b:38:91:c1	00:e0:4c:68:00:2d	ARP	60	Ether / ARP is at 9c:d2:4b:38:91:c1 says 192.168.1.1 / Padding
3	2020-03-18 01:11:31	192.168.1.10	47.244.15.210	TCP	66	Ether / IP / TCP 192.168.1.10:5194 > 47.244.15.210:20395 S
4	2020-03-18 01:11:31	192.168.1.10	47.244.15.210	TCP	66	Ether / IP / TCP 192.168.1.10:5193 > 47.244.15.210:20395 S
5	2020-03-18 01:11:31	192.168.1.10	47.244.15.210	TCP	66	Ether / IP / TCP 192.168.1.10:5197 > 47.244.15.210:20395 S
6	2020-03-18 01:11:32	192.168.1.10	47.244.15.210	TCP	66	Ether / IP / TCP 192.168.1.10:5194 > 47.244.15.210:20395 S
7	2020-03-18 01:11:32	192.168.1.10	47.244.15.210	TCP	66	Ether / IP / TCP 192.168.1.10:5192 > 47.244.15.210:20395 S
8	2020-03-18 01:11:32	192.168.1.10	47.244.15.210	TCP	66	Ether / IP / TCP 192.168.1.10:5197 > 47.244.15.210:20395 S
9	2020-03-18 01:11:32	192.168.1.10	10.10.20.110	UDP	120	Ether / IP / UDP 192.168.1.10:59684 > 10.10.20.110:snmp / SNMP
10	2020-03-18 01:11:33	192.168.1.10	40.119.211.203	Https	155	Ether / IP / TCP 192.168.1.10:1310 > 40.119.211.203:https PA / Raw
11	2020-03-18 01:11:33	192.168.1.10	47.244.15.210	TCP	66	Ether / IP / TCP 192.168.1.10:5193 > 47.244.15.210:20395 S
12	2020-03-18 01:11:33	40.119.211.203	192.168.1.10	Https	225	Ether / IP / TCP 40.119.211.203:https > 192.168.1.10:1310 PA / Raw
13	2020-03-18 01:11:33	192.168.1.10	40.119.211.203	Https	54	Ether / IP / TCP 192.168.1.10:1310 > 40.119.211.203:https A
14	2020-03-18 01:11:33	192.168.1.10	216.58.200.46	Https	66	Ether / IP / TCP 192.168.1.10:5198 > 216.58.200.46:https S
15	2020-03-18 01:11:33	192.168.1.10	216.58.200.46	Https	66	Ether / IP / TCP 192.168.1.10:5199 > 216.58.200.46:https S
16	2020-03-18 01:11:33	240e:d4:2e8e:df00:4882:f650:cbf9:db1d	2404:6800:4012:1::200e	Https	86	Ether / IPv6 / TCP 240e:d4:2e8e:df00:4882:f650:cbf9:db1d:5200 > 2404:6800:4012:1::200e:https S
17	2020-03-18 01:11:34	92.223.85.103	192.168.1.10	Http	60	Ether / IP / TCP 92.223.85.103:http > 192.168.1.10:14585 A / Padding
18	2020-03-18 01:11:34	192.168.1.10	92.223.85.103	Http	54	Ether / IP / TCP 192.168.1.10:14585 > 92.223.85.103:http A
19	2020-03-18 01:11:34	240e:d4:2e8e:df00:4882:f650:cbf9:db1d	2404:6800:4012:1::200e	Https	86	Ether / IPv6 / TCP 240e:d4:2e8e:df00:4882:f650:cbf9:db1d:5201 > 2404:6800:4012:1::200e:https S
20	2020-03-18 01:11:34	192.168.1.10	47.244.15.210	TCP	66	Ether / IP / TCP 192.168.1.10:5194 > 47.244.15.210:20395 S
21	2020-03-18 01:11:34	192.168.1.10	216.58.200.46	Https	66	Ether / IP / TCP 192.168.1.10:5198 > 216.58.200.46:https S
22	2020-03-18 01:11:34	192.168.1.10	47.244.15.210	TCP	66	Ether / IP / TCP 192.168.1.10:5197 > 47.244.15.210:20395 S
23	2020-03-18 01:11:34	192.168.1.10	216.58.200.46	Https	66	Ether / IP / TCP 192.168.1.10:5199 > 216.58.200.46:https S
24	2020-03-18 01:11:34	240e:d4:2e8e:df00:4882:f650:cbf9:db1d	2404:6800:4012:1::200e	Https	86	Ether / IPv6 / TCP 240e:d4:2e8e:df00:4882:f650:cbf9:db1d:5200 > 2404:6800:4012:1::200e:https S
25	2020-03-18 01:11:35	192.168.1.10	14.215.177.39	Https	54	Ether / IP / TCP 192.168.1.10:5178 > 14.215.177.39:https RA
26	2020-03-18 01:11:35	240e:d4:2e8e:df00:4882:f650:cbf9:db1d	2404:6800:4012:1::200e	Https	86	Ether / IPv6 / TCP 240e:d4:2e8e:df00:4882:f650:cbf9:db1d:5201 > 2404:6800:4012:1::200e:https S
27	2020-03-18 01:11:35	192.168.1.10	14.215.177.39	Https	54	Ether / IP / TCP 192.168.1.10:5190 > 14.215.177.39:https FA
28	2020-03-18 01:11:36	192.168.1.10	14.215.177.39	Https	66	Ether / IP / TCP 192.168.1.10:5202 > 14.215.177.39:https S
29	2020-03-18 01:11:36	14.215.177.39	192.168.1.10	Https	66	Ether / IP / TCP 14.215.177.39:https > 192.168.1.10:5202 SA
30	2020-03-18 01:11:36	192.168.1.10	14.215.177.39	Https	54	Ether / IP / TCP 192.168.1.10:5202 > 14.215.177.39:https A
31	2020-03-18 01:11:36	192.168.1.10	14.215.177.39	Https	54	Ether / IP / TCP 192.168.1.10:5202 > 14.215.177.39:https FA
32	2020-03-18 01:11:36	192.168.1.10	14.215.177.39	Https	54	Ether / IP / TCP 192.168.1.10:5202 > 14.215.177.39:https FA
33	2020-03-18 01:11:36	192.168.1.10	220.181.76.82	Http	54	Ether / IP / TCP 192.168.1.10:5075 > 220.181.76.82:http RA
34	2020-03-18 01:11:36	192.168.1.10	47.244.15.210	TCP	66	Ether / IP / TCP 192.168.1.10:5192 > 47.244.15.210:20395 S
35	2020-03-18 01:11:36	192.168.1.10	216.58.200.46	Https	66	Ether / IP / TCP 192.168.1.10:5198 > 216.58.200.46:https S
36	2020-03-18 01:11:36	192.168.1.10	216.58.200.46	Https	66	Ether / IP / TCP 192.168.1.10:5199 > 216.58.200.46:https S
37	2020-03-18 01:11:36	240e:d4:2e8e:df00:4882:f650:cbf9:db1d	2404:6800:4012:1::200e	Https	86	Ether / IPv6 / TCP 240e:d4:2e8e:df00:4882:f650:cbf9:db1d:5200 > 2404:6800:4012:1::200e:https S
38	2020-03-18 01:11:37	192.168.1.10	14.215.177.39	Https	54	Ether / IP / TCP 192.168.1.10:5202 > 14.215.177.39:https FA
39	2020-03-18 01:11:37	240e:d4:2e8e:df00:4882:f650:cbf9:db1d	2404:6800:4012:1::200e	Https	86	Ether / IPv6 / TCP 240e:d4:2e8e:df00:4882:f650:cbf9:db1d:5201 > 2404:6800:4012:1::200e:https S
40	2020-03-18 01:11:37	192.168.1.10	47.244.15.210	TCP	66	Ether / IP / TCP 192.168.1.10:5193 > 47.244.15.210:20395 S
41	2020-03-18 01:11:38	192.168.1.10	14.215.177.39	Https	54	Ether / IP / TCP 192.168.1.10:5202 > 14.215.177.39:https FA
42	2020-03-18 01:11:38	192.168.1.10	47.244.15.210	TCP	66	Ether / IP / TCP 192.168.1.10:5194 > 47.244.15.210:20395 S
43	2020-03-18 01:11:38	192.168.1.10	47.244.15.210	TCP	66	Ether / IP / TCP 192.168.1.10:5197 > 47.244.15.210:20395 S
44	2020-03-18 01:11:39	192.168.1.10	120.131.14.181	UDP	151	Ether / IP / UDP 192.168.1.10:49770 > 120.131.14.181:9402 / Raw
45	2020-03-18 01:11:39	fe80::f141:b4f2:11de:b126	fe80::1	ICMPv6	86	Ether / IPv6 / ICMPv6ND_NS / ICMPv6 Neighbor Discovery Option - Source Link-Layer Address 00:e0:4c:68:00:2d
46	2020-03-18 01:11:39	fe80::1	fe80::f141:b4f2:11de:b126	ICMPv6	78	Ether / IPv6 / ICMPv6 Neighbor Discovery - Neighbor Advertisement (tgt: fe80::1)
47	2020-03-18 01:11:40	192.168.1.10	47.244.15.210	TCP	66	Ether / IP / TCP 192.168.1.10:5203 > 47.244.15.210:20395 S
48	2020-03-18 01:11:40	192.168.1.10	14.215.177.39	Https	54	Ether / IP / TCP 192.168.1.10:5202 > 14.215.177.39:https FA
49	2020-03-18 01:11:40	192.168.1.10	216.58.200.46	Https	66	Ether / IP / TCP 192.168.1.10:5198 > 216.58.200.46:https S
50	2020-03-18 01:11:40	192.168.1.10	216.58.200.46	Https	66	Ether / IP / TCP 192.168.1.10:5199 > 216.58.200.46:https S
51	2020-03-18 01:11:40	240e:d4:2e8e:df00:4882:f650:cbf9:db1d	2404:6800:4012:1::200e	Https	86	Ether / IPv6 / TCP 240e:d4:2e8e:df00:4882:f650:cbf9:db1d:5200 > 2404:6800:4012:1::200e:https S
52	2020-03-18 01:11:41	192.168.1.10	223.252.199.69	TCP	55	Ether / IP / TCP 192.168.1.10:13025 > 223.252.199.69:6003 A / Raw
53	2020-03-18 01:11:41	240e:d4:2e8e:df00:4882:f650:cbf9:db1d	2404:6800:4012:1::200e	Https	86	Ether / IPv6 / TCP 240e:d4:2e8e:df00:4882:f650:cbf9:db1d:5201 > 2404:6800:4012:1::200e:https S
54	2020-03-18 01:11:41	223.252.199.69	192.168.1.10	TCP	66	Ether / IP / TCP 223.252.199.69:6003 > 192.168.1.10:13025 A
55	2020-03-18 01:11:41	192.168.1.10	47.244.15.210	TCP	66	Ether / IP / TCP 192.168.1.10:5204 > 47.244.15.210:20395 S
56	2020-03-18 01:11:41	192.168.1.10	47.244.15.210	TCP	66	Ether / IP / TCP 192.168.1.10:5203 > 47.244.15.210:20395 S
57	2020-03-18 01:11:41	192.168.1.10	47.244.15.210	TCP	66	Ether / IP / TCP 192.168.1.10:5205 > 47.244.15.210:20395 S
58	2020-03-18 01:11:41	fe80::f141:b4f2:11de:b126	fe80::1	DNS	93	Ether / IPv6 / UDP / DNS Qry "b'www.baidu.com.'" 
59	2020-03-18 01:11:41	fe80::f141:b4f2:11de:b126	fe80::1	DNS	93	Ether / IPv6 / UDP / DNS Qry "b'www.baidu.com.'" 
60	2020-03-18 01:11:41	fe80::1	fe80::f141:b4f2:11de:b126	DNS	386	Ether / IPv6 / UDP / DNS Ans "b'www.a.shifen.com.'" 
61	2020-03-18 01:11:41	fe80::1	fe80::f141:b4f2:11de:b126	DNS	177	Ether / IPv6 / UDP / DNS Ans "b'www.a.shifen.com.'" 
62	2020-03-18 01:11:41	192.168.1.10	180.97.33.107	Https	66	Ether / IP / TCP 192.168.1.10:5206 > 180.97.33.107:https S
63	2020-03-18 01:11:42	180.97.33.107	192.168.1.10	Https	66	Ether / IP / TCP 180.97.33.107:https > 192.168.1.10:5206 SA
64	2020-03-18 01:11:42	192.168.1.10	180.97.33.107	Https	54	Ether / IP / TCP 192.168.1.10:5206 > 180.97.33.107:https A
65	2020-03-18 01:11:42	192.168.1.10	180.97.33.107	Https	571	Ether / IP / TCP 192.168.1.10:5206 > 180.97.33.107:https PA / Raw
66	2020-03-18 01:11:42	180.97.33.107	192.168.1.10	Https	60	Ether / IP / TCP 180.97.33.107:https > 192.168.1.10:5206 A / Padding
67	2020-03-18 01:11:42	180.97.33.107	192.168.1.10	Https	150	Ether / IP / TCP 180.97.33.107:https > 192.168.1.10:5206 PA / Raw
68	2020-03-18 01:11:42	180.97.33.107	192.168.1.10	Https	60	Ether / IP / TCP 180.97.33.107:https > 192.168.1.10:5206 PA / Raw
69	2020-03-18 01:11:42	180.97.33.107	192.168.1.10	Https	99	Ether / IP / TCP 180.97.33.107:https > 192.168.1.10:5206 PA / Raw
70	2020-03-18 01:11:42	192.168.1.10	180.97.33.107	Https	54	Ether / IP / TCP 192.168.1.10:5206 > 180.97.33.107:https A
71	2020-03-18 01:11:42	192.168.1.10	180.97.33.107	Https	105	Ether / IP / TCP 192.168.1.10:5206 > 180.97.33.107:https PA / Raw
72	2020-03-18 01:11:42	192.168.1.10	180.97.33.107	Https	1337	Ether / IP / TCP 192.168.1.10:5206 > 180.97.33.107:https PA / Raw
73	2020-03-18 01:11:42	180.97.33.107	192.168.1.10	Https	99	Ether / IP / TCP 180.97.33.107:https > 192.168.1.10:5206 PA / Raw
74	2020-03-18 01:11:42	192.168.1.10	180.97.33.107	Https	66	Ether / IP / TCP 192.168.1.10:5206 > 180.97.33.107:https A
75	2020-03-18 01:11:42	192.168.1.10	180.97.33.107	Https	66	Ether / IP / TCP 192.168.1.10:5207 > 180.97.33.107:https S
76	2020-03-18 01:11:42	fe80::f141:b4f2:11de:b126	fe80::1	DNS	97	Ether / IPv6 / UDP / DNS Qry "b'dss0.bdstatic.com.'" 
77	2020-03-18 01:11:42	fe80::f141:b4f2:11de:b126	fe80::1	DNS	97	Ether / IPv6 / UDP / DNS Qry "b'dss0.bdstatic.com.'" 
78	2020-03-18 01:11:42	192.168.1.10	180.97.33.107	Https	66	Ether / IP / TCP 192.168.1.10:5208 > 180.97.33.107:https S
79	2020-03-18 01:11:42	192.168.1.10	180.97.33.107	Https	66	Ether / IP / TCP 192.168.1.10:5209 > 180.97.33.107:https S
80	2020-03-18 01:11:42	180.97.33.107	192.168.1.10	Https	60	Ether / IP / TCP 180.97.33.107:https > 192.168.1.10:5206 A / Padding
81	2020-03-18 01:11:42	180.97.33.107	192.168.1.10	Https	60	Ether / IP / TCP 180.97.33.107:https > 192.168.1.10:5206 A / Padding
82	2020-03-18 01:11:42	fe80::1	fe80::f141:b4f2:11de:b126	DNS	384	Ether / IPv6 / UDP / DNS Ans "b'sslbaiduv6.jomodns.com.'" 
83	2020-03-18 01:11:42	fe80::1	fe80::f141:b4f2:11de:b126	DNS	193	Ether / IPv6 / UDP / DNS Ans "b'sslbaiduv6.jomodns.com.'" 
84	2020-03-18 01:11:42	192.168.1.10	125.77.154.33	Https	66	Ether / IP / TCP 192.168.1.10:5210 > 125.77.154.33:https S
85	2020-03-18 01:11:42	125.77.154.33	192.168.1.10	Https	66	Ether / IP / TCP 125.77.154.33:https > 192.168.1.10:5210 SA
86	2020-03-18 01:11:42	192.168.1.10	125.77.154.33	Https	54	Ether / IP / TCP 192.168.1.10:5210 > 125.77.154.33:https A
87	2020-03-18 01:11:42	192.168.1.10	125.77.154.33	Https	571	Ether / IP / TCP 192.168.1.10:5210 > 125.77.154.33:https PA / Raw
88	2020-03-18 01:11:42	180.97.33.107	192.168.1.10	Https	66	Ether / IP / TCP 180.97.33.107:https > 192.168.1.10:5207 SA
89	2020-03-18 01:11:42	125.77.154.33	192.168.1.10	Https	60	Ether / IP / TCP 125.77.154.33:https > 192.168.1.10:5210 A / Padding
90	2020-03-18 01:11:42	125.77.154.33	192.168.1.10	Https	60	Ether / IP / TCP 125.77.154.33:https > 192.168.1.10:5210 A / Padding
91	2020-03-18 01:11:42	192.168.1.10	180.97.33.107	Https	54	Ether / IP / TCP 192.168.1.10:5207 > 180.97.33.107:https A
92	2020-03-18 01:11:42	192.168.1.10	180.97.33.107	Https	571	Ether / IP / TCP 192.168.1.10:5207 > 180.97.33.107:https PA / Raw
93	2020-03-18 01:11:42	125.77.154.33	192.168.1.10	Https	1394	Ether / IP / TCP 125.77.154.33:https > 192.168.1.10:5210 A / Raw
94	2020-03-18 01:11:42	125.77.154.33	192.168.1.10	Https	1394	Ether / IP / TCP 125.77.154.33:https > 192.168.1.10:5210 A / Raw
95	2020-03-18 01:11:42	125.77.154.33	192.168.1.10	Https	1394	Ether / IP / TCP 125.77.154.33:https > 192.168.1.10:5210 A / Raw
96	2020-03-18 01:11:42	192.168.1.10	125.77.154.33	Https	54	Ether / IP / TCP 192.168.1.10:5210 > 125.77.154.33:https A
97	2020-03-18 01:11:42	125.77.154.33	192.168.1.10	Https	148	Ether / IP / TCP 125.77.154.33:https > 192.168.1.10:5210 PA / Raw
98	2020-03-18 01:11:42	125.77.154.33	192.168.1.10	Https	130	Ether / IP / TCP 125.77.154.33:https > 192.168.1.10:5210 PA / Raw
99	2020-03-18 01:11:42	192.168.1.10	125.77.154.33	Https	66	Ether / IP / TCP 192.168.1.10:5210 > 125.77.154.33:https A
100	2020-03-18 01:11:42	192.168.1.10	125.77.154.33	Https	54	Ether / IP / TCP 192.168.1.10:5210 > 125.77.154.33:https A
101	2020-03-18 01:11:42	180.97.33.107	192.168.1.10	Https	66	Ether / IP / TCP 180.97.33.107:https > 192.168.1.10:5208 SA
102	2020-03-18 01:11:42	192.168.1.10	180.97.33.107	Https	54	Ether / IP / TCP 192.168.1.10:5208 > 180.97.33.107:https A
103	2020-03-18 01:11:42	192.168.1.10	180.97.33.107	Https	571	Ether / IP / TCP 192.168.1.10:5208 > 180.97.33.107:https PA / Raw
104	2020-03-18 01:11:42	180.97.33.107	192.168.1.10	Https	66	Ether / IP / TCP 180.97.33.107:https > 192.168.1.10:5209 SA
105	2020-03-18 01:11:42	192.168.1.10	180.97.33.107	Https	54	Ether / IP / TCP 192.168.1.10:5209 > 180.97.33.107:https A
106	2020-03-18 01:11:42	192.168.1.10	180.97.33.107	Https	571	Ether / IP / TCP 192.168.1.10:5209 > 180.97.33.107:https PA / Raw
107	2020-03-18 01:11:42	180.97.33.107	192.168.1.10	Https	60	Ether / IP / TCP 180.97.33.107:https > 192.168.1.10:5207 A / Padding
108	2020-03-18 01:11:42	180.97.33.107	192.168.1.10	Https	150	Ether / IP / TCP 180.97.33.107:https > 192.168.1.10:5207 PA / Raw
109	2020-03-18 01:11:42	180.97.33.107	192.168.1.10	Https	60	Ether / IP / TCP 180.97.33.107:https > 192.168.1.10:5207 PA / Raw
110	2020-03-18 01:11:42	180.97.33.107	192.168.1.10	Https	99	Ether / IP / TCP 180.97.33.107:https > 192.168.1.10:5207 PA / Raw
111	2020-03-18 01:11:42	192.168.1.10	180.97.33.107	Https	54	Ether / IP / TCP 192.168.1.10:5207 > 180.97.33.107:https A
112	2020-03-18 01:11:42	192.168.1.10	180.97.33.107	Https	105	Ether / IP / TCP 192.168.1.10:5207 > 180.97.33.107:https PA / Raw
113	2020-03-18 01:11:42	192.168.1.10	180.97.33.107	Https	1465	Ether / IP / TCP 192.168.1.10:5207 > 180.97.33.107:https PA / Raw
114	2020-03-18 01:11:42	180.97.33.107	192.168.1.10	Https	99	Ether / IP / TCP 180.97.33.107:https > 192.168.1.10:5207 PA / Raw
115	2020-03-18 01:11:42	192.168.1.10	180.97.33.107	Https	66	Ether / IP / TCP 192.168.1.10:5207 > 180.97.33.107:https A
116	2020-03-18 01:11:42	180.97.33.107	192.168.1.10	Https	60	Ether / IP / TCP 180.97.33.107:https > 192.168.1.10:5208 A / Padding
117	2020-03-18 01:11:42	180.97.33.107	192.168.1.10	Https	150	Ether / IP / TCP 180.97.33.107:https > 192.168.1.10:5208 PA / Raw
118	2020-03-18 01:11:42	180.97.33.107	192.168.1.10	Https	60	Ether / IP / TCP 180.97.33.107:https > 192.168.1.10:5208 PA / Raw
119	2020-03-18 01:11:42	180.97.33.107	192.168.1.10	Https	99	Ether / IP / TCP 180.97.33.107:https > 192.168.1.10:5208 PA / Raw
120	2020-03-18 01:11:42	192.168.1.10	180.97.33.107	Https	54	Ether / IP / TCP 192.168.1.10:5208 > 180.97.33.107:https A
121	2020-03-18 01:11:42	180.97.33.107	192.168.1.10	Https	60	Ether / IP / TCP 180.97.33.107:https > 192.168.1.10:5209 A / Padding
122	2020-03-18 01:11:42	180.97.33.107	192.168.1.10	Https	150	Ether / IP / TCP 180.97.33.107:https > 192.168.1.10:5209 PA / Raw
123	2020-03-18 01:11:42	180.97.33.107	192.168.1.10	Https	60	Ether / IP / TCP 180.97.33.107:https > 192.168.1.10:5209 PA / Raw
124	2020-03-18 01:11:42	180.97.33.107	192.168.1.10	Https	99	Ether / IP / TCP 180.97.33.107:https > 192.168.1.10:5209 PA / Raw
125	2020-03-18 01:11:42	192.168.1.10	180.97.33.107	Https	105	Ether / IP / TCP 192.168.1.10:5208 > 180.97.33.107:https PA / Raw
126	2020-03-18 01:11:42	192.168.1.10	180.97.33.107	Https	54	Ether / IP / TCP 192.168.1.10:5209 > 180.97.33.107:https A
127	2020-03-18 01:11:42	192.168.1.10	125.77.154.33	Https	134	Ether / IP / TCP 192.168.1.10:5210 > 125.77.154.33:https PA / Raw
128	2020-03-18 01:11:42	192.168.1.10	180.97.33.107	Https	105	Ether / IP / TCP 192.168.1.10:5209 > 180.97.33.107:https PA / Raw
129	2020-03-18 01:11:42	192.168.1.10	180.97.33.107	Https	1478	Ether / IP / TCP 192.168.1.10:5208 > 180.97.33.107:https PA / Raw
130	2020-03-18 01:11:42	192.168.1.10	125.77.154.33	Https	146	Ether / IP / TCP 192.168.1.10:5210 > 125.77.154.33:https PA / Raw
131	2020-03-18 01:11:42	192.168.1.10	180.97.33.107	Https	1323	Ether / IP / TCP 192.168.1.10:5209 > 180.97.33.107:https PA / Raw
132	2020-03-18 01:11:42	192.168.1.10	180.97.33.107	Https	249	Ether / IP / TCP 192.168.1.10:5209 > 180.97.33.107:https PA / Raw
133	2020-03-18 01:11:42	192.168.1.10	125.77.154.33	Https	354	Ether / IP / TCP 192.168.1.10:5210 > 125.77.154.33:https PA / Raw
134	2020-03-18 01:11:42	180.97.33.107	192.168.1.10	Https	1506	Ether / IP / TCP 180.97.33.107:https > 192.168.1.10:5206 A / Raw
135	2020-03-18 01:11:42	180.97.33.107	192.168.1.10	Https	1506	Ether / IP / TCP 180.97.33.107:https > 192.168.1.10:5206 A / Raw
136	2020-03-18 01:11:42	180.97.33.107	192.168.1.10	Https	1179	Ether / IP / TCP 180.97.33.107:https > 192.168.1.10:5206 PA / Raw
137	2020-03-18 01:11:42	180.97.33.107	192.168.1.10	Https	179	Ether / IP / TCP 180.97.33.107:https > 192.168.1.10:5206 PA / Raw
138	2020-03-18 01:11:42	180.97.33.107	192.168.1.10	Https	85	Ether / IP / TCP 180.97.33.107:https > 192.168.1.10:5206 PA / Raw
139	2020-03-18 01:11:42	192.168.1.10	180.97.33.107	Https	54	Ether / IP / TCP 192.168.1.10:5206 > 180.97.33.107:https A
140	2020-03-18 01:11:42	180.97.33.107	192.168.1.10	Https	212	Ether / IP / TCP 180.97.33.107:https > 192.168.1.10:5206 PA / Raw
141	2020-03-18 01:11:42	180.97.33.107	192.168.1.10	Https	88	Ether / IP / TCP 180.97.33.107:https > 192.168.1.10:5206 PA / Raw
142	2020-03-18 01:11:42	192.168.1.10	180.97.33.107	Https	54	Ether / IP / TCP 192.168.1.10:5206 > 180.97.33.107:https A
143	2020-03-18 01:11:42	125.77.154.33	192.168.1.10	Https	60	Ether / IP / TCP 125.77.154.33:https > 192.168.1.10:5210 A / Padding
144	2020-03-18 01:11:42	125.77.154.33	192.168.1.10	Https	341	Ether / IP / TCP 125.77.154.33:https > 192.168.1.10:5210 PA / Raw
145	2020-03-18 01:11:42	125.77.154.33	192.168.1.10	Https	341	Ether / IP / TCP 125.77.154.33:https > 192.168.1.10:5210 PA / Raw
146	2020-03-18 01:11:42	125.77.154.33	192.168.1.10	Https	116	Ether / IP / TCP 125.77.154.33:https > 192.168.1.10:5210 PA / Raw
147	2020-03-18 01:11:42	125.77.154.33	192.168.1.10	Https	60	Ether / IP / TCP 125.77.154.33:https > 192.168.1.10:5210 A / Padding
148	2020-03-18 01:11:42	180.97.33.107	192.168.1.10	Https	99	Ether / IP / TCP 180.97.33.107:https > 192.168.1.10:5208 PA / Raw
149	2020-03-18 01:11:42	125.77.154.33	192.168.1.10	Https	85	Ether / IP / TCP 125.77.154.33:https > 192.168.1.10:5210 PA / Raw
150	2020-03-18 01:11:42	192.168.1.10	180.97.33.107	Https	66	Ether / IP / TCP 192.168.1.10:5208 > 180.97.33.107:https A
151	2020-03-18 01:11:42	192.168.1.10	125.77.154.33	Https	54	Ether / IP / TCP 192.168.1.10:5210 > 125.77.154.33:https A
152	2020-03-18 01:11:42	180.97.33.107	192.168.1.10	Https	99	Ether / IP / TCP 180.97.33.107:https > 192.168.1.10:5209 PA / Raw
153	2020-03-18 01:11:42	192.168.1.10	180.97.33.107	Https	66	Ether / IP / TCP 192.168.1.10:5209 > 180.97.33.107:https A
154	2020-03-18 01:11:42	192.168.1.10	125.77.154.33	Https	85	Ether / IP / TCP 192.168.1.10:5210 > 125.77.154.33:https PA / Raw
155	2020-03-18 01:11:42	125.77.154.33	192.168.1.10	Https	60	Ether / IP / TCP 125.77.154.33:https > 192.168.1.10:5210 A / Padding
156	2020-03-18 01:11:42	125.77.154.33	192.168.1.10	Https	1394	Ether / IP / TCP 125.77.154.33:https > 192.168.1.10:5210 A / Raw
157	2020-03-18 01:11:42	125.77.154.33	192.168.1.10	Https	1394	Ether / IP / TCP 125.77.154.33:https > 192.168.1.10:5210 A / Raw
158	2020-03-18 01:11:42	125.77.154.33	192.168.1.10	Https	1394	Ether / IP / TCP 125.77.154.33:https > 192.168.1.10:5210 A / Raw
159	2020-03-18 01:11:42	192.168.1.10	125.77.154.33	Https	54	Ether / IP / TCP 192.168.1.10:5210 > 125.77.154.33:https A
160	2020-03-18 01:11:42	125.77.154.33	192.168.1.10	Https	869	Ether / IP / TCP 125.77.154.33:https > 192.168.1.10:5210 PA / Raw
161	2020-03-18 01:11:42	192.168.1.10	125.77.154.33	Https	54	Ether / IP / TCP 192.168.1.10:5210 > 125.77.154.33:https A
162	2020-03-18 01:11:42	180.97.33.107	192.168.1.10	Https	60	Ether / IP / TCP 180.97.33.107:https > 192.168.1.10:5207 A / Padding
163	2020-03-18 01:11:42	180.97.33.107	192.168.1.10	Https	60	Ether / IP / TCP 180.97.33.107:https > 192.168.1.10:5207 A / Padding
164	2020-03-18 01:11:42	125.77.154.33	192.168.1.10	Https	60	Ether / IP / TCP 125.77.154.33:https > 192.168.1.10:5210 A / Padding
165	2020-03-18 01:11:42	180.97.33.107	192.168.1.10	Https	60	Ether / IP / TCP 180.97.33.107:https > 192.168.1.10:5208 A / Padding
166	2020-03-18 01:11:42	180.97.33.107	192.168.1.10	Https	60	Ether / IP / TCP 180.97.33.107:https > 192.168.1.10:5209 A / Padding
167	2020-03-18 01:11:42	180.97.33.107	192.168.1.10	Https	60	Ether / IP / TCP 180.97.33.107:https > 192.168.1.10:5208 A / Padding
168	2020-03-18 01:11:42	180.97.33.107	192.168.1.10	Https	60	Ether / IP / TCP 180.97.33.107:https > 192.168.1.10:5209 A / Padding
169	2020-03-18 01:11:42	180.97.33.107	192.168.1.10	Https	60	Ether / IP / TCP 180.97.33.107:https > 192.168.1.10:5209 A / Padding
170	2020-03-18 01:11:42	192.168.1.10	180.97.33.107	Https	1196	Ether / IP / TCP 192.168.1.10:5206 > 180.97.33.107:https PA / Raw
171	2020-03-18 01:11:42	180.97.33.107	192.168.1.10	Https	408	Ether / IP / TCP 180.97.33.107:https > 192.168.1.10:5209 PA / Raw
172	2020-03-18 01:11:42	180.97.33.107	192.168.1.10	Https	60	Ether / IP / TCP 180.97.33.107:https > 192.168.1.10:5206 A / Padding
173	2020-03-18 01:11:42	180.97.33.107	192.168.1.10	Https	567	Ether / IP / TCP 180.97.33.107:https > 192.168.1.10:5206 PA / Raw
174	2020-03-18 01:11:42	180.97.33.107	192.168.1.10	Https	388	Ether / IP / TCP 180.97.33.107:https > 192.168.1.10:5208 PA / Raw
175	2020-03-18 01:11:42	180.97.33.107	192.168.1.10	Https	388	Ether / IP / TCP 180.97.33.107:https > 192.168.1.10:5207 PA / Raw
176	2020-03-18 01:11:42	192.168.1.10	180.97.33.107	Https	54	Ether / IP / TCP 192.168.1.10:5209 > 180.97.33.107:https A
177	2020-03-18 01:11:42	192.168.1.10	180.97.33.107	Https	54	Ether / IP / TCP 192.168.1.10:5206 > 180.97.33.107:https A
178	2020-03-18 01:11:42	192.168.1.10	180.97.33.107	Https	54	Ether / IP / TCP 192.168.1.10:5208 > 180.97.33.107:https A
179	2020-03-18 01:11:42	192.168.1.10	180.97.33.107	Https	54	Ether / IP / TCP 192.168.1.10:5207 > 180.97.33.107:https A
180	2020-03-18 01:11:42	192.168.1.10	47.244.15.210	TCP	66	Ether / IP / TCP 192.168.1.10:5204 > 47.244.15.210:20395 S
181	2020-03-18 01:11:42	fe80::f141:b4f2:11de:b126	fe80::1	DNS	93	Ether / IPv6 / UDP / DNS Qry "b'sp1.baidu.com.'" 
182	2020-03-18 01:11:42	fe80::f141:b4f2:11de:b126	fe80::1	DNS	93	Ether / IPv6 / UDP / DNS Qry "b'sp1.baidu.com.'" 
183	2020-03-18 01:11:42	fe80::f141:b4f2:11de:b126	fe80::1	DNS	93	Ether / IPv6 / UDP / DNS Qry "b'sp2.baidu.com.'" 
184	2020-03-18 01:11:42	fe80::f141:b4f2:11de:b126	fe80::1	DNS	93	Ether / IPv6 / UDP / DNS Qry "b'sp2.baidu.com.'" 
185	2020-03-18 01:11:42	fe80::f141:b4f2:11de:b126	fe80::1	DNS	93	Ether / IPv6 / UDP / DNS Qry "b'sp0.baidu.com.'" 
186	2020-03-18 01:11:42	fe80::f141:b4f2:11de:b126	fe80::1	DNS	93	Ether / IPv6 / UDP / DNS Qry "b'sp0.baidu.com.'" 
187	2020-03-18 01:11:42	fe80::1	fe80::f141:b4f2:11de:b126	DNS	386	Ether / IPv6 / UDP / DNS Ans "b'www.a.shifen.com.'" 
188	2020-03-18 01:11:42	fe80::1	fe80::f141:b4f2:11de:b126	DNS	177	Ether / IPv6 / UDP / DNS Ans "b'www.a.shifen.com.'" 
189	2020-03-18 01:11:42	192.168.1.10	180.101.49.11	Https	66	Ether / IP / TCP 192.168.1.10:5211 > 180.101.49.11:https S
190	2020-03-18 01:11:42	fe80::1	fe80::f141:b4f2:11de:b126	DNS	386	Ether / IPv6 / UDP / DNS Ans "b'www.a.shifen.com.'" 
191	2020-03-18 01:11:42	fe80::1	fe80::f141:b4f2:11de:b126	DNS	177	Ether / IPv6 / UDP / DNS Ans "b'www.a.shifen.com.'" 
192	2020-03-18 01:11:42	192.168.1.10	180.97.33.107	Https	66	Ether / IP / TCP 192.168.1.10:5212 > 180.97.33.107:https S
193	2020-03-18 01:11:42	fe80::1	fe80::f141:b4f2:11de:b126	DNS	386	Ether / IPv6 / UDP / DNS Ans "b'www.a.shifen.com.'" 
194	2020-03-18 01:11:42	fe80::1	fe80::f141:b4f2:11de:b126	DNS	177	Ether / IPv6 / UDP / DNS Ans "b'www.a.shifen.com.'" 
195	2020-03-18 01:11:42	192.168.1.10	220.181.38.149	Https	66	Ether / IP / TCP 192.168.1.10:5213 > 220.181.38.149:https S
196	2020-03-18 01:11:42	180.101.49.11	192.168.1.10	Https	66	Ether / IP / TCP 180.101.49.11:https > 192.168.1.10:5211 SA
197	2020-03-18 01:11:42	192.168.1.10	180.101.49.11	Https	54	Ether / IP / TCP 192.168.1.10:5211 > 180.101.49.11:https A
198	2020-03-18 01:11:42	192.168.1.10	180.101.49.11	Https	571	Ether / IP / TCP 192.168.1.10:5211 > 180.101.49.11:https PA / Raw
199	2020-03-18 01:11:42	180.97.33.107	192.168.1.10	Https	66	Ether / IP / TCP 180.97.33.107:https > 192.168.1.10:5212 SA
200	2020-03-18 01:11:42	192.168.1.10	180.97.33.107	Https	54	Ether / IP / TCP 192.168.1.10:5212 > 180.97.33.107:https A
201	2020-03-18 01:11:42	192.168.1.10	180.97.33.107	Https	571	Ether / IP / TCP 192.168.1.10:5212 > 180.97.33.107:https PA / Raw
202	2020-03-18 01:11:42	220.181.38.149	192.168.1.10	Https	66	Ether / IP / TCP 220.181.38.149:https > 192.168.1.10:5213 SA
203	2020-03-18 01:11:42	192.168.1.10	220.181.38.149	Https	54	Ether / IP / TCP 192.168.1.10:5213 > 220.181.38.149:https A
204	2020-03-18 01:11:42	192.168.1.10	220.181.38.149	Https	571	Ether / IP / TCP 192.168.1.10:5213 > 220.181.38.149:https PA / Raw
205	2020-03-18 01:11:42	180.101.49.11	192.168.1.10	Https	60	Ether / IP / TCP 180.101.49.11:https > 192.168.1.10:5211 A / Padding
206	2020-03-18 01:11:42	180.101.49.11	192.168.1.10	Https	150	Ether / IP / TCP 180.101.49.11:https > 192.168.1.10:5211 PA / Raw
207	2020-03-18 01:11:42	180.101.49.11	192.168.1.10	Https	60	Ether / IP / TCP 180.101.49.11:https > 192.168.1.10:5211 PA / Raw
208	2020-03-18 01:11:42	192.168.1.10	180.101.49.11	Https	54	Ether / IP / TCP 192.168.1.10:5211 > 180.101.49.11:https A
209	2020-03-18 01:11:42	180.101.49.11	192.168.1.10	Https	99	Ether / IP / TCP 180.101.49.11:https > 192.168.1.10:5211 PA / Raw
210	2020-03-18 01:11:42	192.168.1.10	180.101.49.11	Https	105	Ether / IP / TCP 192.168.1.10:5211 > 180.101.49.11:https PA / Raw
211	2020-03-18 01:11:42	192.168.1.10	180.101.49.11	Https	1343	Ether / IP / TCP 192.168.1.10:5211 > 180.101.49.11:https PA / Raw
212	2020-03-18 01:11:42	180.97.33.107	192.168.1.10	Https	60	Ether / IP / TCP 180.97.33.107:https > 192.168.1.10:5212 A / Padding
213	2020-03-18 01:11:42	180.97.33.107	192.168.1.10	Https	150	Ether / IP / TCP 180.97.33.107:https > 192.168.1.10:5212 PA / Raw
214	2020-03-18 01:11:42	180.97.33.107	192.168.1.10	Https	60	Ether / IP / TCP 180.97.33.107:https > 192.168.1.10:5212 PA / Raw
215	2020-03-18 01:11:42	180.97.33.107	192.168.1.10	Https	99	Ether / IP / TCP 180.97.33.107:https > 192.168.1.10:5212 PA / Raw
216	2020-03-18 01:11:42	192.168.1.10	180.97.33.107	Https	54	Ether / IP / TCP 192.168.1.10:5212 > 180.97.33.107:https A
217	2020-03-18 01:11:42	192.168.1.10	180.97.33.107	Https	105	Ether / IP / TCP 192.168.1.10:5212 > 180.97.33.107:https PA / Raw
218	2020-03-18 01:11:42	192.168.1.10	180.97.33.107	Https	1330	Ether / IP / TCP 192.168.1.10:5212 > 180.97.33.107:https PA / Raw
219	2020-03-18 01:11:42	180.101.49.11	192.168.1.10	Https	99	Ether / IP / TCP 180.101.49.11:https > 192.168.1.10:5211 PA / Raw
220	2020-03-18 01:11:42	192.168.1.10	180.101.49.11	Https	66	Ether / IP / TCP 192.168.1.10:5211 > 180.101.49.11:https A
221	2020-03-18 01:11:42	180.97.33.107	192.168.1.10	Https	99	Ether / IP / TCP 180.97.33.107:https > 192.168.1.10:5212 PA / Raw
222	2020-03-18 01:11:42	192.168.1.10	180.97.33.107	Https	66	Ether / IP / TCP 192.168.1.10:5212 > 180.97.33.107:https A
223	2020-03-18 01:11:42	180.101.49.11	192.168.1.10	Https	60	Ether / IP / TCP 180.101.49.11:https > 192.168.1.10:5211 A / Padding
224	2020-03-18 01:11:42	180.101.49.11	192.168.1.10	Https	60	Ether / IP / TCP 180.101.49.11:https > 192.168.1.10:5211 A / Padding
225	2020-03-18 01:11:42	220.181.38.149	192.168.1.10	Https	60	Ether / IP / TCP 220.181.38.149:https > 192.168.1.10:5213 A / Padding
226	2020-03-18 01:11:42	220.181.38.149	192.168.1.10	Https	150	Ether / IP / TCP 220.181.38.149:https > 192.168.1.10:5213 PA / Raw
227	2020-03-18 01:11:42	220.181.38.149	192.168.1.10	Https	60	Ether / IP / TCP 220.181.38.149:https > 192.168.1.10:5213 PA / Raw
228	2020-03-18 01:11:42	220.181.38.149	192.168.1.10	Https	99	Ether / IP / TCP 220.181.38.149:https > 192.168.1.10:5213 PA / Raw
229	2020-03-18 01:11:42	192.168.1.10	220.181.38.149	Https	54	Ether / IP / TCP 192.168.1.10:5213 > 220.181.38.149:https A
230	2020-03-18 01:11:42	192.168.1.10	220.181.38.149	Https	105	Ether / IP / TCP 192.168.1.10:5213 > 220.181.38.149:https PA / Raw
231	2020-03-18 01:11:42	192.168.1.10	220.181.38.149	Https	1369	Ether / IP / TCP 192.168.1.10:5213 > 220.181.38.149:https PA / Raw
232	2020-03-18 01:11:42	180.97.33.107	192.168.1.10	Https	60	Ether / IP / TCP 180.97.33.107:https > 192.168.1.10:5212 A / Padding
233	2020-03-18 01:11:42	180.97.33.107	192.168.1.10	Https	60	Ether / IP / TCP 180.97.33.107:https > 192.168.1.10:5212 A / Padding
234	2020-03-18 01:11:42	220.181.38.149	192.168.1.10	Https	99	Ether / IP / TCP 220.181.38.149:https > 192.168.1.10:5213 PA / Raw
235	2020-03-18 01:11:42	192.168.1.10	220.181.38.149	Https	66	Ether / IP / TCP 192.168.1.10:5213 > 220.181.38.149:https A
236	2020-03-18 01:11:42	180.101.49.11	192.168.1.10	Https	372	Ether / IP / TCP 180.101.49.11:https > 192.168.1.10:5211 PA / Raw
237	2020-03-18 01:11:42	180.97.33.107	192.168.1.10	Https	372	Ether / IP / TCP 180.97.33.107:https > 192.168.1.10:5212 PA / Raw
238	2020-03-18 01:11:42	220.181.38.149	192.168.1.10	Https	60	Ether / IP / TCP 220.181.38.149:https > 192.168.1.10:5213 A / Padding
239	2020-03-18 01:11:42	220.181.38.149	192.168.1.10	Https	60	Ether / IP / TCP 220.181.38.149:https > 192.168.1.10:5213 A / Padding
240	2020-03-18 01:11:42	220.181.38.149	192.168.1.10	Https	372	Ether / IP / TCP 220.181.38.149:https > 192.168.1.10:5213 PA / Raw
241	2020-03-18 01:11:42	192.168.1.10	47.244.15.210	TCP	66	Ether / IP / TCP 192.168.1.10:5205 > 47.244.15.210:20395 S
242	2020-03-18 01:11:42	192.168.1.10	180.101.49.11	Https	54	Ether / IP / TCP 192.168.1.10:5211 > 180.101.49.11:https A
243	2020-03-18 01:11:42	192.168.1.10	180.97.33.107	Https	54	Ether / IP / TCP 192.168.1.10:5212 > 180.97.33.107:https A
244	2020-03-18 01:11:42	192.168.1.10	10.10.20.110	UDP	120	Ether / IP / UDP 192.168.1.10:59684 > 10.10.20.110:snmp / SNMP
245	2020-03-18 01:11:42	192.168.1.10	220.181.38.149	Https	54	Ether / IP / TCP 192.168.1.10:5213 > 220.181.38.149:https A
246	2020-03-18 01:11:42	fe80::f141:b4f2:11de:b126	fe80::1	DNS	98	Ether / IPv6 / UDP / DNS Qry "b'union-click.jd.com.'" 
247	2020-03-18 01:11:42	fe80::f141:b4f2:11de:b126	fe80::1	DNS	98	Ether / IPv6 / UDP / DNS Qry "b'union-click.jd.com.'" 
248	2020-03-18 01:11:42	fe80::1	fe80::f141:b4f2:11de:b126	DNS	304	Ether / IPv6 / UDP / DNS Ans "b'union-click.jd.com.gslb.qianxun.com.'" 
249	2020-03-18 01:11:42	fe80::1	fe80::f141:b4f2:11de:b126	DNS	199	Ether / IPv6 / UDP / DNS Ans "b'union-click.jd.com.gslb.qianxun.com.'" 
250	2020-03-18 01:11:42	192.168.1.10	106.39.169.232	Https	66	Ether / IP / TCP 192.168.1.10:5214 > 106.39.169.232:https S
251	2020-03-18 01:11:42	192.168.1.10	106.39.169.232	Https	66	Ether / IP / TCP 192.168.1.10:5215 > 106.39.169.232:https S
252	2020-03-18 01:11:42	106.39.169.232	192.168.1.10	Https	66	Ether / IP / TCP 106.39.169.232:https > 192.168.1.10:5214 SA
253	2020-03-18 01:11:42	192.168.1.10	106.39.169.232	Https	54	Ether / IP / TCP 192.168.1.10:5214 > 106.39.169.232:https A
254	2020-03-18 01:11:42	192.168.1.10	106.39.169.232	Https	571	Ether / IP / TCP 192.168.1.10:5214 > 106.39.169.232:https PA / Raw
255	2020-03-18 01:11:42	106.39.169.232	192.168.1.10	Https	66	Ether / IP / TCP 106.39.169.232:https > 192.168.1.10:5215 SA
256	2020-03-18 01:11:42	192.168.1.10	106.39.169.232	Https	54	Ether / IP / TCP 192.168.1.10:5215 > 106.39.169.232:https A
257	2020-03-18 01:11:42	192.168.1.10	106.39.169.232	Https	571	Ether / IP / TCP 192.168.1.10:5215 > 106.39.169.232:https PA / Raw
258	2020-03-18 01:11:42	106.39.169.232	192.168.1.10	Https	60	Ether / IP / TCP 106.39.169.232:https > 192.168.1.10:5214 A / Padding
259	2020-03-18 01:11:42	106.39.169.232	192.168.1.10	Https	1506	Ether / IP / TCP 106.39.169.232:https > 192.168.1.10:5214 A / Raw
260	2020-03-18 01:11:42	106.39.169.232	192.168.1.10	Https	1506	Ether / IP / TCP 106.39.169.232:https > 192.168.1.10:5214 A / Raw
261	2020-03-18 01:11:42	106.39.169.232	192.168.1.10	Https	1164	Ether / IP / TCP 106.39.169.232:https > 192.168.1.10:5214 PA / Raw
262	2020-03-18 01:11:42	192.168.1.10	106.39.169.232	Https	54	Ether / IP / TCP 192.168.1.10:5214 > 106.39.169.232:https A
263	2020-03-18 01:11:42	106.39.169.232	192.168.1.10	Https	60	Ether / IP / TCP 106.39.169.232:https > 192.168.1.10:5215 A / Padding
264	2020-03-18 01:11:42	106.39.169.232	192.168.1.10	Https	1506	Ether / IP / TCP 106.39.169.232:https > 192.168.1.10:5215 A / Raw
265	2020-03-18 01:11:42	106.39.169.232	192.168.1.10	Https	1506	Ether / IP / TCP 106.39.169.232:https > 192.168.1.10:5215 A / Raw
266	2020-03-18 01:11:42	106.39.169.232	192.168.1.10	Https	1164	Ether / IP / TCP 106.39.169.232:https > 192.168.1.10:5215 PA / Raw
267	2020-03-18 01:11:42	192.168.1.10	106.39.169.232	Https	54	Ether / IP / TCP 192.168.1.10:5215 > 106.39.169.232:https A
268	2020-03-18 01:11:42	192.168.1.10	106.39.169.232	Https	134	Ether / IP / TCP 192.168.1.10:5214 > 106.39.169.232:https PA / Raw
269	2020-03-18 01:11:42	192.168.1.10	106.39.169.232	Https	134	Ether / IP / TCP 192.168.1.10:5215 > 106.39.169.232:https PA / Raw
270	2020-03-18 01:11:42	192.168.1.10	106.39.169.232	Https	54	Ether / IP / TCP 192.168.1.10:5215 > 106.39.169.232:https FA
271	2020-03-18 01:11:42	192.168.1.10	106.39.169.232	Https	146	Ether / IP / TCP 192.168.1.10:5214 > 106.39.169.232:https PA / Raw
272	2020-03-18 01:11:42	192.168.1.10	106.39.169.232	Https	868	Ether / IP / TCP 192.168.1.10:5214 > 106.39.169.232:https PA / Raw
273	2020-03-18 01:11:43	106.39.169.232	192.168.1.10	Https	341	Ether / IP / TCP 106.39.169.232:https > 192.168.1.10:5214 PA / Raw
274	2020-03-18 01:11:43	106.39.169.232	192.168.1.10	Https	341	Ether / IP / TCP 106.39.169.232:https > 192.168.1.10:5214 PA / Raw
275	2020-03-18 01:11:43	106.39.169.232	192.168.1.10	Https	116	Ether / IP / TCP 106.39.169.232:https > 192.168.1.10:5214 PA / Raw
276	2020-03-18 01:11:43	192.168.1.10	106.39.169.232	Https	54	Ether / IP / TCP 192.168.1.10:5214 > 106.39.169.232:https A
277	2020-03-18 01:11:43	192.168.1.10	106.39.169.232	Https	85	Ether / IP / TCP 192.168.1.10:5214 > 106.39.169.232:https PA / Raw
278	2020-03-18 01:11:43	106.39.169.232	192.168.1.10	Https	341	Ether / IP / TCP 106.39.169.232:https > 192.168.1.10:5215 PA / Raw
279	2020-03-18 01:11:43	106.39.169.232	192.168.1.10	Https	341	Ether / IP / TCP 106.39.169.232:https > 192.168.1.10:5215 PA / Raw
280	2020-03-18 01:11:43	106.39.169.232	192.168.1.10	Https	85	Ether / IP / TCP 106.39.169.232:https > 192.168.1.10:5214 PA / Raw
281	2020-03-18 01:11:43	192.168.1.10	106.39.169.232	Https	54	Ether / IP / TCP 192.168.1.10:5215 > 106.39.169.232:https RA
282	2020-03-18 01:11:43	106.39.169.232	192.168.1.10	Https	60	Ether / IP / TCP 106.39.169.232:https > 192.168.1.10:5215 FA / Padding
283	2020-03-18 01:11:43	106.39.169.232	192.168.1.10	Https	1506	Ether / IP / TCP 106.39.169.232:https > 192.168.1.10:5214 A / Raw
284	2020-03-18 01:11:43	106.39.169.232	192.168.1.10	Https	1086	Ether / IP / TCP 106.39.169.232:https > 192.168.1.10:5214 PA / Raw
285	2020-03-18 01:11:43	192.168.1.10	106.39.169.232	Https	54	Ether / IP / TCP 192.168.1.10:5214 > 106.39.169.232:https A
286	2020-03-18 01:11:43	192.168.1.10	180.101.49.11	Https	1506	Ether / IP / TCP 192.168.1.10:5211 > 180.101.49.11:https A / Raw
287	2020-03-18 01:11:43	192.168.1.10	180.101.49.11	Https	81	Ether / IP / TCP 192.168.1.10:5211 > 180.101.49.11:https PA / Raw
288	2020-03-18 01:11:43	106.39.169.232	192.168.1.10	Https	60	Ether / IP / TCP 106.39.169.232:https > 192.168.1.10:5214 A / Padding
289	2020-03-18 01:11:43	192.168.1.10	106.39.169.232	Https	485	Ether / IP / TCP 192.168.1.10:5214 > 106.39.169.232:https PA / Raw
290	2020-03-18 01:11:43	180.101.49.11	192.168.1.10	Https	60	Ether / IP / TCP 180.101.49.11:https > 192.168.1.10:5211 A / Padding
291	2020-03-18 01:11:43	192.168.1.10	183.57.48.55	UDP	1012	Ether / IP / UDP 192.168.1.10:54843 > 183.57.48.55:8000 / Raw
292	2020-03-18 01:11:43	180.101.49.11	192.168.1.10	Https	372	Ether / IP / TCP 180.101.49.11:https > 192.168.1.10:5211 PA / Raw
293	2020-03-18 01:11:43	106.39.169.232	192.168.1.10	Https	60	Ether / IP / TCP 106.39.169.232:https > 192.168.1.10:5214 A / Padding
294	2020-03-18 01:11:43	183.57.48.55	192.168.1.10	UDP	356	Ether / IP / UDP 183.57.48.55:8000 > 192.168.1.10:54843 / Raw
295	2020-03-18 01:11:43	106.39.169.232	192.168.1.10	Https	1453	Ether / IP / TCP 106.39.169.232:https > 192.168.1.10:5214 PA / Raw
296	2020-03-18 01:11:43	fe80::f141:b4f2:11de:b126	fe80::1	DNS	90	Ether / IPv6 / UDP / DNS Qry "b'www.jd.com.'" 
297	2020-03-18 01:11:43	fe80::f141:b4f2:11de:b126	fe80::1	DNS	90	Ether / IPv6 / UDP / DNS Qry "b'www.jd.com.'" 
298	2020-03-18 01:11:43	fe80::1	fe80::f141:b4f2:11de:b126	DNS	304	Ether / IPv6 / UDP / DNS Ans "b'www.jd.com.gslb.qianxun.com.'" 
299	2020-03-18 01:11:43	fe80::1	fe80::f141:b4f2:11de:b126	DNS	197	Ether / IPv6 / UDP / DNS Ans "b'www.jd.com.gslb.qianxun.com.'" 
300	2020-03-18 01:11:43	192.168.1.10	183.60.141.1	Http	66	Ether / IP / TCP 192.168.1.10:5216 > 183.60.141.1:http S
301	2020-03-18 01:11:43	192.168.1.10	180.101.49.11	Https	54	Ether / IP / TCP 192.168.1.10:5211 > 180.101.49.11:https A
302	2020-03-18 01:11:43	183.60.141.1	192.168.1.10	Http	66	Ether / IP / TCP 183.60.141.1:http > 192.168.1.10:5216 SA
303	2020-03-18 01:11:43	192.168.1.10	183.60.141.1	Http	54	Ether / IP / TCP 192.168.1.10:5216 > 183.60.141.1:http A
304	2020-03-18 01:11:43	192.168.1.10	183.60.141.1	Http	1506	Ether / IP / TCP / HTTP / 'GET' '/?cu=true&utm_source=www.baidu.com&utm_medium=tuiguang&utm_campaign=t_1000003625_hao123mz&utm_term=48d501c9fff349e18f156e1001da46df' 'HTTP/1.1'
305	2020-03-18 01:11:43	192.168.1.10	183.60.141.1	Http	175	Ether / IP / TCP 192.168.1.10:5216 > 183.60.141.1:http PA / HTTP / Raw
306	2020-03-18 01:11:43	192.168.1.10	106.39.169.232	Https	54	Ether / IP / TCP 192.168.1.10:5214 > 106.39.169.232:https A
307	2020-03-18 01:11:43	183.60.141.1	192.168.1.10	Http	60	Ether / IP / TCP 183.60.141.1:http > 192.168.1.10:5216 A / Padding
308	2020-03-18 01:11:43	183.60.141.1	192.168.1.10	Http	575	Ether / IP / TCP / HTTP / 'HTTP/1.1' '302' 'Moved Temporarily' / Raw
309	2020-03-18 01:11:43	192.168.1.10	183.60.141.1	Https	66	Ether / IP / TCP 192.168.1.10:5217 > 183.60.141.1:https S
310	2020-03-18 01:11:43	183.60.141.1	192.168.1.10	Https	66	Ether / IP / TCP 183.60.141.1:https > 192.168.1.10:5217 SA
311	2020-03-18 01:11:43	192.168.1.10	183.60.141.1	Https	54	Ether / IP / TCP 192.168.1.10:5217 > 183.60.141.1:https A
312	2020-03-18 01:11:43	192.168.1.10	183.60.141.1	Https	571	Ether / IP / TCP 192.168.1.10:5217 > 183.60.141.1:https PA / Raw
313	2020-03-18 01:11:43	192.168.1.10	183.60.141.1	Http	54	Ether / IP / TCP 192.168.1.10:5216 > 183.60.141.1:http A
314	2020-03-18 01:11:43	183.60.141.1	192.168.1.10	Https	60	Ether / IP / TCP 183.60.141.1:https > 192.168.1.10:5217 A / Padding
315	2020-03-18 01:11:43	183.60.141.1	192.168.1.10	Https	1506	Ether / IP / TCP 183.60.141.1:https > 192.168.1.10:5217 A / Raw
316	2020-03-18 01:11:43	183.60.141.1	192.168.1.10	Https	1506	Ether / IP / TCP 183.60.141.1:https > 192.168.1.10:5217 A / Raw
317	2020-03-18 01:11:43	183.60.141.1	192.168.1.10	Https	1031	Ether / IP / TCP 183.60.141.1:https > 192.168.1.10:5217 PA / Raw
318	2020-03-18 01:11:43	192.168.1.10	183.60.141.1	Https	54	Ether / IP / TCP 192.168.1.10:5217 > 183.60.141.1:https A
