1	2020-03-17 22:31:01	192.168.1.10	10.10.20.110	UDP	84	Ether / IP / UDP 192.168.1.10:59684 > 10.10.20.110:snmp / SNMP
2	2020-03-17 22:31:01	192.168.1.10	219.133.60.246	Http	66	Ether / IP / TCP 192.168.1.10:10712 > 219.133.60.246:http S
3	2020-03-17 22:31:01	219.133.60.246	192.168.1.10	Http	66	Ether / IP / TCP 219.133.60.246:http > 192.168.1.10:10712 SA
4	2020-03-17 22:31:01	192.168.1.10	219.133.60.246	Http	54	Ether / IP / TCP 192.168.1.10:10712 > 219.133.60.246:http A
5	2020-03-17 22:31:02	192.168.1.10	10.10.20.110	UDP	84	Ether / IP / UDP 192.168.1.10:59684 > 10.10.20.110:snmp / SNMP
6	2020-03-17 22:31:02	192.168.1.10	219.133.60.246	Http	473	Ether / IP / TCP / HTTP / 'POST' '/q.cgi' 'HTTP/1.1' / Raw
7	2020-03-17 22:31:02	219.133.60.246	192.168.1.10	Http	60	Ether / IP / TCP 219.133.60.246:http > 192.168.1.10:10712 A / Padding
8	2020-03-17 22:31:02	219.133.60.246	192.168.1.10	Http	320	Ether / IP / TCP / HTTP / 'HTTP/1.1' '200' 'OK' / Raw
9	2020-03-17 22:31:02	192.168.1.10	219.133.60.246	Http	54	Ether / IP / TCP 192.168.1.10:10712 > 219.133.60.246:http FA
10	2020-03-17 22:31:02	219.133.60.246	192.168.1.10	Http	60	Ether / IP / TCP 219.133.60.246:http > 192.168.1.10:10712 FA / Padding
11	2020-03-17 22:31:02	192.168.1.10	219.133.60.246	Http	54	Ether / IP / TCP 192.168.1.10:10712 > 219.133.60.246:http A
12	2020-03-17 22:31:05	192.168.1.10	14.215.177.39	Https	54	Ether / IP / TCP 192.168.1.10:10705 > 14.215.177.39:https RA
