93	2020-03-17 22:32:28	192.168.1.10	14.215.177.39	Https	54	Ether / IP / TCP 192.168.1.10:10820 > 14.215.177.39:https FA
94	2020-03-17 22:32:30	192.168.1.10	14.215.177.39	Https	54	Ether / IP / TCP 192.168.1.10:10820 > 14.215.177.39:https FA
95	2020-03-17 22:32:31	161.117.236.80	192.168.1.10	TCP	364	Ether / IP / TCP 161.117.236.80:20395 > 192.168.1.10:10804 PA / Raw
96	2020-03-17 22:32:31	192.168.1.10	161.117.236.80	TCP	1058	Ether / IP / TCP 192.168.1.10:10804 > 161.117.236.80:20395 PA / Raw
97	2020-03-17 22:32:31	161.117.236.80	192.168.1.10	TCP	60	Ether / IP / TCP 161.117.236.80:20395 > 192.168.1.10:10804 A / Padding
98	2020-03-17 22:32:31	192.168.1.10	10.10.20.110	UDP	120	Ether / IP / UDP 192.168.1.10:59684 > 10.10.20.110:snmp / SNMP
99	2020-03-17 22:32:31	00:e0:4c:68:00:2d	9c:d2:4b:38:91:c1	ARP	42	Ether / ARP who has 192.168.1.1 says 192.168.1.10
100	2020-03-17 22:32:31	9c:d2:4b:38:91:c1	00:e0:4c:68:00:2d	ARP	60	Ether / ARP is at 9c:d2:4b:38:91:c1 says 192.168.1.1 / Padding
101	2020-03-17 22:32:31	161.117.236.80	192.168.1.10	TCP	735	Ether / IP / TCP 161.117.236.80:20395 > 192.168.1.10:10804 PA / Raw
102	2020-03-17 22:32:31	192.168.1.10	161.117.236.80	TCP	1078	Ether / IP / TCP 192.168.1.10:10804 > 161.117.236.80:20395 PA / Raw
103	2020-03-17 22:32:31	161.117.236.80	192.168.1.10	TCP	60	Ether / IP / TCP 161.117.236.80:20395 > 192.168.1.10:10804 A / Padding
104	2020-03-17 22:32:32	161.117.236.80	192.168.1.10	TCP	1109	Ether / IP / TCP 161.117.236.80:20395 > 192.168.1.10:10804 PA / Raw
105	2020-03-17 22:32:32	192.168.1.10	161.117.236.80	TCP	54	Ether / IP / TCP 192.168.1.10:10804 > 161.117.236.80:20395 A
106	2020-03-17 22:32:35	192.168.1.10	40.119.211.203	Https	153	Ether / IP / TCP 192.168.1.10:1310 > 40.119.211.203:https PA / Raw
107	2020-03-17 22:32:35	192.168.1.10	14.215.177.39	Https	54	Ether / IP / TCP 192.168.1.10:10817 > 14.215.177.39:https RA
108	2020-03-17 22:32:35	40.119.211.203	192.168.1.10	Https	223	Ether / IP / TCP 40.119.211.203:https > 192.168.1.10:1310 PA / Raw
109	2020-03-17 22:32:35	192.168.1.10	40.119.211.203	Https	54	Ether / IP / TCP 192.168.1.10:1310 > 40.119.211.203:https A
110	2020-03-17 22:32:35	192.168.1.10	14.215.177.39	Https	54	Ether / IP / TCP 192.168.1.10:10820 > 14.215.177.39:https FA
111	2020-03-17 22:32:36	192.168.1.10	14.215.177.39	Https	66	Ether / IP / TCP 192.168.1.10:10821 > 14.215.177.39:https S
112	2020-03-17 22:32:36	14.215.177.39	192.168.1.10	Https	66	Ether / IP / TCP 14.215.177.39:https > 192.168.1.10:10821 SA
113	2020-03-17 22:32:36	192.168.1.10	14.215.177.39	Https	54	Ether / IP / TCP 192.168.1.10:10821 > 14.215.177.39:https A
114	2020-03-17 22:32:36	192.168.1.10	14.215.177.39	Https	54	Ether / IP / TCP 192.168.1.10:10821 > 14.215.177.39:https FA
115	2020-03-17 22:32:36	192.168.1.10	14.215.177.39	Https	54	Ether / IP / TCP 192.168.1.10:10821 > 14.215.177.39:https FA
116	2020-03-17 22:32:36	240e:ff:f101:10::11a	240e:d4:2e8e:df00:4882:f650:cbf9:db1d	Http	115	Ether / IPv6 / TCP 240e:ff:f101:10::11a:http > 240e:d4:2e8e:df00:4882:f650:cbf9:db1d:2012 PA / HTTP / Raw
117	2020-03-17 22:32:36	240e:d4:2e8e:df00:4882:f650:cbf9:db1d	240e:ff:f101:10::11a	Http	429	Ether / IPv6 / TCP 240e:d4:2e8e:df00:4882:f650:cbf9:db1d:2012 > 240e:ff:f101:10::11a:http PA / HTTP / Raw
118	2020-03-17 22:32:36	240e:ff:f101:10::11a	240e:d4:2e8e:df00:4882:f650:cbf9:db1d	Http	598	Ether / IPv6 / TCP 240e:ff:f101:10::11a:http > 240e:d4:2e8e:df00:4882:f650:cbf9:db1d:2012 PA / HTTP / Raw
119	2020-03-17 22:32:36	240e:d4:2e8e:df00:4882:f650:cbf9:db1d	240e:ff:f101:10::11a	Http	74	Ether / IPv6 / TCP 240e:d4:2e8e:df00:4882:f650:cbf9:db1d:2012 > 240e:ff:f101:10::11a:http A
120	2020-03-17 22:32:37	192.168.1.10	14.215.177.39	Https	54	Ether / IP / TCP 192.168.1.10:10821 > 14.215.177.39:https FA
121	2020-03-17 22:32:38	192.168.1.10	14.215.177.39	Https	54	Ether / IP / TCP 192.168.1.10:10821 > 14.215.177.39:https FA
122	2020-03-17 22:32:40	161.117.236.80	192.168.1.10	TCP	200	Ether / IP / TCP 161.117.236.80:20395 > 192.168.1.10:10804 PA / Raw
123	2020-03-17 22:32:40	192.168.1.10	161.117.236.80	TCP	54	Ether / IP / TCP 192.168.1.10:10804 > 161.117.236.80:20395 A
124	2020-03-17 22:32:40	161.117.236.80	192.168.1.10	TCP	842	Ether / IP / TCP 161.117.236.80:20395 > 192.168.1.10:10804 PA / Raw
125	2020-03-17 22:32:40	192.168.1.10	161.117.236.80	TCP	54	Ether / IP / TCP 192.168.1.10:10804 > 161.117.236.80:20395 A
126	2020-03-17 22:32:40	192.168.1.10	14.215.177.39	Https	54	Ether / IP / TCP 192.168.1.10:10821 > 14.215.177.39:https FA
127	2020-03-17 22:32:40	161.117.236.80	192.168.1.10	TCP	60	Ether / IP / TCP 161.117.236.80:20395 > 192.168.1.10:10681 FA / Padding
128	2020-03-17 22:32:40	192.168.1.10	161.117.236.80	TCP	54	Ether / IP / TCP 192.168.1.10:10681 > 161.117.236.80:20395 A
129	2020-03-17 22:32:40	192.168.1.10	161.117.236.80	TCP	54	Ether / IP / TCP 192.168.1.10:10681 > 161.117.236.80:20395 FA
130	2020-03-17 22:32:40	161.117.236.80	192.168.1.10	TCP	60	Ether / IP / TCP 161.117.236.80:20395 > 192.168.1.10:10681 A / Padding
131	2020-03-17 22:32:41	192.168.1.10	10.10.20.110	UDP	120	Ether / IP / UDP 192.168.1.10:59684 > 10.10.20.110:snmp / SNMP
132	2020-03-17 22:32:41	00:e0:4c:68:00:2d	9c:d2:4b:38:91:c1	ARP	42	Ether / ARP who has 192.168.1.1 says 192.168.1.10
133	2020-03-17 22:32:41	fe80::f141:b4f2:11de:b126	fe80::1	ICMPv6	86	Ether / IPv6 / ICMPv6ND_NS / ICMPv6 Neighbor Discovery Option - Source Link-Layer Address 00:e0:4c:68:00:2d
134	2020-03-17 22:32:41	9c:d2:4b:38:91:c1	00:e0:4c:68:00:2d	ARP	60	Ether / ARP is at 9c:d2:4b:38:91:c1 says 192.168.1.1 / Padding
135	2020-03-17 22:32:41	fe80::1	fe80::f141:b4f2:11de:b126	ICMPv6	78	Ether / IPv6 / ICMPv6 Neighbor Discovery - Neighbor Advertisement (tgt: fe80::1)
136	2020-03-17 22:32:41	fe80::1	240e:d4:2e8e:df00:4882:f650:cbf9:db1d	ICMPv6	86	Ether / IPv6 / ICMPv6ND_NS / ICMPv6 Neighbor Discovery Option - Source Link-Layer Address 9c:d2:4b:38:91:c1
137	2020-03-17 22:32:41	240e:d4:2e8e:df00:4882:f650:cbf9:db1d	fe80::1	ICMPv6	86	Ether / IPv6 / ICMPv6ND_NA / ICMPv6 Neighbor Discovery Option - Destination Link-Layer Address 00:e0:4c:68:00:2d
138	2020-03-17 22:32:42	192.168.1.10	130.198.91.107	Https	78	Ether / IP / TCP 192.168.1.10:10273 > 130.198.91.107:https PA / Raw
139	2020-03-17 22:32:42	130.198.91.107	192.168.1.10	Https	78	Ether / IP / TCP 130.198.91.107:https > 192.168.1.10:10273 PA / Raw
140	2020-03-17 22:32:42	192.168.1.10	130.198.91.107	Https	54	Ether / IP / TCP 192.168.1.10:10273 > 130.198.91.107:https A
141	2020-03-17 22:32:42	fe80::f141:b4f2:11de:b126	fe80::1	DNS	102	Ether / IPv6 / UDP / DNS Qry "b'analytics.yinxiang.com.'" 
142	2020-03-17 22:32:42	fe80::1	fe80::f141:b4f2:11de:b126	DNS	175	Ether / IPv6 / UDP / DNS Ans 
143	2020-03-17 22:32:42	192.168.1.10	154.8.190.35	Https	66	Ether / IP / TCP 192.168.1.10:10822 > 154.8.190.35:https S
144	2020-03-17 22:32:42	154.8.190.35	192.168.1.10	Https	66	Ether / IP / TCP 154.8.190.35:https > 192.168.1.10:10822 SA
145	2020-03-17 22:32:42	192.168.1.10	154.8.190.35	Https	54	Ether / IP / TCP 192.168.1.10:10822 > 154.8.190.35:https A
146	2020-03-17 22:32:42	192.168.1.10	154.8.190.35	Https	237	Ether / IP / TCP 192.168.1.10:10822 > 154.8.190.35:https PA / Raw
147	2020-03-17 22:32:42	154.8.190.35	192.168.1.10	Https	60	Ether / IP / TCP 154.8.190.35:https > 192.168.1.10:10822 A / Padding
148	2020-03-17 22:32:42	154.8.190.35	192.168.1.10	Https	1486	Ether / IP / TCP 154.8.190.35:https > 192.168.1.10:10822 A / Raw
149	2020-03-17 22:32:42	154.8.190.35	192.168.1.10	Https	1486	Ether / IP / TCP 154.8.190.35:https > 192.168.1.10:10822 A / Raw
150	2020-03-17 22:32:42	154.8.190.35	192.168.1.10	Https	744	Ether / IP / TCP 154.8.190.35:https > 192.168.1.10:10822 PA / Raw
151	2020-03-17 22:32:42	192.168.1.10	154.8.190.35	Https	54	Ether / IP / TCP 192.168.1.10:10822 > 154.8.190.35:https A
152	2020-03-17 22:32:42	192.168.1.10	154.8.190.35	Https	180	Ether / IP / TCP 192.168.1.10:10822 > 154.8.190.35:https PA / Raw
153	2020-03-17 22:32:42	154.8.190.35	192.168.1.10	Https	328	Ether / IP / TCP 154.8.190.35:https > 192.168.1.10:10822 PA / Raw
154	2020-03-17 22:32:42	192.168.1.10	154.8.190.35	Https	303	Ether / IP / TCP 192.168.1.10:10822 > 154.8.190.35:https PA / Raw
155	2020-03-17 22:32:42	154.8.190.35	192.168.1.10	Https	352	Ether / IP / TCP 154.8.190.35:https > 192.168.1.10:10822 PA / Raw
156	2020-03-17 22:32:42	154.8.190.35	192.168.1.10	Https	88	Ether / IP / TCP 154.8.190.35:https > 192.168.1.10:10822 PA / Raw
157	2020-03-17 22:32:42	192.168.1.10	154.8.190.35	Https	54	Ether / IP / TCP 192.168.1.10:10822 > 154.8.190.35:https A
158	2020-03-17 22:32:42	192.168.1.10	154.8.190.35	Https	54	Ether / IP / TCP 192.168.1.10:10822 > 154.8.190.35:https FA
159	2020-03-17 22:32:42	154.8.190.35	192.168.1.10	Https	60	Ether / IP / TCP 154.8.190.35:https > 192.168.1.10:10822 FA / Padding
160	2020-03-17 22:32:42	192.168.1.10	154.8.190.35	Https	54	Ether / IP / TCP 192.168.1.10:10822 > 154.8.190.35:https A
161	2020-03-17 22:32:45	192.168.1.10	14.215.177.39	Https	54	Ether / IP / TCP 192.168.1.10:10820 > 14.215.177.39:https RA
162	2020-03-17 22:32:45	192.168.1.10	14.215.177.39	Https	54	Ether / IP / TCP 192.168.1.10:10821 > 14.215.177.39:https FA
163	2020-03-17 22:32:46	192.168.1.10	14.215.177.39	Https	66	Ether / IP / TCP 192.168.1.10:10823 > 14.215.177.39:https S
164	2020-03-17 22:32:46	14.215.177.39	192.168.1.10	Https	66	Ether / IP / TCP 14.215.177.39:https > 192.168.1.10:10823 SA
165	2020-03-17 22:32:46	192.168.1.10	14.215.177.39	Https	54	Ether / IP / TCP 192.168.1.10:10823 > 14.215.177.39:https A
166	2020-03-17 22:32:46	192.168.1.10	14.215.177.39	Https	54	Ether / IP / TCP 192.168.1.10:10823 > 14.215.177.39:https FA
167	2020-03-17 22:32:46	192.168.1.10	14.215.177.39	Https	54	Ether / IP / TCP 192.168.1.10:10823 > 14.215.177.39:https FA
168	2020-03-17 22:32:46	fe80::1	fe80::f141:b4f2:11de:b126	ICMPv6	86	Ether / IPv6 / ICMPv6ND_NS / ICMPv6 Neighbor Discovery Option - Source Link-Layer Address 9c:d2:4b:38:91:c1
169	2020-03-17 22:32:46	fe80::f141:b4f2:11de:b126	fe80::1	ICMPv6	86	Ether / IPv6 / ICMPv6ND_NA / ICMPv6 Neighbor Discovery Option - Destination Link-Layer Address 00:e0:4c:68:00:2d
170	2020-03-17 22:32:47	192.168.1.10	14.215.177.39	Https	54	Ether / IP / TCP 192.168.1.10:10823 > 14.215.177.39:https FA
171	2020-03-17 22:32:47	192.168.1.10	130.198.91.107	Https	78	Ether / IP / TCP 192.168.1.10:10273 > 130.198.91.107:https PA / Raw
172	2020-03-17 22:32:47	192.168.1.10	130.198.91.107	Https	78	Ether / IP / TCP 192.168.1.10:10273 > 130.198.91.107:https PA / Raw
173	2020-03-17 22:32:47	139.99.69.89	192.168.1.10	Http	60	Ether / IP / TCP 139.99.69.89:http > 192.168.1.10:12360 A / Padding
174	2020-03-17 22:32:47	192.168.1.10	139.99.69.89	Http	54	Ether / IP / TCP 192.168.1.10:12360 > 139.99.69.89:http A
175	2020-03-17 22:32:48	192.168.1.10	130.198.91.107	Https	78	Ether / IP / TCP 192.168.1.10:10273 > 130.198.91.107:https PA / Raw
176	2020-03-17 22:32:48	192.168.1.10	14.215.177.39	Https	54	Ether / IP / TCP 192.168.1.10:10823 > 14.215.177.39:https FA
177	2020-03-17 22:32:48	192.168.1.10	130.198.91.107	Https	78	Ether / IP / TCP 192.168.1.10:10273 > 130.198.91.107:https PA / Raw
178	2020-03-17 22:32:49	130.198.91.107	192.168.1.10	Https	66	Ether / IP / TCP 130.198.91.107:https > 192.168.1.10:10273 A
