1	2020-03-18 00:35:39	192.168.1.10	239.255.255.250	UDP	694	Ether / IP / UDP 192.168.1.10:60067 > 239.255.255.250:ws_discovery / Raw
2	2020-03-18 00:35:39	192.168.1.10	180.163.32.152	UDP	436	Ether / IP / UDP 192.168.1.10:54843 > 180.163.32.152:8000 / Raw
3	2020-03-18 00:35:40	192.168.1.10	223.252.199.69	TCP	55	Ether / IP / TCP 192.168.1.10:13025 > 223.252.199.69:6003 A / Raw
4	2020-03-18 00:35:40	192.168.1.10	172.217.27.142	Https	66	Ether / IP / TCP 192.168.1.10:2574 > 172.217.27.142:https S
5	2020-03-18 00:35:40	223.252.199.69	192.168.1.10	TCP	66	Ether / IP / TCP 223.252.199.69:6003 > 192.168.1.10:13025 A
6	2020-03-18 00:35:40	192.168.1.10	58.87.82.241	Https	54	Ether / IP / TCP 192.168.1.10:4891 > 58.87.82.241:https FA
7	2020-03-18 00:35:40	192.168.1.10	14.215.177.39	Https	54	Ether / IP / TCP 192.168.1.10:2569 > 14.215.177.39:https FA
8	2020-03-18 00:35:40	240e:d4:2e8e:df00:4882:f650:cbf9:db1d	2404:6800:4008:803::200e	Https	86	Ether / IPv6 / TCP 240e:d4:2e8e:df00:4882:f650:cbf9:db1d:2573 > 2404:6800:4008:803::200e:https S
9	2020-03-18 00:35:41	192.168.1.10	180.163.32.152	UDP	436	Ether / IP / UDP 192.168.1.10:54843 > 180.163.32.152:8000 / Raw
10	2020-03-18 00:35:41	192.168.1.10	172.217.27.142	Https	66	Ether / IP / TCP 192.168.1.10:2574 > 172.217.27.142:https S
11	2020-03-18 00:35:41	fe80::f141:b4f2:11de:b126	ff02::c	UDP	714	Ether / IPv6 / UDP fe80::f141:b4f2:11de:b126:60068 > ff02::c:ws_discovery / Raw
12	2020-03-18 00:35:41	192.168.1.10	239.255.255.250	UDP	694	Ether / IP / UDP 192.168.1.10:60067 > 239.255.255.250:ws_discovery / Raw
13	2020-03-18 00:35:42	240e:d4:2e8e:df00:4882:f650:cbf9:db1d	2404:6800:4008:803::200e	Https	86	Ether / IPv6 / TCP 240e:d4:2e8e:df00:4882:f650:cbf9:db1d:2573 > 2404:6800:4008:803::200e:https S
14	2020-03-18 00:35:42	192.168.1.10	58.87.82.241	Https	54	Ether / IP / TCP 192.168.1.10:4891 > 58.87.82.241:https FA
15	2020-03-18 00:35:43	192.168.1.10	172.217.27.142	Https	66	Ether / IP / TCP 192.168.1.10:2574 > 172.217.27.142:https S
16	2020-03-18 00:35:43	192.168.1.10	92.223.85.103	Http	55	Ether / IP / TCP 192.168.1.10:14585 > 92.223.85.103:http A / HTTP / Raw
17	2020-03-18 00:35:43	92.223.85.103	192.168.1.10	Http	66	Ether / IP / TCP 92.223.85.103:http > 192.168.1.10:14585 A
18	2020-03-18 00:35:43	fe80::f141:b4f2:11de:b126	fe80::1	DNS	102	Ether / IPv6 / UDP / DNS Qry "b'analytics.yinxiang.com.'" 
19	2020-03-18 00:35:43	fe80::1	fe80::f141:b4f2:11de:b126	DNS	175	Ether / IPv6 / UDP / DNS Ans 
20	2020-03-18 00:35:43	192.168.1.10	154.8.190.35	Https	66	Ether / IP / TCP 192.168.1.10:2575 > 154.8.190.35:https S
21	2020-03-18 00:35:43	154.8.190.35	192.168.1.10	Https	66	Ether / IP / TCP 154.8.190.35:https > 192.168.1.10:2575 SA
22	2020-03-18 00:35:43	192.168.1.10	154.8.190.35	Https	54	Ether / IP / TCP 192.168.1.10:2575 > 154.8.190.35:https A
23	2020-03-18 00:35:43	192.168.1.10	154.8.190.35	Https	237	Ether / IP / TCP 192.168.1.10:2575 > 154.8.190.35:https PA / Raw
24	2020-03-18 00:35:43	154.8.190.35	192.168.1.10	Https	60	Ether / IP / TCP 154.8.190.35:https > 192.168.1.10:2575 A / Padding
25	2020-03-18 00:35:43	154.8.190.35	192.168.1.10	Https	1486	Ether / IP / TCP 154.8.190.35:https > 192.168.1.10:2575 A / Raw
26	2020-03-18 00:35:43	154.8.190.35	192.168.1.10	Https	1486	Ether / IP / TCP 154.8.190.35:https > 192.168.1.10:2575 A / Raw
27	2020-03-18 00:35:43	154.8.190.35	192.168.1.10	Https	744	Ether / IP / TCP 154.8.190.35:https > 192.168.1.10:2575 PA / Raw
28	2020-03-18 00:35:43	192.168.1.10	154.8.190.35	Https	54	Ether / IP / TCP 192.168.1.10:2575 > 154.8.190.35:https A
29	2020-03-18 00:35:43	192.168.1.10	154.8.190.35	Https	180	Ether / IP / TCP 192.168.1.10:2575 > 154.8.190.35:https PA / Raw
30	2020-03-18 00:35:43	154.8.190.35	192.168.1.10	Https	328	Ether / IP / TCP 154.8.190.35:https > 192.168.1.10:2575 PA / Raw
31	2020-03-18 00:35:43	192.168.1.10	154.8.190.35	Https	303	Ether / IP / TCP 192.168.1.10:2575 > 154.8.190.35:https PA / Raw
32	2020-03-18 00:35:43	154.8.190.35	192.168.1.10	Https	352	Ether / IP / TCP 154.8.190.35:https > 192.168.1.10:2575 PA / Raw
33	2020-03-18 00:35:43	154.8.190.35	192.168.1.10	Https	88	Ether / IP / TCP 154.8.190.35:https > 192.168.1.10:2575 PA / Raw
34	2020-03-18 00:35:43	192.168.1.10	154.8.190.35	Https	54	Ether / IP / TCP 192.168.1.10:2575 > 154.8.190.35:https A
35	2020-03-18 00:35:43	192.168.1.10	154.8.190.35	Https	54	Ether / IP / TCP 192.168.1.10:2575 > 154.8.190.35:https FA
36	2020-03-18 00:35:43	154.8.190.35	192.168.1.10	Https	60	Ether / IP / TCP 154.8.190.35:https > 192.168.1.10:2575 FA / Padding
37	2020-03-18 00:35:43	192.168.1.10	154.8.190.35	Https	54	Ether / IP / TCP 192.168.1.10:2575 > 154.8.190.35:https A
38	2020-03-18 00:35:45	192.168.1.10	14.215.177.39	Https	54	Ether / IP / TCP 192.168.1.10:2559 > 14.215.177.39:https RA
39	2020-03-18 00:35:45	fe80::1	fe80::f141:b4f2:11de:b126	ICMPv6	86	Ether / IPv6 / ICMPv6ND_NS / ICMPv6 Neighbor Discovery Option - Source Link-Layer Address 9c:d2:4b:38:91:c1
40	2020-03-18 00:35:45	fe80::f141:b4f2:11de:b126	fe80::1	ICMPv6	86	Ether / IPv6 / ICMPv6ND_NA / ICMPv6 Neighbor Discovery Option - Destination Link-Layer Address 00:e0:4c:68:00:2d
41	2020-03-18 00:35:45	fe80::f141:b4f2:11de:b126	ff02::c	UDP	718	Ether / IPv6 / UDP fe80::f141:b4f2:11de:b126:60068 > ff02::c:ws_discovery / Raw
42	2020-03-18 00:35:45	192.168.1.10	239.255.255.250	UDP	698	Ether / IP / UDP 192.168.1.10:60067 > 239.255.255.250:ws_discovery / Raw
43	2020-03-18 00:35:45	fe80::f141:b4f2:11de:b126	ff02::c	UDP	718	Ether / IPv6 / UDP fe80::f141:b4f2:11de:b126:60068 > ff02::c:ws_discovery / Raw
44	2020-03-18 00:35:45	192.168.1.10	239.255.255.250	UDP	698	Ether / IP / UDP 192.168.1.10:60067 > 239.255.255.250:ws_discovery / Raw
45	2020-03-18 00:35:45	192.168.1.10	14.215.177.39	Https	54	Ether / IP / TCP 192.168.1.10:2569 > 14.215.177.39:https FA
46	2020-03-18 00:35:45	fe80::f141:b4f2:11de:b126	ff02::c	UDP	718	Ether / IPv6 / UDP fe80::f141:b4f2:11de:b126:60068 > ff02::c:ws_discovery / Raw
47	2020-03-18 00:35:45	fe80::f141:b4f2:11de:b126	ff02::c	UDP	718	Ether / IPv6 / UDP fe80::f141:b4f2:11de:b126:60068 > ff02::c:ws_discovery / Raw
48	2020-03-18 00:35:45	192.168.1.10	239.255.255.250	UDP	698	Ether / IP / UDP 192.168.1.10:60067 > 239.255.255.250:ws_discovery / Raw
49	2020-03-18 00:35:45	192.168.1.10	239.255.255.250	UDP	698	Ether / IP / UDP 192.168.1.10:60067 > 239.255.255.250:ws_discovery / Raw
50	2020-03-18 00:35:45	fe80::f141:b4f2:11de:b126	ff02::c	UDP	718	Ether / IPv6 / UDP fe80::f141:b4f2:11de:b126:60068 > ff02::c:ws_discovery / Raw
51	2020-03-18 00:35:45	fe80::f141:b4f2:11de:b126	ff02::c	UDP	718	Ether / IPv6 / UDP fe80::f141:b4f2:11de:b126:60068 > ff02::c:ws_discovery / Raw
52	2020-03-18 00:35:45	fe80::f141:b4f2:11de:b126	fe80::1	DNS	95	Ether / IPv6 / UDP / DNS Qry "b'tbmsg.baidu.com.'" 
53	2020-03-18 00:35:45	fe80::1	fe80::f141:b4f2:11de:b126	DNS	138	Ether / IPv6 / UDP / DNS Ans 
54	2020-03-18 00:35:45	192.168.1.10	220.181.33.250	Https	66	Ether / IP / TCP 192.168.1.10:2576 > 220.181.33.250:https S
55	2020-03-18 00:35:46	192.168.1.10	239.255.255.250	UDP	698	Ether / IP / UDP 192.168.1.10:60067 > 239.255.255.250:ws_discovery / Raw
56	2020-03-18 00:35:46	220.181.33.250	192.168.1.10	Https	66	Ether / IP / TCP 220.181.33.250:https > 192.168.1.10:2576 SA
57	2020-03-18 00:35:46	192.168.1.10	220.181.33.250	Https	54	Ether / IP / TCP 192.168.1.10:2576 > 220.181.33.250:https A
58	2020-03-18 00:35:46	192.168.1.10	220.181.33.250	Https	571	Ether / IP / TCP 192.168.1.10:2576 > 220.181.33.250:https PA / Raw
59	2020-03-18 00:35:46	192.168.1.10	239.255.255.250	UDP	698	Ether / IP / UDP 192.168.1.10:60067 > 239.255.255.250:ws_discovery / Raw
60	2020-03-18 00:35:46	220.181.33.250	192.168.1.10	Https	60	Ether / IP / TCP 220.181.33.250:https > 192.168.1.10:2576 A / Padding
61	2020-03-18 00:35:46	220.181.33.250	192.168.1.10	Https	150	Ether / IP / TCP 220.181.33.250:https > 192.168.1.10:2576 PA / Raw
62	2020-03-18 00:35:46	220.181.33.250	192.168.1.10	Https	60	Ether / IP / TCP 220.181.33.250:https > 192.168.1.10:2576 PA / Raw
63	2020-03-18 00:35:46	220.181.33.250	192.168.1.10	Https	99	Ether / IP / TCP 220.181.33.250:https > 192.168.1.10:2576 PA / Raw
64	2020-03-18 00:35:46	192.168.1.10	220.181.33.250	Https	54	Ether / IP / TCP 192.168.1.10:2576 > 220.181.33.250:https A
65	2020-03-18 00:35:46	192.168.1.10	220.181.33.250	Https	105	Ether / IP / TCP 192.168.1.10:2576 > 220.181.33.250:https PA / Raw
66	2020-03-18 00:35:46	192.168.1.10	220.181.33.250	Https	1027	Ether / IP / TCP 192.168.1.10:2576 > 220.181.33.250:https PA / Raw
67	2020-03-18 00:35:46	220.181.33.250	192.168.1.10	Https	99	Ether / IP / TCP 220.181.33.250:https > 192.168.1.10:2576 PA / Raw
68	2020-03-18 00:35:46	192.168.1.10	220.181.33.250	Https	66	Ether / IP / TCP 192.168.1.10:2576 > 220.181.33.250:https A
69	2020-03-18 00:35:46	220.181.33.250	192.168.1.10	Https	60	Ether / IP / TCP 220.181.33.250:https > 192.168.1.10:2576 A / Padding
70	2020-03-18 00:35:46	220.181.33.250	192.168.1.10	Https	60	Ether / IP / TCP 220.181.33.250:https > 192.168.1.10:2576 A / Padding
71	2020-03-18 00:35:46	192.168.1.10	14.215.177.39	Https	66	Ether / IP / TCP 192.168.1.10:2577 > 14.215.177.39:https S
72	2020-03-18 00:35:46	14.215.177.39	192.168.1.10	Https	66	Ether / IP / TCP 14.215.177.39:https > 192.168.1.10:2577 SA
73	2020-03-18 00:35:46	192.168.1.10	14.215.177.39	Https	54	Ether / IP / TCP 192.168.1.10:2577 > 14.215.177.39:https A
74	2020-03-18 00:35:46	192.168.1.10	14.215.177.39	Https	54	Ether / IP / TCP 192.168.1.10:2577 > 14.215.177.39:https FA
75	2020-03-18 00:35:46	220.181.33.250	192.168.1.10	Https	367	Ether / IP / TCP 220.181.33.250:https > 192.168.1.10:2576 PA / Raw
76	2020-03-18 00:35:46	192.168.1.10	220.181.33.250	Https	54	Ether / IP / TCP 192.168.1.10:2576 > 220.181.33.250:https A
77	2020-03-18 00:35:46	fe80::f141:b4f2:11de:b126	ff02::c	UDP	718	Ether / IPv6 / UDP fe80::f141:b4f2:11de:b126:60068 > ff02::c:ws_discovery / Raw
78	2020-03-18 00:35:46	192.168.1.10	14.215.177.39	Https	54	Ether / IP / TCP 192.168.1.10:2577 > 14.215.177.39:https FA
79	2020-03-18 00:35:46	fe80::f141:b4f2:11de:b126	ff02::c	UDP	718	Ether / IPv6 / UDP fe80::f141:b4f2:11de:b126:60068 > ff02::c:ws_discovery / Raw
80	2020-03-18 00:35:46	180.163.21.35	192.168.1.10	Http	60	Ether / IP / TCP 180.163.21.35:http > 192.168.1.10:13664 A / Padding
81	2020-03-18 00:35:46	192.168.1.10	180.163.21.35	Http	54	Ether / IP / TCP 192.168.1.10:13664 > 180.163.21.35:http A
82	2020-03-18 00:35:46	240e:d4:2e8e:df00:4882:f650:cbf9:db1d	2404:6800:4008:803::200e	Https	86	Ether / IPv6 / TCP 240e:d4:2e8e:df00:4882:f650:cbf9:db1d:2573 > 2404:6800:4008:803::200e:https S
83	2020-03-18 00:35:46	192.168.1.10	172.217.24.14	Https	66	Ether / IP / TCP 192.168.1.10:2561 > 172.217.24.14:https S
84	2020-03-18 00:35:46	192.168.1.10	239.255.255.250	UDP	698	Ether / IP / UDP 192.168.1.10:60067 > 239.255.255.250:ws_discovery / Raw
85	2020-03-18 00:35:46	192.168.1.10	172.217.27.142	Https	66	Ether / IP / TCP 192.168.1.10:2562 > 172.217.27.142:https S
86	2020-03-18 00:35:47	192.168.1.10	172.217.27.142	Https	66	Ether / IP / TCP 192.168.1.10:2574 > 172.217.27.142:https S
87	2020-03-18 00:35:47	192.168.1.10	239.255.255.250	UDP	698	Ether / IP / UDP 192.168.1.10:60067 > 239.255.255.250:ws_discovery / Raw
88	2020-03-18 00:35:47	192.168.1.10	216.58.200.238	Https	66	Ether / IP / TCP 192.168.1.10:2563 > 216.58.200.238:https S
89	2020-03-18 00:35:47	192.168.1.10	14.215.177.39	Https	54	Ether / IP / TCP 192.168.1.10:2577 > 14.215.177.39:https FA
90	2020-03-18 00:35:47	192.168.1.10	172.217.24.14	Https	66	Ether / IP / TCP 192.168.1.10:2564 > 172.217.24.14:https S
91	2020-03-18 00:35:47	240e:d4:2e8e:df00:4882:f650:cbf9:db1d	2404:6800:4008:802::200e	Https	86	Ether / IPv6 / TCP 240e:d4:2e8e:df00:4882:f650:cbf9:db1d:2565 > 2404:6800:4008:802::200e:https S
92	2020-03-18 00:35:47	240e:d4:2e8e:df00:4882:f650:cbf9:db1d	2404:6800:4008:803::200e	Https	86	Ether / IPv6 / TCP 240e:d4:2e8e:df00:4882:f650:cbf9:db1d:2566 > 2404:6800:4008:803::200e:https S
93	2020-03-18 00:35:47	192.168.1.10	216.58.200.238	Https	66	Ether / IP / TCP 192.168.1.10:2567 > 216.58.200.238:https S
94	2020-03-18 00:35:47	fe80::f141:b4f2:11de:b126	fe80::1	ICMPv6	86	Ether / IPv6 / ICMPv6ND_NS / ICMPv6 Neighbor Discovery Option - Source Link-Layer Address 00:e0:4c:68:00:2d
95	2020-03-18 00:35:47	fe80::1	fe80::f141:b4f2:11de:b126	ICMPv6	78	Ether / IPv6 / ICMPv6 Neighbor Discovery - Neighbor Advertisement (tgt: fe80::1)
96	2020-03-18 00:35:47	fe80::f141:b4f2:11de:b126	ff02::c	UDP	718	Ether / IPv6 / UDP fe80::f141:b4f2:11de:b126:60068 > ff02::c:ws_discovery / Raw
97	2020-03-18 00:35:47	240e:d4:2e8e:df00:4882:f650:cbf9:db1d	2404:6800:4008:802::200e	Https	86	Ether / IPv6 / TCP 240e:d4:2e8e:df00:4882:f650:cbf9:db1d:2568 > 2404:6800:4008:802::200e:https S
98	2020-03-18 00:35:47	192.168.1.10	58.87.82.241	Https	54	Ether / IP / TCP 192.168.1.10:4891 > 58.87.82.241:https FA
99	2020-03-18 00:35:47	fe80::f141:b4f2:11de:b126	fe80::1	DNS	94	Ether / IPv6 / UDP / DNS Qry "b'www.google.com.'" 
100	2020-03-18 00:35:47	fe80::f141:b4f2:11de:b126	fe80::1	DNS	94	Ether / IPv6 / UDP / DNS Qry "b'www.google.com.'" 
101	2020-03-18 00:35:47	fe80::1	fe80::f141:b4f2:11de:b126	DNS	358	Ether / IPv6 / UDP / DNS Ans "199.59.148.140" 
102	2020-03-18 00:35:47	fe80::1	fe80::f141:b4f2:11de:b126	DNS	370	Ether / IPv6 / UDP / DNS Ans "2400:cb00:2048:1::6814:224e" 
103	2020-03-18 00:35:47	240e:d4:2e8e:df00:4882:f650:cbf9:db1d	2400:cb00:2048:1::6814:224e	Https	86	Ether / IPv6 / TCP 240e:d4:2e8e:df00:4882:f650:cbf9:db1d:2578 > 2400:cb00:2048:1::6814:224e:https S
104	2020-03-18 00:35:47	fe80::f141:b4f2:11de:b126	ff02::c	UDP	718	Ether / IPv6 / UDP fe80::f141:b4f2:11de:b126:60068 > ff02::c:ws_discovery / Raw
105	2020-03-18 00:35:48	240e:d4:2e8e:df00:4882:f650:cbf9:db1d	2400:cb00:2048:1::6814:224e	Https	86	Ether / IPv6 / TCP 240e:d4:2e8e:df00:4882:f650:cbf9:db1d:2579 > 2400:cb00:2048:1::6814:224e:https S
106	2020-03-18 00:35:48	240e:d4:2e8e:df00:4882:f650:cbf9:db1d	2400:cb00:2048:1::6814:224e	Https	86	Ether / IPv6 / TCP 240e:d4:2e8e:df00:4882:f650:cbf9:db1d:2580 > 2400:cb00:2048:1::6814:224e:https S
107	2020-03-18 00:35:48	192.168.1.10	199.59.148.140	Https	66	Ether / IP / TCP 192.168.1.10:2581 > 199.59.148.140:https S
108	2020-03-18 00:35:48	192.168.1.10	14.215.177.39	Https	54	Ether / IP / TCP 192.168.1.10:2577 > 14.215.177.39:https FA
109	2020-03-18 00:35:48	18:d2:76:f3:58:0b	ff:ff:ff:ff:ff:ff	ARP	60	Ether / ARP who has 192.168.1.1 says 192.168.1.3 / Padding
110	2020-03-18 00:35:48	192.168.1.10	199.59.148.140	Https	66	Ether / IP / TCP 192.168.1.10:2582 > 199.59.148.140:https S
111	2020-03-18 00:35:48	192.168.1.10	199.59.148.140	Https	66	Ether / IP / TCP 192.168.1.10:2583 > 199.59.148.140:https S
112	2020-03-18 00:35:48	192.168.1.10	183.57.48.55	Http	66	Ether / IP / TCP 192.168.1.10:2584 > 183.57.48.55:http S
113	2020-03-18 00:35:48	183.57.48.55	192.168.1.10	Http	66	Ether / IP / TCP 183.57.48.55:http > 192.168.1.10:2584 SA
114	2020-03-18 00:35:48	192.168.1.10	183.57.48.55	Http	54	Ether / IP / TCP 192.168.1.10:2584 > 183.57.48.55:http A
115	2020-03-18 00:35:48	240e:d4:2e8e:df00:4882:f650:cbf9:db1d	2400:cb00:2048:1::6814:224e	Https	86	Ether / IPv6 / TCP 240e:d4:2e8e:df00:4882:f650:cbf9:db1d:2585 > 2400:cb00:2048:1::6814:224e:https S
116	2020-03-18 00:35:48	192.168.1.10	183.57.48.55	Http	1217	Ether / IP / TCP / HTTP / 'POST' '/q.cgi' 'HTTP/1.1' / Raw
117	2020-03-18 00:35:48	183.57.48.55	192.168.1.10	Http	60	Ether / IP / TCP 183.57.48.55:http > 192.168.1.10:2584 A / Padding
118	2020-03-18 00:35:48	183.57.48.55	192.168.1.10	Http	408	Ether / IP / TCP / HTTP / 'HTTP/1.1' '200' 'OK' / Raw
119	2020-03-18 00:35:48	192.168.1.10	183.57.48.55	Http	54	Ether / IP / TCP 192.168.1.10:2584 > 183.57.48.55:http FA
120	2020-03-18 00:35:48	192.168.1.10	239.255.255.250	UDP	698	Ether / IP / UDP 192.168.1.10:60067 > 239.255.255.250:ws_discovery / Raw
121	2020-03-18 00:35:48	183.57.48.55	192.168.1.10	Http	60	Ether / IP / TCP 183.57.48.55:http > 192.168.1.10:2584 FA / Padding
122	2020-03-18 00:35:48	192.168.1.10	183.57.48.55	Http	54	Ether / IP / TCP 192.168.1.10:2584 > 183.57.48.55:http A
123	2020-03-18 00:35:48	240e:d4:2e8e:df00:4882:f650:cbf9:db1d	2400:cb00:2048:1::6814:224e	Https	86	Ether / IPv6 / TCP 240e:d4:2e8e:df00:4882:f650:cbf9:db1d:2578 > 2400:cb00:2048:1::6814:224e:https S
124	2020-03-18 00:35:48	192.168.1.10	199.59.148.140	Https	66	Ether / IP / TCP 192.168.1.10:2586 > 199.59.148.140:https S
125	2020-03-18 00:35:48	192.168.1.10	239.255.255.250	UDP	698	Ether / IP / UDP 192.168.1.10:60067 > 239.255.255.250:ws_discovery / Raw
126	2020-03-18 00:35:49	240e:d4:2e8e:df00:4882:f650:cbf9:db1d	2400:cb00:2048:1::6814:224e	Https	86	Ether / IPv6 / TCP 240e:d4:2e8e:df00:4882:f650:cbf9:db1d:2579 > 2400:cb00:2048:1::6814:224e:https S
127	2020-03-18 00:35:49	240e:d4:2e8e:df00:4882:f650:cbf9:db1d	2400:cb00:2048:1::6814:224e	Https	86	Ether / IPv6 / TCP 240e:d4:2e8e:df00:4882:f650:cbf9:db1d:2580 > 2400:cb00:2048:1::6814:224e:https S
128	2020-03-18 00:35:49	192.168.1.10	199.59.148.140	Https	66	Ether / IP / TCP 192.168.1.10:2581 > 199.59.148.140:https S
129	2020-03-18 00:35:49	192.168.1.10	199.59.148.140	Https	66	Ether / IP / TCP 192.168.1.10:2582 > 199.59.148.140:https S
130	2020-03-18 00:35:49	192.168.1.10	54.223.180.103	Http	54	Ether / IP / TCP 192.168.1.10:2485 > 54.223.180.103:http FA
131	2020-03-18 00:35:49	192.168.1.10	54.223.180.103	Http	66	Ether / IP / TCP 192.168.1.10:2587 > 54.223.180.103:http S
132	2020-03-18 00:35:49	192.168.1.10	199.59.148.140	Https	66	Ether / IP / TCP 192.168.1.10:2583 > 199.59.148.140:https S
133	2020-03-18 00:35:49	fe80::f141:b4f2:11de:b126	ff02::c	UDP	718	Ether / IPv6 / UDP fe80::f141:b4f2:11de:b126:60068 > ff02::c:ws_discovery / Raw
134	2020-03-18 00:35:49	54.223.180.103	192.168.1.10	Http	60	Ether / IP / TCP 54.223.180.103:http > 192.168.1.10:2587 SA / Padding
135	2020-03-18 00:35:49	192.168.1.10	54.223.180.103	Http	54	Ether / IP / TCP 192.168.1.10:2587 > 54.223.180.103:http A
136	2020-03-18 00:35:49	192.168.1.10	54.223.180.103	Http	426	Ether / IP / TCP / HTTP / 'GET' '/message/updateTime?tags=commontags&updateTime=d751713988987e9331980363e24189ce1544026800519&serviceVersion=1.1.2.627' 'HTTP/1.1' / Raw
137	2020-03-18 00:35:49	54.223.180.103	192.168.1.10	Http	60	Ether / IP / TCP 54.223.180.103:http > 192.168.1.10:2587 A / Padding
138	2020-03-18 00:35:49	54.223.180.103	192.168.1.10	Http	151	Ether / IP / TCP / HTTP / 'HTTP/1.1' '200' 'OK'
139	2020-03-18 00:35:49	192.168.1.10	54.223.180.103	Http	54	Ether / IP / TCP 192.168.1.10:2587 > 54.223.180.103:http A
140	2020-03-18 00:35:49	240e:d4:2e8e:df00:4882:f650:cbf9:db1d	2400:cb00:2048:1::6814:224e	Https	86	Ether / IPv6 / TCP 240e:d4:2e8e:df00:4882:f650:cbf9:db1d:2585 > 2400:cb00:2048:1::6814:224e:https S
141	2020-03-18 00:35:49	192.168.1.10	54.223.180.103	Http	54	Ether / IP / TCP 192.168.1.10:2485 > 54.223.180.103:http FA
142	2020-03-18 00:35:49	fe80::f141:b4f2:11de:b126	ff02::c	UDP	718	Ether / IPv6 / UDP fe80::f141:b4f2:11de:b126:60068 > ff02::c:ws_discovery / Raw
143	2020-03-18 00:35:49	fe80::f141:b4f2:11de:b126	fe80::1	DNS	96	Ether / IPv6 / UDP / DNS Qry "b'dns.msftncsi.com.'" 
144	2020-03-18 00:35:49	fe80::1	fe80::f141:b4f2:11de:b126	DNS	258	Ether / IPv6 / UDP / DNS Ans "fd3e:4f5a:5b81::1" 
145	2020-03-18 00:35:49	192.168.1.10	199.59.148.140	Https	66	Ether / IP / TCP 192.168.1.10:2586 > 199.59.148.140:https S
146	2020-03-18 00:35:50	192.168.1.10	54.223.180.103	Http	54	Ether / IP / TCP 192.168.1.10:2485 > 54.223.180.103:http FA
147	2020-03-18 00:35:50	fe80::f141:b4f2:11de:b126	fe80::1	DNS	96	Ether / IPv6 / UDP / DNS Qry "b'ss0.bdstatic.com.'" 
148	2020-03-18 00:35:50	fe80::f141:b4f2:11de:b126	fe80::1	DNS	96	Ether / IPv6 / UDP / DNS Qry "b'ss0.bdstatic.com.'" 
149	2020-03-18 00:35:50	fe80::1	fe80::f141:b4f2:11de:b126	DNS	384	Ether / IPv6 / UDP / DNS Ans "b'sslbdstatic.jomodns.com.'" 
150	2020-03-18 00:35:50	fe80::1	fe80::f141:b4f2:11de:b126	DNS	193	Ether / IPv6 / UDP / DNS Ans "b'sslbdstatic.jomodns.com.'" 
151	2020-03-18 00:35:50	192.168.1.10	125.77.154.32	Https	66	Ether / IP / TCP 192.168.1.10:2588 > 125.77.154.32:https S
152	2020-03-18 00:35:50	125.77.154.32	192.168.1.10	Https	66	Ether / IP / TCP 125.77.154.32:https > 192.168.1.10:2588 SA
153	2020-03-18 00:35:50	192.168.1.10	125.77.154.32	Https	54	Ether / IP / TCP 192.168.1.10:2588 > 125.77.154.32:https A
154	2020-03-18 00:35:50	192.168.1.10	125.77.154.32	Https	571	Ether / IP / TCP 192.168.1.10:2588 > 125.77.154.32:https PA / Raw
155	2020-03-18 00:35:50	125.77.154.32	192.168.1.10	Https	60	Ether / IP / TCP 125.77.154.32:https > 192.168.1.10:2588 A / Padding
156	2020-03-18 00:35:50	125.77.154.32	192.168.1.10	Https	1394	Ether / IP / TCP 125.77.154.32:https > 192.168.1.10:2588 A / Raw
157	2020-03-18 00:35:50	125.77.154.32	192.168.1.10	Https	1394	Ether / IP / TCP 125.77.154.32:https > 192.168.1.10:2588 A / Raw
158	2020-03-18 00:35:50	125.77.154.32	192.168.1.10	Https	130	Ether / IP / TCP 125.77.154.32:https > 192.168.1.10:2588 PA / Raw
159	2020-03-18 00:35:50	125.77.154.32	192.168.1.10	Https	1394	Ether / IP / TCP 125.77.154.32:https > 192.168.1.10:2588 A / Raw
160	2020-03-18 00:35:50	125.77.154.32	192.168.1.10	Https	148	Ether / IP / TCP 125.77.154.32:https > 192.168.1.10:2588 PA / Raw
161	2020-03-18 00:35:50	192.168.1.10	125.77.154.32	Https	66	Ether / IP / TCP 192.168.1.10:2588 > 125.77.154.32:https A
162	2020-03-18 00:35:50	192.168.1.10	125.77.154.32	Https	54	Ether / IP / TCP 192.168.1.10:2588 > 125.77.154.32:https A
163	2020-03-18 00:35:50	192.168.1.10	125.77.154.32	Https	54	Ether / IP / TCP 192.168.1.10:2588 > 125.77.154.32:https A
164	2020-03-18 00:35:50	192.168.1.10	125.77.154.32	Https	134	Ether / IP / TCP 192.168.1.10:2588 > 125.77.154.32:https PA / Raw
165	2020-03-18 00:35:50	192.168.1.10	125.77.154.32	Https	146	Ether / IP / TCP 192.168.1.10:2588 > 125.77.154.32:https PA / Raw
166	2020-03-18 00:35:50	192.168.1.10	125.77.154.32	Https	609	Ether / IP / TCP 192.168.1.10:2588 > 125.77.154.32:https PA / Raw
167	2020-03-18 00:35:50	192.168.1.10	14.215.177.39	Https	54	Ether / IP / TCP 192.168.1.10:2577 > 14.215.177.39:https FA
168	2020-03-18 00:35:50	125.77.154.32	192.168.1.10	Https	66	Ether / IP / TCP 125.77.154.32:https > 192.168.1.10:2588 A
169	2020-03-18 00:35:50	125.77.154.32	192.168.1.10	Https	60	Ether / IP / TCP 125.77.154.32:https > 192.168.1.10:2588 A / Padding
170	2020-03-18 00:35:50	125.77.154.32	192.168.1.10	Https	60	Ether / IP / TCP 125.77.154.32:https > 192.168.1.10:2588 A / Padding
171	2020-03-18 00:35:50	125.77.154.32	192.168.1.10	Https	341	Ether / IP / TCP 125.77.154.32:https > 192.168.1.10:2588 PA / Raw
172	2020-03-18 00:35:50	125.77.154.32	192.168.1.10	Https	341	Ether / IP / TCP 125.77.154.32:https > 192.168.1.10:2588 PA / Raw
173	2020-03-18 00:35:50	192.168.1.10	125.77.154.32	Https	54	Ether / IP / TCP 192.168.1.10:2588 > 125.77.154.32:https A
174	2020-03-18 00:35:50	125.77.154.32	192.168.1.10	Https	125	Ether / IP / TCP 125.77.154.32:https > 192.168.1.10:2588 PA / Raw
175	2020-03-18 00:35:50	192.168.1.10	125.77.154.32	Https	85	Ether / IP / TCP 192.168.1.10:2588 > 125.77.154.32:https PA / Raw
176	2020-03-18 00:35:50	125.77.154.32	192.168.1.10	Https	1394	Ether / IP / TCP 125.77.154.32:https > 192.168.1.10:2588 A / Raw
177	2020-03-18 00:35:50	125.77.154.32	192.168.1.10	Https	1394	Ether / IP / TCP 125.77.154.32:https > 192.168.1.10:2588 A / Raw
178	2020-03-18 00:35:50	125.77.154.32	192.168.1.10	Https	1394	Ether / IP / TCP 125.77.154.32:https > 192.168.1.10:2588 A / Raw
179	2020-03-18 00:35:50	192.168.1.10	125.77.154.32	Https	54	Ether / IP / TCP 192.168.1.10:2588 > 125.77.154.32:https A
180	2020-03-18 00:35:50	125.77.154.32	192.168.1.10	Https	1394	Ether / IP / TCP 125.77.154.32:https > 192.168.1.10:2588 A / Raw
181	2020-03-18 00:35:50	125.77.154.32	192.168.1.10	Https	1394	Ether / IP / TCP 125.77.154.32:https > 192.168.1.10:2588 A / Raw
182	2020-03-18 00:35:50	192.168.1.10	125.77.154.32	Https	66	Ether / IP / TCP 192.168.1.10:2588 > 125.77.154.32:https A
183	2020-03-18 00:35:50	192.168.1.10	125.77.154.32	Https	66	Ether / IP / TCP 192.168.1.10:2588 > 125.77.154.32:https A
184	2020-03-18 00:35:50	125.77.154.32	192.168.1.10	Https	1394	Ether / IP / TCP 125.77.154.32:https > 192.168.1.10:2588 A / Raw
185	2020-03-18 00:35:50	125.77.154.32	192.168.1.10	Https	1394	Ether / IP / TCP 125.77.154.32:https > 192.168.1.10:2588 A / Raw
186	2020-03-18 00:35:50	125.77.154.32	192.168.1.10	Https	1394	Ether / IP / TCP 125.77.154.32:https > 192.168.1.10:2588 A / Raw
187	2020-03-18 00:35:50	192.168.1.10	125.77.154.32	Https	54	Ether / IP / TCP 192.168.1.10:2588 > 125.77.154.32:https A
188	2020-03-18 00:35:50	192.168.1.10	125.77.154.32	Https	66	Ether / IP / TCP 192.168.1.10:2588 > 125.77.154.32:https A
189	2020-03-18 00:35:50	192.168.1.10	125.77.154.32	Https	74	Ether / IP / TCP 192.168.1.10:2588 > 125.77.154.32:https A
190	2020-03-18 00:35:50	125.77.154.32	192.168.1.10	Https	1394	Ether / IP / TCP 125.77.154.32:https > 192.168.1.10:2588 A / Raw
191	2020-03-18 00:35:50	125.77.154.32	192.168.1.10	Https	1394	Ether / IP / TCP 125.77.154.32:https > 192.168.1.10:2588 A / Raw
192	2020-03-18 00:35:50	192.168.1.10	125.77.154.32	Https	66	Ether / IP / TCP 192.168.1.10:2588 > 125.77.154.32:https A
193	2020-03-18 00:35:50	192.168.1.10	125.77.154.32	Https	54	Ether / IP / TCP 192.168.1.10:2588 > 125.77.154.32:https A
194	2020-03-18 00:35:50	125.77.154.32	192.168.1.10	Https	882	Ether / IP / TCP 125.77.154.32:https > 192.168.1.10:2588 PA / Raw
195	2020-03-18 00:35:50	192.168.1.10	125.77.154.32	Https	54	Ether / IP / TCP 192.168.1.10:2588 > 125.77.154.32:https A
196	2020-03-18 00:35:50	125.77.154.32	192.168.1.10	Https	85	Ether / IP / TCP 125.77.154.32:https > 192.168.1.10:2588 PA / Raw
197	2020-03-18 00:35:50	125.77.154.32	192.168.1.10	Https	60	Ether / IP / TCP 125.77.154.32:https > 192.168.1.10:2588 A / Padding
198	2020-03-18 00:35:50	125.77.154.32	192.168.1.10	Https	1394	Ether / IP / TCP 125.77.154.32:https > 192.168.1.10:2588 A / Raw
199	2020-03-18 00:35:50	192.168.1.10	125.77.154.32	Https	66	Ether / IP / TCP 192.168.1.10:2588 > 125.77.154.32:https A
200	2020-03-18 00:35:50	192.168.1.10	239.255.255.250	UDP	698	Ether / IP / UDP 192.168.1.10:60067 > 239.255.255.250:ws_discovery / Raw
201	2020-03-18 00:35:50	240e:d4:2e8e:df00:4882:f650:cbf9:db1d	2400:cb00:2048:1::6814:224e	Https	86	Ether / IPv6 / TCP 240e:d4:2e8e:df00:4882:f650:cbf9:db1d:2578 > 2400:cb00:2048:1::6814:224e:https S
202	2020-03-18 00:35:50	192.168.1.10	239.255.255.250	UDP	698	Ether / IP / UDP 192.168.1.10:60067 > 239.255.255.250:ws_discovery / Raw
203	2020-03-18 00:35:51	240e:d4:2e8e:df00:4882:f650:cbf9:db1d	2400:cb00:2048:1::6814:224e	Https	86	Ether / IPv6 / TCP 240e:d4:2e8e:df00:4882:f650:cbf9:db1d:2579 > 2400:cb00:2048:1::6814:224e:https S
204	2020-03-18 00:35:51	240e:d4:2e8e:df00:4882:f650:cbf9:db1d	2400:cb00:2048:1::6814:224e	Https	86	Ether / IPv6 / TCP 240e:d4:2e8e:df00:4882:f650:cbf9:db1d:2580 > 2400:cb00:2048:1::6814:224e:https S
205	2020-03-18 00:35:51	192.168.1.10	199.59.148.140	Https	66	Ether / IP / TCP 192.168.1.10:2581 > 199.59.148.140:https S
206	2020-03-18 00:35:51	192.168.1.10	199.59.148.140	Https	66	Ether / IP / TCP 192.168.1.10:2582 > 199.59.148.140:https S
207	2020-03-18 00:35:51	192.168.1.10	199.59.148.140	Https	66	Ether / IP / TCP 192.168.1.10:2583 > 199.59.148.140:https S
208	2020-03-18 00:35:51	fe80::f141:b4f2:11de:b126	ff02::c	UDP	718	Ether / IPv6 / UDP fe80::f141:b4f2:11de:b126:60068 > ff02::c:ws_discovery / Raw
209	2020-03-18 00:35:51	192.168.1.10	54.223.180.103	Http	54	Ether / IP / TCP 192.168.1.10:2485 > 54.223.180.103:http FA
210	2020-03-18 00:35:51	fe80::f141:b4f2:11de:b126	fe80::1	DNS	93	Ether / IPv6 / UDP / DNS Qry "b'sp0.baidu.com.'" 
211	2020-03-18 00:35:51	fe80::f141:b4f2:11de:b126	fe80::1	DNS	93	Ether / IPv6 / UDP / DNS Qry "b'sp0.baidu.com.'" 
212	2020-03-18 00:35:51	fe80::1	fe80::f141:b4f2:11de:b126	DNS	386	Ether / IPv6 / UDP / DNS Ans "b'www.a.shifen.com.'" 
213	2020-03-18 00:35:51	fe80::1	fe80::f141:b4f2:11de:b126	DNS	177	Ether / IPv6 / UDP / DNS Ans "b'www.a.shifen.com.'" 
214	2020-03-18 00:35:51	192.168.1.10	180.97.33.108	Https	66	Ether / IP / TCP 192.168.1.10:2589 > 180.97.33.108:https S
215	2020-03-18 00:35:51	180.97.33.108	192.168.1.10	Https	66	Ether / IP / TCP 180.97.33.108:https > 192.168.1.10:2589 SA
216	2020-03-18 00:35:51	192.168.1.10	180.97.33.108	Https	54	Ether / IP / TCP 192.168.1.10:2589 > 180.97.33.108:https A
217	2020-03-18 00:35:51	192.168.1.10	180.97.33.108	Https	571	Ether / IP / TCP 192.168.1.10:2589 > 180.97.33.108:https PA / Raw
218	2020-03-18 00:35:51	180.97.33.108	192.168.1.10	Https	60	Ether / IP / TCP 180.97.33.108:https > 192.168.1.10:2589 A / Padding
219	2020-03-18 00:35:51	180.97.33.108	192.168.1.10	Https	150	Ether / IP / TCP 180.97.33.108:https > 192.168.1.10:2589 PA / Raw
220	2020-03-18 00:35:51	180.97.33.108	192.168.1.10	Https	60	Ether / IP / TCP 180.97.33.108:https > 192.168.1.10:2589 PA / Raw
221	2020-03-18 00:35:51	180.97.33.108	192.168.1.10	Https	99	Ether / IP / TCP 180.97.33.108:https > 192.168.1.10:2589 PA / Raw
222	2020-03-18 00:35:51	192.168.1.10	180.97.33.108	Https	54	Ether / IP / TCP 192.168.1.10:2589 > 180.97.33.108:https A
223	2020-03-18 00:35:51	192.168.1.10	180.97.33.108	Https	105	Ether / IP / TCP 192.168.1.10:2589 > 180.97.33.108:https PA / Raw
224	2020-03-18 00:35:51	192.168.1.10	180.97.33.108	Https	1506	Ether / IP / TCP 192.168.1.10:2589 > 180.97.33.108:https A / Raw
225	2020-03-18 00:35:51	192.168.1.10	180.97.33.108	Https	721	Ether / IP / TCP 192.168.1.10:2589 > 180.97.33.108:https PA / Raw
226	2020-03-18 00:35:51	180.97.33.108	192.168.1.10	Https	99	Ether / IP / TCP 180.97.33.108:https > 192.168.1.10:2589 PA / Raw
227	2020-03-18 00:35:51	192.168.1.10	180.97.33.108	Https	66	Ether / IP / TCP 192.168.1.10:2589 > 180.97.33.108:https A
228	2020-03-18 00:35:51	180.97.33.108	192.168.1.10	Https	60	Ether / IP / TCP 180.97.33.108:https > 192.168.1.10:2589 A / Padding
229	2020-03-18 00:35:51	180.97.33.108	192.168.1.10	Https	60	Ether / IP / TCP 180.97.33.108:https > 192.168.1.10:2589 A / Padding
230	2020-03-18 00:35:51	180.97.33.108	192.168.1.10	Https	484	Ether / IP / TCP 180.97.33.108:https > 192.168.1.10:2589 PA / Raw
231	2020-03-18 00:35:51	fe80::f141:b4f2:11de:b126	fe80::1	DNS	93	Ether / IPv6 / UDP / DNS Qry "b'sp2.baidu.com.'" 
232	2020-03-18 00:35:51	240e:d4:2e8e:df00:4882:f650:cbf9:db1d	2400:cb00:2048:1::6814:224e	Https	86	Ether / IPv6 / TCP 240e:d4:2e8e:df00:4882:f650:cbf9:db1d:2585 > 2400:cb00:2048:1::6814:224e:https S
233	2020-03-18 00:35:51	fe80::f141:b4f2:11de:b126	fe80::1	DNS	93	Ether / IPv6 / UDP / DNS Qry "b'sp2.baidu.com.'" 
234	2020-03-18 00:35:51	192.168.1.10	180.97.33.108	Https	54	Ether / IP / TCP 192.168.1.10:2589 > 180.97.33.108:https A
235	2020-03-18 00:35:51	fe80::1	fe80::f141:b4f2:11de:b126	DNS	386	Ether / IPv6 / UDP / DNS Ans "b'www.a.shifen.com.'" 
236	2020-03-18 00:35:51	fe80::1	fe80::f141:b4f2:11de:b126	DNS	177	Ether / IPv6 / UDP / DNS Ans "b'www.a.shifen.com.'" 
237	2020-03-18 00:35:51	192.168.1.10	180.97.33.107	Https	66	Ether / IP / TCP 192.168.1.10:2590 > 180.97.33.107:https S
238	2020-03-18 00:35:51	fe80::f141:b4f2:11de:b126	fe80::1	DNS	93	Ether / IPv6 / UDP / DNS Qry "b'www.baidu.com.'" 
239	2020-03-18 00:35:51	180.97.33.107	192.168.1.10	Https	66	Ether / IP / TCP 180.97.33.107:https > 192.168.1.10:2590 SA
240	2020-03-18 00:35:51	192.168.1.10	180.97.33.107	Https	54	Ether / IP / TCP 192.168.1.10:2590 > 180.97.33.107:https A
241	2020-03-18 00:35:51	fe80::f141:b4f2:11de:b126	fe80::1	DNS	93	Ether / IPv6 / UDP / DNS Qry "b'www.baidu.com.'" 
242	2020-03-18 00:35:51	192.168.1.10	180.97.33.107	Https	571	Ether / IP / TCP 192.168.1.10:2590 > 180.97.33.107:https PA / Raw
243	2020-03-18 00:35:51	fe80::1	fe80::f141:b4f2:11de:b126	DNS	386	Ether / IPv6 / UDP / DNS Ans "b'www.a.shifen.com.'" 
244	2020-03-18 00:35:51	fe80::1	fe80::f141:b4f2:11de:b126	DNS	177	Ether / IPv6 / UDP / DNS Ans "b'www.a.shifen.com.'" 
245	2020-03-18 00:35:51	192.168.1.10	180.97.33.108	Https	66	Ether / IP / TCP 192.168.1.10:2591 > 180.97.33.108:https S
246	2020-03-18 00:35:51	192.168.1.10	180.97.33.108	Https	66	Ether / IP / TCP 192.168.1.10:2592 > 180.97.33.108:https S
247	2020-03-18 00:35:51	180.97.33.107	192.168.1.10	Https	60	Ether / IP / TCP 180.97.33.107:https > 192.168.1.10:2590 A / Padding
248	2020-03-18 00:35:51	180.97.33.107	192.168.1.10	Https	150	Ether / IP / TCP 180.97.33.107:https > 192.168.1.10:2590 PA / Raw
249	2020-03-18 00:35:51	180.97.33.107	192.168.1.10	Https	60	Ether / IP / TCP 180.97.33.107:https > 192.168.1.10:2590 PA / Raw
250	2020-03-18 00:35:51	180.97.33.107	192.168.1.10	Https	99	Ether / IP / TCP 180.97.33.107:https > 192.168.1.10:2590 PA / Raw
251	2020-03-18 00:35:51	192.168.1.10	180.97.33.107	Https	54	Ether / IP / TCP 192.168.1.10:2590 > 180.97.33.107:https A
252	2020-03-18 00:35:51	192.168.1.10	180.97.33.107	Https	105	Ether / IP / TCP 192.168.1.10:2590 > 180.97.33.107:https PA / Raw
253	2020-03-18 00:35:51	192.168.1.10	180.97.33.107	Https	1506	Ether / IP / TCP 192.168.1.10:2590 > 180.97.33.107:https A / Raw
254	2020-03-18 00:35:51	192.168.1.10	180.97.33.107	Https	123	Ether / IP / TCP 192.168.1.10:2590 > 180.97.33.107:https PA / Raw
255	2020-03-18 00:35:51	180.97.33.108	192.168.1.10	Https	66	Ether / IP / TCP 180.97.33.108:https > 192.168.1.10:2591 SA
256	2020-03-18 00:35:51	192.168.1.10	180.97.33.108	Https	54	Ether / IP / TCP 192.168.1.10:2591 > 180.97.33.108:https A
257	2020-03-18 00:35:51	192.168.1.10	180.97.33.108	Https	571	Ether / IP / TCP 192.168.1.10:2591 > 180.97.33.108:https PA / Raw
258	2020-03-18 00:35:51	180.97.33.107	192.168.1.10	Https	99	Ether / IP / TCP 180.97.33.107:https > 192.168.1.10:2590 PA / Raw
259	2020-03-18 00:35:51	192.168.1.10	180.97.33.107	Https	66	Ether / IP / TCP 192.168.1.10:2590 > 180.97.33.107:https A
260	2020-03-18 00:35:51	180.97.33.108	192.168.1.10	Https	66	Ether / IP / TCP 180.97.33.108:https > 192.168.1.10:2592 SA
261	2020-03-18 00:35:51	192.168.1.10	180.97.33.108	Https	54	Ether / IP / TCP 192.168.1.10:2592 > 180.97.33.108:https A
262	2020-03-18 00:35:51	192.168.1.10	180.97.33.108	Https	571	Ether / IP / TCP 192.168.1.10:2592 > 180.97.33.108:https PA / Raw
263	2020-03-18 00:35:51	180.97.33.107	192.168.1.10	Https	60	Ether / IP / TCP 180.97.33.107:https > 192.168.1.10:2590 A / Padding
264	2020-03-18 00:35:51	180.97.33.107	192.168.1.10	Https	60	Ether / IP / TCP 180.97.33.107:https > 192.168.1.10:2590 A / Padding
265	2020-03-18 00:35:51	180.97.33.108	192.168.1.10	Https	60	Ether / IP / TCP 180.97.33.108:https > 192.168.1.10:2591 A / Padding
266	2020-03-18 00:35:51	180.97.33.108	192.168.1.10	Https	150	Ether / IP / TCP 180.97.33.108:https > 192.168.1.10:2591 PA / Raw
267	2020-03-18 00:35:51	180.97.33.108	192.168.1.10	Https	60	Ether / IP / TCP 180.97.33.108:https > 192.168.1.10:2591 PA / Raw
268	2020-03-18 00:35:51	180.97.33.108	192.168.1.10	Https	99	Ether / IP / TCP 180.97.33.108:https > 192.168.1.10:2591 PA / Raw
269	2020-03-18 00:35:51	192.168.1.10	180.97.33.108	Https	54	Ether / IP / TCP 192.168.1.10:2591 > 180.97.33.108:https A
270	2020-03-18 00:35:51	180.97.33.108	192.168.1.10	Https	60	Ether / IP / TCP 180.97.33.108:https > 192.168.1.10:2592 A / Padding
271	2020-03-18 00:35:51	192.168.1.10	180.97.33.108	Https	105	Ether / IP / TCP 192.168.1.10:2591 > 180.97.33.108:https PA / Raw
272	2020-03-18 00:35:51	180.97.33.108	192.168.1.10	Https	150	Ether / IP / TCP 180.97.33.108:https > 192.168.1.10:2592 PA / Raw
273	2020-03-18 00:35:51	180.97.33.108	192.168.1.10	Https	60	Ether / IP / TCP 180.97.33.108:https > 192.168.1.10:2592 PA / Raw
274	2020-03-18 00:35:51	192.168.1.10	180.97.33.108	Https	54	Ether / IP / TCP 192.168.1.10:2592 > 180.97.33.108:https A
275	2020-03-18 00:35:51	180.97.33.108	192.168.1.10	Https	99	Ether / IP / TCP 180.97.33.108:https > 192.168.1.10:2592 PA / Raw
276	2020-03-18 00:35:51	192.168.1.10	180.97.33.108	Https	1506	Ether / IP / TCP 192.168.1.10:2591 > 180.97.33.108:https A / Raw
277	2020-03-18 00:35:51	192.168.1.10	180.97.33.108	Https	428	Ether / IP / TCP 192.168.1.10:2591 > 180.97.33.108:https PA / Raw
278	2020-03-18 00:35:51	192.168.1.10	180.97.33.108	Https	105	Ether / IP / TCP 192.168.1.10:2592 > 180.97.33.108:https PA / Raw
279	2020-03-18 00:35:51	180.97.33.108	192.168.1.10	Https	99	Ether / IP / TCP 180.97.33.108:https > 192.168.1.10:2591 PA / Raw
280	2020-03-18 00:35:51	180.97.33.108	192.168.1.10	Https	99	Ether / IP / TCP 180.97.33.108:https > 192.168.1.10:2592 PA / Raw
281	2020-03-18 00:35:51	192.168.1.10	180.97.33.108	Https	66	Ether / IP / TCP 192.168.1.10:2591 > 180.97.33.108:https A
282	2020-03-18 00:35:51	192.168.1.10	180.97.33.108	Https	66	Ether / IP / TCP 192.168.1.10:2592 > 180.97.33.108:https A
283	2020-03-18 00:35:51	180.97.33.107	192.168.1.10	Https	1457	Ether / IP / TCP 180.97.33.107:https > 192.168.1.10:2590 PA / Raw
284	2020-03-18 00:35:51	180.97.33.108	192.168.1.10	Https	60	Ether / IP / TCP 180.97.33.108:https > 192.168.1.10:2592 A / Padding
285	2020-03-18 00:35:51	180.97.33.108	192.168.1.10	Https	60	Ether / IP / TCP 180.97.33.108:https > 192.168.1.10:2591 A / Padding
286	2020-03-18 00:35:51	180.97.33.108	192.168.1.10	Https	60	Ether / IP / TCP 180.97.33.108:https > 192.168.1.10:2591 A / Padding
287	2020-03-18 00:35:51	180.97.33.108	192.168.1.10	Https	842	Ether / IP / TCP 180.97.33.108:https > 192.168.1.10:2591 PA / Raw
288	2020-03-18 00:35:51	192.168.1.10	180.97.33.107	Https	54	Ether / IP / TCP 192.168.1.10:2590 > 180.97.33.107:https A
289	2020-03-18 00:35:51	192.168.1.10	180.97.33.108	Https	54	Ether / IP / TCP 192.168.1.10:2591 > 180.97.33.108:https A
290	2020-03-18 00:35:51	fe80::f141:b4f2:11de:b126	fe80::1	DNS	95	Ether / IPv6 / UDP / DNS Qry "b'image.baidu.com.'" 
291	2020-03-18 00:35:51	fe80::f141:b4f2:11de:b126	fe80::1	DNS	95	Ether / IPv6 / UDP / DNS Qry "b'image.baidu.com.'" 
292	2020-03-18 00:35:51	fe80::1	fe80::f141:b4f2:11de:b126	DNS	310	Ether / IPv6 / UDP / DNS Ans "b'image.n.shifen.com.'" 
293	2020-03-18 00:35:51	fe80::1	fe80::f141:b4f2:11de:b126	DNS	181	Ether / IPv6 / UDP / DNS Ans "b'image.n.shifen.com.'" 
294	2020-03-18 00:35:51	192.168.1.10	14.215.177.185	Https	66	Ether / IP / TCP 192.168.1.10:2593 > 14.215.177.185:https S
295	2020-03-18 00:35:51	192.168.1.10	14.215.177.185	Https	66	Ether / IP / TCP 192.168.1.10:2594 > 14.215.177.185:https S
296	2020-03-18 00:35:51	14.215.177.185	192.168.1.10	Https	66	Ether / IP / TCP 14.215.177.185:https > 192.168.1.10:2593 SA
297	2020-03-18 00:35:51	192.168.1.10	14.215.177.185	Https	54	Ether / IP / TCP 192.168.1.10:2593 > 14.215.177.185:https A
298	2020-03-18 00:35:51	192.168.1.10	14.215.177.185	Https	571	Ether / IP / TCP 192.168.1.10:2593 > 14.215.177.185:https PA / Raw
299	2020-03-18 00:35:51	14.215.177.185	192.168.1.10	Https	66	Ether / IP / TCP 14.215.177.185:https > 192.168.1.10:2594 SA
300	2020-03-18 00:35:51	192.168.1.10	14.215.177.185	Https	54	Ether / IP / TCP 192.168.1.10:2594 > 14.215.177.185:https A
301	2020-03-18 00:35:51	192.168.1.10	14.215.177.185	Https	571	Ether / IP / TCP 192.168.1.10:2594 > 14.215.177.185:https PA / Raw
302	2020-03-18 00:35:51	14.215.177.185	192.168.1.10	Https	60	Ether / IP / TCP 14.215.177.185:https > 192.168.1.10:2594 A / Padding
303	2020-03-18 00:35:51	14.215.177.185	192.168.1.10	Https	150	Ether / IP / TCP 14.215.177.185:https > 192.168.1.10:2594 PA / Raw
304	2020-03-18 00:35:51	14.215.177.185	192.168.1.10	Https	60	Ether / IP / TCP 14.215.177.185:https > 192.168.1.10:2594 PA / Raw
305	2020-03-18 00:35:51	192.168.1.10	14.215.177.185	Https	54	Ether / IP / TCP 192.168.1.10:2594 > 14.215.177.185:https A
306	2020-03-18 00:35:51	14.215.177.185	192.168.1.10	Https	99	Ether / IP / TCP 14.215.177.185:https > 192.168.1.10:2594 PA / Raw
307	2020-03-18 00:35:51	14.215.177.185	192.168.1.10	Https	60	Ether / IP / TCP 14.215.177.185:https > 192.168.1.10:2593 A / Padding
308	2020-03-18 00:35:51	14.215.177.185	192.168.1.10	Https	150	Ether / IP / TCP 14.215.177.185:https > 192.168.1.10:2593 PA / Raw
309	2020-03-18 00:35:51	14.215.177.185	192.168.1.10	Https	60	Ether / IP / TCP 14.215.177.185:https > 192.168.1.10:2593 PA / Raw
