1	2020-03-18 00:52:15	192.168.1.10	14.215.177.39	Https	54	Ether / IP / TCP 192.168.1.10:3296 > 14.215.177.39:https RA
2	2020-03-18 00:52:15	192.168.1.10	14.215.177.39	Https	54	Ether / IP / TCP 192.168.1.10:3303 > 14.215.177.39:https FA
3	2020-03-18 00:52:16	192.168.1.10	14.215.177.39	Https	66	Ether / IP / TCP 192.168.1.10:3305 > 14.215.177.39:https S
4	2020-03-18 00:52:16	14.215.177.39	192.168.1.10	Https	66	Ether / IP / TCP 14.215.177.39:https > 192.168.1.10:3305 SA
5	2020-03-18 00:52:16	192.168.1.10	14.215.177.39	Https	54	Ether / IP / TCP 192.168.1.10:3305 > 14.215.177.39:https A
6	2020-03-18 00:52:16	192.168.1.10	14.215.177.39	Https	54	Ether / IP / TCP 192.168.1.10:3305 > 14.215.177.39:https FA
7	2020-03-18 00:52:16	192.168.1.10	14.215.177.39	Https	54	Ether / IP / TCP 192.168.1.10:3305 > 14.215.177.39:https FA
8	2020-03-18 00:52:17	192.168.1.10	14.215.177.39	Https	54	Ether / IP / TCP 192.168.1.10:3305 > 14.215.177.39:https FA
9	2020-03-18 00:52:18	192.168.1.10	14.215.177.39	Https	54	Ether / IP / TCP 192.168.1.10:3305 > 14.215.177.39:https FA
10	2020-03-18 00:52:18	fe80::f141:b4f2:11de:b126	fe80::1	DNS	93	Ether / IPv6 / UDP / DNS Qry "b'www.zhihu.com.'" 
11	2020-03-18 00:52:18	fe80::f141:b4f2:11de:b126	fe80::1	DNS	93	Ether / IPv6 / UDP / DNS Qry "b'www.zhihu.com.'" 
12	2020-03-18 00:52:18	fe80::1	fe80::f141:b4f2:11de:b126	DNS	525	Ether / IPv6 / UDP / DNS Ans "b'www.zhihu.com.bb.gktianshanjd.com.'" 
13	2020-03-18 00:52:18	fe80::1	fe80::f141:b4f2:11de:b126	DNS	191	Ether / IPv6 / UDP / DNS Ans "b'www.zhihu.com.bb.gktianshanjd.com.'" 
14	2020-03-18 00:52:18	192.168.1.10	125.77.164.226	Https	66	Ether / IP / TCP 192.168.1.10:3307 > 125.77.164.226:https S
15	2020-03-18 00:52:18	125.77.164.226	192.168.1.10	Https	66	Ether / IP / TCP 125.77.164.226:https > 192.168.1.10:3307 SA
16	2020-03-18 00:52:18	192.168.1.10	125.77.164.226	Https	54	Ether / IP / TCP 192.168.1.10:3307 > 125.77.164.226:https A
17	2020-03-18 00:52:18	192.168.1.10	125.77.164.226	Https	571	Ether / IP / TCP 192.168.1.10:3307 > 125.77.164.226:https PA / Raw
18	2020-03-18 00:52:18	125.77.164.226	192.168.1.10	Https	60	Ether / IP / TCP 125.77.164.226:https > 192.168.1.10:3307 A / Padding
19	2020-03-18 00:52:18	125.77.164.226	192.168.1.10	Https	1506	Ether / IP / TCP 125.77.164.226:https > 192.168.1.10:3307 A / Raw
20	2020-03-18 00:52:18	125.77.164.226	192.168.1.10	Https	1473	Ether / IP / TCP 125.77.164.226:https > 192.168.1.10:3307 PA / Raw
21	2020-03-18 00:52:18	192.168.1.10	125.77.164.226	Https	54	Ether / IP / TCP 192.168.1.10:3307 > 125.77.164.226:https A
22	2020-03-18 00:52:18	192.168.1.10	125.77.164.226	Https	147	Ether / IP / TCP 192.168.1.10:3307 > 125.77.164.226:https PA / Raw
23	2020-03-18 00:52:18	192.168.1.10	125.77.164.226	Https	153	Ether / IP / TCP 192.168.1.10:3307 > 125.77.164.226:https PA / Raw
24	2020-03-18 00:52:18	192.168.1.10	125.77.164.226	Https	1506	Ether / IP / TCP 192.168.1.10:3307 > 125.77.164.226:https A / Raw
25	2020-03-18 00:52:18	192.168.1.10	125.77.164.226	Https	1506	Ether / IP / TCP 192.168.1.10:3307 > 125.77.164.226:https A / Raw
26	2020-03-18 00:52:18	192.168.1.10	125.77.164.226	Https	1354	Ether / IP / TCP 192.168.1.10:3307 > 125.77.164.226:https PA / Raw
27	2020-03-18 00:52:18	125.77.164.226	192.168.1.10	Https	60	Ether / IP / TCP 125.77.164.226:https > 192.168.1.10:3307 A / Padding
28	2020-03-18 00:52:18	125.77.164.226	192.168.1.10	Https	296	Ether / IP / TCP 125.77.164.226:https > 192.168.1.10:3307 PA / Raw
29	2020-03-18 00:52:18	125.77.164.226	192.168.1.10	Https	132	Ether / IP / TCP 125.77.164.226:https > 192.168.1.10:3307 PA / Raw
30	2020-03-18 00:52:18	192.168.1.10	125.77.164.226	Https	54	Ether / IP / TCP 192.168.1.10:3307 > 125.77.164.226:https A
31	2020-03-18 00:52:18	192.168.1.10	125.77.164.226	Https	92	Ether / IP / TCP 192.168.1.10:3307 > 125.77.164.226:https PA / Raw
32	2020-03-18 00:52:18	125.77.164.226	192.168.1.10	Https	60	Ether / IP / TCP 125.77.164.226:https > 192.168.1.10:3307 A / Padding
33	2020-03-18 00:52:18	125.77.164.226	192.168.1.10	Https	60	Ether / IP / TCP 125.77.164.226:https > 192.168.1.10:3307 A / Padding
34	2020-03-18 00:52:18	125.77.164.226	192.168.1.10	Https	1506	Ether / IP / TCP 125.77.164.226:https > 192.168.1.10:3307 A / Raw
35	2020-03-18 00:52:18	125.77.164.226	192.168.1.10	Https	684	Ether / IP / TCP 125.77.164.226:https > 192.168.1.10:3307 PA / Raw
36	2020-03-18 00:52:18	125.77.164.226	192.168.1.10	Https	92	Ether / IP / TCP 125.77.164.226:https > 192.168.1.10:3307 PA / Raw
37	2020-03-18 00:52:18	192.168.1.10	125.77.164.226	Https	54	Ether / IP / TCP 192.168.1.10:3307 > 125.77.164.226:https A
38	2020-03-18 00:52:18	125.77.164.226	192.168.1.10	Https	92	Ether / IP / TCP 125.77.164.226:https > 192.168.1.10:3307 PA / Raw
39	2020-03-18 00:52:18	192.168.1.10	125.77.164.226	Https	66	Ether / IP / TCP 192.168.1.10:3307 > 125.77.164.226:https A
40	2020-03-18 00:52:18	fe80::f141:b4f2:11de:b126	fe80::1	DNS	109	Ether / IPv6 / UDP / DNS Qry "b'zhihu-web-analytics.zhihu.com.'" 
41	2020-03-18 00:52:18	fe80::f141:b4f2:11de:b126	fe80::1	DNS	109	Ether / IPv6 / UDP / DNS Qry "b'zhihu-web-analytics.zhihu.com.'" 
42	2020-03-18 00:52:18	fe80::1	fe80::f141:b4f2:11de:b126	DNS	423	Ether / IPv6 / UDP / DNS Ans "b'gslb-offline-pkx01.zhihu.com.'" 
43	2020-03-18 00:52:18	fe80::1	fe80::f141:b4f2:11de:b126	DNS	246	Ether / IPv6 / UDP / DNS Ans "b'gslb-offline-pkx01.zhihu.com.'" 
44	2020-03-18 00:52:18	192.168.1.10	192.144.195.62	Https	66	Ether / IP / TCP 192.168.1.10:3308 > 192.144.195.62:https S
45	2020-03-18 00:52:18	192.144.195.62	192.168.1.10	Https	66	Ether / IP / TCP 192.144.195.62:https > 192.168.1.10:3308 SA
46	2020-03-18 00:52:18	192.168.1.10	192.144.195.62	Https	54	Ether / IP / TCP 192.168.1.10:3308 > 192.144.195.62:https A
47	2020-03-18 00:52:18	192.168.1.10	192.144.195.62	Https	571	Ether / IP / TCP 192.168.1.10:3308 > 192.144.195.62:https PA / Raw
48	2020-03-18 00:52:18	192.144.195.62	192.168.1.10	Https	60	Ether / IP / TCP 192.144.195.62:https > 192.168.1.10:3308 A / Padding
49	2020-03-18 00:52:18	192.144.195.62	192.168.1.10	Https	1486	Ether / IP / TCP 192.144.195.62:https > 192.168.1.10:3308 A / Raw
50	2020-03-18 00:52:18	192.144.195.62	192.168.1.10	Https	1486	Ether / IP / TCP 192.144.195.62:https > 192.168.1.10:3308 A / Raw
51	2020-03-18 00:52:18	192.144.195.62	192.168.1.10	Https	94	Ether / IP / TCP 192.144.195.62:https > 192.168.1.10:3308 PA / Raw
52	2020-03-18 00:52:18	192.168.1.10	192.144.195.62	Https	54	Ether / IP / TCP 192.168.1.10:3308 > 192.144.195.62:https A
53	2020-03-18 00:52:18	192.168.1.10	192.144.195.62	Https	180	Ether / IP / TCP 192.168.1.10:3308 > 192.144.195.62:https PA / Raw
54	2020-03-18 00:52:18	192.168.1.10	192.144.195.62	Https	153	Ether / IP / TCP 192.168.1.10:3308 > 192.144.195.62:https PA / Raw
55	2020-03-18 00:52:18	192.168.1.10	192.144.195.62	Https	499	Ether / IP / TCP 192.168.1.10:3308 > 192.144.195.62:https PA / Raw
56	2020-03-18 00:52:18	192.144.195.62	192.168.1.10	Https	328	Ether / IP / TCP 192.144.195.62:https > 192.168.1.10:3308 PA / Raw
57	2020-03-18 00:52:18	192.144.195.62	192.168.1.10	Https	123	Ether / IP / TCP 192.144.195.62:https > 192.168.1.10:3308 PA / Raw
58	2020-03-18 00:52:18	192.168.1.10	192.144.195.62	Https	54	Ether / IP / TCP 192.168.1.10:3308 > 192.144.195.62:https A
59	2020-03-18 00:52:18	192.168.1.10	192.144.195.62	Https	92	Ether / IP / TCP 192.168.1.10:3308 > 192.144.195.62:https PA / Raw
60	2020-03-18 00:52:18	192.144.195.62	192.168.1.10	Https	60	Ether / IP / TCP 192.144.195.62:https > 192.168.1.10:3308 A / Padding
61	2020-03-18 00:52:18	192.144.195.62	192.168.1.10	Https	92	Ether / IP / TCP 192.144.195.62:https > 192.168.1.10:3308 PA / Raw
62	2020-03-18 00:52:18	192.144.195.62	192.168.1.10	Https	363	Ether / IP / TCP 192.144.195.62:https > 192.168.1.10:3308 PA / Raw
63	2020-03-18 00:52:18	192.168.1.10	192.144.195.62	Https	54	Ether / IP / TCP 192.168.1.10:3308 > 192.144.195.62:https A
64	2020-03-18 00:52:18	192.168.1.10	192.144.195.62	Https	286	Ether / IP / TCP 192.168.1.10:3308 > 192.144.195.62:https PA / Raw
65	2020-03-18 00:52:18	192.168.1.10	192.144.195.62	Https	1381	Ether / IP / TCP 192.168.1.10:3308 > 192.144.195.62:https PA / Raw
66	2020-03-18 00:52:18	192.144.195.62	192.168.1.10	Https	60	Ether / IP / TCP 192.144.195.62:https > 192.168.1.10:3308 A / Padding
67	2020-03-18 00:52:18	192.144.195.62	192.168.1.10	Https	96	Ether / IP / TCP 192.144.195.62:https > 192.168.1.10:3308 PA / Raw
68	2020-03-18 00:52:18	192.144.195.62	192.168.1.10	Https	207	Ether / IP / TCP 192.144.195.62:https > 192.168.1.10:3308 PA / Raw
69	2020-03-18 00:52:18	192.168.1.10	192.144.195.62	Https	54	Ether / IP / TCP 192.168.1.10:3308 > 192.144.195.62:https A
70	2020-03-18 00:52:19	192.168.1.10	120.131.14.181	UDP	151	Ether / IP / UDP 192.168.1.10:49770 > 120.131.14.181:9402 / Raw
71	2020-03-18 00:52:19	fe80::f141:b4f2:11de:b126	fe80::1	DNS	96	Ether / IPv6 / UDP / DNS Qry "b'eclick.baidu.com.'" 
72	2020-03-18 00:52:19	fe80::f141:b4f2:11de:b126	fe80::1	DNS	96	Ether / IPv6 / UDP / DNS Qry "b'eclick.baidu.com.'" 
73	2020-03-18 00:52:19	fe80::1	fe80::f141:b4f2:11de:b126	DNS	312	Ether / IPv6 / UDP / DNS Ans "b'eclick.e.shifen.com.'" 
74	2020-03-18 00:52:19	fe80::1	fe80::f141:b4f2:11de:b126	DNS	183	Ether / IPv6 / UDP / DNS Ans "b'eclick.e.shifen.com.'" 
75	2020-03-18 00:52:19	192.168.1.10	220.181.107.131	Https	66	Ether / IP / TCP 192.168.1.10:3309 > 220.181.107.131:https S
76	2020-03-18 00:52:19	fe80::f141:b4f2:11de:b126	fe80::1	DNS	97	Ether / IPv6 / UDP / DNS Qry "b'imgstat.baidu.com.'" 
77	2020-03-18 00:52:19	fe80::f141:b4f2:11de:b126	fe80::1	DNS	97	Ether / IPv6 / UDP / DNS Qry "b'imgstat.baidu.com.'" 
78	2020-03-18 00:52:19	fe80::1	fe80::f141:b4f2:11de:b126	DNS	314	Ether / IPv6 / UDP / DNS Ans "b'imgstat.n.shifen.com.'" 
79	2020-03-18 00:52:19	fe80::f141:b4f2:11de:b126	fe80::1	DNS	92	Ether / IPv6 / UDP / DNS Qry "b'hm.baidu.com.'" 
80	2020-03-18 00:52:19	fe80::f141:b4f2:11de:b126	fe80::1	DNS	92	Ether / IPv6 / UDP / DNS Qry "b'hm.baidu.com.'" 
81	2020-03-18 00:52:19	fe80::1	fe80::f141:b4f2:11de:b126	DNS	185	Ether / IPv6 / UDP / DNS Ans "b'imgstat.n.shifen.com.'" 
82	2020-03-18 00:52:19	192.168.1.10	180.97.36.16	Https	66	Ether / IP / TCP 192.168.1.10:3310 > 180.97.36.16:https S
83	2020-03-18 00:52:19	fe80::1	fe80::f141:b4f2:11de:b126	DNS	304	Ether / IPv6 / UDP / DNS Ans "b'hm.e.shifen.com.'" 
84	2020-03-18 00:52:19	fe80::1	fe80::f141:b4f2:11de:b126	DNS	175	Ether / IPv6 / UDP / DNS Ans "b'hm.e.shifen.com.'" 
85	2020-03-18 00:52:19	192.168.1.10	106.120.159.126	Https	66	Ether / IP / TCP 192.168.1.10:3311 > 106.120.159.126:https S
86	2020-03-18 00:52:19	192.168.1.10	106.120.159.126	Https	66	Ether / IP / TCP 192.168.1.10:3312 > 106.120.159.126:https S
87	2020-03-18 00:52:19	180.97.36.16	192.168.1.10	Https	66	Ether / IP / TCP 180.97.36.16:https > 192.168.1.10:3310 SA
88	2020-03-18 00:52:19	192.168.1.10	180.97.36.16	Https	54	Ether / IP / TCP 192.168.1.10:3310 > 180.97.36.16:https A
89	2020-03-18 00:52:19	220.181.107.131	192.168.1.10	Https	66	Ether / IP / TCP 220.181.107.131:https > 192.168.1.10:3309 SA
90	2020-03-18 00:52:19	192.168.1.10	180.97.36.16	Https	571	Ether / IP / TCP 192.168.1.10:3310 > 180.97.36.16:https PA / Raw
91	2020-03-18 00:52:19	192.168.1.10	220.181.107.131	Https	54	Ether / IP / TCP 192.168.1.10:3309 > 220.181.107.131:https A
92	2020-03-18 00:52:19	192.168.1.10	220.181.107.131	Https	571	Ether / IP / TCP 192.168.1.10:3309 > 220.181.107.131:https PA / Raw
93	2020-03-18 00:52:19	192.168.1.10	106.120.159.126	Https	66	Ether / IP / TCP 192.168.1.10:3313 > 106.120.159.126:https S
94	2020-03-18 00:52:19	192.168.1.10	106.120.159.126	Https	66	Ether / IP / TCP 192.168.1.10:3314 > 106.120.159.126:https S
95	2020-03-18 00:52:19	192.168.1.10	106.120.159.126	Https	66	Ether / IP / TCP 192.168.1.10:3315 > 106.120.159.126:https S
96	2020-03-18 00:52:19	192.168.1.10	106.120.159.126	Https	66	Ether / IP / TCP 192.168.1.10:3316 > 106.120.159.126:https S
97	2020-03-18 00:52:19	106.120.159.126	192.168.1.10	Https	66	Ether / IP / TCP 106.120.159.126:https > 192.168.1.10:3311 SA
98	2020-03-18 00:52:19	192.168.1.10	106.120.159.126	Https	54	Ether / IP / TCP 192.168.1.10:3311 > 106.120.159.126:https A
99	2020-03-18 00:52:19	192.168.1.10	106.120.159.126	Https	571	Ether / IP / TCP 192.168.1.10:3311 > 106.120.159.126:https PA / Raw
100	2020-03-18 00:52:19	180.97.36.16	192.168.1.10	Https	60	Ether / IP / TCP 180.97.36.16:https > 192.168.1.10:3310 A / Padding
101	2020-03-18 00:52:19	180.97.36.16	192.168.1.10	Https	150	Ether / IP / TCP 180.97.36.16:https > 192.168.1.10:3310 PA / Raw
102	2020-03-18 00:52:19	180.97.36.16	192.168.1.10	Https	60	Ether / IP / TCP 180.97.36.16:https > 192.168.1.10:3310 PA / Raw
103	2020-03-18 00:52:19	180.97.36.16	192.168.1.10	Https	99	Ether / IP / TCP 180.97.36.16:https > 192.168.1.10:3310 PA / Raw
104	2020-03-18 00:52:19	192.168.1.10	180.97.36.16	Https	54	Ether / IP / TCP 192.168.1.10:3310 > 180.97.36.16:https A
105	2020-03-18 00:52:19	192.168.1.10	180.97.36.16	Https	105	Ether / IP / TCP 192.168.1.10:3310 > 180.97.36.16:https PA / Raw
106	2020-03-18 00:52:19	192.168.1.10	180.97.36.16	Https	1293	Ether / IP / TCP 192.168.1.10:3310 > 180.97.36.16:https PA / Raw
107	2020-03-18 00:52:19	180.97.36.16	192.168.1.10	Https	99	Ether / IP / TCP 180.97.36.16:https > 192.168.1.10:3310 PA / Raw
108	2020-03-18 00:52:19	192.168.1.10	180.97.36.16	Https	66	Ether / IP / TCP 192.168.1.10:3310 > 180.97.36.16:https A
109	2020-03-18 00:52:19	106.120.159.126	192.168.1.10	Https	66	Ether / IP / TCP 106.120.159.126:https > 192.168.1.10:3312 SA
110	2020-03-18 00:52:19	192.168.1.10	106.120.159.126	Https	54	Ether / IP / TCP 192.168.1.10:3312 > 106.120.159.126:https A
111	2020-03-18 00:52:19	192.168.1.10	106.120.159.126	Https	571	Ether / IP / TCP 192.168.1.10:3312 > 106.120.159.126:https PA / Raw
112	2020-03-18 00:52:19	220.181.107.131	192.168.1.10	Https	60	Ether / IP / TCP 220.181.107.131:https > 192.168.1.10:3309 A / Padding
113	2020-03-18 00:52:19	106.120.159.126	192.168.1.10	Https	66	Ether / IP / TCP 106.120.159.126:https > 192.168.1.10:3313 SA
114	2020-03-18 00:52:19	192.168.1.10	106.120.159.126	Https	54	Ether / IP / TCP 192.168.1.10:3313 > 106.120.159.126:https A
115	2020-03-18 00:52:19	192.168.1.10	106.120.159.126	Https	571	Ether / IP / TCP 192.168.1.10:3313 > 106.120.159.126:https PA / Raw
116	2020-03-18 00:52:19	220.181.107.131	192.168.1.10	Https	122	Ether / IP / TCP 220.181.107.131:https > 192.168.1.10:3309 PA / Raw
117	2020-03-18 00:52:19	220.181.107.131	192.168.1.10	Https	1506	Ether / IP / TCP 220.181.107.131:https > 192.168.1.10:3309 A / Raw
118	2020-03-18 00:52:19	220.181.107.131	192.168.1.10	Https	1506	Ether / IP / TCP 220.181.107.131:https > 192.168.1.10:3309 A / Raw
119	2020-03-18 00:52:19	220.181.107.131	192.168.1.10	Https	769	Ether / IP / TCP 220.181.107.131:https > 192.168.1.10:3309 PA / Raw
120	2020-03-18 00:52:19	192.168.1.10	220.181.107.131	Https	54	Ether / IP / TCP 192.168.1.10:3309 > 220.181.107.131:https A
121	2020-03-18 00:52:19	220.181.107.131	192.168.1.10	Https	392	Ether / IP / TCP 220.181.107.131:https > 192.168.1.10:3309 PA / Raw
122	2020-03-18 00:52:19	220.181.107.131	192.168.1.10	Https	63	Ether / IP / TCP 220.181.107.131:https > 192.168.1.10:3309 PA / Raw
123	2020-03-18 00:52:19	180.97.36.16	192.168.1.10	Https	60	Ether / IP / TCP 180.97.36.16:https > 192.168.1.10:3310 A / Padding
124	2020-03-18 00:52:19	192.168.1.10	220.181.107.131	Https	54	Ether / IP / TCP 192.168.1.10:3309 > 220.181.107.131:https A
125	2020-03-18 00:52:19	180.97.36.16	192.168.1.10	Https	60	Ether / IP / TCP 180.97.36.16:https > 192.168.1.10:3310 A / Padding
126	2020-03-18 00:52:19	106.120.159.126	192.168.1.10	Https	66	Ether / IP / TCP 106.120.159.126:https > 192.168.1.10:3315 SA
127	2020-03-18 00:52:19	106.120.159.126	192.168.1.10	Https	66	Ether / IP / TCP 106.120.159.126:https > 192.168.1.10:3314 SA
128	2020-03-18 00:52:19	192.168.1.10	106.120.159.126	Https	54	Ether / IP / TCP 192.168.1.10:3315 > 106.120.159.126:https A
129	2020-03-18 00:52:19	192.168.1.10	106.120.159.126	Https	54	Ether / IP / TCP 192.168.1.10:3314 > 106.120.159.126:https A
130	2020-03-18 00:52:19	192.168.1.10	220.181.107.131	Https	180	Ether / IP / TCP 192.168.1.10:3309 > 220.181.107.131:https PA / Raw
131	2020-03-18 00:52:19	180.97.36.16	192.168.1.10	Https	326	Ether / IP / TCP 180.97.36.16:https > 192.168.1.10:3310 PA / Raw
132	2020-03-18 00:52:19	192.168.1.10	106.120.159.126	Https	571	Ether / IP / TCP 192.168.1.10:3315 > 106.120.159.126:https PA / Raw
133	2020-03-18 00:52:19	192.168.1.10	106.120.159.126	Https	571	Ether / IP / TCP 192.168.1.10:3314 > 106.120.159.126:https PA / Raw
134	2020-03-18 00:52:19	192.168.1.10	220.181.107.131	Https	1506	Ether / IP / TCP 192.168.1.10:3309 > 220.181.107.131:https A / Raw
135	2020-03-18 00:52:19	192.168.1.10	220.181.107.131	Https	105	Ether / IP / TCP 192.168.1.10:3309 > 220.181.107.131:https PA / Raw
136	2020-03-18 00:52:19	106.120.159.126	192.168.1.10	Https	66	Ether / IP / TCP 106.120.159.126:https > 192.168.1.10:3316 SA
137	2020-03-18 00:52:19	192.168.1.10	106.120.159.126	Https	54	Ether / IP / TCP 192.168.1.10:3316 > 106.120.159.126:https A
138	2020-03-18 00:52:19	192.168.1.10	106.120.159.126	Https	571	Ether / IP / TCP 192.168.1.10:3316 > 106.120.159.126:https PA / Raw
139	2020-03-18 00:52:19	220.181.107.131	192.168.1.10	Https	63	Ether / IP / TCP 220.181.107.131:https > 192.168.1.10:3309 PA / Raw
140	2020-03-18 00:52:19	192.168.1.10	220.181.107.131	Https	66	Ether / IP / TCP 192.168.1.10:3309 > 220.181.107.131:https A
141	2020-03-18 00:52:19	106.120.159.126	192.168.1.10	Https	60	Ether / IP / TCP 106.120.159.126:https > 192.168.1.10:3311 A / Padding
142	2020-03-18 00:52:19	106.120.159.126	192.168.1.10	Https	122	Ether / IP / TCP 106.120.159.126:https > 192.168.1.10:3311 PA / Raw
143	2020-03-18 00:52:19	106.120.159.126	192.168.1.10	Https	1506	Ether / IP / TCP 106.120.159.126:https > 192.168.1.10:3311 A / Raw
144	2020-03-18 00:52:19	106.120.159.126	192.168.1.10	Https	1506	Ether / IP / TCP 106.120.159.126:https > 192.168.1.10:3311 A / Raw
145	2020-03-18 00:52:19	106.120.159.126	192.168.1.10	Https	769	Ether / IP / TCP 106.120.159.126:https > 192.168.1.10:3311 PA / Raw
146	2020-03-18 00:52:19	192.168.1.10	106.120.159.126	Https	54	Ether / IP / TCP 192.168.1.10:3311 > 106.120.159.126:https A
147	2020-03-18 00:52:19	106.120.159.126	192.168.1.10	Https	392	Ether / IP / TCP 106.120.159.126:https > 192.168.1.10:3311 PA / Raw
148	2020-03-18 00:52:19	106.120.159.126	192.168.1.10	Https	63	Ether / IP / TCP 106.120.159.126:https > 192.168.1.10:3311 PA / Raw
149	2020-03-18 00:52:19	192.168.1.10	106.120.159.126	Https	54	Ether / IP / TCP 192.168.1.10:3311 > 106.120.159.126:https A
150	2020-03-18 00:52:19	192.168.1.10	106.120.159.126	Https	180	Ether / IP / TCP 192.168.1.10:3311 > 106.120.159.126:https PA / Raw
151	2020-03-18 00:52:19	192.168.1.10	106.120.159.126	Https	1235	Ether / IP / TCP 192.168.1.10:3311 > 106.120.159.126:https PA / Raw
152	2020-03-18 00:52:19	106.120.159.126	192.168.1.10	Https	63	Ether / IP / TCP 106.120.159.126:https > 192.168.1.10:3311 PA / Raw
153	2020-03-18 00:52:19	192.168.1.10	106.120.159.126	Https	66	Ether / IP / TCP 192.168.1.10:3311 > 106.120.159.126:https A
154	2020-03-18 00:52:19	106.120.159.126	192.168.1.10	Https	60	Ether / IP / TCP 106.120.159.126:https > 192.168.1.10:3312 A / Padding
155	2020-03-18 00:52:19	106.120.159.126	192.168.1.10	Https	122	Ether / IP / TCP 106.120.159.126:https > 192.168.1.10:3312 PA / Raw
156	2020-03-18 00:52:19	106.120.159.126	192.168.1.10	Https	1506	Ether / IP / TCP 106.120.159.126:https > 192.168.1.10:3312 A / Raw
157	2020-03-18 00:52:19	192.168.1.10	106.120.159.126	Https	54	Ether / IP / TCP 192.168.1.10:3312 > 106.120.159.126:https A
158	2020-03-18 00:52:19	106.120.159.126	192.168.1.10	Https	1506	Ether / IP / TCP 106.120.159.126:https > 192.168.1.10:3312 A / Raw
159	2020-03-18 00:52:19	106.120.159.126	192.168.1.10	Https	769	Ether / IP / TCP 106.120.159.126:https > 192.168.1.10:3312 PA / Raw
160	2020-03-18 00:52:19	192.168.1.10	106.120.159.126	Https	54	Ether / IP / TCP 192.168.1.10:3312 > 106.120.159.126:https A
161	2020-03-18 00:52:19	106.120.159.126	192.168.1.10	Https	392	Ether / IP / TCP 106.120.159.126:https > 192.168.1.10:3312 PA / Raw
162	2020-03-18 00:52:19	106.120.159.126	192.168.1.10	Https	63	Ether / IP / TCP 106.120.159.126:https > 192.168.1.10:3312 PA / Raw
163	2020-03-18 00:52:19	192.168.1.10	106.120.159.126	Https	54	Ether / IP / TCP 192.168.1.10:3312 > 106.120.159.126:https A
164	2020-03-18 00:52:19	192.168.1.10	106.120.159.126	Https	180	Ether / IP / TCP 192.168.1.10:3312 > 106.120.159.126:https PA / Raw
165	2020-03-18 00:52:19	192.168.1.10	106.120.159.126	Https	1481	Ether / IP / TCP 192.168.1.10:3312 > 106.120.159.126:https PA / Raw
166	2020-03-18 00:52:19	106.120.159.126	192.168.1.10	Https	60	Ether / IP / TCP 106.120.159.126:https > 192.168.1.10:3313 A / Padding
167	2020-03-18 00:52:19	106.120.159.126	192.168.1.10	Https	122	Ether / IP / TCP 106.120.159.126:https > 192.168.1.10:3313 PA / Raw
168	2020-03-18 00:52:19	106.120.159.126	192.168.1.10	Https	1506	Ether / IP / TCP 106.120.159.126:https > 192.168.1.10:3313 A / Raw
169	2020-03-18 00:52:19	106.120.159.126	192.168.1.10	Https	1506	Ether / IP / TCP 106.120.159.126:https > 192.168.1.10:3313 A / Raw
170	2020-03-18 00:52:19	106.120.159.126	192.168.1.10	Https	769	Ether / IP / TCP 106.120.159.126:https > 192.168.1.10:3313 PA / Raw
171	2020-03-18 00:52:19	192.168.1.10	106.120.159.126	Https	54	Ether / IP / TCP 192.168.1.10:3313 > 106.120.159.126:https A
172	2020-03-18 00:52:19	106.120.159.126	192.168.1.10	Https	392	Ether / IP / TCP 106.120.159.126:https > 192.168.1.10:3313 PA / Raw
173	2020-03-18 00:52:19	106.120.159.126	192.168.1.10	Https	63	Ether / IP / TCP 106.120.159.126:https > 192.168.1.10:3313 PA / Raw
174	2020-03-18 00:52:19	220.181.107.131	192.168.1.10	Https	60	Ether / IP / TCP 220.181.107.131:https > 192.168.1.10:3309 A / Padding
175	2020-03-18 00:52:19	220.181.107.131	192.168.1.10	Https	173	Ether / IP / TCP 220.181.107.131:https > 192.168.1.10:3309 PA / Raw
176	2020-03-18 00:52:19	220.181.107.131	192.168.1.10	Https	60	Ether / IP / TCP 220.181.107.131:https > 192.168.1.10:3309 PA / Raw
177	2020-03-18 00:52:19	220.181.107.131	192.168.1.10	Https	99	Ether / IP / TCP 220.181.107.131:https > 192.168.1.10:3309 PA / Raw
178	2020-03-18 00:52:19	192.168.1.10	106.120.159.126	Https	54	Ether / IP / TCP 192.168.1.10:3313 > 106.120.159.126:https A
179	2020-03-18 00:52:19	192.168.1.10	220.181.107.131	Https	54	Ether / IP / TCP 192.168.1.10:3309 > 220.181.107.131:https A
180	2020-03-18 00:52:19	192.168.1.10	180.97.36.16	Https	54	Ether / IP / TCP 192.168.1.10:3310 > 180.97.36.16:https A
181	2020-03-18 00:52:19	220.181.107.131	192.168.1.10	Https	60	Ether / IP / TCP 220.181.107.131:https > 192.168.1.10:3309 A / Padding
182	2020-03-18 00:52:19	192.168.1.10	106.120.159.126	Https	180	Ether / IP / TCP 192.168.1.10:3313 > 106.120.159.126:https PA / Raw
183	2020-03-18 00:52:19	192.168.1.10	106.120.159.126	Https	1415	Ether / IP / TCP 192.168.1.10:3313 > 106.120.159.126:https PA / Raw
184	2020-03-18 00:52:19	106.120.159.126	192.168.1.10	Https	60	Ether / IP / TCP 106.120.159.126:https > 192.168.1.10:3315 A / Padding
185	2020-03-18 00:52:19	106.120.159.126	192.168.1.10	Https	122	Ether / IP / TCP 106.120.159.126:https > 192.168.1.10:3315 PA / Raw
186	2020-03-18 00:52:19	106.120.159.126	192.168.1.10	Https	1506	Ether / IP / TCP 106.120.159.126:https > 192.168.1.10:3315 A / Raw
187	2020-03-18 00:52:19	106.120.159.126	192.168.1.10	Https	1506	Ether / IP / TCP 106.120.159.126:https > 192.168.1.10:3315 A / Raw
188	2020-03-18 00:52:19	106.120.159.126	192.168.1.10	Https	769	Ether / IP / TCP 106.120.159.126:https > 192.168.1.10:3315 PA / Raw
189	2020-03-18 00:52:19	192.168.1.10	106.120.159.126	Https	54	Ether / IP / TCP 192.168.1.10:3315 > 106.120.159.126:https A
190	2020-03-18 00:52:19	106.120.159.126	192.168.1.10	Https	60	Ether / IP / TCP 106.120.159.126:https > 192.168.1.10:3316 A / Padding
191	2020-03-18 00:52:19	220.181.107.131	192.168.1.10	Https	394	Ether / IP / TCP 220.181.107.131:https > 192.168.1.10:3309 PA / Raw
192	2020-03-18 00:52:19	192.168.1.10	220.181.107.131	Https	54	Ether / IP / TCP 192.168.1.10:3309 > 220.181.107.131:https A
193	2020-03-18 00:52:19	106.120.159.126	192.168.1.10	Https	392	Ether / IP / TCP 106.120.159.126:https > 192.168.1.10:3315 PA / Raw
194	2020-03-18 00:52:19	106.120.159.126	192.168.1.10	Https	63	Ether / IP / TCP 106.120.159.126:https > 192.168.1.10:3315 PA / Raw
195	2020-03-18 00:52:19	106.120.159.126	192.168.1.10	Https	60	Ether / IP / TCP 106.120.159.126:https > 192.168.1.10:3314 A / Padding
196	2020-03-18 00:52:19	106.120.159.126	192.168.1.10	Https	122	Ether / IP / TCP 106.120.159.126:https > 192.168.1.10:3314 PA / Raw
197	2020-03-18 00:52:19	106.120.159.126	192.168.1.10	Https	1506	Ether / IP / TCP 106.120.159.126:https > 192.168.1.10:3314 A / Raw
198	2020-03-18 00:52:19	106.120.159.126	192.168.1.10	Https	1506	Ether / IP / TCP 106.120.159.126:https > 192.168.1.10:3314 A / Raw
199	2020-03-18 00:52:19	106.120.159.126	192.168.1.10	Https	769	Ether / IP / TCP 106.120.159.126:https > 192.168.1.10:3314 PA / Raw
200	2020-03-18 00:52:19	192.168.1.10	106.120.159.126	Https	54	Ether / IP / TCP 192.168.1.10:3315 > 106.120.159.126:https A
201	2020-03-18 00:52:19	192.168.1.10	106.120.159.126	Https	54	Ether / IP / TCP 192.168.1.10:3314 > 106.120.159.126:https A
202	2020-03-18 00:52:19	106.120.159.126	192.168.1.10	Https	122	Ether / IP / TCP 106.120.159.126:https > 192.168.1.10:3316 PA / Raw
203	2020-03-18 00:52:19	106.120.159.126	192.168.1.10	Https	1506	Ether / IP / TCP 106.120.159.126:https > 192.168.1.10:3316 A / Raw
204	2020-03-18 00:52:19	106.120.159.126	192.168.1.10	Https	1506	Ether / IP / TCP 106.120.159.126:https > 192.168.1.10:3316 A / Raw
205	2020-03-18 00:52:19	106.120.159.126	192.168.1.10	Https	769	Ether / IP / TCP 106.120.159.126:https > 192.168.1.10:3316 PA / Raw
206	2020-03-18 00:52:19	192.168.1.10	106.120.159.126	Https	54	Ether / IP / TCP 192.168.1.10:3316 > 106.120.159.126:https A
207	2020-03-18 00:52:19	192.168.1.10	106.120.159.126	Https	180	Ether / IP / TCP 192.168.1.10:3315 > 106.120.159.126:https PA / Raw
208	2020-03-18 00:52:19	106.120.159.126	192.168.1.10	Https	392	Ether / IP / TCP 106.120.159.126:https > 192.168.1.10:3314 PA / Raw
209	2020-03-18 00:52:19	106.120.159.126	192.168.1.10	Https	63	Ether / IP / TCP 106.120.159.126:https > 192.168.1.10:3314 PA / Raw
210	2020-03-18 00:52:19	192.168.1.10	106.120.159.126	Https	54	Ether / IP / TCP 192.168.1.10:3314 > 106.120.159.126:https A
211	2020-03-18 00:52:19	106.120.159.126	192.168.1.10	Https	392	Ether / IP / TCP 106.120.159.126:https > 192.168.1.10:3316 PA / Raw
212	2020-03-18 00:52:19	106.120.159.126	192.168.1.10	Https	63	Ether / IP / TCP 106.120.159.126:https > 192.168.1.10:3316 PA / Raw
213	2020-03-18 00:52:19	192.168.1.10	106.120.159.126	Https	180	Ether / IP / TCP 192.168.1.10:3314 > 106.120.159.126:https PA / Raw
214	2020-03-18 00:52:19	192.168.1.10	106.120.159.126	Https	54	Ether / IP / TCP 192.168.1.10:3316 > 106.120.159.126:https A
215	2020-03-18 00:52:19	192.168.1.10	106.120.159.126	Https	180	Ether / IP / TCP 192.168.1.10:3316 > 106.120.159.126:https PA / Raw
216	2020-03-18 00:52:19	106.120.159.126	192.168.1.10	Https	63	Ether / IP / TCP 106.120.159.126:https > 192.168.1.10:3315 PA / Raw
217	2020-03-18 00:52:19	192.168.1.10	106.120.159.126	Https	1449	Ether / IP / TCP 192.168.1.10:3315 > 106.120.159.126:https PA / Raw
218	2020-03-18 00:52:19	192.168.1.10	106.120.159.126	Https	1432	Ether / IP / TCP 192.168.1.10:3314 > 106.120.159.126:https PA / Raw
219	2020-03-18 00:52:19	192.168.1.10	106.120.159.126	Https	1463	Ether / IP / TCP 192.168.1.10:3316 > 106.120.159.126:https PA / Raw
220	2020-03-18 00:52:19	192.168.1.10	106.120.159.126	Https	66	Ether / IP / TCP 192.168.1.10:3315 > 106.120.159.126:https A
221	2020-03-18 00:52:19	106.120.159.126	192.168.1.10	Https	63	Ether / IP / TCP 106.120.159.126:https > 192.168.1.10:3314 PA / Raw
222	2020-03-18 00:52:19	192.168.1.10	106.120.159.126	Https	66	Ether / IP / TCP 192.168.1.10:3314 > 106.120.159.126:https A
223	2020-03-18 00:52:19	106.120.159.126	192.168.1.10	Https	63	Ether / IP / TCP 106.120.159.126:https > 192.168.1.10:3316 PA / Raw
224	2020-03-18 00:52:19	192.168.1.10	106.120.159.126	Https	66	Ether / IP / TCP 192.168.1.10:3316 > 106.120.159.126:https A
225	2020-03-18 00:52:19	106.120.159.126	192.168.1.10	Https	60	Ether / IP / TCP 106.120.159.126:https > 192.168.1.10:3311 A / Padding
226	2020-03-18 00:52:19	106.120.159.126	192.168.1.10	Https	173	Ether / IP / TCP 106.120.159.126:https > 192.168.1.10:3311 PA / Raw
227	2020-03-18 00:52:19	106.120.159.126	192.168.1.10	Https	60	Ether / IP / TCP 106.120.159.126:https > 192.168.1.10:3311 PA / Raw
228	2020-03-18 00:52:19	106.120.159.126	192.168.1.10	Https	99	Ether / IP / TCP 106.120.159.126:https > 192.168.1.10:3311 PA / Raw
229	2020-03-18 00:52:19	192.168.1.10	106.120.159.126	Https	54	Ether / IP / TCP 192.168.1.10:3311 > 106.120.159.126:https A
230	2020-03-18 00:52:19	106.120.159.126	192.168.1.10	Https	60	Ether / IP / TCP 106.120.159.126:https > 192.168.1.10:3311 A / Padding
231	2020-03-18 00:52:19	106.120.159.126	192.168.1.10	Https	382	Ether / IP / TCP 106.120.159.126:https > 192.168.1.10:3311 PA / Raw
232	2020-03-18 00:52:19	192.168.1.10	106.120.159.126	Https	54	Ether / IP / TCP 192.168.1.10:3311 > 106.120.159.126:https A
233	2020-03-18 00:52:19	192.168.1.10	106.120.159.126	Https	1386	Ether / IP / TCP 192.168.1.10:3311 > 106.120.159.126:https PA / Raw
234	2020-03-18 00:52:19	106.120.159.126	192.168.1.10	Https	60	Ether / IP / TCP 106.120.159.126:https > 192.168.1.10:3312 A / Padding
235	2020-03-18 00:52:19	106.120.159.126	192.168.1.10	Https	60	Ether / IP / TCP 106.120.159.126:https > 192.168.1.10:3312 A / Padding
236	2020-03-18 00:52:19	106.120.159.126	192.168.1.10	Https	173	Ether / IP / TCP 106.120.159.126:https > 192.168.1.10:3312 PA / Raw
237	2020-03-18 00:52:19	106.120.159.126	192.168.1.10	Https	60	Ether / IP / TCP 106.120.159.126:https > 192.168.1.10:3312 PA / Raw
238	2020-03-18 00:52:19	106.120.159.126	192.168.1.10	Https	99	Ether / IP / TCP 106.120.159.126:https > 192.168.1.10:3312 PA / Raw
239	2020-03-18 00:52:19	192.168.1.10	106.120.159.126	Https	54	Ether / IP / TCP 192.168.1.10:3312 > 106.120.159.126:https A
240	2020-03-18 00:52:19	106.120.159.126	192.168.1.10	Https	382	Ether / IP / TCP 106.120.159.126:https > 192.168.1.10:3312 PA / Raw
241	2020-03-18 00:52:19	192.168.1.10	106.120.159.126	Https	54	Ether / IP / TCP 192.168.1.10:3312 > 106.120.159.126:https A
242	2020-03-18 00:52:19	106.120.159.126	192.168.1.10	Https	60	Ether / IP / TCP 106.120.159.126:https > 192.168.1.10:3313 A / Padding
243	2020-03-18 00:52:19	106.120.159.126	192.168.1.10	Https	60	Ether / IP / TCP 106.120.159.126:https > 192.168.1.10:3313 A / Padding
244	2020-03-18 00:52:19	106.120.159.126	192.168.1.10	Https	173	Ether / IP / TCP 106.120.159.126:https > 192.168.1.10:3313 PA / Raw
245	2020-03-18 00:52:19	106.120.159.126	192.168.1.10	Https	60	Ether / IP / TCP 106.120.159.126:https > 192.168.1.10:3313 PA / Raw
246	2020-03-18 00:52:19	106.120.159.126	192.168.1.10	Https	99	Ether / IP / TCP 106.120.159.126:https > 192.168.1.10:3313 PA / Raw
247	2020-03-18 00:52:19	192.168.1.10	106.120.159.126	Https	54	Ether / IP / TCP 192.168.1.10:3313 > 106.120.159.126:https A
248	2020-03-18 00:52:19	106.120.159.126	192.168.1.10	Https	382	Ether / IP / TCP 106.120.159.126:https > 192.168.1.10:3313 PA / Raw
249	2020-03-18 00:52:19	192.168.1.10	106.120.159.126	Https	54	Ether / IP / TCP 192.168.1.10:3313 > 106.120.159.126:https A
250	2020-03-18 00:52:19	106.120.159.126	192.168.1.10	Https	60	Ether / IP / TCP 106.120.159.126:https > 192.168.1.10:3315 A / Padding
251	2020-03-18 00:52:19	106.120.159.126	192.168.1.10	Https	173	Ether / IP / TCP 106.120.159.126:https > 192.168.1.10:3315 PA / Raw
252	2020-03-18 00:52:19	106.120.159.126	192.168.1.10	Https	60	Ether / IP / TCP 106.120.159.126:https > 192.168.1.10:3315 PA / Raw
253	2020-03-18 00:52:19	106.120.159.126	192.168.1.10	Https	99	Ether / IP / TCP 106.120.159.126:https > 192.168.1.10:3315 PA / Raw
254	2020-03-18 00:52:19	192.168.1.10	106.120.159.126	Https	54	Ether / IP / TCP 192.168.1.10:3315 > 106.120.159.126:https A
255	2020-03-18 00:52:20	106.120.159.126	192.168.1.10	Https	60	Ether / IP / TCP 106.120.159.126:https > 192.168.1.10:3316 A / Padding
256	2020-03-18 00:52:20	106.120.159.126	192.168.1.10	Https	60	Ether / IP / TCP 106.120.159.126:https > 192.168.1.10:3314 A / Padding
257	2020-03-18 00:52:20	106.120.159.126	192.168.1.10	Https	173	Ether / IP / TCP 106.120.159.126:https > 192.168.1.10:3316 PA / Raw
258	2020-03-18 00:52:20	106.120.159.126	192.168.1.10	Https	105	Ether / IP / TCP 106.120.159.126:https > 192.168.1.10:3316 PA / Raw
259	2020-03-18 00:52:20	106.120.159.126	192.168.1.10	Https	173	Ether / IP / TCP 106.120.159.126:https > 192.168.1.10:3314 PA / Raw
260	2020-03-18 00:52:20	106.120.159.126	192.168.1.10	Https	60	Ether / IP / TCP 106.120.159.126:https > 192.168.1.10:3314 PA / Raw
261	2020-03-18 00:52:20	106.120.159.126	192.168.1.10	Https	99	Ether / IP / TCP 106.120.159.126:https > 192.168.1.10:3314 PA / Raw
262	2020-03-18 00:52:20	106.120.159.126	192.168.1.10	Https	60	Ether / IP / TCP 106.120.159.126:https > 192.168.1.10:3316 A / Padding
263	2020-03-18 00:52:20	192.168.1.10	106.120.159.126	Https	54	Ether / IP / TCP 192.168.1.10:3316 > 106.120.159.126:https A
264	2020-03-18 00:52:20	192.168.1.10	106.120.159.126	Https	54	Ether / IP / TCP 192.168.1.10:3314 > 106.120.159.126:https A
265	2020-03-18 00:52:20	106.120.159.126	192.168.1.10	Https	60	Ether / IP / TCP 106.120.159.126:https > 192.168.1.10:3315 A / Padding
266	2020-03-18 00:52:20	106.120.159.126	192.168.1.10	Https	60	Ether / IP / TCP 106.120.159.126:https > 192.168.1.10:3314 A / Padding
267	2020-03-18 00:52:20	106.120.159.126	192.168.1.10	Https	382	Ether / IP / TCP 106.120.159.126:https > 192.168.1.10:3316 PA / Raw
268	2020-03-18 00:52:20	106.120.159.126	192.168.1.10	Https	382	Ether / IP / TCP 106.120.159.126:https > 192.168.1.10:3315 PA / Raw
269	2020-03-18 00:52:20	192.168.1.10	106.120.159.126	Https	54	Ether / IP / TCP 192.168.1.10:3315 > 106.120.159.126:https A
270	2020-03-18 00:52:20	106.120.159.126	192.168.1.10	Https	382	Ether / IP / TCP 106.120.159.126:https > 192.168.1.10:3314 PA / Raw
271	2020-03-18 00:52:20	192.168.1.10	106.120.159.126	Https	54	Ether / IP / TCP 192.168.1.10:3314 > 106.120.159.126:https A
272	2020-03-18 00:52:20	106.120.159.126	192.168.1.10	Https	60	Ether / IP / TCP 106.120.159.126:https > 192.168.1.10:3311 A / Padding
273	2020-03-18 00:52:20	106.120.159.126	192.168.1.10	Https	382	Ether / IP / TCP 106.120.159.126:https > 192.168.1.10:3311 PA / Raw
274	2020-03-18 00:52:20	192.168.1.10	154.8.131.191	Https	91	Ether / IP / TCP 192.168.1.10:2891 > 154.8.131.191:https PA / Raw
275	2020-03-18 00:52:20	192.168.1.10	154.8.131.191	Https	54	Ether / IP / TCP 192.168.1.10:2891 > 154.8.131.191:https FA
276	2020-03-18 00:52:20	192.168.1.10	106.120.159.126	Https	54	Ether / IP / TCP 192.168.1.10:3316 > 106.120.159.126:https A
277	2020-03-18 00:52:20	192.168.1.10	154.8.131.191	Https	91	Ether / IP / TCP 192.168.1.10:icslap > 154.8.131.191:https PA / Raw
278	2020-03-18 00:52:20	192.168.1.10	154.8.131.191	Https	54	Ether / IP / TCP 192.168.1.10:icslap > 154.8.131.191:https FA
279	2020-03-18 00:52:20	192.168.1.10	106.120.159.126	Https	54	Ether / IP / TCP 192.168.1.10:3311 > 106.120.159.126:https A
280	2020-03-18 00:52:20	154.8.131.191	192.168.1.10	Https	60	Ether / IP / TCP 154.8.131.191:https > 192.168.1.10:2891 FA / Padding
281	2020-03-18 00:52:20	192.168.1.10	154.8.131.191	Https	54	Ether / IP / TCP 192.168.1.10:2891 > 154.8.131.191:https A
282	2020-03-18 00:52:20	154.8.131.191	192.168.1.10	Https	60	Ether / IP / TCP 154.8.131.191:https > 192.168.1.10:icslap FA / Padding
283	2020-03-18 00:52:20	192.168.1.10	154.8.131.191	Https	54	Ether / IP / TCP 192.168.1.10:icslap > 154.8.131.191:https A
284	2020-03-18 00:52:20	240e:d4:2e8e:df00:4882:f650:cbf9:db1d	2404:6800:4008:c03::bc	TCP	74	Ether / IPv6 / TCP 240e:d4:2e8e:df00:4882:f650:cbf9:db1d:11846 > 2404:6800:4008:c03::bc:5228 FA
285	2020-03-18 00:52:20	192.168.1.10	125.77.164.226	Https	54	Ether / IP / TCP 192.168.1.10:3307 > 125.77.164.226:https FA
286	2020-03-18 00:52:20	192.168.1.10	192.144.195.62	Https	54	Ether / IP / TCP 192.168.1.10:3308 > 192.144.195.62:https FA
287	2020-03-18 00:52:20	192.168.1.10	220.181.107.131	Https	54	Ether / IP / TCP 192.168.1.10:3309 > 220.181.107.131:https FA
288	2020-03-18 00:52:20	192.168.1.10	106.120.159.126	Https	54	Ether / IP / TCP 192.168.1.10:3312 > 106.120.159.126:https FA
289	2020-03-18 00:52:20	192.168.1.10	106.120.159.126	Https	54	Ether / IP / TCP 192.168.1.10:3313 > 106.120.159.126:https FA
290	2020-03-18 00:52:20	192.168.1.10	106.120.159.126	Https	54	Ether / IP / TCP 192.168.1.10:3316 > 106.120.159.126:https FA
291	2020-03-18 00:52:20	192.168.1.10	106.120.159.126	Https	54	Ether / IP / TCP 192.168.1.10:3315 > 106.120.159.126:https FA
292	2020-03-18 00:52:20	192.168.1.10	106.120.159.126	Https	54	Ether / IP / TCP 192.168.1.10:3314 > 106.120.159.126:https FA
293	2020-03-18 00:52:20	192.168.1.10	106.120.159.126	Https	54	Ether / IP / TCP 192.168.1.10:3311 > 106.120.159.126:https FA
294	2020-03-18 00:52:20	192.168.1.10	180.97.36.16	Https	54	Ether / IP / TCP 192.168.1.10:3310 > 180.97.36.16:https FA
295	2020-03-18 00:52:20	125.77.164.226	192.168.1.10	Https	60	Ether / IP / TCP 125.77.164.226:https > 192.168.1.10:3307 FA / Padding
296	2020-03-18 00:52:20	192.168.1.10	125.77.164.226	Https	54	Ether / IP / TCP 192.168.1.10:3307 > 125.77.164.226:https A
297	2020-03-18 00:52:20	125.77.164.226	192.168.1.10	Https	60	Ether / IP / TCP 125.77.164.226:https > 192.168.1.10:3307 FA / Padding
298	2020-03-18 00:52:20	192.168.1.10	125.77.164.226	Https	54	Ether / IP / TCP 192.168.1.10:3307 > 125.77.164.226:https A
299	2020-03-18 00:52:20	125.77.164.226	192.168.1.10	Https	60	Ether / IP / TCP 125.77.164.226:https > 192.168.1.10:3307 R / Padding
300	2020-03-18 00:52:20	180.97.36.16	192.168.1.10	Https	60	Ether / IP / TCP 180.97.36.16:https > 192.168.1.10:3310 A / Padding
301	2020-03-18 00:52:20	180.97.36.16	192.168.1.10	Https	85	Ether / IP / TCP 180.97.36.16:https > 192.168.1.10:3310 PA / Raw
302	2020-03-18 00:52:20	180.97.36.16	192.168.1.10	Https	60	Ether / IP / TCP 180.97.36.16:https > 192.168.1.10:3310 FA / Padding
303	2020-03-18 00:52:20	192.168.1.10	180.97.36.16	Https	54	Ether / IP / TCP 192.168.1.10:3310 > 180.97.36.16:https RA
304	2020-03-18 00:52:20	220.181.107.131	192.168.1.10	Https	60	Ether / IP / TCP 220.181.107.131:https > 192.168.1.10:3309 A / Padding
305	2020-03-18 00:52:20	220.181.107.131	192.168.1.10	Https	85	Ether / IP / TCP 220.181.107.131:https > 192.168.1.10:3309 PA / Raw
306	2020-03-18 00:52:20	220.181.107.131	192.168.1.10	Https	60	Ether / IP / TCP 220.181.107.131:https > 192.168.1.10:3309 FA / Padding
307	2020-03-18 00:52:20	192.168.1.10	220.181.107.131	Https	54	Ether / IP / TCP 192.168.1.10:3309 > 220.181.107.131:https RA
308	2020-03-18 00:52:20	192.144.195.62	192.168.1.10	Https	60	Ether / IP / TCP 192.144.195.62:https > 192.168.1.10:3308 FA / Padding
309	2020-03-18 00:52:20	106.120.159.126	192.168.1.10	Https	60	Ether / IP / TCP 106.120.159.126:https > 192.168.1.10:3316 A / Padding
310	2020-03-18 00:52:20	106.120.159.126	192.168.1.10	Https	85	Ether / IP / TCP 106.120.159.126:https > 192.168.1.10:3316 PA / Raw
311	2020-03-18 00:52:20	106.120.159.126	192.168.1.10	Https	60	Ether / IP / TCP 106.120.159.126:https > 192.168.1.10:3316 FA / Padding
312	2020-03-18 00:52:20	106.120.159.126	192.168.1.10	Https	60	Ether / IP / TCP 106.120.159.126:https > 192.168.1.10:3312 A / Padding
313	2020-03-18 00:52:20	106.120.159.126	192.168.1.10	Https	85	Ether / IP / TCP 106.120.159.126:https > 192.168.1.10:3312 PA / Raw
314	2020-03-18 00:52:20	106.120.159.126	192.168.1.10	Https	60	Ether / IP / TCP 106.120.159.126:https > 192.168.1.10:3312 FA / Padding
