1	2020-03-17 22:20:50	192.168.1.10	14.215.177.39	Https	54	Ether / IP / TCP 192.168.1.10:10123 > 14.215.177.39:https FA
2	2020-03-17 22:20:50	192.168.1.10	10.10.20.110	UDP	84	Ether / IP / UDP 192.168.1.10:59684 > 10.10.20.110:snmp / SNMP
3	2020-03-17 22:20:50	192.168.1.10	220.181.76.102	Http	54	Ether / IP / TCP 192.168.1.10:10100 > 220.181.76.102:http FA
4	2020-03-17 22:20:50	192.168.1.10	220.181.76.102	Http	66	Ether / IP / TCP 192.168.1.10:10125 > 220.181.76.102:http S
5	2020-03-17 22:20:50	220.181.76.102	192.168.1.10	Http	60	Ether / IP / TCP 220.181.76.102:http > 192.168.1.10:10100 A / Padding
6	2020-03-17 22:20:50	220.181.76.102	192.168.1.10	Http	66	Ether / IP / TCP 220.181.76.102:http > 192.168.1.10:10125 SA
7	2020-03-17 22:20:50	192.168.1.10	220.181.76.102	Http	54	Ether / IP / TCP 192.168.1.10:10125 > 220.181.76.102:http A
8	2020-03-17 22:20:50	192.168.1.10	220.181.76.102	Http	652	Ether / IP / TCP / HTTP / 'GET' '/fsearch?keyfrom=deskdict.screentrans.http.1.stroke&q=Realtek%20USB%20GbE%20Family%20Controller&pos=-1&doctype=xml&xmlVersion=9.1&dogVersion=1.0&client=deskdict&id=e5eaa952d53a2c94c&vendor=unknown&in=YoudaoDict_webdict_default_8.8.1.0&appVer=8.8.1.0&appZengqiang=0&abTest=0&le=en&proc=python.exe&fytype=AUTO&scrfrom=stroke' 'HTTP/1.1'
9	2020-03-17 22:20:50	220.181.76.102	192.168.1.10	Http	60	Ether / IP / TCP 220.181.76.102:http > 192.168.1.10:10125 A / Padding
10	2020-03-17 22:20:50	220.181.76.102	192.168.1.10	Http	685	Ether / IP / TCP / HTTP / 'HTTP/1.1' '200' 'OK' / Raw
11	2020-03-17 22:20:50	192.168.1.10	220.181.76.102	Http	54	Ether / IP / TCP 192.168.1.10:10125 > 220.181.76.102:http A
12	2020-03-17 22:20:50	192.168.1.10	220.181.76.82	Http	54	Ether / IP / TCP 192.168.1.10:10101 > 220.181.76.82:http FA
13	2020-03-17 22:20:51	192.168.1.10	220.181.76.82	Http	66	Ether / IP / TCP 192.168.1.10:10126 > 220.181.76.82:http S
14	2020-03-17 22:20:51	220.181.76.82	192.168.1.10	Http	60	Ether / IP / TCP 220.181.76.82:http > 192.168.1.10:10101 A / Padding
15	2020-03-17 22:20:51	220.181.76.82	192.168.1.10	Http	66	Ether / IP / TCP 220.181.76.82:http > 192.168.1.10:10126 SA
16	2020-03-17 22:20:51	192.168.1.10	220.181.76.82	Http	54	Ether / IP / TCP 192.168.1.10:10126 > 220.181.76.82:http A
17	2020-03-17 22:20:51	192.168.1.10	220.181.76.82	Http	541	Ether / IP / TCP / HTTP / 'GET' '/apps/log.html?keyfrom=deskdict.main&q=Realtek%20USB%20GbE%20Family%20Controller&timing=stroke_trans_query&type=success&rnd=1d5fc67:42cefc70&appVer=8.8.1.0&vendor=unknown&id=e5eaa952d53a2c94c&abTest=0&client=deskdict&vip=0' 'HTTP/1.1'
18	2020-03-17 22:20:51	220.181.76.82	192.168.1.10	Http	60	Ether / IP / TCP 220.181.76.82:http > 192.168.1.10:10126 A / Padding
19	2020-03-17 22:20:51	220.181.76.82	192.168.1.10	Http	282	Ether / IP / TCP / HTTP / 'HTTP/1.1' '200' 'OK'
20	2020-03-17 22:20:51	192.168.1.10	220.181.76.82	Http	54	Ether / IP / TCP 192.168.1.10:10126 > 220.181.76.82:http A
21	2020-03-17 22:20:53	fe80::f141:b4f2:11de:b126	fe80::1	DNS	102	Ether / IPv6 / UDP / DNS Qry "b'analytics.yinxiang.com.'" 
22	2020-03-17 22:20:53	fe80::1	fe80::f141:b4f2:11de:b126	DNS	175	Ether / IPv6 / UDP / DNS Ans 
23	2020-03-17 22:20:53	192.168.1.10	154.8.190.35	Https	66	Ether / IP / TCP 192.168.1.10:10127 > 154.8.190.35:https S
24	2020-03-17 22:20:53	154.8.190.35	192.168.1.10	Https	66	Ether / IP / TCP 154.8.190.35:https > 192.168.1.10:10127 SA
25	2020-03-17 22:20:53	192.168.1.10	154.8.190.35	Https	54	Ether / IP / TCP 192.168.1.10:10127 > 154.8.190.35:https A
26	2020-03-17 22:20:53	192.168.1.10	154.8.190.35	Https	237	Ether / IP / TCP 192.168.1.10:10127 > 154.8.190.35:https PA / Raw
27	2020-03-17 22:20:53	154.8.190.35	192.168.1.10	Https	60	Ether / IP / TCP 154.8.190.35:https > 192.168.1.10:10127 A / Padding
28	2020-03-17 22:20:53	154.8.190.35	192.168.1.10	Https	1486	Ether / IP / TCP 154.8.190.35:https > 192.168.1.10:10127 A / Raw
29	2020-03-17 22:20:53	154.8.190.35	192.168.1.10	Https	1486	Ether / IP / TCP 154.8.190.35:https > 192.168.1.10:10127 A / Raw
30	2020-03-17 22:20:53	192.168.1.10	154.8.190.35	Https	54	Ether / IP / TCP 192.168.1.10:10127 > 154.8.190.35:https A
31	2020-03-17 22:20:53	154.8.190.35	192.168.1.10	Https	744	Ether / IP / TCP 154.8.190.35:https > 192.168.1.10:10127 PA / Raw
32	2020-03-17 22:20:53	192.168.1.10	154.8.190.35	Https	180	Ether / IP / TCP 192.168.1.10:10127 > 154.8.190.35:https PA / Raw
33	2020-03-17 22:20:53	154.8.190.35	192.168.1.10	Https	328	Ether / IP / TCP 154.8.190.35:https > 192.168.1.10:10127 PA / Raw
34	2020-03-17 22:20:53	192.168.1.10	154.8.190.35	Https	303	Ether / IP / TCP 192.168.1.10:10127 > 154.8.190.35:https PA / Raw
35	2020-03-17 22:20:53	154.8.190.35	192.168.1.10	Https	352	Ether / IP / TCP 154.8.190.35:https > 192.168.1.10:10127 PA / Raw
36	2020-03-17 22:20:53	154.8.190.35	192.168.1.10	Https	88	Ether / IP / TCP 154.8.190.35:https > 192.168.1.10:10127 PA / Raw
37	2020-03-17 22:20:53	192.168.1.10	154.8.190.35	Https	54	Ether / IP / TCP 192.168.1.10:10127 > 154.8.190.35:https A
38	2020-03-17 22:20:53	192.168.1.10	154.8.190.35	Https	54	Ether / IP / TCP 192.168.1.10:10127 > 154.8.190.35:https FA
39	2020-03-17 22:20:53	154.8.190.35	192.168.1.10	Https	60	Ether / IP / TCP 154.8.190.35:https > 192.168.1.10:10127 FA / Padding
40	2020-03-17 22:20:53	192.168.1.10	154.8.190.35	Https	54	Ether / IP / TCP 192.168.1.10:10127 > 154.8.190.35:https A
41	2020-03-17 22:20:53	161.117.236.80	192.168.1.10	TCP	810	Ether / IP / TCP 161.117.236.80:20395 > 192.168.1.10:10093 PA / Raw
42	2020-03-17 22:20:53	192.168.1.10	161.117.236.80	TCP	54	Ether / IP / TCP 192.168.1.10:10093 > 161.117.236.80:20395 A
43	2020-03-17 22:20:54	240e:d4:2e8e:df00:4882:f650:cbf9:db1d	2401:c900:1601:161::2	TCP	98	Ether / IPv6 / TCP 240e:d4:2e8e:df00:4882:f650:cbf9:db1d:10012 > 2401:c900:1601:161::2:5938 PA / Raw
44	2020-03-17 22:20:54	2401:c900:1601:161::2	240e:d4:2e8e:df00:4882:f650:cbf9:db1d	TCP	98	Ether / IPv6 / TCP 2401:c900:1601:161::2:5938 > 240e:d4:2e8e:df00:4882:f650:cbf9:db1d:10012 PA / Raw
45	2020-03-17 22:20:54	240e:d4:2e8e:df00:4882:f650:cbf9:db1d	2401:c900:1601:161::2	TCP	74	Ether / IPv6 / TCP 240e:d4:2e8e:df00:4882:f650:cbf9:db1d:10012 > 2401:c900:1601:161::2:5938 A
46	2020-03-17 22:20:55	192.168.1.10	14.215.177.39	Https	54	Ether / IP / TCP 192.168.1.10:10115 > 14.215.177.39:https RA
47	2020-03-17 22:20:55	192.168.1.10	14.215.177.39	Https	54	Ether / IP / TCP 192.168.1.10:10123 > 14.215.177.39:https FA
48	2020-03-17 22:20:55	192.168.1.10	10.10.20.110	UDP	84	Ether / IP / UDP 192.168.1.10:59684 > 10.10.20.110:snmp / SNMP
49	2020-03-17 22:20:56	139.99.69.89	192.168.1.10	Http	60	Ether / IP / TCP 139.99.69.89:http > 192.168.1.10:12360 A / Padding
50	2020-03-17 22:20:56	192.168.1.10	139.99.69.89	Http	54	Ether / IP / TCP 192.168.1.10:12360 > 139.99.69.89:http A
51	2020-03-17 22:20:56	192.168.1.10	14.215.177.39	Https	66	Ether / IP / TCP 192.168.1.10:10128 > 14.215.177.39:https S
52	2020-03-17 22:20:56	14.215.177.39	192.168.1.10	Https	66	Ether / IP / TCP 14.215.177.39:https > 192.168.1.10:10128 SA
53	2020-03-17 22:20:56	192.168.1.10	14.215.177.39	Https	54	Ether / IP / TCP 192.168.1.10:10128 > 14.215.177.39:https A
54	2020-03-17 22:20:56	192.168.1.10	14.215.177.39	Https	54	Ether / IP / TCP 192.168.1.10:10128 > 14.215.177.39:https FA
55	2020-03-17 22:20:56	192.168.1.10	120.131.14.181	UDP	151	Ether / IP / UDP 192.168.1.10:49770 > 120.131.14.181:9402 / Raw
56	2020-03-17 22:20:56	192.168.1.10	14.215.177.39	Https	54	Ether / IP / TCP 192.168.1.10:10128 > 14.215.177.39:https FA
57	2020-03-17 22:20:56	192.168.1.10	10.10.20.110	UDP	84	Ether / IP / UDP 192.168.1.10:59684 > 10.10.20.110:snmp / SNMP
58	2020-03-17 22:20:57	192.168.1.10	14.215.177.39	Https	54	Ether / IP / TCP 192.168.1.10:10128 > 14.215.177.39:https FA
59	2020-03-17 22:20:57	fe80::f141:b4f2:11de:b126	fe80::1	ICMPv6	86	Ether / IPv6 / ICMPv6ND_NS / ICMPv6 Neighbor Discovery Option - Source Link-Layer Address 00:e0:4c:68:00:2d
60	2020-03-17 22:20:57	fe80::1	fe80::f141:b4f2:11de:b126	ICMPv6	78	Ether / IPv6 / ICMPv6 Neighbor Discovery - Neighbor Advertisement (tgt: fe80::1)
61	2020-03-17 22:20:58	fe80::1	fe80::f141:b4f2:11de:b126	ICMPv6	86	Ether / IPv6 / ICMPv6ND_NS / ICMPv6 Neighbor Discovery Option - Source Link-Layer Address 9c:d2:4b:38:91:c1
62	2020-03-17 22:20:58	fe80::f141:b4f2:11de:b126	fe80::1	ICMPv6	86	Ether / IPv6 / ICMPv6ND_NA / ICMPv6 Neighbor Discovery Option - Destination Link-Layer Address 00:e0:4c:68:00:2d
63	2020-03-17 22:20:58	192.168.1.10	14.215.177.39	Https	54	Ether / IP / TCP 192.168.1.10:10128 > 14.215.177.39:https FA
64	2020-03-17 22:20:59	fe80::1	240e:d4:2e8e:df00:4882:f650:cbf9:db1d	ICMPv6	86	Ether / IPv6 / ICMPv6ND_NS / ICMPv6 Neighbor Discovery Option - Source Link-Layer Address 9c:d2:4b:38:91:c1
65	2020-03-17 22:20:59	240e:d4:2e8e:df00:4882:f650:cbf9:db1d	fe80::1	ICMPv6	86	Ether / IPv6 / ICMPv6ND_NA / ICMPv6 Neighbor Discovery Option - Destination Link-Layer Address 00:e0:4c:68:00:2d
66	2020-03-17 22:20:59	240e:d4:2e8e:df00:4882:f650:cbf9:db1d	2401:c900:1601:161::2	TCP	98	Ether / IPv6 / TCP 240e:d4:2e8e:df00:4882:f650:cbf9:db1d:10012 > 2401:c900:1601:161::2:5938 PA / Raw
67	2020-03-17 22:21:00	2401:c900:1601:161::2	240e:d4:2e8e:df00:4882:f650:cbf9:db1d	TCP	74	Ether / IPv6 / TCP 2401:c900:1601:161::2:5938 > 240e:d4:2e8e:df00:4882:f650:cbf9:db1d:10012 A
68	2020-03-17 22:21:00	192.168.1.10	14.215.177.39	Https	54	Ether / IP / TCP 192.168.1.10:10128 > 14.215.177.39:https FA
69	2020-03-17 22:21:00	220.181.76.102	192.168.1.10	Http	60	Ether / IP / TCP 220.181.76.102:http > 192.168.1.10:10125 FA / Padding
70	2020-03-17 22:21:00	192.168.1.10	220.181.76.102	Http	54	Ether / IP / TCP 192.168.1.10:10125 > 220.181.76.102:http A
71	2020-03-17 22:21:01	220.181.76.82	192.168.1.10	Http	60	Ether / IP / TCP 220.181.76.82:http > 192.168.1.10:10126 FA / Padding
72	2020-03-17 22:21:01	192.168.1.10	220.181.76.82	Http	54	Ether / IP / TCP 192.168.1.10:10126 > 220.181.76.82:http A
73	2020-03-17 22:21:01	00:e0:4c:68:00:2d	9c:d2:4b:38:91:c1	ARP	42	Ether / ARP who has 192.168.1.1 says 192.168.1.10
74	2020-03-17 22:21:01	9c:d2:4b:38:91:c1	00:e0:4c:68:00:2d	ARP	60	Ether / ARP is at 9c:d2:4b:38:91:c1 says 192.168.1.1 / Padding
75	2020-03-17 22:21:01	192.168.1.10	10.10.20.110	UDP	84	Ether / IP / UDP 192.168.1.10:59684 > 10.10.20.110:snmp / SNMP
76	2020-03-17 22:21:02	240e:d4:2e8e:df00:4882:f650:cbf9:db1d	2404:6800:4008:c00::bc	TCP	75	Ether / IPv6 / TCP 240e:d4:2e8e:df00:4882:f650:cbf9:db1d:2055 > 2404:6800:4008:c00::bc:5228 A / Raw
77	2020-03-17 22:21:02	2404:6800:4008:c00::bc	240e:d4:2e8e:df00:4882:f650:cbf9:db1d	TCP	86	Ether / IPv6 / TCP 2404:6800:4008:c00::bc:5228 > 240e:d4:2e8e:df00:4882:f650:cbf9:db1d:2055 A
78	2020-03-17 22:21:02	192.168.1.10	10.10.20.110	UDP	84	Ether / IP / UDP 192.168.1.10:59684 > 10.10.20.110:snmp / SNMP
79	2020-03-17 22:21:05	192.168.1.10	14.215.177.39	Https	54	Ether / IP / TCP 192.168.1.10:10123 > 14.215.177.39:https RA
80	2020-03-17 22:21:05	192.168.1.10	14.215.177.39	Https	54	Ether / IP / TCP 192.168.1.10:10128 > 14.215.177.39:https FA
81	2020-03-17 22:21:06	192.168.1.10	14.215.177.39	Https	66	Ether / IP / TCP 192.168.1.10:10129 > 14.215.177.39:https S
82	2020-03-17 22:21:06	14.215.177.39	192.168.1.10	Https	66	Ether / IP / TCP 14.215.177.39:https > 192.168.1.10:10129 SA
83	2020-03-17 22:21:06	192.168.1.10	14.215.177.39	Https	54	Ether / IP / TCP 192.168.1.10:10129 > 14.215.177.39:https A
84	2020-03-17 22:21:06	192.168.1.10	14.215.177.39	Https	54	Ether / IP / TCP 192.168.1.10:10129 > 14.215.177.39:https FA
85	2020-03-17 22:21:06	139.99.69.89	192.168.1.10	Http	60	Ether / IP / TCP 139.99.69.89:http > 192.168.1.10:12360 A / Padding
86	2020-03-17 22:21:06	192.168.1.10	139.99.69.89	Http	54	Ether / IP / TCP 192.168.1.10:12360 > 139.99.69.89:http A
87	2020-03-17 22:21:06	192.168.1.10	14.215.177.39	Https	54	Ether / IP / TCP 192.168.1.10:10129 > 14.215.177.39:https FA
88	2020-03-17 22:21:07	192.168.1.10	14.215.177.39	Https	54	Ether / IP / TCP 192.168.1.10:10129 > 14.215.177.39:https FA
89	2020-03-17 22:21:07	192.168.1.10	10.10.20.110	UDP	83	Ether / IP / UDP 192.168.1.10:59684 > 10.10.20.110:snmp / SNMP
90	2020-03-17 22:21:08	192.168.1.10	14.215.177.39	Https	54	Ether / IP / TCP 192.168.1.10:10129 > 14.215.177.39:https FA
91	2020-03-17 22:21:08	192.168.1.10	10.10.20.110	UDP	83	Ether / IP / UDP 192.168.1.10:59684 > 10.10.20.110:snmp / SNMP
92	2020-03-17 22:21:09	192.168.1.10	139.99.69.89	Http	55	Ether / IP / TCP 192.168.1.10:12360 > 139.99.69.89:http A / HTTP / Raw
93	2020-03-17 22:21:09	139.99.69.89	192.168.1.10	Http	66	Ether / IP / TCP 139.99.69.89:http > 192.168.1.10:12360 A
94	2020-03-17 22:21:10	192.168.1.10	161.117.236.80	TCP	66	Ether / IP / TCP 192.168.1.10:10132 > 161.117.236.80:20395 S
95	2020-03-17 22:21:10	161.117.236.80	192.168.1.10	TCP	66	Ether / IP / TCP 161.117.236.80:20395 > 192.168.1.10:10132 SA
96	2020-03-17 22:21:10	192.168.1.10	161.117.236.80	TCP	54	Ether / IP / TCP 192.168.1.10:10132 > 161.117.236.80:20395 A
97	2020-03-17 22:21:10	192.168.1.10	161.117.236.80	TCP	786	Ether / IP / TCP 192.168.1.10:10132 > 161.117.236.80:20395 PA / Raw
98	2020-03-17 22:21:10	192.168.1.10	161.117.236.80	TCP	638	Ether / IP / TCP 192.168.1.10:10132 > 161.117.236.80:20395 PA / Raw
99	2020-03-17 22:21:10	161.117.236.80	192.168.1.10	TCP	60	Ether / IP / TCP 161.117.236.80:20395 > 192.168.1.10:10132 A / Padding
100	2020-03-17 22:21:10	161.117.236.80	192.168.1.10	TCP	60	Ether / IP / TCP 161.117.236.80:20395 > 192.168.1.10:10132 A / Padding
101	2020-03-17 22:21:10	192.168.1.10	14.215.177.39	Https	54	Ether / IP / TCP 192.168.1.10:10129 > 14.215.177.39:https FA
102	2020-03-17 22:21:10	161.117.236.80	192.168.1.10	TCP	641	Ether / IP / TCP 161.117.236.80:20395 > 192.168.1.10:10132 PA / Raw
103	2020-03-17 22:21:10	192.168.1.10	161.117.236.80	TCP	54	Ether / IP / TCP 192.168.1.10:10132 > 161.117.236.80:20395 A
104	2020-03-17 22:21:10	161.117.236.80	192.168.1.10	TCP	1183	Ether / IP / TCP 161.117.236.80:20395 > 192.168.1.10:10132 PA / Raw
105	2020-03-17 22:21:10	192.168.1.10	161.117.236.80	TCP	900	Ether / IP / TCP 192.168.1.10:10132 > 161.117.236.80:20395 PA / Raw
106	2020-03-17 22:21:10	192.168.1.10	161.117.236.80	TCP	991	Ether / IP / TCP 192.168.1.10:10132 > 161.117.236.80:20395 PA / Raw
107	2020-03-17 22:21:11	161.117.236.80	192.168.1.10	TCP	60	Ether / IP / TCP 161.117.236.80:20395 > 192.168.1.10:10132 A / Padding
108	2020-03-17 22:21:11	161.117.236.80	192.168.1.10	TCP	60	Ether / IP / TCP 161.117.236.80:20395 > 192.168.1.10:10132 A / Padding
109	2020-03-17 22:21:11	161.117.236.80	192.168.1.10	TCP	656	Ether / IP / TCP 161.117.236.80:20395 > 192.168.1.10:10132 PA / Raw
110	2020-03-17 22:21:11	192.168.1.10	161.117.236.80	TCP	459	Ether / IP / TCP 192.168.1.10:10132 > 161.117.236.80:20395 PA / Raw
111	2020-03-17 22:21:11	161.117.236.80	192.168.1.10	TCP	60	Ether / IP / TCP 161.117.236.80:20395 > 192.168.1.10:10132 A / Padding
112	2020-03-17 22:21:11	192.168.1.10	140.82.113.25	Https	55	Ether / IP / TCP 192.168.1.10:9423 > 140.82.113.25:https A / Raw
113	2020-03-17 22:21:12	140.82.113.25	192.168.1.10	Https	66	Ether / IP / TCP 140.82.113.25:https > 192.168.1.10:9423 A
114	2020-03-17 22:21:12	192.168.1.10	220.181.76.102	Http	54	Ether / IP / TCP 192.168.1.10:10125 > 220.181.76.102:http FA
115	2020-03-17 22:21:12	192.168.1.10	220.181.76.102	Http	66	Ether / IP / TCP 192.168.1.10:10133 > 220.181.76.102:http S
116	2020-03-17 22:21:12	220.181.76.102	192.168.1.10	Http	66	Ether / IP / TCP 220.181.76.102:http > 192.168.1.10:10133 SA
117	2020-03-17 22:21:12	220.181.76.102	192.168.1.10	Http	60	Ether / IP / TCP 220.181.76.102:http > 192.168.1.10:10125 A / Padding
118	2020-03-17 22:21:12	192.168.1.10	220.181.76.102	Http	54	Ether / IP / TCP 192.168.1.10:10133 > 220.181.76.102:http A
119	2020-03-17 22:21:12	192.168.1.10	220.181.76.102	Http	622	Ether / IP / TCP / HTTP / 'GET' '/fsearch?keyfrom=deskdict.screentrans.http.1.stroke&q=response&pos=-1&doctype=xml&xmlVersion=9.1&dogVersion=1.0&client=deskdict&id=e5eaa952d53a2c94c&vendor=unknown&in=YoudaoDict_webdict_default_8.8.1.0&appVer=8.8.1.0&appZengqiang=0&abTest=0&le=en&proc=pycharm64.exe&fytype=AUTO&scrfrom=stroke' 'HTTP/1.1'
120	2020-03-17 22:21:13	192.168.1.10	220.181.76.82	Http	54	Ether / IP / TCP 192.168.1.10:10126 > 220.181.76.82:http FA
121	2020-03-17 22:21:13	192.168.1.10	220.181.76.82	Http	66	Ether / IP / TCP 192.168.1.10:10134 > 220.181.76.82:http S
122	2020-03-17 22:21:13	220.181.76.102	192.168.1.10	Http	60	Ether / IP / TCP 220.181.76.102:http > 192.168.1.10:10133 A / Padding
123	2020-03-17 22:21:13	220.181.76.102	192.168.1.10	Http	1506	Ether / IP / TCP / HTTP / 'HTTP/1.1' '200' 'OK' / Raw
124	2020-03-17 22:21:13	220.181.76.102	192.168.1.10	Http	77	Ether / IP / TCP 220.181.76.102:http > 192.168.1.10:10133 PA / HTTP / Raw
125	2020-03-17 22:21:13	192.168.1.10	220.181.76.102	Http	54	Ether / IP / TCP 192.168.1.10:10133 > 220.181.76.102:http A
126	2020-03-17 22:21:13	220.181.76.82	192.168.1.10	Http	66	Ether / IP / TCP 220.181.76.82:http > 192.168.1.10:10134 SA
127	2020-03-17 22:21:13	220.181.76.82	192.168.1.10	Http	60	Ether / IP / TCP 220.181.76.82:http > 192.168.1.10:10126 A / Padding
128	2020-03-17 22:21:13	192.168.1.10	220.181.76.82	Http	54	Ether / IP / TCP 192.168.1.10:10134 > 220.181.76.82:http A
129	2020-03-17 22:21:13	192.168.1.10	220.181.76.82	Http	508	Ether / IP / TCP / HTTP / 'GET' '/apps/log.html?keyfrom=deskdict.main&q=response&timing=stroke_trans_query&type=success&rnd=1d5fc67:4fee3560&appVer=8.8.1.0&vendor=unknown&id=e5eaa952d53a2c94c&abTest=0&client=deskdict&vip=0' 'HTTP/1.1'
130	2020-03-17 22:21:13	192.168.1.10	220.181.76.82	Http	66	Ether / IP / TCP 192.168.1.10:10135 > 220.181.76.82:http S
131	2020-03-17 22:21:13	220.181.76.82	192.168.1.10	Http	60	Ether / IP / TCP 220.181.76.82:http > 192.168.1.10:10134 A / Padding
132	2020-03-17 22:21:13	220.181.76.82	192.168.1.10	Http	282	Ether / IP / TCP / HTTP / 'HTTP/1.1' '200' 'OK'
133	2020-03-17 22:21:13	192.168.1.10	220.181.76.82	Http	54	Ether / IP / TCP 192.168.1.10:10134 > 220.181.76.82:http A
134	2020-03-17 22:21:13	220.181.76.82	192.168.1.10	Http	66	Ether / IP / TCP 220.181.76.82:http > 192.168.1.10:10135 SA
135	2020-03-17 22:21:13	192.168.1.10	220.181.76.82	Http	54	Ether / IP / TCP 192.168.1.10:10135 > 220.181.76.82:http A
136	2020-03-17 22:21:13	192.168.1.10	220.181.76.82	Http	508	Ether / IP / TCP / HTTP / 'GET' '/apps/log.html?keyfrom=deskdict.main&q=response&timing=stroke_trans_query&type=success&rnd=1d5fc67:4ff70f00&appVer=8.8.1.0&vendor=unknown&id=e5eaa952d53a2c94c&abTest=0&client=deskdict&vip=0' 'HTTP/1.1'
137	2020-03-17 22:21:13	220.181.76.82	192.168.1.10	Http	60	Ether / IP / TCP 220.181.76.82:http > 192.168.1.10:10135 A / Padding
138	2020-03-17 22:21:13	220.181.76.82	192.168.1.10	Http	282	Ether / IP / TCP / HTTP / 'HTTP/1.1' '200' 'OK'
139	2020-03-17 22:21:13	192.168.1.10	220.181.76.82	Http	54	Ether / IP / TCP 192.168.1.10:10135 > 220.181.76.82:http A
140	2020-03-17 22:21:13	192.168.1.10	183.36.108.34	TCP	66	Ether / IP / TCP 192.168.1.10:10136 > 183.36.108.34:36688 S
141	2020-03-17 22:21:13	183.36.108.34	192.168.1.10	TCP	66	Ether / IP / TCP 183.36.108.34:36688 > 192.168.1.10:10136 SA
142	2020-03-17 22:21:13	192.168.1.10	183.36.108.34	TCP	54	Ether / IP / TCP 192.168.1.10:10136 > 183.36.108.34:36688 A
143	2020-03-17 22:21:13	192.168.1.10	183.36.108.34	TCP	282	Ether / IP / TCP 192.168.1.10:10136 > 183.36.108.34:36688 PA / Raw
144	2020-03-17 22:21:13	183.36.108.34	192.168.1.10	TCP	60	Ether / IP / TCP 183.36.108.34:36688 > 192.168.1.10:10136 A / Padding
145	2020-03-17 22:21:13	183.36.108.34	192.168.1.10	TCP	74	Ether / IP / TCP 183.36.108.34:36688 > 192.168.1.10:10136 PA / Raw
146	2020-03-17 22:21:13	192.168.1.10	183.36.108.34	TCP	54	Ether / IP / TCP 192.168.1.10:10136 > 183.36.108.34:36688 A
147	2020-03-17 22:21:13	161.117.236.80	192.168.1.10	TCP	1453	Ether / IP / TCP 161.117.236.80:20395 > 192.168.1.10:10132 PA / Raw
148	2020-03-17 22:21:13	192.168.1.10	161.117.236.80	TCP	54	Ether / IP / TCP 192.168.1.10:10132 > 161.117.236.80:20395 A
149	2020-03-17 22:21:13	192.168.1.10	10.10.20.110	UDP	83	Ether / IP / UDP 192.168.1.10:59684 > 10.10.20.110:snmp / SNMP
150	2020-03-17 22:21:14	192.168.1.10	183.36.108.34	TCP	54	Ether / IP / TCP 192.168.1.10:10136 > 183.36.108.34:36688 FA
151	2020-03-17 22:21:14	9c:d2:4b:38:91:c1	00:e0:4c:68:00:2d	ARP	60	Ether / ARP who has 192.168.1.10 says 192.168.1.1 / Padding
152	2020-03-17 22:21:14	00:e0:4c:68:00:2d	9c:d2:4b:38:91:c1	ARP	42	Ether / ARP is at 00:e0:4c:68:00:2d says 192.168.1.10
153	2020-03-17 22:21:14	183.36.108.34	192.168.1.10	TCP	60	Ether / IP / TCP 183.36.108.34:36688 > 192.168.1.10:10136 FA / Padding
154	2020-03-17 22:21:14	192.168.1.10	183.36.108.34	TCP	54	Ether / IP / TCP 192.168.1.10:10136 > 183.36.108.34:36688 A
155	2020-03-17 22:21:14	192.168.1.10	10.10.20.110	UDP	83	Ether / IP / UDP 192.168.1.10:59684 > 10.10.20.110:snmp / SNMP
156	2020-03-17 22:21:15	192.168.1.10	14.215.177.39	Https	54	Ether / IP / TCP 192.168.1.10:10128 > 14.215.177.39:https RA
157	2020-03-17 22:21:15	192.168.1.10	161.117.236.80	TCP	54	Ether / IP / TCP 192.168.1.10:10132 > 161.117.236.80:20395 FA
158	2020-03-17 22:21:15	192.168.1.10	14.215.177.39	Https	54	Ether / IP / TCP 192.168.1.10:10129 > 14.215.177.39:https FA
159	2020-03-17 22:21:15	161.117.236.80	192.168.1.10	TCP	60	Ether / IP / TCP 161.117.236.80:20395 > 192.168.1.10:10132 A / Padding
160	2020-03-17 22:21:15	161.117.236.80	192.168.1.10	TCP	60	Ether / IP / TCP 161.117.236.80:20395 > 192.168.1.10:10132 FA / Padding
161	2020-03-17 22:21:15	192.168.1.10	161.117.236.80	TCP	54	Ether / IP / TCP 192.168.1.10:10132 > 161.117.236.80:20395 A
162	2020-03-17 22:21:15	192.168.1.10	239.255.255.250	UDP	216	Ether / IP / UDP 192.168.1.10:60184 > 239.255.255.250:ssdp / Raw
163	2020-03-17 22:21:16	192.168.1.10	14.215.177.39	Https	66	Ether / IP / TCP 192.168.1.10:10142 > 14.215.177.39:https S
164	2020-03-17 22:21:16	14.215.177.39	192.168.1.10	Https	66	Ether / IP / TCP 14.215.177.39:https > 192.168.1.10:10142 SA
165	2020-03-17 22:21:16	192.168.1.10	14.215.177.39	Https	54	Ether / IP / TCP 192.168.1.10:10142 > 14.215.177.39:https A
166	2020-03-17 22:21:16	192.168.1.10	14.215.177.39	Https	54	Ether / IP / TCP 192.168.1.10:10142 > 14.215.177.39:https FA
167	2020-03-17 22:21:16	192.168.1.10	14.215.177.39	Https	54	Ether / IP / TCP 192.168.1.10:10142 > 14.215.177.39:https FA
168	2020-03-17 22:21:16	192.168.1.10	239.255.255.250	UDP	216	Ether / IP / UDP 192.168.1.10:60184 > 239.255.255.250:ssdp / Raw
169	2020-03-17 22:21:17	192.168.1.10	14.215.177.39	Https	54	Ether / IP / TCP 192.168.1.10:10142 > 14.215.177.39:https FA
170	2020-03-17 22:21:17	192.168.1.10	239.255.255.250	UDP	216	Ether / IP / UDP 192.168.1.10:60184 > 239.255.255.250:ssdp / Raw
171	2020-03-17 22:21:18	192.168.1.10	14.215.177.39	Https	54	Ether / IP / TCP 192.168.1.10:10142 > 14.215.177.39:https FA
172	2020-03-17 22:21:18	192.168.1.10	239.255.255.250	UDP	216	Ether / IP / UDP 192.168.1.10:60184 > 239.255.255.250:ssdp / Raw
173	2020-03-17 22:21:19	192.168.1.10	183.36.108.34	TCP	66	Ether / IP / TCP 192.168.1.10:10143 > 183.36.108.34:36688 S
174	2020-03-17 22:21:19	183.36.108.34	192.168.1.10	TCP	66	Ether / IP / TCP 183.36.108.34:36688 > 192.168.1.10:10143 SA
175	2020-03-17 22:21:19	192.168.1.10	183.36.108.34	TCP	54	Ether / IP / TCP 192.168.1.10:10143 > 183.36.108.34:36688 A
176	2020-03-17 22:21:19	192.168.1.10	183.36.108.34	TCP	282	Ether / IP / TCP 192.168.1.10:10143 > 183.36.108.34:36688 PA / Raw
177	2020-03-17 22:21:19	192.168.1.10	10.10.20.110	UDP	83	Ether / IP / UDP 192.168.1.10:59684 > 10.10.20.110:snmp / SNMP
178	2020-03-17 22:21:19	183.36.108.34	192.168.1.10	TCP	60	Ether / IP / TCP 183.36.108.34:36688 > 192.168.1.10:10143 A / Padding
179	2020-03-17 22:21:19	183.36.108.34	192.168.1.10	TCP	74	Ether / IP / TCP 183.36.108.34:36688 > 192.168.1.10:10143 PA / Raw
180	2020-03-17 22:21:19	192.168.1.10	183.36.108.34	TCP	54	Ether / IP / TCP 192.168.1.10:10143 > 183.36.108.34:36688 A
181	2020-03-17 22:21:20	140.82.113.25	192.168.1.10	Https	78	Ether / IP / TCP 140.82.113.25:https > 192.168.1.10:9423 PA / Raw
182	2020-03-17 22:21:20	192.168.1.10	140.82.113.25	Https	82	Ether / IP / TCP 192.168.1.10:9423 > 140.82.113.25:https PA / Raw
183	2020-03-17 22:21:20	192.168.1.10	14.215.177.39	Https	54	Ether / IP / TCP 192.168.1.10:10142 > 14.215.177.39:https FA
184	2020-03-17 22:21:20	192.168.1.10	10.10.20.110	UDP	83	Ether / IP / UDP 192.168.1.10:59684 > 10.10.20.110:snmp / SNMP
185	2020-03-17 22:21:20	192.168.1.10	183.36.108.34	TCP	54	Ether / IP / TCP 192.168.1.10:10143 > 183.36.108.34:36688 FA
186	2020-03-17 22:21:20	183.36.108.34	192.168.1.10	TCP	60	Ether / IP / TCP 183.36.108.34:36688 > 192.168.1.10:10143 FA / Padding
187	2020-03-17 22:21:20	192.168.1.10	183.36.108.34	TCP	54	Ether / IP / TCP 192.168.1.10:10143 > 183.36.108.34:36688 A
188	2020-03-17 22:21:21	192.168.1.10	140.82.113.25	Https	82	Ether / IP / TCP 192.168.1.10:9423 > 140.82.113.25:https PA / Raw
189	2020-03-17 22:21:21	140.82.113.25	192.168.1.10	Https	66	Ether / IP / TCP 140.82.113.25:https > 192.168.1.10:9423 A
190	2020-03-17 22:21:21	192.168.1.10	10.10.20.110	UDP	120	Ether / IP / UDP 192.168.1.10:59684 > 10.10.20.110:snmp / SNMP
191	2020-03-17 22:21:23	220.181.76.102	192.168.1.10	Http	60	Ether / IP / TCP 220.181.76.102:http > 192.168.1.10:10133 FA / Padding
192	2020-03-17 22:21:23	192.168.1.10	220.181.76.102	Http	54	Ether / IP / TCP 192.168.1.10:10133 > 220.181.76.102:http A
193	2020-03-17 22:21:23	220.181.76.82	192.168.1.10	Http	60	Ether / IP / TCP 220.181.76.82:http > 192.168.1.10:10134 FA / Padding
194	2020-03-17 22:21:23	192.168.1.10	220.181.76.82	Http	54	Ether / IP / TCP 192.168.1.10:10134 > 220.181.76.82:http A
195	2020-03-17 22:21:23	220.181.76.82	192.168.1.10	Http	60	Ether / IP / TCP 220.181.76.82:http > 192.168.1.10:10135 FA / Padding
196	2020-03-17 22:21:23	192.168.1.10	220.181.76.82	Http	54	Ether / IP / TCP 192.168.1.10:10135 > 220.181.76.82:http A
197	2020-03-17 22:21:23	fe80::f141:b4f2:11de:b126	fe80::1	DNS	102	Ether / IPv6 / UDP / DNS Qry "b'analytics.yinxiang.com.'" 
198	2020-03-17 22:21:23	fe80::1	fe80::f141:b4f2:11de:b126	DNS	175	Ether / IPv6 / UDP / DNS Ans 
199	2020-03-17 22:21:23	192.168.1.10	154.8.190.35	Https	66	Ether / IP / TCP 192.168.1.10:10144 > 154.8.190.35:https S
200	2020-03-17 22:21:23	154.8.190.35	192.168.1.10	Https	66	Ether / IP / TCP 154.8.190.35:https > 192.168.1.10:10144 SA
201	2020-03-17 22:21:23	192.168.1.10	154.8.190.35	Https	54	Ether / IP / TCP 192.168.1.10:10144 > 154.8.190.35:https A
202	2020-03-17 22:21:23	192.168.1.10	154.8.190.35	Https	237	Ether / IP / TCP 192.168.1.10:10144 > 154.8.190.35:https PA / Raw
203	2020-03-17 22:21:23	154.8.190.35	192.168.1.10	Https	60	Ether / IP / TCP 154.8.190.35:https > 192.168.1.10:10144 A / Padding
204	2020-03-17 22:21:23	154.8.190.35	192.168.1.10	Https	1486	Ether / IP / TCP 154.8.190.35:https > 192.168.1.10:10144 A / Raw
205	2020-03-17 22:21:23	154.8.190.35	192.168.1.10	Https	1486	Ether / IP / TCP 154.8.190.35:https > 192.168.1.10:10144 A / Raw
206	2020-03-17 22:21:23	154.8.190.35	192.168.1.10	Https	744	Ether / IP / TCP 154.8.190.35:https > 192.168.1.10:10144 PA / Raw
207	2020-03-17 22:21:23	192.168.1.10	154.8.190.35	Https	54	Ether / IP / TCP 192.168.1.10:10144 > 154.8.190.35:https A
208	2020-03-17 22:21:23	192.168.1.10	154.8.190.35	Https	180	Ether / IP / TCP 192.168.1.10:10144 > 154.8.190.35:https PA / Raw
209	2020-03-17 22:21:23	154.8.190.35	192.168.1.10	Https	328	Ether / IP / TCP 154.8.190.35:https > 192.168.1.10:10144 PA / Raw
210	2020-03-17 22:21:23	192.168.1.10	154.8.190.35	Https	303	Ether / IP / TCP 192.168.1.10:10144 > 154.8.190.35:https PA / Raw
211	2020-03-17 22:21:23	154.8.190.35	192.168.1.10	Https	352	Ether / IP / TCP 154.8.190.35:https > 192.168.1.10:10144 PA / Raw
212	2020-03-17 22:21:23	154.8.190.35	192.168.1.10	Https	88	Ether / IP / TCP 154.8.190.35:https > 192.168.1.10:10144 PA / Raw
213	2020-03-17 22:21:23	192.168.1.10	154.8.190.35	Https	54	Ether / IP / TCP 192.168.1.10:10144 > 154.8.190.35:https A
214	2020-03-17 22:21:23	192.168.1.10	154.8.190.35	Https	54	Ether / IP / TCP 192.168.1.10:10144 > 154.8.190.35:https FA
215	2020-03-17 22:21:23	154.8.190.35	192.168.1.10	Https	60	Ether / IP / TCP 154.8.190.35:https > 192.168.1.10:10144 FA / Padding
216	2020-03-17 22:21:23	192.168.1.10	154.8.190.35	Https	54	Ether / IP / TCP 192.168.1.10:10144 > 154.8.190.35:https A
217	2020-03-17 22:21:24	192.168.1.10	54.223.180.103	Http	54	Ether / IP / TCP 192.168.1.10:10082 > 54.223.180.103:http FA
218	2020-03-17 22:21:24	192.168.1.10	54.223.180.103	Http	66	Ether / IP / TCP 192.168.1.10:10145 > 54.223.180.103:http S
219	2020-03-17 22:21:24	54.223.180.103	192.168.1.10	Http	60	Ether / IP / TCP 54.223.180.103:http > 192.168.1.10:10082 A / Padding
220	2020-03-17 22:21:24	54.223.180.103	192.168.1.10	Http	66	Ether / IP / TCP 54.223.180.103:http > 192.168.1.10:10145 SA
221	2020-03-17 22:21:24	192.168.1.10	54.223.180.103	Http	54	Ether / IP / TCP 192.168.1.10:10145 > 54.223.180.103:http A
222	2020-03-17 22:21:24	192.168.1.10	54.223.180.103	Http	426	Ether / IP / TCP / HTTP / 'GET' '/message/updateTime?tags=commontags&updateTime=d751713988987e9331980363e24189ce1544026800519&serviceVersion=1.1.2.627' 'HTTP/1.1' / Raw
223	2020-03-17 22:21:24	54.223.180.103	192.168.1.10	Http	60	Ether / IP / TCP 54.223.180.103:http > 192.168.1.10:10145 A / Padding
224	2020-03-17 22:21:24	54.223.180.103	192.168.1.10	Http	151	Ether / IP / TCP / HTTP / 'HTTP/1.1' '200' 'OK'
225	2020-03-17 22:21:24	192.168.1.10	54.223.180.103	Http	54	Ether / IP / TCP 192.168.1.10:10145 > 54.223.180.103:http A
226	2020-03-17 22:21:25	192.168.1.10	14.215.177.39	Https	54	Ether / IP / TCP 192.168.1.10:10129 > 14.215.177.39:https RA
227	2020-03-17 22:21:25	192.168.1.10	14.215.177.39	Https	54	Ether / IP / TCP 192.168.1.10:10142 > 14.215.177.39:https FA
228	2020-03-17 22:21:25	192.168.1.10	10.10.20.110	UDP	83	Ether / IP / UDP 192.168.1.10:59684 > 10.10.20.110:snmp / SNMP
229	2020-03-17 22:21:26	192.168.1.10	140.82.113.25	Https	55	Ether / IP / TCP 192.168.1.10:9647 > 140.82.113.25:https A / Raw
230	2020-03-17 22:21:26	192.168.1.10	14.215.177.39	Https	66	Ether / IP / TCP 192.168.1.10:10146 > 14.215.177.39:https S
231	2020-03-17 22:21:26	14.215.177.39	192.168.1.10	Https	66	Ether / IP / TCP 14.215.177.39:https > 192.168.1.10:10146 SA
232	2020-03-17 22:21:26	192.168.1.10	14.215.177.39	Https	54	Ether / IP / TCP 192.168.1.10:10146 > 14.215.177.39:https A
233	2020-03-17 22:21:26	192.168.1.10	14.215.177.39	Https	54	Ether / IP / TCP 192.168.1.10:10146 > 14.215.177.39:https FA
234	2020-03-17 22:21:26	140.82.113.25	192.168.1.10	Https	66	Ether / IP / TCP 140.82.113.25:https > 192.168.1.10:9647 A
235	2020-03-17 22:21:26	192.168.1.10	14.215.177.39	Https	54	Ether / IP / TCP 192.168.1.10:10146 > 14.215.177.39:https FA
236	2020-03-17 22:21:26	192.168.1.10	10.10.20.110	UDP	83	Ether / IP / UDP 192.168.1.10:59684 > 10.10.20.110:snmp / SNMP
237	2020-03-17 22:21:27	192.168.1.10	14.215.177.39	Https	54	Ether / IP / TCP 192.168.1.10:10146 > 14.215.177.39:https FA
238	2020-03-17 22:21:28	192.168.1.10	14.215.177.39	Https	54	Ether / IP / TCP 192.168.1.10:10146 > 14.215.177.39:https FA
239	2020-03-17 22:21:28	fe80::f141:b4f2:11de:b126	fe80::1	ICMPv6	86	Ether / IPv6 / ICMPv6ND_NS / ICMPv6 Neighbor Discovery Option - Source Link-Layer Address 00:e0:4c:68:00:2d
240	2020-03-17 22:21:28	fe80::1	fe80::f141:b4f2:11de:b126	ICMPv6	78	Ether / IPv6 / ICMPv6 Neighbor Discovery - Neighbor Advertisement (tgt: fe80::1)
241	2020-03-17 22:21:28	fe80::1	fe80::f141:b4f2:11de:b126	ICMPv6	86	Ether / IPv6 / ICMPv6ND_NS / ICMPv6 Neighbor Discovery Option - Source Link-Layer Address 9c:d2:4b:38:91:c1
242	2020-03-17 22:21:28	fe80::f141:b4f2:11de:b126	fe80::1	ICMPv6	86	Ether / IPv6 / ICMPv6ND_NA / ICMPv6 Neighbor Discovery Option - Destination Link-Layer Address 00:e0:4c:68:00:2d
243	2020-03-17 22:21:30	192.168.1.10	161.117.236.80	TCP	66	Ether / IP / TCP 192.168.1.10:10149 > 161.117.236.80:20395 S
244	2020-03-17 22:21:30	161.117.236.80	192.168.1.10	TCP	66	Ether / IP / TCP 161.117.236.80:20395 > 192.168.1.10:10149 SA
245	2020-03-17 22:21:30	192.168.1.10	161.117.236.80	TCP	54	Ether / IP / TCP 192.168.1.10:10149 > 161.117.236.80:20395 A
246	2020-03-17 22:21:30	192.168.1.10	161.117.236.80	TCP	336	Ether / IP / TCP 192.168.1.10:10149 > 161.117.236.80:20395 PA / Raw
247	2020-03-17 22:21:30	192.168.1.10	161.117.236.80	TCP	939	Ether / IP / TCP 192.168.1.10:10149 > 161.117.236.80:20395 PA / Raw
248	2020-03-17 22:21:30	161.117.236.80	192.168.1.10	TCP	60	Ether / IP / TCP 161.117.236.80:20395 > 192.168.1.10:10149 A / Padding
249	2020-03-17 22:21:30	161.117.236.80	192.168.1.10	TCP	60	Ether / IP / TCP 161.117.236.80:20395 > 192.168.1.10:10149 A / Padding
250	2020-03-17 22:21:30	192.168.1.10	14.215.177.39	Https	54	Ether / IP / TCP 192.168.1.10:10146 > 14.215.177.39:https FA
251	2020-03-17 22:21:31	161.117.236.80	192.168.1.10	TCP	1432	Ether / IP / TCP 161.117.236.80:20395 > 192.168.1.10:10149 PA / Raw
252	2020-03-17 22:21:31	192.168.1.10	161.117.236.80	TCP	54	Ether / IP / TCP 192.168.1.10:10149 > 161.117.236.80:20395 A
253	2020-03-17 22:21:31	192.168.1.10	10.10.20.110	UDP	120	Ether / IP / UDP 192.168.1.10:59684 > 10.10.20.110:snmp / SNMP
254	2020-03-17 22:21:31	161.117.236.80	192.168.1.10	TCP	541	Ether / IP / TCP 161.117.236.80:20395 > 192.168.1.10:10149 PA / Raw
255	2020-03-17 22:21:31	192.168.1.10	161.117.236.80	TCP	279	Ether / IP / TCP 192.168.1.10:10149 > 161.117.236.80:20395 PA / Raw
256	2020-03-17 22:21:31	192.168.1.10	161.117.236.80	TCP	1018	Ether / IP / TCP 192.168.1.10:10149 > 161.117.236.80:20395 PA / Raw
257	2020-03-17 22:21:31	161.117.236.80	192.168.1.10	TCP	60	Ether / IP / TCP 161.117.236.80:20395 > 192.168.1.10:10149 A / Padding
258	2020-03-17 22:21:31	161.117.236.80	192.168.1.10	TCP	60	Ether / IP / TCP 161.117.236.80:20395 > 192.168.1.10:10149 A / Padding
259	2020-03-17 22:21:32	161.117.236.80	192.168.1.10	TCP	1506	Ether / IP / TCP 161.117.236.80:20395 > 192.168.1.10:10149 PA / Raw
