1	2020-03-18 01:00:46	192.168.1.10	14.215.177.39	Https	66	Ether / IP / TCP 192.168.1.10:4391 > 14.215.177.39:https S
2	2020-03-18 01:00:46	14.215.177.39	192.168.1.10	Https	66	Ether / IP / TCP 14.215.177.39:https > 192.168.1.10:4391 SA
3	2020-03-18 01:00:46	192.168.1.10	14.215.177.39	Https	54	Ether / IP / TCP 192.168.1.10:4391 > 14.215.177.39:https A
4	2020-03-18 01:00:46	192.168.1.10	14.215.177.39	Https	54	Ether / IP / TCP 192.168.1.10:4391 > 14.215.177.39:https FA
5	2020-03-18 01:00:46	192.168.1.10	172.217.160.78	Https	66	Ether / IP / TCP 192.168.1.10:4383 > 172.217.160.78:https S
6	2020-03-18 01:00:46	192.168.1.10	14.215.177.39	Https	54	Ether / IP / TCP 192.168.1.10:4391 > 14.215.177.39:https FA
7	2020-03-18 01:00:46	192.168.1.10	172.217.160.78	Https	66	Ether / IP / TCP 192.168.1.10:4384 > 172.217.160.78:https S
8	2020-03-18 01:00:46	192.168.1.10	47.244.15.210	TCP	66	Ether / IP / TCP 192.168.1.10:4385 > 47.244.15.210:20395 S
9	2020-03-18 01:00:47	192.168.1.10	14.215.177.39	Https	54	Ether / IP / TCP 192.168.1.10:4391 > 14.215.177.39:https FA
10	2020-03-18 01:00:47	192.168.1.10	130.198.91.107	Https	78	Ether / IP / TCP 192.168.1.10:10273 > 130.198.91.107:https PA / Raw
11	2020-03-18 01:00:48	240e:d4:2e8e:df00:4882:f650:cbf9:db1d	240e:ff:f101:10::11a	Http	477	Ether / IPv6 / TCP 240e:d4:2e8e:df00:4882:f650:cbf9:db1d:2012 > 240e:ff:f101:10::11a:http PA / HTTP / Raw
12	2020-03-18 01:00:48	240e:ff:f101:10::11a	240e:d4:2e8e:df00:4882:f650:cbf9:db1d	Http	164	Ether / IPv6 / TCP 240e:ff:f101:10::11a:http > 240e:d4:2e8e:df00:4882:f650:cbf9:db1d:2012 PA / HTTP / Raw
13	2020-03-18 01:00:48	192.168.1.10	14.215.177.39	Https	54	Ether / IP / TCP 192.168.1.10:4391 > 14.215.177.39:https FA
14	2020-03-18 01:00:48	240e:d4:2e8e:df00:4882:f650:cbf9:db1d	240e:ff:f101:10::11a	Http	74	Ether / IPv6 / TCP 240e:d4:2e8e:df00:4882:f650:cbf9:db1d:2012 > 240e:ff:f101:10::11a:http A
15	2020-03-18 01:00:48	192.168.1.10	130.198.91.107	Https	78	Ether / IP / TCP 192.168.1.10:10273 > 130.198.91.107:https PA / Raw
16	2020-03-18 01:00:48	192.168.1.10	10.10.20.110	UDP	84	Ether / IP / UDP 192.168.1.10:59684 > 10.10.20.110:snmp / SNMP
17	2020-03-18 01:00:48	130.198.91.107	192.168.1.10	Https	78	Ether / IP / TCP 130.198.91.107:https > 192.168.1.10:10273 PA / Raw
18	2020-03-18 01:00:48	192.168.1.10	130.198.91.107	Https	54	Ether / IP / TCP 192.168.1.10:10273 > 130.198.91.107:https A
19	2020-03-18 01:00:48	130.198.91.107	192.168.1.10	Https	66	Ether / IP / TCP 130.198.91.107:https > 192.168.1.10:10273 A
20	2020-03-18 01:00:48	192.168.1.10	183.36.108.34	TCP	66	Ether / IP / TCP 192.168.1.10:4392 > 183.36.108.34:36688 S
21	2020-03-18 01:00:48	183.36.108.34	192.168.1.10	TCP	66	Ether / IP / TCP 183.36.108.34:36688 > 192.168.1.10:4392 SA
22	2020-03-18 01:00:48	192.168.1.10	183.36.108.34	TCP	54	Ether / IP / TCP 192.168.1.10:4392 > 183.36.108.34:36688 A
23	2020-03-18 01:00:48	192.168.1.10	183.36.108.34	TCP	282	Ether / IP / TCP 192.168.1.10:4392 > 183.36.108.34:36688 PA / Raw
24	2020-03-18 01:00:48	183.36.108.34	192.168.1.10	TCP	60	Ether / IP / TCP 183.36.108.34:36688 > 192.168.1.10:4392 A / Padding
25	2020-03-18 01:00:48	183.36.108.34	192.168.1.10	TCP	74	Ether / IP / TCP 183.36.108.34:36688 > 192.168.1.10:4392 PA / Raw
26	2020-03-18 01:00:48	192.168.1.10	183.36.108.34	TCP	282	Ether / IP / TCP 192.168.1.10:4392 > 183.36.108.34:36688 PA / Raw
27	2020-03-18 01:00:48	183.36.108.34	192.168.1.10	TCP	74	Ether / IP / TCP 183.36.108.34:36688 > 192.168.1.10:4392 PA / Raw
28	2020-03-18 01:00:48	192.168.1.10	183.36.108.34	TCP	54	Ether / IP / TCP 192.168.1.10:4392 > 183.36.108.34:36688 A
29	2020-03-18 01:00:49	192.168.1.10	10.10.20.110	UDP	84	Ether / IP / UDP 192.168.1.10:59684 > 10.10.20.110:snmp / SNMP
30	2020-03-18 01:00:49	192.168.1.10	47.244.15.210	TCP	66	Ether / IP / TCP 192.168.1.10:4393 > 47.244.15.210:20395 S
31	2020-03-18 01:00:49	192.168.1.10	183.36.108.34	TCP	54	Ether / IP / TCP 192.168.1.10:4392 > 183.36.108.34:36688 FA
32	2020-03-18 01:00:49	183.36.108.34	192.168.1.10	TCP	60	Ether / IP / TCP 183.36.108.34:36688 > 192.168.1.10:4392 FA / Padding
33	2020-03-18 01:00:49	192.168.1.10	183.36.108.34	TCP	54	Ether / IP / TCP 192.168.1.10:4392 > 183.36.108.34:36688 A
34	2020-03-18 01:00:50	92.223.85.103	192.168.1.10	Http	60	Ether / IP / TCP 92.223.85.103:http > 192.168.1.10:14585 A / Padding
35	2020-03-18 01:00:50	192.168.1.10	92.223.85.103	Http	54	Ether / IP / TCP 192.168.1.10:14585 > 92.223.85.103:http A
36	2020-03-18 01:00:50	192.168.1.10	14.215.177.39	Https	54	Ether / IP / TCP 192.168.1.10:4391 > 14.215.177.39:https FA
37	2020-03-18 01:00:50	192.168.1.10	47.244.15.210	TCP	66	Ether / IP / TCP 192.168.1.10:4393 > 47.244.15.210:20395 S
38	2020-03-18 01:00:50	00:e0:4c:68:00:2d	01:80:c2:00:00:0e	LLDP	58	00:e0:4c:68:00:2d > 01:80:c2:00:00:0e (LLDP) / Raw
39	2020-03-18 01:00:51	192.168.1.10	47.244.15.210	TCP	66	Ether / IP / TCP 192.168.1.10:4396 > 47.244.15.210:20395 S
40	2020-03-18 01:00:52	192.168.1.10	47.244.15.210	TCP	66	Ether / IP / TCP 192.168.1.10:4396 > 47.244.15.210:20395 S
41	2020-03-18 01:00:52	192.168.1.10	47.244.15.210	TCP	66	Ether / IP / TCP 192.168.1.10:4393 > 47.244.15.210:20395 S
42	2020-03-18 01:00:52	192.168.1.10	10.10.20.110	UDP	120	Ether / IP / UDP 192.168.1.10:59684 > 10.10.20.110:snmp / SNMP
43	2020-03-18 01:00:52	fe80::f141:b4f2:11de:b126	fe80::1	ICMPv6	86	Ether / IPv6 / ICMPv6ND_NS / ICMPv6 Neighbor Discovery Option - Source Link-Layer Address 00:e0:4c:68:00:2d
44	2020-03-18 01:00:52	fe80::1	fe80::f141:b4f2:11de:b126	ICMPv6	78	Ether / IPv6 / ICMPv6 Neighbor Discovery - Neighbor Advertisement (tgt: fe80::1)
45	2020-03-18 01:00:52	240e:d4:2e8e:df00:4882:f650:cbf9:db1d	2400:cb00:2048:1::6814:224e	Https	86	Ether / IPv6 / TCP 240e:d4:2e8e:df00:4882:f650:cbf9:db1d:4397 > 2400:cb00:2048:1::6814:224e:https S
46	2020-03-18 01:00:53	240e:d4:2e8e:df00:4882:f650:cbf9:db1d	2400:cb00:2048:1::6814:224e	Https	86	Ether / IPv6 / TCP 240e:d4:2e8e:df00:4882:f650:cbf9:db1d:4398 > 2400:cb00:2048:1::6814:224e:https S
47	2020-03-18 01:00:53	192.168.1.10	183.57.48.55	UDP	1012	Ether / IP / UDP 192.168.1.10:54843 > 183.57.48.55:8000 / Raw
48	2020-03-18 01:00:53	183.57.48.55	192.168.1.10	UDP	356	Ether / IP / UDP 183.57.48.55:8000 > 192.168.1.10:54843 / Raw
49	2020-03-18 01:00:53	192.168.1.10	64.13.192.74	Https	66	Ether / IP / TCP 192.168.1.10:4399 > 64.13.192.74:https S
50	2020-03-18 01:00:53	240e:d4:2e8e:df00:4882:f650:cbf9:db1d	2400:cb00:2048:1::6814:224e	Https	86	Ether / IPv6 / TCP 240e:d4:2e8e:df00:4882:f650:cbf9:db1d:4400 > 2400:cb00:2048:1::6814:224e:https S
51	2020-03-18 01:00:53	64.13.192.74	192.168.1.10	Https	60	Ether / IP / TCP 64.13.192.74:https > 192.168.1.10:4399 RA / Padding
52	2020-03-18 01:00:53	240e:d4:2e8e:df00:4882:f650:cbf9:db1d	2400:cb00:2048:1::6814:224e	Https	86	Ether / IPv6 / TCP 240e:d4:2e8e:df00:4882:f650:cbf9:db1d:4401 > 2400:cb00:2048:1::6814:224e:https S
53	2020-03-18 01:00:53	192.168.1.10	64.13.192.74	Https	66	Ether / IP / TCP 192.168.1.10:4402 > 64.13.192.74:https S
54	2020-03-18 01:00:53	64.13.192.74	192.168.1.10	Https	60	Ether / IP / TCP 64.13.192.74:https > 192.168.1.10:4402 RA / Padding
55	2020-03-18 01:00:53	192.168.1.10	64.13.192.74	Https	66	Ether / IP / TCP 192.168.1.10:4403 > 64.13.192.74:https S
56	2020-03-18 01:00:53	64.13.192.74	192.168.1.10	Https	60	Ether / IP / TCP 64.13.192.74:https > 192.168.1.10:4403 RA / Padding
57	2020-03-18 01:00:53	192.168.1.10	92.223.85.103	Http	55	Ether / IP / TCP 192.168.1.10:14585 > 92.223.85.103:http A / HTTP / Raw
58	2020-03-18 01:00:53	192.168.1.10	130.198.91.107	Https	78	Ether / IP / TCP 192.168.1.10:10273 > 130.198.91.107:https PA / Raw
59	2020-03-18 01:00:53	192.168.1.10	64.13.192.74	Https	66	Ether / IP / TCP 192.168.1.10:4399 > 64.13.192.74:https S
60	2020-03-18 01:00:53	192.168.1.10	64.13.192.74	Https	66	Ether / IP / TCP 192.168.1.10:4404 > 64.13.192.74:https S
61	2020-03-18 01:00:53	92.223.85.103	192.168.1.10	Http	66	Ether / IP / TCP 92.223.85.103:http > 192.168.1.10:14585 A
62	2020-03-18 01:00:53	64.13.192.74	192.168.1.10	Https	60	Ether / IP / TCP 64.13.192.74:https > 192.168.1.10:4404 RA / Padding
63	2020-03-18 01:00:53	240e:d4:2e8e:df00:4882:f650:cbf9:db1d	2400:cb00:2048:1::6814:224e	Https	86	Ether / IPv6 / TCP 240e:d4:2e8e:df00:4882:f650:cbf9:db1d:4397 > 2400:cb00:2048:1::6814:224e:https S
64	2020-03-18 01:00:53	192.168.1.10	64.13.192.74	Https	66	Ether / IP / TCP 192.168.1.10:4402 > 64.13.192.74:https S
65	2020-03-18 01:00:53	192.168.1.10	64.13.192.74	Https	66	Ether / IP / TCP 192.168.1.10:4403 > 64.13.192.74:https S
66	2020-03-18 01:00:53	130.198.91.107	192.168.1.10	Https	60	Ether / IP / TCP 130.198.91.107:https > 192.168.1.10:10273 A / Padding
67	2020-03-18 01:00:54	240e:d4:2e8e:df00:4882:f650:cbf9:db1d	2400:cb00:2048:1::6814:224e	Https	86	Ether / IPv6 / TCP 240e:d4:2e8e:df00:4882:f650:cbf9:db1d:4398 > 2400:cb00:2048:1::6814:224e:https S
68	2020-03-18 01:00:54	240e:d4:2e8e:df00:4882:f650:cbf9:db1d	2400:cb00:2048:1::6814:224e	Https	86	Ether / IPv6 / TCP 240e:d4:2e8e:df00:4882:f650:cbf9:db1d:4400 > 2400:cb00:2048:1::6814:224e:https S
69	2020-03-18 01:00:54	192.168.1.10	64.13.192.74	Https	66	Ether / IP / TCP 192.168.1.10:4404 > 64.13.192.74:https S
70	2020-03-18 01:00:54	fe80::f141:b4f2:11de:b126	fe80::1	DNS	93	Ether / IPv6 / UDP / DNS Qry "b'www.baidu.com.'" 
71	2020-03-18 01:00:54	fe80::f141:b4f2:11de:b126	fe80::1	DNS	93	Ether / IPv6 / UDP / DNS Qry "b'www.baidu.com.'" 
72	2020-03-18 01:00:54	fe80::1	fe80::f141:b4f2:11de:b126	DNS	386	Ether / IPv6 / UDP / DNS Ans "b'www.a.shifen.com.'" 
73	2020-03-18 01:00:54	fe80::1	fe80::f141:b4f2:11de:b126	DNS	177	Ether / IPv6 / UDP / DNS Ans "b'www.a.shifen.com.'" 
74	2020-03-18 01:00:54	192.168.1.10	220.181.38.149	Https	66	Ether / IP / TCP 192.168.1.10:4405 > 220.181.38.149:https S
75	2020-03-18 01:00:54	192.168.1.10	220.181.38.149	Https	66	Ether / IP / TCP 192.168.1.10:4406 > 220.181.38.149:https S
76	2020-03-18 01:00:54	220.181.38.149	192.168.1.10	Https	66	Ether / IP / TCP 220.181.38.149:https > 192.168.1.10:4405 SA
77	2020-03-18 01:00:54	192.168.1.10	220.181.38.149	Https	54	Ether / IP / TCP 192.168.1.10:4405 > 220.181.38.149:https A
78	2020-03-18 01:00:54	192.168.1.10	220.181.38.149	Https	571	Ether / IP / TCP 192.168.1.10:4405 > 220.181.38.149:https PA / Raw
79	2020-03-18 01:00:54	220.181.38.149	192.168.1.10	Https	66	Ether / IP / TCP 220.181.38.149:https > 192.168.1.10:4406 SA
80	2020-03-18 01:00:54	192.168.1.10	220.181.38.149	Https	54	Ether / IP / TCP 192.168.1.10:4406 > 220.181.38.149:https A
81	2020-03-18 01:00:54	192.168.1.10	220.181.38.149	Https	571	Ether / IP / TCP 192.168.1.10:4406 > 220.181.38.149:https PA / Raw
82	2020-03-18 01:00:54	220.181.38.149	192.168.1.10	Https	60	Ether / IP / TCP 220.181.38.149:https > 192.168.1.10:4405 A / Padding
83	2020-03-18 01:00:54	220.181.38.149	192.168.1.10	Https	122	Ether / IP / TCP 220.181.38.149:https > 192.168.1.10:4405 PA / Raw
84	2020-03-18 01:00:54	220.181.38.149	192.168.1.10	Https	1506	Ether / IP / TCP 220.181.38.149:https > 192.168.1.10:4405 A / Raw
85	2020-03-18 01:00:54	192.168.1.10	220.181.38.149	Https	54	Ether / IP / TCP 192.168.1.10:4405 > 220.181.38.149:https A
86	2020-03-18 01:00:54	220.181.38.149	192.168.1.10	Https	1506	Ether / IP / TCP 220.181.38.149:https > 192.168.1.10:4405 A / Raw
87	2020-03-18 01:00:54	220.181.38.149	192.168.1.10	Https	784	Ether / IP / TCP 220.181.38.149:https > 192.168.1.10:4405 PA / Raw
88	2020-03-18 01:00:54	192.168.1.10	220.181.38.149	Https	54	Ether / IP / TCP 192.168.1.10:4405 > 220.181.38.149:https A
89	2020-03-18 01:00:54	220.181.38.149	192.168.1.10	Https	392	Ether / IP / TCP 220.181.38.149:https > 192.168.1.10:4405 PA / Raw
90	2020-03-18 01:00:54	220.181.38.149	192.168.1.10	Https	63	Ether / IP / TCP 220.181.38.149:https > 192.168.1.10:4405 PA / Raw
91	2020-03-18 01:00:54	192.168.1.10	220.181.38.149	Https	54	Ether / IP / TCP 192.168.1.10:4405 > 220.181.38.149:https A
92	2020-03-18 01:00:54	192.168.1.10	172.217.160.78	Https	66	Ether / IP / TCP 192.168.1.10:4383 > 172.217.160.78:https S
93	2020-03-18 01:00:54	220.181.38.149	192.168.1.10	Https	60	Ether / IP / TCP 220.181.38.149:https > 192.168.1.10:4406 A / Padding
94	2020-03-18 01:00:54	220.181.38.149	192.168.1.10	Https	122	Ether / IP / TCP 220.181.38.149:https > 192.168.1.10:4406 PA / Raw
95	2020-03-18 01:00:54	220.181.38.149	192.168.1.10	Https	1506	Ether / IP / TCP 220.181.38.149:https > 192.168.1.10:4406 A / Raw
96	2020-03-18 01:00:54	192.168.1.10	220.181.38.149	Https	54	Ether / IP / TCP 192.168.1.10:4406 > 220.181.38.149:https A
97	2020-03-18 01:00:54	220.181.38.149	192.168.1.10	Https	1506	Ether / IP / TCP 220.181.38.149:https > 192.168.1.10:4406 A / Raw
98	2020-03-18 01:00:54	220.181.38.149	192.168.1.10	Https	784	Ether / IP / TCP 220.181.38.149:https > 192.168.1.10:4406 PA / Raw
99	2020-03-18 01:00:54	192.168.1.10	220.181.38.149	Https	54	Ether / IP / TCP 192.168.1.10:4406 > 220.181.38.149:https A
100	2020-03-18 01:00:54	220.181.38.149	192.168.1.10	Https	63	Ether / IP / TCP 220.181.38.149:https > 192.168.1.10:4405 PA / Raw
101	2020-03-18 01:00:54	192.168.1.10	220.181.38.149	Https	66	Ether / IP / TCP 192.168.1.10:4405 > 220.181.38.149:https A
102	2020-03-18 01:00:54	220.181.38.149	192.168.1.10	Https	392	Ether / IP / TCP 220.181.38.149:https > 192.168.1.10:4406 PA / Raw
103	2020-03-18 01:00:54	220.181.38.149	192.168.1.10	Https	63	Ether / IP / TCP 220.181.38.149:https > 192.168.1.10:4406 PA / Raw
104	2020-03-18 01:00:54	192.168.1.10	220.181.38.149	Https	54	Ether / IP / TCP 192.168.1.10:4406 > 220.181.38.149:https A
105	2020-03-18 01:00:54	192.168.1.10	220.181.38.149	Https	180	Ether / IP / TCP 192.168.1.10:4405 > 220.181.38.149:https PA / Raw
106	2020-03-18 01:00:54	192.168.1.10	220.181.38.149	Https	180	Ether / IP / TCP 192.168.1.10:4406 > 220.181.38.149:https PA / Raw
107	2020-03-18 01:00:54	192.168.1.10	220.181.38.149	Https	1191	Ether / IP / TCP 192.168.1.10:4405 > 220.181.38.149:https PA / Raw
108	2020-03-18 01:00:54	240e:d4:2e8e:df00:4882:f650:cbf9:db1d	2400:cb00:2048:1::6814:224e	Https	86	Ether / IPv6 / TCP 240e:d4:2e8e:df00:4882:f650:cbf9:db1d:4401 > 2400:cb00:2048:1::6814:224e:https S
109	2020-03-18 01:00:54	54.223.180.103	192.168.1.10	Http	60	Ether / IP / TCP 54.223.180.103:http > 192.168.1.10:4346 FA / Padding
110	2020-03-18 01:00:54	192.168.1.10	54.223.180.103	Http	54	Ether / IP / TCP 192.168.1.10:4346 > 54.223.180.103:http A
111	2020-03-18 01:00:54	220.181.38.149	192.168.1.10	Https	60	Ether / IP / TCP 220.181.38.149:https > 192.168.1.10:4405 A / Padding
112	2020-03-18 01:00:54	220.181.38.149	192.168.1.10	Https	229	Ether / IP / TCP 220.181.38.149:https > 192.168.1.10:4405 PA / Raw
113	2020-03-18 01:00:54	220.181.38.149	192.168.1.10	Https	60	Ether / IP / TCP 220.181.38.149:https > 192.168.1.10:4405 PA / Raw
114	2020-03-18 01:00:54	220.181.38.149	192.168.1.10	Https	99	Ether / IP / TCP 220.181.38.149:https > 192.168.1.10:4405 PA / Raw
115	2020-03-18 01:00:54	192.168.1.10	220.181.38.149	Https	54	Ether / IP / TCP 192.168.1.10:4405 > 220.181.38.149:https A
116	2020-03-18 01:00:54	220.181.38.149	192.168.1.10	Https	60	Ether / IP / TCP 220.181.38.149:https > 192.168.1.10:4405 A / Padding
117	2020-03-18 01:00:54	220.181.38.149	192.168.1.10	Https	60	Ether / IP / TCP 220.181.38.149:https > 192.168.1.10:4406 A / Padding
118	2020-03-18 01:00:54	220.181.38.149	192.168.1.10	Https	229	Ether / IP / TCP 220.181.38.149:https > 192.168.1.10:4406 PA / Raw
119	2020-03-18 01:00:54	220.181.38.149	192.168.1.10	Https	60	Ether / IP / TCP 220.181.38.149:https > 192.168.1.10:4406 PA / Raw
120	2020-03-18 01:00:54	192.168.1.10	220.181.38.149	Https	54	Ether / IP / TCP 192.168.1.10:4406 > 220.181.38.149:https A
121	2020-03-18 01:00:54	220.181.38.149	192.168.1.10	Https	99	Ether / IP / TCP 220.181.38.149:https > 192.168.1.10:4406 PA / Raw
122	2020-03-18 01:00:54	220.181.38.149	192.168.1.10	Https	99	Ether / IP / TCP 220.181.38.149:https > 192.168.1.10:4405 PA / Raw
123	2020-03-18 01:00:54	192.168.1.10	220.181.38.149	Https	66	Ether / IP / TCP 192.168.1.10:4405 > 220.181.38.149:https A
124	2020-03-18 01:00:54	192.168.1.10	220.181.38.149	Https	54	Ether / IP / TCP 192.168.1.10:4406 > 220.181.38.149:https A
125	2020-03-18 01:00:54	192.168.1.10	10.10.20.110	UDP	84	Ether / IP / UDP 192.168.1.10:59684 > 10.10.20.110:snmp / SNMP
126	2020-03-18 01:00:54	192.168.1.10	172.217.160.78	Https	66	Ether / IP / TCP 192.168.1.10:4384 > 172.217.160.78:https S
127	2020-03-18 01:00:54	220.181.38.149	192.168.1.10	Https	1506	Ether / IP / TCP 220.181.38.149:https > 192.168.1.10:4405 A / Raw
128	2020-03-18 01:00:54	220.181.38.149	192.168.1.10	Https	1506	Ether / IP / TCP 220.181.38.149:https > 192.168.1.10:4405 A / Raw
129	2020-03-18 01:00:54	220.181.38.149	192.168.1.10	Https	1179	Ether / IP / TCP 220.181.38.149:https > 192.168.1.10:4405 PA / Raw
130	2020-03-18 01:00:54	192.168.1.10	220.181.38.149	Https	54	Ether / IP / TCP 192.168.1.10:4405 > 220.181.38.149:https A
131	2020-03-18 01:00:54	220.181.38.149	192.168.1.10	Https	179	Ether / IP / TCP 220.181.38.149:https > 192.168.1.10:4405 PA / Raw
132	2020-03-18 01:00:54	220.181.38.149	192.168.1.10	Https	84	Ether / IP / TCP 220.181.38.149:https > 192.168.1.10:4405 PA / Raw
133	2020-03-18 01:00:54	192.168.1.10	220.181.38.149	Https	54	Ether / IP / TCP 192.168.1.10:4405 > 220.181.38.149:https A
134	2020-03-18 01:00:54	220.181.38.149	192.168.1.10	Https	1506	Ether / IP / TCP 220.181.38.149:https > 192.168.1.10:4405 A / Raw
135	2020-03-18 01:00:54	220.181.38.149	192.168.1.10	Https	1506	Ether / IP / TCP 220.181.38.149:https > 192.168.1.10:4405 A / Raw
136	2020-03-18 01:00:54	220.181.38.149	192.168.1.10	Https	1179	Ether / IP / TCP 220.181.38.149:https > 192.168.1.10:4405 PA / Raw
137	2020-03-18 01:00:54	220.181.38.149	192.168.1.10	Https	179	Ether / IP / TCP 220.181.38.149:https > 192.168.1.10:4405 PA / Raw
138	2020-03-18 01:00:54	192.168.1.10	220.181.38.149	Https	54	Ether / IP / TCP 192.168.1.10:4405 > 220.181.38.149:https A
139	2020-03-18 01:00:54	220.181.38.149	192.168.1.10	Https	1506	Ether / IP / TCP 220.181.38.149:https > 192.168.1.10:4405 A / Raw
140	2020-03-18 01:00:54	220.181.38.149	192.168.1.10	Https	1506	Ether / IP / TCP 220.181.38.149:https > 192.168.1.10:4405 A / Raw
141	2020-03-18 01:00:54	220.181.38.149	192.168.1.10	Https	1179	Ether / IP / TCP 220.181.38.149:https > 192.168.1.10:4405 PA / Raw
142	2020-03-18 01:00:54	192.168.1.10	220.181.38.149	Https	54	Ether / IP / TCP 192.168.1.10:4405 > 220.181.38.149:https A
143	2020-03-18 01:00:54	220.181.38.149	192.168.1.10	Https	1506	Ether / IP / TCP 220.181.38.149:https > 192.168.1.10:4405 A / Raw
144	2020-03-18 01:00:54	220.181.38.149	192.168.1.10	Https	1506	Ether / IP / TCP 220.181.38.149:https > 192.168.1.10:4405 A / Raw
145	2020-03-18 01:00:54	220.181.38.149	192.168.1.10	Https	1179	Ether / IP / TCP 220.181.38.149:https > 192.168.1.10:4405 PA / Raw
146	2020-03-18 01:00:54	192.168.1.10	220.181.38.149	Https	54	Ether / IP / TCP 192.168.1.10:4405 > 220.181.38.149:https A
147	2020-03-18 01:00:54	220.181.38.149	192.168.1.10	Https	1506	Ether / IP / TCP 220.181.38.149:https > 192.168.1.10:4405 A / Raw
148	2020-03-18 01:00:54	220.181.38.149	192.168.1.10	Https	1506	Ether / IP / TCP 220.181.38.149:https > 192.168.1.10:4405 A / Raw
149	2020-03-18 01:00:54	192.168.1.10	220.181.38.149	Https	54	Ether / IP / TCP 192.168.1.10:4405 > 220.181.38.149:https A
150	2020-03-18 01:00:54	220.181.38.149	192.168.1.10	Https	1506	Ether / IP / TCP 220.181.38.149:https > 192.168.1.10:4405 A / Raw
151	2020-03-18 01:00:54	220.181.38.149	192.168.1.10	Https	1506	Ether / IP / TCP 220.181.38.149:https > 192.168.1.10:4405 A / Raw
152	2020-03-18 01:00:54	220.181.38.149	192.168.1.10	Https	155	Ether / IP / TCP 220.181.38.149:https > 192.168.1.10:4405 PA / Raw
153	2020-03-18 01:00:54	220.181.38.149	192.168.1.10	Https	85	Ether / IP / TCP 220.181.38.149:https > 192.168.1.10:4405 PA / Raw
154	2020-03-18 01:00:54	192.168.1.10	220.181.38.149	Https	54	Ether / IP / TCP 192.168.1.10:4405 > 220.181.38.149:https A
155	2020-03-18 01:00:54	220.181.38.149	192.168.1.10	Https	1506	Ether / IP / TCP 220.181.38.149:https > 192.168.1.10:4405 A / Raw
156	2020-03-18 01:00:54	220.181.38.149	192.168.1.10	Https	1506	Ether / IP / TCP 220.181.38.149:https > 192.168.1.10:4405 A / Raw
157	2020-03-18 01:00:54	220.181.38.149	192.168.1.10	Https	1179	Ether / IP / TCP 220.181.38.149:https > 192.168.1.10:4405 PA / Raw
158	2020-03-18 01:00:54	220.181.38.149	192.168.1.10	Https	178	Ether / IP / TCP 220.181.38.149:https > 192.168.1.10:4405 PA / Raw
159	2020-03-18 01:00:54	192.168.1.10	220.181.38.149	Https	54	Ether / IP / TCP 192.168.1.10:4405 > 220.181.38.149:https A
160	2020-03-18 01:00:54	220.181.38.149	192.168.1.10	Https	1506	Ether / IP / TCP 220.181.38.149:https > 192.168.1.10:4405 A / Raw
161	2020-03-18 01:00:54	220.181.38.149	192.168.1.10	Https	1506	Ether / IP / TCP 220.181.38.149:https > 192.168.1.10:4405 A / Raw
162	2020-03-18 01:00:54	192.168.1.10	220.181.38.149	Https	54	Ether / IP / TCP 192.168.1.10:4405 > 220.181.38.149:https A
163	2020-03-18 01:00:54	192.168.1.10	47.244.15.210	TCP	66	Ether / IP / TCP 192.168.1.10:4396 > 47.244.15.210:20395 S
164	2020-03-18 01:00:54	220.181.38.149	192.168.1.10	Https	1506	Ether / IP / TCP 220.181.38.149:https > 192.168.1.10:4405 A / Raw
