1	2020-03-17 22:29:05	192.168.1.10	220.181.76.102	Http	54	Ether / IP / TCP 192.168.1.10:10630 > 220.181.76.102:http FA
2	2020-03-17 22:29:05	192.168.1.10	220.181.76.102	Http	66	Ether / IP / TCP 192.168.1.10:10647 > 220.181.76.102:http S
3	2020-03-17 22:29:05	220.181.76.102	192.168.1.10	Http	66	Ether / IP / TCP 220.181.76.102:http > 192.168.1.10:10647 SA
4	2020-03-17 22:29:05	192.168.1.10	220.181.76.102	Http	54	Ether / IP / TCP 192.168.1.10:10647 > 220.181.76.102:http A
5	2020-03-17 22:29:05	192.168.1.10	220.181.76.102	Http	652	Ether / IP / TCP / HTTP / 'GET' '/fsearch?keyfrom=deskdict.screentrans.http.1.stroke&q=Realtek%20USB%20GbE%20Family%20Controller&pos=-1&doctype=xml&xmlVersion=9.1&dogVersion=1.0&client=deskdict&id=e5eaa952d53a2c94c&vendor=unknown&in=YoudaoDict_webdict_default_8.8.1.0&appVer=8.8.1.0&appZengqiang=0&abTest=0&le=en&proc=python.exe&fytype=AUTO&scrfrom=stroke' 'HTTP/1.1'
6	2020-03-17 22:29:05	220.181.76.102	192.168.1.10	Http	60	Ether / IP / TCP 220.181.76.102:http > 192.168.1.10:10630 A / Padding
7	2020-03-17 22:29:05	9c:d2:4b:38:91:c1	00:e0:4c:68:00:2d	ARP	60	Ether / ARP who has 192.168.1.10 says 192.168.1.1 / Padding
8	2020-03-17 22:29:05	00:e0:4c:68:00:2d	9c:d2:4b:38:91:c1	ARP	42	Ether / ARP is at 00:e0:4c:68:00:2d says 192.168.1.10
9	2020-03-17 22:29:06	220.181.76.102	192.168.1.10	Http	60	Ether / IP / TCP 220.181.76.102:http > 192.168.1.10:10647 A / Padding
10	2020-03-17 22:29:06	220.181.76.102	192.168.1.10	Http	685	Ether / IP / TCP / HTTP / 'HTTP/1.1' '200' 'OK' / Raw
11	2020-03-17 22:29:06	192.168.1.10	220.181.76.102	Http	54	Ether / IP / TCP 192.168.1.10:10647 > 220.181.76.102:http A
12	2020-03-17 22:29:06	192.168.1.10	220.181.76.82	Http	54	Ether / IP / TCP 192.168.1.10:10631 > 220.181.76.82:http FA
13	2020-03-17 22:29:06	192.168.1.10	220.181.76.82	Http	66	Ether / IP / TCP 192.168.1.10:10648 > 220.181.76.82:http S
14	2020-03-17 22:29:06	220.181.76.82	192.168.1.10	Http	60	Ether / IP / TCP 220.181.76.82:http > 192.168.1.10:10631 A / Padding
15	2020-03-17 22:29:06	220.181.76.82	192.168.1.10	Http	66	Ether / IP / TCP 220.181.76.82:http > 192.168.1.10:10648 SA
16	2020-03-17 22:29:06	192.168.1.10	220.181.76.82	Http	54	Ether / IP / TCP 192.168.1.10:10648 > 220.181.76.82:http A
17	2020-03-17 22:29:06	192.168.1.10	220.181.76.82	Http	541	Ether / IP / TCP / HTTP / 'GET' '/apps/log.html?keyfrom=deskdict.main&q=Realtek%20USB%20GbE%20Family%20Controller&timing=stroke_trans_query&type=success&rnd=1d5fc68:69e1c620&appVer=8.8.1.0&vendor=unknown&id=e5eaa952d53a2c94c&abTest=0&client=deskdict&vip=0' 'HTTP/1.1'
18	2020-03-17 22:29:06	192.168.1.10	130.198.91.107	Https	78	Ether / IP / TCP 192.168.1.10:10273 > 130.198.91.107:https PA / Raw
19	2020-03-17 22:29:06	220.181.76.82	192.168.1.10	Http	60	Ether / IP / TCP 220.181.76.82:http > 192.168.1.10:10648 A / Padding
20	2020-03-17 22:29:06	220.181.76.82	192.168.1.10	Http	282	Ether / IP / TCP / HTTP / 'HTTP/1.1' '200' 'OK'
21	2020-03-17 22:29:06	192.168.1.10	220.181.76.82	Http	54	Ether / IP / TCP 192.168.1.10:10648 > 220.181.76.82:http A
22	2020-03-17 22:29:06	192.168.1.10	14.215.177.39	Https	66	Ether / IP / TCP 192.168.1.10:10649 > 14.215.177.39:https S
23	2020-03-17 22:29:06	14.215.177.39	192.168.1.10	Https	66	Ether / IP / TCP 14.215.177.39:https > 192.168.1.10:10649 SA
24	2020-03-17 22:29:06	192.168.1.10	14.215.177.39	Https	54	Ether / IP / TCP 192.168.1.10:10649 > 14.215.177.39:https A
25	2020-03-17 22:29:06	192.168.1.10	14.215.177.39	Https	54	Ether / IP / TCP 192.168.1.10:10649 > 14.215.177.39:https FA
26	2020-03-17 22:29:06	192.168.1.10	14.215.177.39	Https	54	Ether / IP / TCP 192.168.1.10:10649 > 14.215.177.39:https FA
27	2020-03-17 22:29:06	130.198.91.107	192.168.1.10	Https	60	Ether / IP / TCP 130.198.91.107:https > 192.168.1.10:10273 A / Padding
28	2020-03-17 22:29:07	192.168.1.10	14.215.177.39	Https	54	Ether / IP / TCP 192.168.1.10:10649 > 14.215.177.39:https FA
29	2020-03-17 22:29:08	192.168.1.10	14.215.177.39	Https	54	Ether / IP / TCP 192.168.1.10:10649 > 14.215.177.39:https FA
