1	2020-03-18 01:10:07	fe80::f141:b4f2:11de:b126	fe80::1	DNS	99	Ether / IPv6 / UDP / DNS Qry "b'api.vc.bilibili.com.'" 
2	2020-03-18 01:10:07	fe80::1	fe80::f141:b4f2:11de:b126	DNS	204	Ether / IPv6 / UDP / DNS Ans "b'interface.biliapi.com.'" 
3	2020-03-18 01:10:07	192.168.1.10	120.92.168.51	Https	66	Ether / IP / TCP 192.168.1.10:5096 > 120.92.168.51:https S
4	2020-03-18 01:10:07	192.168.1.10	14.215.177.39	Https	54	Ether / IP / TCP 192.168.1.10:5095 > 14.215.177.39:https FA
5	2020-03-18 01:10:07	120.92.168.51	192.168.1.10	Https	62	Ether / IP / TCP 120.92.168.51:https > 192.168.1.10:5096 SA
6	2020-03-18 01:10:07	192.168.1.10	120.92.168.51	Https	54	Ether / IP / TCP 192.168.1.10:5096 > 120.92.168.51:https A
7	2020-03-18 01:10:07	192.168.1.10	120.92.168.51	Https	571	Ether / IP / TCP 192.168.1.10:5096 > 120.92.168.51:https PA / Raw
8	2020-03-18 01:10:07	120.92.168.51	192.168.1.10	Https	60	Ether / IP / TCP 120.92.168.51:https > 192.168.1.10:5096 A / Padding
9	2020-03-18 01:10:07	120.92.168.51	192.168.1.10	Https	1506	Ether / IP / TCP 120.92.168.51:https > 192.168.1.10:5096 A / Raw
10	2020-03-18 01:10:07	120.92.168.51	192.168.1.10	Https	1506	Ether / IP / TCP 120.92.168.51:https > 192.168.1.10:5096 A / Raw
11	2020-03-18 01:10:07	120.92.168.51	192.168.1.10	Https	408	Ether / IP / TCP 120.92.168.51:https > 192.168.1.10:5096 PA / Raw
12	2020-03-18 01:10:07	192.168.1.10	120.92.168.51	Https	54	Ether / IP / TCP 192.168.1.10:5096 > 120.92.168.51:https A
13	2020-03-18 01:10:07	192.168.1.10	120.92.168.51	Https	180	Ether / IP / TCP 192.168.1.10:5096 > 120.92.168.51:https PA / Raw
14	2020-03-18 01:10:07	192.168.1.10	120.92.168.51	Https	1148	Ether / IP / TCP 192.168.1.10:5096 > 120.92.168.51:https PA / Raw
15	2020-03-18 01:10:07	120.92.168.51	192.168.1.10	Https	60	Ether / IP / TCP 120.92.168.51:https > 192.168.1.10:5096 A / Padding
16	2020-03-18 01:10:07	120.92.168.51	192.168.1.10	Https	312	Ether / IP / TCP 120.92.168.51:https > 192.168.1.10:5096 PA / Raw
17	2020-03-18 01:10:07	192.168.1.10	120.92.168.51	Https	54	Ether / IP / TCP 192.168.1.10:5096 > 120.92.168.51:https A
18	2020-03-18 01:10:07	120.92.168.51	192.168.1.10	Https	938	Ether / IP / TCP 120.92.168.51:https > 192.168.1.10:5096 PA / Raw
19	2020-03-18 01:10:07	192.168.1.10	120.92.168.51	Https	54	Ether / IP / TCP 192.168.1.10:5096 > 120.92.168.51:https A
20	2020-03-18 01:10:07	192.168.1.10	130.198.91.107	Https	78	Ether / IP / TCP 192.168.1.10:10273 > 130.198.91.107:https PA / Raw
21	2020-03-18 01:10:07	192.168.1.10	120.92.168.51	Https	54	Ether / IP / TCP 192.168.1.10:5096 > 120.92.168.51:https FA
22	2020-03-18 01:10:07	120.92.168.51	192.168.1.10	Https	60	Ether / IP / TCP 120.92.168.51:https > 192.168.1.10:5096 FA / Padding
23	2020-03-18 01:10:07	192.168.1.10	120.92.168.51	Https	54	Ether / IP / TCP 192.168.1.10:5096 > 120.92.168.51:https A
24	2020-03-18 01:10:07	130.198.91.107	192.168.1.10	Https	60	Ether / IP / TCP 130.198.91.107:https > 192.168.1.10:10273 A / Padding
25	2020-03-18 01:10:08	192.168.1.10	14.215.177.39	Https	54	Ether / IP / TCP 192.168.1.10:5095 > 14.215.177.39:https FA
26	2020-03-18 01:10:08	192.168.1.10	47.244.15.210	TCP	66	Ether / IP / TCP 192.168.1.10:5094 > 47.244.15.210:20395 S
27	2020-03-18 01:10:09	192.168.1.10	47.244.15.210	TCP	66	Ether / IP / TCP 192.168.1.10:5097 > 47.244.15.210:20395 S
28	2020-03-18 01:10:10	192.168.1.10	47.244.15.210	TCP	66	Ether / IP / TCP 192.168.1.10:5097 > 47.244.15.210:20395 S
29	2020-03-18 01:10:10	192.168.1.10	14.215.177.39	Https	54	Ether / IP / TCP 192.168.1.10:5095 > 14.215.177.39:https FA
30	2020-03-18 01:10:10	223.252.199.69	192.168.1.10	TCP	60	Ether / IP / TCP 223.252.199.69:6003 > 192.168.1.10:13025 PA / Raw / Padding
31	2020-03-18 01:10:10	192.168.1.10	223.252.199.69	TCP	54	Ether / IP / TCP 192.168.1.10:13025 > 223.252.199.69:6003 A
32	2020-03-18 01:10:11	192.168.1.10	223.252.199.69	TCP	63	Ether / IP / TCP 192.168.1.10:13025 > 223.252.199.69:6003 PA / Raw
33	2020-03-18 01:10:11	fe80::f141:b4f2:11de:b126	fe80::1	DNS	102	Ether / IPv6 / UDP / DNS Qry "b'analytics.yinxiang.com.'" 
34	2020-03-18 01:10:11	fe80::1	fe80::f141:b4f2:11de:b126	DNS	175	Ether / IPv6 / UDP / DNS Ans 
35	2020-03-18 01:10:11	223.252.199.69	192.168.1.10	TCP	60	Ether / IP / TCP 223.252.199.69:6003 > 192.168.1.10:13025 A / Padding
36	2020-03-18 01:10:11	192.168.1.10	154.8.190.35	Https	66	Ether / IP / TCP 192.168.1.10:5098 > 154.8.190.35:https S
37	2020-03-18 01:10:11	154.8.190.35	192.168.1.10	Https	66	Ether / IP / TCP 154.8.190.35:https > 192.168.1.10:5098 SA
38	2020-03-18 01:10:11	192.168.1.10	154.8.190.35	Https	54	Ether / IP / TCP 192.168.1.10:5098 > 154.8.190.35:https A
39	2020-03-18 01:10:11	192.168.1.10	154.8.190.35	Https	237	Ether / IP / TCP 192.168.1.10:5098 > 154.8.190.35:https PA / Raw
40	2020-03-18 01:10:11	154.8.190.35	192.168.1.10	Https	60	Ether / IP / TCP 154.8.190.35:https > 192.168.1.10:5098 A / Padding
41	2020-03-18 01:10:11	154.8.190.35	192.168.1.10	Https	1486	Ether / IP / TCP 154.8.190.35:https > 192.168.1.10:5098 A / Raw
42	2020-03-18 01:10:11	154.8.190.35	192.168.1.10	Https	1486	Ether / IP / TCP 154.8.190.35:https > 192.168.1.10:5098 A / Raw
43	2020-03-18 01:10:11	154.8.190.35	192.168.1.10	Https	744	Ether / IP / TCP 154.8.190.35:https > 192.168.1.10:5098 PA / Raw
44	2020-03-18 01:10:11	192.168.1.10	154.8.190.35	Https	54	Ether / IP / TCP 192.168.1.10:5098 > 154.8.190.35:https A
45	2020-03-18 01:10:11	192.168.1.10	154.8.190.35	Https	180	Ether / IP / TCP 192.168.1.10:5098 > 154.8.190.35:https PA / Raw
46	2020-03-18 01:10:11	154.8.190.35	192.168.1.10	Https	328	Ether / IP / TCP 154.8.190.35:https > 192.168.1.10:5098 PA / Raw
47	2020-03-18 01:10:11	192.168.1.10	154.8.190.35	Https	303	Ether / IP / TCP 192.168.1.10:5098 > 154.8.190.35:https PA / Raw
48	2020-03-18 01:10:11	154.8.190.35	192.168.1.10	Https	352	Ether / IP / TCP 154.8.190.35:https > 192.168.1.10:5098 PA / Raw
49	2020-03-18 01:10:11	154.8.190.35	192.168.1.10	Https	88	Ether / IP / TCP 154.8.190.35:https > 192.168.1.10:5098 PA / Raw
50	2020-03-18 01:10:11	192.168.1.10	154.8.190.35	Https	54	Ether / IP / TCP 192.168.1.10:5098 > 154.8.190.35:https A
51	2020-03-18 01:10:11	192.168.1.10	154.8.190.35	Https	54	Ether / IP / TCP 192.168.1.10:5098 > 154.8.190.35:https FA
52	2020-03-18 01:10:11	154.8.190.35	192.168.1.10	Https	60	Ether / IP / TCP 154.8.190.35:https > 192.168.1.10:5098 FA / Padding
53	2020-03-18 01:10:11	192.168.1.10	154.8.190.35	Https	54	Ether / IP / TCP 192.168.1.10:5098 > 154.8.190.35:https A
54	2020-03-18 01:10:12	192.168.1.10	47.244.15.210	TCP	66	Ether / IP / TCP 192.168.1.10:5097 > 47.244.15.210:20395 S
55	2020-03-18 01:10:12	192.168.1.10	47.244.15.210	TCP	66	Ether / IP / TCP 192.168.1.10:5094 > 47.244.15.210:20395 S
56	2020-03-18 01:10:13	192.168.1.10	10.10.20.110	UDP	120	Ether / IP / UDP 192.168.1.10:59684 > 10.10.20.110:snmp / SNMP
57	2020-03-18 01:10:15	192.168.1.10	120.92.150.209	TCP	122	Ether / IP / TCP 192.168.1.10:4724 > 120.92.150.209:7823 PA / Raw
58	2020-03-18 01:10:15	192.168.1.10	14.215.177.39	Https	54	Ether / IP / TCP 192.168.1.10:5091 > 14.215.177.39:https RA
59	2020-03-18 01:10:15	120.92.150.209	192.168.1.10	TCP	105	Ether / IP / TCP 120.92.150.209:7823 > 192.168.1.10:4724 PA / Raw
60	2020-03-18 01:10:15	192.168.1.10	120.92.150.209	TCP	54	Ether / IP / TCP 192.168.1.10:4724 > 120.92.150.209:7823 A
61	2020-03-18 01:10:15	192.168.1.10	14.215.177.39	Https	54	Ether / IP / TCP 192.168.1.10:5095 > 14.215.177.39:https FA
62	2020-03-18 01:10:15	192.168.1.10	47.244.15.210	TCP	66	Ether / IP / TCP 192.168.1.10:5099 > 47.244.15.210:20395 S
63	2020-03-18 01:10:15	92.223.85.103	192.168.1.10	Http	60	Ether / IP / TCP 92.223.85.103:http > 192.168.1.10:14585 A / Padding
64	2020-03-18 01:10:15	192.168.1.10	92.223.85.103	Http	54	Ether / IP / TCP 192.168.1.10:14585 > 92.223.85.103:http A
65	2020-03-18 01:10:16	192.168.1.10	14.215.177.39	Https	66	Ether / IP / TCP 192.168.1.10:5100 > 14.215.177.39:https S
66	2020-03-18 01:10:16	14.215.177.39	192.168.1.10	Https	66	Ether / IP / TCP 14.215.177.39:https > 192.168.1.10:5100 SA
67	2020-03-18 01:10:16	192.168.1.10	14.215.177.39	Https	54	Ether / IP / TCP 192.168.1.10:5100 > 14.215.177.39:https A
68	2020-03-18 01:10:16	192.168.1.10	14.215.177.39	Https	54	Ether / IP / TCP 192.168.1.10:5100 > 14.215.177.39:https FA
69	2020-03-18 01:10:16	192.168.1.10	47.244.15.210	TCP	66	Ether / IP / TCP 192.168.1.10:5097 > 47.244.15.210:20395 S
70	2020-03-18 01:10:16	192.168.1.10	14.215.177.39	Https	54	Ether / IP / TCP 192.168.1.10:5100 > 14.215.177.39:https FA
71	2020-03-18 01:10:16	192.168.1.10	47.244.15.210	TCP	66	Ether / IP / TCP 192.168.1.10:5099 > 47.244.15.210:20395 S
72	2020-03-18 01:10:17	192.168.1.10	14.215.177.39	Https	54	Ether / IP / TCP 192.168.1.10:5100 > 14.215.177.39:https FA
73	2020-03-18 01:10:18	192.168.1.10	14.215.177.39	Https	54	Ether / IP / TCP 192.168.1.10:5100 > 14.215.177.39:https FA
74	2020-03-18 01:10:18	192.168.1.10	108.177.125.188	TCP	55	Ether / IP / TCP 192.168.1.10:3515 > 108.177.125.188:5228 A / Raw
75	2020-03-18 01:10:18	108.177.125.188	192.168.1.10	TCP	66	Ether / IP / TCP 108.177.125.188:5228 > 192.168.1.10:3515 A
76	2020-03-18 01:10:18	192.168.1.10	47.244.15.210	TCP	66	Ether / IP / TCP 192.168.1.10:5099 > 47.244.15.210:20395 S
77	2020-03-18 01:10:19	192.168.1.10	120.131.14.181	UDP	151	Ether / IP / UDP 192.168.1.10:49770 > 120.131.14.181:9402 / Raw
78	2020-03-18 01:10:20	192.168.1.10	14.215.177.39	Https	54	Ether / IP / TCP 192.168.1.10:5100 > 14.215.177.39:https FA
