1	2020-03-18 00:38:42	192.168.1.10	183.57.48.55	UDP	420	Ether / IP / UDP 192.168.1.10:54843 > 183.57.48.55:8000 / Raw
2	2020-03-18 00:38:43	192.168.1.10	180.163.32.152	UDP	420	Ether / IP / UDP 192.168.1.10:54843 > 180.163.32.152:8000 / Raw
3	2020-03-18 00:38:43	192.168.1.10	183.3.225.78	TCP	66	Ether / IP / TCP 192.168.1.10:2802 > 183.3.225.78:36688 S
4	2020-03-18 00:38:44	183.3.225.78	192.168.1.10	TCP	66	Ether / IP / TCP 183.3.225.78:36688 > 192.168.1.10:2802 SA
5	2020-03-18 00:38:44	192.168.1.10	183.3.225.78	TCP	54	Ether / IP / TCP 192.168.1.10:2802 > 183.3.225.78:36688 A
6	2020-03-18 00:38:44	192.168.1.10	183.3.225.78	TCP	346	Ether / IP / TCP 192.168.1.10:2802 > 183.3.225.78:36688 PA / Raw
7	2020-03-18 00:38:44	183.3.225.78	192.168.1.10	TCP	60	Ether / IP / TCP 183.3.225.78:36688 > 192.168.1.10:2802 A / Padding
8	2020-03-18 00:38:44	183.3.225.78	192.168.1.10	TCP	74	Ether / IP / TCP 183.3.225.78:36688 > 192.168.1.10:2802 PA / Raw
9	2020-03-18 00:38:44	192.168.1.10	183.3.225.78	TCP	54	Ether / IP / TCP 192.168.1.10:2802 > 183.3.225.78:36688 A
10	2020-03-18 00:38:44	240e:d4:2e8e:df00:4882:f650:cbf9:db1d	2404:6800:4008:803::200e	Https	86	Ether / IPv6 / TCP 240e:d4:2e8e:df00:4882:f650:cbf9:db1d:2790 > 2404:6800:4008:803::200e:https S
11	2020-03-18 00:38:44	192.168.1.10	172.217.27.142	Https	66	Ether / IP / TCP 192.168.1.10:2791 > 172.217.27.142:https S
12	2020-03-18 00:38:44	192.168.1.10	180.163.32.152	UDP	420	Ether / IP / UDP 192.168.1.10:54843 > 180.163.32.152:8000 / Raw
13	2020-03-18 00:38:44	fe80::f141:b4f2:11de:b126	fe80::1	DNS	102	Ether / IPv6 / UDP / DNS Qry "b'analytics.yinxiang.com.'" 
14	2020-03-18 00:38:44	fe80::1	fe80::f141:b4f2:11de:b126	DNS	175	Ether / IPv6 / UDP / DNS Ans 
15	2020-03-18 00:38:44	192.168.1.10	154.8.190.35	Https	66	Ether / IP / TCP 192.168.1.10:2803 > 154.8.190.35:https S
16	2020-03-18 00:38:44	154.8.190.35	192.168.1.10	Https	66	Ether / IP / TCP 154.8.190.35:https > 192.168.1.10:2803 SA
17	2020-03-18 00:38:44	192.168.1.10	154.8.190.35	Https	54	Ether / IP / TCP 192.168.1.10:2803 > 154.8.190.35:https A
18	2020-03-18 00:38:44	192.168.1.10	154.8.190.35	Https	237	Ether / IP / TCP 192.168.1.10:2803 > 154.8.190.35:https PA / Raw
19	2020-03-18 00:38:45	154.8.190.35	192.168.1.10	Https	60	Ether / IP / TCP 154.8.190.35:https > 192.168.1.10:2803 A / Padding
20	2020-03-18 00:38:45	154.8.190.35	192.168.1.10	Https	1486	Ether / IP / TCP 154.8.190.35:https > 192.168.1.10:2803 A / Raw
21	2020-03-18 00:38:45	154.8.190.35	192.168.1.10	Https	1486	Ether / IP / TCP 154.8.190.35:https > 192.168.1.10:2803 A / Raw
22	2020-03-18 00:38:45	154.8.190.35	192.168.1.10	Https	744	Ether / IP / TCP 154.8.190.35:https > 192.168.1.10:2803 PA / Raw
23	2020-03-18 00:38:45	192.168.1.10	154.8.190.35	Https	54	Ether / IP / TCP 192.168.1.10:2803 > 154.8.190.35:https A
24	2020-03-18 00:38:45	192.168.1.10	14.215.177.39	Https	54	Ether / IP / TCP 192.168.1.10:2788 > 14.215.177.39:https RA
25	2020-03-18 00:38:45	192.168.1.10	154.8.190.35	Https	180	Ether / IP / TCP 192.168.1.10:2803 > 154.8.190.35:https PA / Raw
26	2020-03-18 00:38:45	154.8.190.35	192.168.1.10	Https	328	Ether / IP / TCP 154.8.190.35:https > 192.168.1.10:2803 PA / Raw
27	2020-03-18 00:38:45	192.168.1.10	154.8.190.35	Https	54	Ether / IP / TCP 192.168.1.10:2803 > 154.8.190.35:https A
28	2020-03-18 00:38:45	192.168.1.10	154.8.190.35	Https	303	Ether / IP / TCP 192.168.1.10:2803 > 154.8.190.35:https PA / Raw
29	2020-03-18 00:38:45	192.168.1.10	183.3.225.78	TCP	54	Ether / IP / TCP 192.168.1.10:2802 > 183.3.225.78:36688 FA
30	2020-03-18 00:38:45	183.3.225.78	192.168.1.10	TCP	60	Ether / IP / TCP 183.3.225.78:36688 > 192.168.1.10:2802 FA / Padding
31	2020-03-18 00:38:45	192.168.1.10	183.3.225.78	TCP	54	Ether / IP / TCP 192.168.1.10:2802 > 183.3.225.78:36688 A
32	2020-03-18 00:38:45	154.8.190.35	192.168.1.10	Https	352	Ether / IP / TCP 154.8.190.35:https > 192.168.1.10:2803 PA / Raw
33	2020-03-18 00:38:45	154.8.190.35	192.168.1.10	Https	88	Ether / IP / TCP 154.8.190.35:https > 192.168.1.10:2803 PA / Raw
34	2020-03-18 00:38:45	192.168.1.10	154.8.190.35	Https	54	Ether / IP / TCP 192.168.1.10:2803 > 154.8.190.35:https A
35	2020-03-18 00:38:45	192.168.1.10	14.215.177.39	Https	54	Ether / IP / TCP 192.168.1.10:2801 > 14.215.177.39:https FA
36	2020-03-18 00:38:45	192.168.1.10	154.8.190.35	Https	54	Ether / IP / TCP 192.168.1.10:2803 > 154.8.190.35:https FA
37	2020-03-18 00:38:45	154.8.190.35	192.168.1.10	Https	60	Ether / IP / TCP 154.8.190.35:https > 192.168.1.10:2803 FA / Padding
38	2020-03-18 00:38:45	192.168.1.10	154.8.190.35	Https	54	Ether / IP / TCP 192.168.1.10:2803 > 154.8.190.35:https A
39	2020-03-18 00:38:46	fe80::f141:b4f2:11de:b126	fe80::1	DNS	106	Ether / IPv6 / UDP / DNS Qry "b'pcs-sdk-server.alibaba.com.'" 
40	2020-03-18 00:38:46	fe80::1	fe80::f141:b4f2:11de:b126	DNS	264	Ether / IPv6 / UDP / DNS Ans "b'na61-na62.wagbridge.alibaba.alibaba.com.'" 
41	2020-03-18 00:38:46	192.168.1.10	203.119.144.59	Http	66	Ether / IP / TCP 192.168.1.10:2804 > 203.119.144.59:http S
42	2020-03-18 00:38:46	192.168.1.10	14.215.177.39	Https	66	Ether / IP / TCP 192.168.1.10:2805 > 14.215.177.39:https S
43	2020-03-18 00:38:46	203.119.144.59	192.168.1.10	Http	66	Ether / IP / TCP 203.119.144.59:http > 192.168.1.10:2804 SA
44	2020-03-18 00:38:46	192.168.1.10	203.119.144.59	Http	54	Ether / IP / TCP 192.168.1.10:2804 > 203.119.144.59:http A
45	2020-03-18 00:38:46	192.168.1.10	203.119.144.59	Http	181	Ether / IP / TCP / HTTP / 'POST' '/a' 'HTTP/1.1'
46	2020-03-18 00:38:46	192.168.1.10	203.119.144.59	Http	1494	Ether / IP / TCP 192.168.1.10:2804 > 203.119.144.59:http A / HTTP / Raw
47	2020-03-18 00:38:46	192.168.1.10	203.119.144.59	Http	552	Ether / IP / TCP 192.168.1.10:2804 > 203.119.144.59:http PA / HTTP / Raw
48	2020-03-18 00:38:46	14.215.177.39	192.168.1.10	Https	66	Ether / IP / TCP 14.215.177.39:https > 192.168.1.10:2805 SA
49	2020-03-18 00:38:46	192.168.1.10	14.215.177.39	Https	54	Ether / IP / TCP 192.168.1.10:2805 > 14.215.177.39:https A
50	2020-03-18 00:38:46	192.168.1.10	14.215.177.39	Https	54	Ether / IP / TCP 192.168.1.10:2805 > 14.215.177.39:https FA
51	2020-03-18 00:38:46	203.119.144.59	192.168.1.10	Http	60	Ether / IP / TCP 203.119.144.59:http > 192.168.1.10:2804 A / Padding
52	2020-03-18 00:38:46	203.119.144.59	192.168.1.10	Http	60	Ether / IP / TCP 203.119.144.59:http > 192.168.1.10:2804 A / Padding
53	2020-03-18 00:38:46	203.119.144.59	192.168.1.10	Http	60	Ether / IP / TCP 203.119.144.59:http > 192.168.1.10:2804 A / Padding
54	2020-03-18 00:38:46	203.119.144.59	192.168.1.10	Http	324	Ether / IP / TCP / HTTP / 'HTTP/1.1' '200' 'OK'
55	2020-03-18 00:38:46	203.119.144.59	192.168.1.10	Http	83	Ether / IP / TCP 203.119.144.59:http > 192.168.1.10:2804 PA / HTTP / Raw
56	2020-03-18 00:38:46	192.168.1.10	203.119.144.59	Http	54	Ether / IP / TCP 192.168.1.10:2804 > 203.119.144.59:http A
57	2020-03-18 00:38:46	192.168.1.10	14.215.177.39	Https	54	Ether / IP / TCP 192.168.1.10:2805 > 14.215.177.39:https FA
58	2020-03-18 00:38:47	192.168.1.10	14.215.177.39	Https	54	Ether / IP / TCP 192.168.1.10:2805 > 14.215.177.39:https FA
59	2020-03-18 00:38:48	240e:d4:2e8e:df00:4882:f650:cbf9:db1d	2404:6800:4008:803::200e	Https	86	Ether / IPv6 / TCP 240e:d4:2e8e:df00:4882:f650:cbf9:db1d:2796 > 2404:6800:4008:803::200e:https S
60	2020-03-18 00:38:48	192.168.1.10	14.215.177.39	Https	54	Ether / IP / TCP 192.168.1.10:2805 > 14.215.177.39:https FA
61	2020-03-18 00:38:48	192.168.1.10	172.217.27.142	Https	66	Ether / IP / TCP 192.168.1.10:2797 > 172.217.27.142:https S
62	2020-03-18 00:38:48	192.168.1.10	172.217.160.110	Https	66	Ether / IP / TCP 192.168.1.10:2798 > 172.217.160.110:https S
63	2020-03-18 00:38:49	192.168.1.10	172.217.160.110	Https	66	Ether / IP / TCP 192.168.1.10:2799 > 172.217.160.110:https S
64	2020-03-18 00:38:50	192.168.1.10	172.217.27.142	Https	66	Ether / IP / TCP 192.168.1.10:2806 > 172.217.27.142:https S
65	2020-03-18 00:38:50	54.223.180.103	192.168.1.10	Http	60	Ether / IP / TCP 54.223.180.103:http > 192.168.1.10:2774 FA / Padding
66	2020-03-18 00:38:50	192.168.1.10	54.223.180.103	Http	54	Ether / IP / TCP 192.168.1.10:2774 > 54.223.180.103:http A
67	2020-03-18 00:38:50	92.223.85.103	192.168.1.10	Http	60	Ether / IP / TCP 92.223.85.103:http > 192.168.1.10:14585 A / Padding
68	2020-03-18 00:38:50	192.168.1.10	92.223.85.103	Http	54	Ether / IP / TCP 192.168.1.10:14585 > 92.223.85.103:http A
69	2020-03-18 00:38:50	240e:d4:2e8e:df00:4882:f650:cbf9:db1d	2404:6800:4008:803::200e	Https	86	Ether / IPv6 / TCP 240e:d4:2e8e:df00:4882:f650:cbf9:db1d:2807 > 2404:6800:4008:803::200e:https S
70	2020-03-18 00:38:50	192.168.1.10	14.215.177.39	Https	54	Ether / IP / TCP 192.168.1.10:2805 > 14.215.177.39:https FA
71	2020-03-18 00:38:51	192.168.1.10	172.217.27.142	Https	66	Ether / IP / TCP 192.168.1.10:2806 > 172.217.27.142:https S
72	2020-03-18 00:38:51	240e:d4:2e8e:df00:4882:f650:cbf9:db1d	2404:6800:4008:803::200e	Https	86	Ether / IPv6 / TCP 240e:d4:2e8e:df00:4882:f650:cbf9:db1d:2807 > 2404:6800:4008:803::200e:https S
73	2020-03-18 00:38:51	00:e0:4c:68:00:2d	9c:d2:4b:38:91:c1	ARP	42	Ether / ARP who has 192.168.1.1 says 192.168.1.10
74	2020-03-18 00:38:51	9c:d2:4b:38:91:c1	00:e0:4c:68:00:2d	ARP	60	Ether / ARP is at 9c:d2:4b:38:91:c1 says 192.168.1.1 / Padding
75	2020-03-18 00:38:52	192.168.1.10	10.10.20.110	UDP	120	Ether / IP / UDP 192.168.1.10:59684 > 10.10.20.110:snmp / SNMP
76	2020-03-18 00:38:53	192.168.1.10	172.217.27.142	Https	66	Ether / IP / TCP 192.168.1.10:2806 > 172.217.27.142:https S
77	2020-03-18 00:38:53	240e:d4:2e8e:df00:4882:f650:cbf9:db1d	2404:6800:4008:803::200e	Https	86	Ether / IPv6 / TCP 240e:d4:2e8e:df00:4882:f650:cbf9:db1d:2807 > 2404:6800:4008:803::200e:https S
78	2020-03-18 00:38:54	192.168.1.10	172.217.27.142	Https	66	Ether / IP / TCP 192.168.1.10:2808 > 172.217.27.142:https S
79	2020-03-18 00:38:54	204.79.197.254	192.168.1.10	Https	60	Ether / IP / TCP 204.79.197.254:https > 192.168.1.10:2707 RA / Padding
80	2020-03-18 00:38:54	18:d2:76:f3:58:0b	ff:ff:ff:ff:ff:ff	ARP	60	Ether / ARP who has 192.168.1.1 says 192.168.1.3 / Padding
81	2020-03-18 00:38:54	240e:d4:2e8e:df00:4882:f650:cbf9:db1d	2404:6800:4008:803::200e	Https	86	Ether / IPv6 / TCP 240e:d4:2e8e:df00:4882:f650:cbf9:db1d:2809 > 2404:6800:4008:803::200e:https S
82	2020-03-18 00:38:54	192.168.1.10	172.217.24.14	Https	66	Ether / IP / TCP 192.168.1.10:2810 > 172.217.24.14:https S
83	2020-03-18 00:38:55	192.168.1.10	223.252.199.69	TCP	55	Ether / IP / TCP 192.168.1.10:13025 > 223.252.199.69:6003 A / Raw
84	2020-03-18 00:38:55	192.168.1.10	14.215.177.39	Https	54	Ether / IP / TCP 192.168.1.10:2801 > 14.215.177.39:https RA
85	2020-03-18 00:38:55	223.252.199.69	192.168.1.10	TCP	66	Ether / IP / TCP 223.252.199.69:6003 > 192.168.1.10:13025 A
86	2020-03-18 00:38:55	192.168.1.10	172.217.24.14	Https	66	Ether / IP / TCP 192.168.1.10:2811 > 172.217.24.14:https S
87	2020-03-18 00:38:55	192.168.1.10	172.217.27.142	Https	66	Ether / IP / TCP 192.168.1.10:2808 > 172.217.27.142:https S
88	2020-03-18 00:38:55	240e:d4:2e8e:df00:4882:f650:cbf9:db1d	2404:6800:4008:803::200e	Https	86	Ether / IPv6 / TCP 240e:d4:2e8e:df00:4882:f650:cbf9:db1d:2809 > 2404:6800:4008:803::200e:https S
89	2020-03-18 00:38:55	192.168.1.10	14.215.177.39	Https	54	Ether / IP / TCP 192.168.1.10:2805 > 14.215.177.39:https FA
90	2020-03-18 00:38:55	192.168.1.10	172.217.24.14	Https	66	Ether / IP / TCP 192.168.1.10:2810 > 172.217.24.14:https S
91	2020-03-18 00:38:56	192.168.1.10	172.217.24.14	Https	66	Ether / IP / TCP 192.168.1.10:2811 > 172.217.24.14:https S
92	2020-03-18 00:38:56	192.168.1.10	14.215.177.39	Https	66	Ether / IP / TCP 192.168.1.10:2812 > 14.215.177.39:https S
93	2020-03-18 00:38:56	14.215.177.39	192.168.1.10	Https	66	Ether / IP / TCP 14.215.177.39:https > 192.168.1.10:2812 SA
94	2020-03-18 00:38:56	192.168.1.10	14.215.177.39	Https	54	Ether / IP / TCP 192.168.1.10:2812 > 14.215.177.39:https A
95	2020-03-18 00:38:56	192.168.1.10	14.215.177.39	Https	54	Ether / IP / TCP 192.168.1.10:2812 > 14.215.177.39:https FA
96	2020-03-18 00:38:56	192.168.1.10	14.215.177.39	Https	54	Ether / IP / TCP 192.168.1.10:2812 > 14.215.177.39:https FA
97	2020-03-18 00:38:56	204.79.197.222	192.168.1.10	Https	60	Ether / IP / TCP 204.79.197.222:https > 192.168.1.10:2708 RA / Padding
98	2020-03-18 00:38:57	192.168.1.10	14.215.177.39	Https	54	Ether / IP / TCP 192.168.1.10:2812 > 14.215.177.39:https FA
99	2020-03-18 00:38:57	192.168.1.10	172.217.27.142	Https	66	Ether / IP / TCP 192.168.1.10:2808 > 172.217.27.142:https S
100	2020-03-18 00:38:57	192.168.1.10	172.217.27.142	Https	66	Ether / IP / TCP 192.168.1.10:2806 > 172.217.27.142:https S
101	2020-03-18 00:38:57	240e:d4:2e8e:df00:4882:f650:cbf9:db1d	2404:6800:4008:803::200e	Https	86	Ether / IPv6 / TCP 240e:d4:2e8e:df00:4882:f650:cbf9:db1d:2809 > 2404:6800:4008:803::200e:https S
102	2020-03-18 00:38:57	240e:d4:2e8e:df00:4882:f650:cbf9:db1d	2404:6800:4008:803::200e	Https	86	Ether / IPv6 / TCP 240e:d4:2e8e:df00:4882:f650:cbf9:db1d:2807 > 2404:6800:4008:803::200e:https S
103	2020-03-18 00:38:57	192.168.1.10	172.217.24.14	Https	66	Ether / IP / TCP 192.168.1.10:2810 > 172.217.24.14:https S
104	2020-03-18 00:38:58	192.168.1.10	172.217.24.14	Https	66	Ether / IP / TCP 192.168.1.10:2811 > 172.217.24.14:https S
105	2020-03-18 00:38:58	192.168.1.10	14.215.177.39	Https	54	Ether / IP / TCP 192.168.1.10:2812 > 14.215.177.39:https FA
106	2020-03-18 00:38:58	fe80::f141:b4f2:11de:b126	fe80::1	ICMPv6	86	Ether / IPv6 / ICMPv6ND_NS / ICMPv6 Neighbor Discovery Option - Source Link-Layer Address 00:e0:4c:68:00:2d
107	2020-03-18 00:38:58	fe80::1	fe80::f141:b4f2:11de:b126	ICMPv6	78	Ether / IPv6 / ICMPv6 Neighbor Discovery - Neighbor Advertisement (tgt: fe80::1)
108	2020-03-18 00:38:58	192.168.1.10	120.131.14.181	UDP	151	Ether / IP / UDP 192.168.1.10:49770 > 120.131.14.181:9402 / Raw
109	2020-03-18 00:38:59	240e:d4:2e8e:df00:4882:f650:cbf9:db1d	2404:6800:4008:803::200e	Https	86	Ether / IPv6 / TCP 240e:d4:2e8e:df00:4882:f650:cbf9:db1d:2813 > 2404:6800:4008:803::200e:https S
110	2020-03-18 00:38:59	9c:d2:4b:38:91:c1	00:e0:4c:68:00:2d	ARP	60	Ether / ARP who has 192.168.1.10 says 192.168.1.1 / Padding
111	2020-03-18 00:38:59	00:e0:4c:68:00:2d	9c:d2:4b:38:91:c1	ARP	42	Ether / ARP is at 00:e0:4c:68:00:2d says 192.168.1.10
112	2020-03-18 00:38:59	192.168.1.10	172.217.27.142	Https	66	Ether / IP / TCP 192.168.1.10:2814 > 172.217.27.142:https S
113	2020-03-18 00:39:00	240e:d4:2e8e:df00:4882:f650:cbf9:db1d	2404:6800:4008:803::200e	Https	86	Ether / IPv6 / TCP 240e:d4:2e8e:df00:4882:f650:cbf9:db1d:2813 > 2404:6800:4008:803::200e:https S
114	2020-03-18 00:39:00	154.8.131.192	192.168.1.10	Https	60	Ether / IP / TCP 154.8.131.192:https > 192.168.1.10:11843 A / Padding
115	2020-03-18 00:39:00	192.168.1.10	154.8.131.192	Https	54	Ether / IP / TCP 192.168.1.10:11843 > 154.8.131.192:https A
116	2020-03-18 00:39:00	192.168.1.10	172.217.27.142	Https	66	Ether / IP / TCP 192.168.1.10:2814 > 172.217.27.142:https S
117	2020-03-18 00:39:00	192.168.1.10	14.215.177.39	Https	54	Ether / IP / TCP 192.168.1.10:2812 > 14.215.177.39:https FA
118	2020-03-18 00:39:00	92.223.85.103	192.168.1.10	Http	60	Ether / IP / TCP 92.223.85.103:http > 192.168.1.10:14585 A / Padding
119	2020-03-18 00:39:00	192.168.1.10	92.223.85.103	Http	54	Ether / IP / TCP 192.168.1.10:14585 > 92.223.85.103:http A
120	2020-03-18 00:39:01	192.168.1.10	154.8.131.192	Https	91	Ether / IP / TCP 192.168.1.10:11843 > 154.8.131.192:https PA / Raw
121	2020-03-18 00:39:01	154.8.131.192	192.168.1.10	Https	87	Ether / IP / TCP 154.8.131.192:https > 192.168.1.10:11843 PA / Raw
122	2020-03-18 00:39:01	192.168.1.10	172.217.27.142	Https	66	Ether / IP / TCP 192.168.1.10:2808 > 172.217.27.142:https S
123	2020-03-18 00:39:01	192.168.1.10	154.8.131.192	Https	54	Ether / IP / TCP 192.168.1.10:11843 > 154.8.131.192:https A
124	2020-03-18 00:39:01	240e:d4:2e8e:df00:4882:f650:cbf9:db1d	2404:6800:4008:803::200e	Https	86	Ether / IPv6 / TCP 240e:d4:2e8e:df00:4882:f650:cbf9:db1d:2809 > 2404:6800:4008:803::200e:https S
125	2020-03-18 00:39:01	192.168.1.10	172.217.24.14	Https	66	Ether / IP / TCP 192.168.1.10:2810 > 172.217.24.14:https S
126	2020-03-18 00:39:02	192.168.1.10	172.217.24.14	Https	66	Ether / IP / TCP 192.168.1.10:2811 > 172.217.24.14:https S
127	2020-03-18 00:39:02	240e:d4:2e8e:df00:4882:f650:cbf9:db1d	2404:6800:4008:803::200e	Https	86	Ether / IPv6 / TCP 240e:d4:2e8e:df00:4882:f650:cbf9:db1d:2813 > 2404:6800:4008:803::200e:https S
128	2020-03-18 00:39:02	192.168.1.10	172.217.27.142	Https	66	Ether / IP / TCP 192.168.1.10:2814 > 172.217.27.142:https S
129	2020-03-18 00:39:02	192.168.1.10	10.10.20.110	UDP	120	Ether / IP / UDP 192.168.1.10:59684 > 10.10.20.110:snmp / SNMP
130	2020-03-18 00:39:04	fe80::f141:b4f2:11de:b126	fe80::1	DNS	96	Ether / IPv6 / UDP / DNS Qry "b'dns.msftncsi.com.'" 
131	2020-03-18 00:39:04	fe80::1	fe80::f141:b4f2:11de:b126	DNS	258	Ether / IPv6 / UDP / DNS Ans "fd3e:4f5a:5b81::1" 
132	2020-03-18 00:39:05	192.168.1.10	14.215.177.39	Https	54	Ether / IP / TCP 192.168.1.10:2805 > 14.215.177.39:https RA
133	2020-03-18 00:39:05	192.168.1.10	172.217.27.142	Https	66	Ether / IP / TCP 192.168.1.10:2806 > 172.217.27.142:https S
134	2020-03-18 00:39:05	192.168.1.10	14.215.177.39	Https	54	Ether / IP / TCP 192.168.1.10:2812 > 14.215.177.39:https FA
135	2020-03-18 00:39:05	240e:d4:2e8e:df00:4882:f650:cbf9:db1d	2404:6800:4008:803::200e	Https	86	Ether / IPv6 / TCP 240e:d4:2e8e:df00:4882:f650:cbf9:db1d:2807 > 2404:6800:4008:803::200e:https S
136	2020-03-18 00:39:05	192.168.1.10	130.198.91.107	Https	78	Ether / IP / TCP 192.168.1.10:10273 > 130.198.91.107:https PA / Raw
137	2020-03-18 00:39:06	192.168.1.10	14.215.177.39	Https	66	Ether / IP / TCP 192.168.1.10:2815 > 14.215.177.39:https S
138	2020-03-18 00:39:06	14.215.177.39	192.168.1.10	Https	66	Ether / IP / TCP 14.215.177.39:https > 192.168.1.10:2815 SA
139	2020-03-18 00:39:06	192.168.1.10	14.215.177.39	Https	54	Ether / IP / TCP 192.168.1.10:2815 > 14.215.177.39:https A
140	2020-03-18 00:39:06	192.168.1.10	14.215.177.39	Https	54	Ether / IP / TCP 192.168.1.10:2815 > 14.215.177.39:https FA
141	2020-03-18 00:39:06	192.168.1.10	130.198.91.107	Https	78	Ether / IP / TCP 192.168.1.10:10273 > 130.198.91.107:https PA / Raw
142	2020-03-18 00:39:06	240e:d4:2e8e:df00:4882:f650:cbf9:db1d	2404:6800:4008:803::200e	Https	86	Ether / IPv6 / TCP 240e:d4:2e8e:df00:4882:f650:cbf9:db1d:2813 > 2404:6800:4008:803::200e:https S
143	2020-03-18 00:39:06	fe80::f141:b4f2:11de:b126	fe80::1	ICMPv6	86	Ether / IPv6 / ICMPv6ND_NS / ICMPv6 Neighbor Discovery Option - Source Link-Layer Address 00:e0:4c:68:00:2d
144	2020-03-18 00:39:06	fe80::1	fe80::f141:b4f2:11de:b126	ICMPv6	78	Ether / IPv6 / ICMPv6 Neighbor Discovery - Neighbor Advertisement (tgt: fe80::1)
145	2020-03-18 00:39:06	130.198.91.107	192.168.1.10	Https	78	Ether / IP / TCP 130.198.91.107:https > 192.168.1.10:10273 PA / Raw
146	2020-03-18 00:39:06	192.168.1.10	14.215.177.39	Https	54	Ether / IP / TCP 192.168.1.10:2815 > 14.215.177.39:https FA
147	2020-03-18 00:39:06	192.168.1.10	130.198.91.107	Https	54	Ether / IP / TCP 192.168.1.10:10273 > 130.198.91.107:https A
148	2020-03-18 00:39:06	130.198.91.107	192.168.1.10	Https	66	Ether / IP / TCP 130.198.91.107:https > 192.168.1.10:10273 A
149	2020-03-18 00:39:06	192.168.1.10	172.217.27.142	Https	66	Ether / IP / TCP 192.168.1.10:2814 > 172.217.27.142:https S
150	2020-03-18 00:39:07	192.168.1.10	14.215.177.39	Https	54	Ether / IP / TCP 192.168.1.10:2815 > 14.215.177.39:https FA
151	2020-03-18 00:39:08	192.168.1.10	14.215.177.39	Https	54	Ether / IP / TCP 192.168.1.10:2815 > 14.215.177.39:https FA
152	2020-03-18 00:39:09	192.168.1.10	172.217.27.142	Https	66	Ether / IP / TCP 192.168.1.10:2808 > 172.217.27.142:https S
153	2020-03-18 00:39:09	240e:d4:2e8e:df00:4882:f650:cbf9:db1d	2404:6800:4008:803::200e	Https	86	Ether / IPv6 / TCP 240e:d4:2e8e:df00:4882:f650:cbf9:db1d:2809 > 2404:6800:4008:803::200e:https S
154	2020-03-18 00:39:09	192.168.1.10	172.217.24.14	Https	66	Ether / IP / TCP 192.168.1.10:2810 > 172.217.24.14:https S
155	2020-03-18 00:39:10	192.168.1.10	172.217.24.14	Https	66	Ether / IP / TCP 192.168.1.10:2811 > 172.217.24.14:https S
156	2020-03-18 00:39:10	192.168.1.10	14.215.177.39	Https	54	Ether / IP / TCP 192.168.1.10:2815 > 14.215.177.39:https FA
157	2020-03-18 00:39:11	00:e0:4c:68:00:2d	9c:d2:4b:38:91:c1	ARP	42	Ether / ARP who has 192.168.1.1 says 192.168.1.10
158	2020-03-18 00:39:11	9c:d2:4b:38:91:c1	00:e0:4c:68:00:2d	ARP	60	Ether / ARP is at 9c:d2:4b:38:91:c1 says 192.168.1.1 / Padding
159	2020-03-18 00:39:11	192.168.1.10	130.198.91.107	Https	78	Ether / IP / TCP 192.168.1.10:10273 > 130.198.91.107:https PA / Raw
160	2020-03-18 00:39:11	130.198.91.107	192.168.1.10	Https	60	Ether / IP / TCP 130.198.91.107:https > 192.168.1.10:10273 A / Padding
161	2020-03-18 00:39:12	192.168.1.10	10.10.20.110	UDP	120	Ether / IP / UDP 192.168.1.10:59684 > 10.10.20.110:snmp / SNMP
162	2020-03-18 00:39:14	240e:d4:2e8e:df00:4882:f650:cbf9:db1d	2404:6800:4008:803::200e	Https	86	Ether / IPv6 / TCP 240e:d4:2e8e:df00:4882:f650:cbf9:db1d:2813 > 2404:6800:4008:803::200e:https S
163	2020-03-18 00:39:14	240e:d4:2e8e:df00:4882:f650:cbf9:db1d	2404:6800:4008:c03::bc	TCP	75	Ether / IPv6 / TCP 240e:d4:2e8e:df00:4882:f650:cbf9:db1d:11846 > 2404:6800:4008:c03::bc:5228 A / Raw
164	2020-03-18 00:39:14	192.168.1.10	172.217.27.142	Https	66	Ether / IP / TCP 192.168.1.10:2814 > 172.217.27.142:https S
165	2020-03-18 00:39:15	192.168.1.10	14.215.177.39	Https	54	Ether / IP / TCP 192.168.1.10:2812 > 14.215.177.39:https RA
166	2020-03-18 00:39:15	192.168.1.10	59.111.181.35	Http	66	Ether / IP / TCP 192.168.1.10:2816 > 59.111.181.35:http S
167	2020-03-18 00:39:15	240e:d4:2e8e:df00:4882:f650:cbf9:db1d	2404:6800:4008:803::200e	Https	86	Ether / IPv6 / TCP 240e:d4:2e8e:df00:4882:f650:cbf9:db1d:2817 > 2404:6800:4008:803::200e:https S
168	2020-03-18 00:39:15	59.111.181.35	192.168.1.10	Http	66	Ether / IP / TCP 59.111.181.35:http > 192.168.1.10:2816 SA
169	2020-03-18 00:39:15	192.168.1.10	59.111.181.35	Http	54	Ether / IP / TCP 192.168.1.10:2816 > 59.111.181.35:http A
170	2020-03-18 00:39:15	192.168.1.10	59.111.181.35	Http	1103	Ether / IP / TCP / HTTP / 'POST' '/eapi/pl/count' 'HTTP/1.1'
171	2020-03-18 00:39:15	192.168.1.10	59.111.181.35	Http	1245	Ether / IP / TCP 192.168.1.10:2816 > 59.111.181.35:http PA / HTTP / Raw
172	2020-03-18 00:39:15	59.111.181.35	192.168.1.10	Http	60	Ether / IP / TCP 59.111.181.35:http > 192.168.1.10:2816 A / Padding
173	2020-03-18 00:39:15	59.111.181.35	192.168.1.10	Http	60	Ether / IP / TCP 59.111.181.35:http > 192.168.1.10:2816 A / Padding
174	2020-03-18 00:39:15	59.111.181.35	192.168.1.10	Http	934	Ether / IP / TCP / HTTP / 'HTTP/1.1' '200' 'OK' / Raw
175	2020-03-18 00:39:15	59.111.181.35	192.168.1.10	Http	74	Ether / IP / TCP 59.111.181.35:http > 192.168.1.10:2816 PA / HTTP / Raw
176	2020-03-18 00:39:15	192.168.1.10	59.111.181.35	Http	54	Ether / IP / TCP 192.168.1.10:2816 > 59.111.181.35:http A
177	2020-03-18 00:39:15	192.168.1.10	172.217.27.142	Https	66	Ether / IP / TCP 192.168.1.10:2818 > 172.217.27.142:https S
178	2020-03-18 00:39:15	192.168.1.10	14.215.177.39	Https	54	Ether / IP / TCP 192.168.1.10:2815 > 14.215.177.39:https FA
179	2020-03-18 00:39:15	fe80::f141:b4f2:11de:b126	fe80::1	DNS	102	Ether / IPv6 / UDP / DNS Qry "b'analytics.yinxiang.com.'" 
180	2020-03-18 00:39:15	fe80::1	fe80::f141:b4f2:11de:b126	DNS	175	Ether / IPv6 / UDP / DNS Ans 
181	2020-03-18 00:39:15	192.168.1.10	159.226.8.7	DNS	82	Ether / IP / UDP / DNS Qry "b'analytics.yinxiang.com.'" 
182	2020-03-18 00:39:15	159.226.8.7	192.168.1.10	DNS	155	Ether / IP / UDP / DNS Ans 
183	2020-03-18 00:39:15	192.168.1.10	154.8.190.35	Https	66	Ether / IP / TCP 192.168.1.10:2819 > 154.8.190.35:https S
184	2020-03-18 00:39:15	154.8.190.35	192.168.1.10	Https	66	Ether / IP / TCP 154.8.190.35:https > 192.168.1.10:2819 SA
185	2020-03-18 00:39:15	192.168.1.10	154.8.190.35	Https	54	Ether / IP / TCP 192.168.1.10:2819 > 154.8.190.35:https A
186	2020-03-18 00:39:15	192.168.1.10	154.8.190.35	Https	237	Ether / IP / TCP 192.168.1.10:2819 > 154.8.190.35:https PA / Raw
187	2020-03-18 00:39:15	154.8.190.35	192.168.1.10	Https	60	Ether / IP / TCP 154.8.190.35:https > 192.168.1.10:2819 A / Padding
188	2020-03-18 00:39:15	154.8.190.35	192.168.1.10	Https	1486	Ether / IP / TCP 154.8.190.35:https > 192.168.1.10:2819 A / Raw
189	2020-03-18 00:39:15	154.8.190.35	192.168.1.10	Https	1486	Ether / IP / TCP 154.8.190.35:https > 192.168.1.10:2819 A / Raw
190	2020-03-18 00:39:15	154.8.190.35	192.168.1.10	Https	744	Ether / IP / TCP 154.8.190.35:https > 192.168.1.10:2819 PA / Raw
191	2020-03-18 00:39:15	192.168.1.10	154.8.190.35	Https	54	Ether / IP / TCP 192.168.1.10:2819 > 154.8.190.35:https A
192	2020-03-18 00:39:15	192.168.1.10	154.8.190.35	Https	180	Ether / IP / TCP 192.168.1.10:2819 > 154.8.190.35:https PA / Raw
193	2020-03-18 00:39:15	154.8.190.35	192.168.1.10	Https	328	Ether / IP / TCP 154.8.190.35:https > 192.168.1.10:2819 PA / Raw
194	2020-03-18 00:39:15	192.168.1.10	154.8.190.35	Https	303	Ether / IP / TCP 192.168.1.10:2819 > 154.8.190.35:https PA / Raw
195	2020-03-18 00:39:15	154.8.190.35	192.168.1.10	Https	352	Ether / IP / TCP 154.8.190.35:https > 192.168.1.10:2819 PA / Raw
196	2020-03-18 00:39:15	154.8.190.35	192.168.1.10	Https	88	Ether / IP / TCP 154.8.190.35:https > 192.168.1.10:2819 PA / Raw
197	2020-03-18 00:39:15	192.168.1.10	154.8.190.35	Https	54	Ether / IP / TCP 192.168.1.10:2819 > 154.8.190.35:https A
198	2020-03-18 00:39:15	192.168.1.10	154.8.190.35	Https	54	Ether / IP / TCP 192.168.1.10:2819 > 154.8.190.35:https FA
199	2020-03-18 00:39:15	192.168.1.10	172.217.160.78	Https	66	Ether / IP / TCP 192.168.1.10:2820 > 172.217.160.78:https S
200	2020-03-18 00:39:15	154.8.190.35	192.168.1.10	Https	60	Ether / IP / TCP 154.8.190.35:https > 192.168.1.10:2819 FA / Padding
201	2020-03-18 00:39:15	192.168.1.10	154.8.190.35	Https	54	Ether / IP / TCP 192.168.1.10:2819 > 154.8.190.35:https A
202	2020-03-18 00:39:16	240e:d4:2e8e:df00:4882:f650:cbf9:db1d	2404:6800:4008:803::200e	Https	86	Ether / IPv6 / TCP 240e:d4:2e8e:df00:4882:f650:cbf9:db1d:2817 > 2404:6800:4008:803::200e:https S
203	2020-03-18 00:39:16	192.168.1.10	172.217.160.78	Https	66	Ether / IP / TCP 192.168.1.10:2821 > 172.217.160.78:https S
204	2020-03-18 00:39:16	192.168.1.10	14.215.177.39	Https	66	Ether / IP / TCP 192.168.1.10:2822 > 14.215.177.39:https S
205	2020-03-18 00:39:16	14.215.177.39	192.168.1.10	Https	66	Ether / IP / TCP 14.215.177.39:https > 192.168.1.10:2822 SA
206	2020-03-18 00:39:16	192.168.1.10	14.215.177.39	Https	54	Ether / IP / TCP 192.168.1.10:2822 > 14.215.177.39:https A
207	2020-03-18 00:39:16	192.168.1.10	14.215.177.39	Https	54	Ether / IP / TCP 192.168.1.10:2822 > 14.215.177.39:https FA
208	2020-03-18 00:39:16	192.168.1.10	172.217.27.142	Https	66	Ether / IP / TCP 192.168.1.10:2818 > 172.217.27.142:https S
209	2020-03-18 00:39:16	192.168.1.10	14.215.177.39	Https	54	Ether / IP / TCP 192.168.1.10:2822 > 14.215.177.39:https FA
210	2020-03-18 00:39:16	192.168.1.10	172.217.160.78	Https	66	Ether / IP / TCP 192.168.1.10:2820 > 172.217.160.78:https S
211	2020-03-18 00:39:17	192.168.1.10	14.215.177.39	Https	54	Ether / IP / TCP 192.168.1.10:2822 > 14.215.177.39:https FA
212	2020-03-18 00:39:17	192.168.1.10	172.217.160.78	Https	66	Ether / IP / TCP 192.168.1.10:2821 > 172.217.160.78:https S
213	2020-03-18 00:39:18	240e:d4:2e8e:df00:4882:f650:cbf9:db1d	2404:6800:4008:803::200e	Https	86	Ether / IPv6 / TCP 240e:d4:2e8e:df00:4882:f650:cbf9:db1d:2817 > 2404:6800:4008:803::200e:https S
214	2020-03-18 00:39:18	192.168.1.10	14.215.177.39	Https	54	Ether / IP / TCP 192.168.1.10:2822 > 14.215.177.39:https FA
215	2020-03-18 00:39:18	192.168.1.10	172.217.27.142	Https	66	Ether / IP / TCP 192.168.1.10:2818 > 172.217.27.142:https S
216	2020-03-18 00:39:18	192.168.1.10	172.217.160.78	Https	66	Ether / IP / TCP 192.168.1.10:2820 > 172.217.160.78:https S
217	2020-03-18 00:39:19	192.168.1.10	172.217.160.78	Https	66	Ether / IP / TCP 192.168.1.10:2821 > 172.217.160.78:https S
218	2020-03-18 00:39:20	59.111.181.35	192.168.1.10	Http	60	Ether / IP / TCP 59.111.181.35:http > 192.168.1.10:2816 FA / Padding
219	2020-03-18 00:39:20	192.168.1.10	59.111.181.35	Http	54	Ether / IP / TCP 192.168.1.10:2816 > 59.111.181.35:http A
220	2020-03-18 00:39:20	192.168.1.10	172.217.27.142	Https	66	Ether / IP / TCP 192.168.1.10:2823 > 172.217.27.142:https S
221	2020-03-18 00:39:20	240e:d4:2e8e:df00:4882:f650:cbf9:db1d	2404:6800:4008:803::200e	Https	86	Ether / IPv6 / TCP 240e:d4:2e8e:df00:4882:f650:cbf9:db1d:2824 > 2404:6800:4008:803::200e:https S
222	2020-03-18 00:39:20	192.168.1.10	14.215.177.39	Https	54	Ether / IP / TCP 192.168.1.10:2822 > 14.215.177.39:https FA
223	2020-03-18 00:39:21	192.168.1.10	172.217.27.142	Https	66	Ether / IP / TCP 192.168.1.10:2823 > 172.217.27.142:https S
224	2020-03-18 00:39:21	92.223.85.103	192.168.1.10	Http	60	Ether / IP / TCP 92.223.85.103:http > 192.168.1.10:14585 A / Padding
225	2020-03-18 00:39:21	192.168.1.10	92.223.85.103	Http	54	Ether / IP / TCP 192.168.1.10:14585 > 92.223.85.103:http A
226	2020-03-18 00:39:21	240e:d4:2e8e:df00:4882:f650:cbf9:db1d	2404:6800:4008:803::200e	Https	86	Ether / IPv6 / TCP 240e:d4:2e8e:df00:4882:f650:cbf9:db1d:2824 > 2404:6800:4008:803::200e:https S
227	2020-03-18 00:39:22	240e:d4:2e8e:df00:4882:f650:cbf9:db1d	2404:6800:4008:803::200e	Https	86	Ether / IPv6 / TCP 240e:d4:2e8e:df00:4882:f650:cbf9:db1d:2817 > 2404:6800:4008:803::200e:https S
228	2020-03-18 00:39:22	192.168.1.10	172.217.27.142	Https	66	Ether / IP / TCP 192.168.1.10:2818 > 172.217.27.142:https S
229	2020-03-18 00:39:22	fe80::f141:b4f2:11de:b126	fe80::1	ICMPv6	86	Ether / IPv6 / ICMPv6ND_NS / ICMPv6 Neighbor Discovery Option - Source Link-Layer Address 00:e0:4c:68:00:2d
230	2020-03-18 00:39:22	fe80::1	fe80::f141:b4f2:11de:b126	ICMPv6	78	Ether / IPv6 / ICMPv6 Neighbor Discovery - Neighbor Advertisement (tgt: fe80::1)
231	2020-03-18 00:39:22	192.168.1.10	172.217.160.78	Https	66	Ether / IP / TCP 192.168.1.10:2820 > 172.217.160.78:https S
232	2020-03-18 00:39:23	192.168.1.10	172.217.160.78	Https	66	Ether / IP / TCP 192.168.1.10:2821 > 172.217.160.78:https S
233	2020-03-18 00:39:23	192.168.1.10	172.217.27.142	Https	66	Ether / IP / TCP 192.168.1.10:2823 > 172.217.27.142:https S
234	2020-03-18 00:39:23	240e:d4:2e8e:df00:4882:f650:cbf9:db1d	2404:6800:4008:803::200e	Https	86	Ether / IPv6 / TCP 240e:d4:2e8e:df00:4882:f650:cbf9:db1d:2824 > 2404:6800:4008:803::200e:https S
235	2020-03-18 00:39:24	192.168.1.10	92.223.85.103	Http	55	Ether / IP / TCP 192.168.1.10:14585 > 92.223.85.103:http A / HTTP / Raw
236	2020-03-18 00:39:24	192.168.1.10	92.223.85.103	Http	55	Ether / IP / TCP 192.168.1.10:14585 > 92.223.85.103:http A / HTTP / Raw
237	2020-03-18 00:39:25	192.168.1.10	14.215.177.39	Https	54	Ether / IP / TCP 192.168.1.10:2815 > 14.215.177.39:https RA
238	2020-03-18 00:39:25	92.223.85.103	192.168.1.10	Http	66	Ether / IP / TCP 92.223.85.103:http > 192.168.1.10:14585 A
239	2020-03-18 00:39:25	192.168.1.10	59.111.181.35	Http	54	Ether / IP / TCP 192.168.1.10:2816 > 59.111.181.35:http FA
240	2020-03-18 00:39:25	59.111.181.35	192.168.1.10	Http	60	Ether / IP / TCP 59.111.181.35:http > 192.168.1.10:2816 A / Padding
241	2020-03-18 00:39:25	18:d2:76:f3:58:0b	ff:ff:ff:ff:ff:ff	ARP	60	Ether / ARP who has 192.168.1.1 says 192.168.1.3 / Padding
242	2020-03-18 00:39:25	192.168.1.10	14.215.177.39	Https	54	Ether / IP / TCP 192.168.1.10:2822 > 14.215.177.39:https FA
243	2020-03-18 00:39:26	192.168.1.10	14.215.177.39	Https	66	Ether / IP / TCP 192.168.1.10:2825 > 14.215.177.39:https S
244	2020-03-18 00:39:26	14.215.177.39	192.168.1.10	Https	66	Ether / IP / TCP 14.215.177.39:https > 192.168.1.10:2825 SA
245	2020-03-18 00:39:26	192.168.1.10	14.215.177.39	Https	54	Ether / IP / TCP 192.168.1.10:2825 > 14.215.177.39:https A
246	2020-03-18 00:39:26	192.168.1.10	14.215.177.39	Https	54	Ether / IP / TCP 192.168.1.10:2825 > 14.215.177.39:https FA
247	2020-03-18 00:39:26	203.119.144.59	192.168.1.10	Http	60	Ether / IP / TCP 203.119.144.59:http > 192.168.1.10:2804 FA / Padding
248	2020-03-18 00:39:26	192.168.1.10	203.119.144.59	Http	54	Ether / IP / TCP 192.168.1.10:2804 > 203.119.144.59:http A
249	2020-03-18 00:39:26	192.168.1.10	203.119.144.59	Http	54	Ether / IP / TCP 192.168.1.10:2804 > 203.119.144.59:http FA
250	2020-03-18 00:39:26	203.119.144.59	192.168.1.10	Http	60	Ether / IP / TCP 203.119.144.59:http > 192.168.1.10:2804 A / Padding
251	2020-03-18 00:39:26	192.168.1.10	14.215.177.39	Https	54	Ether / IP / TCP 192.168.1.10:2825 > 14.215.177.39:https FA
252	2020-03-18 00:39:27	192.168.1.10	14.215.177.39	Https	54	Ether / IP / TCP 192.168.1.10:2825 > 14.215.177.39:https FA
253	2020-03-18 00:39:27	192.168.1.10	172.217.27.142	Https	66	Ether / IP / TCP 192.168.1.10:2823 > 172.217.27.142:https S
254	2020-03-18 00:39:27	240e:d4:2e8e:df00:4882:f650:cbf9:db1d	2404:6800:4008:803::200e	Https	86	Ether / IPv6 / TCP 240e:d4:2e8e:df00:4882:f650:cbf9:db1d:2824 > 2404:6800:4008:803::200e:https S
255	2020-03-18 00:39:27	192.168.1.10	239.255.255.250	UDP	216	Ether / IP / UDP 192.168.1.10:49377 > 239.255.255.250:ssdp / Raw
256	2020-03-18 00:39:27	fe80::1	fe80::f141:b4f2:11de:b126	ICMPv6	86	Ether / IPv6 / ICMPv6ND_NS / ICMPv6 Neighbor Discovery Option - Source Link-Layer Address 9c:d2:4b:38:91:c1
257	2020-03-18 00:39:27	fe80::f141:b4f2:11de:b126	fe80::1	ICMPv6	86	Ether / IPv6 / ICMPv6ND_NA / ICMPv6 Neighbor Discovery Option - Destination Link-Layer Address 00:e0:4c:68:00:2d
258	2020-03-18 00:39:28	192.168.1.10	14.215.177.39	Https	54	Ether / IP / TCP 192.168.1.10:2825 > 14.215.177.39:https FA
259	2020-03-18 00:39:28	192.168.1.10	239.255.255.250	UDP	216	Ether / IP / UDP 192.168.1.10:49377 > 239.255.255.250:ssdp / Raw
260	2020-03-18 00:39:28	240e:d4:2e8e:df00:4882:f650:cbf9:db1d	2404:6800:4008:802::200e	Https	86	Ether / IPv6 / TCP 240e:d4:2e8e:df00:4882:f650:cbf9:db1d:2826 > 2404:6800:4008:802::200e:https S
261	2020-03-18 00:39:29	240e:d4:2e8e:df00:4882:f650:cbf9:db1d	2404:6800:4008:802::200e	Https	86	Ether / IPv6 / TCP 240e:d4:2e8e:df00:4882:f650:cbf9:db1d:2827 > 2404:6800:4008:802::200e:https S
262	2020-03-18 00:39:29	192.168.1.10	172.217.24.14	Https	66	Ether / IP / TCP 192.168.1.10:2828 > 172.217.24.14:https S
263	2020-03-18 00:39:29	192.168.1.10	172.217.24.14	Https	66	Ether / IP / TCP 192.168.1.10:2829 > 172.217.24.14:https S
264	2020-03-18 00:39:29	192.168.1.10	239.255.255.250	UDP	216	Ether / IP / UDP 192.168.1.10:49377 > 239.255.255.250:ssdp / Raw
265	2020-03-18 00:39:29	240e:d4:2e8e:df00:4882:f650:cbf9:db1d	2404:6800:4008:802::200e	Https	86	Ether / IPv6 / TCP 240e:d4:2e8e:df00:4882:f650:cbf9:db1d:2826 > 2404:6800:4008:802::200e:https S
266	2020-03-18 00:39:30	9c:d2:4b:38:91:c1	00:e0:4c:68:00:2d	ARP	60	Ether / ARP who has 192.168.1.10 says 192.168.1.1 / Padding
267	2020-03-18 00:39:30	00:e0:4c:68:00:2d	9c:d2:4b:38:91:c1	ARP	42	Ether / ARP is at 00:e0:4c:68:00:2d says 192.168.1.10
268	2020-03-18 00:39:30	240e:d4:2e8e:df00:4882:f650:cbf9:db1d	2404:6800:4008:802::200e	Https	86	Ether / IPv6 / TCP 240e:d4:2e8e:df00:4882:f650:cbf9:db1d:2827 > 2404:6800:4008:802::200e:https S
269	2020-03-18 00:39:30	240e:d4:2e8e:df00:4882:f650:cbf9:db1d	2404:6800:4008:803::200e	Https	86	Ether / IPv6 / TCP 240e:d4:2e8e:df00:4882:f650:cbf9:db1d:2817 > 2404:6800:4008:803::200e:https S
270	2020-03-18 00:39:30	192.168.1.10	172.217.24.14	Https	66	Ether / IP / TCP 192.168.1.10:2828 > 172.217.24.14:https S
271	2020-03-18 00:39:30	192.168.1.10	172.217.24.14	Https	66	Ether / IP / TCP 192.168.1.10:2829 > 172.217.24.14:https S
272	2020-03-18 00:39:30	192.168.1.10	172.217.27.142	Https	66	Ether / IP / TCP 192.168.1.10:2818 > 172.217.27.142:https S
273	2020-03-18 00:39:30	192.168.1.10	14.215.177.39	Https	54	Ether / IP / TCP 192.168.1.10:2825 > 14.215.177.39:https FA
274	2020-03-18 00:39:30	192.168.1.10	239.255.255.250	UDP	216	Ether / IP / UDP 192.168.1.10:49377 > 239.255.255.250:ssdp / Raw
275	2020-03-18 00:39:30	192.168.1.10	172.217.160.78	Https	66	Ether / IP / TCP 192.168.1.10:2820 > 172.217.160.78:https S
276	2020-03-18 00:39:31	192.168.1.10	154.8.131.192	Https	91	Ether / IP / TCP 192.168.1.10:11843 > 154.8.131.192:https PA / Raw
277	2020-03-18 00:39:31	154.8.131.192	192.168.1.10	Https	87	Ether / IP / TCP 154.8.131.192:https > 192.168.1.10:11843 PA / Raw
278	2020-03-18 00:39:31	192.168.1.10	154.8.131.192	Https	54	Ether / IP / TCP 192.168.1.10:11843 > 154.8.131.192:https A
279	2020-03-18 00:39:31	192.168.1.10	172.217.160.78	Https	66	Ether / IP / TCP 192.168.1.10:2821 > 172.217.160.78:https S
280	2020-03-18 00:39:31	240e:d4:2e8e:df00:4882:f650:cbf9:db1d	2404:6800:4008:802::200e	Https	86	Ether / IPv6 / TCP 240e:d4:2e8e:df00:4882:f650:cbf9:db1d:2826 > 2404:6800:4008:802::200e:https S
281	2020-03-18 00:39:32	240e:d4:2e8e:df00:4882:f650:cbf9:db1d	2404:6800:4008:802::200e	Https	86	Ether / IPv6 / TCP 240e:d4:2e8e:df00:4882:f650:cbf9:db1d:2827 > 2404:6800:4008:802::200e:https S
282	2020-03-18 00:39:32	192.168.1.10	172.217.24.14	Https	66	Ether / IP / TCP 192.168.1.10:2828 > 172.217.24.14:https S
283	2020-03-18 00:39:32	192.168.1.10	172.217.24.14	Https	66	Ether / IP / TCP 192.168.1.10:2829 > 172.217.24.14:https S
284	2020-03-18 00:39:32	180.163.21.35	192.168.1.10	Http	60	Ether / IP / TCP 180.163.21.35:http > 192.168.1.10:13664 A / Padding
285	2020-03-18 00:39:32	192.168.1.10	180.163.21.35	Http	54	Ether / IP / TCP 192.168.1.10:13664 > 180.163.21.35:http A
286	2020-03-18 00:39:34	fe80::f141:b4f2:11de:b126	fe80::1	ICMPv6	86	Ether / IPv6 / ICMPv6ND_NS / ICMPv6 Neighbor Discovery Option - Source Link-Layer Address 00:e0:4c:68:00:2d
287	2020-03-18 00:39:34	fe80::1	fe80::f141:b4f2:11de:b126	ICMPv6	78	Ether / IPv6 / ICMPv6 Neighbor Discovery - Neighbor Advertisement (tgt: fe80::1)
288	2020-03-18 00:39:35	192.168.1.10	14.215.177.39	Https	54	Ether / IP / TCP 192.168.1.10:2822 > 14.215.177.39:https RA
289	2020-03-18 00:39:35	92.223.85.103	192.168.1.10	Http	60	Ether / IP / TCP 92.223.85.103:http > 192.168.1.10:14585 A / Padding
290	2020-03-18 00:39:35	192.168.1.10	92.223.85.103	Http	54	Ether / IP / TCP 192.168.1.10:14585 > 92.223.85.103:http A
291	2020-03-18 00:39:35	192.168.1.10	172.217.27.142	Https	66	Ether / IP / TCP 192.168.1.10:2823 > 172.217.27.142:https S
292	2020-03-18 00:39:35	192.168.1.10	14.215.177.39	Https	54	Ether / IP / TCP 192.168.1.10:2825 > 14.215.177.39:https FA
293	2020-03-18 00:39:35	240e:d4:2e8e:df00:4882:f650:cbf9:db1d	2404:6800:4008:803::200e	Https	86	Ether / IPv6 / TCP 240e:d4:2e8e:df00:4882:f650:cbf9:db1d:2824 > 2404:6800:4008:803::200e:https S
294	2020-03-18 00:39:35	240e:d4:2e8e:df00:4882:f650:cbf9:db1d	2404:6800:4008:802::200e	Https	86	Ether / IPv6 / TCP 240e:d4:2e8e:df00:4882:f650:cbf9:db1d:2826 > 2404:6800:4008:802::200e:https S
295	2020-03-18 00:39:36	240e:d4:2e8e:df00:4882:f650:cbf9:db1d	2404:6800:4008:802::200e	Https	86	Ether / IPv6 / TCP 240e:d4:2e8e:df00:4882:f650:cbf9:db1d:2827 > 2404:6800:4008:802::200e:https S
296	2020-03-18 00:39:36	192.168.1.10	172.217.27.142	Https	66	Ether / IP / TCP 192.168.1.10:2830 > 172.217.27.142:https S
297	2020-03-18 00:39:36	192.168.1.10	172.217.24.14	Https	66	Ether / IP / TCP 192.168.1.10:2828 > 172.217.24.14:https S
298	2020-03-18 00:39:36	192.168.1.10	14.215.177.39	Https	66	Ether / IP / TCP 192.168.1.10:2831 > 14.215.177.39:https S
299	2020-03-18 00:39:36	14.215.177.39	192.168.1.10	Https	66	Ether / IP / TCP 14.215.177.39:https > 192.168.1.10:2831 SA
300	2020-03-18 00:39:36	192.168.1.10	14.215.177.39	Https	54	Ether / IP / TCP 192.168.1.10:2831 > 14.215.177.39:https A
301	2020-03-18 00:39:36	192.168.1.10	14.215.177.39	Https	54	Ether / IP / TCP 192.168.1.10:2831 > 14.215.177.39:https FA
302	2020-03-18 00:39:36	192.168.1.10	172.217.24.14	Https	66	Ether / IP / TCP 192.168.1.10:2829 > 172.217.24.14:https S
303	2020-03-18 00:39:36	240e:d4:2e8e:df00:4882:f650:cbf9:db1d	2404:6800:4008:803::200e	Https	86	Ether / IPv6 / TCP 240e:d4:2e8e:df00:4882:f650:cbf9:db1d:2832 > 2404:6800:4008:803::200e:https S
304	2020-03-18 00:39:36	192.168.1.10	14.215.177.39	Https	54	Ether / IP / TCP 192.168.1.10:2831 > 14.215.177.39:https FA
