1	2020-03-17 22:44:30	192.168.1.10	220.181.76.102	Http	652	Ether / IP / TCP / HTTP / 'GET' '/fsearch?keyfrom=deskdict.screentrans.http.1.stroke&q=Realtek%20USB%20GbE%20Family%20Controller&pos=-1&doctype=xml&xmlVersion=9.1&dogVersion=1.0&client=deskdict&id=e5eaa952d53a2c94c&vendor=unknown&in=YoudaoDict_webdict_default_8.8.1.0&appVer=8.8.1.0&appZengqiang=0&abTest=0&le=en&proc=python.exe&fytype=AUTO&scrfrom=stroke' 'HTTP/1.1'
2	2020-03-17 22:44:30	220.181.76.102	192.168.1.10	Http	685	Ether / IP / TCP / HTTP / 'HTTP/1.1' '200' 'OK' / Raw
3	2020-03-17 22:44:30	192.168.1.10	220.181.76.102	Http	54	Ether / IP / TCP 192.168.1.10:11480 > 220.181.76.102:http A
4	2020-03-17 22:44:30	192.168.1.10	220.181.76.82	Http	54	Ether / IP / TCP 192.168.1.10:11450 > 220.181.76.82:http FA
5	2020-03-17 22:44:30	192.168.1.10	220.181.76.82	Http	66	Ether / IP / TCP 192.168.1.10:11487 > 220.181.76.82:http S
6	2020-03-17 22:44:30	220.181.76.82	192.168.1.10	Http	66	Ether / IP / TCP 220.181.76.82:http > 192.168.1.10:11487 SA
7	2020-03-17 22:44:30	192.168.1.10	220.181.76.82	Http	54	Ether / IP / TCP 192.168.1.10:11487 > 220.181.76.82:http A
8	2020-03-17 22:44:30	192.168.1.10	220.181.76.82	Http	541	Ether / IP / TCP / HTTP / 'GET' '/apps/log.html?keyfrom=deskdict.main&q=Realtek%20USB%20GbE%20Family%20Controller&timing=stroke_trans_query&type=success&rnd=1d5fc6a:90c0b920&appVer=8.8.1.0&vendor=unknown&id=e5eaa952d53a2c94c&abTest=0&client=deskdict&vip=0' 'HTTP/1.1'
9	2020-03-17 22:44:30	220.181.76.82	192.168.1.10	Http	60	Ether / IP / TCP 220.181.76.82:http > 192.168.1.10:11487 A / Padding
10	2020-03-17 22:44:30	220.181.76.82	192.168.1.10	Http	282	Ether / IP / TCP / HTTP / 'HTTP/1.1' '200' 'OK'
11	2020-03-17 22:44:30	192.168.1.10	220.181.76.82	Http	54	Ether / IP / TCP 192.168.1.10:11487 > 220.181.76.82:http A
12	2020-03-17 22:44:30	192.168.1.10	220.181.76.82	Http	54	Ether / IP / TCP 192.168.1.10:11450 > 220.181.76.82:http FA
13	2020-03-17 22:44:30	192.168.1.10	14.215.177.39	Https	54	Ether / IP / TCP 192.168.1.10:11486 > 14.215.177.39:https FA
14	2020-03-17 22:44:31	192.168.1.10	220.181.76.82	Http	54	Ether / IP / TCP 192.168.1.10:11450 > 220.181.76.82:http FA
15	2020-03-17 22:44:32	180.163.21.35	192.168.1.10	Http	60	Ether / IP / TCP 180.163.21.35:http > 192.168.1.10:9537 A / Padding
16	2020-03-17 22:44:32	192.168.1.10	180.163.21.35	Http	54	Ether / IP / TCP 192.168.1.10:9537 > 180.163.21.35:http A
17	2020-03-17 22:44:32	192.168.1.10	220.181.76.82	Http	54	Ether / IP / TCP 192.168.1.10:11450 > 220.181.76.82:http FA
18	2020-03-17 22:44:32	192.168.1.10	10.10.20.110	UDP	120	Ether / IP / UDP 192.168.1.10:59684 > 10.10.20.110:snmp / SNMP
19	2020-03-17 22:44:33	192.168.1.10	203.208.39.217	UDP	666	Ether / IP / UDP 192.168.1.10:65323 > 203.208.39.217:https / Raw
20	2020-03-17 22:44:33	192.168.1.10	203.208.39.217	UDP	673	Ether / IP / UDP 192.168.1.10:65323 > 203.208.39.217:https / Raw
21	2020-03-17 22:44:33	203.208.39.217	192.168.1.10	UDP	62	Ether / IP / UDP 203.208.39.217:https > 192.168.1.10:65323 / Raw
22	2020-03-17 22:44:33	203.208.39.217	192.168.1.10	UDP	111	Ether / IP / UDP 203.208.39.217:https > 192.168.1.10:65323 / Raw
23	2020-03-17 22:44:33	203.208.39.217	192.168.1.10	UDP	88	Ether / IP / UDP 203.208.39.217:https > 192.168.1.10:65323 / Raw
24	2020-03-17 22:44:33	192.168.1.10	203.208.39.217	UDP	70	Ether / IP / UDP 192.168.1.10:65323 > 203.208.39.217:https / Raw
25	2020-03-17 22:44:34	fe80::f141:b4f2:11de:b126	fe80::1	DNS	95	Ether / IPv6 / UDP / DNS Qry "b'www.cnblogs.com.'" 
26	2020-03-17 22:44:34	fe80::f141:b4f2:11de:b126	fe80::1	DNS	100	Ether / IPv6 / UDP / DNS Qry "b'adservice.google.com.'" 
27	2020-03-17 22:44:34	fe80::f141:b4f2:11de:b126	fe80::1	DNS	100	Ether / IPv6 / UDP / DNS Qry "b'adservice.google.com.'" 
28	2020-03-17 22:44:34	fe80::f141:b4f2:11de:b126	fe80::1	DNS	95	Ether / IPv6 / UDP / DNS Qry "b'www.cnblogs.com.'" 
29	2020-03-17 22:44:34	fe80::f141:b4f2:11de:b126	fe80::1	DNS	98	Ether / IPv6 / UDP / DNS Qry "b'common.cnblogs.com.'" 
30	2020-03-17 22:44:34	fe80::f141:b4f2:11de:b126	fe80::1	DNS	98	Ether / IPv6 / UDP / DNS Qry "b'common.cnblogs.com.'" 
31	2020-03-17 22:44:34	192.168.1.10	203.208.40.95	UDP	567	Ether / IP / UDP 192.168.1.10:50082 > 203.208.40.95:https / Raw
32	2020-03-17 22:44:34	fe80::1	fe80::f141:b4f2:11de:b126	DNS	457	Ether / IPv6 / UDP / DNS Ans "101.37.113.127" 
33	2020-03-17 22:44:34	fe80::1	fe80::f141:b4f2:11de:b126	DNS	190	Ether / IPv6 / UDP / DNS Ans "b'pagead46.l.doubleclick.net.'" 
34	2020-03-17 22:44:34	fe80::1	fe80::f141:b4f2:11de:b126	DNS	447	Ether / IPv6 / UDP / DNS Ans "b'pagead46.l.doubleclick.net.'" 
35	2020-03-17 22:44:34	fe80::1	fe80::f141:b4f2:11de:b126	DNS	428	Ether / IPv6 / UDP / DNS Ans "42.121.254.191" 
36	2020-03-17 22:44:34	fe80::1	fe80::f141:b4f2:11de:b126	DNS	168	Ether / IPv6 / UDP / DNS Ans 
37	2020-03-17 22:44:34	fe80::1	fe80::f141:b4f2:11de:b126	DNS	171	Ether / IPv6 / UDP / DNS Ans 
38	2020-03-17 22:44:34	192.168.1.10	101.37.113.127	Https	66	Ether / IP / TCP 192.168.1.10:11489 > 101.37.113.127:https S
39	2020-03-17 22:44:34	fe80::f141:b4f2:11de:b126	fe80::1	DNS	107	Ether / IPv6 / UDP / DNS Qry "b'googleads.g.doubleclick.net.'" 
40	2020-03-17 22:44:34	192.168.1.10	42.121.254.191	Https	66	Ether / IP / TCP 192.168.1.10:11490 > 42.121.254.191:https S
41	2020-03-17 22:44:34	fe80::f141:b4f2:11de:b126	fe80::1	DNS	103	Ether / IPv6 / UDP / DNS Qry "b'blog-static.cnblogs.com.'" 
42	2020-03-17 22:44:34	fe80::f141:b4f2:11de:b126	fe80::1	DNS	103	Ether / IPv6 / UDP / DNS Qry "b'blog-static.cnblogs.com.'" 
43	2020-03-17 22:44:34	fe80::1	fe80::f141:b4f2:11de:b126	DNS	192	Ether / IPv6 / UDP / DNS Ans "b'pagead46.l.doubleclick.net.'" 
44	2020-03-17 22:44:34	192.168.1.10	203.208.39.217	UDP	1392	Ether / IP / UDP 192.168.1.10:58953 > 203.208.39.217:https / Raw
45	2020-03-17 22:44:34	fe80::f141:b4f2:11de:b126	fe80::1	DNS	100	Ether / IPv6 / UDP / DNS Qry "b'cdnjs.cloudflare.com.'" 
46	2020-03-17 22:44:34	fe80::f141:b4f2:11de:b126	fe80::1	DNS	100	Ether / IPv6 / UDP / DNS Qry "b'cdnjs.cloudflare.com.'" 
47	2020-03-17 22:44:34	fe80::1	fe80::f141:b4f2:11de:b126	DNS	433	Ether / IPv6 / UDP / DNS Ans "47.99.1.159" 
48	2020-03-17 22:44:34	fe80::1	fe80::f141:b4f2:11de:b126	DNS	176	Ether / IPv6 / UDP / DNS Ans 
49	2020-03-17 22:44:34	fe80::1	fe80::f141:b4f2:11de:b126	DNS	550	Ether / IPv6 / UDP / DNS Ans "104.17.65.4" 
50	2020-03-17 22:44:34	fe80::1	fe80::f141:b4f2:11de:b126	DNS	574	Ether / IPv6 / UDP / DNS Ans "2606:4700::6811:4004" 
51	2020-03-17 22:44:34	192.168.1.10	47.99.1.159	Https	66	Ether / IP / TCP 192.168.1.10:11491 > 47.99.1.159:https S
52	2020-03-17 22:44:34	240e:d4:2e8e:df00:4882:f650:cbf9:db1d	2606:4700::6811:4004	Https	86	Ether / IPv6 / TCP 240e:d4:2e8e:df00:4882:f650:cbf9:db1d:11492 > 2606:4700::6811:4004:https S
53	2020-03-17 22:44:34	42.121.254.191	192.168.1.10	Https	66	Ether / IP / TCP 42.121.254.191:https > 192.168.1.10:11490 SA
54	2020-03-17 22:44:34	192.168.1.10	42.121.254.191	Https	54	Ether / IP / TCP 192.168.1.10:11490 > 42.121.254.191:https A
55	2020-03-17 22:44:34	192.168.1.10	42.121.254.191	Https	571	Ether / IP / TCP 192.168.1.10:11490 > 42.121.254.191:https PA / Raw
56	2020-03-17 22:44:34	101.37.113.127	192.168.1.10	Https	66	Ether / IP / TCP 101.37.113.127:https > 192.168.1.10:11489 SA
57	2020-03-17 22:44:34	192.168.1.10	101.37.113.127	Https	54	Ether / IP / TCP 192.168.1.10:11489 > 101.37.113.127:https A
58	2020-03-17 22:44:34	192.168.1.10	101.37.113.127	Https	571	Ether / IP / TCP 192.168.1.10:11489 > 101.37.113.127:https PA / Raw
59	2020-03-17 22:44:34	47.99.1.159	192.168.1.10	Https	66	Ether / IP / TCP 47.99.1.159:https > 192.168.1.10:11491 SA
60	2020-03-17 22:44:34	192.168.1.10	47.99.1.159	Https	54	Ether / IP / TCP 192.168.1.10:11491 > 47.99.1.159:https A
61	2020-03-17 22:44:34	192.168.1.10	47.99.1.159	Https	571	Ether / IP / TCP 192.168.1.10:11491 > 47.99.1.159:https PA / Raw
62	2020-03-17 22:44:34	42.121.254.191	192.168.1.10	Https	60	Ether / IP / TCP 42.121.254.191:https > 192.168.1.10:11490 A / Padding
63	2020-03-17 22:44:34	203.208.40.95	192.168.1.10	UDP	109	Ether / IP / UDP 203.208.40.95:https > 192.168.1.10:50082 / Raw
64	2020-03-17 22:44:34	203.208.40.95	192.168.1.10	UDP	60	Ether / IP / UDP 203.208.40.95:https > 192.168.1.10:50082 / Raw / Padding
65	2020-03-17 22:44:34	101.37.113.127	192.168.1.10	Https	60	Ether / IP / TCP 101.37.113.127:https > 192.168.1.10:11489 A / Padding
66	2020-03-17 22:44:34	42.121.254.191	192.168.1.10	Https	1506	Ether / IP / TCP 42.121.254.191:https > 192.168.1.10:11490 A / Raw
67	2020-03-17 22:44:34	42.121.254.191	192.168.1.10	Https	1506	Ether / IP / TCP 42.121.254.191:https > 192.168.1.10:11490 A / Raw
68	2020-03-17 22:44:34	42.121.254.191	192.168.1.10	Https	230	Ether / IP / TCP 42.121.254.191:https > 192.168.1.10:11490 PA / Raw
69	2020-03-17 22:44:34	192.168.1.10	42.121.254.191	Https	54	Ether / IP / TCP 192.168.1.10:11490 > 42.121.254.191:https A
70	2020-03-17 22:44:34	192.168.1.10	203.208.40.95	UDP	70	Ether / IP / UDP 192.168.1.10:50082 > 203.208.40.95:https / Raw
71	2020-03-17 22:44:34	101.37.113.127	192.168.1.10	Https	1506	Ether / IP / TCP 101.37.113.127:https > 192.168.1.10:11489 A / Raw
72	2020-03-17 22:44:34	101.37.113.127	192.168.1.10	Https	1506	Ether / IP / TCP 101.37.113.127:https > 192.168.1.10:11489 A / Raw
73	2020-03-17 22:44:34	101.37.113.127	192.168.1.10	Https	230	Ether / IP / TCP 101.37.113.127:https > 192.168.1.10:11489 PA / Raw
74	2020-03-17 22:44:34	192.168.1.10	101.37.113.127	Https	54	Ether / IP / TCP 192.168.1.10:11489 > 101.37.113.127:https A
75	2020-03-17 22:44:34	47.99.1.159	192.168.1.10	Https	60	Ether / IP / TCP 47.99.1.159:https > 192.168.1.10:11491 A / Padding
76	2020-03-17 22:44:34	47.99.1.159	192.168.1.10	Https	1506	Ether / IP / TCP 47.99.1.159:https > 192.168.1.10:11491 A / Raw
77	2020-03-17 22:44:34	47.99.1.159	192.168.1.10	Https	1506	Ether / IP / TCP 47.99.1.159:https > 192.168.1.10:11491 A / Raw
78	2020-03-17 22:44:34	47.99.1.159	192.168.1.10	Https	230	Ether / IP / TCP 47.99.1.159:https > 192.168.1.10:11491 PA / Raw
79	2020-03-17 22:44:34	192.168.1.10	47.99.1.159	Https	54	Ether / IP / TCP 192.168.1.10:11491 > 47.99.1.159:https A
80	2020-03-17 22:44:34	192.168.1.10	47.99.1.159	Https	147	Ether / IP / TCP 192.168.1.10:11491 > 47.99.1.159:https PA / Raw
81	2020-03-17 22:44:34	192.168.1.10	101.37.113.127	Https	147	Ether / IP / TCP 192.168.1.10:11489 > 101.37.113.127:https PA / Raw
82	2020-03-17 22:44:34	192.168.1.10	42.121.254.191	Https	147	Ether / IP / TCP 192.168.1.10:11490 > 42.121.254.191:https PA / Raw
83	2020-03-17 22:44:34	47.99.1.159	192.168.1.10	Https	312	Ether / IP / TCP 47.99.1.159:https > 192.168.1.10:11491 PA / Raw
84	2020-03-17 22:44:34	47.99.1.159	192.168.1.10	Https	123	Ether / IP / TCP 47.99.1.159:https > 192.168.1.10:11491 PA / Raw
85	2020-03-17 22:44:34	192.168.1.10	47.99.1.159	Https	54	Ether / IP / TCP 192.168.1.10:11491 > 47.99.1.159:https A
86	2020-03-17 22:44:34	101.37.113.127	192.168.1.10	Https	312	Ether / IP / TCP 101.37.113.127:https > 192.168.1.10:11489 PA / Raw
87	2020-03-17 22:44:34	101.37.113.127	192.168.1.10	Https	123	Ether / IP / TCP 101.37.113.127:https > 192.168.1.10:11489 PA / Raw
88	2020-03-17 22:44:34	192.168.1.10	101.37.113.127	Https	54	Ether / IP / TCP 192.168.1.10:11489 > 101.37.113.127:https A
89	2020-03-17 22:44:34	42.121.254.191	192.168.1.10	Https	312	Ether / IP / TCP 42.121.254.191:https > 192.168.1.10:11490 PA / Raw
90	2020-03-17 22:44:34	42.121.254.191	192.168.1.10	Https	123	Ether / IP / TCP 42.121.254.191:https > 192.168.1.10:11490 PA / Raw
91	2020-03-17 22:44:34	192.168.1.10	42.121.254.191	Https	54	Ether / IP / TCP 192.168.1.10:11490 > 42.121.254.191:https A
92	2020-03-17 22:44:34	203.208.39.217	192.168.1.10	UDP	1392	Ether / IP / UDP 203.208.39.217:https > 192.168.1.10:58953 / Raw
93	2020-03-17 22:44:34	192.168.1.10	203.208.39.217	UDP	70	Ether / IP / UDP 192.168.1.10:58953 > 203.208.39.217:https / Raw
94	2020-03-17 22:44:34	192.168.1.10	219.133.60.246	UDP	1012	Ether / IP / UDP 192.168.1.10:54843 > 219.133.60.246:8000 / Raw
95	2020-03-17 22:44:34	219.133.60.246	192.168.1.10	UDP	356	Ether / IP / UDP 219.133.60.246:8000 > 192.168.1.10:54843 / Raw
96	2020-03-17 22:44:34	192.168.1.10	101.37.113.127	Https	153	Ether / IP / TCP 192.168.1.10:11489 > 101.37.113.127:https PA / Raw
97	2020-03-17 22:44:34	192.168.1.10	101.37.113.127	Https	92	Ether / IP / TCP 192.168.1.10:11489 > 101.37.113.127:https PA / Raw
98	2020-03-17 22:44:34	192.168.1.10	101.37.113.127	Https	1122	Ether / IP / TCP 192.168.1.10:11489 > 101.37.113.127:https PA / Raw
99	2020-03-17 22:44:34	192.168.1.10	101.37.113.127	Https	195	Ether / IP / TCP 192.168.1.10:11489 > 101.37.113.127:https PA / Raw
100	2020-03-17 22:44:34	fe80::f141:b4f2:11de:b126	fe80::1	DNS	98	Ether / IPv6 / UDP / DNS Qry "b'recomm.cnblogs.com.'" 
101	2020-03-17 22:44:34	fe80::f141:b4f2:11de:b126	fe80::1	DNS	98	Ether / IPv6 / UDP / DNS Qry "b'recomm.cnblogs.com.'" 
102	2020-03-17 22:44:34	fe80::1	fe80::f141:b4f2:11de:b126	DNS	428	Ether / IPv6 / UDP / DNS Ans "47.110.223.99" 
103	2020-03-17 22:44:34	101.37.113.127	192.168.1.10	Https	60	Ether / IP / TCP 101.37.113.127:https > 192.168.1.10:11489 A / Padding
104	2020-03-17 22:44:34	101.37.113.127	192.168.1.10	Https	92	Ether / IP / TCP 101.37.113.127:https > 192.168.1.10:11489 PA / Raw
105	2020-03-17 22:44:34	192.168.1.10	101.37.113.127	Https	214	Ether / IP / TCP 192.168.1.10:11489 > 101.37.113.127:https PA / Raw
106	2020-03-17 22:44:34	fe80::1	fe80::f141:b4f2:11de:b126	DNS	171	Ether / IPv6 / UDP / DNS Ans 
107	2020-03-17 22:44:34	192.168.1.10	101.37.113.127	Https	225	Ether / IP / TCP 192.168.1.10:11489 > 101.37.113.127:https PA / Raw
108	2020-03-17 22:44:34	192.168.1.10	47.110.223.99	Https	66	Ether / IP / TCP 192.168.1.10:11493 > 47.110.223.99:https S
109	2020-03-17 22:44:34	192.168.1.10	220.181.76.82	Http	54	Ether / IP / TCP 192.168.1.10:11450 > 220.181.76.82:http FA
110	2020-03-17 22:44:34	101.37.113.127	192.168.1.10	Https	212	Ether / IP / TCP 101.37.113.127:https > 192.168.1.10:11489 PA / Raw
111	2020-03-17 22:44:34	101.37.113.127	192.168.1.10	Https	172	Ether / IP / TCP 101.37.113.127:https > 192.168.1.10:11489 PA / Raw
112	2020-03-17 22:44:34	101.37.113.127	192.168.1.10	Https	321	Ether / IP / TCP 101.37.113.127:https > 192.168.1.10:11489 PA / Raw
113	2020-03-17 22:44:34	101.37.113.127	192.168.1.10	Https	410	Ether / IP / TCP 101.37.113.127:https > 192.168.1.10:11489 PA / Raw
114	2020-03-17 22:44:34	192.168.1.10	101.37.113.127	Https	54	Ether / IP / TCP 192.168.1.10:11489 > 101.37.113.127:https A
115	2020-03-17 22:44:34	101.37.113.127	192.168.1.10	Https	129	Ether / IP / TCP 101.37.113.127:https > 192.168.1.10:11489 PA / Raw
116	2020-03-17 22:44:34	101.37.113.127	192.168.1.10	Https	92	Ether / IP / TCP 101.37.113.127:https > 192.168.1.10:11489 PA / Raw
117	2020-03-17 22:44:34	192.168.1.10	101.37.113.127	Https	54	Ether / IP / TCP 192.168.1.10:11489 > 101.37.113.127:https A
118	2020-03-17 22:44:34	192.168.1.10	104.17.65.4	Https	66	Ether / IP / TCP 192.168.1.10:11494 > 104.17.65.4:https S
119	2020-03-17 22:44:34	101.37.113.127	192.168.1.10	Https	60	Ether / IP / TCP 101.37.113.127:https > 192.168.1.10:11489 A / Padding
120	2020-03-17 22:44:34	47.110.223.99	192.168.1.10	Https	66	Ether / IP / TCP 47.110.223.99:https > 192.168.1.10:11493 SA
121	2020-03-17 22:44:34	192.168.1.10	47.110.223.99	Https	54	Ether / IP / TCP 192.168.1.10:11493 > 47.110.223.99:https A
122	2020-03-17 22:44:34	192.168.1.10	47.110.223.99	Https	571	Ether / IP / TCP 192.168.1.10:11493 > 47.110.223.99:https PA / Raw
123	2020-03-17 22:44:34	101.37.113.127	192.168.1.10	Https	148	Ether / IP / TCP 101.37.113.127:https > 192.168.1.10:11489 PA / Raw
124	2020-03-17 22:44:34	101.37.113.127	192.168.1.10	Https	112	Ether / IP / TCP 101.37.113.127:https > 192.168.1.10:11489 PA / Raw
125	2020-03-17 22:44:34	101.37.113.127	192.168.1.10	Https	163	Ether / IP / TCP 101.37.113.127:https > 192.168.1.10:11489 PA / Raw
126	2020-03-17 22:44:34	101.37.113.127	192.168.1.10	Https	114	Ether / IP / TCP 101.37.113.127:https > 192.168.1.10:11489 PA / Raw
127	2020-03-17 22:44:34	101.37.113.127	192.168.1.10	Https	174	Ether / IP / TCP 101.37.113.127:https > 192.168.1.10:11489 PA / Raw
128	2020-03-17 22:44:34	101.37.113.127	192.168.1.10	Https	102	Ether / IP / TCP 101.37.113.127:https > 192.168.1.10:11489 PA / Raw
129	2020-03-17 22:44:34	192.168.1.10	101.37.113.127	Https	54	Ether / IP / TCP 192.168.1.10:11489 > 101.37.113.127:https A
130	2020-03-17 22:44:34	47.110.223.99	192.168.1.10	Https	60	Ether / IP / TCP 47.110.223.99:https > 192.168.1.10:11493 A / Padding
131	2020-03-17 22:44:34	47.110.223.99	192.168.1.10	Https	1506	Ether / IP / TCP 47.110.223.99:https > 192.168.1.10:11493 A / Raw
132	2020-03-17 22:44:34	47.110.223.99	192.168.1.10	Https	1506	Ether / IP / TCP 47.110.223.99:https > 192.168.1.10:11493 A / Raw
133	2020-03-17 22:44:34	47.110.223.99	192.168.1.10	Https	230	Ether / IP / TCP 47.110.223.99:https > 192.168.1.10:11493 PA / Raw
134	2020-03-17 22:44:34	192.168.1.10	47.110.223.99	Https	54	Ether / IP / TCP 192.168.1.10:11493 > 47.110.223.99:https A
135	2020-03-17 22:44:34	101.37.113.127	192.168.1.10	Https	146	Ether / IP / TCP 101.37.113.127:https > 192.168.1.10:11489 PA / Raw
136	2020-03-17 22:44:34	101.37.113.127	192.168.1.10	Https	132	Ether / IP / TCP 101.37.113.127:https > 192.168.1.10:11489 PA / Raw
137	2020-03-17 22:44:34	101.37.113.127	192.168.1.10	Https	296	Ether / IP / TCP 101.37.113.127:https > 192.168.1.10:11489 PA / Raw
138	2020-03-17 22:44:34	101.37.113.127	192.168.1.10	Https	572	Ether / IP / TCP 101.37.113.127:https > 192.168.1.10:11489 PA / Raw
139	2020-03-17 22:44:34	101.37.113.127	192.168.1.10	Https	386	Ether / IP / TCP 101.37.113.127:https > 192.168.1.10:11489 PA / Raw
140	2020-03-17 22:44:34	101.37.113.127	192.168.1.10	Https	455	Ether / IP / TCP 101.37.113.127:https > 192.168.1.10:11489 PA / Raw
141	2020-03-17 22:44:34	101.37.113.127	192.168.1.10	Https	427	Ether / IP / TCP 101.37.113.127:https > 192.168.1.10:11489 PA / Raw
142	2020-03-17 22:44:34	101.37.113.127	192.168.1.10	Https	537	Ether / IP / TCP 101.37.113.127:https > 192.168.1.10:11489 PA / Raw
143	2020-03-17 22:44:34	101.37.113.127	192.168.1.10	Https	483	Ether / IP / TCP 101.37.113.127:https > 192.168.1.10:11489 PA / Raw
144	2020-03-17 22:44:34	101.37.113.127	192.168.1.10	Https	387	Ether / IP / TCP 101.37.113.127:https > 192.168.1.10:11489 PA / Raw
145	2020-03-17 22:44:34	101.37.113.127	192.168.1.10	Https	102	Ether / IP / TCP 101.37.113.127:https > 192.168.1.10:11489 PA / Raw
146	2020-03-17 22:44:34	192.168.1.10	101.37.113.127	Https	54	Ether / IP / TCP 192.168.1.10:11489 > 101.37.113.127:https A
147	2020-03-17 22:44:34	192.168.1.10	203.208.39.217	UDP	1146	Ether / IP / UDP 192.168.1.10:58953 > 203.208.39.217:https / Raw
148	2020-03-17 22:44:34	192.168.1.10	47.110.223.99	Https	147	Ether / IP / TCP 192.168.1.10:11493 > 47.110.223.99:https PA / Raw
149	2020-03-17 22:44:34	192.168.1.10	47.110.223.99	Https	153	Ether / IP / TCP 192.168.1.10:11493 > 47.110.223.99:https PA / Raw
150	2020-03-17 22:44:34	192.168.1.10	47.110.223.99	Https	419	Ether / IP / TCP 192.168.1.10:11493 > 47.110.223.99:https PA / Raw
151	2020-03-17 22:44:34	192.168.1.10	101.37.113.127	Https	199	Ether / IP / TCP 192.168.1.10:11489 > 101.37.113.127:https PA / Raw
152	2020-03-17 22:44:34	47.110.223.99	192.168.1.10	Https	312	Ether / IP / TCP 47.110.223.99:https > 192.168.1.10:11493 PA / Raw
153	2020-03-17 22:44:34	47.110.223.99	192.168.1.10	Https	123	Ether / IP / TCP 47.110.223.99:https > 192.168.1.10:11493 PA / Raw
154	2020-03-17 22:44:34	192.168.1.10	47.110.223.99	Https	54	Ether / IP / TCP 192.168.1.10:11493 > 47.110.223.99:https A
155	2020-03-17 22:44:34	47.110.223.99	192.168.1.10	Https	92	Ether / IP / TCP 47.110.223.99:https > 192.168.1.10:11493 PA / Raw
156	2020-03-17 22:44:34	192.168.1.10	47.110.223.99	Https	92	Ether / IP / TCP 192.168.1.10:11493 > 47.110.223.99:https PA / Raw
157	2020-03-17 22:44:34	47.110.223.99	192.168.1.10	Https	256	Ether / IP / TCP 47.110.223.99:https > 192.168.1.10:11493 PA / Raw
158	2020-03-17 22:44:34	192.168.1.10	47.110.223.99	Https	54	Ether / IP / TCP 192.168.1.10:11493 > 47.110.223.99:https A
159	2020-03-17 22:44:34	192.168.1.10	47.110.223.99	Https	66	Ether / IP / TCP 192.168.1.10:11495 > 47.110.223.99:https S
160	2020-03-17 22:44:34	fe80::f141:b4f2:11de:b126	fe80::1	DNS	97	Ether / IPv6 / UDP / DNS Qry "b'count.cnblogs.com.'" 
161	2020-03-17 22:44:34	fe80::f141:b4f2:11de:b126	fe80::1	DNS	97	Ether / IPv6 / UDP / DNS Qry "b'count.cnblogs.com.'" 
162	2020-03-17 22:44:34	fe80::1	fe80::f141:b4f2:11de:b126	DNS	438	Ether / IPv6 / UDP / DNS Ans "118.178.109.187" 
163	2020-03-17 22:44:34	47.110.223.99	192.168.1.10	Https	66	Ether / IP / TCP 47.110.223.99:https > 192.168.1.10:11495 SA
164	2020-03-17 22:44:34	192.168.1.10	47.110.223.99	Https	54	Ether / IP / TCP 192.168.1.10:11495 > 47.110.223.99:https A
165	2020-03-17 22:44:34	101.37.113.127	192.168.1.10	Https	151	Ether / IP / TCP 101.37.113.127:https > 192.168.1.10:11489 PA / Raw
166	2020-03-17 22:44:34	101.37.113.127	192.168.1.10	Https	145	Ether / IP / TCP 101.37.113.127:https > 192.168.1.10:11489 PA / Raw
167	2020-03-17 22:44:34	101.37.113.127	192.168.1.10	Https	344	Ether / IP / TCP 101.37.113.127:https > 192.168.1.10:11489 PA / Raw
168	2020-03-17 22:44:34	192.168.1.10	47.110.223.99	Https	571	Ether / IP / TCP 192.168.1.10:11495 > 47.110.223.99:https PA / Raw
169	2020-03-17 22:44:34	192.168.1.10	101.37.113.127	Https	54	Ether / IP / TCP 192.168.1.10:11489 > 101.37.113.127:https A
170	2020-03-17 22:44:34	101.37.113.127	192.168.1.10	Https	426	Ether / IP / TCP 101.37.113.127:https > 192.168.1.10:11489 PA / Raw
171	2020-03-17 22:44:34	101.37.113.127	192.168.1.10	Https	488	Ether / IP / TCP 101.37.113.127:https > 192.168.1.10:11489 PA / Raw
172	2020-03-17 22:44:34	101.37.113.127	192.168.1.10	Https	494	Ether / IP / TCP 101.37.113.127:https > 192.168.1.10:11489 PA / Raw
173	2020-03-17 22:44:34	101.37.113.127	192.168.1.10	Https	508	Ether / IP / TCP 101.37.113.127:https > 192.168.1.10:11489 PA / Raw
174	2020-03-17 22:44:34	101.37.113.127	192.168.1.10	Https	557	Ether / IP / TCP 101.37.113.127:https > 192.168.1.10:11489 PA / Raw
175	2020-03-17 22:44:34	192.168.1.10	101.37.113.127	Https	54	Ether / IP / TCP 192.168.1.10:11489 > 101.37.113.127:https A
176	2020-03-17 22:44:34	101.37.113.127	192.168.1.10	Https	578	Ether / IP / TCP 101.37.113.127:https > 192.168.1.10:11489 PA / Raw
177	2020-03-17 22:44:34	101.37.113.127	192.168.1.10	Https	640	Ether / IP / TCP 101.37.113.127:https > 192.168.1.10:11489 PA / Raw
178	2020-03-17 22:44:34	101.37.113.127	192.168.1.10	Https	447	Ether / IP / TCP 101.37.113.127:https > 192.168.1.10:11489 PA / Raw
179	2020-03-17 22:44:34	101.37.113.127	192.168.1.10	Https	102	Ether / IP / TCP 101.37.113.127:https > 192.168.1.10:11489 PA / Raw
180	2020-03-17 22:44:34	192.168.1.10	101.37.113.127	Https	54	Ether / IP / TCP 192.168.1.10:11489 > 101.37.113.127:https A
181	2020-03-17 22:44:34	fe80::1	fe80::f141:b4f2:11de:b126	DNS	170	Ether / IPv6 / UDP / DNS Ans 
182	2020-03-17 22:44:34	192.168.1.10	118.178.109.187	Https	66	Ether / IP / TCP 192.168.1.10:11496 > 118.178.109.187:https S
183	2020-03-17 22:44:34	47.110.223.99	192.168.1.10	Https	60	Ether / IP / TCP 47.110.223.99:https > 192.168.1.10:11495 A / Padding
184	2020-03-17 22:44:34	47.110.223.99	192.168.1.10	Https	1506	Ether / IP / TCP 47.110.223.99:https > 192.168.1.10:11495 A / Raw
185	2020-03-17 22:44:34	47.110.223.99	192.168.1.10	Https	1506	Ether / IP / TCP 47.110.223.99:https > 192.168.1.10:11495 A / Raw
186	2020-03-17 22:44:34	47.110.223.99	192.168.1.10	Https	230	Ether / IP / TCP 47.110.223.99:https > 192.168.1.10:11495 PA / Raw
187	2020-03-17 22:44:34	192.168.1.10	47.110.223.99	Https	54	Ether / IP / TCP 192.168.1.10:11495 > 47.110.223.99:https A
188	2020-03-17 22:44:34	118.178.109.187	192.168.1.10	Https	66	Ether / IP / TCP 118.178.109.187:https > 192.168.1.10:11496 SA
189	2020-03-17 22:44:34	192.168.1.10	118.178.109.187	Https	54	Ether / IP / TCP 192.168.1.10:11496 > 118.178.109.187:https A
190	2020-03-17 22:44:34	192.168.1.10	47.110.223.99	Https	147	Ether / IP / TCP 192.168.1.10:11495 > 47.110.223.99:https PA / Raw
191	2020-03-17 22:44:34	192.168.1.10	118.178.109.187	Https	571	Ether / IP / TCP 192.168.1.10:11496 > 118.178.109.187:https PA / Raw
192	2020-03-17 22:44:34	192.168.1.10	47.110.223.99	Https	153	Ether / IP / TCP 192.168.1.10:11495 > 47.110.223.99:https PA / Raw
193	2020-03-17 22:44:34	192.168.1.10	47.110.223.99	Https	655	Ether / IP / TCP 192.168.1.10:11495 > 47.110.223.99:https PA / Raw
194	2020-03-17 22:44:34	192.168.1.10	47.110.223.99	Https	179	Ether / IP / TCP 192.168.1.10:11495 > 47.110.223.99:https PA / Raw
195	2020-03-17 22:44:34	47.110.223.99	192.168.1.10	Https	60	Ether / IP / TCP 47.110.223.99:https > 192.168.1.10:11493 A / Padding
196	2020-03-17 22:44:34	203.208.39.217	192.168.1.10	UDP	945	Ether / IP / UDP 203.208.39.217:https > 192.168.1.10:58953 / Raw
197	2020-03-17 22:44:34	203.208.39.217	192.168.1.10	UDP	85	Ether / IP / UDP 203.208.39.217:https > 192.168.1.10:58953 / Raw
198	2020-03-17 22:44:34	47.110.223.99	192.168.1.10	Https	312	Ether / IP / TCP 47.110.223.99:https > 192.168.1.10:11495 PA / Raw
199	2020-03-17 22:44:34	47.110.223.99	192.168.1.10	Https	123	Ether / IP / TCP 47.110.223.99:https > 192.168.1.10:11495 PA / Raw
200	2020-03-17 22:44:34	192.168.1.10	47.110.223.99	Https	54	Ether / IP / TCP 192.168.1.10:11495 > 47.110.223.99:https A
201	2020-03-17 22:44:34	192.168.1.10	203.208.39.217	UDP	70	Ether / IP / UDP 192.168.1.10:58953 > 203.208.39.217:https / Raw
202	2020-03-17 22:44:34	192.168.1.10	47.110.223.99	Https	92	Ether / IP / TCP 192.168.1.10:11495 > 47.110.223.99:https PA / Raw
203	2020-03-17 22:44:34	47.110.223.99	192.168.1.10	Https	60	Ether / IP / TCP 47.110.223.99:https > 192.168.1.10:11495 A / Padding
204	2020-03-17 22:44:34	47.110.223.99	192.168.1.10	Https	92	Ether / IP / TCP 47.110.223.99:https > 192.168.1.10:11495 PA / Raw
205	2020-03-17 22:44:34	118.178.109.187	192.168.1.10	Https	60	Ether / IP / TCP 118.178.109.187:https > 192.168.1.10:11496 A / Padding
206	2020-03-17 22:44:34	118.178.109.187	192.168.1.10	Https	1506	Ether / IP / TCP 118.178.109.187:https > 192.168.1.10:11496 A / Raw
207	2020-03-17 22:44:34	118.178.109.187	192.168.1.10	Https	1506	Ether / IP / TCP 118.178.109.187:https > 192.168.1.10:11496 A / Raw
208	2020-03-17 22:44:34	118.178.109.187	192.168.1.10	Https	230	Ether / IP / TCP 118.178.109.187:https > 192.168.1.10:11496 PA / Raw
209	2020-03-17 22:44:34	192.168.1.10	118.178.109.187	Https	54	Ether / IP / TCP 192.168.1.10:11496 > 118.178.109.187:https A
210	2020-03-17 22:44:34	47.110.223.99	192.168.1.10	Https	1019	Ether / IP / TCP 47.110.223.99:https > 192.168.1.10:11495 PA / Raw
211	2020-03-17 22:44:34	47.110.223.99	192.168.1.10	Https	92	Ether / IP / TCP 47.110.223.99:https > 192.168.1.10:11495 PA / Raw
212	2020-03-17 22:44:34	192.168.1.10	47.110.223.99	Https	54	Ether / IP / TCP 192.168.1.10:11495 > 47.110.223.99:https A
213	2020-03-17 22:44:34	192.168.1.10	118.178.109.187	Https	147	Ether / IP / TCP 192.168.1.10:11496 > 118.178.109.187:https PA / Raw
214	2020-03-17 22:44:34	192.168.1.10	118.178.109.187	Https	153	Ether / IP / TCP 192.168.1.10:11496 > 118.178.109.187:https PA / Raw
215	2020-03-17 22:44:34	192.168.1.10	118.178.109.187	Https	378	Ether / IP / TCP 192.168.1.10:11496 > 118.178.109.187:https PA / Raw
216	2020-03-17 22:44:34	fe80::f141:b4f2:11de:b126	fe80::1	DNS	93	Ether / IPv6 / UDP / DNS Qry "b'music.163.com.'" 
217	2020-03-17 22:44:34	fe80::f141:b4f2:11de:b126	fe80::1	DNS	93	Ether / IPv6 / UDP / DNS Qry "b'music.163.com.'" 
218	2020-03-17 22:44:34	fe80::1	fe80::f141:b4f2:11de:b126	DNS	368	Ether / IPv6 / UDP / DNS Ans "b'music.ntes53.netease.com.'" 
219	2020-03-17 22:44:34	fe80::1	fe80::f141:b4f2:11de:b126	DNS	364	Ether / IPv6 / UDP / DNS Ans "b'music.ntes53.netease.com.'" 
220	2020-03-17 22:44:34	240e:d4:2e8e:df00:4882:f650:cbf9:db1d	2407:ae80:200:1001::20	Https	86	Ether / IPv6 / TCP 240e:d4:2e8e:df00:4882:f650:cbf9:db1d:11497 > 2407:ae80:200:1001::20:https S
221	2020-03-17 22:44:34	47.110.223.99	192.168.1.10	Https	60	Ether / IP / TCP 47.110.223.99:https > 192.168.1.10:11495 A / Padding
222	2020-03-17 22:44:35	118.178.109.187	192.168.1.10	Https	60	Ether / IP / TCP 118.178.109.187:https > 192.168.1.10:11496 A / Padding
223	2020-03-17 22:44:35	118.178.109.187	192.168.1.10	Https	312	Ether / IP / TCP 118.178.109.187:https > 192.168.1.10:11496 PA / Raw
224	2020-03-17 22:44:35	118.178.109.187	192.168.1.10	Https	132	Ether / IP / TCP 118.178.109.187:https > 192.168.1.10:11496 PA / Raw
225	2020-03-17 22:44:35	192.168.1.10	118.178.109.187	Https	54	Ether / IP / TCP 192.168.1.10:11496 > 118.178.109.187:https A
226	2020-03-17 22:44:35	192.168.1.10	118.178.109.187	Https	92	Ether / IP / TCP 192.168.1.10:11496 > 118.178.109.187:https PA / Raw
227	2020-03-17 22:44:35	2407:ae80:200:1001::20	240e:d4:2e8e:df00:4882:f650:cbf9:db1d	Https	86	Ether / IPv6 / TCP 2407:ae80:200:1001::20:https > 240e:d4:2e8e:df00:4882:f650:cbf9:db1d:11497 SA
228	2020-03-17 22:44:35	240e:d4:2e8e:df00:4882:f650:cbf9:db1d	2407:ae80:200:1001::20	Https	74	Ether / IPv6 / TCP 240e:d4:2e8e:df00:4882:f650:cbf9:db1d:11497 > 2407:ae80:200:1001::20:https A
229	2020-03-17 22:44:35	240e:d4:2e8e:df00:4882:f650:cbf9:db1d	2407:ae80:200:1001::20	Https	591	Ether / IPv6 / TCP 240e:d4:2e8e:df00:4882:f650:cbf9:db1d:11497 > 2407:ae80:200:1001::20:https PA / Raw
230	2020-03-17 22:44:35	118.178.109.187	192.168.1.10	Https	223	Ether / IP / TCP 118.178.109.187:https > 192.168.1.10:11496 PA / Raw
231	2020-03-17 22:44:35	192.168.1.10	118.178.109.187	Https	66	Ether / IP / TCP 192.168.1.10:11498 > 118.178.109.187:https S
232	2020-03-17 22:44:35	2407:ae80:200:1001::20	240e:d4:2e8e:df00:4882:f650:cbf9:db1d	Https	74	Ether / IPv6 / TCP 2407:ae80:200:1001::20:https > 240e:d4:2e8e:df00:4882:f650:cbf9:db1d:11497 A
233	2020-03-17 22:44:35	2407:ae80:200:1001::20	240e:d4:2e8e:df00:4882:f650:cbf9:db1d	Https	666	Ether / IPv6 / TCP 2407:ae80:200:1001::20:https > 240e:d4:2e8e:df00:4882:f650:cbf9:db1d:11497 PA / Raw
234	2020-03-17 22:44:35	240e:d4:2e8e:df00:4882:f650:cbf9:db1d	2407:ae80:200:1001::20	Https	86	Ether / IPv6 / TCP 240e:d4:2e8e:df00:4882:f650:cbf9:db1d:11497 > 2407:ae80:200:1001::20:https A
235	2020-03-17 22:44:35	118.178.109.187	192.168.1.10	Https	66	Ether / IP / TCP 118.178.109.187:https > 192.168.1.10:11498 SA
236	2020-03-17 22:44:35	192.168.1.10	118.178.109.187	Https	54	Ether / IP / TCP 192.168.1.10:11498 > 118.178.109.187:https A
237	2020-03-17 22:44:35	192.168.1.10	118.178.109.187	Https	571	Ether / IP / TCP 192.168.1.10:11498 > 118.178.109.187:https PA / Raw
238	2020-03-17 22:44:35	192.168.1.10	118.178.109.187	Https	54	Ether / IP / TCP 192.168.1.10:11496 > 118.178.109.187:https A
239	2020-03-17 22:44:35	fe80::f141:b4f2:11de:b126	fe80::1	DNS	110	Ether / IPv6 / UDP / DNS Qry "b'securepubads.g.doubleclick.net.'" 
240	2020-03-17 22:44:35	118.178.109.187	192.168.1.10	Https	60	Ether / IP / TCP 118.178.109.187:https > 192.168.1.10:11498 A / Padding
241	2020-03-17 22:44:35	118.178.109.187	192.168.1.10	Https	1506	Ether / IP / TCP 118.178.109.187:https > 192.168.1.10:11498 A / Raw
242	2020-03-17 22:44:35	118.178.109.187	192.168.1.10	Https	1506	Ether / IP / TCP 118.178.109.187:https > 192.168.1.10:11498 A / Raw
243	2020-03-17 22:44:35	118.178.109.187	192.168.1.10	Https	230	Ether / IP / TCP 118.178.109.187:https > 192.168.1.10:11498 PA / Raw
244	2020-03-17 22:44:35	192.168.1.10	118.178.109.187	Https	54	Ether / IP / TCP 192.168.1.10:11498 > 118.178.109.187:https A
245	2020-03-17 22:44:35	fe80::1	fe80::f141:b4f2:11de:b126	DNS	196	Ether / IPv6 / UDP / DNS Ans "b'partnerad.l.doubleclick.net.'" 
246	2020-03-17 22:44:35	192.168.1.10	118.178.109.187	Https	147	Ether / IP / TCP 192.168.1.10:11498 > 118.178.109.187:https PA / Raw
247	2020-03-17 22:44:35	192.168.1.10	203.208.40.57	UDP	1392	Ether / IP / UDP 192.168.1.10:58993 > 203.208.40.57:https / Raw
248	2020-03-17 22:44:35	192.168.1.10	118.178.109.187	Https	153	Ether / IP / TCP 192.168.1.10:11498 > 118.178.109.187:https PA / Raw
249	2020-03-17 22:44:35	192.168.1.10	203.208.40.57	UDP	1224	Ether / IP / UDP 192.168.1.10:58993 > 203.208.40.57:https / Raw
250	2020-03-17 22:44:35	192.168.1.10	118.178.109.187	Https	632	Ether / IP / TCP 192.168.1.10:11498 > 118.178.109.187:https PA / Raw
251	2020-03-17 22:44:35	192.168.1.10	14.215.177.39	Https	54	Ether / IP / TCP 192.168.1.10:11478 > 14.215.177.39:https RA
252	2020-03-17 22:44:35	192.168.1.10	40.119.211.203	Https	155	Ether / IP / TCP 192.168.1.10:1310 > 40.119.211.203:https PA / Raw
253	2020-03-17 22:44:35	118.178.109.187	192.168.1.10	Https	60	Ether / IP / TCP 118.178.109.187:https > 192.168.1.10:11496 A / Padding
254	2020-03-17 22:44:35	118.178.109.187	192.168.1.10	Https	312	Ether / IP / TCP 118.178.109.187:https > 192.168.1.10:11498 PA / Raw
255	2020-03-17 22:44:35	118.178.109.187	192.168.1.10	Https	123	Ether / IP / TCP 118.178.109.187:https > 192.168.1.10:11498 PA / Raw
256	2020-03-17 22:44:35	192.168.1.10	118.178.109.187	Https	54	Ether / IP / TCP 192.168.1.10:11498 > 118.178.109.187:https A
257	2020-03-17 22:44:35	192.168.1.10	118.178.109.187	Https	92	Ether / IP / TCP 192.168.1.10:11498 > 118.178.109.187:https PA / Raw
258	2020-03-17 22:44:35	118.178.109.187	192.168.1.10	Https	92	Ether / IP / TCP 118.178.109.187:https > 192.168.1.10:11498 PA / Raw
259	2020-03-17 22:44:35	118.178.109.187	192.168.1.10	Https	200	Ether / IP / TCP 118.178.109.187:https > 192.168.1.10:11498 PA / Raw
260	2020-03-17 22:44:35	192.168.1.10	118.178.109.187	Https	54	Ether / IP / TCP 192.168.1.10:11498 > 118.178.109.187:https A
261	2020-03-17 22:44:35	203.208.40.57	192.168.1.10	UDP	1392	Ether / IP / UDP 203.208.40.57:https > 192.168.1.10:58993 / Raw
262	2020-03-17 22:44:35	203.208.40.57	192.168.1.10	UDP	1392	Ether / IP / UDP 203.208.40.57:https > 192.168.1.10:58993 / Raw
263	2020-03-17 22:44:35	192.168.1.10	203.208.40.57	UDP	78	Ether / IP / UDP 192.168.1.10:58993 > 203.208.40.57:https / Raw
264	2020-03-17 22:44:35	192.168.1.10	203.208.40.57	UDP	1392	Ether / IP / UDP 192.168.1.10:58993 > 203.208.40.57:https / Raw
265	2020-03-17 22:44:35	192.168.1.10	203.208.40.57	UDP	1224	Ether / IP / UDP 192.168.1.10:58993 > 203.208.40.57:https / Raw
266	2020-03-17 22:44:35	fe80::f141:b4f2:11de:b126	fe80::1	DNS	104	Ether / IPv6 / UDP / DNS Qry "b'www.google-analytics.com.'" 
267	2020-03-17 22:44:35	118.178.109.187	192.168.1.10	Https	60	Ether / IP / TCP 118.178.109.187:https > 192.168.1.10:11498 A / Padding
268	2020-03-17 22:44:35	fe80::1	fe80::f141:b4f2:11de:b126	DNS	198	Ether / IPv6 / UDP / DNS Ans "b'www-google-analytics.l.google.com.'" 
269	2020-03-17 22:44:35	192.168.1.10	203.208.50.37	UDP	1392	Ether / IP / UDP 192.168.1.10:65027 > 203.208.50.37:https / Raw
270	2020-03-17 22:44:35	192.168.1.10	203.208.50.37	UDP	743	Ether / IP / UDP 192.168.1.10:65027 > 203.208.50.37:https / Raw
271	2020-03-17 22:44:35	40.119.211.203	192.168.1.10	Https	225	Ether / IP / TCP 40.119.211.203:https > 192.168.1.10:1310 PA / Raw
272	2020-03-17 22:44:35	203.208.40.57	192.168.1.10	UDP	81	Ether / IP / UDP 203.208.40.57:https > 192.168.1.10:58993 / Raw
273	2020-03-17 22:44:35	192.168.1.10	40.119.211.203	Https	54	Ether / IP / TCP 192.168.1.10:1310 > 40.119.211.203:https A
274	2020-03-17 22:44:35	203.208.40.57	192.168.1.10	UDP	1392	Ether / IP / UDP 203.208.40.57:https > 192.168.1.10:58993 / Raw
275	2020-03-17 22:44:35	192.168.1.10	203.208.40.57	UDP	70	Ether / IP / UDP 192.168.1.10:58993 > 203.208.40.57:https / Raw
276	2020-03-17 22:44:35	203.208.50.37	192.168.1.10	UDP	1392	Ether / IP / UDP 203.208.50.37:https > 192.168.1.10:65027 / Raw
277	2020-03-17 22:44:35	192.168.1.10	203.208.50.37	UDP	70	Ether / IP / UDP 192.168.1.10:65027 > 203.208.50.37:https / Raw
278	2020-03-17 22:44:35	fe80::f141:b4f2:11de:b126	fe80::1	DNS	97	Ether / IPv6 / UDP / DNS Qry "b'fonts.gstatic.com.'" 
279	2020-03-17 22:44:35	fe80::1	fe80::f141:b4f2:11de:b126	DNS	183	Ether / IPv6 / UDP / DNS Ans "b'gstaticadssl.l.google.com.'" 
280	2020-03-17 22:44:35	192.168.1.10	203.208.40.79	UDP	1392	Ether / IP / UDP 192.168.1.10:61312 > 203.208.40.79:https / Raw
281	2020-03-17 22:44:35	203.208.50.37	192.168.1.10	UDP	416	Ether / IP / UDP 203.208.50.37:https > 192.168.1.10:65027 / Raw
282	2020-03-17 22:44:35	192.168.1.10	203.208.50.37	UDP	70	Ether / IP / UDP 192.168.1.10:65027 > 203.208.50.37:https / Raw
283	2020-03-17 22:44:35	192.168.1.10	203.208.40.57	UDP	1216	Ether / IP / UDP 192.168.1.10:58993 > 203.208.40.57:https / Raw
284	2020-03-17 22:44:35	203.208.40.79	192.168.1.10	UDP	1392	Ether / IP / UDP 203.208.40.79:https > 192.168.1.10:61312 / Raw
285	2020-03-17 22:44:35	192.168.1.10	203.208.40.79	UDP	70	Ether / IP / UDP 192.168.1.10:61312 > 203.208.40.79:https / Raw
286	2020-03-17 22:44:35	203.208.40.57	192.168.1.10	UDP	65	Ether / IP / UDP 203.208.40.57:https > 192.168.1.10:58993 / Raw
287	2020-03-17 22:44:35	192.168.1.10	14.215.177.39	Https	54	Ether / IP / TCP 192.168.1.10:11486 > 14.215.177.39:https FA
288	2020-03-17 22:44:35	240e:d4:2e8e:df00:4882:f650:cbf9:db1d	2606:4700::6811:4004	Https	86	Ether / IPv6 / TCP 240e:d4:2e8e:df00:4882:f650:cbf9:db1d:11492 > 2606:4700::6811:4004:https S
289	2020-03-17 22:44:35	192.168.1.10	104.17.65.4	Https	66	Ether / IP / TCP 192.168.1.10:11494 > 104.17.65.4:https S
290	2020-03-17 22:44:35	203.208.40.57	192.168.1.10	UDP	1392	Ether / IP / UDP 203.208.40.57:https > 192.168.1.10:58993 / Raw
291	2020-03-17 22:44:35	203.208.40.57	192.168.1.10	UDP	1392	Ether / IP / UDP 203.208.40.57:https > 192.168.1.10:58993 / Raw
292	2020-03-17 22:44:35	203.208.40.57	192.168.1.10	UDP	1392	Ether / IP / UDP 203.208.40.57:https > 192.168.1.10:58993 / Raw
293	2020-03-17 22:44:35	203.208.40.57	192.168.1.10	UDP	1278	Ether / IP / UDP 203.208.40.57:https > 192.168.1.10:58993 / Raw
294	2020-03-17 22:44:35	203.208.40.57	192.168.1.10	UDP	138	Ether / IP / UDP 203.208.40.57:https > 192.168.1.10:58993 / Raw
295	2020-03-17 22:44:35	192.168.1.10	203.208.40.57	UDP	70	Ether / IP / UDP 192.168.1.10:58993 > 203.208.40.57:https / Raw
296	2020-03-17 22:44:35	192.168.1.10	203.208.40.57	UDP	70	Ether / IP / UDP 192.168.1.10:58993 > 203.208.40.57:https / Raw
297	2020-03-17 22:44:35	192.168.1.10	203.208.40.57	UDP	70	Ether / IP / UDP 192.168.1.10:58993 > 203.208.40.57:https / Raw
298	2020-03-17 22:44:35	192.168.1.10	203.208.40.57	UDP	384	Ether / IP / UDP 192.168.1.10:58993 > 203.208.40.57:https / Raw
299	2020-03-17 22:44:35	104.17.65.4	192.168.1.10	Https	66	Ether / IP / TCP 104.17.65.4:https > 192.168.1.10:11494 SA
300	2020-03-17 22:44:35	192.168.1.10	104.17.65.4	Https	54	Ether / IP / TCP 192.168.1.10:11494 > 104.17.65.4:https A
301	2020-03-17 22:44:35	192.168.1.10	104.17.65.4	Https	571	Ether / IP / TCP 192.168.1.10:11494 > 104.17.65.4:https PA / Raw
302	2020-03-17 22:44:35	fe80::f141:b4f2:11de:b126	fe80::1	DNS	99	Ether / IPv6 / UDP / DNS Qry "b'img2018.cnblogs.com.'" 
303	2020-03-17 22:44:35	fe80::f141:b4f2:11de:b126	fe80::1	DNS	99	Ether / IPv6 / UDP / DNS Qry "b'img2018.cnblogs.com.'" 
304	2020-03-17 22:44:35	fe80::1	fe80::f141:b4f2:11de:b126	DNS	429	Ether / IPv6 / UDP / DNS Ans "47.110.198.25" 
305	2020-03-17 22:44:35	fe80::1	fe80::f141:b4f2:11de:b126	DNS	172	Ether / IPv6 / UDP / DNS Ans 
306	2020-03-17 22:44:35	192.168.1.10	47.110.198.25	Https	66	Ether / IP / TCP 192.168.1.10:11499 > 47.110.198.25:https S
307	2020-03-17 22:44:35	192.168.1.10	101.37.113.127	Https	217	Ether / IP / TCP 192.168.1.10:11489 > 101.37.113.127:https PA / Raw
308	2020-03-17 22:44:35	203.208.40.57	192.168.1.10	UDP	130	Ether / IP / UDP 203.208.40.57:https > 192.168.1.10:58993 / Raw
309	2020-03-17 22:44:35	203.208.40.57	192.168.1.10	UDP	60	Ether / IP / UDP 203.208.40.57:https > 192.168.1.10:58993 / Raw / Padding
310	2020-03-17 22:44:35	192.168.1.10	203.208.40.57	UDP	70	Ether / IP / UDP 192.168.1.10:58993 > 203.208.40.57:https / Raw
311	2020-03-17 22:44:35	47.110.198.25	192.168.1.10	Https	66	Ether / IP / TCP 47.110.198.25:https > 192.168.1.10:11499 SA
312	2020-03-17 22:44:35	192.168.1.10	47.110.198.25	Https	54	Ether / IP / TCP 192.168.1.10:11499 > 47.110.198.25:https A
