1	2020-03-17 22:08:55	192.168.1.10	180.163.32.152	UDP	444	Ether / IP / UDP 192.168.1.10:54843 > 180.163.32.152:8000 / Raw
2	2020-03-17 22:08:55	192.168.1.10	14.215.177.39	Https	54	Ether / IP / TCP 192.168.1.10:8847 > 14.215.177.39:https RA
3	2020-03-17 22:08:55	192.168.1.10	220.181.76.102	Http	652	Ether / IP / TCP / HTTP / 'GET' '/fsearch?keyfrom=deskdict.screentrans.http.1.stroke&q=Realtek%20USB%20GbE%20Family%20Controller&pos=-1&doctype=xml&xmlVersion=9.1&dogVersion=1.0&client=deskdict&id=e5eaa952d53a2c94c&vendor=unknown&in=YoudaoDict_webdict_default_8.8.1.0&appVer=8.8.1.0&appZengqiang=0&abTest=0&le=en&proc=python.exe&fytype=AUTO&scrfrom=stroke' 'HTTP/1.1'
4	2020-03-17 22:08:55	220.181.76.102	192.168.1.10	Http	685	Ether / IP / TCP / HTTP / 'HTTP/1.1' '200' 'OK' / Raw
5	2020-03-17 22:08:55	192.168.1.10	220.181.76.102	Http	54	Ether / IP / TCP 192.168.1.10:8855 > 220.181.76.102:http A
6	2020-03-17 22:08:55	fe80::1	fe80::f141:b4f2:11de:b126	ICMPv6	86	Ether / IPv6 / ICMPv6ND_NS / ICMPv6 Neighbor Discovery Option - Source Link-Layer Address 9c:d2:4b:38:91:c1
7	2020-03-17 22:08:55	fe80::f141:b4f2:11de:b126	fe80::1	ICMPv6	86	Ether / IPv6 / ICMPv6ND_NA / ICMPv6 Neighbor Discovery Option - Destination Link-Layer Address 00:e0:4c:68:00:2d
8	2020-03-17 22:08:55	192.168.1.10	239.255.255.250	UDP	698	Ether / IP / UDP 192.168.1.10:60067 > 239.255.255.250:ws_discovery / Raw
9	2020-03-17 22:08:55	192.168.1.10	220.181.76.82	Http	54	Ether / IP / TCP 192.168.1.10:8833 > 220.181.76.82:http FA
10	2020-03-17 22:08:55	192.168.1.10	220.181.76.82	Http	66	Ether / IP / TCP 192.168.1.10:8859 > 220.181.76.82:http S
11	2020-03-17 22:08:55	fe80::f141:b4f2:11de:b126	fe80::1	DNS	102	Ether / IPv6 / UDP / DNS Qry "b'analytics.yinxiang.com.'" 
12	2020-03-17 22:08:55	220.181.76.82	192.168.1.10	Http	60	Ether / IP / TCP 220.181.76.82:http > 192.168.1.10:8833 A / Padding
13	2020-03-17 22:08:55	220.181.76.82	192.168.1.10	Http	66	Ether / IP / TCP 220.181.76.82:http > 192.168.1.10:8859 SA
14	2020-03-17 22:08:55	192.168.1.10	220.181.76.82	Http	54	Ether / IP / TCP 192.168.1.10:8859 > 220.181.76.82:http A
15	2020-03-17 22:08:55	192.168.1.10	220.181.76.82	Http	541	Ether / IP / TCP / HTTP / 'GET' '/apps/log.html?keyfrom=deskdict.main&q=Realtek%20USB%20GbE%20Family%20Controller&timing=stroke_trans_query&type=success&rnd=1d5fc65:982585b0&appVer=8.8.1.0&vendor=unknown&id=e5eaa952d53a2c94c&abTest=0&client=deskdict&vip=0' 'HTTP/1.1'
16	2020-03-17 22:08:55	fe80::1	fe80::f141:b4f2:11de:b126	DNS	175	Ether / IPv6 / UDP / DNS Ans 
17	2020-03-17 22:08:55	192.168.1.10	154.8.190.35	Https	66	Ether / IP / TCP 192.168.1.10:8860 > 154.8.190.35:https S
18	2020-03-17 22:08:55	220.181.76.82	192.168.1.10	Http	60	Ether / IP / TCP 220.181.76.82:http > 192.168.1.10:8859 A / Padding
19	2020-03-17 22:08:55	fe80::f141:b4f2:11de:b126	ff02::c	UDP	718	Ether / IPv6 / UDP fe80::f141:b4f2:11de:b126:60068 > ff02::c:ws_discovery / Raw
20	2020-03-17 22:08:55	220.181.76.82	192.168.1.10	Http	282	Ether / IP / TCP / HTTP / 'HTTP/1.1' '200' 'OK'
21	2020-03-17 22:08:55	192.168.1.10	220.181.76.82	Http	54	Ether / IP / TCP 192.168.1.10:8859 > 220.181.76.82:http A
22	2020-03-17 22:08:55	154.8.190.35	192.168.1.10	Https	66	Ether / IP / TCP 154.8.190.35:https > 192.168.1.10:8860 SA
23	2020-03-17 22:08:55	192.168.1.10	154.8.190.35	Https	54	Ether / IP / TCP 192.168.1.10:8860 > 154.8.190.35:https A
24	2020-03-17 22:08:55	192.168.1.10	154.8.190.35	Https	237	Ether / IP / TCP 192.168.1.10:8860 > 154.8.190.35:https PA / Raw
25	2020-03-17 22:08:55	154.8.190.35	192.168.1.10	Https	60	Ether / IP / TCP 154.8.190.35:https > 192.168.1.10:8860 A / Padding
26	2020-03-17 22:08:55	154.8.190.35	192.168.1.10	Https	1486	Ether / IP / TCP 154.8.190.35:https > 192.168.1.10:8860 A / Raw
27	2020-03-17 22:08:55	154.8.190.35	192.168.1.10	Https	1486	Ether / IP / TCP 154.8.190.35:https > 192.168.1.10:8860 A / Raw
28	2020-03-17 22:08:55	154.8.190.35	192.168.1.10	Https	744	Ether / IP / TCP 154.8.190.35:https > 192.168.1.10:8860 PA / Raw
29	2020-03-17 22:08:55	192.168.1.10	154.8.190.35	Https	54	Ether / IP / TCP 192.168.1.10:8860 > 154.8.190.35:https A
30	2020-03-17 22:08:55	192.168.1.10	154.8.190.35	Https	180	Ether / IP / TCP 192.168.1.10:8860 > 154.8.190.35:https PA / Raw
31	2020-03-17 22:08:55	154.8.190.35	192.168.1.10	Https	328	Ether / IP / TCP 154.8.190.35:https > 192.168.1.10:8860 PA / Raw
32	2020-03-17 22:08:55	192.168.1.10	154.8.190.35	Https	303	Ether / IP / TCP 192.168.1.10:8860 > 154.8.190.35:https PA / Raw
33	2020-03-17 22:08:55	154.8.190.35	192.168.1.10	Https	352	Ether / IP / TCP 154.8.190.35:https > 192.168.1.10:8860 PA / Raw
34	2020-03-17 22:08:55	154.8.190.35	192.168.1.10	Https	88	Ether / IP / TCP 154.8.190.35:https > 192.168.1.10:8860 PA / Raw
35	2020-03-17 22:08:55	192.168.1.10	154.8.190.35	Https	54	Ether / IP / TCP 192.168.1.10:8860 > 154.8.190.35:https A
36	2020-03-17 22:08:55	192.168.1.10	154.8.190.35	Https	54	Ether / IP / TCP 192.168.1.10:8860 > 154.8.190.35:https FA
37	2020-03-17 22:08:55	192.168.1.10	14.215.177.39	Https	54	Ether / IP / TCP 192.168.1.10:8856 > 14.215.177.39:https FA
38	2020-03-17 22:08:55	154.8.190.35	192.168.1.10	Https	60	Ether / IP / TCP 154.8.190.35:https > 192.168.1.10:8860 FA / Padding
39	2020-03-17 22:08:55	192.168.1.10	154.8.190.35	Https	54	Ether / IP / TCP 192.168.1.10:8860 > 154.8.190.35:https A
40	2020-03-17 22:08:55	192.168.1.10	172.217.160.78	Https	66	Ether / IP / TCP 192.168.1.10:8851 > 172.217.160.78:https S
41	2020-03-17 22:08:55	192.168.1.10	172.217.160.78	Https	66	Ether / IP / TCP 192.168.1.10:8852 > 172.217.160.78:https S
42	2020-03-17 22:08:56	192.168.1.10	239.255.255.250	UDP	698	Ether / IP / UDP 192.168.1.10:60067 > 239.255.255.250:ws_discovery / Raw
43	2020-03-17 22:08:56	192.168.1.10	14.215.177.39	Https	66	Ether / IP / TCP 192.168.1.10:8861 > 14.215.177.39:https S
44	2020-03-17 22:08:56	14.215.177.39	192.168.1.10	Https	66	Ether / IP / TCP 14.215.177.39:https > 192.168.1.10:8861 SA
45	2020-03-17 22:08:56	192.168.1.10	14.215.177.39	Https	54	Ether / IP / TCP 192.168.1.10:8861 > 14.215.177.39:https A
46	2020-03-17 22:08:56	192.168.1.10	14.215.177.39	Https	54	Ether / IP / TCP 192.168.1.10:8861 > 14.215.177.39:https FA
47	2020-03-17 22:08:56	192.168.1.10	180.163.32.152	UDP	444	Ether / IP / UDP 192.168.1.10:54843 > 180.163.32.152:8000 / Raw
48	2020-03-17 22:08:56	fe80::f141:b4f2:11de:b126	ff02::c	UDP	718	Ether / IPv6 / UDP fe80::f141:b4f2:11de:b126:60068 > ff02::c:ws_discovery / Raw
49	2020-03-17 22:08:56	192.168.1.10	120.131.14.181	UDP	151	Ether / IP / UDP 192.168.1.10:49770 > 120.131.14.181:9402 / Raw
50	2020-03-17 22:08:56	9c:d2:4b:38:91:c1	00:e0:4c:68:00:2d	ARP	60	Ether / ARP who has 192.168.1.10 says 192.168.1.1 / Padding
51	2020-03-17 22:08:56	00:e0:4c:68:00:2d	9c:d2:4b:38:91:c1	ARP	42	Ether / ARP is at 00:e0:4c:68:00:2d says 192.168.1.10
52	2020-03-17 22:08:56	192.168.1.10	14.215.177.39	Https	54	Ether / IP / TCP 192.168.1.10:8861 > 14.215.177.39:https FA
53	2020-03-17 22:08:57	192.168.1.10	14.215.177.39	Https	54	Ether / IP / TCP 192.168.1.10:8861 > 14.215.177.39:https FA
54	2020-03-17 22:08:57	192.168.1.10	239.255.255.250	UDP	698	Ether / IP / UDP 192.168.1.10:60067 > 239.255.255.250:ws_discovery / Raw
55	2020-03-17 22:08:58	240e:d4:2e8e:df00:4882:f650:cbf9:db1d	2401:c900:1601:161::7	TCP	98	Ether / IPv6 / TCP 240e:d4:2e8e:df00:4882:f650:cbf9:db1d:3803 > 2401:c900:1601:161::7:5938 PA / Raw
56	2020-03-17 22:08:58	fe80::f141:b4f2:11de:b126	ff02::c	UDP	718	Ether / IPv6 / UDP fe80::f141:b4f2:11de:b126:60068 > ff02::c:ws_discovery / Raw
57	2020-03-17 22:08:58	192.168.1.10	14.215.177.39	Https	54	Ether / IP / TCP 192.168.1.10:8861 > 14.215.177.39:https FA
58	2020-03-17 22:08:58	240e:d4:2e8e:df00:4882:f650:cbf9:db1d	2401:c900:1601:161::7	TCP	98	Ether / IPv6 / TCP 240e:d4:2e8e:df00:4882:f650:cbf9:db1d:3803 > 2401:c900:1601:161::7:5938 PA / Raw
59	2020-03-17 22:08:59	2401:c900:1601:161::7	240e:d4:2e8e:df00:4882:f650:cbf9:db1d	TCP	86	Ether / IPv6 / TCP 2401:c900:1601:161::7:5938 > 240e:d4:2e8e:df00:4882:f650:cbf9:db1d:3803 A
60	2020-03-17 22:08:59	192.168.1.10	239.255.255.250	UDP	698	Ether / IP / UDP 192.168.1.10:60067 > 239.255.255.250:ws_discovery / Raw
61	2020-03-17 22:08:59	fe80::f141:b4f2:11de:b126	fe80::1	DNS	106	Ether / IPv6 / UDP / DNS Qry "b'android.clients.google.com.'" 
62	2020-03-17 22:08:59	fe80::1	fe80::f141:b4f2:11de:b126	DNS	180	Ether / IPv6 / UDP / DNS Ans "b'android.l.google.com.'" 
63	2020-03-17 22:08:59	192.168.1.10	172.217.24.14	Https	66	Ether / IP / TCP 192.168.1.10:8862 > 172.217.24.14:https S
64	2020-03-17 22:09:00	fe80::f141:b4f2:11de:b126	ff02::c	UDP	718	Ether / IPv6 / UDP fe80::f141:b4f2:11de:b126:60068 > ff02::c:ws_discovery / Raw
65	2020-03-17 22:09:00	161.117.236.80	192.168.1.10	TCP	1461	Ether / IP / TCP 161.117.236.80:20395 > 192.168.1.10:8784 PA / Raw
66	2020-03-17 22:09:00	192.168.1.10	161.117.236.80	TCP	847	Ether / IP / TCP 192.168.1.10:8784 > 161.117.236.80:20395 PA / Raw
67	2020-03-17 22:09:00	161.117.236.80	192.168.1.10	TCP	60	Ether / IP / TCP 161.117.236.80:20395 > 192.168.1.10:8784 A / Padding
68	2020-03-17 22:09:00	192.168.1.10	14.215.177.39	Https	54	Ether / IP / TCP 192.168.1.10:8861 > 14.215.177.39:https FA
69	2020-03-17 22:09:00	192.168.1.10	172.217.24.14	Https	66	Ether / IP / TCP 192.168.1.10:8862 > 172.217.24.14:https S
70	2020-03-17 22:09:01	240e:d4:2e8e:df00:4882:f650:cbf9:db1d	240e:49:5700:100:19c:e7ef:11e1:7194	Https	86	Ether / IPv6 / TCP 240e:d4:2e8e:df00:4882:f650:cbf9:db1d:8863 > 240e:49:5700:100:19c:e7ef:11e1:7194:https S
71	2020-03-17 22:09:01	240e:d4:2e8e:df00:4882:f650:cbf9:db1d	240e:49:5700:100:19c:e7ef:11e1:7194	Https	86	Ether / IPv6 / TCP 240e:d4:2e8e:df00:4882:f650:cbf9:db1d:8864 > 240e:49:5700:100:19c:e7ef:11e1:7194:https S
72	2020-03-17 22:09:01	192.168.1.10	119.147.134.70	Https	66	Ether / IP / TCP 192.168.1.10:8865 > 119.147.134.70:https S
73	2020-03-17 22:09:01	119.147.134.70	192.168.1.10	Https	66	Ether / IP / TCP 119.147.134.70:https > 192.168.1.10:8865 SA
74	2020-03-17 22:09:01	192.168.1.10	119.147.134.70	Https	54	Ether / IP / TCP 192.168.1.10:8865 > 119.147.134.70:https A
75	2020-03-17 22:09:01	192.168.1.10	119.147.134.70	Https	604	Ether / IP / TCP 192.168.1.10:8865 > 119.147.134.70:https PA / Raw
76	2020-03-17 22:09:01	119.147.134.70	192.168.1.10	Https	60	Ether / IP / TCP 119.147.134.70:https > 192.168.1.10:8865 A / Padding
77	2020-03-17 22:09:01	119.147.134.70	192.168.1.10	Https	266	Ether / IP / TCP 119.147.134.70:https > 192.168.1.10:8865 PA / Raw
78	2020-03-17 22:09:01	192.168.1.10	119.147.134.70	Https	118	Ether / IP / TCP 192.168.1.10:8865 > 119.147.134.70:https PA / Raw
79	2020-03-17 22:09:01	192.168.1.10	119.147.134.70	Https	146	Ether / IP / TCP 192.168.1.10:8865 > 119.147.134.70:https PA / Raw
80	2020-03-17 22:09:01	192.168.1.10	119.147.134.70	Https	390	Ether / IP / TCP 192.168.1.10:8865 > 119.147.134.70:https PA / Raw
81	2020-03-17 22:09:01	119.147.134.70	192.168.1.10	Https	566	Ether / IP / TCP 119.147.134.70:https > 192.168.1.10:8865 PA / Raw
82	2020-03-17 22:09:01	192.168.1.10	119.147.134.70	Https	85	Ether / IP / TCP 192.168.1.10:8865 > 119.147.134.70:https PA / Raw
83	2020-03-17 22:09:01	119.147.134.70	192.168.1.10	Https	60	Ether / IP / TCP 119.147.134.70:https > 192.168.1.10:8865 A / Padding
84	2020-03-17 22:09:01	119.147.134.70	192.168.1.10	Https	85	Ether / IP / TCP 119.147.134.70:https > 192.168.1.10:8865 PA / Raw
85	2020-03-17 22:09:01	119.147.134.70	192.168.1.10	Https	602	Ether / IP / TCP 119.147.134.70:https > 192.168.1.10:8865 PA / Raw
86	2020-03-17 22:09:01	119.147.134.70	192.168.1.10	Https	85	Ether / IP / TCP 119.147.134.70:https > 192.168.1.10:8865 PA / Raw
87	2020-03-17 22:09:01	192.168.1.10	119.147.134.70	Https	54	Ether / IP / TCP 192.168.1.10:8865 > 119.147.134.70:https A
88	2020-03-17 22:09:01	240e:ff:f101:10::11a	240e:d4:2e8e:df00:4882:f650:cbf9:db1d	Http	115	Ether / IPv6 / TCP 240e:ff:f101:10::11a:http > 240e:d4:2e8e:df00:4882:f650:cbf9:db1d:2012 PA / HTTP / Raw
89	2020-03-17 22:09:01	240e:d4:2e8e:df00:4882:f650:cbf9:db1d	240e:ff:f101:10::11a	Http	429	Ether / IPv6 / TCP 240e:d4:2e8e:df00:4882:f650:cbf9:db1d:2012 > 240e:ff:f101:10::11a:http PA / HTTP / Raw
90	2020-03-17 22:09:01	192.168.1.10	119.147.134.70	Https	66	Ether / IP / TCP 192.168.1.10:8866 > 119.147.134.70:https S
91	2020-03-17 22:09:01	119.147.134.70	192.168.1.10	Https	66	Ether / IP / TCP 119.147.134.70:https > 192.168.1.10:8866 SA
92	2020-03-17 22:09:01	192.168.1.10	119.147.134.70	Https	54	Ether / IP / TCP 192.168.1.10:8866 > 119.147.134.70:https A
93	2020-03-17 22:09:01	192.168.1.10	119.147.134.70	Https	604	Ether / IP / TCP 192.168.1.10:8866 > 119.147.134.70:https PA / Raw
94	2020-03-17 22:09:01	240e:ff:f101:10::11a	240e:d4:2e8e:df00:4882:f650:cbf9:db1d	Http	598	Ether / IPv6 / TCP 240e:ff:f101:10::11a:http > 240e:d4:2e8e:df00:4882:f650:cbf9:db1d:2012 PA / HTTP / Raw
95	2020-03-17 22:09:01	119.147.134.70	192.168.1.10	Https	60	Ether / IP / TCP 119.147.134.70:https > 192.168.1.10:8866 A / Padding
96	2020-03-17 22:09:01	119.147.134.70	192.168.1.10	Https	266	Ether / IP / TCP 119.147.134.70:https > 192.168.1.10:8866 PA / Raw
97	2020-03-17 22:09:01	192.168.1.10	119.147.134.70	Https	118	Ether / IP / TCP 192.168.1.10:8866 > 119.147.134.70:https PA / Raw
98	2020-03-17 22:09:01	192.168.1.10	239.255.255.250	UDP	698	Ether / IP / UDP 192.168.1.10:60067 > 239.255.255.250:ws_discovery / Raw
99	2020-03-17 22:09:01	119.147.134.70	192.168.1.10	Https	566	Ether / IP / TCP 119.147.134.70:https > 192.168.1.10:8866 PA / Raw
100	2020-03-17 22:09:01	240e:d4:2e8e:df00:4882:f650:cbf9:db1d	240e:ff:f101:10::11a	Http	74	Ether / IPv6 / TCP 240e:d4:2e8e:df00:4882:f650:cbf9:db1d:2012 > 240e:ff:f101:10::11a:http A
101	2020-03-17 22:09:01	192.168.1.10	119.147.134.70	Https	54	Ether / IP / TCP 192.168.1.10:8866 > 119.147.134.70:https A
102	2020-03-17 22:09:01	161.117.236.80	192.168.1.10	TCP	1506	Ether / IP / TCP 161.117.236.80:20395 > 192.168.1.10:8784 A / Raw
103	2020-03-17 22:09:01	161.117.236.80	192.168.1.10	TCP	1501	Ether / IP / TCP 161.117.236.80:20395 > 192.168.1.10:8784 PA / Raw
104	2020-03-17 22:09:01	192.168.1.10	161.117.236.80	TCP	54	Ether / IP / TCP 192.168.1.10:8784 > 161.117.236.80:20395 A
105	2020-03-17 22:09:01	161.117.236.80	192.168.1.10	TCP	1412	Ether / IP / TCP 161.117.236.80:20395 > 192.168.1.10:8784 PA / Raw
106	2020-03-17 22:09:01	192.168.1.10	161.117.236.80	TCP	54	Ether / IP / TCP 192.168.1.10:8784 > 161.117.236.80:20395 A
107	2020-03-17 22:09:02	fe80::f141:b4f2:11de:b126	ff02::c	UDP	718	Ether / IPv6 / UDP fe80::f141:b4f2:11de:b126:60068 > ff02::c:ws_discovery / Raw
108	2020-03-17 22:09:02	2401:c900:1601:161::7	240e:d4:2e8e:df00:4882:f650:cbf9:db1d	TCP	98	Ether / IPv6 / TCP 2401:c900:1601:161::7:5938 > 240e:d4:2e8e:df00:4882:f650:cbf9:db1d:3803 PA / Raw
109	2020-03-17 22:09:02	240e:d4:2e8e:df00:4882:f650:cbf9:db1d	2401:c900:1601:161::7	TCP	74	Ether / IPv6 / TCP 240e:d4:2e8e:df00:4882:f650:cbf9:db1d:3803 > 2401:c900:1601:161::7:5938 A
110	2020-03-17 22:09:02	192.168.1.10	172.217.24.14	Https	66	Ether / IP / TCP 192.168.1.10:8862 > 172.217.24.14:https S
111	2020-03-17 22:09:03	240e:d4:2e8e:df00:4882:f650:cbf9:db1d	2404:6800:4008:c00::bc	TCP	75	Ether / IPv6 / TCP 240e:d4:2e8e:df00:4882:f650:cbf9:db1d:2055 > 2404:6800:4008:c00::bc:5228 A / Raw
112	2020-03-17 22:09:04	2404:6800:4008:c00::bc	240e:d4:2e8e:df00:4882:f650:cbf9:db1d	TCP	86	Ether / IPv6 / TCP 2404:6800:4008:c00::bc:5228 > 240e:d4:2e8e:df00:4882:f650:cbf9:db1d:2055 A
113	2020-03-17 22:09:04	fe80::f141:b4f2:11de:b126	ff02::c	UDP	714	Ether / IPv6 / UDP fe80::f141:b4f2:11de:b126:60068 > ff02::c:ws_discovery / Raw
114	2020-03-17 22:09:04	192.168.1.10	239.255.255.250	UDP	694	Ether / IP / UDP 192.168.1.10:60067 > 239.255.255.250:ws_discovery / Raw
115	2020-03-17 22:09:04	192.168.1.10	239.255.255.250	UDP	694	Ether / IP / UDP 192.168.1.10:60067 > 239.255.255.250:ws_discovery / Raw
116	2020-03-17 22:09:04	fe80::f141:b4f2:11de:b126	ff02::c	UDP	714	Ether / IPv6 / UDP fe80::f141:b4f2:11de:b126:60068 > ff02::c:ws_discovery / Raw
117	2020-03-17 22:09:04	192.168.1.10	239.255.255.250	UDP	694	Ether / IP / UDP 192.168.1.10:60067 > 239.255.255.250:ws_discovery / Raw
118	2020-03-17 22:09:05	192.168.1.10	14.215.177.39	Https	54	Ether / IP / TCP 192.168.1.10:8856 > 14.215.177.39:https RA
119	2020-03-17 22:09:05	220.181.76.102	192.168.1.10	Http	60	Ether / IP / TCP 220.181.76.102:http > 192.168.1.10:8855 FA / Padding
120	2020-03-17 22:09:05	192.168.1.10	220.181.76.102	Http	54	Ether / IP / TCP 192.168.1.10:8855 > 220.181.76.102:http A
121	2020-03-17 22:09:05	fe80::f141:b4f2:11de:b126	ff02::c	UDP	714	Ether / IPv6 / UDP fe80::f141:b4f2:11de:b126:60068 > ff02::c:ws_discovery / Raw
122	2020-03-17 22:09:05	220.181.76.82	192.168.1.10	Http	60	Ether / IP / TCP 220.181.76.82:http > 192.168.1.10:8859 FA / Padding
123	2020-03-17 22:09:05	192.168.1.10	220.181.76.82	Http	54	Ether / IP / TCP 192.168.1.10:8859 > 220.181.76.82:http A
124	2020-03-17 22:09:05	192.168.1.10	239.255.255.250	UDP	694	Ether / IP / UDP 192.168.1.10:60067 > 239.255.255.250:ws_discovery / Raw
125	2020-03-17 22:09:05	192.168.1.10	119.147.134.70	Https	54	Ether / IP / TCP 192.168.1.10:8866 > 119.147.134.70:https FA
126	2020-03-17 22:09:05	192.168.1.10	119.147.134.70	Https	54	Ether / IP / TCP 192.168.1.10:8865 > 119.147.134.70:https FA
127	2020-03-17 22:09:05	fe80::f141:b4f2:11de:b126	fe80::1	DNS	94	Ether / IPv6 / UDP / DNS Qry "b'www.google.com.'" 
128	2020-03-17 22:09:05	fe80::f141:b4f2:11de:b126	fe80::1	DNS	94	Ether / IPv6 / UDP / DNS Qry "b'www.google.com.'" 
129	2020-03-17 22:09:05	fe80::1	fe80::f141:b4f2:11de:b126	DNS	342	Ether / IPv6 / UDP / DNS Ans "67.228.235.91" 
130	2020-03-17 22:09:05	fe80::1	fe80::f141:b4f2:11de:b126	DNS	342	Ether / IPv6 / UDP / DNS Ans "2404:6800:4008:800::2004" 
131	2020-03-17 22:09:05	240e:d4:2e8e:df00:4882:f650:cbf9:db1d	2404:6800:4008:800::2004	Https	86	Ether / IPv6 / TCP 240e:d4:2e8e:df00:4882:f650:cbf9:db1d:8867 > 2404:6800:4008:800::2004:https S
132	2020-03-17 22:09:05	119.147.134.70	192.168.1.10	Https	60	Ether / IP / TCP 119.147.134.70:https > 192.168.1.10:8865 FA / Padding
133	2020-03-17 22:09:05	192.168.1.10	119.147.134.70	Https	54	Ether / IP / TCP 192.168.1.10:8865 > 119.147.134.70:https A
134	2020-03-17 22:09:05	119.147.134.70	192.168.1.10	Https	60	Ether / IP / TCP 119.147.134.70:https > 192.168.1.10:8866 FA / Padding
135	2020-03-17 22:09:05	192.168.1.10	119.147.134.70	Https	54	Ether / IP / TCP 192.168.1.10:8866 > 119.147.134.70:https A
136	2020-03-17 22:09:05	192.168.1.10	14.215.177.39	Https	54	Ether / IP / TCP 192.168.1.10:8861 > 14.215.177.39:https FA
137	2020-03-17 22:09:05	192.168.1.10	183.57.48.55	Http	66	Ether / IP / TCP 192.168.1.10:8868 > 183.57.48.55:http S
138	2020-03-17 22:09:05	183.57.48.55	192.168.1.10	Http	66	Ether / IP / TCP 183.57.48.55:http > 192.168.1.10:8868 SA
139	2020-03-17 22:09:05	192.168.1.10	183.57.48.55	Http	54	Ether / IP / TCP 192.168.1.10:8868 > 183.57.48.55:http A
140	2020-03-17 22:09:05	240e:d4:2e8e:df00:4882:f650:cbf9:db1d	2404:6800:4008:800::2004	Https	86	Ether / IPv6 / TCP 240e:d4:2e8e:df00:4882:f650:cbf9:db1d:8869 > 2404:6800:4008:800::2004:https S
141	2020-03-17 22:09:05	240e:d4:2e8e:df00:4882:f650:cbf9:db1d	2404:6800:4008:800::2004	Https	86	Ether / IPv6 / TCP 240e:d4:2e8e:df00:4882:f650:cbf9:db1d:8870 > 2404:6800:4008:800::2004:https S
142	2020-03-17 22:09:05	192.168.1.10	67.228.235.91	Https	66	Ether / IP / TCP 192.168.1.10:8871 > 67.228.235.91:https S
143	2020-03-17 22:09:05	161.117.236.80	192.168.1.10	TCP	1505	Ether / IP / TCP 161.117.236.80:20395 > 192.168.1.10:8784 PA / Raw
144	2020-03-17 22:09:05	192.168.1.10	183.57.48.55	Http	1217	Ether / IP / TCP / HTTP / 'POST' '/q.cgi' 'HTTP/1.1' / Raw
145	2020-03-17 22:09:05	183.57.48.55	192.168.1.10	Http	60	Ether / IP / TCP 183.57.48.55:http > 192.168.1.10:8868 A / Padding
146	2020-03-17 22:09:05	183.57.48.55	192.168.1.10	Http	408	Ether / IP / TCP / HTTP / 'HTTP/1.1' '200' 'OK' / Raw
147	2020-03-17 22:09:05	192.168.1.10	183.57.48.55	Http	54	Ether / IP / TCP 192.168.1.10:8868 > 183.57.48.55:http FA
148	2020-03-17 22:09:05	192.168.1.10	161.117.236.80	TCP	54	Ether / IP / TCP 192.168.1.10:8784 > 161.117.236.80:20395 A
149	2020-03-17 22:09:05	183.57.48.55	192.168.1.10	Http	60	Ether / IP / TCP 183.57.48.55:http > 192.168.1.10:8868 FA / Padding
150	2020-03-17 22:09:05	192.168.1.10	183.57.48.55	Http	54	Ether / IP / TCP 192.168.1.10:8868 > 183.57.48.55:http A
151	2020-03-17 22:09:05	240e:d4:2e8e:df00:4882:f650:cbf9:db1d	2404:6800:4008:800::2004	Https	86	Ether / IPv6 / TCP 240e:d4:2e8e:df00:4882:f650:cbf9:db1d:8872 > 2404:6800:4008:800::2004:https S
152	2020-03-17 22:09:05	192.168.1.10	67.228.235.91	Https	66	Ether / IP / TCP 192.168.1.10:8873 > 67.228.235.91:https S
153	2020-03-17 22:09:05	192.168.1.10	67.228.235.91	Https	66	Ether / IP / TCP 192.168.1.10:8874 > 67.228.235.91:https S
154	2020-03-17 22:09:06	192.168.1.10	67.228.235.91	Https	66	Ether / IP / TCP 192.168.1.10:8875 > 67.228.235.91:https S
155	2020-03-17 22:09:06	192.168.1.10	239.255.255.250	UDP	694	Ether / IP / UDP 192.168.1.10:60067 > 239.255.255.250:ws_discovery / Raw
156	2020-03-17 22:09:06	fe80::f141:b4f2:11de:b126	ff02::c	UDP	714	Ether / IPv6 / UDP fe80::f141:b4f2:11de:b126:60068 > ff02::c:ws_discovery / Raw
157	2020-03-17 22:09:06	192.168.1.10	14.215.177.39	Https	66	Ether / IP / TCP 192.168.1.10:8876 > 14.215.177.39:https S
158	2020-03-17 22:09:06	14.215.177.39	192.168.1.10	Https	66	Ether / IP / TCP 14.215.177.39:https > 192.168.1.10:8876 SA
159	2020-03-17 22:09:06	192.168.1.10	14.215.177.39	Https	54	Ether / IP / TCP 192.168.1.10:8876 > 14.215.177.39:https A
160	2020-03-17 22:09:06	192.168.1.10	14.215.177.39	Https	54	Ether / IP / TCP 192.168.1.10:8876 > 14.215.177.39:https FA
161	2020-03-17 22:09:06	240e:d4:2e8e:df00:4882:f650:cbf9:db1d	2404:6800:4008:800::2004	Https	86	Ether / IPv6 / TCP 240e:d4:2e8e:df00:4882:f650:cbf9:db1d:8867 > 2404:6800:4008:800::2004:https S
162	2020-03-17 22:09:06	192.168.1.10	14.215.177.39	Https	54	Ether / IP / TCP 192.168.1.10:8876 > 14.215.177.39:https FA
163	2020-03-17 22:09:06	240e:d4:2e8e:df00:4882:f650:cbf9:db1d	2404:6800:4008:800::2004	Https	86	Ether / IPv6 / TCP 240e:d4:2e8e:df00:4882:f650:cbf9:db1d:8869 > 2404:6800:4008:800::2004:https S
164	2020-03-17 22:09:06	240e:d4:2e8e:df00:4882:f650:cbf9:db1d	2404:6800:4008:800::2004	Https	86	Ether / IPv6 / TCP 240e:d4:2e8e:df00:4882:f650:cbf9:db1d:8870 > 2404:6800:4008:800::2004:https S
165	2020-03-17 22:09:06	192.168.1.10	67.228.235.91	Https	66	Ether / IP / TCP 192.168.1.10:8871 > 67.228.235.91:https S
166	2020-03-17 22:09:06	fe80::1	240e:d4:2e8e:df00:4882:f650:cbf9:db1d	ICMPv6	86	Ether / IPv6 / ICMPv6ND_NS / ICMPv6 Neighbor Discovery Option - Source Link-Layer Address 9c:d2:4b:38:91:c1
167	2020-03-17 22:09:06	240e:d4:2e8e:df00:4882:f650:cbf9:db1d	fe80::1	ICMPv6	86	Ether / IPv6 / ICMPv6ND_NA / ICMPv6 Neighbor Discovery Option - Destination Link-Layer Address 00:e0:4c:68:00:2d
168	2020-03-17 22:09:06	240e:d4:2e8e:df00:4882:f650:cbf9:db1d	2404:6800:4008:800::2004	Https	86	Ether / IPv6 / TCP 240e:d4:2e8e:df00:4882:f650:cbf9:db1d:8872 > 2404:6800:4008:800::2004:https S
169	2020-03-17 22:09:06	192.168.1.10	172.217.24.14	Https	66	Ether / IP / TCP 192.168.1.10:8862 > 172.217.24.14:https S
170	2020-03-17 22:09:06	fe80::f141:b4f2:11de:b126	fe80::1	DNS	93	Ether / IPv6 / UDP / DNS Qry "b'www.baidu.com.'" 
171	2020-03-17 22:09:06	fe80::f141:b4f2:11de:b126	fe80::1	DNS	93	Ether / IPv6 / UDP / DNS Qry "b'www.baidu.com.'" 
172	2020-03-17 22:09:06	fe80::1	fe80::f141:b4f2:11de:b126	DNS	322	Ether / IPv6 / UDP / DNS Ans "b'www.a.shifen.com.'" 
173	2020-03-17 22:09:06	fe80::1	fe80::f141:b4f2:11de:b126	DNS	177	Ether / IPv6 / UDP / DNS Ans "b'www.a.shifen.com.'" 
174	2020-03-17 22:09:06	192.168.1.10	14.215.177.39	Https	66	Ether / IP / TCP 192.168.1.10:8877 > 14.215.177.39:https S
175	2020-03-17 22:09:06	192.168.1.10	14.215.177.39	Https	66	Ether / IP / TCP 192.168.1.10:8878 > 14.215.177.39:https S
176	2020-03-17 22:09:06	192.168.1.10	67.228.235.91	Https	66	Ether / IP / TCP 192.168.1.10:8873 > 67.228.235.91:https S
177	2020-03-17 22:09:06	14.215.177.39	192.168.1.10	Https	66	Ether / IP / TCP 14.215.177.39:https > 192.168.1.10:8877 SA
178	2020-03-17 22:09:06	192.168.1.10	14.215.177.39	Https	54	Ether / IP / TCP 192.168.1.10:8877 > 14.215.177.39:https A
179	2020-03-17 22:09:06	192.168.1.10	14.215.177.39	Https	571	Ether / IP / TCP 192.168.1.10:8877 > 14.215.177.39:https PA / Raw
180	2020-03-17 22:09:06	14.215.177.39	192.168.1.10	Https	66	Ether / IP / TCP 14.215.177.39:https > 192.168.1.10:8878 SA
181	2020-03-17 22:09:06	192.168.1.10	14.215.177.39	Https	54	Ether / IP / TCP 192.168.1.10:8878 > 14.215.177.39:https A
182	2020-03-17 22:09:06	192.168.1.10	14.215.177.39	Https	571	Ether / IP / TCP 192.168.1.10:8878 > 14.215.177.39:https PA / Raw
183	2020-03-17 22:09:06	14.215.177.39	192.168.1.10	Https	60	Ether / IP / TCP 14.215.177.39:https > 192.168.1.10:8877 A / Padding
184	2020-03-17 22:09:06	14.215.177.39	192.168.1.10	Https	150	Ether / IP / TCP 14.215.177.39:https > 192.168.1.10:8877 PA / Raw
185	2020-03-17 22:09:06	14.215.177.39	192.168.1.10	Https	60	Ether / IP / TCP 14.215.177.39:https > 192.168.1.10:8877 PA / Raw
186	2020-03-17 22:09:06	14.215.177.39	192.168.1.10	Https	99	Ether / IP / TCP 14.215.177.39:https > 192.168.1.10:8877 PA / Raw
187	2020-03-17 22:09:06	192.168.1.10	14.215.177.39	Https	54	Ether / IP / TCP 192.168.1.10:8877 > 14.215.177.39:https A
188	2020-03-17 22:09:06	192.168.1.10	14.215.177.39	Https	105	Ether / IP / TCP 192.168.1.10:8877 > 14.215.177.39:https PA / Raw
189	2020-03-17 22:09:06	192.168.1.10	14.215.177.39	Https	1334	Ether / IP / TCP 192.168.1.10:8877 > 14.215.177.39:https PA / Raw
190	2020-03-17 22:09:06	14.215.177.39	192.168.1.10	Https	99	Ether / IP / TCP 14.215.177.39:https > 192.168.1.10:8877 PA / Raw
191	2020-03-17 22:09:06	192.168.1.10	14.215.177.39	Https	66	Ether / IP / TCP 192.168.1.10:8877 > 14.215.177.39:https A
192	2020-03-17 22:09:06	192.168.1.10	67.228.235.91	Https	66	Ether / IP / TCP 192.168.1.10:8874 > 67.228.235.91:https S
193	2020-03-17 22:09:06	14.215.177.39	192.168.1.10	Https	60	Ether / IP / TCP 14.215.177.39:https > 192.168.1.10:8878 A / Padding
194	2020-03-17 22:09:06	14.215.177.39	192.168.1.10	Https	150	Ether / IP / TCP 14.215.177.39:https > 192.168.1.10:8878 PA / Raw
195	2020-03-17 22:09:06	14.215.177.39	192.168.1.10	Https	60	Ether / IP / TCP 14.215.177.39:https > 192.168.1.10:8878 PA / Raw
196	2020-03-17 22:09:06	14.215.177.39	192.168.1.10	Https	99	Ether / IP / TCP 14.215.177.39:https > 192.168.1.10:8878 PA / Raw
197	2020-03-17 22:09:06	192.168.1.10	14.215.177.39	Https	54	Ether / IP / TCP 192.168.1.10:8878 > 14.215.177.39:https A
198	2020-03-17 22:09:06	192.168.1.10	14.215.177.39	Https	105	Ether / IP / TCP 192.168.1.10:8878 > 14.215.177.39:https PA / Raw
199	2020-03-17 22:09:06	14.215.177.39	192.168.1.10	Https	99	Ether / IP / TCP 14.215.177.39:https > 192.168.1.10:8878 PA / Raw
200	2020-03-17 22:09:06	192.168.1.10	14.215.177.39	Https	66	Ether / IP / TCP 192.168.1.10:8878 > 14.215.177.39:https A
201	2020-03-17 22:09:06	14.215.177.39	192.168.1.10	Https	60	Ether / IP / TCP 14.215.177.39:https > 192.168.1.10:8877 A / Padding
202	2020-03-17 22:09:06	14.215.177.39	192.168.1.10	Https	60	Ether / IP / TCP 14.215.177.39:https > 192.168.1.10:8877 A / Padding
203	2020-03-17 22:09:06	14.215.177.39	192.168.1.10	Https	60	Ether / IP / TCP 14.215.177.39:https > 192.168.1.10:8878 A / Padding
204	2020-03-17 22:09:07	192.168.1.10	67.228.235.91	Https	66	Ether / IP / TCP 192.168.1.10:8875 > 67.228.235.91:https S
205	2020-03-17 22:09:07	192.168.1.10	14.215.177.39	Https	54	Ether / IP / TCP 192.168.1.10:8876 > 14.215.177.39:https FA
206	2020-03-17 22:09:07	240e:ff:f101:10::11a	240e:d4:2e8e:df00:4882:f650:cbf9:db1d	Http	115	Ether / IPv6 / TCP 240e:ff:f101:10::11a:http > 240e:d4:2e8e:df00:4882:f650:cbf9:db1d:2012 PA / HTTP / Raw
207	2020-03-17 22:09:07	240e:d4:2e8e:df00:4882:f650:cbf9:db1d	240e:ff:f101:10::11a	Http	413	Ether / IPv6 / TCP 240e:d4:2e8e:df00:4882:f650:cbf9:db1d:2012 > 240e:ff:f101:10::11a:http PA / HTTP / Raw
208	2020-03-17 22:09:07	240e:ff:f101:10::11a	240e:d4:2e8e:df00:4882:f650:cbf9:db1d	Http	614	Ether / IPv6 / TCP 240e:ff:f101:10::11a:http > 240e:d4:2e8e:df00:4882:f650:cbf9:db1d:2012 PA / HTTP / Raw
209	2020-03-17 22:09:07	240e:d4:2e8e:df00:4882:f650:cbf9:db1d	240e:ff:f101:10::11a	Http	74	Ether / IPv6 / TCP 240e:d4:2e8e:df00:4882:f650:cbf9:db1d:2012 > 240e:ff:f101:10::11a:http A
210	2020-03-17 22:09:07	14.215.177.39	192.168.1.10	Https	1506	Ether / IP / TCP 14.215.177.39:https > 192.168.1.10:8877 A / Raw
211	2020-03-17 22:09:07	14.215.177.39	192.168.1.10	Https	1506	Ether / IP / TCP 14.215.177.39:https > 192.168.1.10:8877 A / Raw
212	2020-03-17 22:09:07	14.215.177.39	192.168.1.10	Https	1179	Ether / IP / TCP 14.215.177.39:https > 192.168.1.10:8877 PA / Raw
213	2020-03-17 22:09:07	192.168.1.10	14.215.177.39	Https	54	Ether / IP / TCP 192.168.1.10:8877 > 14.215.177.39:https A
214	2020-03-17 22:09:07	14.215.177.39	192.168.1.10	Https	209	Ether / IP / TCP 14.215.177.39:https > 192.168.1.10:8877 PA / Raw
215	2020-03-17 22:09:07	14.215.177.39	192.168.1.10	Https	1506	Ether / IP / TCP 14.215.177.39:https > 192.168.1.10:8877 A / Raw
216	2020-03-17 22:09:07	14.215.177.39	192.168.1.10	Https	1506	Ether / IP / TCP 14.215.177.39:https > 192.168.1.10:8877 A / Raw
217	2020-03-17 22:09:07	14.215.177.39	192.168.1.10	Https	1179	Ether / IP / TCP 14.215.177.39:https > 192.168.1.10:8877 PA / Raw
218	2020-03-17 22:09:07	14.215.177.39	192.168.1.10	Https	1506	Ether / IP / TCP 14.215.177.39:https > 192.168.1.10:8877 A / Raw
219	2020-03-17 22:09:07	192.168.1.10	14.215.177.39	Https	54	Ether / IP / TCP 192.168.1.10:8877 > 14.215.177.39:https A
220	2020-03-17 22:09:07	14.215.177.39	192.168.1.10	Https	1506	Ether / IP / TCP 14.215.177.39:https > 192.168.1.10:8877 A / Raw
221	2020-03-17 22:09:07	14.215.177.39	192.168.1.10	Https	1304	Ether / IP / TCP 14.215.177.39:https > 192.168.1.10:8877 PA / Raw
222	2020-03-17 22:09:07	192.168.1.10	14.215.177.39	Https	54	Ether / IP / TCP 192.168.1.10:8877 > 14.215.177.39:https A
223	2020-03-17 22:09:07	14.215.177.39	192.168.1.10	Https	1506	Ether / IP / TCP 14.215.177.39:https > 192.168.1.10:8877 A / Raw
224	2020-03-17 22:09:07	14.215.177.39	192.168.1.10	Https	1506	Ether / IP / TCP 14.215.177.39:https > 192.168.1.10:8877 A / Raw
225	2020-03-17 22:09:07	14.215.177.39	192.168.1.10	Https	1506	Ether / IP / TCP 14.215.177.39:https > 192.168.1.10:8877 A / Raw
226	2020-03-17 22:09:07	192.168.1.10	14.215.177.39	Https	54	Ether / IP / TCP 192.168.1.10:8877 > 14.215.177.39:https A
227	2020-03-17 22:09:07	14.215.177.39	192.168.1.10	Https	554	Ether / IP / TCP 14.215.177.39:https > 192.168.1.10:8877 PA / Raw
228	2020-03-17 22:09:07	14.215.177.39	192.168.1.10	Https	85	Ether / IP / TCP 14.215.177.39:https > 192.168.1.10:8877 PA / Raw
229	2020-03-17 22:09:07	192.168.1.10	14.215.177.39	Https	54	Ether / IP / TCP 192.168.1.10:8877 > 14.215.177.39:https A
230	2020-03-17 22:09:07	14.215.177.39	192.168.1.10	Https	1506	Ether / IP / TCP 14.215.177.39:https > 192.168.1.10:8877 A / Raw
231	2020-03-17 22:09:07	14.215.177.39	192.168.1.10	Https	1506	Ether / IP / TCP 14.215.177.39:https > 192.168.1.10:8877 A / Raw
232	2020-03-17 22:09:07	14.215.177.39	192.168.1.10	Https	82	Ether / IP / TCP 14.215.177.39:https > 192.168.1.10:8877 PA / Raw
233	2020-03-17 22:09:07	192.168.1.10	14.215.177.39	Https	54	Ether / IP / TCP 192.168.1.10:8877 > 14.215.177.39:https A
234	2020-03-17 22:09:07	14.215.177.39	192.168.1.10	Https	1506	Ether / IP / TCP 14.215.177.39:https > 192.168.1.10:8877 A / Raw
235	2020-03-17 22:09:07	14.215.177.39	192.168.1.10	Https	1506	Ether / IP / TCP 14.215.177.39:https > 192.168.1.10:8877 A / Raw
236	2020-03-17 22:09:07	14.215.177.39	192.168.1.10	Https	1179	Ether / IP / TCP 14.215.177.39:https > 192.168.1.10:8877 PA / Raw
237	2020-03-17 22:09:07	14.215.177.39	192.168.1.10	Https	209	Ether / IP / TCP 14.215.177.39:https > 192.168.1.10:8877 PA / Raw
238	2020-03-17 22:09:07	192.168.1.10	14.215.177.39	Https	54	Ether / IP / TCP 192.168.1.10:8877 > 14.215.177.39:https A
239	2020-03-17 22:09:07	14.215.177.39	192.168.1.10	Https	1506	Ether / IP / TCP 14.215.177.39:https > 192.168.1.10:8877 A / Raw
240	2020-03-17 22:09:07	14.215.177.39	192.168.1.10	Https	1506	Ether / IP / TCP 14.215.177.39:https > 192.168.1.10:8877 A / Raw
241	2020-03-17 22:09:07	14.215.177.39	192.168.1.10	Https	1506	Ether / IP / TCP 14.215.177.39:https > 192.168.1.10:8877 A / Raw
242	2020-03-17 22:09:07	192.168.1.10	14.215.177.39	Https	54	Ether / IP / TCP 192.168.1.10:8877 > 14.215.177.39:https A
243	2020-03-17 22:09:07	14.215.177.39	192.168.1.10	Https	1506	Ether / IP / TCP 14.215.177.39:https > 192.168.1.10:8877 A / Raw
244	2020-03-17 22:09:07	14.215.177.39	192.168.1.10	Https	1506	Ether / IP / TCP 14.215.177.39:https > 192.168.1.10:8877 A / Raw
245	2020-03-17 22:09:07	192.168.1.10	14.215.177.39	Https	54	Ether / IP / TCP 192.168.1.10:8877 > 14.215.177.39:https A
246	2020-03-17 22:09:07	14.215.177.39	192.168.1.10	Https	1506	Ether / IP / TCP 14.215.177.39:https > 192.168.1.10:8877 A / Raw
247	2020-03-17 22:09:07	14.215.177.39	192.168.1.10	Https	1506	Ether / IP / TCP 14.215.177.39:https > 192.168.1.10:8877 A / Raw
248	2020-03-17 22:09:07	14.215.177.39	192.168.1.10	Https	1506	Ether / IP / TCP 14.215.177.39:https > 192.168.1.10:8877 A / Raw
249	2020-03-17 22:09:07	192.168.1.10	14.215.177.39	Https	54	Ether / IP / TCP 192.168.1.10:8877 > 14.215.177.39:https A
250	2020-03-17 22:09:07	14.215.177.39	192.168.1.10	Https	1506	Ether / IP / TCP 14.215.177.39:https > 192.168.1.10:8877 A / Raw
251	2020-03-17 22:09:07	14.215.177.39	192.168.1.10	Https	1506	Ether / IP / TCP 14.215.177.39:https > 192.168.1.10:8877 A / Raw
252	2020-03-17 22:09:07	14.215.177.39	192.168.1.10	Https	1506	Ether / IP / TCP 14.215.177.39:https > 192.168.1.10:8877 A / Raw
253	2020-03-17 22:09:07	14.215.177.39	192.168.1.10	Https	1506	Ether / IP / TCP 14.215.177.39:https > 192.168.1.10:8877 A / Raw
254	2020-03-17 22:09:07	14.215.177.39	192.168.1.10	Https	1506	Ether / IP / TCP 14.215.177.39:https > 192.168.1.10:8877 A / Raw
255	2020-03-17 22:09:07	14.215.177.39	192.168.1.10	Https	1506	Ether / IP / TCP 14.215.177.39:https > 192.168.1.10:8877 A / Raw
256	2020-03-17 22:09:07	14.215.177.39	192.168.1.10	Https	1506	Ether / IP / TCP 14.215.177.39:https > 192.168.1.10:8877 A / Raw
257	2020-03-17 22:09:07	14.215.177.39	192.168.1.10	Https	1506	Ether / IP / TCP 14.215.177.39:https > 192.168.1.10:8877 A / Raw
258	2020-03-17 22:09:07	14.215.177.39	192.168.1.10	Https	1506	Ether / IP / TCP 14.215.177.39:https > 192.168.1.10:8877 A / Raw
259	2020-03-17 22:09:07	192.168.1.10	14.215.177.39	Https	54	Ether / IP / TCP 192.168.1.10:8877 > 14.215.177.39:https A
260	2020-03-17 22:09:07	14.215.177.39	192.168.1.10	Https	1506	Ether / IP / TCP 14.215.177.39:https > 192.168.1.10:8877 A / Raw
261	2020-03-17 22:09:07	192.168.1.10	14.215.177.39	Https	54	Ether / IP / TCP 192.168.1.10:8877 > 14.215.177.39:https A
262	2020-03-17 22:09:07	14.215.177.39	192.168.1.10	Https	1506	Ether / IP / TCP 14.215.177.39:https > 192.168.1.10:8877 A / Raw
263	2020-03-17 22:09:07	14.215.177.39	192.168.1.10	Https	1506	Ether / IP / TCP 14.215.177.39:https > 192.168.1.10:8877 A / Raw
264	2020-03-17 22:09:07	14.215.177.39	192.168.1.10	Https	1506	Ether / IP / TCP 14.215.177.39:https > 192.168.1.10:8877 A / Raw
265	2020-03-17 22:09:07	192.168.1.10	14.215.177.39	Https	54	Ether / IP / TCP 192.168.1.10:8877 > 14.215.177.39:https A
266	2020-03-17 22:09:07	14.215.177.39	192.168.1.10	Https	1506	Ether / IP / TCP 14.215.177.39:https > 192.168.1.10:8877 A / Raw
267	2020-03-17 22:09:07	14.215.177.39	192.168.1.10	Https	1506	Ether / IP / TCP 14.215.177.39:https > 192.168.1.10:8877 A / Raw
268	2020-03-17 22:09:07	14.215.177.39	192.168.1.10	Https	1506	Ether / IP / TCP 14.215.177.39:https > 192.168.1.10:8877 A / Raw
269	2020-03-17 22:09:07	14.215.177.39	192.168.1.10	Https	1506	Ether / IP / TCP 14.215.177.39:https > 192.168.1.10:8877 A / Raw
270	2020-03-17 22:09:07	14.215.177.39	192.168.1.10	Https	1506	Ether / IP / TCP 14.215.177.39:https > 192.168.1.10:8877 A / Raw
271	2020-03-17 22:09:07	14.215.177.39	192.168.1.10	Https	1506	Ether / IP / TCP 14.215.177.39:https > 192.168.1.10:8877 A / Raw
272	2020-03-17 22:09:07	192.168.1.10	14.215.177.39	Https	54	Ether / IP / TCP 192.168.1.10:8877 > 14.215.177.39:https A
273	2020-03-17 22:09:07	14.215.177.39	192.168.1.10	Https	1506	Ether / IP / TCP 14.215.177.39:https > 192.168.1.10:8877 A / Raw
274	2020-03-17 22:09:07	14.215.177.39	192.168.1.10	Https	1506	Ether / IP / TCP 14.215.177.39:https > 192.168.1.10:8877 A / Raw
275	2020-03-17 22:09:07	192.168.1.10	14.215.177.39	Https	54	Ether / IP / TCP 192.168.1.10:8877 > 14.215.177.39:https A
276	2020-03-17 22:09:07	14.215.177.39	192.168.1.10	Https	1506	Ether / IP / TCP 14.215.177.39:https > 192.168.1.10:8877 A / Raw
277	2020-03-17 22:09:07	14.215.177.39	192.168.1.10	Https	1506	Ether / IP / TCP 14.215.177.39:https > 192.168.1.10:8877 A / Raw
278	2020-03-17 22:09:07	14.215.177.39	192.168.1.10	Https	990	Ether / IP / TCP 14.215.177.39:https > 192.168.1.10:8877 PA / Raw
279	2020-03-17 22:09:07	192.168.1.10	14.215.177.39	Https	54	Ether / IP / TCP 192.168.1.10:8877 > 14.215.177.39:https A
280	2020-03-17 22:09:07	fe80::f141:b4f2:11de:b126	fe80::1	DNS	97	Ether / IPv6 / UDP / DNS Qry "b'dss0.bdstatic.com.'" 
281	2020-03-17 22:09:07	fe80::f141:b4f2:11de:b126	fe80::1	DNS	97	Ether / IPv6 / UDP / DNS Qry "b'dss0.bdstatic.com.'" 
282	2020-03-17 22:09:07	fe80::f141:b4f2:11de:b126	fe80::1	DNS	97	Ether / IPv6 / UDP / DNS Qry "b'dss1.bdstatic.com.'" 
283	2020-03-17 22:09:07	fe80::f141:b4f2:11de:b126	fe80::1	DNS	93	Ether / IPv6 / UDP / DNS Qry "b'sp0.baidu.com.'" 
284	2020-03-17 22:09:07	fe80::f141:b4f2:11de:b126	fe80::1	DNS	97	Ether / IPv6 / UDP / DNS Qry "b'dss1.bdstatic.com.'" 
285	2020-03-17 22:09:07	fe80::1	fe80::f141:b4f2:11de:b126	DNS	384	Ether / IPv6 / UDP / DNS Ans "b'sslbaiduv6.jomodns.com.'" 
286	2020-03-17 22:09:07	fe80::1	fe80::f141:b4f2:11de:b126	DNS	193	Ether / IPv6 / UDP / DNS Ans "b'sslbaiduv6.jomodns.com.'" 
287	2020-03-17 22:09:07	fe80::1	fe80::f141:b4f2:11de:b126	DNS	384	Ether / IPv6 / UDP / DNS Ans "b'sslbaiduv6.jomodns.com.'" 
288	2020-03-17 22:09:07	fe80::1	fe80::f141:b4f2:11de:b126	DNS	177	Ether / IPv6 / UDP / DNS Ans "b'www.a.shifen.com.'" 
289	2020-03-17 22:09:07	fe80::1	fe80::f141:b4f2:11de:b126	DNS	193	Ether / IPv6 / UDP / DNS Ans "b'sslbaiduv6.jomodns.com.'" 
290	2020-03-17 22:09:07	fe80::f141:b4f2:11de:b126	fe80::1	DNS	93	Ether / IPv6 / UDP / DNS Qry "b'sp1.baidu.com.'" 
291	2020-03-17 22:09:07	fe80::f141:b4f2:11de:b126	fe80::1	DNS	93	Ether / IPv6 / UDP / DNS Qry "b'sp1.baidu.com.'" 
292	2020-03-17 22:09:07	fe80::f141:b4f2:11de:b126	fe80::1	DNS	93	Ether / IPv6 / UDP / DNS Qry "b'sp2.baidu.com.'" 
293	2020-03-17 22:09:07	fe80::f141:b4f2:11de:b126	fe80::1	DNS	93	Ether / IPv6 / UDP / DNS Qry "b'sp2.baidu.com.'" 
294	2020-03-17 22:09:07	fe80::f141:b4f2:11de:b126	fe80::1	DNS	95	Ether / IPv6 / UDP / DNS Qry "b'pics5.baidu.com.'" 
295	2020-03-17 22:09:07	fe80::1	fe80::f141:b4f2:11de:b126	DNS	322	Ether / IPv6 / UDP / DNS Ans "b'www.a.shifen.com.'" 
296	2020-03-17 22:09:07	fe80::1	fe80::f141:b4f2:11de:b126	DNS	177	Ether / IPv6 / UDP / DNS Ans "b'www.a.shifen.com.'" 
297	2020-03-17 22:09:07	fe80::f141:b4f2:11de:b126	fe80::1	DNS	95	Ether / IPv6 / UDP / DNS Qry "b'pics5.baidu.com.'" 
298	2020-03-17 22:09:07	fe80::f141:b4f2:11de:b126	fe80::1	DNS	96	Ether / IPv6 / UDP / DNS Qry "b'ss1.bdstatic.com.'" 
299	2020-03-17 22:09:07	fe80::f141:b4f2:11de:b126	fe80::1	DNS	96	Ether / IPv6 / UDP / DNS Qry "b'ss1.bdstatic.com.'" 
300	2020-03-17 22:09:07	fe80::1	fe80::f141:b4f2:11de:b126	DNS	322	Ether / IPv6 / UDP / DNS Ans "b'www.a.shifen.com.'" 
301	2020-03-17 22:09:07	fe80::1	fe80::f141:b4f2:11de:b126	DNS	177	Ether / IPv6 / UDP / DNS Ans "b'www.a.shifen.com.'" 
302	2020-03-17 22:09:07	fe80::1	fe80::f141:b4f2:11de:b126	DNS	423	Ether / IPv6 / UDP / DNS Ans "b'pics0.baidu.com.a.bdydns.com.'" 
303	2020-03-17 22:09:07	fe80::1	fe80::f141:b4f2:11de:b126	DNS	226	Ether / IPv6 / UDP / DNS Ans "b'pics0.baidu.com.a.bdydns.com.'" 
304	2020-03-17 22:09:07	fe80::1	fe80::f141:b4f2:11de:b126	DNS	384	Ether / IPv6 / UDP / DNS Ans "b'sslbdstatic.jomodns.com.'" 
305	2020-03-17 22:09:07	fe80::1	fe80::f141:b4f2:11de:b126	DNS	193	Ether / IPv6 / UDP / DNS Ans "b'sslbdstatic.jomodns.com.'" 
306	2020-03-17 22:09:07	192.168.1.10	125.77.154.35	Https	66	Ether / IP / TCP 192.168.1.10:8879 > 125.77.154.35:https S
307	2020-03-17 22:09:07	125.77.154.35	192.168.1.10	Https	66	Ether / IP / TCP 125.77.154.35:https > 192.168.1.10:8879 SA
308	2020-03-17 22:09:07	192.168.1.10	125.77.154.35	Https	54	Ether / IP / TCP 192.168.1.10:8879 > 125.77.154.35:https A
309	2020-03-17 22:09:07	192.168.1.10	125.77.154.35	Https	571	Ether / IP / TCP 192.168.1.10:8879 > 125.77.154.35:https PA / Raw
310	2020-03-17 22:09:07	125.77.154.35	192.168.1.10	Https	60	Ether / IP / TCP 125.77.154.35:https > 192.168.1.10:8879 A / Padding
311	2020-03-17 22:09:07	125.77.154.35	192.168.1.10	Https	1334	Ether / IP / TCP 125.77.154.35:https > 192.168.1.10:8879 A / Raw
312	2020-03-17 22:09:07	125.77.154.35	192.168.1.10	Https	1334	Ether / IP / TCP 125.77.154.35:https > 192.168.1.10:8879 A / Raw
313	2020-03-17 22:09:07	125.77.154.35	192.168.1.10	Https	1334	Ether / IP / TCP 125.77.154.35:https > 192.168.1.10:8879 A / Raw
314	2020-03-17 22:09:07	125.77.154.35	192.168.1.10	Https	310	Ether / IP / TCP 125.77.154.35:https > 192.168.1.10:8879 PA / Raw
315	2020-03-17 22:09:07	125.77.154.35	192.168.1.10	Https	148	Ether / IP / TCP 125.77.154.35:https > 192.168.1.10:8879 PA / Raw
316	2020-03-17 22:09:07	192.168.1.10	125.77.154.35	Https	66	Ether / IP / TCP 192.168.1.10:8879 > 125.77.154.35:https A
317	2020-03-17 22:09:07	192.168.1.10	125.77.154.35	Https	66	Ether / IP / TCP 192.168.1.10:8879 > 125.77.154.35:https A
318	2020-03-17 22:09:07	192.168.1.10	125.77.154.35	Https	54	Ether / IP / TCP 192.168.1.10:8879 > 125.77.154.35:https A
319	2020-03-17 22:09:07	192.168.1.10	125.77.154.35	Https	54	Ether / IP / TCP 192.168.1.10:8879 > 125.77.154.35:https A
320	2020-03-17 22:09:07	125.77.154.35	192.168.1.10	Https	148	Ether / IP / TCP 125.77.154.35:https > 192.168.1.10:8879 PA / Raw
321	2020-03-17 22:09:07	192.168.1.10	125.77.154.35	Https	66	Ether / IP / TCP 192.168.1.10:8879 > 125.77.154.35:https A
322	2020-03-17 22:09:07	192.168.1.10	125.77.154.35	Https	134	Ether / IP / TCP 192.168.1.10:8879 > 125.77.154.35:https PA / Raw
323	2020-03-17 22:09:07	192.168.1.10	125.77.154.35	Https	146	Ether / IP / TCP 192.168.1.10:8879 > 125.77.154.35:https PA / Raw
324	2020-03-17 22:09:07	192.168.1.10	125.77.154.35	Https	769	Ether / IP / TCP 192.168.1.10:8879 > 125.77.154.35:https PA / Raw
325	2020-03-17 22:09:07	240e:d4:2e8e:df00:4882:f650:cbf9:db1d	2401:c900:1601:161::7	TCP	98	Ether / IPv6 / TCP 240e:d4:2e8e:df00:4882:f650:cbf9:db1d:3803 > 2401:c900:1601:161::7:5938 PA / Raw
326	2020-03-17 22:09:07	125.77.154.35	192.168.1.10	Https	60	Ether / IP / TCP 125.77.154.35:https > 192.168.1.10:8879 A / Padding
327	2020-03-17 22:09:07	125.77.154.35	192.168.1.10	Https	341	Ether / IP / TCP 125.77.154.35:https > 192.168.1.10:8879 PA / Raw
328	2020-03-17 22:09:07	125.77.154.35	192.168.1.10	Https	341	Ether / IP / TCP 125.77.154.35:https > 192.168.1.10:8879 PA / Raw
329	2020-03-17 22:09:07	125.77.154.35	192.168.1.10	Https	116	Ether / IP / TCP 125.77.154.35:https > 192.168.1.10:8879 PA / Raw
330	2020-03-17 22:09:07	192.168.1.10	125.77.154.35	Https	54	Ether / IP / TCP 192.168.1.10:8879 > 125.77.154.35:https A
331	2020-03-17 22:09:07	125.77.154.35	192.168.1.10	Https	66	Ether / IP / TCP 125.77.154.35:https > 192.168.1.10:8879 A
332	2020-03-17 22:09:07	125.77.154.35	192.168.1.10	Https	60	Ether / IP / TCP 125.77.154.35:https > 192.168.1.10:8879 A / Padding
333	2020-03-17 22:09:07	192.168.1.10	125.77.154.35	Https	85	Ether / IP / TCP 192.168.1.10:8879 > 125.77.154.35:https PA / Raw
334	2020-03-17 22:09:07	125.77.154.35	192.168.1.10	Https	85	Ether / IP / TCP 125.77.154.35:https > 192.168.1.10:8879 PA / Raw
335	2020-03-17 22:09:07	125.77.154.35	192.168.1.10	Https	1334	Ether / IP / TCP 125.77.154.35:https > 192.168.1.10:8879 A / Raw
336	2020-03-17 22:09:07	125.77.154.35	192.168.1.10	Https	1334	Ether / IP / TCP 125.77.154.35:https > 192.168.1.10:8879 A / Raw
337	2020-03-17 22:09:07	125.77.154.35	192.168.1.10	Https	1334	Ether / IP / TCP 125.77.154.35:https > 192.168.1.10:8879 A / Raw
338	2020-03-17 22:09:07	125.77.154.35	192.168.1.10	Https	1334	Ether / IP / TCP 125.77.154.35:https > 192.168.1.10:8879 A / Raw
339	2020-03-17 22:09:07	125.77.154.35	192.168.1.10	Https	1334	Ether / IP / TCP 125.77.154.35:https > 192.168.1.10:8879 A / Raw
340	2020-03-17 22:09:07	125.77.154.35	192.168.1.10	Https	1334	Ether / IP / TCP 125.77.154.35:https > 192.168.1.10:8879 A / Raw
341	2020-03-17 22:09:07	125.77.154.35	192.168.1.10	Https	1334	Ether / IP / TCP 125.77.154.35:https > 192.168.1.10:8879 A / Raw
342	2020-03-17 22:09:07	125.77.154.35	192.168.1.10	Https	1334	Ether / IP / TCP 125.77.154.35:https > 192.168.1.10:8879 A / Raw
343	2020-03-17 22:09:07	125.77.154.35	192.168.1.10	Https	1334	Ether / IP / TCP 125.77.154.35:https > 192.168.1.10:8879 A / Raw
344	2020-03-17 22:09:07	125.77.154.35	192.168.1.10	Https	1334	Ether / IP / TCP 125.77.154.35:https > 192.168.1.10:8879 A / Raw
345	2020-03-17 22:09:07	125.77.154.35	192.168.1.10	Https	1334	Ether / IP / TCP 125.77.154.35:https > 192.168.1.10:8879 A / Raw
346	2020-03-17 22:09:07	125.77.154.35	192.168.1.10	Https	1334	Ether / IP / TCP 125.77.154.35:https > 192.168.1.10:8879 A / Raw
347	2020-03-17 22:09:07	125.77.154.35	192.168.1.10	Https	1100	Ether / IP / TCP 125.77.154.35:https > 192.168.1.10:8879 PA / Raw
348	2020-03-17 22:09:07	125.77.154.35	192.168.1.10	Https	1263	Ether / IP / TCP 125.77.154.35:https > 192.168.1.10:8879 PA / Raw
349	2020-03-17 22:09:07	125.77.154.35	192.168.1.10	Https	85	Ether / IP / TCP 125.77.154.35:https > 192.168.1.10:8879 PA / Raw
350	2020-03-17 22:09:07	192.168.1.10	125.77.154.35	Https	66	Ether / IP / TCP 192.168.1.10:8879 > 125.77.154.35:https A
351	2020-03-17 22:09:07	192.168.1.10	125.77.154.35	Https	66	Ether / IP / TCP 192.168.1.10:8879 > 125.77.154.35:https A
352	2020-03-17 22:09:07	192.168.1.10	125.77.154.35	Https	54	Ether / IP / TCP 192.168.1.10:8879 > 125.77.154.35:https A
353	2020-03-17 22:09:07	192.168.1.10	125.77.154.35	Https	66	Ether / IP / TCP 192.168.1.10:8879 > 125.77.154.35:https A
354	2020-03-17 22:09:07	192.168.1.10	125.77.154.35	Https	66	Ether / IP / TCP 192.168.1.10:8879 > 125.77.154.35:https A
355	2020-03-17 22:09:07	192.168.1.10	125.77.154.35	Https	74	Ether / IP / TCP 192.168.1.10:8879 > 125.77.154.35:https A
356	2020-03-17 22:09:07	192.168.1.10	125.77.154.35	Https	66	Ether / IP / TCP 192.168.1.10:8879 > 125.77.154.35:https A
357	2020-03-17 22:09:07	192.168.1.10	125.77.154.35	Https	54	Ether / IP / TCP 192.168.1.10:8879 > 125.77.154.35:https A
358	2020-03-17 22:09:07	192.168.1.10	125.77.154.35	Https	66	Ether / IP / TCP 192.168.1.10:8879 > 125.77.154.35:https A
359	2020-03-17 22:09:07	192.168.1.10	125.77.154.35	Https	54	Ether / IP / TCP 192.168.1.10:8879 > 125.77.154.35:https A
360	2020-03-17 22:09:07	192.168.1.10	125.77.154.35	Https	54	Ether / IP / TCP 192.168.1.10:8879 > 125.77.154.35:https A
361	2020-03-17 22:09:07	125.77.154.35	192.168.1.10	Https	60	Ether / IP / TCP 125.77.154.35:https > 192.168.1.10:8879 A / Padding
362	2020-03-17 22:09:07	125.77.154.35	192.168.1.10	Https	60	Ether / IP / TCP 125.77.154.35:https > 192.168.1.10:8879 A / Padding
363	2020-03-17 22:09:07	192.168.1.10	239.255.255.250	UDP	694	Ether / IP / UDP 192.168.1.10:60067 > 239.255.255.250:ws_discovery / Raw
364	2020-03-17 22:09:07	192.168.1.10	14.215.177.38	Https	66	Ether / IP / TCP 192.168.1.10:8880 > 14.215.177.38:https S
365	2020-03-17 22:09:07	14.215.177.38	192.168.1.10	Https	66	Ether / IP / TCP 14.215.177.38:https > 192.168.1.10:8880 SA
366	2020-03-17 22:09:07	192.168.1.10	14.215.177.38	Https	54	Ether / IP / TCP 192.168.1.10:8880 > 14.215.177.38:https A
367	2020-03-17 22:09:07	192.168.1.10	14.215.177.38	Https	571	Ether / IP / TCP 192.168.1.10:8880 > 14.215.177.38:https PA / Raw
368	2020-03-17 22:09:07	14.215.177.38	192.168.1.10	Https	60	Ether / IP / TCP 14.215.177.38:https > 192.168.1.10:8880 A / Padding
369	2020-03-17 22:09:07	14.215.177.38	192.168.1.10	Https	150	Ether / IP / TCP 14.215.177.38:https > 192.168.1.10:8880 PA / Raw
370	2020-03-17 22:09:07	14.215.177.38	192.168.1.10	Https	60	Ether / IP / TCP 14.215.177.38:https > 192.168.1.10:8880 PA / Raw
371	2020-03-17 22:09:07	14.215.177.38	192.168.1.10	Https	99	Ether / IP / TCP 14.215.177.38:https > 192.168.1.10:8880 PA / Raw
372	2020-03-17 22:09:07	192.168.1.10	14.215.177.38	Https	54	Ether / IP / TCP 192.168.1.10:8880 > 14.215.177.38:https A
373	2020-03-17 22:09:07	192.168.1.10	14.215.177.38	Https	105	Ether / IP / TCP 192.168.1.10:8880 > 14.215.177.38:https PA / Raw
374	2020-03-17 22:09:07	192.168.1.10	14.215.177.38	Https	1365	Ether / IP / TCP 192.168.1.10:8880 > 14.215.177.38:https PA / Raw
375	2020-03-17 22:09:07	14.215.177.38	192.168.1.10	Https	99	Ether / IP / TCP 14.215.177.38:https > 192.168.1.10:8880 PA / Raw
376	2020-03-17 22:09:07	192.168.1.10	14.215.177.38	Https	66	Ether / IP / TCP 192.168.1.10:8880 > 14.215.177.38:https A
377	2020-03-17 22:09:07	14.215.177.38	192.168.1.10	Https	60	Ether / IP / TCP 14.215.177.38:https > 192.168.1.10:8880 A / Padding
378	2020-03-17 22:09:07	14.215.177.38	192.168.1.10	Https	60	Ether / IP / TCP 14.215.177.38:https > 192.168.1.10:8880 A / Padding
379	2020-03-17 22:09:07	192.168.1.10	14.215.177.38	Https	66	Ether / IP / TCP 192.168.1.10:8881 > 14.215.177.38:https S
380	2020-03-17 22:09:07	192.168.1.10	14.215.177.39	Https	1506	Ether / IP / TCP 192.168.1.10:8877 > 14.215.177.39:https A / Raw
381	2020-03-17 22:09:07	192.168.1.10	14.215.177.39	Https	819	Ether / IP / TCP 192.168.1.10:8877 > 14.215.177.39:https PA / Raw
382	2020-03-17 22:09:07	14.215.177.38	192.168.1.10	Https	66	Ether / IP / TCP 14.215.177.38:https > 192.168.1.10:8881 SA
383	2020-03-17 22:09:07	192.168.1.10	14.215.177.38	Https	54	Ether / IP / TCP 192.168.1.10:8881 > 14.215.177.38:https A
384	2020-03-17 22:09:07	192.168.1.10	14.215.177.38	Https	571	Ether / IP / TCP 192.168.1.10:8881 > 14.215.177.38:https PA / Raw
385	2020-03-17 22:09:07	fe80::f141:b4f2:11de:b126	ff02::c	UDP	714	Ether / IPv6 / UDP fe80::f141:b4f2:11de:b126:60068 > ff02::c:ws_discovery / Raw
386	2020-03-17 22:09:07	14.215.177.39	192.168.1.10	Https	60	Ether / IP / TCP 14.215.177.39:https > 192.168.1.10:8877 A / Padding
387	2020-03-17 22:09:07	14.215.177.38	192.168.1.10	Https	60	Ether / IP / TCP 14.215.177.38:https > 192.168.1.10:8881 A / Padding
388	2020-03-17 22:09:07	14.215.177.38	192.168.1.10	Https	150	Ether / IP / TCP 14.215.177.38:https > 192.168.1.10:8881 PA / Raw
389	2020-03-17 22:09:07	14.215.177.38	192.168.1.10	Https	60	Ether / IP / TCP 14.215.177.38:https > 192.168.1.10:8881 PA / Raw
390	2020-03-17 22:09:07	14.215.177.38	192.168.1.10	Https	99	Ether / IP / TCP 14.215.177.38:https > 192.168.1.10:8881 PA / Raw
391	2020-03-17 22:09:07	192.168.1.10	14.215.177.38	Https	54	Ether / IP / TCP 192.168.1.10:8881 > 14.215.177.38:https A
392	2020-03-17 22:09:07	192.168.1.10	14.215.177.38	Https	105	Ether / IP / TCP 192.168.1.10:8881 > 14.215.177.38:https PA / Raw
393	2020-03-17 22:09:07	192.168.1.10	14.215.177.38	Https	1192	Ether / IP / TCP 192.168.1.10:8881 > 14.215.177.38:https PA / Raw
394	2020-03-17 22:09:07	14.215.177.39	192.168.1.10	Https	889	Ether / IP / TCP 14.215.177.39:https > 192.168.1.10:8877 PA / Raw
395	2020-03-17 22:09:07	14.215.177.38	192.168.1.10	Https	99	Ether / IP / TCP 14.215.177.38:https > 192.168.1.10:8881 PA / Raw
396	2020-03-17 22:09:07	192.168.1.10	14.215.177.38	Https	66	Ether / IP / TCP 192.168.1.10:8881 > 14.215.177.38:https A
397	2020-03-17 22:09:08	14.215.177.38	192.168.1.10	Https	372	Ether / IP / TCP 14.215.177.38:https > 192.168.1.10:8880 PA / Raw
398	2020-03-17 22:09:08	14.215.177.38	192.168.1.10	Https	60	Ether / IP / TCP 14.215.177.38:https > 192.168.1.10:8881 A / Padding
399	2020-03-17 22:09:08	14.215.177.38	192.168.1.10	Https	60	Ether / IP / TCP 14.215.177.38:https > 192.168.1.10:8881 A / Padding
400	2020-03-17 22:09:08	192.168.1.10	14.215.177.39	Https	54	Ether / IP / TCP 192.168.1.10:8877 > 14.215.177.39:https A
401	2020-03-17 22:09:08	192.168.1.10	183.57.48.55	UDP	484	Ether / IP / UDP 192.168.1.10:54843 > 183.57.48.55:8000 / Raw
402	2020-03-17 22:09:08	fe80::f141:b4f2:11de:b126	fe80::1	DNS	97	Ether / IPv6 / UDP / DNS Qry "b'fonts.gstatic.com.'" 
403	2020-03-17 22:09:08	fe80::1	fe80::f141:b4f2:11de:b126	DNS	183	Ether / IPv6 / UDP / DNS Ans "b'gstaticadssl.l.google.com.'" 
404	2020-03-17 22:09:08	192.168.1.10	203.208.41.79	UDP	1392	Ether / IP / UDP 192.168.1.10:49920 > 203.208.41.79:https / Raw
405	2020-03-17 22:09:08	192.168.1.10	14.215.177.38	Https	54	Ether / IP / TCP 192.168.1.10:8880 > 14.215.177.38:https A
406	2020-03-17 22:09:08	192.168.1.10	14.215.177.39	Https	1506	Ether / IP / TCP 192.168.1.10:8877 > 14.215.177.39:https A / Raw
407	2020-03-17 22:09:08	192.168.1.10	14.215.177.39	Https	1389	Ether / IP / TCP 192.168.1.10:8877 > 14.215.177.39:https PA / Raw
408	2020-03-17 22:09:08	192.168.1.10	14.215.177.39	Https	66	Ether / IP / TCP 192.168.1.10:8882 > 14.215.177.39:https S
409	2020-03-17 22:09:08	14.215.177.39	192.168.1.10	Https	60	Ether / IP / TCP 14.215.177.39:https > 192.168.1.10:8877 A / Padding
410	2020-03-17 22:09:08	14.215.177.39	192.168.1.10	Https	312	Ether / IP / TCP 14.215.177.39:https > 192.168.1.10:8877 PA / Raw
411	2020-03-17 22:09:08	14.215.177.39	192.168.1.10	Https	66	Ether / IP / TCP 14.215.177.39:https > 192.168.1.10:8882 SA
412	2020-03-17 22:09:08	192.168.1.10	14.215.177.39	Https	54	Ether / IP / TCP 192.168.1.10:8882 > 14.215.177.39:https A
413	2020-03-17 22:09:08	192.168.1.10	14.215.177.39	Https	571	Ether / IP / TCP 192.168.1.10:8882 > 14.215.177.39:https PA / Raw
414	2020-03-17 22:09:08	240e:d4:2e8e:df00:4882:f650:cbf9:db1d	2401:c900:1601:161::7	TCP	98	Ether / IPv6 / TCP 240e:d4:2e8e:df00:4882:f650:cbf9:db1d:3803 > 2401:c900:1601:161::7:5938 PA / Raw
415	2020-03-17 22:09:08	14.215.177.39	192.168.1.10	Https	60	Ether / IP / TCP 14.215.177.39:https > 192.168.1.10:8882 A / Padding
416	2020-03-17 22:09:08	14.215.177.39	192.168.1.10	Https	150	Ether / IP / TCP 14.215.177.39:https > 192.168.1.10:8882 PA / Raw
417	2020-03-17 22:09:08	14.215.177.39	192.168.1.10	Https	60	Ether / IP / TCP 14.215.177.39:https > 192.168.1.10:8882 PA / Raw
418	2020-03-17 22:09:08	14.215.177.39	192.168.1.10	Https	99	Ether / IP / TCP 14.215.177.39:https > 192.168.1.10:8882 PA / Raw
419	2020-03-17 22:09:08	192.168.1.10	14.215.177.39	Https	54	Ether / IP / TCP 192.168.1.10:8882 > 14.215.177.39:https A
420	2020-03-17 22:09:08	192.168.1.10	14.215.177.39	Https	105	Ether / IP / TCP 192.168.1.10:8882 > 14.215.177.39:https PA / Raw
421	2020-03-17 22:09:08	192.168.1.10	14.215.177.39	Https	1506	Ether / IP / TCP 192.168.1.10:8882 > 14.215.177.39:https A / Raw
422	2020-03-17 22:09:08	192.168.1.10	14.215.177.39	Https	1145	Ether / IP / TCP 192.168.1.10:8882 > 14.215.177.39:https PA / Raw
423	2020-03-17 22:09:08	203.208.41.79	192.168.1.10	UDP	1392	Ether / IP / UDP 203.208.41.79:https > 192.168.1.10:49920 / Raw
424	2020-03-17 22:09:08	14.215.177.39	192.168.1.10	Https	99	Ether / IP / TCP 14.215.177.39:https > 192.168.1.10:8882 PA / Raw
425	2020-03-17 22:09:08	192.168.1.10	14.215.177.39	Https	66	Ether / IP / TCP 192.168.1.10:8882 > 14.215.177.39:https A
426	2020-03-17 22:09:08	192.168.1.10	203.208.41.79	UDP	70	Ether / IP / UDP 192.168.1.10:49920 > 203.208.41.79:https / Raw
427	2020-03-17 22:09:08	192.168.1.10	14.215.177.39	Https	54	Ether / IP / TCP 192.168.1.10:8877 > 14.215.177.39:https A
428	2020-03-17 22:09:08	14.215.177.39	192.168.1.10	Https	60	Ether / IP / TCP 14.215.177.39:https > 192.168.1.10:8882 A / Padding
429	2020-03-17 22:09:08	14.215.177.39	192.168.1.10	Https	60	Ether / IP / TCP 14.215.177.39:https > 192.168.1.10:8882 A / Padding
430	2020-03-17 22:09:08	14.215.177.38	192.168.1.10	Https	372	Ether / IP / TCP 14.215.177.38:https > 192.168.1.10:8881 PA / Raw
431	2020-03-17 22:09:08	192.168.1.10	14.215.177.38	Https	54	Ether / IP / TCP 192.168.1.10:8881 > 14.215.177.38:https A
432	2020-03-17 22:09:08	14.215.177.39	192.168.1.10	Https	372	Ether / IP / TCP 14.215.177.39:https > 192.168.1.10:8882 PA / Raw
433	2020-03-17 22:09:08	192.168.1.10	14.215.177.39	Https	54	Ether / IP / TCP 192.168.1.10:8876 > 14.215.177.39:https FA
434	2020-03-17 22:09:08	192.168.1.10	14.215.177.39	Https	54	Ether / IP / TCP 192.168.1.10:8882 > 14.215.177.39:https A
435	2020-03-17 22:09:08	240e:d4:2e8e:df00:4882:f650:cbf9:db1d	2404:6800:4008:800::2004	Https	86	Ether / IPv6 / TCP 240e:d4:2e8e:df00:4882:f650:cbf9:db1d:8867 > 2404:6800:4008:800::2004:https S
436	2020-03-17 22:09:08	192.168.1.10	14.215.177.38	Https	66	Ether / IP / TCP 192.168.1.10:8885 > 14.215.177.38:https S
437	2020-03-17 22:09:08	14.215.177.38	192.168.1.10	Https	66	Ether / IP / TCP 14.215.177.38:https > 192.168.1.10:8885 SA
438	2020-03-17 22:09:08	192.168.1.10	14.215.177.38	Https	54	Ether / IP / TCP 192.168.1.10:8885 > 14.215.177.38:https A
439	2020-03-17 22:09:08	192.168.1.10	14.215.177.38	Https	571	Ether / IP / TCP 192.168.1.10:8885 > 14.215.177.38:https PA / Raw
440	2020-03-17 22:09:08	14.215.177.38	192.168.1.10	Https	60	Ether / IP / TCP 14.215.177.38:https > 192.168.1.10:8885 A / Padding
441	2020-03-17 22:09:08	14.215.177.38	192.168.1.10	Https	150	Ether / IP / TCP 14.215.177.38:https > 192.168.1.10:8885 PA / Raw
442	2020-03-17 22:09:08	14.215.177.38	192.168.1.10	Https	60	Ether / IP / TCP 14.215.177.38:https > 192.168.1.10:8885 PA / Raw
443	2020-03-17 22:09:08	14.215.177.38	192.168.1.10	Https	99	Ether / IP / TCP 14.215.177.38:https > 192.168.1.10:8885 PA / Raw
444	2020-03-17 22:09:08	192.168.1.10	14.215.177.38	Https	54	Ether / IP / TCP 192.168.1.10:8885 > 14.215.177.38:https A
445	2020-03-17 22:09:08	192.168.1.10	14.215.177.38	Https	105	Ether / IP / TCP 192.168.1.10:8885 > 14.215.177.38:https PA / Raw
446	2020-03-17 22:09:08	192.168.1.10	14.215.177.38	Https	1383	Ether / IP / TCP 192.168.1.10:8885 > 14.215.177.38:https PA / Raw
447	2020-03-17 22:09:08	14.215.177.38	192.168.1.10	Https	99	Ether / IP / TCP 14.215.177.38:https > 192.168.1.10:8885 PA / Raw
448	2020-03-17 22:09:08	192.168.1.10	14.215.177.38	Https	66	Ether / IP / TCP 192.168.1.10:8885 > 14.215.177.38:https A
449	2020-03-17 22:09:08	14.215.177.38	192.168.1.10	Https	60	Ether / IP / TCP 14.215.177.38:https > 192.168.1.10:8885 A / Padding
450	2020-03-17 22:09:08	14.215.177.38	192.168.1.10	Https	60	Ether / IP / TCP 14.215.177.38:https > 192.168.1.10:8885 A / Padding
451	2020-03-17 22:09:08	2401:c900:1601:161::7	240e:d4:2e8e:df00:4882:f650:cbf9:db1d	TCP	86	Ether / IPv6 / TCP 2401:c900:1601:161::7:5938 > 240e:d4:2e8e:df00:4882:f650:cbf9:db1d:3803 A
452	2020-03-17 22:09:08	240e:d4:2e8e:df00:4882:f650:cbf9:db1d	2404:6800:4008:800::2004	Https	86	Ether / IPv6 / TCP 240e:d4:2e8e:df00:4882:f650:cbf9:db1d:8869 > 2404:6800:4008:800::2004:https S
453	2020-03-17 22:09:08	14.215.177.38	192.168.1.10	Https	372	Ether / IP / TCP 14.215.177.38:https > 192.168.1.10:8885 PA / Raw
454	2020-03-17 22:09:08	192.168.1.10	14.215.177.39	Https	1399	Ether / IP / TCP 192.168.1.10:8877 > 14.215.177.39:https PA / Raw
455	2020-03-17 22:09:08	14.215.177.39	192.168.1.10	Https	60	Ether / IP / TCP 14.215.177.39:https > 192.168.1.10:8877 A / Padding
456	2020-03-17 22:09:08	192.168.1.10	14.215.177.38	Https	54	Ether / IP / TCP 192.168.1.10:8885 > 14.215.177.38:https A
457	2020-03-17 22:09:08	240e:d4:2e8e:df00:4882:f650:cbf9:db1d	2404:6800:4008:800::2004	Https	86	Ether / IPv6 / TCP 240e:d4:2e8e:df00:4882:f650:cbf9:db1d:8870 > 2404:6800:4008:800::2004:https S
458	2020-03-17 22:09:08	192.168.1.10	67.228.235.91	Https	66	Ether / IP / TCP 192.168.1.10:8871 > 67.228.235.91:https S
459	2020-03-17 22:09:08	14.215.177.39	192.168.1.10	Https	1506	Ether / IP / TCP 14.215.177.39:https > 192.168.1.10:8877 A / Raw
460	2020-03-17 22:09:08	14.215.177.39	192.168.1.10	Https	1506	Ether / IP / TCP 14.215.177.39:https > 192.168.1.10:8877 A / Raw
461	2020-03-17 22:09:08	14.215.177.39	192.168.1.10	Https	1179	Ether / IP / TCP 14.215.177.39:https > 192.168.1.10:8877 PA / Raw
462	2020-03-17 22:09:08	14.215.177.39	192.168.1.10	Https	210	Ether / IP / TCP 14.215.177.39:https > 192.168.1.10:8877 PA / Raw
463	2020-03-17 22:09:08	14.215.177.39	192.168.1.10	Https	212	Ether / IP / TCP 14.215.177.39:https > 192.168.1.10:8877 PA / Raw
464	2020-03-17 22:09:08	14.215.177.39	192.168.1.10	Https	88	Ether / IP / TCP 14.215.177.39:https > 192.168.1.10:8877 PA / Raw
465	2020-03-17 22:09:08	192.168.1.10	14.215.177.39	Https	54	Ether / IP / TCP 192.168.1.10:8877 > 14.215.177.39:https A
466	2020-03-17 22:09:08	240e:d4:2e8e:df00:4882:f650:cbf9:db1d	2404:6800:4008:800::2004	Https	86	Ether / IPv6 / TCP 240e:d4:2e8e:df00:4882:f650:cbf9:db1d:8872 > 2404:6800:4008:800::2004:https S
467	2020-03-17 22:09:08	192.168.1.10	14.215.177.39	Https	1137	Ether / IP / TCP 192.168.1.10:8877 > 14.215.177.39:https PA / Raw
468	2020-03-17 22:09:08	192.168.1.10	125.77.154.33	Https	66	Ether / IP / TCP 192.168.1.10:8887 > 125.77.154.33:https S
469	2020-03-17 22:09:08	fe80::f141:b4f2:11de:b126	fe80::1	DNS	94	Ether / IPv6 / UDP / DNS Qry "b'dss0.baidu.com.'" 
470	2020-03-17 22:09:08	192.168.1.10	125.77.154.33	Https	66	Ether / IP / TCP 192.168.1.10:8888 > 125.77.154.33:https S
471	2020-03-17 22:09:08	fe80::f141:b4f2:11de:b126	fe80::1	DNS	94	Ether / IPv6 / UDP / DNS Qry "b'dss1.baidu.com.'" 
472	2020-03-17 22:09:08	fe80::f141:b4f2:11de:b126	fe80::1	DNS	94	Ether / IPv6 / UDP / DNS Qry "b'dss1.baidu.com.'" 
473	2020-03-17 22:09:08	fe80::f141:b4f2:11de:b126	fe80::1	DNS	94	Ether / IPv6 / UDP / DNS Qry "b'dss3.baidu.com.'" 
474	2020-03-17 22:09:08	125.77.154.33	192.168.1.10	Https	66	Ether / IP / TCP 125.77.154.33:https > 192.168.1.10:8887 SA
475	2020-03-17 22:09:08	192.168.1.10	125.77.154.33	Https	54	Ether / IP / TCP 192.168.1.10:8887 > 125.77.154.33:https A
476	2020-03-17 22:09:08	fe80::f141:b4f2:11de:b126	fe80::1	DNS	97	Ether / IPv6 / UDP / DNS Qry "b'gss0.bdstatic.com.'" 
477	2020-03-17 22:09:08	fe80::f141:b4f2:11de:b126	fe80::1	DNS	94	Ether / IPv6 / UDP / DNS Qry "b'dss3.baidu.com.'" 
478	2020-03-17 22:09:08	192.168.1.10	125.77.154.33	Https	571	Ether / IP / TCP 192.168.1.10:8887 > 125.77.154.33:https PA / Raw
479	2020-03-17 22:09:08	125.77.154.33	192.168.1.10	Https	66	Ether / IP / TCP 125.77.154.33:https > 192.168.1.10:8888 SA
480	2020-03-17 22:09:08	fe80::f141:b4f2:11de:b126	fe80::1	DNS	97	Ether / IPv6 / UDP / DNS Qry "b'gss0.bdstatic.com.'" 
481	2020-03-17 22:09:08	192.168.1.10	125.77.154.33	Https	54	Ether / IP / TCP 192.168.1.10:8888 > 125.77.154.33:https A
482	2020-03-17 22:09:08	fe80::1	fe80::f141:b4f2:11de:b126	DNS	184	Ether / IPv6 / UDP / DNS Ans "b'sslbaiduv6.jomodns.com.'" 
483	2020-03-17 22:09:08	fe80::1	fe80::f141:b4f2:11de:b126	DNS	381	Ether / IPv6 / UDP / DNS Ans "b'sslbaiduv6.jomodns.com.'" 
484	2020-03-17 22:09:08	192.168.1.10	125.77.154.33	Https	571	Ether / IP / TCP 192.168.1.10:8888 > 125.77.154.33:https PA / Raw
485	2020-03-17 22:09:08	14.215.177.39	192.168.1.10	Https	60	Ether / IP / TCP 14.215.177.39:https > 192.168.1.10:8877 A / Padding
486	2020-03-17 22:09:08	fe80::1	fe80::f141:b4f2:11de:b126	DNS	184	Ether / IPv6 / UDP / DNS Ans "b'sslbaiduv6.jomodns.com.'" 
487	2020-03-17 22:09:08	fe80::1	fe80::f141:b4f2:11de:b126	DNS	381	Ether / IPv6 / UDP / DNS Ans "b'sslbaiduv6.jomodns.com.'" 
488	2020-03-17 22:09:08	14.215.177.39	192.168.1.10	Https	713	Ether / IP / TCP 14.215.177.39:https > 192.168.1.10:8877 PA / Raw
489	2020-03-17 22:09:08	125.77.154.33	192.168.1.10	Https	60	Ether / IP / TCP 125.77.154.33:https > 192.168.1.10:8887 A / Padding
490	2020-03-17 22:09:08	fe80::1	fe80::f141:b4f2:11de:b126	DNS	382	Ether / IPv6 / UDP / DNS Ans "b'sslshare.jomodns.com.'" 
491	2020-03-17 22:09:08	fe80::1	fe80::f141:b4f2:11de:b126	DNS	184	Ether / IPv6 / UDP / DNS Ans "b'sslbaiduv6.jomodns.com.'" 
492	2020-03-17 22:09:08	192.168.1.10	125.77.154.33	Https	66	Ether / IP / TCP 192.168.1.10:8889 > 125.77.154.33:https S
493	2020-03-17 22:09:08	fe80::1	fe80::f141:b4f2:11de:b126	DNS	191	Ether / IPv6 / UDP / DNS Ans "b'sslshare.jomodns.com.'" 
494	2020-03-17 22:09:08	125.77.154.33	192.168.1.10	Https	1394	Ether / IP / TCP 125.77.154.33:https > 192.168.1.10:8887 A / Raw
495	2020-03-17 22:09:08	125.77.154.33	192.168.1.10	Https	1394	Ether / IP / TCP 125.77.154.33:https > 192.168.1.10:8887 A / Raw
496	2020-03-17 22:09:08	125.77.154.33	192.168.1.10	Https	148	Ether / IP / TCP 125.77.154.33:https > 192.168.1.10:8887 PA / Raw
497	2020-03-17 22:09:08	125.77.154.33	192.168.1.10	Https	1394	Ether / IP / TCP 125.77.154.33:https > 192.168.1.10:8887 A / Raw
498	2020-03-17 22:09:08	125.77.154.33	192.168.1.10	Https	130	Ether / IP / TCP 125.77.154.33:https > 192.168.1.10:8887 PA / Raw
499	2020-03-17 22:09:08	192.168.1.10	125.77.154.33	Https	66	Ether / IP / TCP 192.168.1.10:8887 > 125.77.154.33:https A
500	2020-03-17 22:09:08	192.168.1.10	125.77.154.33	Https	66	Ether / IP / TCP 192.168.1.10:8887 > 125.77.154.33:https A
501	2020-03-17 22:09:08	192.168.1.10	125.77.154.33	Https	54	Ether / IP / TCP 192.168.1.10:8887 > 125.77.154.33:https A
502	2020-03-17 22:09:08	125.77.154.33	192.168.1.10	Https	60	Ether / IP / TCP 125.77.154.33:https > 192.168.1.10:8888 A / Padding
503	2020-03-17 22:09:08	192.168.1.10	125.77.154.33	Https	66	Ether / IP / TCP 192.168.1.10:8890 > 125.77.154.33:https S
504	2020-03-17 22:09:08	125.77.154.33	192.168.1.10	Https	1394	Ether / IP / TCP 125.77.154.33:https > 192.168.1.10:8888 A / Raw
505	2020-03-17 22:09:08	125.77.154.33	192.168.1.10	Https	1394	Ether / IP / TCP 125.77.154.33:https > 192.168.1.10:8888 A / Raw
506	2020-03-17 22:09:08	125.77.154.33	192.168.1.10	Https	1394	Ether / IP / TCP 125.77.154.33:https > 192.168.1.10:8888 A / Raw
507	2020-03-17 22:09:08	125.77.154.33	192.168.1.10	Https	148	Ether / IP / TCP 125.77.154.33:https > 192.168.1.10:8888 PA / Raw
508	2020-03-17 22:09:08	125.77.154.33	192.168.1.10	Https	130	Ether / IP / TCP 125.77.154.33:https > 192.168.1.10:8888 PA / Raw
509	2020-03-17 22:09:08	192.168.1.10	125.77.154.33	Https	66	Ether / IP / TCP 192.168.1.10:8888 > 125.77.154.33:https A
510	2020-03-17 22:09:08	192.168.1.10	125.77.154.33	Https	54	Ether / IP / TCP 192.168.1.10:8888 > 125.77.154.33:https A
511	2020-03-17 22:09:08	192.168.1.10	125.77.154.33	Https	66	Ether / IP / TCP 192.168.1.10:8888 > 125.77.154.33:https A
512	2020-03-17 22:09:08	192.168.1.10	125.77.154.33	Https	54	Ether / IP / TCP 192.168.1.10:8888 > 125.77.154.33:https A
513	2020-03-17 22:09:08	192.168.1.10	67.228.235.91	Https	66	Ether / IP / TCP 192.168.1.10:8873 > 67.228.235.91:https S
514	2020-03-17 22:09:08	125.77.154.33	192.168.1.10	Https	66	Ether / IP / TCP 125.77.154.33:https > 192.168.1.10:8889 SA
515	2020-03-17 22:09:08	192.168.1.10	125.77.154.33	Https	54	Ether / IP / TCP 192.168.1.10:8889 > 125.77.154.33:https A
516	2020-03-17 22:09:08	192.168.1.10	125.77.154.33	Https	66	Ether / IP / TCP 192.168.1.10:8891 > 125.77.154.33:https S
517	2020-03-17 22:09:08	192.168.1.10	125.77.154.33	Https	66	Ether / IP / TCP 192.168.1.10:8892 > 125.77.154.33:https S
518	2020-03-17 22:09:08	125.77.154.33	192.168.1.10	Https	66	Ether / IP / TCP 125.77.154.33:https > 192.168.1.10:8890 SA
519	2020-03-17 22:09:08	192.168.1.10	125.77.154.33	Https	54	Ether / IP / TCP 192.168.1.10:8890 > 125.77.154.33:https A
520	2020-03-17 22:09:08	192.168.1.10	125.77.154.31	Https	66	Ether / IP / TCP 192.168.1.10:8893 > 125.77.154.31:https S
521	2020-03-17 22:09:08	192.168.1.10	125.77.154.33	Https	66	Ether / IP / TCP 192.168.1.10:8894 > 125.77.154.33:https S
522	2020-03-17 22:09:08	125.77.154.33	192.168.1.10	Https	66	Ether / IP / TCP 125.77.154.33:https > 192.168.1.10:8891 SA
523	2020-03-17 22:09:08	192.168.1.10	125.77.154.33	Https	54	Ether / IP / TCP 192.168.1.10:8891 > 125.77.154.33:https A
524	2020-03-17 22:09:08	125.77.154.33	192.168.1.10	Https	66	Ether / IP / TCP 125.77.154.33:https > 192.168.1.10:8892 SA
525	2020-03-17 22:09:08	192.168.1.10	125.77.154.33	Https	54	Ether / IP / TCP 192.168.1.10:8892 > 125.77.154.33:https A
526	2020-03-17 22:09:08	125.77.154.31	192.168.1.10	Https	66	Ether / IP / TCP 125.77.154.31:https > 192.168.1.10:8893 SA
527	2020-03-17 22:09:08	192.168.1.10	125.77.154.33	Https	668	Ether / IP / TCP 192.168.1.10:8889 > 125.77.154.33:https PA / Raw
528	2020-03-17 22:09:08	192.168.1.10	125.77.154.31	Https	54	Ether / IP / TCP 192.168.1.10:8893 > 125.77.154.31:https A
529	2020-03-17 22:09:08	125.77.154.33	192.168.1.10	Https	66	Ether / IP / TCP 125.77.154.33:https > 192.168.1.10:8894 SA
530	2020-03-17 22:09:08	fe80::f141:b4f2:11de:b126	fe80::1	DNS	94	Ether / IPv6 / UDP / DNS Qry "b'dss2.baidu.com.'" 
531	2020-03-17 22:09:08	192.168.1.10	125.77.154.33	Https	54	Ether / IP / TCP 192.168.1.10:8894 > 125.77.154.33:https A
532	2020-03-17 22:09:08	fe80::f141:b4f2:11de:b126	fe80::1	DNS	94	Ether / IPv6 / UDP / DNS Qry "b'dss2.baidu.com.'" 
533	2020-03-17 22:09:08	192.168.1.10	125.77.154.33	Https	571	Ether / IP / TCP 192.168.1.10:8890 > 125.77.154.33:https PA / Raw
534	2020-03-17 22:09:08	192.168.1.10	125.77.154.33	Https	66	Ether / IP / TCP 192.168.1.10:8895 > 125.77.154.33:https S
535	2020-03-17 22:09:08	192.168.1.10	125.77.154.33	Https	571	Ether / IP / TCP 192.168.1.10:8891 > 125.77.154.33:https PA / Raw
536	2020-03-17 22:09:08	192.168.1.10	125.77.154.33	Https	571	Ether / IP / TCP 192.168.1.10:8892 > 125.77.154.33:https PA / Raw
537	2020-03-17 22:09:08	192.168.1.10	125.77.154.31	Https	571	Ether / IP / TCP 192.168.1.10:8893 > 125.77.154.31:https PA / Raw
538	2020-03-17 22:09:08	192.168.1.10	125.77.154.33	Https	571	Ether / IP / TCP 192.168.1.10:8894 > 125.77.154.33:https PA / Raw
539	2020-03-17 22:09:08	125.77.154.33	192.168.1.10	Https	60	Ether / IP / TCP 125.77.154.33:https > 192.168.1.10:8889 A / Padding
540	2020-03-17 22:09:08	125.77.154.33	192.168.1.10	Https	304	Ether / IP / TCP 125.77.154.33:https > 192.168.1.10:8889 PA / Raw
541	2020-03-17 22:09:08	125.77.154.33	192.168.1.10	Https	60	Ether / IP / TCP 125.77.154.33:https > 192.168.1.10:8890 A / Padding
542	2020-03-17 22:09:08	125.77.154.33	192.168.1.10	Https	66	Ether / IP / TCP 125.77.154.33:https > 192.168.1.10:8895 SA
543	2020-03-17 22:09:08	fe80::1	fe80::f141:b4f2:11de:b126	DNS	381	Ether / IPv6 / UDP / DNS Ans "b'sslbaiduv6.jomodns.com.'" 
544	2020-03-17 22:09:08	fe80::1	fe80::f141:b4f2:11de:b126	DNS	184	Ether / IPv6 / UDP / DNS Ans "b'sslbaiduv6.jomodns.com.'" 
545	2020-03-17 22:09:08	192.168.1.10	125.77.154.33	Https	54	Ether / IP / TCP 192.168.1.10:8895 > 125.77.154.33:https A
546	2020-03-17 22:09:08	125.77.154.33	192.168.1.10	Https	60	Ether / IP / TCP 125.77.154.33:https > 192.168.1.10:8891 A / Padding
547	2020-03-17 22:09:08	125.77.154.33	192.168.1.10	Https	60	Ether / IP / TCP 125.77.154.33:https > 192.168.1.10:8892 A / Padding
548	2020-03-17 22:09:08	125.77.154.31	192.168.1.10	Https	60	Ether / IP / TCP 125.77.154.31:https > 192.168.1.10:8893 A / Padding
549	2020-03-17 22:09:08	192.168.1.10	125.77.154.33	Https	134	Ether / IP / TCP 192.168.1.10:8889 > 125.77.154.33:https PA / Raw
550	2020-03-17 22:09:08	192.168.1.10	125.77.154.33	Https	571	Ether / IP / TCP 192.168.1.10:8895 > 125.77.154.33:https PA / Raw
551	2020-03-17 22:09:08	125.77.154.33	192.168.1.10	Https	1394	Ether / IP / TCP 125.77.154.33:https > 192.168.1.10:8891 A / Raw
552	2020-03-17 22:09:08	125.77.154.33	192.168.1.10	Https	1394	Ether / IP / TCP 125.77.154.33:https > 192.168.1.10:8891 A / Raw
553	2020-03-17 22:09:08	125.77.154.33	192.168.1.10	Https	1394	Ether / IP / TCP 125.77.154.33:https > 192.168.1.10:8891 A / Raw
554	2020-03-17 22:09:08	125.77.154.33	192.168.1.10	Https	130	Ether / IP / TCP 125.77.154.33:https > 192.168.1.10:8891 PA / Raw
555	2020-03-17 22:09:08	125.77.154.33	192.168.1.10	Https	148	Ether / IP / TCP 125.77.154.33:https > 192.168.1.10:8891 PA / Raw
556	2020-03-17 22:09:08	125.77.154.33	192.168.1.10	Https	60	Ether / IP / TCP 125.77.154.33:https > 192.168.1.10:8894 A / Padding
557	2020-03-17 22:09:08	125.77.154.33	192.168.1.10	Https	1394	Ether / IP / TCP 125.77.154.33:https > 192.168.1.10:8892 A / Raw
558	2020-03-17 22:09:08	125.77.154.33	192.168.1.10	Https	1394	Ether / IP / TCP 125.77.154.33:https > 192.168.1.10:8892 A / Raw
559	2020-03-17 22:09:08	125.77.154.33	192.168.1.10	Https	1394	Ether / IP / TCP 125.77.154.33:https > 192.168.1.10:8892 A / Raw
560	2020-03-17 22:09:08	125.77.154.33	192.168.1.10	Https	130	Ether / IP / TCP 125.77.154.33:https > 192.168.1.10:8892 PA / Raw
561	2020-03-17 22:09:08	125.77.154.33	192.168.1.10	Https	148	Ether / IP / TCP 125.77.154.33:https > 192.168.1.10:8892 PA / Raw
562	2020-03-17 22:09:08	192.168.1.10	125.77.154.33	Https	66	Ether / IP / TCP 192.168.1.10:8892 > 125.77.154.33:https A
563	2020-03-17 22:09:08	192.168.1.10	125.77.154.33	Https	54	Ether / IP / TCP 192.168.1.10:8892 > 125.77.154.33:https A
564	2020-03-17 22:09:08	192.168.1.10	125.77.154.33	Https	66	Ether / IP / TCP 192.168.1.10:8896 > 125.77.154.33:https S
565	2020-03-17 22:09:08	192.168.1.10	125.77.154.33	Https	54	Ether / IP / TCP 192.168.1.10:8891 > 125.77.154.33:https A
566	2020-03-17 22:09:08	192.168.1.10	125.77.154.33	Https	54	Ether / IP / TCP 192.168.1.10:8892 > 125.77.154.33:https A
567	2020-03-17 22:09:08	125.77.154.33	192.168.1.10	Https	1394	Ether / IP / TCP 125.77.154.33:https > 192.168.1.10:8890 A / Raw
568	2020-03-17 22:09:08	125.77.154.33	192.168.1.10	Https	1394	Ether / IP / TCP 125.77.154.33:https > 192.168.1.10:8890 A / Raw
569	2020-03-17 22:09:08	125.77.154.33	192.168.1.10	Https	130	Ether / IP / TCP 125.77.154.33:https > 192.168.1.10:8890 PA / Raw
570	2020-03-17 22:09:08	125.77.154.33	192.168.1.10	Https	1394	Ether / IP / TCP 125.77.154.33:https > 192.168.1.10:8890 A / Raw
571	2020-03-17 22:09:08	125.77.154.33	192.168.1.10	Https	148	Ether / IP / TCP 125.77.154.33:https > 192.168.1.10:8890 PA / Raw
572	2020-03-17 22:09:08	192.168.1.10	125.77.154.33	Https	66	Ether / IP / TCP 192.168.1.10:8890 > 125.77.154.33:https A
573	2020-03-17 22:09:08	192.168.1.10	125.77.154.33	Https	54	Ether / IP / TCP 192.168.1.10:8890 > 125.77.154.33:https A
574	2020-03-17 22:09:08	125.77.154.31	192.168.1.10	Https	1394	Ether / IP / TCP 125.77.154.31:https > 192.168.1.10:8893 A / Raw
575	2020-03-17 22:09:08	125.77.154.31	192.168.1.10	Https	1394	Ether / IP / TCP 125.77.154.31:https > 192.168.1.10:8893 A / Raw
576	2020-03-17 22:09:08	125.77.154.31	192.168.1.10	Https	1394	Ether / IP / TCP 125.77.154.31:https > 192.168.1.10:8893 A / Raw
577	2020-03-17 22:09:08	125.77.154.31	192.168.1.10	Https	65	Ether / IP / TCP 125.77.154.31:https > 192.168.1.10:8893 PA / Raw
578	2020-03-17 22:09:08	125.77.154.33	192.168.1.10	Https	1394	Ether / IP / TCP 125.77.154.33:https > 192.168.1.10:8894 A / Raw
579	2020-03-17 22:09:08	125.77.154.33	192.168.1.10	Https	1394	Ether / IP / TCP 125.77.154.33:https > 192.168.1.10:8894 A / Raw
580	2020-03-17 22:09:08	125.77.154.33	192.168.1.10	Https	130	Ether / IP / TCP 125.77.154.33:https > 192.168.1.10:8894 PA / Raw
581	2020-03-17 22:09:08	125.77.154.33	192.168.1.10	Https	1394	Ether / IP / TCP 125.77.154.33:https > 192.168.1.10:8894 A / Raw
582	2020-03-17 22:09:08	125.77.154.33	192.168.1.10	Https	148	Ether / IP / TCP 125.77.154.33:https > 192.168.1.10:8894 PA / Raw
583	2020-03-17 22:09:08	192.168.1.10	125.77.154.33	Https	146	Ether / IP / TCP 192.168.1.10:8889 > 125.77.154.33:https PA / Raw
584	2020-03-17 22:09:08	192.168.1.10	125.77.154.31	Https	66	Ether / IP / TCP 192.168.1.10:8893 > 125.77.154.31:https A
585	2020-03-17 22:09:08	192.168.1.10	125.77.154.31	Https	54	Ether / IP / TCP 192.168.1.10:8893 > 125.77.154.31:https A
586	2020-03-17 22:09:08	192.168.1.10	125.77.154.33	Https	66	Ether / IP / TCP 192.168.1.10:8894 > 125.77.154.33:https A
587	2020-03-17 22:09:08	192.168.1.10	125.77.154.33	Https	54	Ether / IP / TCP 192.168.1.10:8894 > 125.77.154.33:https A
588	2020-03-17 22:09:08	192.168.1.10	125.77.154.33	Https	66	Ether / IP / TCP 192.168.1.10:8894 > 125.77.154.33:https A
589	2020-03-17 22:09:08	192.168.1.10	125.77.154.33	Https	54	Ether / IP / TCP 192.168.1.10:8894 > 125.77.154.33:https A
590	2020-03-17 22:09:08	192.168.1.10	125.77.154.31	Https	54	Ether / IP / TCP 192.168.1.10:8893 > 125.77.154.31:https A
591	2020-03-17 22:09:08	125.77.154.33	192.168.1.10	Https	60	Ether / IP / TCP 125.77.154.33:https > 192.168.1.10:8889 A / Padding
592	2020-03-17 22:09:08	125.77.154.33	192.168.1.10	Https	60	Ether / IP / TCP 125.77.154.33:https > 192.168.1.10:8895 A / Padding
593	2020-03-17 22:09:08	125.77.154.33	192.168.1.10	Https	116	Ether / IP / TCP 125.77.154.33:https > 192.168.1.10:8889 PA / Raw
594	2020-03-17 22:09:08	192.168.1.10	125.77.154.33	Https	768	Ether / IP / TCP 192.168.1.10:8889 > 125.77.154.33:https PA / Raw
595	2020-03-17 22:09:08	192.168.1.10	125.77.154.33	Https	182	Ether / IP / TCP 192.168.1.10:8889 > 125.77.154.33:https PA / Raw
596	2020-03-17 22:09:08	192.168.1.10	125.77.154.33	Https	181	Ether / IP / TCP 192.168.1.10:8889 > 125.77.154.33:https PA / Raw
597	2020-03-17 22:09:08	192.168.1.10	125.77.154.33	Https	182	Ether / IP / TCP 192.168.1.10:8889 > 125.77.154.33:https PA / Raw
598	2020-03-17 22:09:08	192.168.1.10	125.77.154.33	Https	182	Ether / IP / TCP 192.168.1.10:8889 > 125.77.154.33:https PA / Raw
599	2020-03-17 22:09:08	192.168.1.10	125.77.154.33	Https	182	Ether / IP / TCP 192.168.1.10:8889 > 125.77.154.33:https PA / Raw
600	2020-03-17 22:09:08	192.168.1.10	125.77.154.33	Https	182	Ether / IP / TCP 192.168.1.10:8889 > 125.77.154.33:https PA / Raw
601	2020-03-17 22:09:08	192.168.1.10	125.77.154.33	Https	182	Ether / IP / TCP 192.168.1.10:8889 > 125.77.154.33:https PA / Raw
602	2020-03-17 22:09:08	192.168.1.10	125.77.154.33	Https	182	Ether / IP / TCP 192.168.1.10:8889 > 125.77.154.33:https PA / Raw
603	2020-03-17 22:09:08	125.77.154.33	192.168.1.10	Https	66	Ether / IP / TCP 125.77.154.33:https > 192.168.1.10:8896 SA
604	2020-03-17 22:09:08	125.77.154.33	192.168.1.10	Https	1394	Ether / IP / TCP 125.77.154.33:https > 192.168.1.10:8895 A / Raw
605	2020-03-17 22:09:08	192.168.1.10	125.77.154.33	Https	181	Ether / IP / TCP 192.168.1.10:8889 > 125.77.154.33:https PA / Raw
606	2020-03-17 22:09:08	125.77.154.33	192.168.1.10	Https	1394	Ether / IP / TCP 125.77.154.33:https > 192.168.1.10:8895 A / Raw
607	2020-03-17 22:09:08	125.77.154.33	192.168.1.10	Https	1394	Ether / IP / TCP 125.77.154.33:https > 192.168.1.10:8895 A / Raw
608	2020-03-17 22:09:08	125.77.154.33	192.168.1.10	Https	130	Ether / IP / TCP 125.77.154.33:https > 192.168.1.10:8895 PA / Raw
609	2020-03-17 22:09:08	192.168.1.10	125.77.154.33	Https	182	Ether / IP / TCP 192.168.1.10:8889 > 125.77.154.33:https PA / Raw
610	2020-03-17 22:09:08	192.168.1.10	125.77.154.33	Https	66	Ether / IP / TCP 192.168.1.10:8895 > 125.77.154.33:https A
611	2020-03-17 22:09:08	192.168.1.10	125.77.154.33	Https	66	Ether / IP / TCP 192.168.1.10:8895 > 125.77.154.33:https A
612	2020-03-17 22:09:08	192.168.1.10	125.77.154.33	Https	54	Ether / IP / TCP 192.168.1.10:8895 > 125.77.154.33:https A
613	2020-03-17 22:09:08	192.168.1.10	125.77.154.33	Https	54	Ether / IP / TCP 192.168.1.10:8896 > 125.77.154.33:https A
614	2020-03-17 22:09:08	125.77.154.33	192.168.1.10	Https	148	Ether / IP / TCP 125.77.154.33:https > 192.168.1.10:8895 PA / Raw
615	2020-03-17 22:09:08	125.77.154.33	192.168.1.10	Https	60	Ether / IP / TCP 125.77.154.33:https > 192.168.1.10:8889 A / Padding
616	2020-03-17 22:09:08	192.168.1.10	125.77.154.33	Https	54	Ether / IP / TCP 192.168.1.10:8895 > 125.77.154.33:https A
617	2020-03-17 22:09:08	125.77.154.33	192.168.1.10	Https	85	Ether / IP / TCP 125.77.154.33:https > 192.168.1.10:8889 PA / Raw
618	2020-03-17 22:09:08	192.168.1.10	125.77.154.33	Https	571	Ether / IP / TCP 192.168.1.10:8896 > 125.77.154.33:https PA / Raw
619	2020-03-17 22:09:08	192.168.1.10	125.77.154.33	Https	85	Ether / IP / TCP 192.168.1.10:8889 > 125.77.154.33:https PA / Raw
620	2020-03-17 22:09:08	125.77.154.33	192.168.1.10	Https	60	Ether / IP / TCP 125.77.154.33:https > 192.168.1.10:8889 A / Padding
621	2020-03-17 22:09:08	125.77.154.33	192.168.1.10	Https	60	Ether / IP / TCP 125.77.154.33:https > 192.168.1.10:8889 A / Padding
622	2020-03-17 22:09:08	125.77.154.33	192.168.1.10	Https	66	Ether / IP / TCP 125.77.154.33:https > 192.168.1.10:8889 A
623	2020-03-17 22:09:08	125.77.154.33	192.168.1.10	Https	60	Ether / IP / TCP 125.77.154.33:https > 192.168.1.10:8889 A / Padding
624	2020-03-17 22:09:08	125.77.154.33	192.168.1.10	Https	60	Ether / IP / TCP 125.77.154.33:https > 192.168.1.10:8889 A / Padding
625	2020-03-17 22:09:08	125.77.154.33	192.168.1.10	Https	66	Ether / IP / TCP 125.77.154.33:https > 192.168.1.10:8889 A
626	2020-03-17 22:09:08	125.77.154.33	192.168.1.10	Https	66	Ether / IP / TCP 125.77.154.33:https > 192.168.1.10:8889 A
627	2020-03-17 22:09:08	125.77.154.33	192.168.1.10	Https	60	Ether / IP / TCP 125.77.154.33:https > 192.168.1.10:8889 A / Padding
628	2020-03-17 22:09:08	125.77.154.33	192.168.1.10	Https	66	Ether / IP / TCP 125.77.154.33:https > 192.168.1.10:8889 A
629	2020-03-17 22:09:08	125.77.154.33	192.168.1.10	Https	60	Ether / IP / TCP 125.77.154.33:https > 192.168.1.10:8889 A / Padding
630	2020-03-17 22:09:08	125.77.154.33	192.168.1.10	Https	60	Ether / IP / TCP 125.77.154.33:https > 192.168.1.10:8889 A / Padding
631	2020-03-17 22:09:08	125.77.154.33	192.168.1.10	Https	1394	Ether / IP / TCP 125.77.154.33:https > 192.168.1.10:8889 A / Raw
632	2020-03-17 22:09:08	125.77.154.33	192.168.1.10	Https	1186	Ether / IP / TCP 125.77.154.33:https > 192.168.1.10:8889 PA / Raw
633	2020-03-17 22:09:08	125.77.154.33	192.168.1.10	Https	85	Ether / IP / TCP 125.77.154.33:https > 192.168.1.10:8889 PA / Raw
634	2020-03-17 22:09:08	192.168.1.10	125.77.154.33	Https	54	Ether / IP / TCP 192.168.1.10:8889 > 125.77.154.33:https A
635	2020-03-17 22:09:08	125.77.154.33	192.168.1.10	Https	1394	Ether / IP / TCP 125.77.154.33:https > 192.168.1.10:8889 A / Raw
636	2020-03-17 22:09:08	125.77.154.33	192.168.1.10	Https	1394	Ether / IP / TCP 125.77.154.33:https > 192.168.1.10:8889 PA / Raw
637	2020-03-17 22:09:08	125.77.154.33	192.168.1.10	Https	85	Ether / IP / TCP 125.77.154.33:https > 192.168.1.10:8889 PA / Raw
638	2020-03-17 22:09:08	125.77.154.33	192.168.1.10	Https	1394	Ether / IP / TCP 125.77.154.33:https > 192.168.1.10:8889 A / Raw
639	2020-03-17 22:09:08	125.77.154.33	192.168.1.10	Https	1394	Ether / IP / TCP 125.77.154.33:https > 192.168.1.10:8889 A / Raw
640	2020-03-17 22:09:08	125.77.154.33	192.168.1.10	Https	139	Ether / IP / TCP 125.77.154.33:https > 192.168.1.10:8889 PA / Raw
641	2020-03-17 22:09:08	125.77.154.33	192.168.1.10	Https	85	Ether / IP / TCP 125.77.154.33:https > 192.168.1.10:8889 PA / Raw
642	2020-03-17 22:09:08	125.77.154.33	192.168.1.10	Https	619	Ether / IP / TCP 125.77.154.33:https > 192.168.1.10:8889 PA / Raw
643	2020-03-17 22:09:08	125.77.154.33	192.168.1.10	Https	1394	Ether / IP / TCP 125.77.154.33:https > 192.168.1.10:8889 A / Raw
644	2020-03-17 22:09:08	125.77.154.33	192.168.1.10	Https	85	Ether / IP / TCP 125.77.154.33:https > 192.168.1.10:8889 PA / Raw
645	2020-03-17 22:09:08	125.77.154.33	192.168.1.10	Https	1007	Ether / IP / TCP 125.77.154.33:https > 192.168.1.10:8889 PA / Raw
646	2020-03-17 22:09:08	125.77.154.33	192.168.1.10	Https	1394	Ether / IP / TCP 125.77.154.33:https > 192.168.1.10:8889 A / Raw
647	2020-03-17 22:09:08	125.77.154.33	192.168.1.10	Https	1394	Ether / IP / TCP 125.77.154.33:https > 192.168.1.10:8889 A / Raw
