1	2020-03-17 22:19:44	2401:c900:1601:161::2	240e:d4:2e8e:df00:4882:f650:cbf9:db1d	TCP	86	Ether / IPv6 / TCP 2401:c900:1601:161::2:5938 > 240e:d4:2e8e:df00:4882:f650:cbf9:db1d:10012 A
2	2020-03-17 22:19:44	192.168.1.10	52.139.250.253	Https	157	Ether / IP / TCP 192.168.1.10:1307 > 52.139.250.253:https PA / Raw
3	2020-03-17 22:19:45	192.168.1.10	14.215.177.39	Https	54	Ether / IP / TCP 192.168.1.10:10083 > 14.215.177.39:https RA
4	2020-03-17 22:19:45	192.168.1.10	52.139.250.253	Https	157	Ether / IP / TCP 192.168.1.10:1307 > 52.139.250.253:https PA / Raw
5	2020-03-17 22:19:45	52.139.250.253	192.168.1.10	Https	66	Ether / IP / TCP 52.139.250.253:https > 192.168.1.10:1307 A
6	2020-03-17 22:19:45	192.168.1.10	161.117.236.80	TCP	54	Ether / IP / TCP 192.168.1.10:10097 > 161.117.236.80:20395 FA
7	2020-03-17 22:19:45	192.168.1.10	161.117.236.80	TCP	54	Ether / IP / TCP 192.168.1.10:10089 > 161.117.236.80:20395 FA
8	2020-03-17 22:19:45	192.168.1.10	14.215.177.39	Https	54	Ether / IP / TCP 192.168.1.10:10090 > 14.215.177.39:https FA
9	2020-03-17 22:19:45	161.117.236.80	192.168.1.10	TCP	60	Ether / IP / TCP 161.117.236.80:20395 > 192.168.1.10:10097 A / Padding
10	2020-03-17 22:19:45	161.117.236.80	192.168.1.10	TCP	60	Ether / IP / TCP 161.117.236.80:20395 > 192.168.1.10:10089 A / Padding
11	2020-03-17 22:19:45	161.117.236.80	192.168.1.10	TCP	60	Ether / IP / TCP 161.117.236.80:20395 > 192.168.1.10:10097 FA / Padding
12	2020-03-17 22:19:45	192.168.1.10	161.117.236.80	TCP	54	Ether / IP / TCP 192.168.1.10:10097 > 161.117.236.80:20395 A
13	2020-03-17 22:19:45	161.117.236.80	192.168.1.10	TCP	60	Ether / IP / TCP 161.117.236.80:20395 > 192.168.1.10:10089 FA / Padding
14	2020-03-17 22:19:45	192.168.1.10	161.117.236.80	TCP	54	Ether / IP / TCP 192.168.1.10:10089 > 161.117.236.80:20395 A
15	2020-03-17 22:19:45	2401:c900:1601:161::2	240e:d4:2e8e:df00:4882:f650:cbf9:db1d	TCP	1370	Ether / IPv6 / TCP 2401:c900:1601:161::2:5938 > 240e:d4:2e8e:df00:4882:f650:cbf9:db1d:10012 PA / Raw
16	2020-03-17 22:19:45	240e:d4:2e8e:df00:4882:f650:cbf9:db1d	2401:c900:1601:161::2	TCP	251	Ether / IPv6 / TCP 240e:d4:2e8e:df00:4882:f650:cbf9:db1d:10012 > 2401:c900:1601:161::2:5938 PA / Raw
17	2020-03-17 22:19:46	52.139.250.253	192.168.1.10	Https	227	Ether / IP / TCP 52.139.250.253:https > 192.168.1.10:1307 PA / Raw
18	2020-03-17 22:19:46	192.168.1.10	52.139.250.253	Https	54	Ether / IP / TCP 192.168.1.10:1307 > 52.139.250.253:https A
19	2020-03-17 22:19:46	192.168.1.10	14.215.177.39	Https	66	Ether / IP / TCP 192.168.1.10:10099 > 14.215.177.39:https S
20	2020-03-17 22:19:46	14.215.177.39	192.168.1.10	Https	66	Ether / IP / TCP 14.215.177.39:https > 192.168.1.10:10099 SA
21	2020-03-17 22:19:46	192.168.1.10	14.215.177.39	Https	54	Ether / IP / TCP 192.168.1.10:10099 > 14.215.177.39:https A
22	2020-03-17 22:19:46	192.168.1.10	14.215.177.39	Https	54	Ether / IP / TCP 192.168.1.10:10099 > 14.215.177.39:https FA
23	2020-03-17 22:19:46	2401:c900:1601:161::2	240e:d4:2e8e:df00:4882:f650:cbf9:db1d	TCP	274	Ether / IPv6 / TCP 2401:c900:1601:161::2:5938 > 240e:d4:2e8e:df00:4882:f650:cbf9:db1d:10012 PA / Raw
24	2020-03-17 22:19:46	240e:d4:2e8e:df00:4882:f650:cbf9:db1d	2401:c900:1601:161::2	TCP	1282	Ether / IPv6 / TCP 240e:d4:2e8e:df00:4882:f650:cbf9:db1d:10012 > 2401:c900:1601:161::2:5938 PA / Raw
25	2020-03-17 22:19:46	192.168.1.10	14.215.177.39	Https	54	Ether / IP / TCP 192.168.1.10:10099 > 14.215.177.39:https FA
26	2020-03-17 22:19:46	2401:c900:1601:161::2	240e:d4:2e8e:df00:4882:f650:cbf9:db1d	TCP	274	Ether / IPv6 / TCP 2401:c900:1601:161::2:5938 > 240e:d4:2e8e:df00:4882:f650:cbf9:db1d:10012 PA / Raw
