1	2020-03-17 22:10:37	192.168.1.10	14.215.177.39	Https	54	Ether / IP / TCP 192.168.1.10:9022 > 14.215.177.39:https FA
2	2020-03-17 22:10:37	240e:d4:2e8e:df00:4882:f650:cbf9:db1d	2404:6800:4008:803::200e	Https	86	Ether / IPv6 / TCP 240e:d4:2e8e:df00:4882:f650:cbf9:db1d:9023 > 2404:6800:4008:803::200e:https S
3	2020-03-17 22:10:37	240e:d4:2e8e:df00:4882:f650:cbf9:db1d	2404:6800:4008:803::200e	Https	86	Ether / IPv6 / TCP 240e:d4:2e8e:df00:4882:f650:cbf9:db1d:9024 > 2404:6800:4008:803::200e:https S
4	2020-03-17 22:10:38	192.168.1.10	172.217.160.110	Https	66	Ether / IP / TCP 192.168.1.10:9025 > 172.217.160.110:https S
5	2020-03-17 22:10:38	192.168.1.10	14.215.177.39	Https	54	Ether / IP / TCP 192.168.1.10:9022 > 14.215.177.39:https FA
6	2020-03-17 22:10:38	192.168.1.10	172.217.160.110	Https	66	Ether / IP / TCP 192.168.1.10:9026 > 172.217.160.110:https S
7	2020-03-17 22:10:38	240e:d4:2e8e:df00:4882:f650:cbf9:db1d	2404:6800:4008:803::200e	Https	86	Ether / IPv6 / TCP 240e:d4:2e8e:df00:4882:f650:cbf9:db1d:9023 > 2404:6800:4008:803::200e:https S
8	2020-03-17 22:10:38	240e:d4:2e8e:df00:4882:f650:cbf9:db1d	2404:6800:4008:803::200e	Https	86	Ether / IPv6 / TCP 240e:d4:2e8e:df00:4882:f650:cbf9:db1d:9024 > 2404:6800:4008:803::200e:https S
9	2020-03-17 22:10:39	192.168.1.10	172.217.160.110	Https	66	Ether / IP / TCP 192.168.1.10:9025 > 172.217.160.110:https S
10	2020-03-17 22:10:39	192.168.1.10	172.217.160.110	Https	66	Ether / IP / TCP 192.168.1.10:9026 > 172.217.160.110:https S
11	2020-03-17 22:10:40	fe80::1	240e:d4:2e8e:df00:4882:f650:cbf9:db1d	ICMPv6	86	Ether / IPv6 / ICMPv6ND_NS / ICMPv6 Neighbor Discovery Option - Source Link-Layer Address 9c:d2:4b:38:91:c1
12	2020-03-17 22:10:40	240e:d4:2e8e:df00:4882:f650:cbf9:db1d	fe80::1	ICMPv6	86	Ether / IPv6 / ICMPv6ND_NA / ICMPv6 Neighbor Discovery Option - Destination Link-Layer Address 00:e0:4c:68:00:2d
13	2020-03-17 22:10:40	192.168.1.10	119.147.134.70	Https	54	Ether / IP / TCP 192.168.1.10:9020 > 119.147.134.70:https FA
14	2020-03-17 22:10:40	192.168.1.10	180.97.93.48	Https	54	Ether / IP / TCP 192.168.1.10:9021 > 180.97.93.48:https FA
15	2020-03-17 22:10:40	192.168.1.10	119.147.134.70	Https	54	Ether / IP / TCP 192.168.1.10:9019 > 119.147.134.70:https FA
16	2020-03-17 22:10:40	119.147.134.70	192.168.1.10	Https	60	Ether / IP / TCP 119.147.134.70:https > 192.168.1.10:9019 FA / Padding
17	2020-03-17 22:10:40	192.168.1.10	119.147.134.70	Https	54	Ether / IP / TCP 192.168.1.10:9019 > 119.147.134.70:https A
18	2020-03-17 22:10:40	119.147.134.70	192.168.1.10	Https	60	Ether / IP / TCP 119.147.134.70:https > 192.168.1.10:9020 FA / Padding
19	2020-03-17 22:10:40	192.168.1.10	119.147.134.70	Https	54	Ether / IP / TCP 192.168.1.10:9020 > 119.147.134.70:https A
20	2020-03-17 22:10:40	180.97.93.48	192.168.1.10	Https	60	Ether / IP / TCP 180.97.93.48:https > 192.168.1.10:9021 A / Padding
21	2020-03-17 22:10:40	180.97.93.48	192.168.1.10	Https	85	Ether / IP / TCP 180.97.93.48:https > 192.168.1.10:9021 PA / Raw
22	2020-03-17 22:10:40	180.97.93.48	192.168.1.10	Https	60	Ether / IP / TCP 180.97.93.48:https > 192.168.1.10:9021 FA / Padding
23	2020-03-17 22:10:40	192.168.1.10	180.97.93.48	Https	54	Ether / IP / TCP 192.168.1.10:9021 > 180.97.93.48:https RA
24	2020-03-17 22:10:40	180.97.93.48	192.168.1.10	Https	60	Ether / IP / TCP 180.97.93.48:https > 192.168.1.10:9021 FA / Padding
25	2020-03-17 22:10:40	192.168.1.10	14.215.177.39	Https	54	Ether / IP / TCP 192.168.1.10:9022 > 14.215.177.39:https FA
26	2020-03-17 22:10:40	240e:d4:2e8e:df00:4882:f650:cbf9:db1d	2404:6800:4008:803::200e	Https	86	Ether / IPv6 / TCP 240e:d4:2e8e:df00:4882:f650:cbf9:db1d:9023 > 2404:6800:4008:803::200e:https S
27	2020-03-17 22:10:40	240e:d4:2e8e:df00:4882:f650:cbf9:db1d	2404:6800:4008:803::200e	Https	86	Ether / IPv6 / TCP 240e:d4:2e8e:df00:4882:f650:cbf9:db1d:9024 > 2404:6800:4008:803::200e:https S
28	2020-03-17 22:10:41	192.168.1.10	172.217.160.110	Https	66	Ether / IP / TCP 192.168.1.10:9025 > 172.217.160.110:https S
29	2020-03-17 22:10:41	220.181.76.102	192.168.1.10	Http	60	Ether / IP / TCP 220.181.76.102:http > 192.168.1.10:9009 FA / Padding
30	2020-03-17 22:10:41	192.168.1.10	220.181.76.102	Http	54	Ether / IP / TCP 192.168.1.10:9009 > 220.181.76.102:http A
31	2020-03-17 22:10:41	220.181.76.82	192.168.1.10	Http	60	Ether / IP / TCP 220.181.76.82:http > 192.168.1.10:9010 FA / Padding
32	2020-03-17 22:10:41	192.168.1.10	220.181.76.82	Http	54	Ether / IP / TCP 192.168.1.10:9010 > 220.181.76.82:http A
33	2020-03-17 22:10:41	192.168.1.10	172.217.160.110	Https	66	Ether / IP / TCP 192.168.1.10:9026 > 172.217.160.110:https S
34	2020-03-17 22:10:41	00:e0:4c:68:00:2d	9c:d2:4b:38:91:c1	ARP	42	Ether / ARP who has 192.168.1.1 says 192.168.1.10
35	2020-03-17 22:10:41	9c:d2:4b:38:91:c1	00:e0:4c:68:00:2d	ARP	60	Ether / ARP is at 9c:d2:4b:38:91:c1 says 192.168.1.1 / Padding
36	2020-03-17 22:10:41	fe80::f141:b4f2:11de:b126	fe80::1	DNS	96	Ether / IPv6 / UDP / DNS Qry "b'qdun-data.qq.com.'" 
37	2020-03-17 22:10:41	fe80::1	fe80::f141:b4f2:11de:b126	DNS	316	Ether / IPv6 / UDP / DNS Ans "113.96.231.13" 
38	2020-03-17 22:10:41	192.168.1.10	113.96.231.13	Https	66	Ether / IP / TCP 192.168.1.10:9027 > 113.96.231.13:https S
39	2020-03-17 22:10:41	113.96.231.13	192.168.1.10	Https	60	Ether / IP / TCP 113.96.231.13:https > 192.168.1.10:9027 SA / Padding
40	2020-03-17 22:10:41	192.168.1.10	113.96.231.13	Https	54	Ether / IP / TCP 192.168.1.10:9027 > 113.96.231.13:https A
41	2020-03-17 22:10:41	fe80::f141:b4f2:11de:b126	fe80::1	DNS	96	Ether / IPv6 / UDP / DNS Qry "b'qd-update.qq.com.'" 
42	2020-03-17 22:10:41	fe80::1	fe80::f141:b4f2:11de:b126	DNS	268	Ether / IPv6 / UDP / DNS Ans "113.96.12.221" 
43	2020-03-17 22:10:42	192.168.1.10	113.96.12.221	TCP	66	Ether / IP / TCP 192.168.1.10:9028 > 113.96.12.221:8080 S
44	2020-03-17 22:10:42	113.96.12.221	192.168.1.10	TCP	66	Ether / IP / TCP 113.96.12.221:8080 > 192.168.1.10:9028 SA
45	2020-03-17 22:10:42	192.168.1.10	113.96.12.221	TCP	54	Ether / IP / TCP 192.168.1.10:9028 > 113.96.12.221:8080 A
46	2020-03-17 22:10:42	192.168.1.10	113.96.231.13	Https	315	Ether / IP / TCP 192.168.1.10:9027 > 113.96.231.13:https PA / Raw
47	2020-03-17 22:10:42	192.168.1.10	113.96.12.221	TCP	309	Ether / IP / TCP / HTTP / 'GET' '/' 'HTTP/1.1'
48	2020-03-17 22:10:42	192.168.1.10	54.223.180.103	Http	54	Ether / IP / TCP 192.168.1.10:8957 > 54.223.180.103:http FA
49	2020-03-17 22:10:42	192.168.1.10	54.223.180.103	Http	66	Ether / IP / TCP 192.168.1.10:9029 > 54.223.180.103:http S
50	2020-03-17 22:10:42	113.96.231.13	192.168.1.10	Https	60	Ether / IP / TCP 113.96.231.13:https > 192.168.1.10:9027 A / Padding
51	2020-03-17 22:10:42	113.96.231.13	192.168.1.10	Https	122	Ether / IP / TCP 113.96.231.13:https > 192.168.1.10:9027 PA / Raw
52	2020-03-17 22:10:42	192.168.1.10	113.96.231.13	Https	54	Ether / IP / TCP 192.168.1.10:9027 > 113.96.231.13:https FA
53	2020-03-17 22:10:42	113.96.12.221	192.168.1.10	TCP	60	Ether / IP / TCP 113.96.12.221:8080 > 192.168.1.10:9028 A / Padding
54	2020-03-17 22:10:42	192.168.1.10	113.96.12.221	TCP	298	Ether / IP / TCP 192.168.1.10:9028 > 113.96.12.221:8080 PA / HTTP / Raw
55	2020-03-17 22:10:42	192.168.1.10	172.217.160.78	Https	66	Ether / IP / TCP 192.168.1.10:9015 > 172.217.160.78:https S
56	2020-03-17 22:10:42	113.96.231.13	192.168.1.10	Https	60	Ether / IP / TCP 113.96.231.13:https > 192.168.1.10:9027 FA / Padding
57	2020-03-17 22:10:42	192.168.1.10	113.96.231.13	Https	54	Ether / IP / TCP 192.168.1.10:9027 > 113.96.231.13:https A
58	2020-03-17 22:10:42	113.96.12.221	192.168.1.10	TCP	60	Ether / IP / TCP 113.96.12.221:8080 > 192.168.1.10:9028 A / Padding
59	2020-03-17 22:10:42	54.223.180.103	192.168.1.10	Http	60	Ether / IP / TCP 54.223.180.103:http > 192.168.1.10:8957 A / Padding
60	2020-03-17 22:10:42	113.96.12.221	192.168.1.10	TCP	303	Ether / IP / TCP / HTTP / 'HTTP/1.1' '200' 'OK' / Raw
61	2020-03-17 22:10:42	192.168.1.10	113.96.12.221	TCP	54	Ether / IP / TCP 192.168.1.10:9028 > 113.96.12.221:8080 FA
62	2020-03-17 22:10:42	54.223.180.103	192.168.1.10	Http	60	Ether / IP / TCP 54.223.180.103:http > 192.168.1.10:9029 SA / Padding
63	2020-03-17 22:10:42	192.168.1.10	54.223.180.103	Http	54	Ether / IP / TCP 192.168.1.10:9029 > 54.223.180.103:http A
64	2020-03-17 22:10:42	192.168.1.10	54.223.180.103	Http	859	Ether / IP / TCP / HTTP / 'GET' '/settings?uuid=K3ljEeMu7B8u&tags=commontags&hash=0fd26239cc0a9a25e9bcaabe192bb76b&source=service&version=1.0.12.720&serviceversion=1.1.2.627&readerversion=9.6.1.25160&miniversion=1.0.13.527' 'HTTP/1.1' / Raw
65	2020-03-17 22:10:42	113.96.12.221	192.168.1.10	TCP	60	Ether / IP / TCP 113.96.12.221:8080 > 192.168.1.10:9028 FA / Padding
66	2020-03-17 22:10:42	192.168.1.10	113.96.12.221	TCP	54	Ether / IP / TCP 192.168.1.10:9028 > 113.96.12.221:8080 A
67	2020-03-17 22:10:42	54.223.180.103	192.168.1.10	Http	60	Ether / IP / TCP 54.223.180.103:http > 192.168.1.10:9029 A / Padding
68	2020-03-17 22:10:42	192.168.1.10	113.96.12.221	TCP	66	Ether / IP / TCP 192.168.1.10:9030 > 113.96.12.221:8080 S
69	2020-03-17 22:10:42	54.223.180.103	192.168.1.10	Http	132	Ether / IP / TCP / HTTP / 'HTTP/1.1' '200' 'OK'
70	2020-03-17 22:10:42	192.168.1.10	54.223.180.103	Http	54	Ether / IP / TCP 192.168.1.10:9029 > 54.223.180.103:http A
71	2020-03-17 22:10:42	113.96.12.221	192.168.1.10	TCP	66	Ether / IP / TCP 113.96.12.221:8080 > 192.168.1.10:9030 SA
72	2020-03-17 22:10:42	192.168.1.10	113.96.12.221	TCP	54	Ether / IP / TCP 192.168.1.10:9030 > 113.96.12.221:8080 A
73	2020-03-17 22:10:42	192.168.1.10	113.96.12.221	TCP	309	Ether / IP / TCP / HTTP / 'GET' '/' 'HTTP/1.1'
74	2020-03-17 22:10:42	113.96.12.221	192.168.1.10	TCP	60	Ether / IP / TCP 113.96.12.221:8080 > 192.168.1.10:9030 A / Padding
75	2020-03-17 22:10:42	192.168.1.10	113.96.12.221	TCP	374	Ether / IP / TCP 192.168.1.10:9030 > 113.96.12.221:8080 PA / HTTP / Raw
76	2020-03-17 22:10:42	113.96.12.221	192.168.1.10	TCP	60	Ether / IP / TCP 113.96.12.221:8080 > 192.168.1.10:9030 A / Padding
77	2020-03-17 22:10:42	113.96.12.221	192.168.1.10	TCP	303	Ether / IP / TCP / HTTP / 'HTTP/1.1' '200' 'OK' / Raw
78	2020-03-17 22:10:42	192.168.1.10	113.96.12.221	TCP	54	Ether / IP / TCP 192.168.1.10:9030 > 113.96.12.221:8080 FA
79	2020-03-17 22:10:42	113.96.12.221	192.168.1.10	TCP	60	Ether / IP / TCP 113.96.12.221:8080 > 192.168.1.10:9030 FA / Padding
80	2020-03-17 22:10:42	192.168.1.10	113.96.12.221	TCP	54	Ether / IP / TCP 192.168.1.10:9030 > 113.96.12.221:8080 A
81	2020-03-17 22:10:42	192.168.1.10	10.10.20.110	UDP	120	Ether / IP / UDP 192.168.1.10:59684 > 10.10.20.110:snmp / SNMP
82	2020-03-17 22:10:42	192.168.1.10	10.10.20.110	UDP	84	Ether / IP / UDP 192.168.1.10:59684 > 10.10.20.110:snmp / SNMP
83	2020-03-17 22:10:43	fe80::f141:b4f2:11de:b126	fe80::1	ICMPv6	86	Ether / IPv6 / ICMPv6ND_NS / ICMPv6 Neighbor Discovery Option - Source Link-Layer Address 00:e0:4c:68:00:2d
84	2020-03-17 22:10:43	fe80::1	fe80::f141:b4f2:11de:b126	ICMPv6	78	Ether / IPv6 / ICMPv6 Neighbor Discovery - Neighbor Advertisement (tgt: fe80::1)
85	2020-03-17 22:10:43	192.168.1.10	10.10.20.110	UDP	84	Ether / IP / UDP 192.168.1.10:59684 > 10.10.20.110:snmp / SNMP
86	2020-03-17 22:10:44	192.168.1.10	180.97.93.48	Https	66	Ether / IP / TCP 192.168.1.10:9031 > 180.97.93.48:https S
87	2020-03-17 22:10:44	180.97.93.48	192.168.1.10	Https	66	Ether / IP / TCP 180.97.93.48:https > 192.168.1.10:9031 SA
88	2020-03-17 22:10:44	192.168.1.10	180.97.93.48	Https	54	Ether / IP / TCP 192.168.1.10:9031 > 180.97.93.48:https A
89	2020-03-17 22:10:44	192.168.1.10	180.97.93.48	Https	571	Ether / IP / TCP 192.168.1.10:9031 > 180.97.93.48:https PA / Raw
90	2020-03-17 22:10:44	180.97.93.48	192.168.1.10	Https	60	Ether / IP / TCP 180.97.93.48:https > 192.168.1.10:9031 A / Padding
91	2020-03-17 22:10:44	180.97.93.48	192.168.1.10	Https	150	Ether / IP / TCP 180.97.93.48:https > 192.168.1.10:9031 PA / Raw
92	2020-03-17 22:10:44	180.97.93.48	192.168.1.10	Https	60	Ether / IP / TCP 180.97.93.48:https > 192.168.1.10:9031 PA / Raw
93	2020-03-17 22:10:44	180.97.93.48	192.168.1.10	Https	99	Ether / IP / TCP 180.97.93.48:https > 192.168.1.10:9031 PA / Raw
94	2020-03-17 22:10:44	192.168.1.10	180.97.93.48	Https	54	Ether / IP / TCP 192.168.1.10:9031 > 180.97.93.48:https A
95	2020-03-17 22:10:44	192.168.1.10	180.97.93.48	Https	105	Ether / IP / TCP 192.168.1.10:9031 > 180.97.93.48:https PA / Raw
96	2020-03-17 22:10:44	192.168.1.10	180.97.93.48	Https	1409	Ether / IP / TCP 192.168.1.10:9031 > 180.97.93.48:https PA / Raw
97	2020-03-17 22:10:44	180.97.93.48	192.168.1.10	Https	99	Ether / IP / TCP 180.97.93.48:https > 192.168.1.10:9031 PA / Raw
98	2020-03-17 22:10:44	192.168.1.10	180.97.93.48	Https	66	Ether / IP / TCP 192.168.1.10:9031 > 180.97.93.48:https A
99	2020-03-17 22:10:44	180.97.93.48	192.168.1.10	Https	60	Ether / IP / TCP 180.97.93.48:https > 192.168.1.10:9031 A / Padding
100	2020-03-17 22:10:44	180.97.93.48	192.168.1.10	Https	60	Ether / IP / TCP 180.97.93.48:https > 192.168.1.10:9031 A / Padding
101	2020-03-17 22:10:44	180.97.93.48	192.168.1.10	Https	372	Ether / IP / TCP 180.97.93.48:https > 192.168.1.10:9031 PA / Raw
102	2020-03-17 22:10:44	192.168.1.10	180.97.93.48	Https	54	Ether / IP / TCP 192.168.1.10:9031 > 180.97.93.48:https A
103	2020-03-17 22:10:44	240e:d4:2e8e:df00:4882:f650:cbf9:db1d	2404:6800:4008:803::200e	Https	86	Ether / IPv6 / TCP 240e:d4:2e8e:df00:4882:f650:cbf9:db1d:9023 > 2404:6800:4008:803::200e:https S
104	2020-03-17 22:10:44	192.168.1.10	52.139.250.253	Https	157	Ether / IP / TCP 192.168.1.10:1307 > 52.139.250.253:https PA / Raw
105	2020-03-17 22:10:44	52.139.250.253	192.168.1.10	Https	227	Ether / IP / TCP 52.139.250.253:https > 192.168.1.10:1307 PA / Raw
106	2020-03-17 22:10:44	192.168.1.10	52.139.250.253	Https	54	Ether / IP / TCP 192.168.1.10:1307 > 52.139.250.253:https A
107	2020-03-17 22:10:44	240e:d4:2e8e:df00:4882:f650:cbf9:db1d	2404:6800:4008:803::200e	Https	86	Ether / IPv6 / TCP 240e:d4:2e8e:df00:4882:f650:cbf9:db1d:9024 > 2404:6800:4008:803::200e:https S
108	2020-03-17 22:10:45	192.168.1.10	172.217.160.110	Https	66	Ether / IP / TCP 192.168.1.10:9025 > 172.217.160.110:https S
109	2020-03-17 22:10:45	192.168.1.10	14.215.177.39	Https	54	Ether / IP / TCP 192.168.1.10:9014 > 14.215.177.39:https RA
110	2020-03-17 22:10:45	192.168.1.10	172.217.160.110	Https	66	Ether / IP / TCP 192.168.1.10:9026 > 172.217.160.110:https S
111	2020-03-17 22:10:45	192.168.1.10	14.215.177.39	Https	54	Ether / IP / TCP 192.168.1.10:9022 > 14.215.177.39:https FA
112	2020-03-17 22:10:46	192.168.1.10	14.215.177.39	Https	66	Ether / IP / TCP 192.168.1.10:9032 > 14.215.177.39:https S
113	2020-03-17 22:10:46	14.215.177.39	192.168.1.10	Https	66	Ether / IP / TCP 14.215.177.39:https > 192.168.1.10:9032 SA
114	2020-03-17 22:10:46	192.168.1.10	14.215.177.39	Https	54	Ether / IP / TCP 192.168.1.10:9032 > 14.215.177.39:https A
115	2020-03-17 22:10:46	192.168.1.10	14.215.177.39	Https	54	Ether / IP / TCP 192.168.1.10:9032 > 14.215.177.39:https FA
116	2020-03-17 22:10:46	192.168.1.10	14.215.177.39	Https	54	Ether / IP / TCP 192.168.1.10:9032 > 14.215.177.39:https FA
117	2020-03-17 22:10:46	192.168.1.10	139.99.69.89	Http	55	Ether / IP / TCP 192.168.1.10:12360 > 139.99.69.89:http A / HTTP / Raw
118	2020-03-17 22:10:46	fe80::1	fe80::f141:b4f2:11de:b126	ICMPv6	86	Ether / IPv6 / ICMPv6ND_NS / ICMPv6 Neighbor Discovery Option - Source Link-Layer Address 9c:d2:4b:38:91:c1
119	2020-03-17 22:10:46	fe80::f141:b4f2:11de:b126	fe80::1	ICMPv6	86	Ether / IPv6 / ICMPv6ND_NA / ICMPv6 Neighbor Discovery Option - Destination Link-Layer Address 00:e0:4c:68:00:2d
120	2020-03-17 22:10:47	192.168.1.10	14.215.177.39	Https	54	Ether / IP / TCP 192.168.1.10:9032 > 14.215.177.39:https FA
121	2020-03-17 22:10:47	139.99.69.89	192.168.1.10	Http	66	Ether / IP / TCP 139.99.69.89:http > 192.168.1.10:12360 A
122	2020-03-17 22:10:47	192.168.1.10	180.97.93.48	Https	66	Ether / IP / TCP 192.168.1.10:9033 > 180.97.93.48:https S
123	2020-03-17 22:10:47	192.168.1.10	180.97.93.48	Https	1506	Ether / IP / TCP 192.168.1.10:9031 > 180.97.93.48:https A / Raw
124	2020-03-17 22:10:47	192.168.1.10	180.97.93.48	Https	126	Ether / IP / TCP 192.168.1.10:9031 > 180.97.93.48:https PA / Raw
125	2020-03-17 22:10:47	fe80::f141:b4f2:11de:b126	fe80::1	DNS	97	Ether / IPv6 / UDP / DNS Qry "b'reports.baidu.com.'" 
126	2020-03-17 22:10:47	fe80::f141:b4f2:11de:b126	fe80::1	DNS	96	Ether / IPv6 / UDP / DNS Qry "b'eclick.baidu.com.'" 
127	2020-03-17 22:10:47	fe80::f141:b4f2:11de:b126	fe80::1	DNS	96	Ether / IPv6 / UDP / DNS Qry "b'eclick.baidu.com.'" 
128	2020-03-17 22:10:47	fe80::f141:b4f2:11de:b126	fe80::1	DNS	97	Ether / IPv6 / UDP / DNS Qry "b'reports.baidu.com.'" 
129	2020-03-17 22:10:47	fe80::1	fe80::f141:b4f2:11de:b126	DNS	112	Ether / IPv6 / UDP / DNS Ans "220.181.107.131" 
130	2020-03-17 22:10:47	fe80::f141:b4f2:11de:b126	fe80::1	DNS	92	Ether / IPv6 / UDP / DNS Qry "b'hm.baidu.com.'" 
131	2020-03-17 22:10:47	fe80::f141:b4f2:11de:b126	fe80::1	DNS	92	Ether / IPv6 / UDP / DNS Qry "b'hm.baidu.com.'" 
132	2020-03-17 22:10:47	fe80::1	fe80::f141:b4f2:11de:b126	DNS	108	Ether / IPv6 / UDP / DNS Ans "106.120.159.126" 
133	2020-03-17 22:10:47	fe80::1	fe80::f141:b4f2:11de:b126	DNS	314	Ether / IPv6 / UDP / DNS Ans "b'reports.a.shifen.com.'" 
134	2020-03-17 22:10:47	fe80::1	fe80::f141:b4f2:11de:b126	DNS	183	Ether / IPv6 / UDP / DNS Ans "b'eclick.e.shifen.com.'" 
135	2020-03-17 22:10:47	fe80::1	fe80::f141:b4f2:11de:b126	DNS	185	Ether / IPv6 / UDP / DNS Ans "b'reports.a.shifen.com.'" 
136	2020-03-17 22:10:47	192.168.1.10	220.181.107.131	Https	66	Ether / IP / TCP 192.168.1.10:9034 > 220.181.107.131:https S
137	2020-03-17 22:10:47	192.168.1.10	14.215.177.63	Https	66	Ether / IP / TCP 192.168.1.10:9035 > 14.215.177.63:https S
138	2020-03-17 22:10:47	fe80::1	fe80::f141:b4f2:11de:b126	DNS	175	Ether / IPv6 / UDP / DNS Ans "b'hm.e.shifen.com.'" 
139	2020-03-17 22:10:47	192.168.1.10	106.120.159.126	Https	66	Ether / IP / TCP 192.168.1.10:9036 > 106.120.159.126:https S
140	2020-03-17 22:10:47	192.168.1.10	106.120.159.126	Https	66	Ether / IP / TCP 192.168.1.10:9037 > 106.120.159.126:https S
141	2020-03-17 22:10:47	180.97.93.48	192.168.1.10	Https	66	Ether / IP / TCP 180.97.93.48:https > 192.168.1.10:9033 SA
142	2020-03-17 22:10:47	192.168.1.10	180.97.93.48	Https	54	Ether / IP / TCP 192.168.1.10:9033 > 180.97.93.48:https A
143	2020-03-17 22:10:47	192.168.1.10	180.97.93.48	Https	571	Ether / IP / TCP 192.168.1.10:9033 > 180.97.93.48:https PA / Raw
144	2020-03-17 22:10:47	180.97.93.48	192.168.1.10	Https	60	Ether / IP / TCP 180.97.93.48:https > 192.168.1.10:9031 A / Padding
145	2020-03-17 22:10:47	14.215.177.63	192.168.1.10	Https	66	Ether / IP / TCP 14.215.177.63:https > 192.168.1.10:9035 SA
146	2020-03-17 22:10:47	192.168.1.10	14.215.177.63	Https	54	Ether / IP / TCP 192.168.1.10:9035 > 14.215.177.63:https A
147	2020-03-17 22:10:47	192.168.1.10	14.215.177.63	Https	571	Ether / IP / TCP 192.168.1.10:9035 > 14.215.177.63:https PA / Raw
148	2020-03-17 22:10:47	180.97.93.48	192.168.1.10	Https	60	Ether / IP / TCP 180.97.93.48:https > 192.168.1.10:9033 A / Padding
149	2020-03-17 22:10:47	180.97.93.48	192.168.1.10	Https	150	Ether / IP / TCP 180.97.93.48:https > 192.168.1.10:9033 PA / Raw
150	2020-03-17 22:10:47	180.97.93.48	192.168.1.10	Https	60	Ether / IP / TCP 180.97.93.48:https > 192.168.1.10:9033 PA / Raw
151	2020-03-17 22:10:47	180.97.93.48	192.168.1.10	Https	99	Ether / IP / TCP 180.97.93.48:https > 192.168.1.10:9033 PA / Raw
152	2020-03-17 22:10:47	192.168.1.10	180.97.93.48	Https	54	Ether / IP / TCP 192.168.1.10:9033 > 180.97.93.48:https A
153	2020-03-17 22:10:47	192.168.1.10	180.97.93.48	Https	105	Ether / IP / TCP 192.168.1.10:9033 > 180.97.93.48:https PA / Raw
154	2020-03-17 22:10:47	192.168.1.10	180.97.93.48	Https	1399	Ether / IP / TCP 192.168.1.10:9033 > 180.97.93.48:https PA / Raw
155	2020-03-17 22:10:47	14.215.177.63	192.168.1.10	Https	60	Ether / IP / TCP 14.215.177.63:https > 192.168.1.10:9035 A / Padding
156	2020-03-17 22:10:47	14.215.177.63	192.168.1.10	Https	122	Ether / IP / TCP 14.215.177.63:https > 192.168.1.10:9035 PA / Raw
157	2020-03-17 22:10:47	14.215.177.63	192.168.1.10	Https	1506	Ether / IP / TCP 14.215.177.63:https > 192.168.1.10:9035 A / Raw
158	2020-03-17 22:10:47	14.215.177.63	192.168.1.10	Https	1506	Ether / IP / TCP 14.215.177.63:https > 192.168.1.10:9035 A / Raw
159	2020-03-17 22:10:47	14.215.177.63	192.168.1.10	Https	769	Ether / IP / TCP 14.215.177.63:https > 192.168.1.10:9035 PA / Raw
160	2020-03-17 22:10:47	192.168.1.10	14.215.177.63	Https	54	Ether / IP / TCP 192.168.1.10:9035 > 14.215.177.63:https A
161	2020-03-17 22:10:47	220.181.107.131	192.168.1.10	Https	66	Ether / IP / TCP 220.181.107.131:https > 192.168.1.10:9034 SA
162	2020-03-17 22:10:47	192.168.1.10	220.181.107.131	Https	54	Ether / IP / TCP 192.168.1.10:9034 > 220.181.107.131:https A
163	2020-03-17 22:10:47	14.215.177.63	192.168.1.10	Https	392	Ether / IP / TCP 14.215.177.63:https > 192.168.1.10:9035 PA / Raw
164	2020-03-17 22:10:47	14.215.177.63	192.168.1.10	Https	63	Ether / IP / TCP 14.215.177.63:https > 192.168.1.10:9035 PA / Raw
165	2020-03-17 22:10:47	192.168.1.10	220.181.107.131	Https	571	Ether / IP / TCP 192.168.1.10:9034 > 220.181.107.131:https PA / Raw
166	2020-03-17 22:10:47	192.168.1.10	14.215.177.63	Https	54	Ether / IP / TCP 192.168.1.10:9035 > 14.215.177.63:https A
167	2020-03-17 22:10:47	180.97.93.48	192.168.1.10	Https	356	Ether / IP / TCP 180.97.93.48:https > 192.168.1.10:9031 PA / Raw
168	2020-03-17 22:10:47	106.120.159.126	192.168.1.10	Https	66	Ether / IP / TCP 106.120.159.126:https > 192.168.1.10:9036 SA
169	2020-03-17 22:10:47	192.168.1.10	106.120.159.126	Https	54	Ether / IP / TCP 192.168.1.10:9036 > 106.120.159.126:https A
170	2020-03-17 22:10:47	192.168.1.10	106.120.159.126	Https	571	Ether / IP / TCP 192.168.1.10:9036 > 106.120.159.126:https PA / Raw
171	2020-03-17 22:10:47	106.120.159.126	192.168.1.10	Https	66	Ether / IP / TCP 106.120.159.126:https > 192.168.1.10:9037 SA
172	2020-03-17 22:10:47	192.168.1.10	106.120.159.126	Https	54	Ether / IP / TCP 192.168.1.10:9037 > 106.120.159.126:https A
173	2020-03-17 22:10:47	192.168.1.10	106.120.159.126	Https	571	Ether / IP / TCP 192.168.1.10:9037 > 106.120.159.126:https PA / Raw
174	2020-03-17 22:10:47	14.215.177.63	192.168.1.10	Https	63	Ether / IP / TCP 14.215.177.63:https > 192.168.1.10:9035 PA / Raw
175	2020-03-17 22:10:47	192.168.1.10	14.215.177.63	Https	66	Ether / IP / TCP 192.168.1.10:9035 > 14.215.177.63:https A
176	2020-03-17 22:10:47	180.97.93.48	192.168.1.10	Https	60	Ether / IP / TCP 180.97.93.48:https > 192.168.1.10:9033 A / Padding
177	2020-03-17 22:10:47	180.97.93.48	192.168.1.10	Https	60	Ether / IP / TCP 180.97.93.48:https > 192.168.1.10:9033 A / Padding
178	2020-03-17 22:10:47	180.97.93.48	192.168.1.10	Https	372	Ether / IP / TCP 180.97.93.48:https > 192.168.1.10:9033 PA / Raw
179	2020-03-17 22:10:47	192.168.1.10	14.215.177.63	Https	180	Ether / IP / TCP 192.168.1.10:9035 > 14.215.177.63:https PA / Raw
180	2020-03-17 22:10:47	192.168.1.10	14.215.177.63	Https	621	Ether / IP / TCP 192.168.1.10:9035 > 14.215.177.63:https PA / Raw
181	2020-03-17 22:10:47	192.168.1.10	14.215.177.63	Https	1037	Ether / IP / TCP 192.168.1.10:9035 > 14.215.177.63:https PA / Raw
182	2020-03-17 22:10:47	220.181.107.131	192.168.1.10	Https	60	Ether / IP / TCP 220.181.107.131:https > 192.168.1.10:9034 A / Padding
183	2020-03-17 22:10:47	192.168.1.10	180.97.93.48	Https	54	Ether / IP / TCP 192.168.1.10:9031 > 180.97.93.48:https A
184	2020-03-17 22:10:47	106.120.159.126	192.168.1.10	Https	60	Ether / IP / TCP 106.120.159.126:https > 192.168.1.10:9036 A / Padding
185	2020-03-17 22:10:47	106.120.159.126	192.168.1.10	Https	122	Ether / IP / TCP 106.120.159.126:https > 192.168.1.10:9036 PA / Raw
186	2020-03-17 22:10:47	106.120.159.126	192.168.1.10	Https	1506	Ether / IP / TCP 106.120.159.126:https > 192.168.1.10:9036 A / Raw
187	2020-03-17 22:10:47	106.120.159.126	192.168.1.10	Https	1506	Ether / IP / TCP 106.120.159.126:https > 192.168.1.10:9036 A / Raw
188	2020-03-17 22:10:47	106.120.159.126	192.168.1.10	Https	769	Ether / IP / TCP 106.120.159.126:https > 192.168.1.10:9036 PA / Raw
189	2020-03-17 22:10:47	192.168.1.10	106.120.159.126	Https	54	Ether / IP / TCP 192.168.1.10:9036 > 106.120.159.126:https A
190	2020-03-17 22:10:47	106.120.159.126	192.168.1.10	Https	392	Ether / IP / TCP 106.120.159.126:https > 192.168.1.10:9036 PA / Raw
191	2020-03-17 22:10:47	106.120.159.126	192.168.1.10	Https	63	Ether / IP / TCP 106.120.159.126:https > 192.168.1.10:9036 PA / Raw
192	2020-03-17 22:10:47	192.168.1.10	106.120.159.126	Https	54	Ether / IP / TCP 192.168.1.10:9036 > 106.120.159.126:https A
193	2020-03-17 22:10:47	192.168.1.10	106.120.159.126	Https	180	Ether / IP / TCP 192.168.1.10:9036 > 106.120.159.126:https PA / Raw
194	2020-03-17 22:10:47	192.168.1.10	106.120.159.126	Https	1462	Ether / IP / TCP 192.168.1.10:9036 > 106.120.159.126:https PA / Raw
195	2020-03-17 22:10:47	106.120.159.126	192.168.1.10	Https	60	Ether / IP / TCP 106.120.159.126:https > 192.168.1.10:9037 A / Padding
196	2020-03-17 22:10:47	14.215.177.63	192.168.1.10	Https	60	Ether / IP / TCP 14.215.177.63:https > 192.168.1.10:9035 A / Padding
197	2020-03-17 22:10:47	14.215.177.63	192.168.1.10	Https	60	Ether / IP / TCP 14.215.177.63:https > 192.168.1.10:9035 A / Padding
198	2020-03-17 22:10:47	14.215.177.63	192.168.1.10	Https	60	Ether / IP / TCP 14.215.177.63:https > 192.168.1.10:9035 A / Padding
199	2020-03-17 22:10:47	14.215.177.63	192.168.1.10	Https	173	Ether / IP / TCP 14.215.177.63:https > 192.168.1.10:9035 PA / Raw
200	2020-03-17 22:10:47	14.215.177.63	192.168.1.10	Https	60	Ether / IP / TCP 14.215.177.63:https > 192.168.1.10:9035 PA / Raw
201	2020-03-17 22:10:47	14.215.177.63	192.168.1.10	Https	99	Ether / IP / TCP 14.215.177.63:https > 192.168.1.10:9035 PA / Raw
202	2020-03-17 22:10:47	192.168.1.10	14.215.177.63	Https	54	Ether / IP / TCP 192.168.1.10:9035 > 14.215.177.63:https A
203	2020-03-17 22:10:47	106.120.159.126	192.168.1.10	Https	63	Ether / IP / TCP 106.120.159.126:https > 192.168.1.10:9036 PA / Raw
204	2020-03-17 22:10:47	192.168.1.10	106.120.159.126	Https	66	Ether / IP / TCP 192.168.1.10:9036 > 106.120.159.126:https A
205	2020-03-17 22:10:47	14.215.177.63	192.168.1.10	Https	99	Ether / IP / TCP 14.215.177.63:https > 192.168.1.10:9035 PA / Raw
206	2020-03-17 22:10:47	192.168.1.10	14.215.177.63	Https	66	Ether / IP / TCP 192.168.1.10:9035 > 14.215.177.63:https A
207	2020-03-17 22:10:47	192.168.1.10	180.97.93.48	Https	54	Ether / IP / TCP 192.168.1.10:9033 > 180.97.93.48:https A
208	2020-03-17 22:10:47	106.120.159.126	192.168.1.10	Https	60	Ether / IP / TCP 106.120.159.126:https > 192.168.1.10:9036 A / Padding
209	2020-03-17 22:10:47	106.120.159.126	192.168.1.10	Https	173	Ether / IP / TCP 106.120.159.126:https > 192.168.1.10:9036 PA / Raw
210	2020-03-17 22:10:47	106.120.159.126	192.168.1.10	Https	105	Ether / IP / TCP 106.120.159.126:https > 192.168.1.10:9036 PA / Raw
211	2020-03-17 22:10:47	192.168.1.10	106.120.159.126	Https	54	Ether / IP / TCP 192.168.1.10:9036 > 106.120.159.126:https A
212	2020-03-17 22:10:47	106.120.159.126	192.168.1.10	Https	60	Ether / IP / TCP 106.120.159.126:https > 192.168.1.10:9036 A / Padding
213	2020-03-17 22:10:47	106.120.159.126	192.168.1.10	Https	382	Ether / IP / TCP 106.120.159.126:https > 192.168.1.10:9036 PA / Raw
214	2020-03-17 22:10:47	192.168.1.10	106.120.159.126	Https	1447	Ether / IP / TCP 192.168.1.10:9036 > 106.120.159.126:https PA / Raw
215	2020-03-17 22:10:47	14.215.177.63	192.168.1.10	Https	310	Ether / IP / TCP 14.215.177.63:https > 192.168.1.10:9035 PA / Raw
216	2020-03-17 22:10:47	14.215.177.63	192.168.1.10	Https	84	Ether / IP / TCP 14.215.177.63:https > 192.168.1.10:9035 PA / Raw
217	2020-03-17 22:10:47	192.168.1.10	14.215.177.63	Https	54	Ether / IP / TCP 192.168.1.10:9035 > 14.215.177.63:https A
218	2020-03-17 22:10:47	106.120.159.126	192.168.1.10	Https	60	Ether / IP / TCP 106.120.159.126:https > 192.168.1.10:9036 A / Padding
219	2020-03-17 22:10:47	14.215.177.63	192.168.1.10	Https	84	Ether / IP / TCP 14.215.177.63:https > 192.168.1.10:9035 PA / Raw
220	2020-03-17 22:10:47	192.168.1.10	14.215.177.63	Https	66	Ether / IP / TCP 192.168.1.10:9035 > 14.215.177.63:https A
221	2020-03-17 22:10:47	106.120.159.126	192.168.1.10	Https	122	Ether / IP / TCP 106.120.159.126:https > 192.168.1.10:9037 PA / Raw
222	2020-03-17 22:10:47	106.120.159.126	192.168.1.10	Https	1506	Ether / IP / TCP 106.120.159.126:https > 192.168.1.10:9037 A / Raw
223	2020-03-17 22:10:47	192.168.1.10	106.120.159.126	Https	54	Ether / IP / TCP 192.168.1.10:9037 > 106.120.159.126:https A
224	2020-03-17 22:10:47	106.120.159.126	192.168.1.10	Https	1506	Ether / IP / TCP 106.120.159.126:https > 192.168.1.10:9037 A / Raw
225	2020-03-17 22:10:47	106.120.159.126	192.168.1.10	Https	769	Ether / IP / TCP 106.120.159.126:https > 192.168.1.10:9037 PA / Raw
226	2020-03-17 22:10:47	192.168.1.10	106.120.159.126	Https	54	Ether / IP / TCP 192.168.1.10:9037 > 106.120.159.126:https A
227	2020-03-17 22:10:47	106.120.159.126	192.168.1.10	Https	382	Ether / IP / TCP 106.120.159.126:https > 192.168.1.10:9036 PA / Raw
228	2020-03-17 22:10:47	106.120.159.126	192.168.1.10	Https	392	Ether / IP / TCP 106.120.159.126:https > 192.168.1.10:9037 PA / Raw
229	2020-03-17 22:10:47	106.120.159.126	192.168.1.10	Https	63	Ether / IP / TCP 106.120.159.126:https > 192.168.1.10:9037 PA / Raw
230	2020-03-17 22:10:47	192.168.1.10	106.120.159.126	Https	54	Ether / IP / TCP 192.168.1.10:9037 > 106.120.159.126:https A
231	2020-03-17 22:10:47	192.168.1.10	106.120.159.126	Https	180	Ether / IP / TCP 192.168.1.10:9037 > 106.120.159.126:https PA / Raw
232	2020-03-17 22:10:47	192.168.1.10	106.120.159.126	Https	54	Ether / IP / TCP 192.168.1.10:9036 > 106.120.159.126:https A
233	2020-03-17 22:10:47	220.181.107.131	192.168.1.10	Https	122	Ether / IP / TCP 220.181.107.131:https > 192.168.1.10:9034 PA / Raw
234	2020-03-17 22:10:47	220.181.107.131	192.168.1.10	Https	1506	Ether / IP / TCP 220.181.107.131:https > 192.168.1.10:9034 A / Raw
235	2020-03-17 22:10:47	220.181.107.131	192.168.1.10	Https	1506	Ether / IP / TCP 220.181.107.131:https > 192.168.1.10:9034 A / Raw
236	2020-03-17 22:10:47	220.181.107.131	192.168.1.10	Https	769	Ether / IP / TCP 220.181.107.131:https > 192.168.1.10:9034 PA / Raw
237	2020-03-17 22:10:47	192.168.1.10	220.181.107.131	Https	54	Ether / IP / TCP 192.168.1.10:9034 > 220.181.107.131:https A
238	2020-03-17 22:10:47	220.181.107.131	192.168.1.10	Https	392	Ether / IP / TCP 220.181.107.131:https > 192.168.1.10:9034 PA / Raw
239	2020-03-17 22:10:47	220.181.107.131	192.168.1.10	Https	63	Ether / IP / TCP 220.181.107.131:https > 192.168.1.10:9034 PA / Raw
240	2020-03-17 22:10:47	192.168.1.10	220.181.107.131	Https	54	Ether / IP / TCP 192.168.1.10:9034 > 220.181.107.131:https A
241	2020-03-17 22:10:47	192.168.1.10	220.181.107.131	Https	180	Ether / IP / TCP 192.168.1.10:9034 > 220.181.107.131:https PA / Raw
242	2020-03-17 22:10:47	192.168.1.10	220.181.107.131	Https	1299	Ether / IP / TCP 192.168.1.10:9034 > 220.181.107.131:https PA / Raw
243	2020-03-17 22:10:47	220.181.107.131	192.168.1.10	Https	63	Ether / IP / TCP 220.181.107.131:https > 192.168.1.10:9034 PA / Raw
244	2020-03-17 22:10:47	192.168.1.10	220.181.107.131	Https	66	Ether / IP / TCP 192.168.1.10:9034 > 220.181.107.131:https A
245	2020-03-17 22:10:47	106.120.159.126	192.168.1.10	Https	60	Ether / IP / TCP 106.120.159.126:https > 192.168.1.10:9037 A / Padding
246	2020-03-17 22:10:47	220.181.107.131	192.168.1.10	Https	60	Ether / IP / TCP 220.181.107.131:https > 192.168.1.10:9034 A / Padding
247	2020-03-17 22:10:47	220.181.107.131	192.168.1.10	Https	60	Ether / IP / TCP 220.181.107.131:https > 192.168.1.10:9034 A / Padding
248	2020-03-17 22:10:47	220.181.107.131	192.168.1.10	Https	173	Ether / IP / TCP 220.181.107.131:https > 192.168.1.10:9034 PA / Raw
249	2020-03-17 22:10:47	220.181.107.131	192.168.1.10	Https	60	Ether / IP / TCP 220.181.107.131:https > 192.168.1.10:9034 PA / Raw
250	2020-03-17 22:10:47	220.181.107.131	192.168.1.10	Https	99	Ether / IP / TCP 220.181.107.131:https > 192.168.1.10:9034 PA / Raw
251	2020-03-17 22:10:47	192.168.1.10	220.181.107.131	Https	54	Ether / IP / TCP 192.168.1.10:9034 > 220.181.107.131:https A
252	2020-03-17 22:10:47	106.120.159.126	192.168.1.10	Https	173	Ether / IP / TCP 106.120.159.126:https > 192.168.1.10:9037 PA / Raw
253	2020-03-17 22:10:47	106.120.159.126	192.168.1.10	Https	60	Ether / IP / TCP 106.120.159.126:https > 192.168.1.10:9037 PA / Raw
254	2020-03-17 22:10:47	106.120.159.126	192.168.1.10	Https	99	Ether / IP / TCP 106.120.159.126:https > 192.168.1.10:9037 PA / Raw
255	2020-03-17 22:10:47	192.168.1.10	106.120.159.126	Https	54	Ether / IP / TCP 192.168.1.10:9037 > 106.120.159.126:https A
256	2020-03-17 22:10:47	fe80::f141:b4f2:11de:b126	fe80::1	DNS	96	Ether / IPv6 / UDP / DNS Qry "b'ss0.bdstatic.com.'" 
257	2020-03-17 22:10:47	fe80::f141:b4f2:11de:b126	fe80::1	DNS	96	Ether / IPv6 / UDP / DNS Qry "b'ss0.bdstatic.com.'" 
258	2020-03-17 22:10:47	fe80::1	fe80::f141:b4f2:11de:b126	DNS	384	Ether / IPv6 / UDP / DNS Ans "b'sslbdstatic.jomodns.com.'" 
259	2020-03-17 22:10:47	fe80::1	fe80::f141:b4f2:11de:b126	DNS	193	Ether / IPv6 / UDP / DNS Ans "b'sslbdstatic.jomodns.com.'" 
260	2020-03-17 22:10:47	192.168.1.10	125.77.154.32	Https	66	Ether / IP / TCP 192.168.1.10:9038 > 125.77.154.32:https S
261	2020-03-17 22:10:47	220.181.107.131	192.168.1.10	Https	394	Ether / IP / TCP 220.181.107.131:https > 192.168.1.10:9034 PA / Raw
262	2020-03-17 22:10:47	192.168.1.10	220.181.107.131	Https	54	Ether / IP / TCP 192.168.1.10:9034 > 220.181.107.131:https A
263	2020-03-17 22:10:47	125.77.154.32	192.168.1.10	Https	66	Ether / IP / TCP 125.77.154.32:https > 192.168.1.10:9038 SA
264	2020-03-17 22:10:47	192.168.1.10	125.77.154.32	Https	54	Ether / IP / TCP 192.168.1.10:9038 > 125.77.154.32:https A
265	2020-03-17 22:10:47	192.168.1.10	125.77.154.32	Https	571	Ether / IP / TCP 192.168.1.10:9038 > 125.77.154.32:https PA / Raw
266	2020-03-17 22:10:47	125.77.154.32	192.168.1.10	Https	60	Ether / IP / TCP 125.77.154.32:https > 192.168.1.10:9038 A / Padding
267	2020-03-17 22:10:47	125.77.154.32	192.168.1.10	Https	1394	Ether / IP / TCP 125.77.154.32:https > 192.168.1.10:9038 A / Raw
268	2020-03-17 22:10:47	125.77.154.32	192.168.1.10	Https	1394	Ether / IP / TCP 125.77.154.32:https > 192.168.1.10:9038 A / Raw
269	2020-03-17 22:10:47	125.77.154.32	192.168.1.10	Https	130	Ether / IP / TCP 125.77.154.32:https > 192.168.1.10:9038 PA / Raw
270	2020-03-17 22:10:47	125.77.154.32	192.168.1.10	Https	1394	Ether / IP / TCP 125.77.154.32:https > 192.168.1.10:9038 A / Raw
271	2020-03-17 22:10:47	125.77.154.32	192.168.1.10	Https	148	Ether / IP / TCP 125.77.154.32:https > 192.168.1.10:9038 PA / Raw
272	2020-03-17 22:10:47	192.168.1.10	125.77.154.32	Https	66	Ether / IP / TCP 192.168.1.10:9038 > 125.77.154.32:https A
273	2020-03-17 22:10:47	192.168.1.10	125.77.154.32	Https	54	Ether / IP / TCP 192.168.1.10:9038 > 125.77.154.32:https A
274	2020-03-17 22:10:47	192.168.1.10	125.77.154.32	Https	134	Ether / IP / TCP 192.168.1.10:9038 > 125.77.154.32:https PA / Raw
275	2020-03-17 22:10:47	192.168.1.10	125.77.154.32	Https	146	Ether / IP / TCP 192.168.1.10:9038 > 125.77.154.32:https PA / Raw
276	2020-03-17 22:10:47	192.168.1.10	125.77.154.32	Https	633	Ether / IP / TCP 192.168.1.10:9038 > 125.77.154.32:https PA / Raw
277	2020-03-17 22:10:47	125.77.154.32	192.168.1.10	Https	60	Ether / IP / TCP 125.77.154.32:https > 192.168.1.10:9038 A / Padding
278	2020-03-17 22:10:47	125.77.154.32	192.168.1.10	Https	341	Ether / IP / TCP 125.77.154.32:https > 192.168.1.10:9038 PA / Raw
279	2020-03-17 22:10:47	125.77.154.32	192.168.1.10	Https	341	Ether / IP / TCP 125.77.154.32:https > 192.168.1.10:9038 PA / Raw
280	2020-03-17 22:10:47	125.77.154.32	192.168.1.10	Https	116	Ether / IP / TCP 125.77.154.32:https > 192.168.1.10:9038 PA / Raw
281	2020-03-17 22:10:47	192.168.1.10	125.77.154.32	Https	54	Ether / IP / TCP 192.168.1.10:9038 > 125.77.154.32:https A
282	2020-03-17 22:10:47	192.168.1.10	125.77.154.32	Https	85	Ether / IP / TCP 192.168.1.10:9038 > 125.77.154.32:https PA / Raw
283	2020-03-17 22:10:47	125.77.154.32	192.168.1.10	Https	66	Ether / IP / TCP 125.77.154.32:https > 192.168.1.10:9038 A
284	2020-03-17 22:10:47	125.77.154.32	192.168.1.10	Https	60	Ether / IP / TCP 125.77.154.32:https > 192.168.1.10:9038 A / Padding
285	2020-03-17 22:10:47	125.77.154.32	192.168.1.10	Https	85	Ether / IP / TCP 125.77.154.32:https > 192.168.1.10:9038 PA / Raw
286	2020-03-17 22:10:47	125.77.154.32	192.168.1.10	Https	1394	Ether / IP / TCP 125.77.154.32:https > 192.168.1.10:9038 A / Raw
287	2020-03-17 22:10:47	125.77.154.32	192.168.1.10	Https	1394	Ether / IP / TCP 125.77.154.32:https > 192.168.1.10:9038 A / Raw
288	2020-03-17 22:10:47	192.168.1.10	125.77.154.32	Https	54	Ether / IP / TCP 192.168.1.10:9038 > 125.77.154.32:https A
289	2020-03-17 22:10:47	125.77.154.32	192.168.1.10	Https	1394	Ether / IP / TCP 125.77.154.32:https > 192.168.1.10:9038 A / Raw
290	2020-03-17 22:10:47	125.77.154.32	192.168.1.10	Https	1394	Ether / IP / TCP 125.77.154.32:https > 192.168.1.10:9038 A / Raw
291	2020-03-17 22:10:47	125.77.154.32	192.168.1.10	Https	1394	Ether / IP / TCP 125.77.154.32:https > 192.168.1.10:9038 A / Raw
292	2020-03-17 22:10:47	192.168.1.10	125.77.154.32	Https	66	Ether / IP / TCP 192.168.1.10:9038 > 125.77.154.32:https A
293	2020-03-17 22:10:47	192.168.1.10	125.77.154.32	Https	54	Ether / IP / TCP 192.168.1.10:9038 > 125.77.154.32:https A
294	2020-03-17 22:10:47	192.168.1.10	125.77.154.32	Https	54	Ether / IP / TCP 192.168.1.10:9038 > 125.77.154.32:https A
295	2020-03-17 22:10:47	125.77.154.32	192.168.1.10	Https	1394	Ether / IP / TCP 125.77.154.32:https > 192.168.1.10:9038 A / Raw
296	2020-03-17 22:10:47	125.77.154.32	192.168.1.10	Https	1394	Ether / IP / TCP 125.77.154.32:https > 192.168.1.10:9038 A / Raw
297	2020-03-17 22:10:47	125.77.154.32	192.168.1.10	Https	1394	Ether / IP / TCP 125.77.154.32:https > 192.168.1.10:9038 A / Raw
298	2020-03-17 22:10:47	192.168.1.10	125.77.154.32	Https	66	Ether / IP / TCP 192.168.1.10:9038 > 125.77.154.32:https A
299	2020-03-17 22:10:47	125.77.154.32	192.168.1.10	Https	1394	Ether / IP / TCP 125.77.154.32:https > 192.168.1.10:9038 A / Raw
300	2020-03-17 22:10:47	125.77.154.32	192.168.1.10	Https	1394	Ether / IP / TCP 125.77.154.32:https > 192.168.1.10:9038 A / Raw
301	2020-03-17 22:10:47	125.77.154.32	192.168.1.10	Https	1394	Ether / IP / TCP 125.77.154.32:https > 192.168.1.10:9038 A / Raw
302	2020-03-17 22:10:47	192.168.1.10	125.77.154.32	Https	66	Ether / IP / TCP 192.168.1.10:9038 > 125.77.154.32:https A
303	2020-03-17 22:10:47	192.168.1.10	125.77.154.32	Https	66	Ether / IP / TCP 192.168.1.10:9038 > 125.77.154.32:https A
304	2020-03-17 22:10:47	192.168.1.10	125.77.154.32	Https	54	Ether / IP / TCP 192.168.1.10:9038 > 125.77.154.32:https A
305	2020-03-17 22:10:47	125.77.154.32	192.168.1.10	Https	1394	Ether / IP / TCP 125.77.154.32:https > 192.168.1.10:9038 A / Raw
306	2020-03-17 22:10:47	192.168.1.10	125.77.154.32	Https	54	Ether / IP / TCP 192.168.1.10:9038 > 125.77.154.32:https A
307	2020-03-17 22:10:47	125.77.154.32	192.168.1.10	Https	1394	Ether / IP / TCP 125.77.154.32:https > 192.168.1.10:9038 A / Raw
308	2020-03-17 22:10:47	125.77.154.32	192.168.1.10	Https	1394	Ether / IP / TCP 125.77.154.32:https > 192.168.1.10:9038 A / Raw
309	2020-03-17 22:10:47	192.168.1.10	125.77.154.32	Https	54	Ether / IP / TCP 192.168.1.10:9038 > 125.77.154.32:https A
310	2020-03-17 22:10:47	125.77.154.32	192.168.1.10	Https	1394	Ether / IP / TCP 125.77.154.32:https > 192.168.1.10:9038 A / Raw
311	2020-03-17 22:10:47	125.77.154.32	192.168.1.10	Https	1394	Ether / IP / TCP 125.77.154.32:https > 192.168.1.10:9038 A / Raw
312	2020-03-17 22:10:47	192.168.1.10	125.77.154.32	Https	66	Ether / IP / TCP 192.168.1.10:9038 > 125.77.154.32:https A
313	2020-03-17 22:10:47	125.77.154.32	192.168.1.10	Https	1394	Ether / IP / TCP 125.77.154.32:https > 192.168.1.10:9038 A / Raw
314	2020-03-17 22:10:47	125.77.154.32	192.168.1.10	Https	1394	Ether / IP / TCP 125.77.154.32:https > 192.168.1.10:9038 A / Raw
315	2020-03-17 22:10:47	125.77.154.32	192.168.1.10	Https	1394	Ether / IP / TCP 125.77.154.32:https > 192.168.1.10:9038 A / Raw
316	2020-03-17 22:10:47	192.168.1.10	125.77.154.32	Https	74	Ether / IP / TCP 192.168.1.10:9038 > 125.77.154.32:https A
317	2020-03-17 22:10:47	192.168.1.10	125.77.154.32	Https	66	Ether / IP / TCP 192.168.1.10:9038 > 125.77.154.32:https A
318	2020-03-17 22:10:47	192.168.1.10	125.77.154.32	Https	54	Ether / IP / TCP 192.168.1.10:9038 > 125.77.154.32:https A
319	2020-03-17 22:10:47	125.77.154.32	192.168.1.10	Https	1394	Ether / IP / TCP 125.77.154.32:https > 192.168.1.10:9038 A / Raw
320	2020-03-17 22:10:47	125.77.154.32	192.168.1.10	Https	1394	Ether / IP / TCP 125.77.154.32:https > 192.168.1.10:9038 A / Raw
321	2020-03-17 22:10:47	125.77.154.32	192.168.1.10	Https	60	Ether / IP / TCP 125.77.154.32:https > 192.168.1.10:9038 A / Padding
322	2020-03-17 22:10:47	125.77.154.32	192.168.1.10	Https	60	Ether / IP / TCP 125.77.154.32:https > 192.168.1.10:9038 A / Padding
323	2020-03-17 22:10:47	192.168.1.10	125.77.154.32	Https	66	Ether / IP / TCP 192.168.1.10:9038 > 125.77.154.32:https A
324	2020-03-17 22:10:47	192.168.1.10	125.77.154.32	Https	54	Ether / IP / TCP 192.168.1.10:9038 > 125.77.154.32:https A
325	2020-03-17 22:10:47	125.77.154.32	192.168.1.10	Https	1394	Ether / IP / TCP 125.77.154.32:https > 192.168.1.10:9038 A / Raw
326	2020-03-17 22:10:47	125.77.154.32	192.168.1.10	Https	1394	Ether / IP / TCP 125.77.154.32:https > 192.168.1.10:9038 A / Raw
327	2020-03-17 22:10:47	125.77.154.32	192.168.1.10	Https	1394	Ether / IP / TCP 125.77.154.32:https > 192.168.1.10:9038 A / Raw
328	2020-03-17 22:10:47	192.168.1.10	125.77.154.32	Https	66	Ether / IP / TCP 192.168.1.10:9038 > 125.77.154.32:https A
329	2020-03-17 22:10:47	192.168.1.10	125.77.154.32	Https	54	Ether / IP / TCP 192.168.1.10:9038 > 125.77.154.32:https A
330	2020-03-17 22:10:47	125.77.154.32	192.168.1.10	Https	1394	Ether / IP / TCP 125.77.154.32:https > 192.168.1.10:9038 A / Raw
331	2020-03-17 22:10:47	125.77.154.32	192.168.1.10	Https	1394	Ether / IP / TCP 125.77.154.32:https > 192.168.1.10:9038 A / Raw
332	2020-03-17 22:10:47	125.77.154.32	192.168.1.10	Https	1394	Ether / IP / TCP 125.77.154.32:https > 192.168.1.10:9038 A / Raw
333	2020-03-17 22:10:47	192.168.1.10	125.77.154.32	Https	54	Ether / IP / TCP 192.168.1.10:9038 > 125.77.154.32:https A
334	2020-03-17 22:10:47	125.77.154.32	192.168.1.10	Https	1394	Ether / IP / TCP 125.77.154.32:https > 192.168.1.10:9038 A / Raw
335	2020-03-17 22:10:47	125.77.154.32	192.168.1.10	Https	1394	Ether / IP / TCP 125.77.154.32:https > 192.168.1.10:9038 A / Raw
336	2020-03-17 22:10:47	192.168.1.10	125.77.154.32	Https	54	Ether / IP / TCP 192.168.1.10:9038 > 125.77.154.32:https A
337	2020-03-17 22:10:47	125.77.154.32	192.168.1.10	Https	1394	Ether / IP / TCP 125.77.154.32:https > 192.168.1.10:9038 A / Raw
338	2020-03-17 22:10:47	125.77.154.32	192.168.1.10	Https	1394	Ether / IP / TCP 125.77.154.32:https > 192.168.1.10:9038 A / Raw
339	2020-03-17 22:10:47	125.77.154.32	192.168.1.10	Https	1394	Ether / IP / TCP 125.77.154.32:https > 192.168.1.10:9038 A / Raw
340	2020-03-17 22:10:47	192.168.1.10	125.77.154.32	Https	66	Ether / IP / TCP 192.168.1.10:9038 > 125.77.154.32:https A
341	2020-03-17 22:10:47	192.168.1.10	125.77.154.32	Https	54	Ether / IP / TCP 192.168.1.10:9038 > 125.77.154.32:https A
342	2020-03-17 22:10:47	192.168.1.10	125.77.154.32	Https	66	Ether / IP / TCP 192.168.1.10:9038 > 125.77.154.32:https A
343	2020-03-17 22:10:47	125.77.154.32	192.168.1.10	Https	1394	Ether / IP / TCP 125.77.154.32:https > 192.168.1.10:9038 A / Raw
344	2020-03-17 22:10:47	125.77.154.32	192.168.1.10	Https	1394	Ether / IP / TCP 125.77.154.32:https > 192.168.1.10:9038 A / Raw
345	2020-03-17 22:10:47	192.168.1.10	125.77.154.32	Https	66	Ether / IP / TCP 192.168.1.10:9038 > 125.77.154.32:https A
346	2020-03-17 22:10:47	192.168.1.10	125.77.154.32	Https	54	Ether / IP / TCP 192.168.1.10:9038 > 125.77.154.32:https A
347	2020-03-17 22:10:47	125.77.154.32	192.168.1.10	Https	1394	Ether / IP / TCP 125.77.154.32:https > 192.168.1.10:9038 A / Raw
348	2020-03-17 22:10:47	125.77.154.32	192.168.1.10	Https	1394	Ether / IP / TCP 125.77.154.32:https > 192.168.1.10:9038 A / Raw
349	2020-03-17 22:10:47	125.77.154.32	192.168.1.10	Https	130	Ether / IP / TCP 125.77.154.32:https > 192.168.1.10:9038 PA / Raw
350	2020-03-17 22:10:47	192.168.1.10	125.77.154.32	Https	66	Ether / IP / TCP 192.168.1.10:9038 > 125.77.154.32:https A
351	2020-03-17 22:10:47	192.168.1.10	125.77.154.32	Https	54	Ether / IP / TCP 192.168.1.10:9038 > 125.77.154.32:https A
352	2020-03-17 22:10:47	125.77.154.32	192.168.1.10	Https	1394	Ether / IP / TCP 125.77.154.32:https > 192.168.1.10:9038 A / Raw
353	2020-03-17 22:10:47	192.168.1.10	125.77.154.32	Https	66	Ether / IP / TCP 192.168.1.10:9038 > 125.77.154.32:https A
354	2020-03-17 22:10:47	125.77.154.32	192.168.1.10	Https	1394	Ether / IP / TCP 125.77.154.32:https > 192.168.1.10:9038 A / Raw
355	2020-03-17 22:10:47	192.168.1.10	125.77.154.32	Https	66	Ether / IP / TCP 192.168.1.10:9038 > 125.77.154.32:https A
356	2020-03-17 22:10:47	192.168.1.10	125.77.154.32	Https	313	Ether / IP / TCP 192.168.1.10:9038 > 125.77.154.32:https PA / Raw
357	2020-03-17 22:10:47	125.77.154.32	192.168.1.10	Https	60	Ether / IP / TCP 125.77.154.32:https > 192.168.1.10:9038 A / Padding
358	2020-03-17 22:10:48	125.77.154.32	192.168.1.10	Https	1394	Ether / IP / TCP 125.77.154.32:https > 192.168.1.10:9038 A / Raw
359	2020-03-17 22:10:48	125.77.154.32	192.168.1.10	Https	1394	Ether / IP / TCP 125.77.154.32:https > 192.168.1.10:9038 A / Raw
360	2020-03-17 22:10:48	125.77.154.32	192.168.1.10	Https	1394	Ether / IP / TCP 125.77.154.32:https > 192.168.1.10:9038 A / Raw
361	2020-03-17 22:10:48	192.168.1.10	125.77.154.32	Https	54	Ether / IP / TCP 192.168.1.10:9038 > 125.77.154.32:https A
