1	2020-03-18 00:31:25	192.168.1.10	14.215.177.39	Https	54	Ether / IP / TCP 192.168.1.10:2021 > 14.215.177.39:https FA
2	2020-03-18 00:31:25	192.168.1.10	180.163.32.152	UDP	420	Ether / IP / UDP 192.168.1.10:54843 > 180.163.32.152:8000 / Raw
3	2020-03-18 00:31:25	192.168.1.10	10.10.20.110	UDP	83	Ether / IP / UDP 192.168.1.10:59684 > 10.10.20.110:snmp / SNMP
4	2020-03-18 00:31:25	fe80::1	fe80::f141:b4f2:11de:b126	ICMPv6	86	Ether / IPv6 / ICMPv6ND_NS / ICMPv6 Neighbor Discovery Option - Source Link-Layer Address 9c:d2:4b:38:91:c1
5	2020-03-18 00:31:25	fe80::f141:b4f2:11de:b126	fe80::1	ICMPv6	86	Ether / IPv6 / ICMPv6ND_NA / ICMPv6 Neighbor Discovery Option - Destination Link-Layer Address 00:e0:4c:68:00:2d
6	2020-03-18 00:31:26	192.168.1.10	161.117.236.80	TCP	66	Ether / IP / TCP 192.168.1.10:2025 > 161.117.236.80:20395 S
7	2020-03-18 00:31:26	192.168.1.10	14.215.177.39	Https	66	Ether / IP / TCP 192.168.1.10:2029 > 14.215.177.39:https S
8	2020-03-18 00:31:26	14.215.177.39	192.168.1.10	Https	66	Ether / IP / TCP 14.215.177.39:https > 192.168.1.10:2029 SA
9	2020-03-18 00:31:26	192.168.1.10	14.215.177.39	Https	54	Ether / IP / TCP 192.168.1.10:2029 > 14.215.177.39:https A
10	2020-03-18 00:31:26	192.168.1.10	14.215.177.39	Https	54	Ether / IP / TCP 192.168.1.10:2029 > 14.215.177.39:https FA
11	2020-03-18 00:31:26	192.168.1.10	14.215.177.39	Https	54	Ether / IP / TCP 192.168.1.10:2029 > 14.215.177.39:https FA
12	2020-03-18 00:31:26	192.168.1.10	180.163.32.152	UDP	420	Ether / IP / UDP 192.168.1.10:54843 > 180.163.32.152:8000 / Raw
13	2020-03-18 00:31:26	192.168.1.10	161.117.236.80	TCP	66	Ether / IP / TCP 192.168.1.10:2026 > 161.117.236.80:20395 S
14	2020-03-18 00:31:27	192.168.1.10	154.8.131.192	Https	91	Ether / IP / TCP 192.168.1.10:11843 > 154.8.131.192:https PA / Raw
15	2020-03-18 00:31:27	192.168.1.10	14.215.177.39	Https	54	Ether / IP / TCP 192.168.1.10:2029 > 14.215.177.39:https FA
16	2020-03-18 00:31:27	154.8.131.192	192.168.1.10	Https	87	Ether / IP / TCP 154.8.131.192:https > 192.168.1.10:11843 PA / Raw
17	2020-03-18 00:31:27	192.168.1.10	154.8.131.192	Https	54	Ether / IP / TCP 192.168.1.10:11843 > 154.8.131.192:https A
18	2020-03-18 00:31:27	192.168.1.10	239.255.255.250	UDP	216	Ether / IP / UDP 192.168.1.10:61153 > 239.255.255.250:ssdp / Raw
19	2020-03-18 00:31:28	192.168.1.10	14.215.177.39	Https	54	Ether / IP / TCP 192.168.1.10:2029 > 14.215.177.39:https FA
20	2020-03-18 00:31:28	192.168.1.10	239.255.255.250	UDP	216	Ether / IP / UDP 192.168.1.10:61153 > 239.255.255.250:ssdp / Raw
21	2020-03-18 00:31:29	192.168.1.10	161.117.236.80	TCP	66	Ether / IP / TCP 192.168.1.10:2030 > 161.117.236.80:20395 S
22	2020-03-18 00:31:29	192.168.1.10	239.255.255.250	UDP	216	Ether / IP / UDP 192.168.1.10:61153 > 239.255.255.250:ssdp / Raw
23	2020-03-18 00:31:29	192.168.1.10	161.117.236.80	TCP	66	Ether / IP / TCP 192.168.1.10:2031 > 161.117.236.80:20395 S
24	2020-03-18 00:31:30	192.168.1.10	161.117.236.80	TCP	66	Ether / IP / TCP 192.168.1.10:2030 > 161.117.236.80:20395 S
25	2020-03-18 00:31:30	fe80::f141:b4f2:11de:b126	fe80::1	DNS	94	Ether / IPv6 / UDP / DNS Qry "b'www.google.com.'" 
26	2020-03-18 00:31:30	fe80::f141:b4f2:11de:b126	fe80::1	DNS	94	Ether / IPv6 / UDP / DNS Qry "b'www.google.com.'" 
27	2020-03-18 00:31:30	fe80::1	fe80::f141:b4f2:11de:b126	DNS	110	Ether / IPv6 / UDP / DNS Ans "199.59.148.140" 
28	2020-03-18 00:31:30	fe80::1	fe80::f141:b4f2:11de:b126	DNS	122	Ether / IPv6 / UDP / DNS Ans "2400:cb00:2048:1::6814:224e" 
29	2020-03-18 00:31:30	240e:d4:2e8e:df00:4882:f650:cbf9:db1d	2400:cb00:2048:1::6814:224e	Https	86	Ether / IPv6 / TCP 240e:d4:2e8e:df00:4882:f650:cbf9:db1d:2032 > 2400:cb00:2048:1::6814:224e:https S
30	2020-03-18 00:31:30	192.168.1.10	14.215.177.39	Https	54	Ether / IP / TCP 192.168.1.10:2029 > 14.215.177.39:https FA
31	2020-03-18 00:31:30	192.168.1.10	239.255.255.250	UDP	216	Ether / IP / UDP 192.168.1.10:61153 > 239.255.255.250:ssdp / Raw
32	2020-03-18 00:31:30	192.168.1.10	161.117.236.80	TCP	66	Ether / IP / TCP 192.168.1.10:2031 > 161.117.236.80:20395 S
33	2020-03-18 00:31:30	240e:d4:2e8e:df00:4882:f650:cbf9:db1d	2400:cb00:2048:1::6814:224e	Https	86	Ether / IPv6 / TCP 240e:d4:2e8e:df00:4882:f650:cbf9:db1d:2033 > 2400:cb00:2048:1::6814:224e:https S
34	2020-03-18 00:31:30	192.168.1.10	183.57.48.55	Http	66	Ether / IP / TCP 192.168.1.10:2034 > 183.57.48.55:http S
35	2020-03-18 00:31:30	183.57.48.55	192.168.1.10	Http	66	Ether / IP / TCP 183.57.48.55:http > 192.168.1.10:2034 SA
36	2020-03-18 00:31:30	192.168.1.10	183.57.48.55	Http	54	Ether / IP / TCP 192.168.1.10:2034 > 183.57.48.55:http A
37	2020-03-18 00:31:30	240e:d4:2e8e:df00:4882:f650:cbf9:db1d	2400:cb00:2048:1::6814:224e	Https	86	Ether / IPv6 / TCP 240e:d4:2e8e:df00:4882:f650:cbf9:db1d:2035 > 2400:cb00:2048:1::6814:224e:https S
38	2020-03-18 00:31:30	192.168.1.10	199.59.148.140	Https	66	Ether / IP / TCP 192.168.1.10:2036 > 199.59.148.140:https S
39	2020-03-18 00:31:30	192.168.1.10	183.57.48.55	Http	1217	Ether / IP / TCP / HTTP / 'POST' '/q.cgi' 'HTTP/1.1' / Raw
40	2020-03-18 00:31:30	183.57.48.55	192.168.1.10	Http	60	Ether / IP / TCP 183.57.48.55:http > 192.168.1.10:2034 A / Padding
41	2020-03-18 00:31:30	183.57.48.55	192.168.1.10	Http	408	Ether / IP / TCP / HTTP / 'HTTP/1.1' '200' 'OK' / Raw
42	2020-03-18 00:31:30	192.168.1.10	183.57.48.55	Http	54	Ether / IP / TCP 192.168.1.10:2034 > 183.57.48.55:http FA
43	2020-03-18 00:31:30	183.57.48.55	192.168.1.10	Http	60	Ether / IP / TCP 183.57.48.55:http > 192.168.1.10:2034 FA / Padding
44	2020-03-18 00:31:30	192.168.1.10	183.57.48.55	Http	54	Ether / IP / TCP 192.168.1.10:2034 > 183.57.48.55:http A
45	2020-03-18 00:31:30	240e:d4:2e8e:df00:4882:f650:cbf9:db1d	2400:cb00:2048:1::6814:224e	Https	86	Ether / IPv6 / TCP 240e:d4:2e8e:df00:4882:f650:cbf9:db1d:2037 > 2400:cb00:2048:1::6814:224e:https S
46	2020-03-18 00:31:31	192.168.1.10	199.59.148.140	Https	66	Ether / IP / TCP 192.168.1.10:2038 > 199.59.148.140:https S
47	2020-03-18 00:31:31	192.168.1.10	199.59.148.140	Https	66	Ether / IP / TCP 192.168.1.10:2039 > 199.59.148.140:https S
48	2020-03-18 00:31:31	192.168.1.10	199.59.148.140	Https	66	Ether / IP / TCP 192.168.1.10:2040 > 199.59.148.140:https S
49	2020-03-18 00:31:31	240e:d4:2e8e:df00:4882:f650:cbf9:db1d	2400:cb00:2048:1::6814:224e	Https	86	Ether / IPv6 / TCP 240e:d4:2e8e:df00:4882:f650:cbf9:db1d:2032 > 2400:cb00:2048:1::6814:224e:https S
50	2020-03-18 00:31:31	240e:d4:2e8e:df00:4882:f650:cbf9:db1d	2400:cb00:2048:1::6814:224e	Https	86	Ether / IPv6 / TCP 240e:d4:2e8e:df00:4882:f650:cbf9:db1d:2033 > 2400:cb00:2048:1::6814:224e:https S
51	2020-03-18 00:31:31	192.168.1.10	161.117.236.80	TCP	66	Ether / IP / TCP 192.168.1.10:2043 > 161.117.236.80:20395 S
52	2020-03-18 00:31:31	240e:d4:2e8e:df00:4882:f650:cbf9:db1d	2400:cb00:2048:1::6814:224e	Https	86	Ether / IPv6 / TCP 240e:d4:2e8e:df00:4882:f650:cbf9:db1d:2035 > 2400:cb00:2048:1::6814:224e:https S
53	2020-03-18 00:31:31	192.168.1.10	199.59.148.140	Https	66	Ether / IP / TCP 192.168.1.10:2036 > 199.59.148.140:https S
54	2020-03-18 00:31:31	240e:d4:2e8e:df00:4882:f650:cbf9:db1d	2400:cb00:2048:1::6814:224e	Https	86	Ether / IPv6 / TCP 240e:d4:2e8e:df00:4882:f650:cbf9:db1d:2037 > 2400:cb00:2048:1::6814:224e:https S
55	2020-03-18 00:31:32	192.168.1.10	199.59.148.140	Https	66	Ether / IP / TCP 192.168.1.10:2038 > 199.59.148.140:https S
56	2020-03-18 00:31:32	192.168.1.10	199.59.148.140	Https	66	Ether / IP / TCP 192.168.1.10:2039 > 199.59.148.140:https S
57	2020-03-18 00:31:32	192.168.1.10	161.117.236.80	TCP	66	Ether / IP / TCP 192.168.1.10:2030 > 161.117.236.80:20395 S
58	2020-03-18 00:31:32	192.168.1.10	199.59.148.140	Https	66	Ether / IP / TCP 192.168.1.10:2040 > 199.59.148.140:https S
59	2020-03-18 00:31:32	192.168.1.10	219.133.60.246	Http	66	Ether / IP / TCP 192.168.1.10:2044 > 219.133.60.246:http S
60	2020-03-18 00:31:32	219.133.60.246	192.168.1.10	Http	66	Ether / IP / TCP 219.133.60.246:http > 192.168.1.10:2044 SA
61	2020-03-18 00:31:32	192.168.1.10	219.133.60.246	Http	54	Ether / IP / TCP 192.168.1.10:2044 > 219.133.60.246:http A
62	2020-03-18 00:31:32	192.168.1.10	219.133.60.246	Http	513	Ether / IP / TCP / HTTP / 'POST' '/q.cgi' 'HTTP/1.1' / Raw
63	2020-03-18 00:31:32	192.168.1.10	161.117.236.80	TCP	66	Ether / IP / TCP 192.168.1.10:2031 > 161.117.236.80:20395 S
64	2020-03-18 00:31:32	219.133.60.246	192.168.1.10	Http	60	Ether / IP / TCP 219.133.60.246:http > 192.168.1.10:2044 A / Padding
65	2020-03-18 00:31:32	219.133.60.246	192.168.1.10	Http	352	Ether / IP / TCP / HTTP / 'HTTP/1.1' '200' 'OK' / Raw
66	2020-03-18 00:31:32	192.168.1.10	219.133.60.246	Http	54	Ether / IP / TCP 192.168.1.10:2044 > 219.133.60.246:http FA
67	2020-03-18 00:31:32	192.168.1.10	219.133.60.246	UDP	316	Ether / IP / UDP 192.168.1.10:62754 > 219.133.60.246:8000 / Raw
68	2020-03-18 00:31:32	192.168.1.10	161.117.236.80	TCP	66	Ether / IP / TCP 192.168.1.10:2043 > 161.117.236.80:20395 S
69	2020-03-18 00:31:32	219.133.60.246	192.168.1.10	Http	60	Ether / IP / TCP 219.133.60.246:http > 192.168.1.10:2044 FA / Padding
70	2020-03-18 00:31:32	192.168.1.10	219.133.60.246	Http	54	Ether / IP / TCP 192.168.1.10:2044 > 219.133.60.246:http A
71	2020-03-18 00:31:33	192.168.1.10	219.133.60.246	Http	66	Ether / IP / TCP 192.168.1.10:2045 > 219.133.60.246:http S
72	2020-03-18 00:31:33	219.133.60.246	192.168.1.10	Http	66	Ether / IP / TCP 219.133.60.246:http > 192.168.1.10:2045 SA
73	2020-03-18 00:31:33	192.168.1.10	219.133.60.246	Http	54	Ether / IP / TCP 192.168.1.10:2045 > 219.133.60.246:http A
74	2020-03-18 00:31:33	240e:d4:2e8e:df00:4882:f650:cbf9:db1d	2400:cb00:2048:1::6814:224e	Https	86	Ether / IPv6 / TCP 240e:d4:2e8e:df00:4882:f650:cbf9:db1d:2032 > 2400:cb00:2048:1::6814:224e:https S
75	2020-03-18 00:31:33	240e:d4:2e8e:df00:4882:f650:cbf9:db1d	2400:cb00:2048:1::6814:224e	Https	86	Ether / IPv6 / TCP 240e:d4:2e8e:df00:4882:f650:cbf9:db1d:2033 > 2400:cb00:2048:1::6814:224e:https S
76	2020-03-18 00:31:33	192.168.1.10	219.133.60.246	Http	521	Ether / IP / TCP / HTTP / 'POST' '/q.cgi' 'HTTP/1.1' / Raw
77	2020-03-18 00:31:33	219.133.60.246	192.168.1.10	Http	60	Ether / IP / TCP 219.133.60.246:http > 192.168.1.10:2045 A / Padding
78	2020-03-18 00:31:33	219.133.60.246	192.168.1.10	Http	264	Ether / IP / TCP / HTTP / 'HTTP/1.1' '200' 'OK' / Raw
79	2020-03-18 00:31:33	192.168.1.10	219.133.60.246	Http	54	Ether / IP / TCP 192.168.1.10:2045 > 219.133.60.246:http FA
80	2020-03-18 00:31:33	240e:d4:2e8e:df00:4882:f650:cbf9:db1d	2400:cb00:2048:1::6814:224e	Https	86	Ether / IPv6 / TCP 240e:d4:2e8e:df00:4882:f650:cbf9:db1d:2035 > 2400:cb00:2048:1::6814:224e:https S
81	2020-03-18 00:31:33	192.168.1.10	199.59.148.140	Https	66	Ether / IP / TCP 192.168.1.10:2036 > 199.59.148.140:https S
82	2020-03-18 00:31:33	219.133.60.246	192.168.1.10	Http	60	Ether / IP / TCP 219.133.60.246:http > 192.168.1.10:2045 FA / Padding
83	2020-03-18 00:31:33	192.168.1.10	219.133.60.246	Http	54	Ether / IP / TCP 192.168.1.10:2045 > 219.133.60.246:http A
84	2020-03-18 00:31:33	192.168.1.10	161.117.236.80	TCP	66	Ether / IP / TCP 192.168.1.10:2048 > 161.117.236.80:20395 S
85	2020-03-18 00:31:34	240e:d4:2e8e:df00:4882:f650:cbf9:db1d	2400:cb00:2048:1::6814:224e	Https	86	Ether / IPv6 / TCP 240e:d4:2e8e:df00:4882:f650:cbf9:db1d:2037 > 2400:cb00:2048:1::6814:224e:https S
86	2020-03-18 00:31:34	192.168.1.10	199.59.148.140	Https	66	Ether / IP / TCP 192.168.1.10:2038 > 199.59.148.140:https S
87	2020-03-18 00:31:34	192.168.1.10	199.59.148.140	Https	66	Ether / IP / TCP 192.168.1.10:2039 > 199.59.148.140:https S
88	2020-03-18 00:31:34	192.168.1.10	199.59.148.140	Https	66	Ether / IP / TCP 192.168.1.10:2040 > 199.59.148.140:https S
89	2020-03-18 00:31:34	192.168.1.10	161.117.236.80	TCP	66	Ether / IP / TCP 192.168.1.10:2051 > 161.117.236.80:20395 S
90	2020-03-18 00:31:34	192.168.1.10	161.117.236.80	TCP	66	Ether / IP / TCP 192.168.1.10:2043 > 161.117.236.80:20395 S
91	2020-03-18 00:31:34	192.168.1.10	161.117.236.80	TCP	66	Ether / IP / TCP 192.168.1.10:2048 > 161.117.236.80:20395 S
92	2020-03-18 00:31:34	192.168.1.10	161.117.236.80	TCP	66	Ether / IP / TCP 192.168.1.10:2054 > 161.117.236.80:20395 S
93	2020-03-18 00:31:35	192.168.1.10	14.215.177.39	Https	54	Ether / IP / TCP 192.168.1.10:2021 > 14.215.177.39:https RA
94	2020-03-18 00:31:35	192.168.1.10	161.117.236.80	TCP	66	Ether / IP / TCP 192.168.1.10:2057 > 161.117.236.80:20395 S
95	2020-03-18 00:31:35	192.168.1.10	14.215.177.39	Https	54	Ether / IP / TCP 192.168.1.10:2029 > 14.215.177.39:https FA
96	2020-03-18 00:31:35	192.168.1.10	161.117.236.80	TCP	66	Ether / IP / TCP 192.168.1.10:2051 > 161.117.236.80:20395 S
97	2020-03-18 00:31:35	192.168.1.10	161.117.236.80	TCP	66	Ether / IP / TCP 192.168.1.10:2054 > 161.117.236.80:20395 S
98	2020-03-18 00:31:36	192.168.1.10	161.117.236.80	TCP	66	Ether / IP / TCP 192.168.1.10:2030 > 161.117.236.80:20395 S
99	2020-03-18 00:31:36	192.168.1.10	192.168.1.255	UDP	92	Ether / IP / UDP 192.168.1.10:netbios_ns > 192.168.1.255:netbios_ns / NBNSQueryRequest
100	2020-03-18 00:31:36	192.168.1.10	224.0.0.251	UDP	68	Ether / IP / UDP / DNS Qry "b'hi.local.'" 
101	2020-03-18 00:31:36	fe80::f141:b4f2:11de:b126	ff02::fb	UDP	88	Ether / IPv6 / UDP / DNS Qry "b'hi.local.'" 
102	2020-03-18 00:31:36	192.168.1.10	224.0.0.251	UDP	68	Ether / IP / UDP / DNS Qry "b'hi.local.'" 
103	2020-03-18 00:31:36	fe80::f141:b4f2:11de:b126	ff02::fb	UDP	88	Ether / IPv6 / UDP / DNS Qry "b'hi.local.'" 
104	2020-03-18 00:31:36	fe80::f141:b4f2:11de:b126	ff02::1:3	UDP	82	Ether / IPv6 / UDP fe80::f141:b4f2:11de:b126:59530 > ff02::1:3:llmnr / LLMNRQuery
105	2020-03-18 00:31:36	192.168.1.10	224.0.0.252	UDP	62	Ether / IP / UDP 192.168.1.10:59530 > 224.0.0.252:llmnr / LLMNRQuery
106	2020-03-18 00:31:36	fe80::f141:b4f2:11de:b126	ff02::1:3	UDP	82	Ether / IPv6 / UDP fe80::f141:b4f2:11de:b126:51819 > ff02::1:3:llmnr / LLMNRQuery
107	2020-03-18 00:31:36	192.168.1.10	224.0.0.252	UDP	62	Ether / IP / UDP 192.168.1.10:51819 > 224.0.0.252:llmnr / LLMNRQuery
108	2020-03-18 00:31:36	192.168.1.10	14.215.177.39	Https	66	Ether / IP / TCP 192.168.1.10:2058 > 14.215.177.39:https S
109	2020-03-18 00:31:36	192.168.1.10	161.117.236.80	TCP	66	Ether / IP / TCP 192.168.1.10:2061 > 161.117.236.80:20395 S
110	2020-03-18 00:31:36	14.215.177.39	192.168.1.10	Https	66	Ether / IP / TCP 14.215.177.39:https > 192.168.1.10:2058 SA
111	2020-03-18 00:31:36	192.168.1.10	14.215.177.39	Https	54	Ether / IP / TCP 192.168.1.10:2058 > 14.215.177.39:https A
112	2020-03-18 00:31:36	192.168.1.10	14.215.177.39	Https	54	Ether / IP / TCP 192.168.1.10:2058 > 14.215.177.39:https FA
113	2020-03-18 00:31:36	192.168.1.10	161.117.236.80	TCP	66	Ether / IP / TCP 192.168.1.10:2064 > 161.117.236.80:20395 S
114	2020-03-18 00:31:36	192.168.1.10	161.117.236.80	TCP	66	Ether / IP / TCP 192.168.1.10:2057 > 161.117.236.80:20395 S
115	2020-03-18 00:31:36	fe80::f141:b4f2:11de:b126	fe80::1	ICMPv6	86	Ether / IPv6 / ICMPv6ND_NS / ICMPv6 Neighbor Discovery Option - Source Link-Layer Address 00:e0:4c:68:00:2d
116	2020-03-18 00:31:36	fe80::1	fe80::f141:b4f2:11de:b126	ICMPv6	78	Ether / IPv6 / ICMPv6 Neighbor Discovery - Neighbor Advertisement (tgt: fe80::1)
117	2020-03-18 00:31:36	192.168.1.10	14.215.177.39	Https	54	Ether / IP / TCP 192.168.1.10:2058 > 14.215.177.39:https FA
118	2020-03-18 00:31:36	fe80::f141:b4f2:11de:b126	ff02::1:3	UDP	82	Ether / IPv6 / UDP fe80::f141:b4f2:11de:b126:59530 > ff02::1:3:llmnr / LLMNRQuery
119	2020-03-18 00:31:36	192.168.1.10	224.0.0.252	UDP	62	Ether / IP / UDP 192.168.1.10:59530 > 224.0.0.252:llmnr / LLMNRQuery
120	2020-03-18 00:31:36	fe80::f141:b4f2:11de:b126	ff02::1:3	UDP	82	Ether / IPv6 / UDP fe80::f141:b4f2:11de:b126:51819 > ff02::1:3:llmnr / LLMNRQuery
121	2020-03-18 00:31:36	192.168.1.10	224.0.0.252	UDP	62	Ether / IP / UDP 192.168.1.10:51819 > 224.0.0.252:llmnr / LLMNRQuery
122	2020-03-18 00:31:36	192.168.1.10	161.117.236.80	TCP	66	Ether / IP / TCP 192.168.1.10:2031 > 161.117.236.80:20395 S
123	2020-03-18 00:31:36	192.168.1.10	192.168.1.255	UDP	92	Ether / IP / UDP 192.168.1.10:netbios_ns > 192.168.1.255:netbios_ns / NBNSQueryRequest
124	2020-03-18 00:31:36	192.168.1.10	161.117.236.80	TCP	66	Ether / IP / TCP 192.168.1.10:2048 > 161.117.236.80:20395 S
125	2020-03-18 00:31:37	192.168.1.10	14.215.177.39	Https	54	Ether / IP / TCP 192.168.1.10:2058 > 14.215.177.39:https FA
126	2020-03-18 00:31:37	192.168.1.10	224.0.0.251	UDP	68	Ether / IP / UDP / DNS Qry "b'hi.local.'" 
127	2020-03-18 00:31:37	fe80::f141:b4f2:11de:b126	ff02::fb	UDP	88	Ether / IPv6 / UDP / DNS Qry "b'hi.local.'" 
128	2020-03-18 00:31:37	192.168.1.10	224.0.0.251	UDP	68	Ether / IP / UDP / DNS Qry "b'hi.local.'" 
129	2020-03-18 00:31:37	fe80::f141:b4f2:11de:b126	ff02::fb	UDP	88	Ether / IPv6 / UDP / DNS Qry "b'hi.local.'" 
130	2020-03-18 00:31:37	192.168.1.10	161.117.236.80	TCP	66	Ether / IP / TCP 192.168.1.10:2061 > 161.117.236.80:20395 S
131	2020-03-18 00:31:37	192.168.1.10	161.117.236.80	TCP	66	Ether / IP / TCP 192.168.1.10:2064 > 161.117.236.80:20395 S
132	2020-03-18 00:31:37	240e:d4:2e8e:df00:4882:f650:cbf9:db1d	2400:cb00:2048:1::6814:224e	Https	86	Ether / IPv6 / TCP 240e:d4:2e8e:df00:4882:f650:cbf9:db1d:2032 > 2400:cb00:2048:1::6814:224e:https S
133	2020-03-18 00:31:37	192.168.1.10	161.117.236.80	TCP	66	Ether / IP / TCP 192.168.1.10:2051 > 161.117.236.80:20395 S
134	2020-03-18 00:31:37	192.168.1.10	192.168.1.255	UDP	92	Ether / IP / UDP 192.168.1.10:netbios_ns > 192.168.1.255:netbios_ns / NBNSQueryRequest
135	2020-03-18 00:31:37	240e:d4:2e8e:df00:4882:f650:cbf9:db1d	2400:cb00:2048:1::6814:224e	Https	86	Ether / IPv6 / TCP 240e:d4:2e8e:df00:4882:f650:cbf9:db1d:2033 > 2400:cb00:2048:1::6814:224e:https S
136	2020-03-18 00:31:37	240e:d4:2e8e:df00:4882:f650:cbf9:db1d	2400:cb00:2048:1::6814:224e	Https	86	Ether / IPv6 / TCP 240e:d4:2e8e:df00:4882:f650:cbf9:db1d:2035 > 2400:cb00:2048:1::6814:224e:https S
137	2020-03-18 00:31:37	192.168.1.10	199.59.148.140	Https	66	Ether / IP / TCP 192.168.1.10:2036 > 199.59.148.140:https S
138	2020-03-18 00:31:37	192.168.1.10	161.117.236.80	TCP	66	Ether / IP / TCP 192.168.1.10:2054 > 161.117.236.80:20395 S
139	2020-03-18 00:31:38	240e:d4:2e8e:df00:4882:f650:cbf9:db1d	2400:cb00:2048:1::6814:224e	Https	86	Ether / IPv6 / TCP 240e:d4:2e8e:df00:4882:f650:cbf9:db1d:2037 > 2400:cb00:2048:1::6814:224e:https S
140	2020-03-18 00:31:38	192.168.1.10	199.59.148.140	Https	66	Ether / IP / TCP 192.168.1.10:2038 > 199.59.148.140:https S
141	2020-03-18 00:31:38	192.168.1.10	199.59.148.140	Https	66	Ether / IP / TCP 192.168.1.10:2039 > 199.59.148.140:https S
142	2020-03-18 00:31:38	192.168.1.10	161.117.236.80	TCP	66	Ether / IP / TCP 192.168.1.10:2057 > 161.117.236.80:20395 S
143	2020-03-18 00:31:38	192.168.1.10	14.215.177.39	Https	54	Ether / IP / TCP 192.168.1.10:2058 > 14.215.177.39:https FA
144	2020-03-18 00:31:38	192.168.1.10	199.59.148.140	Https	66	Ether / IP / TCP 192.168.1.10:2040 > 199.59.148.140:https S
145	2020-03-18 00:31:38	192.168.1.10	120.131.14.181	UDP	151	Ether / IP / UDP 192.168.1.10:49770 > 120.131.14.181:9402 / Raw
146	2020-03-18 00:31:38	192.168.1.10	161.117.236.80	TCP	66	Ether / IP / TCP 192.168.1.10:2043 > 161.117.236.80:20395 S
147	2020-03-18 00:31:39	192.168.1.10	161.117.236.80	TCP	66	Ether / IP / TCP 192.168.1.10:2065 > 161.117.236.80:20395 S
148	2020-03-18 00:31:39	192.168.1.10	161.117.236.80	TCP	66	Ether / IP / TCP 192.168.1.10:2061 > 161.117.236.80:20395 S
149	2020-03-18 00:31:39	192.168.1.10	161.117.236.80	TCP	66	Ether / IP / TCP 192.168.1.10:2064 > 161.117.236.80:20395 S
150	2020-03-18 00:31:39	192.168.1.10	223.252.199.69	TCP	55	Ether / IP / TCP 192.168.1.10:13025 > 223.252.199.69:6003 A / Raw
151	2020-03-18 00:31:39	223.252.199.69	192.168.1.10	TCP	66	Ether / IP / TCP 223.252.199.69:6003 > 192.168.1.10:13025 A
152	2020-03-18 00:31:40	18:d2:76:f3:58:0b	ff:ff:ff:ff:ff:ff	ARP	60	Ether / ARP who has 192.168.1.1 says 192.168.1.3 / Padding
153	2020-03-18 00:31:40	192.168.1.10	161.117.236.80	TCP	66	Ether / IP / TCP 192.168.1.10:2065 > 161.117.236.80:20395 S
154	2020-03-18 00:31:40	192.168.1.10	14.215.177.39	Https	54	Ether / IP / TCP 192.168.1.10:2058 > 14.215.177.39:https FA
155	2020-03-18 00:31:40	192.168.1.10	161.117.236.80	TCP	66	Ether / IP / TCP 192.168.1.10:2048 > 161.117.236.80:20395 S
156	2020-03-18 00:31:41	9c:d2:4b:38:91:c1	00:e0:4c:68:00:2d	ARP	60	Ether / ARP who has 192.168.1.10 says 192.168.1.1 / Padding
157	2020-03-18 00:31:41	00:e0:4c:68:00:2d	9c:d2:4b:38:91:c1	ARP	42	Ether / ARP is at 00:e0:4c:68:00:2d says 192.168.1.10
158	2020-03-18 00:31:41	192.168.1.10	161.117.236.80	TCP	66	Ether / IP / TCP 192.168.1.10:2051 > 161.117.236.80:20395 S
159	2020-03-18 00:31:41	192.168.1.10	161.117.236.80	TCP	66	Ether / IP / TCP 192.168.1.10:2066 > 161.117.236.80:20395 S
160	2020-03-18 00:31:41	192.168.1.10	161.117.236.80	TCP	66	Ether / IP / TCP 192.168.1.10:2054 > 161.117.236.80:20395 S
161	2020-03-18 00:31:42	192.168.1.10	161.117.236.80	TCP	66	Ether / IP / TCP 192.168.1.10:2065 > 161.117.236.80:20395 S
162	2020-03-18 00:31:42	192.168.1.10	161.117.236.80	TCP	66	Ether / IP / TCP 192.168.1.10:2057 > 161.117.236.80:20395 S
163	2020-03-18 00:31:42	192.168.1.10	161.117.236.80	TCP	66	Ether / IP / TCP 192.168.1.10:2066 > 161.117.236.80:20395 S
164	2020-03-18 00:31:42	192.168.1.10	130.198.91.107	Https	78	Ether / IP / TCP 192.168.1.10:10273 > 130.198.91.107:https PA / Raw
165	2020-03-18 00:31:43	192.168.1.10	161.117.236.80	TCP	66	Ether / IP / TCP 192.168.1.10:2061 > 161.117.236.80:20395 S
166	2020-03-18 00:31:43	192.168.1.10	161.117.236.80	TCP	66	Ether / IP / TCP 192.168.1.10:2064 > 161.117.236.80:20395 S
167	2020-03-18 00:31:43	130.198.91.107	192.168.1.10	Https	78	Ether / IP / TCP 130.198.91.107:https > 192.168.1.10:10273 PA / Raw
168	2020-03-18 00:31:43	192.168.1.10	130.198.91.107	Https	54	Ether / IP / TCP 192.168.1.10:10273 > 130.198.91.107:https A
169	2020-03-18 00:31:43	130.198.91.107	192.168.1.10	Https	78	Ether / IP / TCP 130.198.91.107:https > 192.168.1.10:10273 PA / Raw
170	2020-03-18 00:31:43	192.168.1.10	130.198.91.107	Https	66	Ether / IP / TCP 192.168.1.10:10273 > 130.198.91.107:https A
171	2020-03-18 00:31:43	192.168.1.10	161.117.236.80	TCP	66	Ether / IP / TCP 192.168.1.10:2067 > 161.117.236.80:20395 S
172	2020-03-18 00:31:44	192.168.1.10	161.117.236.80	TCP	66	Ether / IP / TCP 192.168.1.10:2068 > 161.117.236.80:20395 S
173	2020-03-18 00:31:44	192.168.1.10	161.117.236.80	TCP	66	Ether / IP / TCP 192.168.1.10:2066 > 161.117.236.80:20395 S
174	2020-03-18 00:31:44	192.168.1.10	161.117.236.80	TCP	66	Ether / IP / TCP 192.168.1.10:2067 > 161.117.236.80:20395 S
175	2020-03-18 00:31:44	192.168.1.10	161.117.236.80	TCP	66	Ether / IP / TCP 192.168.1.10:2069 > 161.117.236.80:20395 S
176	2020-03-18 00:31:45	192.168.1.10	14.215.177.39	Https	54	Ether / IP / TCP 192.168.1.10:2029 > 14.215.177.39:https RA
177	2020-03-18 00:31:45	240e:d4:2e8e:df00:4882:f650:cbf9:db1d	2404:6800:4008:c03::bc	TCP	75	Ether / IPv6 / TCP 240e:d4:2e8e:df00:4882:f650:cbf9:db1d:11846 > 2404:6800:4008:c03::bc:5228 A / Raw
178	2020-03-18 00:31:45	192.168.1.10	161.117.236.80	TCP	66	Ether / IP / TCP 192.168.1.10:2070 > 161.117.236.80:20395 S
179	2020-03-18 00:31:45	00:e0:4c:68:00:2d	9c:d2:4b:38:91:c1	ARP	42	Ether / ARP who has 192.168.1.1 says 192.168.1.10
180	2020-03-18 00:31:45	9c:d2:4b:38:91:c1	00:e0:4c:68:00:2d	ARP	60	Ether / ARP is at 9c:d2:4b:38:91:c1 says 192.168.1.1 / Padding
181	2020-03-18 00:31:45	240e:d4:2e8e:df00:4882:f650:cbf9:db1d	2400:cb00:2048:1::6814:224e	Https	86	Ether / IPv6 / TCP 240e:d4:2e8e:df00:4882:f650:cbf9:db1d:2032 > 2400:cb00:2048:1::6814:224e:https S
182	2020-03-18 00:31:45	192.168.1.10	14.215.177.39	Https	54	Ether / IP / TCP 192.168.1.10:2058 > 14.215.177.39:https FA
183	2020-03-18 00:31:45	192.168.1.10	161.117.236.80	TCP	66	Ether / IP / TCP 192.168.1.10:2068 > 161.117.236.80:20395 S
184	2020-03-18 00:31:45	240e:d4:2e8e:df00:4882:f650:cbf9:db1d	2400:cb00:2048:1::6814:224e	Https	86	Ether / IPv6 / TCP 240e:d4:2e8e:df00:4882:f650:cbf9:db1d:2033 > 2400:cb00:2048:1::6814:224e:https S
185	2020-03-18 00:31:45	240e:d4:2e8e:df00:4882:f650:cbf9:db1d	2400:cb00:2048:1::6814:224e	Https	86	Ether / IPv6 / TCP 240e:d4:2e8e:df00:4882:f650:cbf9:db1d:2035 > 2400:cb00:2048:1::6814:224e:https S
186	2020-03-18 00:31:45	192.168.1.10	199.59.148.140	Https	66	Ether / IP / TCP 192.168.1.10:2036 > 199.59.148.140:https S
187	2020-03-18 00:31:45	192.168.1.10	161.117.236.80	TCP	66	Ether / IP / TCP 192.168.1.10:2069 > 161.117.236.80:20395 S
188	2020-03-18 00:31:46	240e:d4:2e8e:df00:4882:f650:cbf9:db1d	2400:cb00:2048:1::6814:224e	Https	86	Ether / IPv6 / TCP 240e:d4:2e8e:df00:4882:f650:cbf9:db1d:2037 > 2400:cb00:2048:1::6814:224e:https S
189	2020-03-18 00:31:46	192.168.1.10	199.59.148.140	Https	66	Ether / IP / TCP 192.168.1.10:2038 > 199.59.148.140:https S
190	2020-03-18 00:31:46	192.168.1.10	199.59.148.140	Https	66	Ether / IP / TCP 192.168.1.10:2039 > 199.59.148.140:https S
191	2020-03-18 00:31:46	192.168.1.10	161.117.236.80	TCP	66	Ether / IP / TCP 192.168.1.10:2065 > 161.117.236.80:20395 S
192	2020-03-18 00:31:46	192.168.1.10	14.215.177.39	Https	66	Ether / IP / TCP 192.168.1.10:2071 > 14.215.177.39:https S
193	2020-03-18 00:31:46	192.168.1.10	161.117.236.80	TCP	66	Ether / IP / TCP 192.168.1.10:2072 > 161.117.236.80:20395 S
194	2020-03-18 00:31:46	14.215.177.39	192.168.1.10	Https	66	Ether / IP / TCP 14.215.177.39:https > 192.168.1.10:2071 SA
195	2020-03-18 00:31:46	192.168.1.10	14.215.177.39	Https	54	Ether / IP / TCP 192.168.1.10:2071 > 14.215.177.39:https A
196	2020-03-18 00:31:46	192.168.1.10	14.215.177.39	Https	54	Ether / IP / TCP 192.168.1.10:2071 > 14.215.177.39:https FA
197	2020-03-18 00:31:46	192.168.1.10	161.117.236.80	TCP	66	Ether / IP / TCP 192.168.1.10:2073 > 161.117.236.80:20395 S
198	2020-03-18 00:31:46	192.168.1.10	161.117.236.80	TCP	66	Ether / IP / TCP 192.168.1.10:2070 > 161.117.236.80:20395 S
199	2020-03-18 00:31:46	192.168.1.10	199.59.148.140	Https	66	Ether / IP / TCP 192.168.1.10:2040 > 199.59.148.140:https S
200	2020-03-18 00:31:46	192.168.1.10	14.215.177.39	Https	54	Ether / IP / TCP 192.168.1.10:2071 > 14.215.177.39:https FA
201	2020-03-18 00:31:46	192.168.1.10	161.117.236.80	TCP	66	Ether / IP / TCP 192.168.1.10:2067 > 161.117.236.80:20395 S
202	2020-03-18 00:31:47	192.168.1.10	14.215.177.39	Https	54	Ether / IP / TCP 192.168.1.10:2071 > 14.215.177.39:https FA
203	2020-03-18 00:31:47	192.168.1.10	161.117.236.80	TCP	66	Ether / IP / TCP 192.168.1.10:2072 > 161.117.236.80:20395 S
204	2020-03-18 00:31:47	192.168.1.10	161.117.236.80	TCP	66	Ether / IP / TCP 192.168.1.10:2073 > 161.117.236.80:20395 S
205	2020-03-18 00:31:47	192.168.1.10	161.117.236.80	TCP	66	Ether / IP / TCP 192.168.1.10:2068 > 161.117.236.80:20395 S
206	2020-03-18 00:31:47	192.168.1.10	161.117.236.80	TCP	66	Ether / IP / TCP 192.168.1.10:2078 > 161.117.236.80:20395 S
207	2020-03-18 00:31:47	192.168.1.10	161.117.236.80	TCP	66	Ether / IP / TCP 192.168.1.10:2079 > 161.117.236.80:20395 S
208	2020-03-18 00:31:47	192.168.1.10	161.117.236.80	TCP	66	Ether / IP / TCP 192.168.1.10:2069 > 161.117.236.80:20395 S
209	2020-03-18 00:31:48	192.168.1.10	54.223.180.103	Http	54	Ether / IP / TCP 192.168.1.10:1925 > 54.223.180.103:http FA
210	2020-03-18 00:31:48	192.168.1.10	54.223.180.103	Http	66	Ether / IP / TCP 192.168.1.10:2080 > 54.223.180.103:http S
211	2020-03-18 00:31:48	54.223.180.103	192.168.1.10	Http	60	Ether / IP / TCP 54.223.180.103:http > 192.168.1.10:1925 A / Padding
212	2020-03-18 00:31:48	54.223.180.103	192.168.1.10	Http	66	Ether / IP / TCP 54.223.180.103:http > 192.168.1.10:2080 SA
213	2020-03-18 00:31:48	192.168.1.10	54.223.180.103	Http	54	Ether / IP / TCP 192.168.1.10:2080 > 54.223.180.103:http A
214	2020-03-18 00:31:48	192.168.1.10	54.223.180.103	Http	426	Ether / IP / TCP / HTTP / 'GET' '/message/updateTime?tags=commontags&updateTime=d751713988987e9331980363e24189ce1544026800519&serviceVersion=1.1.2.627' 'HTTP/1.1' / Raw
215	2020-03-18 00:31:48	192.168.1.10	161.117.236.80	TCP	66	Ether / IP / TCP 192.168.1.10:2070 > 161.117.236.80:20395 S
216	2020-03-18 00:31:48	54.223.180.103	192.168.1.10	Http	60	Ether / IP / TCP 54.223.180.103:http > 192.168.1.10:2080 A / Padding
217	2020-03-18 00:31:48	54.223.180.103	192.168.1.10	Http	151	Ether / IP / TCP / HTTP / 'HTTP/1.1' '200' 'OK'
218	2020-03-18 00:31:48	192.168.1.10	54.223.180.103	Http	54	Ether / IP / TCP 192.168.1.10:2080 > 54.223.180.103:http A
219	2020-03-18 00:31:48	192.168.1.10	14.215.177.39	Https	54	Ether / IP / TCP 192.168.1.10:2071 > 14.215.177.39:https FA
220	2020-03-18 00:31:48	192.168.1.10	130.198.91.107	Https	78	Ether / IP / TCP 192.168.1.10:10273 > 130.198.91.107:https PA / Raw
221	2020-03-18 00:31:48	92.223.85.103	192.168.1.10	Http	60	Ether / IP / TCP 92.223.85.103:http > 192.168.1.10:14585 A / Padding
222	2020-03-18 00:31:48	192.168.1.10	92.223.85.103	Http	54	Ether / IP / TCP 192.168.1.10:14585 > 92.223.85.103:http A
223	2020-03-18 00:31:48	192.168.1.10	161.117.236.80	TCP	66	Ether / IP / TCP 192.168.1.10:2085 > 161.117.236.80:20395 S
224	2020-03-18 00:31:48	192.168.1.10	161.117.236.80	TCP	66	Ether / IP / TCP 192.168.1.10:2086 > 161.117.236.80:20395 S
225	2020-03-18 00:31:48	130.198.91.107	192.168.1.10	Https	60	Ether / IP / TCP 130.198.91.107:https > 192.168.1.10:10273 A / Padding
226	2020-03-18 00:31:48	192.168.1.10	161.117.236.80	TCP	66	Ether / IP / TCP 192.168.1.10:2078 > 161.117.236.80:20395 S
227	2020-03-18 00:31:48	192.168.1.10	161.117.236.80	TCP	66	Ether / IP / TCP 192.168.1.10:2079 > 161.117.236.80:20395 S
228	2020-03-18 00:31:48	192.168.1.10	161.117.236.80	TCP	66	Ether / IP / TCP 192.168.1.10:2066 > 161.117.236.80:20395 S
229	2020-03-18 00:31:49	192.168.1.10	161.117.236.80	TCP	66	Ether / IP / TCP 192.168.1.10:2087 > 161.117.236.80:20395 S
230	2020-03-18 00:31:49	192.168.1.10	161.117.236.80	TCP	66	Ether / IP / TCP 192.168.1.10:2072 > 161.117.236.80:20395 S
231	2020-03-18 00:31:49	192.168.1.10	161.117.236.80	TCP	66	Ether / IP / TCP 192.168.1.10:2073 > 161.117.236.80:20395 S
232	2020-03-18 00:31:49	192.168.1.10	161.117.236.80	TCP	66	Ether / IP / TCP 192.168.1.10:2085 > 161.117.236.80:20395 S
233	2020-03-18 00:31:49	192.168.1.10	161.117.236.80	TCP	66	Ether / IP / TCP 192.168.1.10:2086 > 161.117.236.80:20395 S
234	2020-03-18 00:31:50	192.168.1.10	161.117.236.80	TCP	66	Ether / IP / TCP 192.168.1.10:2087 > 161.117.236.80:20395 S
235	2020-03-18 00:31:50	192.168.1.10	14.215.177.39	Https	54	Ether / IP / TCP 192.168.1.10:2071 > 14.215.177.39:https FA
236	2020-03-18 00:31:50	192.168.1.10	161.117.236.80	TCP	66	Ether / IP / TCP 192.168.1.10:2078 > 161.117.236.80:20395 S
237	2020-03-18 00:31:50	192.168.1.10	161.117.236.80	TCP	66	Ether / IP / TCP 192.168.1.10:2079 > 161.117.236.80:20395 S
238	2020-03-18 00:31:50	192.168.1.10	161.117.236.80	TCP	66	Ether / IP / TCP 192.168.1.10:2067 > 161.117.236.80:20395 S
239	2020-03-18 00:31:51	fe80::f141:b4f2:11de:b126	fe80::1	DNS	102	Ether / IPv6 / UDP / DNS Qry "b'analytics.yinxiang.com.'" 
240	2020-03-18 00:31:51	fe80::1	fe80::f141:b4f2:11de:b126	DNS	175	Ether / IPv6 / UDP / DNS Ans 
241	2020-03-18 00:31:51	192.168.1.10	154.8.190.35	Https	66	Ether / IP / TCP 192.168.1.10:2088 > 154.8.190.35:https S
242	2020-03-18 00:31:51	154.8.190.35	192.168.1.10	Https	66	Ether / IP / TCP 154.8.190.35:https > 192.168.1.10:2088 SA
243	2020-03-18 00:31:51	192.168.1.10	154.8.190.35	Https	54	Ether / IP / TCP 192.168.1.10:2088 > 154.8.190.35:https A
244	2020-03-18 00:31:51	192.168.1.10	154.8.190.35	Https	237	Ether / IP / TCP 192.168.1.10:2088 > 154.8.190.35:https PA / Raw
245	2020-03-18 00:31:51	154.8.190.35	192.168.1.10	Https	60	Ether / IP / TCP 154.8.190.35:https > 192.168.1.10:2088 A / Padding
246	2020-03-18 00:31:51	154.8.190.35	192.168.1.10	Https	1486	Ether / IP / TCP 154.8.190.35:https > 192.168.1.10:2088 A / Raw
247	2020-03-18 00:31:51	154.8.190.35	192.168.1.10	Https	1486	Ether / IP / TCP 154.8.190.35:https > 192.168.1.10:2088 A / Raw
248	2020-03-18 00:31:51	154.8.190.35	192.168.1.10	Https	744	Ether / IP / TCP 154.8.190.35:https > 192.168.1.10:2088 PA / Raw
249	2020-03-18 00:31:51	192.168.1.10	154.8.190.35	Https	54	Ether / IP / TCP 192.168.1.10:2088 > 154.8.190.35:https A
250	2020-03-18 00:31:51	192.168.1.10	154.8.190.35	Https	180	Ether / IP / TCP 192.168.1.10:2088 > 154.8.190.35:https PA / Raw
251	2020-03-18 00:31:51	154.8.190.35	192.168.1.10	Https	328	Ether / IP / TCP 154.8.190.35:https > 192.168.1.10:2088 PA / Raw
252	2020-03-18 00:31:51	192.168.1.10	154.8.190.35	Https	303	Ether / IP / TCP 192.168.1.10:2088 > 154.8.190.35:https PA / Raw
253	2020-03-18 00:31:51	154.8.190.35	192.168.1.10	Https	352	Ether / IP / TCP 154.8.190.35:https > 192.168.1.10:2088 PA / Raw
254	2020-03-18 00:31:51	154.8.190.35	192.168.1.10	Https	88	Ether / IP / TCP 154.8.190.35:https > 192.168.1.10:2088 PA / Raw
255	2020-03-18 00:31:51	192.168.1.10	154.8.190.35	Https	54	Ether / IP / TCP 192.168.1.10:2088 > 154.8.190.35:https A
256	2020-03-18 00:31:51	192.168.1.10	154.8.190.35	Https	54	Ether / IP / TCP 192.168.1.10:2088 > 154.8.190.35:https FA
257	2020-03-18 00:31:51	154.8.190.35	192.168.1.10	Https	60	Ether / IP / TCP 154.8.190.35:https > 192.168.1.10:2088 FA / Padding
258	2020-03-18 00:31:51	192.168.1.10	154.8.190.35	Https	54	Ether / IP / TCP 192.168.1.10:2088 > 154.8.190.35:https A
259	2020-03-18 00:31:51	192.168.1.10	199.59.148.140	Https	66	Ether / IP / TCP 192.168.1.10:2089 > 199.59.148.140:https S
260	2020-03-18 00:31:51	192.168.1.10	161.117.236.80	TCP	66	Ether / IP / TCP 192.168.1.10:2085 > 161.117.236.80:20395 S
261	2020-03-18 00:31:51	192.168.1.10	161.117.236.80	TCP	66	Ether / IP / TCP 192.168.1.10:2086 > 161.117.236.80:20395 S
262	2020-03-18 00:31:51	192.168.1.10	161.117.236.80	TCP	66	Ether / IP / TCP 192.168.1.10:2068 > 161.117.236.80:20395 S
263	2020-03-18 00:31:51	192.168.1.10	199.59.148.140	Https	66	Ether / IP / TCP 192.168.1.10:2090 > 199.59.148.140:https S
264	2020-03-18 00:31:51	192.168.1.10	161.117.236.80	TCP	66	Ether / IP / TCP 192.168.1.10:2091 > 161.117.236.80:20395 S
265	2020-03-18 00:31:51	192.168.1.10	199.59.148.140	Https	66	Ether / IP / TCP 192.168.1.10:2092 > 199.59.148.140:https S
266	2020-03-18 00:31:51	240e:d4:2e8e:df00:4882:f650:cbf9:db1d	2400:cb00:2048:1::6814:224e	Https	86	Ether / IPv6 / TCP 240e:d4:2e8e:df00:4882:f650:cbf9:db1d:2093 > 2400:cb00:2048:1::6814:224e:https S
267	2020-03-18 00:31:51	192.168.1.10	161.117.236.80	TCP	66	Ether / IP / TCP 192.168.1.10:2069 > 161.117.236.80:20395 S
268	2020-03-18 00:31:52	192.168.1.10	199.59.148.140	Https	66	Ether / IP / TCP 192.168.1.10:2094 > 199.59.148.140:https S
269	2020-03-18 00:31:52	240e:d4:2e8e:df00:4882:f650:cbf9:db1d	2400:cb00:2048:1::6814:224e	Https	86	Ether / IPv6 / TCP 240e:d4:2e8e:df00:4882:f650:cbf9:db1d:2095 > 2400:cb00:2048:1::6814:224e:https S
270	2020-03-18 00:31:52	240e:d4:2e8e:df00:4882:f650:cbf9:db1d	2400:cb00:2048:1::6814:224e	Https	86	Ether / IPv6 / TCP 240e:d4:2e8e:df00:4882:f650:cbf9:db1d:2096 > 2400:cb00:2048:1::6814:224e:https S
271	2020-03-18 00:31:52	192.168.1.10	161.117.236.80	TCP	66	Ether / IP / TCP 192.168.1.10:2087 > 161.117.236.80:20395 S
272	2020-03-18 00:31:52	192.168.1.10	161.117.236.80	TCP	66	Ether / IP / TCP 192.168.1.10:2070 > 161.117.236.80:20395 S
273	2020-03-18 00:31:52	240e:d4:2e8e:df00:4882:f650:cbf9:db1d	2400:cb00:2048:1::6814:224e	Https	86	Ether / IPv6 / TCP 240e:d4:2e8e:df00:4882:f650:cbf9:db1d:2097 > 2400:cb00:2048:1::6814:224e:https S
274	2020-03-18 00:31:52	192.168.1.10	199.59.148.140	Https	66	Ether / IP / TCP 192.168.1.10:2089 > 199.59.148.140:https S
275	2020-03-18 00:31:52	192.168.1.10	10.10.20.110	UDP	120	Ether / IP / UDP 192.168.1.10:59684 > 10.10.20.110:snmp / SNMP
276	2020-03-18 00:31:52	192.168.1.10	199.59.148.140	Https	66	Ether / IP / TCP 192.168.1.10:2090 > 199.59.148.140:https S
277	2020-03-18 00:31:52	192.168.1.10	161.117.236.80	TCP	66	Ether / IP / TCP 192.168.1.10:2091 > 161.117.236.80:20395 S
278	2020-03-18 00:31:52	192.168.1.10	199.59.148.140	Https	66	Ether / IP / TCP 192.168.1.10:2092 > 199.59.148.140:https S
279	2020-03-18 00:31:52	240e:d4:2e8e:df00:4882:f650:cbf9:db1d	2400:cb00:2048:1::6814:224e	Https	86	Ether / IPv6 / TCP 240e:d4:2e8e:df00:4882:f650:cbf9:db1d:2093 > 2400:cb00:2048:1::6814:224e:https S
280	2020-03-18 00:31:53	192.168.1.10	199.59.148.140	Https	66	Ether / IP / TCP 192.168.1.10:2094 > 199.59.148.140:https S
281	2020-03-18 00:31:53	240e:d4:2e8e:df00:4882:f650:cbf9:db1d	2400:cb00:2048:1::6814:224e	Https	86	Ether / IPv6 / TCP 240e:d4:2e8e:df00:4882:f650:cbf9:db1d:2095 > 2400:cb00:2048:1::6814:224e:https S
282	2020-03-18 00:31:53	240e:d4:2e8e:df00:4882:f650:cbf9:db1d	2400:cb00:2048:1::6814:224e	Https	86	Ether / IPv6 / TCP 240e:d4:2e8e:df00:4882:f650:cbf9:db1d:2096 > 2400:cb00:2048:1::6814:224e:https S
283	2020-03-18 00:31:53	192.168.1.10	161.117.236.80	TCP	66	Ether / IP / TCP 192.168.1.10:2072 > 161.117.236.80:20395 S
284	2020-03-18 00:31:53	192.168.1.10	161.117.236.80	TCP	66	Ether / IP / TCP 192.168.1.10:2073 > 161.117.236.80:20395 S
285	2020-03-18 00:31:53	240e:d4:2e8e:df00:4882:f650:cbf9:db1d	2400:cb00:2048:1::6814:224e	Https	86	Ether / IPv6 / TCP 240e:d4:2e8e:df00:4882:f650:cbf9:db1d:2097 > 2400:cb00:2048:1::6814:224e:https S
286	2020-03-18 00:31:53	fe80::f141:b4f2:11de:b126	fe80::1	DNS	93	Ether / IPv6 / UDP / DNS Qry "b'www.baidu.com.'" 
287	2020-03-18 00:31:53	fe80::f141:b4f2:11de:b126	fe80::1	DNS	93	Ether / IPv6 / UDP / DNS Qry "b'www.baidu.com.'" 
288	2020-03-18 00:31:53	fe80::1	fe80::f141:b4f2:11de:b126	DNS	386	Ether / IPv6 / UDP / DNS Ans "b'www.a.shifen.com.'" 
289	2020-03-18 00:31:53	fe80::1	fe80::f141:b4f2:11de:b126	DNS	177	Ether / IPv6 / UDP / DNS Ans "b'www.a.shifen.com.'" 
290	2020-03-18 00:31:53	192.168.1.10	220.181.38.149	Https	66	Ether / IP / TCP 192.168.1.10:2098 > 220.181.38.149:https S
291	2020-03-18 00:31:53	192.168.1.10	220.181.38.149	Https	66	Ether / IP / TCP 192.168.1.10:2099 > 220.181.38.149:https S
292	2020-03-18 00:31:53	220.181.38.149	192.168.1.10	Https	66	Ether / IP / TCP 220.181.38.149:https > 192.168.1.10:2099 SA
293	2020-03-18 00:31:53	192.168.1.10	220.181.38.149	Https	54	Ether / IP / TCP 192.168.1.10:2099 > 220.181.38.149:https A
294	2020-03-18 00:31:53	220.181.38.149	192.168.1.10	Https	66	Ether / IP / TCP 220.181.38.149:https > 192.168.1.10:2098 SA
295	2020-03-18 00:31:53	192.168.1.10	220.181.38.149	Https	54	Ether / IP / TCP 192.168.1.10:2098 > 220.181.38.149:https A
296	2020-03-18 00:31:53	192.168.1.10	220.181.38.149	Https	571	Ether / IP / TCP 192.168.1.10:2099 > 220.181.38.149:https PA / Raw
297	2020-03-18 00:31:53	192.168.1.10	220.181.38.149	Https	571	Ether / IP / TCP 192.168.1.10:2098 > 220.181.38.149:https PA / Raw
298	2020-03-18 00:31:53	220.181.38.149	192.168.1.10	Https	60	Ether / IP / TCP 220.181.38.149:https > 192.168.1.10:2099 A / Padding
299	2020-03-18 00:31:53	220.181.38.149	192.168.1.10	Https	60	Ether / IP / TCP 220.181.38.149:https > 192.168.1.10:2098 A / Padding
300	2020-03-18 00:31:53	220.181.38.149	192.168.1.10	Https	122	Ether / IP / TCP 220.181.38.149:https > 192.168.1.10:2099 PA / Raw
301	2020-03-18 00:31:53	220.181.38.149	192.168.1.10	Https	1506	Ether / IP / TCP 220.181.38.149:https > 192.168.1.10:2099 A / Raw
302	2020-03-18 00:31:53	220.181.38.149	192.168.1.10	Https	1506	Ether / IP / TCP 220.181.38.149:https > 192.168.1.10:2099 A / Raw
303	2020-03-18 00:31:53	220.181.38.149	192.168.1.10	Https	784	Ether / IP / TCP 220.181.38.149:https > 192.168.1.10:2099 PA / Raw
304	2020-03-18 00:31:53	220.181.38.149	192.168.1.10	Https	122	Ether / IP / TCP 220.181.38.149:https > 192.168.1.10:2098 PA / Raw
305	2020-03-18 00:31:53	192.168.1.10	220.181.38.149	Https	54	Ether / IP / TCP 192.168.1.10:2099 > 220.181.38.149:https A
306	2020-03-18 00:31:53	220.181.38.149	192.168.1.10	Https	1506	Ether / IP / TCP 220.181.38.149:https > 192.168.1.10:2098 A / Raw
307	2020-03-18 00:31:53	220.181.38.149	192.168.1.10	Https	1506	Ether / IP / TCP 220.181.38.149:https > 192.168.1.10:2098 A / Raw
308	2020-03-18 00:31:53	220.181.38.149	192.168.1.10	Https	784	Ether / IP / TCP 220.181.38.149:https > 192.168.1.10:2098 PA / Raw
309	2020-03-18 00:31:53	192.168.1.10	220.181.38.149	Https	54	Ether / IP / TCP 192.168.1.10:2098 > 220.181.38.149:https A
310	2020-03-18 00:31:53	220.181.38.149	192.168.1.10	Https	392	Ether / IP / TCP 220.181.38.149:https > 192.168.1.10:2099 PA / Raw
